Link,n_hits,all_links,category,id,url,hs_path,profile,permalink,created_at,sic_code,service_area,hours,products,services,brands,specialities,established,employee_cnt,payment_method,diplomas,licenses,memberships,liability_insurance,bonded,project_rate,project_minimum,written_contract,written_warranty,warranty_terms,parent_company_id,name,total_number_of_reviews_cache,total_number_of_approved_reviews_cache,number_of_photos_cache,avg_rating_cache,categories_info_cache,savings_count,subdomain,fraudulent,fraudulent_count,total_number_of_pending_reviews_cache,images_count,bully,secret,replied_to_at_least_one_review_cache,latest_approved_review_created_at,has_set_tasks,lead_purchase_eligible,service_area_id,star_score,quote_button_category,direct_phone,direct_contact,claimed_at,completion_percent_cache
https://homestars.com/on/cadmus/bathroom-renovation,7,https://homestars.com/on/cadmus/bathroom-renovation,Bathroom Renovation,2807659,http://www.agmrenovations.com/,/companies/2807659-agm-renovations?searched_category_id=316&service_area=2285073,"AGM Renovations experts provide quality basement and Bathroom Renovation services throughout the GTA and the surrounding area. See our Service Area for the complete list of towns where our  renovation services are offered. We offer 100% satisfaction guarantee on our workmanship and offer competitive prices with exceptional quality.

Expect more and when you need the best; trust AGM Renovations. We guarantee that you will be completely satisfied, which means that you don't pay until you are satisfied.
Our mission is to be committed to excel in the work we do. We are committed to excel and maintain a sense of pride in our all we do! 

AGM Basements, Basement finishing, Basement Renovations, Basement Reno, Finishing Basements, Basement Company, Finished Basements, Basement Expert, Finished Basements Company, Bathroom Renovations, Bathroom remodeling.",agm-renovations,2013-03-21T13:05:30.000-04:00,NA,"Ajax, Aurora, Barrie, Bradford, Brampton, Brock, Brantford, Burlington, Etobicoke, Georgetown, Georgina, East Gwillimbury, West Gwillimbury, Halton Hills, Hamilton, King City, London, Maple, Markham, Milton, Mississauga, Newmarket, Oakville, Oshawa, Pickering, Richmond Hill, Scarborough, Scugog, Stoufville, Thornhill, Toronto, Uxbridge, Vaughan, Whitby, Woodbridge",,"AGM Renovations, Basement finishing, Basement Renovations, Basement Reno, Finishing Basements, Basement Company, Finished Basements, Basement Expert, Finished Basements Company, Bathroom Renovations","AGM Renovations offers Complete basement and Bathroom renovations packages from the professional design through the professional cleaning including:

Drywall- We employ only professional drywall installers and our goal is deliver complete satisfaction to each and every client with the quality of our workmanship and our prompt, reliable service.
    
Taping- Our drywall taping techniques will bring a high quality smooth finish, with a level of excellence you will take pride in.

Painting- We include all wall priming, painting of ceilings, baseboards, casing, crown and cove moldings into our basement construction packages
    
High Grade Laminate Flooring- is standard in our basement renovations packages.

Tiling- Shower, bathroom, or kitchenette tiling will be done by professional tile installers who are employed directly by AGM. A 2 year unlimited warranty is provided to you standard when you finish your basement with AGM
   
Plumbing- Our licensed plumbers will ensure that no problem is left unsolved and you can be sure that any drain or other plumbing defects left by the original house builder will be fixed effectively.

Electrical- We are committed to providing fully licensed electrician service as part of our standard package. Should you ever require an electrical certificate when you decide to sell your property, we will be happy to provide it to you

AGM Basements, Basement finishing, Basement Renovations, Basement Reno, Finishing Basements, Basement Company, Finished Basements, Basement Expert, Finished Basements Company",,"AGM Renovations - offers complete basement and Bathroom renovations packages from professional design to professional cleaning.

AGM Basements, Basement finishing, Basement Renovations, Basement Reno, Finishing Basements, Basement Company, Finished Basements, Basement Expert, Finished Basements Company",18,80,,,"Master Business Licence, Toronto Builder's licence","Built,",TRUE,TRUE,,,TRUE,FALSE,2 year unlimited warranty,1870659,AGM Renovations,609,477,79,9.33124,"Basement Renovation, Basement renovation, Basement remodeling, Basement remodelling, renovating your basement, renovation, waterproofing, remodeling, home renovation, house renovation, water in basement, basement waterproofing,finishing basement, moistureproof, remodeling the house, caulking,General Contractors, Residential General Contractor, Building Contractor, Additions, Remodeling Contractor,  Renovation, Builder, building construction, renovation, remodeling, construction builders, construction company, construction companies, home repair, construction jobs, home remodeling, general contractors, contractors general, contractor general, contractors construction, construction contractors, home improvement and remodeling, kitchen remodeling, construction contractor, builders contractors, home renovation, general contracting, building contractors, building companies, home renovations, builder contractor, building contractor, remodeling contractor, commercial construction, residential construction, house contractor, concrete contractors, home contractors, general construction, construction general, contractors remodeling, remodeling contractors, remodelers, remodel contractor, remodel contractors, general contract, commercial contractors, renovations contractors, home improvement contractor, licensed contractor, license general contractor, mud room, mudroom, caulking, ,Bathroom Renovation, Bathroom renovation, bathroom remodeling, bathroom remodelling, renovating the bathroom, tearing out the bathroom, fixing up the bathroom, bathroom contractors, bathroom vanities, bathroom vanity, design of bathroom, bathroom and design, design for bathroom, design a bathroom, design a bath, bath design, bathroom tile, bathroom cabinets, remodeling a bathroom, bathroom remodeling, remodeling the bathroom, ,Bath renovation, New tub, caulking, ,Kitchen Planning & Renovation, Kitchen Planning And Design, Kitchen Cabinet Planning, Kitchen Design, Kitchen Remodeling, kitchen or, and bathroom, a and a kitchens, kitchens and, for kitchens, a kitchens, kitchens, the house design, cabinets for kitchen, cabinets for the kitchen, cabinets and kitchen, kitchen cabinets, design a kitchen, about kitchen design, a kitchen design, how to kitchen design, design and kitchen, the kitchen design, design for kitchen, kitchen designs, renovation and remodeling, remodeling and renovation, kitchen designer,,Kitchen Renovation, caulking, ,Kitchen & Bathroom - Cabinets & Design, Kitchen Cabinet And Counter, Kitchen Cabinet Hardware, Bathroom Cabinet, Bathroom Wall Cabinet, Bathroom Sink Cabinet, cabinets, kitchens, cabinetry, kitchen and cabinets, cabinets for kitchen, about kitchen cabinets, kitchen cabinets, kitchen cabinets in, cabinets for the kitchen, cabinets and kitchen, cabinets kitchen, kitchen cabinet, cabinet kitchen, the kitchen cabinet, kitchen by design, design kitchen, a kitchen design, design a kitchen, design for kitchen, design and kitchen, design by kitchen, kitchen design, cabinetry kitchen, kitchen cabinetry, designs kitchen, kitchen designs, bathroom vanities, vanity and bathroom, bath and vanity, designer kitchen, ,",0,agm,FALSE,0,0,80,FALSE,a0b9b6e67166497359f0fe46f88ee02725bb0fb4,TRUE,2022-10-23T13:04:19.000-04:00,TRUE,TRUE,2285073,91.2430777516,316,NA,NA,NA,NA
https://homestars.com/on/cadmus/bathroom-renovation,7,https://homestars.com/on/cadmus/bathroom-renovation,Bathroom Renovation,2963827,,/companies/2963827-the-best-connects?searched_category_id=316&service_area=2282266,We are a small family business that specializes in Bathroom/basement/kitchen/laundry room renovations. We live off of honesty and integrity so you can trust we will do everything the right way the first time and when you get to witness that you will then know you have found THE BEST CONNECTS in the biz.,the-best-connects,2022-01-23T10:18:39.000-05:00,NA,NA,NA,,,,,NA,NA,,,,,FALSE,FALSE,,,FALSE,FALSE,,2025777,The Best Connects,6,5,76,10,"Bathroom Renovation, Bathroom renovation, bathroom remodeling, bathroom remodelling, renovating the bathroom, tearing out the bathroom, fixing up the bathroom, bathroom contractors, bathroom vanities, bathroom vanity, design of bathroom, bathroom and design, design for bathroom, design a bathroom, design a bath, bath design, bathroom tile, bathroom cabinets, remodeling a bathroom, bathroom remodeling, remodeling the bathroom, ,Bath renovation, New tub, caulking, ,Basement Renovation, Basement renovation, Basement remodeling, Basement remodelling, renovating your basement, renovation, waterproofing, remodeling, home renovation, house renovation, water in basement, basement waterproofing,finishing basement, moistureproof, remodeling the house, caulking,General Contractors, Residential General Contractor, Building Contractor, Additions, Remodeling Contractor,  Renovation, Builder, building construction, renovation, remodeling, construction builders, construction company, construction companies, home repair, construction jobs, home remodeling, general contractors, contractors general, contractor general, contractors construction, construction contractors, home improvement and remodeling, kitchen remodeling, construction contractor, builders contractors, home renovation, general contracting, building contractors, building companies, home renovations, builder contractor, building contractor, remodeling contractor, commercial construction, residential construction, house contractor, concrete contractors, home contractors, general construction, construction general, contractors remodeling, remodeling contractors, remodelers, remodel contractor, remodel contractors, general contract, commercial contractors, renovations contractors, home improvement contractor, licensed contractor, license general contractor, mud room, mudroom, caulking, ,",0,thebestconnects,FALSE,0,0,80,FALSE,5bc91fcd69e68e51febb07912d54c62026b38620,TRUE,NA,TRUE,TRUE,2282266,90.763354411,316,NA,NA,2022-01-23T10:19:08.000-05:00,0
https://homestars.com/on/cadmus/bathroom-renovation,7,https://homestars.com/on/cadmus/bathroom-renovation,Bathroom Renovation,2967029,https://www.rydersrenovations.ca,/companies/2967029-ryder-s-renovations-inc?searched_category_id=316&service_area=2277623,"About Ryder's Renovations Inc.
Our Team Specializes in Customizing Residential & Commercial Spaces.
We offer a Wide Range of Services! Renovations, Remodelling, Repairs, Painting & Flooring!
Ryder's Renovations incorporation is a company that many trusts, we make customization simple for you when you design with us!",ryder-s-renovations-inc,2022-04-11T14:19:21.000-04:00,NA,NA,NA,,Remodelling  Repairs  Painting  Flooring,,,NA,NA,,,,,FALSE,FALSE,,,FALSE,FALSE,,2028947,RYDER’S RENOVATIONS INC.,4,4,30,10,"Floor Laying & Refinishing, Hardwood Floor, Wood Floor, Floor Tile, Dance Floor, Ceramic Floor Tile, Floor Refinishing, bamboo floor, cork floor, FSC wood flooring, stone floor, marble floor, slate floor, squeaky floor repair, laminate, laminate repair, wood floor, floor and wood, wood flooring, wood floors, floors in wood, hardwood flooring, hardwood floors, hardwood floors and, hardwood floor, hardwood floor wood, wood floor flooring, refinishing, floor refinishing, floor refinishing in, refinishing floor, hardwood install, floor laying, laying a floor, flood sanding, wood floor refinishing, refinishing hardwood floors, flooring laying, wood floors refinishing, wood flooring refinishing, floor co, flooring hard wood, hard wood floors, laying floors, flooring company, flooring engineered hardwood, floor company, hard wood floor, cleaning hardwood floors, installing hardwood flooring, installing hardwood floors, installing wood flooring, installing wood floors, installing hardwood floors, installing wood flooring, installing wood floors, installing hardwood floor, hardwood flooring installation, business floor, wood flooring installation, hardwood floor installation, floor companies, lay hardwood flooring, lay hardwood floor, wood floor repair, repair wood floor, repair hardwood floor, hardwood floor repair, finishing a hardwood floor, squeeky floors,,Hardwood floors, Install hardwood floors, caulking,Bathroom Renovation, Bathroom renovation, bathroom remodeling, bathroom remodelling, renovating the bathroom, tearing out the bathroom, fixing up the bathroom, bathroom contractors, bathroom vanities, bathroom vanity, design of bathroom, bathroom and design, design for bathroom, design a bathroom, design a bath, bath design, bathroom tile, bathroom cabinets, remodeling a bathroom, bathroom remodeling, remodeling the bathroom, ,Bath renovation, New tub, caulking, ,Paint & Wallpaper Contractors, Paint Colors, Paint Store, Paint Brush, Paint Shop, Home Wallpaper,Wallpaper, Paint colour advice, paint colour consultants, wallpapering, painter, faux, painters painting, painters paint, business painting, find painting, painting and restoration, new jersey painting, oh painting, local painting, wall paper repair, ,Drywall Contractors, Dry Wall Repair, Dry Wall Installation, dry wall contracting, gypsum repair, gypsum installation, gypsum contractors, gyprock installers, gyprock intallation, dry wall installers, sheetrock, wall board, drywall, drywaller, waller, wall repair, drywall, plaster, how to drywall, drywall, what is drywall, sheetrock, dry wall, plastering, wall repair, drywall repair, how to repair drywall, repair drywall,  ,",0,RYDERSRENOVATIONS,FALSE,0,0,31,FALSE,4cb2eb4345660d371eb59fad32db02a2ec284201,FALSE,NA,TRUE,TRUE,2277623,89.0313265213,316,NA,NA,2022-04-11T14:21:29.000-04:00,0
https://homestars.com/on/cadmus/bathroom-renovation,7,https://homestars.com/on/cadmus/bathroom-renovation,Bathroom Renovation,2959009,https://www.aandjvaluereno.ca/,/companies/2959009-a-and-j-value-renovations?searched_category_id=316&service_area=2296192,"Sometimes when you desire to improve your current home it is best to obtain help from knowledgeable experts in the field of renovating spaces. 

Here at A and J Value Renovations, we have 17 years of experience, always willing to give our best to ensure you are pleased with your new home renovations in the end. 

If you are planning on having a home makeover, then you can count on us to provide satisfactory services.",a-and-j-value-renovations,2021-08-20T13:08:56.000-04:00,NA,NA,NA,,"Home Renovations, Basement Renovation, Kitchen Renovation, Bathroom Renovation, Plumbing, Electricity",,,NA,NA,Cheque,,,,TRUE,FALSE,,,FALSE,FALSE,,2020986,A and J Value Renovations,10,9,68,10,"Bathroom Renovation, Bathroom renovation, bathroom remodeling, bathroom remodelling, renovating the bathroom, tearing out the bathroom, fixing up the bathroom, bathroom contractors, bathroom vanities, bathroom vanity, design of bathroom, bathroom and design, design for bathroom, design a bathroom, design a bath, bath design, bathroom tile, bathroom cabinets, remodeling a bathroom, bathroom remodeling, remodeling the bathroom, ,Bath renovation, New tub, caulking, ,Basement Renovation, Basement renovation, Basement remodeling, Basement remodelling, renovating your basement, renovation, waterproofing, remodeling, home renovation, house renovation, water in basement, basement waterproofing,finishing basement, moistureproof, remodeling the house, caulking,Kitchen Planning & Renovation, Kitchen Planning And Design, Kitchen Cabinet Planning, Kitchen Design, Kitchen Remodeling, kitchen or, and bathroom, a and a kitchens, kitchens and, for kitchens, a kitchens, kitchens, the house design, cabinets for kitchen, cabinets for the kitchen, cabinets and kitchen, kitchen cabinets, design a kitchen, about kitchen design, a kitchen design, how to kitchen design, design and kitchen, the kitchen design, design for kitchen, kitchen designs, renovation and remodeling, remodeling and renovation, kitchen designer,,Kitchen Renovation, caulking, ,Tile & Stone Contractors, Natural Stone Tile, Stone Floor Tile, Ceramic Tile, Floor tile, Tile installers, Stone installers, stone counter top installers, tile counter top installers, stone backsplash intallers, granite installers, marble installers, limestone installers, linoleum installers, slate contractors, slate installers,install tite ,backsplash , fire place veenerneed someone to install blacksplash , wall stone veener bath room mosaic,",0,,FALSE,0,0,103,FALSE,489c5e8efb919d819872264c7e8704aea690c71e,TRUE,NA,TRUE,TRUE,2296192,89.524424187,316,NA,NA,2021-08-20T13:10:56.000-04:00,0
https://homestars.com/on/cadmus/bathroom-renovation,7,https://homestars.com/on/cadmus/bathroom-renovation,Bathroom Renovation,2966559,http://www.precisionimprovements.ca,/companies/2966559-precision-improvements?searched_category_id=316&service_area=2276555,"Here at Precision Improvements we want to give you the bathroom you've been wanting. From studs to finishes we'll handle it all and be in total communication with you along the way. We want you to love your bathroom for years to come whether you want to spend $15000.00 or $50,000.00. We can make it happen and we guarantee the results.",precision-improvements,2022-03-30T09:03:24.000-04:00,NA,NA,NA,Bathrooms and showers,"Tiles, flooring, full bathrooms.","Riobel, Zitta, Enigma, Panasonic, Behr, Home Depot",Curbless showers,2021,3,"Cash, cheque, etransfer",,,,TRUE,TRUE,,$10000.00,TRUE,FALSE,Limited warranty,2028477,Precision Improvements ,1,1,23,10,"Bathroom Renovation, Bathroom renovation, bathroom remodeling, bathroom remodelling, renovating the bathroom, tearing out the bathroom, fixing up the bathroom, bathroom contractors, bathroom vanities, bathroom vanity, design of bathroom, bathroom and design, design for bathroom, design a bathroom, design a bath, bath design, bathroom tile, bathroom cabinets, remodeling a bathroom, bathroom remodeling, remodeling the bathroom, ,Bath renovation, New tub, caulking, ,",0,precisionimprovements,FALSE,0,0,25,FALSE,ffe87e7a20157d3de3f429ebce2aca09960e38e0,TRUE,NA,TRUE,TRUE,2276555,90.9271262569,316,NA,NA,2022-03-30T09:04:26.000-04:00,0
https://homestars.com/on/cadmus/bathroom-renovation,7,https://homestars.com/on/cadmus/bathroom-renovation,Bathroom Renovation,2975195,,/companies/2975195-smart-solution-contracting?searched_category_id=316&service_area=2297339,"We are a small, family oriented renovation company with focus on your needs. Each job presents its own unique challenges, and our experience allows us to help your project dreams become a reality.",smart-solution-contracting,2022-11-01T11:28:48.000-04:00,NA,NA,NA,,,,,NA,NA,,,,,FALSE,FALSE,,,FALSE,FALSE,,2037093,Smart Solution Contracting,1,1,13,10,"Bathroom Renovation, Bathroom renovation, bathroom remodeling, bathroom remodelling, renovating the bathroom, tearing out the bathroom, fixing up the bathroom, bathroom contractors, bathroom vanities, bathroom vanity, design of bathroom, bathroom and design, design for bathroom, design a bathroom, design a bath, bath design, bathroom tile, bathroom cabinets, remodeling a bathroom, bathroom remodeling, remodeling the bathroom, ,Bath renovation, New tub, caulking, ,Home Additions, General contractor, home improvement, building addition, home expansion, house expansion, house building, plans house, house plans from, plans for house, the house plans, house plans, renovation, in house design, home plans house, home house plans, house home plans, house plans home, remodeling, house plans and designs, designs house plans, house designs plans, house plans designs, home plans and designs, home designs plans, floor plans, house build, renovations, plans for building, kitchen cabinets, remodel, kitchen design, house plans for building, house plans building, ,",0,,FALSE,0,0,14,FALSE,aedb9b2c63266df04355704569517ab3c711aa9a,TRUE,NA,TRUE,TRUE,2297339,90.9392718808,316,NA,NA,2022-11-01T11:31:30.000-04:00,0
https://homestars.com/on/cadmus/bathroom-renovation,7,https://homestars.com/on/cadmus/bathroom-renovation,Bathroom Renovation,2967490,,/companies/2967490-integrity-property-redevelopment-consulting?searched_category_id=316&service_area=2278663,"Thank you for looking at our profile.  We are working hard to achieve first-class ratings with Homestars.  We have been in the construction and home renovation business for years, and have recently signed up with Homestars. 

We treat all customers like family, and our motto is... ""Do it right the first time...""

The INTEGRITY PROPERTY GROUP GIVES you our assurance that our professional installation crew will be friendly, neat and courteous as they complete your on-site installation and we clean up when we’re through. If you have any questions or needs that we might help you with please give us a call any time.”

We want to earn your business...!  Our business is based on reviews and referrals...

We are located in central Peterborough, however, we can handle jobs within a one hour radius, which would include a good part of cottage country (Kawartha's) and also Durham region, as well as part of Northumberland County.

It would be our pleasure to provide you with a free quote, to understand the scope of the work required, and to give you professional services.

Our specialties include the following;

* Deck Design and Installation
* Fence & Gate
* Pergola Design and Installation
* Building Sheds / Cabanas
* Landscape and Interlock
* General Home Renovations

Thank you for looking at our profile and we hope that we have the opportunity of working with you and your family on your next project.",integrity-property-redevelopment-consulting,2022-04-25T15:20:50.000-04:00,NA,NA,NA,"* Deck Design and Installation
* Fence & Gate
* Pergola Design and Installation
* Building Sheds / Cabanas
* Landscape and Interlock
* General Home Renovations","* Deck Design and Installation
* Fence & Gate
* Pergola Design and Installation
* Building Sheds / Cabanas
* Landscape and Interlock
* General Home Renovations",,"* Deck Design and Installation
* Fence & Gate
* Pergola Design and Installation
* Building Sheds / Cabanas
* Landscape and Interlock
* General Home Renovations",2010,10,Cash or E-Transfer,YES,,,TRUE,FALSE,Varies project to Project,$1000.00,TRUE,FALSE,To be discussed when quote provided,2029408,Integrity Property Redevelopment & Consulting,1,1,12,10,"Basement Renovation, Basement renovation, Basement remodeling, Basement remodelling, renovating your basement, renovation, waterproofing, remodeling, home renovation, house renovation, water in basement, basement waterproofing,finishing basement, moistureproof, remodeling the house, caulking,Bathroom Renovation, Bathroom renovation, bathroom remodeling, bathroom remodelling, renovating the bathroom, tearing out the bathroom, fixing up the bathroom, bathroom contractors, bathroom vanities, bathroom vanity, design of bathroom, bathroom and design, design for bathroom, design a bathroom, design a bath, bath design, bathroom tile, bathroom cabinets, remodeling a bathroom, bathroom remodeling, remodeling the bathroom, ,Bath renovation, New tub, caulking, ,General Contractors, Residential General Contractor, Building Contractor, Additions, Remodeling Contractor,  Renovation, Builder, building construction, renovation, remodeling, construction builders, construction company, construction companies, home repair, construction jobs, home remodeling, general contractors, contractors general, contractor general, contractors construction, construction contractors, home improvement and remodeling, kitchen remodeling, construction contractor, builders contractors, home renovation, general contracting, building contractors, building companies, home renovations, builder contractor, building contractor, remodeling contractor, commercial construction, residential construction, house contractor, concrete contractors, home contractors, general construction, construction general, contractors remodeling, remodeling contractors, remodelers, remodel contractor, remodel contractors, general contract, commercial contractors, renovations contractors, home improvement contractor, licensed contractor, license general contractor, mud room, mudroom, caulking, ,Kitchen Planning & Renovation, Kitchen Planning And Design, Kitchen Cabinet Planning, Kitchen Design, Kitchen Remodeling, kitchen or, and bathroom, a and a kitchens, kitchens and, for kitchens, a kitchens, kitchens, the house design, cabinets for kitchen, cabinets for the kitchen, cabinets and kitchen, kitchen cabinets, design a kitchen, about kitchen design, a kitchen design, how to kitchen design, design and kitchen, the kitchen design, design for kitchen, kitchen designs, renovation and remodeling, remodeling and renovation, kitchen designer,,Kitchen Renovation, caulking, ,",0,,FALSE,0,0,15,FALSE,0c2ba1c44b3b5ee34c1ae4549af75e49a255bea1,TRUE,NA,TRUE,TRUE,2278663,90.767467542,316,NA,NA,2022-04-25T15:24:56.000-04:00,0
