Link,n_hits,all_links,category,id,url,hs_path,profile,permalink,created_at,sic_code,service_area,hours,products,services,brands,specialities,established,employee_cnt,payment_method,diplomas,licenses,memberships,liability_insurance,bonded,project_rate,project_minimum,written_contract,written_warranty,warranty_terms,parent_company_id,name,total_number_of_reviews_cache,total_number_of_approved_reviews_cache,number_of_photos_cache,avg_rating_cache,categories_info_cache,savings_count,claimed_at,subdomain,fraudulent,fraudulent_count,total_number_of_pending_reviews_cache,images_count,completion_percent_cache,bully,secret,replied_to_at_least_one_review_cache,has_set_tasks,lead_purchase_eligible,service_area_id,star_score,quote_button_category,direct_phone,direct_contact
https://homestars.com/on/lefroy/furniture-refinish-repair,2,https://homestars.com/on/lefroy/furniture-refinish-repair,Furniture Refinish & Repair,2915160,https://rays-restoration.ueniweb.com/#header,/companies/2915160-ray-restorations?searched_category_id=366&service_area=2161312,"Foremost Furnishings, Upholstery Repairs in Barrie

Ray’s Restoration is one of the leaders in the furniture repair and upholstery industry in the Barrie area. We do furniture and kitchen cupboards restoration as well as reupholstery. We have mastered the art of dedicated craftsmanship and unparalleled quality in furnishings and wood repair. No matter how much of your office or home furniture needs restoration, no service is too big or too small for our dedicated team. You can call us on +17057305507 for a quote or to book.

Master Craft Upholsterers
There’s no need to throw away any of your furnishings just because they’ve got a little rip in the fabric. If you’re planning on buying or selling a piece of furniture you should allow a member of our crafty upholstery team repair your sofas, armchairs and fabrics back to their original health. This can be a great way of adding value to a furnishing that may have seen better days. You can always be guaranteed of a high-quality and professional service with Ray’s Restoration.

Why Choose Us?
We have vast experience repairing and reconditioning all kinds of furnishings and upholstery, and our process guarantees we repair and care for your furnishings as quickly and efficiently as possible. Never compromise when it comes to quality, let us take care of your furniture repair needs. We would be honoured to have you as a customer.


Facebook: https://www.facebook.com/pg/Rays-Restorations-39818480058/photos/?ref=page_internal",ray-restorations,2018-04-24T09:48:05.000-04:00,NA,NA,NA,,,,,2006,2,"E-Transfer, Cash, Cheques",,,,TRUE,FALSE,,,FALSE,FALSE,,1977344,Ray Restorations ,6,6,59,10,"Furniture Refinish & Repair, Furniture Repair Refinish, Refinish Furniture, Refinish Old Furniture, repair old furniture, how to antique, how to upholstery, refinishing, furniture old. how to antique furniture, furniture and antiques, antiques and furniture, furniture antiques, furniture repair, repair furniture, furniture repair how to, how to repair furniture, furniture restoration how to, how to furniture restoration, restoration of furniture, restoration furniture, furniture restoration, how to finish wood, furniture upholstery how to, repair wood, wood repair, wood refinishing how to, wood refinishing, how to refinishing furniture, furniture refinishing, refinishing furniture how to, refinishing furniture, furniture refinishing how to, wood finish, antique repair, fix wood, restoration antique, antique restoration, chair repair, fix furniture, repair upholstery, ,",0,2018-04-24T09:49:24.000-04:00,,FALSE,0,0,60,0,FALSE,62e8c289f59b3756e02af9735e03582dfba1c71d,TRUE,TRUE,FALSE,2161312,85.8082749755,366,NA,NA
https://homestars.com/on/lefroy/furniture-refinish-repair,2,https://homestars.com/on/lefroy/furniture-refinish-repair,Furniture Refinish & Repair,2884405,NA,/companies/2884405-dr-vinyl-and-mr-hide?searched_category_id=366&service_area=2084975,"Colour and Repair specialist for Leather, Vinyl, Plastics and Carpet. We make small cuts and tears go away saving you costly upholstery cost. Also specialize in Re-Dying Leather furniture. Established since 1994. 
leathervinylrepairs.com 
",dr-vinyl-and-mr-hide,2016-02-23T12:05:08.000-05:00,NA,NA,NA,NA,NA,NA,NA,NA,NA,NA,NA,NA,NA,FALSE,FALSE,NA,NA,FALSE,FALSE,NA,1946829,Dr. Vinyl And Mr. Hide,0,0,0,NA,"Furniture Refinish & Repair, Furniture Repair Refinish, Refinish Furniture, Refinish Old Furniture, repair old furniture, how to antique, how to upholstery, refinishing, furniture old. how to antique furniture, furniture and antiques, antiques and furniture, furniture antiques, furniture repair, repair furniture, furniture repair how to, how to repair furniture, furniture restoration how to, how to furniture restoration, restoration of furniture, restoration furniture, furniture restoration, how to finish wood, furniture upholstery how to, repair wood, wood repair, wood refinishing how to, wood refinishing, how to refinishing furniture, furniture refinishing, refinishing furniture how to, refinishing furniture, furniture refinishing how to, wood finish, antique repair, fix wood, restoration antique, antique restoration, chair repair, fix furniture, repair upholstery, ,",0,NA,NA,FALSE,0,0,0,0,FALSE,aaed646a19bd712189a95b4710bb6c676046bab2,FALSE,FALSE,FALSE,2084975,0,366,NA,NA
