Link,n_hits,all_links,category,id,url,hs_path,profile,permalink,created_at,sic_code,service_area,hours,products,services,brands,specialities,established,employee_cnt,payment_method,diplomas,licenses,memberships,liability_insurance,bonded,project_rate,project_minimum,written_contract,written_warranty,warranty_terms,parent_company_id,name,total_number_of_reviews_cache,total_number_of_approved_reviews_cache,number_of_photos_cache,avg_rating_cache,categories_info_cache,savings_count,claimed_at,subdomain,fraudulent,fraudulent_count,total_number_of_pending_reviews_cache,images_count,completion_percent_cache,bully,secret,replied_to_at_least_one_review_cache,has_set_tasks,lead_purchase_eligible,service_area_id,star_score,quote_button_category,direct_phone,direct_contact
https://homestars.com/on/russell/builders,1,https://homestars.com/on/russell/builders,Builders,2959204,https://elevateluxuryhomes.ca,/companies/2959204-elevate-luxury-homes?searched_category_id=321&service_area=2260065,"At Elevate Luxury Homes we believe that homes are the most precious places. 
They are our safe havens, a place where we make our memories and dreams with our loved ones. 

Elevate Luxury Homes is a custom home company that was founded on the idea of helping people create their dream homes that reflects their unique personalities.
 
Our professional team is dedicated to homeowners receiving the best value for every dollar they invest, making their new home a wise financial investment. 
With over 3 decades of experience and an extensive trade network, Elevate Luxury Homes will bring your dream home to reality.",elevate-luxury-homes,2021-08-27T16:19:28.000-04:00,NA,NA,NA,Custom Homes,,,,2017,5,"Cash, Check, E-Transfer, Debit & Credit",,Full Licensed,,FALSE,FALSE,,,TRUE,FALSE,Tarion,2021181,Elevate Luxury Homes,1,1,14,10,"Builders, Home Builders, Home Contractors, residential builders, home construction companies, residential building contractor, builder, construction builders, local home builders, custom home builders, master builders, general builders, new home builders, building contractors, custom home builders, luxury home builders, ,",0,2021-08-27T16:20:55.000-04:00,elevatehomes,FALSE,0,0,16,0,FALSE,5d6dc403ae31d0337fe38eb8cdaf423969f7705d,TRUE,TRUE,FALSE,2260065,86.3508977956,321,NA,NA
