Link,n_hits,all_links,category,id,url,hs_path,profile,permalink,created_at,sic_code,service_area,hours,products,services,brands,specialities,established,employee_cnt,payment_method,diplomas,licenses,memberships,liability_insurance,bonded,project_rate,project_minimum,written_contract,written_warranty,warranty_terms,parent_company_id,name,total_number_of_reviews_cache,total_number_of_approved_reviews_cache,number_of_photos_cache,avg_rating_cache,categories_info_cache,savings_count,claimed_at,subdomain,fraudulent,fraudulent_count,total_number_of_pending_reviews_cache,images_count,completion_percent_cache,bully,secret,replied_to_at_least_one_review_cache,latest_approved_review_created_at,has_set_tasks,lead_purchase_eligible,service_area_id,star_score,quote_button_category,direct_phone,direct_contact
https://homestars.com/on/newcastle/kitchen-planning-renovation,23,"c(""https://homestars.com/on/newcastle/kitchen-planning-renovation?&page=2&"", ""https://homestars.com/on/newcastle/kitchen-planning-renovation?&page=3&"")",Kitchen Planning & Renovation,2936562,http://rightchoicerenos.com/,/companies/2936562-right-choice-renos-inc?searched_category_id=393&service_area=2209982,"RIGHT CHOICE RENOS was founded on the principles of providing honest, reliable and ethical work at a fair price specializing in Home Renovation and Electrical work. Sean D'Aguiar has over 15 years experience with dealing with various trades. Brad Emmons,owner of EMMONS ELECTRIC is a Master Electrician and ACP certified who has over 20 years experience in the industry. Together we have a combined knowledge and appreciation of the overall process and requirements to get the project completed in a time efficient manner. We understand that renovation projects can be a stressful process. We treat every project as though it is our own and hope to provide the most pleasurable experience to every customer.",right-choice-renos-inc,2019-10-31T18:12:22.000-04:00,NA,NA,NA,,"ACCESSIBILITY 
From design to implementation we can build accessibility ramps, decks bathrooms and more. 

BASEMENT RENOVATIONS
From start to finish we take care of the planning, demolition, wall construction, electrical work, insulation, soundproofing ceiling, drywall, door installation, new floors, painting and much more.
Separate entrance-way, In-law suites, Bedrooms, Kitchens, Playrooms, Bathrooms, Laundry Rooms and More.

CEILINGS
Upgrading your home with ceiling renovations is a surefire way of improving the quality and value of your home and will give it a new modern look. We offer installation of drop ceilings, smooth ceilings, pot-lights, coffered ceilings and more. 

DECKS
Whether you are looking to repair/refinish an existing deck or to build your dream deck we can take care of it all. From design and planning to reality.  We offer flat decks, raised decks, multi-level decks, stairways and accessible ramps and more.

DEMOLITION/CONSTRUCTION CLEANUP
As part of any renovation project demolition is always one of the first steps. we take care of all demolition and garbage removal associated.

DRYWALLING
Complete repair and refinish of existing and new drywall on walls and ceilings.

ELETRICAL
We offer fully licensed services which include complete re-wiring of existing service, knob & tube removal, aluminum wiring, trouble shooting & repairs, radiant floor heat, lighting, pool and spa Hook-ups, Panel & Service upgrades, layout and design. 

FLOORING
We can take care of all your flooring needs; from the subfloor to the installation  of carpet, tile floors, laminate or vinyl

GARAGE AND SHED CONSTRUCTION  
Need some additional storage or need some power installed? We can help by adding or upgrading an electrical service,  shelving, repairs to existing building to design and build of your new garbage, storage shed, pool house or workshop.

GARAGE DOORS
Looking to add extra space or replace that old door; We offer full Garage Builds, Door openers, Garage door upgrades, capping, interior access doors, removal and installation.

GENERAL CONTRACTING
We manage all aspects of the project from start to finish which include; design and planning, drawings, permits and inspections.

HANDYMAN SERVICES
From minor repairs to your full renovation projects, we can help with it all.  

HVAC 
Fully licensed to supply and install new furnace upgrades, fireplaces, air-conditioners, hot water tanks and on demand hot water units. 

KITCHEN RENOVATIONS
Kitchens are the heart of the home, a gathering place for family and friends to cook, eat and entertain. We provide full kitchen remodeling to simply updating your existing kitchen. We can help with the installation of cabinet lighting, new floors, pot lights or even a back-splash. 

PAINTING
We provide services for painting which include; ceilings, interior and exterior walls (brick,wood and aluminum siding), decks, sheds, fences and more.  









 ",,,2019,4,Cash/ Cheque,,Electrical / HVAC/ Plumbing ,,TRUE,TRUE,,,TRUE,FALSE,,1998736,Right Choice Renos Inc.,23,22,386,9.95455,"General Contractors, Residential General Contractor, Building Contractor, Additions, Remodeling Contractor,  Renovation, Builder, building construction, renovation, remodeling, construction builders, construction company, construction companies, home repair, construction jobs, home remodeling, general contractors, contractors general, contractor general, contractors construction, construction contractors, home improvement and remodeling, kitchen remodeling, construction contractor, builders contractors, home renovation, general contracting, building contractors, building companies, home renovations, builder contractor, building contractor, remodeling contractor, commercial construction, residential construction, house contractor, concrete contractors, home contractors, general construction, construction general, contractors remodeling, remodeling contractors, remodelers, remodel contractor, remodel contractors, general contract, commercial contractors, renovations contractors, home improvement contractor, licensed contractor, license general contractor, mud room, mudroom, caulking, ,Kitchen Planning & Renovation, Kitchen Planning And Design, Kitchen Cabinet Planning, Kitchen Design, Kitchen Remodeling, kitchen or, and bathroom, a and a kitchens, kitchens and, for kitchens, a kitchens, kitchens, the house design, cabinets for kitchen, cabinets for the kitchen, cabinets and kitchen, kitchen cabinets, design a kitchen, about kitchen design, a kitchen design, how to kitchen design, design and kitchen, the kitchen design, design for kitchen, kitchen designs, renovation and remodeling, remodeling and renovation, kitchen designer,,Kitchen Renovation, caulking, ,",0,2019-11-05T13:35:12.000-05:00,rightchoicerenos,FALSE,0,0,373,0,FALSE,e4b1132a7e81d22122e44be03f81b1ef17b695db,TRUE,2021-01-18T22:09:40.000-05:00,TRUE,TRUE,2209982,94.5761915807,393,NA,NA
https://homestars.com/on/newcastle/kitchen-planning-renovation,23,"c(""https://homestars.com/on/newcastle/kitchen-planning-renovation?&page=2&"", ""https://homestars.com/on/newcastle/kitchen-planning-renovation?&page=3&"")",Kitchen Planning & Renovation,2896130,https://www.facebook.com/btlcontracting/,/companies/2896130-built-to-last-contracting?searched_category_id=393&service_area=2240677,"*During the unprecedented time we are happy to offer Zoom and Facetime consultations, or in person with mask and social distancing. We are following all CDC guidelines. Your health is our priority !*

 At Built to Last Contracting we believe in simplicity.  We handle all aspects of your project from inception to design. We understand that a renovation can be immensely stressful, and we are here to make sure that is not the case! When you select us for your project, all you have to do is envision the changes you want made to your space and then let us handle the rest. We do full home and commercial renovation but specialize in Custom Kitchens, Basements and Bathrooms. Full 3D design rendering drawings available to envision your dream space before we make it your reality!  We are covered under WSIB and 2 Million liability insurance. We aim to make your renovation process as seamless as possible. ",built-to-last-contracting,2017-04-16T15:44:41.000-04:00,NA,NA,NA,,,,,NA,4,Cheque or E-Transfer,,"We sub-contract to a licensed Electrician, Plumber, Architect and HVAC technician. ",,TRUE,FALSE,,3500,TRUE,FALSE,2 Year Warranty ,1958554,Built To Last Contracting,30,27,81,9.88889,"Kitchen Planning & Renovation, Kitchen Planning And Design, Kitchen Cabinet Planning, Kitchen Design, Kitchen Remodeling, kitchen or, and bathroom, a and a kitchens, kitchens and, for kitchens, a kitchens, kitchens, the house design, cabinets for kitchen, cabinets for the kitchen, cabinets and kitchen, kitchen cabinets, design a kitchen, about kitchen design, a kitchen design, how to kitchen design, design and kitchen, the kitchen design, design for kitchen, kitchen designs, renovation and remodeling, remodeling and renovation, kitchen designer,,Kitchen Renovation, caulking, ,General Contractors, Residential General Contractor, Building Contractor, Additions, Remodeling Contractor,  Renovation, Builder, building construction, renovation, remodeling, construction builders, construction company, construction companies, home repair, construction jobs, home remodeling, general contractors, contractors general, contractor general, contractors construction, construction contractors, home improvement and remodeling, kitchen remodeling, construction contractor, builders contractors, home renovation, general contracting, building contractors, building companies, home renovations, builder contractor, building contractor, remodeling contractor, commercial construction, residential construction, house contractor, concrete contractors, home contractors, general construction, construction general, contractors remodeling, remodeling contractors, remodelers, remodel contractor, remodel contractors, general contract, commercial contractors, renovations contractors, home improvement contractor, licensed contractor, license general contractor, mud room, mudroom, caulking, ,",0,NA,builttolast,FALSE,0,0,92,0,FALSE,a6b92916bd6b6055218cb8e42555fbee1d8acc59,TRUE,NA,TRUE,TRUE,2240677,97.6421359617,393,NA,NA
https://homestars.com/on/newcastle/kitchen-planning-renovation,23,"c(""https://homestars.com/on/newcastle/kitchen-planning-renovation?&page=2&"", ""https://homestars.com/on/newcastle/kitchen-planning-renovation?&page=3&"")",Kitchen Planning & Renovation,2931859,https://aplusconstructions.ca/,/companies/2931859-a-construction-canada?searched_category_id=393&service_area=2200360,"General Contractors, we handle all jobs big & small. Professionals in new builds, additions, interior design/renovations, basement finishing.",a-construction-canada,2019-06-06T23:42:55.000-04:00,NA,NA,NA,,,,,NA,NA,,,,,FALSE,FALSE,,,TRUE,FALSE,,1994033,A+ Construction Canada,11,11,12,9.90909,"General Contractors, Residential General Contractor, Building Contractor, Additions, Remodeling Contractor,  Renovation, Builder, building construction, renovation, remodeling, construction builders, construction company, construction companies, home repair, construction jobs, home remodeling, general contractors, contractors general, contractor general, contractors construction, construction contractors, home improvement and remodeling, kitchen remodeling, construction contractor, builders contractors, home renovation, general contracting, building contractors, building companies, home renovations, builder contractor, building contractor, remodeling contractor, commercial construction, residential construction, house contractor, concrete contractors, home contractors, general construction, construction general, contractors remodeling, remodeling contractors, remodelers, remodel contractor, remodel contractors, general contract, commercial contractors, renovations contractors, home improvement contractor, licensed contractor, license general contractor, mud room, mudroom, caulking, ,Basement Renovation, Basement renovation, Basement remodeling, Basement remodelling, renovating your basement, renovation, waterproofing, remodeling, home renovation, house renovation, water in basement, basement waterproofing,finishing basement, moistureproof, remodeling the house, caulking,Bathroom Renovation, Bathroom renovation, bathroom remodeling, bathroom remodelling, renovating the bathroom, tearing out the bathroom, fixing up the bathroom, bathroom contractors, bathroom vanities, bathroom vanity, design of bathroom, bathroom and design, design for bathroom, design a bathroom, design a bath, bath design, bathroom tile, bathroom cabinets, remodeling a bathroom, bathroom remodeling, remodeling the bathroom, ,Bath renovation, New tub, caulking, ,Kitchen Planning & Renovation, Kitchen Planning And Design, Kitchen Cabinet Planning, Kitchen Design, Kitchen Remodeling, kitchen or, and bathroom, a and a kitchens, kitchens and, for kitchens, a kitchens, kitchens, the house design, cabinets for kitchen, cabinets for the kitchen, cabinets and kitchen, kitchen cabinets, design a kitchen, about kitchen design, a kitchen design, how to kitchen design, design and kitchen, the kitchen design, design for kitchen, kitchen designs, renovation and remodeling, remodeling and renovation, kitchen designer,,Kitchen Renovation, caulking, ,",0,2019-06-06T23:44:11.000-04:00,aplusconstruct,FALSE,0,0,13,0,FALSE,a14c6ef487d0d91426652c247dfe3b9ed0d37518,TRUE,2019-08-20T13:58:27.000-04:00,TRUE,TRUE,2200360,83.1266131534,393,NA,NA
https://homestars.com/on/newcastle/kitchen-planning-renovation,23,"c(""https://homestars.com/on/newcastle/kitchen-planning-renovation?&page=2&"", ""https://homestars.com/on/newcastle/kitchen-planning-renovation?&page=3&"")",Kitchen Planning & Renovation,2851375,http://eastprocontracting.ca,/companies/2851375-east-pro-contracting-group?searched_category_id=393&service_area=2114531,"East Pro Contracting Group offers commercial and residential services in the east GTA and surrounding areas. 

With over 15 years of experience renovating kitchens, bathrooms, basements, offices and more, we provide all the necessary resources to assist with preparing creative designs as well as managing and completing your project on budget, on time and with the highest level of quality workmanship. 

Whether we are drawing inspiration from modern trends, finding unique solutions to renovation challenges or simply creating a space that showcases your true colours, we can help to customize a plan and create a budget for your next project!

Service areas include (but not necessarily limited to) Scarborough, East York, North York, Markham, Stouffville, Claremont, Uxbridge, Pickering, Ajax, Whitby, Oshawa, Courtice, Bowmanville. ",east-pro-contracting-group,2014-04-02T15:13:44.000-04:00,NA,NA,,,Commercial and Residential remodels and general renovations,vary depending on client preference and project details,"Whole home renovations, including Kitchens, Bathrooms and Basement projects. 
Commercial repairs and renovation services available as well. ",2004,NA,"Cheque, Interac",,,,TRUE,FALSE,,,TRUE,FALSE,1 year. Please ask for details.,1913807,East Pro Contracting Group,25,23,44,9.95652,"General Contractors, Residential General Contractor, Building Contractor, Additions, Remodeling Contractor,  Renovation, Builder, building construction, renovation, remodeling, construction builders, construction company, construction companies, home repair, construction jobs, home remodeling, general contractors, contractors general, contractor general, contractors construction, construction contractors, home improvement and remodeling, kitchen remodeling, construction contractor, builders contractors, home renovation, general contracting, building contractors, building companies, home renovations, builder contractor, building contractor, remodeling contractor, commercial construction, residential construction, house contractor, concrete contractors, home contractors, general construction, construction general, contractors remodeling, remodeling contractors, remodelers, remodel contractor, remodel contractors, general contract, commercial contractors, renovations contractors, home improvement contractor, licensed contractor, license general contractor, mud room, mudroom, caulking, ,Basement Renovation, Basement renovation, Basement remodeling, Basement remodelling, renovating your basement, renovation, waterproofing, remodeling, home renovation, house renovation, water in basement, basement waterproofing,finishing basement, moistureproof, remodeling the house, caulking,Kitchen Planning & Renovation, Kitchen Planning And Design, Kitchen Cabinet Planning, Kitchen Design, Kitchen Remodeling, kitchen or, and bathroom, a and a kitchens, kitchens and, for kitchens, a kitchens, kitchens, the house design, cabinets for kitchen, cabinets for the kitchen, cabinets and kitchen, kitchen cabinets, design a kitchen, about kitchen design, a kitchen design, how to kitchen design, design and kitchen, the kitchen design, design for kitchen, kitchen designs, renovation and remodeling, remodeling and renovation, kitchen designer,,Kitchen Renovation, caulking, ,",0,NA,,FALSE,0,0,54,0,FALSE,3c7da0e2655b65ba77075895328571b77d759eef,TRUE,2018-10-17T08:39:54.000-04:00,TRUE,TRUE,2114531,88.8422184719,393,NA,NA
https://homestars.com/on/newcastle/kitchen-planning-renovation,23,"c(""https://homestars.com/on/newcastle/kitchen-planning-renovation?&page=2&"", ""https://homestars.com/on/newcastle/kitchen-planning-renovation?&page=3&"")",Kitchen Planning & Renovation,2925108,http://housetek.ca/,/companies/2925108-housetek-home-improvements?searched_category_id=393&service_area=2183424,"HouseTek’s number one goal is to make your house a much more attractive, comfortable and functional place to live by applying care, thought, skill and passion to every phase of our work.
We are pleased to offer services in Oshawa, Ontario and eastern Toronto and we love transforming kitchens, bathrooms and basements into beautiful and functional living spaces.   We love home renovation and we're good at it!",housetek-home-improvements,2018-12-10T18:21:37.000-05:00,NA,NA,NA,,,,,NA,NA,"E-Transfer, Cash, Cheque, ",,,,TRUE,FALSE,,,TRUE,FALSE,"Yes, ask for details.  ",1987282,Housetek Home Improvements,18,17,113,9.58823,"Kitchen Planning & Renovation, Kitchen Planning And Design, Kitchen Cabinet Planning, Kitchen Design, Kitchen Remodeling, kitchen or, and bathroom, a and a kitchens, kitchens and, for kitchens, a kitchens, kitchens, the house design, cabinets for kitchen, cabinets for the kitchen, cabinets and kitchen, kitchen cabinets, design a kitchen, about kitchen design, a kitchen design, how to kitchen design, design and kitchen, the kitchen design, design for kitchen, kitchen designs, renovation and remodeling, remodeling and renovation, kitchen designer,,Kitchen Renovation, caulking, ,Bathroom Renovation, Bathroom renovation, bathroom remodeling, bathroom remodelling, renovating the bathroom, tearing out the bathroom, fixing up the bathroom, bathroom contractors, bathroom vanities, bathroom vanity, design of bathroom, bathroom and design, design for bathroom, design a bathroom, design a bath, bath design, bathroom tile, bathroom cabinets, remodeling a bathroom, bathroom remodeling, remodeling the bathroom, ,Bath renovation, New tub, caulking, ,",0,2018-12-10T18:24:31.000-05:00,housetek,FALSE,0,0,130,0,FALSE,3f86dc922590916639d9612572960cc85f01dd1b,TRUE,2019-08-23T18:06:11.000-04:00,TRUE,TRUE,2183424,92.8883802407,393,NA,NA
https://homestars.com/on/newcastle/kitchen-planning-renovation,23,"c(""https://homestars.com/on/newcastle/kitchen-planning-renovation?&page=2&"", ""https://homestars.com/on/newcastle/kitchen-planning-renovation?&page=3&"")",Kitchen Planning & Renovation,2932572,https://www.prontokitchens.ca,/companies/2932572-pronto-kitchens?searched_category_id=393&service_area=2225799,All In One Kitchen & Cabinetry Renovation Solution Pronto Kitchens is a full-service kitchen renovation company. Whether it’s a just cabinetry or a full renovation Pronto is fully equipped with in-house specialists. Everything is in house from manufacturing to installation and have a list of trusted contractors that have the fastest project completions in the Renovation industry. Get Free No Obligation In-Home Inspection.,pronto-kitchens,2019-06-27T16:47:50.000-04:00,NA,NA,NA,,,,,NA,NA,"Cash, Cheque, Credit Card",,,,TRUE,FALSE,,,TRUE,FALSE,1 year ,1994746,Pronto Kitchens,11,9,22,8.55556,"Kitchen Planning & Renovation, Kitchen Planning And Design, Kitchen Cabinet Planning, Kitchen Design, Kitchen Remodeling, kitchen or, and bathroom, a and a kitchens, kitchens and, for kitchens, a kitchens, kitchens, the house design, cabinets for kitchen, cabinets for the kitchen, cabinets and kitchen, kitchen cabinets, design a kitchen, about kitchen design, a kitchen design, how to kitchen design, design and kitchen, the kitchen design, design for kitchen, kitchen designs, renovation and remodeling, remodeling and renovation, kitchen designer,,Kitchen Renovation, caulking, ,",0,2019-06-27T16:48:08.000-04:00,,FALSE,0,0,23,0,FALSE,d2d7bd06ef0b38240a6342dd10d1ba1dc45101f9,TRUE,NA,TRUE,TRUE,2225799,70.2210108455,393,NA,NA
