Link,n_hits,all_links,category,id,url,hs_path,profile,permalink,created_at,sic_code,service_area,hours,products,services,brands,specialities,established,employee_cnt,payment_method,diplomas,licenses,memberships,liability_insurance,bonded,project_rate,project_minimum,written_contract,written_warranty,warranty_terms,parent_company_id,name,total_number_of_reviews_cache,total_number_of_approved_reviews_cache,number_of_photos_cache,avg_rating_cache,categories_info_cache,savings_count,claimed_at,subdomain,fraudulent,fraudulent_count,total_number_of_pending_reviews_cache,images_count,completion_percent_cache,bully,secret,replied_to_at_least_one_review_cache,latest_approved_review_created_at,has_set_tasks,lead_purchase_eligible,service_area_id,star_score,quote_button_category,direct_phone,direct_contact
https://homestars.com/on/elora/kitchen-bathroom-cabinets-design,3,https://homestars.com/on/elora/kitchen-bathroom-cabinets-design,Kitchen & Bathroom - Cabinets & Design,2758047,http://technokitchenrefacing.com/,/companies/2758047-techno-kitchen-refacing?searched_category_id=392&service_area=2241901,"Techno Kitchen Refacing is an Ontario based kitchen renovation company that specializes in refacing, rather than replacing. Recently, we brought on another member to the team to supply the increasing demand. Now, we can serve you faster, and across a larger area.

Techno's word-of-mouth marketing philosophy shows how happy customers have been with the product. Honesty and customer satisfaction are of the utmost concern for Techno and the customer will benefit every time.

Want to see it for yourself? Our customers are so happy and enthusiastic about the work that they've allowed us to invite you into their homes to see firsthand the quality of the work. Call today and ask how to arrange a meeting with Frank.",techno-kitchen-refacing,2008-03-04T16:55:15.000-05:00,NA,"Stoney Creek, Hamilton, Grimsby, St. Catherine's, Niagara, Welland, Burlington, Oakville, Milton, Georgetown, Halton Hills, Caledon, Mississauga, Brampton, Toronto, Etobicoke, Scarborough, North York, Markham, Ajax, Pickering, Richmond Hill, Oshawa, Vaughan, Woodbridge, Barrie, Muskoka, Kitchener, Cambridge, Waterloo, Guelph, Ayr, Orangeville, Flamborough, Waterdown",Tuesday to Friday 10 am - 5 pm Saturday 10 am - 4 pm ,"Why Choose Techno?
Full Satisfaction Guarantee! Real wood doors and veneer in several different stains, colors and species! No plastic, no paper, no cheap looking laminate! We're a member of the Better Business Bureau! You work directly with the owner who will be personally involved in making your dream kitchen a reality!","Cabinet repainting, cabinet refacing and custom-built cabinetry and entertainment units.",,"*WE SPECIALIZE IN REAL WOOD*
After 15 years of experience in the woodworking and cabinetry industry, Techno founder Frank Silletti chose to start his own refacing company with the goal of giving homeowners in Ontario a more affordable alternative to traditional kitchen remodeling. Frank says ""By using the cabinet refacing process, we are able to dramatically cut down the time, cost and inconvenience of building and creating your dream kitchen"". With the experience and the motivation to back his work, you can be sure Frank will be there to answer any questions or concerns to deliver the best value and quality of work available. Please feel free to visit the contact page and fill out an information request form. We look forward to hearing from you!

 ",2003,8,"Cheque, Visa, Mastercard, Debit",,Approved,,TRUE,TRUE,,,TRUE,FALSE,,1821099,Techno Kitchen Refacing,263,237,30,9.9789,"Kitchen & Bathroom - Cabinets & Design, Kitchen Cabinet And Counter, Kitchen Cabinet Hardware, Bathroom Cabinet, Bathroom Wall Cabinet, Bathroom Sink Cabinet, cabinets, kitchens, cabinetry, kitchen and cabinets, cabinets for kitchen, about kitchen cabinets, kitchen cabinets, kitchen cabinets in, cabinets for the kitchen, cabinets and kitchen, cabinets kitchen, kitchen cabinet, cabinet kitchen, the kitchen cabinet, kitchen by design, design kitchen, a kitchen design, design a kitchen, design for kitchen, design and kitchen, design by kitchen, kitchen design, cabinetry kitchen, kitchen cabinetry, designs kitchen, kitchen designs, bathroom vanities, vanity and bathroom, bath and vanity, designer kitchen, ,Kitchen Planning & Renovation, Kitchen Planning And Design, Kitchen Cabinet Planning, Kitchen Design, Kitchen Remodeling, kitchen or, and bathroom, a and a kitchens, kitchens and, for kitchens, a kitchens, kitchens, the house design, cabinets for kitchen, cabinets for the kitchen, cabinets and kitchen, kitchen cabinets, design a kitchen, about kitchen design, a kitchen design, how to kitchen design, design and kitchen, the kitchen design, design for kitchen, kitchen designs, renovation and remodeling, remodeling and renovation, kitchen designer,,Kitchen Renovation, caulking, ,Countertops, Granite Counter Tops, Kitchen Counter Tops, Marble Counter Tops, Laminate Counter Top, Quartz Counter Top, Corian counter top, tile counter top, silestone counter tops, arborite counter tops, custom counter tops, kitchen, remodeling, kitchen cabinet, kitchen design, ,",1,2011-01-16T19:41:57.000-05:00,kitchenrefacing,FALSE,0,1,37,100,FALSE,cba1b244bc7010887a806905a10809103a42cd8f,TRUE,2022-09-26T17:21:42.000-04:00,TRUE,TRUE,2241901,99.5197896225,392,NA,NA
https://homestars.com/on/elora/kitchen-bathroom-cabinets-design,3,https://homestars.com/on/elora/kitchen-bathroom-cabinets-design,Kitchen & Bathroom - Cabinets & Design,2862889,NA,/companies/2862889-coverdale-kitchens-and-designs?searched_category_id=392&service_area=2003155,NA,coverdale-kitchens-and-designs,2014-12-01T08:40:03.000-05:00,NA,NA,NA,NA,NA,NA,NA,NA,NA,NA,NA,NA,NA,FALSE,FALSE,NA,NA,FALSE,FALSE,NA,1925315,Coverdale Kitchens And Designs,3,1,0,0,"Kitchen & Bathroom - Cabinets & Design, Kitchen Cabinet And Counter, Kitchen Cabinet Hardware, Bathroom Cabinet, Bathroom Wall Cabinet, Bathroom Sink Cabinet, cabinets, kitchens, cabinetry, kitchen and cabinets, cabinets for kitchen, about kitchen cabinets, kitchen cabinets, kitchen cabinets in, cabinets for the kitchen, cabinets and kitchen, cabinets kitchen, kitchen cabinet, cabinet kitchen, the kitchen cabinet, kitchen by design, design kitchen, a kitchen design, design a kitchen, design for kitchen, design and kitchen, design by kitchen, kitchen design, cabinetry kitchen, kitchen cabinetry, designs kitchen, kitchen designs, bathroom vanities, vanity and bathroom, bath and vanity, designer kitchen, ,",0,2014-12-01T08:40:05.000-05:00,NA,FALSE,0,0,0,0,FALSE,4517463c3c7a2d93aeff88751812c101f80388ea,FALSE,2015-03-16T06:31:28.000-04:00,TRUE,FALSE,2003155,0.0,392,NA,NA
https://homestars.com/on/elora/kitchen-bathroom-cabinets-design,3,https://homestars.com/on/elora/kitchen-bathroom-cabinets-design,Kitchen & Bathroom - Cabinets & Design,2686076,NA,/companies/2686076-gl-industries?searched_category_id=392&service_area=1699280,NA,gl-industries,2008-03-04T16:55:15.000-05:00,NA,NA,NA,NA,NA,NA,NA,NA,NA,NA,NA,NA,NA,FALSE,FALSE,NA,NA,FALSE,FALSE,NA,1749128,GL Industries,0,0,0,NA,"Kitchen & Bathroom - Cabinets & Design, Kitchen Cabinet And Counter, Kitchen Cabinet Hardware, Bathroom Cabinet, Bathroom Wall Cabinet, Bathroom Sink Cabinet, cabinets, kitchens, cabinetry, kitchen and cabinets, cabinets for kitchen, about kitchen cabinets, kitchen cabinets, kitchen cabinets in, cabinets for the kitchen, cabinets and kitchen, cabinets kitchen, kitchen cabinet, cabinet kitchen, the kitchen cabinet, kitchen by design, design kitchen, a kitchen design, design a kitchen, design for kitchen, design and kitchen, design by kitchen, kitchen design, cabinetry kitchen, kitchen cabinetry, designs kitchen, kitchen designs, bathroom vanities, vanity and bathroom, bath and vanity, designer kitchen, ,",0,NA,NA,FALSE,0,0,0,NA,FALSE,NA,FALSE,NA,FALSE,FALSE,1699280,-1.0,392,NA,NA
