Link,n_hits,all_links,category,id,url,hs_path,profile,permalink,created_at,sic_code,service_area,hours,products,services,brands,specialities,established,employee_cnt,payment_method,diplomas,licenses,memberships,liability_insurance,bonded,project_rate,project_minimum,written_contract,written_warranty,warranty_terms,parent_company_id,name,total_number_of_reviews_cache,total_number_of_approved_reviews_cache,number_of_photos_cache,avg_rating_cache,categories_info_cache,savings_count,claimed_at,subdomain,fraudulent,fraudulent_count,total_number_of_pending_reviews_cache,images_count,completion_percent_cache,bully,secret,replied_to_at_least_one_review_cache,latest_approved_review_created_at,has_set_tasks,lead_purchase_eligible,service_area_id,star_score,quote_button_category,direct_phone,direct_contact
https://homestars.com/on/port%20coquitlam/weed-control,2,https://homestars.com/on/port%20coquitlam/weed-control,Weed Control,198943,http://www.bur-han.ca,/companies/198943-burhan-lawn-care?searched_category_id=449&service_area=1826464,"BUR-HAN ® Garden and Lawn Care is a complete residential, commercial and strata garden and lawn maintenance company serving both residential and commercial clients. Call us today at 604-983-2687 to get a free quote! 

Areas Serviced:
Residential: North Vancouver, West Vancouver, Burnaby, Vancouver & some parts of Coquitlam 
Commercial: North Vancouver, West Vancouver, Burnaby, Vancouver, Coquitlam, Port Coquitlam, Port Moody, Maple Ridge, Whiterock, Surrey, Delta, New Westminster 

",burhan-lawn-care,2006-11-07T19:00:00.000-05:00,NA,"Vancouver, North Vancouver, West Vancouver, Burnaby, Coquitlam, Port Coquitlam, Port Moody, Maple Ridge, and parts New Westminster",Monday - Friday: 8:30am - 4:30pm,"Strata, Industrial, Retail, and Commercial Clients: All garden care and lawn care maintenance needs, Parking Lot management, Snow Management, Landscaping","Lawns: Deep Core Aeration, Fertilization, Organic Weed Control, Lime, Moss Spray, Seed and Soil, Grub Gone, Leaf and Clean-up, Landscape Maintenance, Real Estate Outdoor Make-over as well as projects/installations such as paving stone installation/repair, retaining walls, driveways, pathways, artificial turf, etc. ",,"Gardening & Grounds Maintenance,
Lawn Care, 
Project Services : Paving Stones, Retaining Walls, Irrigation, Lighting, Material Installations, etc. ",1995,40,Visa or MasterCard,Red Seal,,,TRUE,FALSE,,,FALSE,FALSE,,55344,Bur Han Garden And Lawn Care,122,95,64,9.7,"Lawn Maintenance, Lawn Care, Lawn Mowers, Lawn Maintenance Companies, grass cutters, grass cutting, shrub pruning, lawns, a lawns, landscaping, mowing, lawn mowers, mowing lawn, lawn mowing, mowing the lawns, mowing lawns, lawns mowing, yard and garden, maintenance lawn, lawns maintenance, lawncare, service lawn, lawn service, grass mowing, lawn treatment, green grass, lawn repair, grass lawn mowers, lawn & landscape, lawn landscape, a lawn and landscape, landscape and lawn, lawn and landscape, lawn services, yard landscape, lawn maintenance service, lawn service maintenance, landscaping a yard, yard landscaping, lawn maintenance services, maintenance company, grass cutting, maintenance business, lawn business, leaf clean up, fall leaves, hedges ,Weed Control, lawn maintenance, weeding companies, weed companies, weed and pest control,Garden Maintenance, lawn, flower beds flowers bedding plants yards, lawns, landscaping, landscaping and, how to landscape a garden, garden landscape, garden and landscape, landscape garden, landscape and garden, landscape a garden, landscape of garden, garden & landscape, gardener, gardening, gardens and landscape, landscape gardens, gardens landscape, gardeners, lawn mowers, lawn mowing, lawns mowing, garden centre, garden and lawn, horticulture, garden centres, design and garden, garden design, the garden design, design garden, garden design how to, how to garden design, how to design a garden, design a garden, gardening gardens, maintenance lawn, lawn maintenance, design landscape, designs garden, garden designs, lawncare, lawn service, garden & landscaping, landscaping and garden, garden landscaping, landscaping a garden, landscaping garden, garden and landscaping, grass mowing, garden designer, leaf clean up, fall leaves, hedges
,",1,2009-11-11T18:17:11.000-05:00,Bur-Han,FALSE,0,0,64,100,FALSE,321810d136e073157072d9739c2a474e43f95c41,TRUE,2021-10-13T19:05:58.000-04:00,TRUE,TRUE,1826464,90.2583938111,449,NA,NA
https://homestars.com/on/port%20coquitlam/weed-control,2,https://homestars.com/on/port%20coquitlam/weed-control,Weed Control,2578064,NA,/companies/2578064-agave-enterprises-ltd?searched_category_id=449&service_area=1591268,NA,agave-enterprises-ltd,2008-03-04T16:55:15.000-05:00,NA,NA,NA,NA,NA,NA,NA,NA,NA,NA,NA,NA,NA,FALSE,FALSE,NA,NA,FALSE,FALSE,NA,1641116,Agave Enterprises Ltd,0,0,0,NA,"Weed Control, lawn maintenance, weeding companies, weed companies, weed and pest control,",0,NA,NA,FALSE,0,0,0,NA,FALSE,NA,FALSE,NA,FALSE,FALSE,1591268,0,449,NA,NA
