Link,n_hits,all_links,category,id,url,hs_path,profile,permalink,created_at,sic_code,service_area,hours,products,services,brands,specialities,established,employee_cnt,payment_method,diplomas,licenses,memberships,liability_insurance,bonded,project_rate,project_minimum,written_contract,written_warranty,warranty_terms,parent_company_id,name,total_number_of_reviews_cache,total_number_of_approved_reviews_cache,number_of_photos_cache,avg_rating_cache,categories_info_cache,savings_count,subdomain,fraudulent,fraudulent_count,total_number_of_pending_reviews_cache,images_count,completion_percent_cache,bully,secret,replied_to_at_least_one_review_cache,latest_approved_review_created_at,has_set_tasks,lead_purchase_eligible,service_area_id,star_score,quote_button_category,direct_phone,direct_contact,claimed_at
https://homestars.com/on/rocky%20view%20county/roofing,47,"c(""https://homestars.com/on/rocky%20view%20county/roofing?&page=2&"", ""https://homestars.com/on/rocky%20view%20county/roofing?&page=3&"", ""https://homestars.com/on/rocky%20view%20county/roofing?&page=4&"", ""https://homestars.com/on/rocky%20view%20county/roofing?&page=5&"")",Roofing,2788448,http://www.rushroofing.com,/companies/2788448-rush-roofing-and-exteriors?searched_category_id=428&service_area=1846760,"Rush Roofing has been installing asphalt, wood, and specialty roofs in Calgary and the surrounding area since 1992.

Today, Rush Roofing is recognized by builders and manufacturers for our excellent installation procedures. We have manufacturer-certified installers for all the products we offer, and we have obtained Master Elite Contractor status (only 3% of roofing contractors in North America have obtained this status.) This allows us to offer one of the best shingle warranties available: The Golden Pledge Warranty.

Rush Roofing is willing and able to take on jobs of all sizes, from large commercial flat roofs to small rural bungalows - we have experienced installers that can get the job done right. Whether you are a homeowner looking to replace a worn-out roof, or a builder/developer seeking a contractor for your next project, you can feel confident that we will offer our best service at our best price backed by our workmanship warranty.

Our roofing practices are based on the guidelines set forth by the Alberta Building Code.

We are members of the Calgary Home Builders Association and an Accredited Business with the Better Business Bureau, with an A+ rating.

For all your roofing needs, Rush Roofing has you covered!",rush-roofing-and-exteriors,2011-06-24T11:44:52.000-04:00,NA,Calgary & Surrounding Areas,,"Asphalt Roofing, Shakes, Flat Roofing, Metal Roofing, Standing Seam, Torch on Membranes. ","Re-Roofing, New Construction Roofing, Flat Roofing, Siding, Soffit, Fascia, Eavestrough, ","IKO, GAF, Soprema, Royal, GEM, Malarkey, Owens Corning, Hardie Board, Gentek, Kaycan, Waynes, ","New Construction, Re-Roofs, Flat Roofing, Metal Roofing, Rubber Roofing, Siding, Soffit, Fascia, Eavestrough",1992,NA,"Cash, Cheque, Mastercard, Visa.",,"WCB, COR","Calgary Home Builders Association, Better Business Bureau, ACSA",TRUE,FALSE,,None,TRUE,FALSE,15 Year Workmanship,1851500,Rush Roofing and Exteriors,33,30,19,9.26667,"Roofing, Roofing Contractor, Metal Roofing, Roofing Material, Roofing Shingles, Roofing Company, cedar roofing, roofing repair, roof repair, cedar shingles, shingles, roof repair, slate roofing, slate roofs, cedar shakes, roof, how to roof, about roofing, at roofing, the roofing, roofing roofing, a roofing, roof roof roofing, shingles, roofs, shingles for roof, roof shingles, shingles roof, roofing shingles, shingles roofing, metal roof, roof metal, metal roofing, roofing metal, steel roof, steel roofing, roof repair, roof and repair, roofers, roofer, roof tiles, roof tile, tile roof, roofing contractors, roofing companies, metal roofs, roof shingle, shingle roof, contractor roofing, roofing contractor, Roofing Contractor for New Shingles, roofing canada, roofing companies, canadian roofing contractors, roof builders, roofing installers, contractor roofing, roofing calgary, roofing ottawa, roofers calgary, roofing jobs, roofing barrie, best roofing material, vancouver, roofing contractors, roof contractors, roofing supply , home roofing, roofing ontario, roof ontario, commercial roofing, residential roofers, roofing builders, shingle roof contractor, residential roofing company, roof types, best roofing company, fiberglass shingles,  canadian roofing company, flat roofing, industrail roofing, types of roofing, roofing options, list roofing companies, shinglers, roofing estimates, elk shingles,  roofing reviews, asphalt shingles prices, metal sheet roofing, roofing systems, flat roofing companies, roofing and siding, roofers review, new roofing, slate roofing contractors, roof installers, vinyl roofing material, roof sheets, commercial roof repairs,",1,rushroofing,FALSE,0,0,21,NA,FALSE,374004ff726fbc11fdcc97189727191aa82671ae,TRUE,2016-11-30T21:58:32.000-05:00,TRUE,TRUE,1846760,88.7393311129,428,NA,NA,2014-05-23T12:19:36.000-04:00
https://homestars.com/on/rocky%20view%20county/roofing,47,"c(""https://homestars.com/on/rocky%20view%20county/roofing?&page=2&"", ""https://homestars.com/on/rocky%20view%20county/roofing?&page=3&"", ""https://homestars.com/on/rocky%20view%20county/roofing?&page=4&"", ""https://homestars.com/on/rocky%20view%20county/roofing?&page=5&"")",Roofing,2894657,http://practicalroofing.ca/,/companies/2894657-practical-roofing-exteriors-ltd?searched_category_id=428&service_area=2117961,Practical Roofing & Exteriors strives to provide high quality of workmanship and products for our customer. We help the customer with making an educated decision from the start. Our crews act in a professional and proper manner because it is your home. We look forward to working with you.,practical-roofing-exteriors-ltd,2017-03-02T17:36:13.000-05:00,NA,NA,NA,"Laminate shingles, Rubber shingles, Eaves, Siding","Re-roof, new roof, eaves, siding, gutter cleaning, roof inspections","Landmark, Malarky, Gaf, Eurotile",Pitched roofing.,2001,NA,,,Yes,BBB,TRUE,FALSE,,,FALSE,FALSE,,1957081,Practical Roofing & Exteriors Ltd.,35,31,9,9.64516,"Roofing, Roofing Contractor, Metal Roofing, Roofing Material, Roofing Shingles, Roofing Company, cedar roofing, roofing repair, roof repair, cedar shingles, shingles, roof repair, slate roofing, slate roofs, cedar shakes, roof, how to roof, about roofing, at roofing, the roofing, roofing roofing, a roofing, roof roof roofing, shingles, roofs, shingles for roof, roof shingles, shingles roof, roofing shingles, shingles roofing, metal roof, roof metal, metal roofing, roofing metal, steel roof, steel roofing, roof repair, roof and repair, roofers, roofer, roof tiles, roof tile, tile roof, roofing contractors, roofing companies, metal roofs, roof shingle, shingle roof, contractor roofing, roofing contractor, Roofing Contractor for New Shingles, roofing canada, roofing companies, canadian roofing contractors, roof builders, roofing installers, contractor roofing, roofing calgary, roofing ottawa, roofers calgary, roofing jobs, roofing barrie, best roofing material, vancouver, roofing contractors, roof contractors, roofing supply , home roofing, roofing ontario, roof ontario, commercial roofing, residential roofers, roofing builders, shingle roof contractor, residential roofing company, roof types, best roofing company, fiberglass shingles,  canadian roofing company, flat roofing, industrail roofing, types of roofing, roofing options, list roofing companies, shinglers, roofing estimates, elk shingles,  roofing reviews, asphalt shingles prices, metal sheet roofing, roofing systems, flat roofing companies, roofing and siding, roofers review, new roofing, slate roofing contractors, roof installers, vinyl roofing material, roof sheets, commercial roof repairs,Gutters & Eavestroughs, Eavestrough Cleaning, Eavestrough Installation, Eavestrough Maintenance, gutter cleaning, gutter installation, gutter maintenance, installing gutters, installing eavestroughs, Eavestrough Repair, ,Siding, vinyl siding, wood siding, exterior siding, aluminum siding, cedar shakes, cedar shingles, composite wood siding, seamless steel siding, wood clapboard, stone siding, brick siding, exterior, side, sides, how to siding, the siding, the other side, stucco,  how to vinyl siding, about vinyl siding, what is vinyl siding, in vinyl siding, vinyl siding how to, vinyl siding, siding vinyl, how to install vinyl, cement fiber, fiber cement, siding house, house with siding, siding on a house, what is siding on a house, siding for house, siding a house, how to siding a house, siding on house, house siding, siding for a house, ,",0,NA,FALSE,0,0,10,0,FALSE,650778dc993261d38d68643e3db1d0d6ae23f75f,TRUE,NA,TRUE,TRUE,2117961,87.0271970722,428,NA,NA,NA
https://homestars.com/on/rocky%20view%20county/roofing,47,"c(""https://homestars.com/on/rocky%20view%20county/roofing?&page=2&"", ""https://homestars.com/on/rocky%20view%20county/roofing?&page=3&"", ""https://homestars.com/on/rocky%20view%20county/roofing?&page=4&"", ""https://homestars.com/on/rocky%20view%20county/roofing?&page=5&"")",Roofing,2973297,,/companies/2973297-pro-master-roofing-ltd?searched_category_id=428&service_area=2292262,,pro-master-roofing-ltd,2022-09-20T13:47:54.000-04:00,NA,NA,NA,,,,,NA,NA,,,,,FALSE,FALSE,,,FALSE,FALSE,,2035208,Pro Master Roofing Ltd,5,4,17,10,"Roofing, Roofing Contractor, Metal Roofing, Roofing Material, Roofing Shingles, Roofing Company, cedar roofing, roofing repair, roof repair, cedar shingles, shingles, roof repair, slate roofing, slate roofs, cedar shakes, roof, how to roof, about roofing, at roofing, the roofing, roofing roofing, a roofing, roof roof roofing, shingles, roofs, shingles for roof, roof shingles, shingles roof, roofing shingles, shingles roofing, metal roof, roof metal, metal roofing, roofing metal, steel roof, steel roofing, roof repair, roof and repair, roofers, roofer, roof tiles, roof tile, tile roof, roofing contractors, roofing companies, metal roofs, roof shingle, shingle roof, contractor roofing, roofing contractor, Roofing Contractor for New Shingles, roofing canada, roofing companies, canadian roofing contractors, roof builders, roofing installers, contractor roofing, roofing calgary, roofing ottawa, roofers calgary, roofing jobs, roofing barrie, best roofing material, vancouver, roofing contractors, roof contractors, roofing supply , home roofing, roofing ontario, roof ontario, commercial roofing, residential roofers, roofing builders, shingle roof contractor, residential roofing company, roof types, best roofing company, fiberglass shingles,  canadian roofing company, flat roofing, industrail roofing, types of roofing, roofing options, list roofing companies, shinglers, roofing estimates, elk shingles,  roofing reviews, asphalt shingles prices, metal sheet roofing, roofing systems, flat roofing companies, roofing and siding, roofers review, new roofing, slate roofing contractors, roof installers, vinyl roofing material, roof sheets, commercial roof repairs,",0,,FALSE,0,0,19,0,FALSE,84b260b595afc9c85597b57e0b249f404c547ca4,TRUE,2022-11-07T05:02:41.000-05:00,TRUE,TRUE,2292262,90.4501965182,428,NA,NA,2022-09-20T13:48:42.000-04:00
https://homestars.com/on/rocky%20view%20county/roofing,47,"c(""https://homestars.com/on/rocky%20view%20county/roofing?&page=2&"", ""https://homestars.com/on/rocky%20view%20county/roofing?&page=3&"", ""https://homestars.com/on/rocky%20view%20county/roofing?&page=4&"", ""https://homestars.com/on/rocky%20view%20county/roofing?&page=5&"")",Roofing,2970910,http://yycalberta.com,/companies/2970910-yyc-siding-roofing?searched_category_id=428&service_area=2286728,"Your Home. Your Budget. Our Help.
Over the last year we have built a team that is dedicated to client care.  We go above and beyond to eliminate problems we have seen so many home owners face; storm chasers, sales people who see dollar signs, trades that do not show up, unfair estimates, poor installations--these are just to name a few.

With over 35 years of combined experience in exterior installations, we have the privilege of offering the culmination of our skillsets, knowledge, experience and just old-school hard work. The best part is offering genuine customer service --something I believe a lot of people are missing these days.

We proudly offer a Lifetime Workmanship Guarantee with all of our installations. It is a privilege to be trusted with a person's home and we stand behind everything we install, offering a team that is committed to taking care of your exteriors.  One thing we do not offer is buyer's remorse.  In taking the solution-oriented approach with all of our projects, we want our clients to work with us because of who we are and what we can provide -- not because of a sales pitch.  What we deliver is something you will not come across very often in this industry.

Whether you need a new roof, have an insurance claim or just need a bit of insight, we are here to help.",yyc-siding-roofing,2022-07-22T18:52:16.000-04:00,NA,NA,NA,"Cedar, Lux, James Hardie, Solar Vents, Vinyl, Steel Standing Seam, Building Envelope, Sheds, Pergolas.","Zero-Obligation Assessments and Estimates, Property Management, 3D Renderings, Insurance Claim Advocacy, Roofing Replacement, Siding Replacement, New Construction, Sheds, Repairs, Emergency 24/7/356.","Canada Go Green Solar Vents, KWP, James Hardie, Smartboard, Lux, AL-13, EZ-Trim, Mitten, Royal, Gentek, Kaycan, IKO, Owens Corning, Euroshield, Tyvek, Hal-Tex.",Boutique Builder.  Custom Exterior Renovation and Restoration,2006,10,Cheque or E-Transfer,,"Business License, 5 Million, WCB Insurance","Houzz, Home Stars, Bark",TRUE,FALSE,Home Owner Budget,300,TRUE,FALSE,Life Time Workmanship,2032821,YYC Siding & Roofing,4,3,78,10,"Siding, vinyl siding, wood siding, exterior siding, aluminum siding, cedar shakes, cedar shingles, composite wood siding, seamless steel siding, wood clapboard, stone siding, brick siding, exterior, side, sides, how to siding, the siding, the other side, stucco,  how to vinyl siding, about vinyl siding, what is vinyl siding, in vinyl siding, vinyl siding how to, vinyl siding, siding vinyl, how to install vinyl, cement fiber, fiber cement, siding house, house with siding, siding on a house, what is siding on a house, siding for house, siding a house, how to siding a house, siding on house, house siding, siding for a house, ,Roofing, Roofing Contractor, Metal Roofing, Roofing Material, Roofing Shingles, Roofing Company, cedar roofing, roofing repair, roof repair, cedar shingles, shingles, roof repair, slate roofing, slate roofs, cedar shakes, roof, how to roof, about roofing, at roofing, the roofing, roofing roofing, a roofing, roof roof roofing, shingles, roofs, shingles for roof, roof shingles, shingles roof, roofing shingles, shingles roofing, metal roof, roof metal, metal roofing, roofing metal, steel roof, steel roofing, roof repair, roof and repair, roofers, roofer, roof tiles, roof tile, tile roof, roofing contractors, roofing companies, metal roofs, roof shingle, shingle roof, contractor roofing, roofing contractor, Roofing Contractor for New Shingles, roofing canada, roofing companies, canadian roofing contractors, roof builders, roofing installers, contractor roofing, roofing calgary, roofing ottawa, roofers calgary, roofing jobs, roofing barrie, best roofing material, vancouver, roofing contractors, roof contractors, roofing supply , home roofing, roofing ontario, roof ontario, commercial roofing, residential roofers, roofing builders, shingle roof contractor, residential roofing company, roof types, best roofing company, fiberglass shingles,  canadian roofing company, flat roofing, industrail roofing, types of roofing, roofing options, list roofing companies, shinglers, roofing estimates, elk shingles,  roofing reviews, asphalt shingles prices, metal sheet roofing, roofing systems, flat roofing companies, roofing and siding, roofers review, new roofing, slate roofing contractors, roof installers, vinyl roofing material, roof sheets, commercial roof repairs,",0,,FALSE,0,1,80,0,FALSE,289668d77eb57f5f159d8c72e09abcfca07f2443,TRUE,NA,TRUE,TRUE,2286728,90.5217427337,428,NA,NA,2022-07-22T18:53:01.000-04:00
https://homestars.com/on/rocky%20view%20county/roofing,47,"c(""https://homestars.com/on/rocky%20view%20county/roofing?&page=2&"", ""https://homestars.com/on/rocky%20view%20county/roofing?&page=3&"", ""https://homestars.com/on/rocky%20view%20county/roofing?&page=4&"", ""https://homestars.com/on/rocky%20view%20county/roofing?&page=5&"")",Roofing,2970622,,/companies/2970622-kleo-construction-ltd?searched_category_id=428&service_area=2286070,"Welcome to Kleo Constructions LTD
Your Dream is our Passion
Join now our family and get a free quote!!",kleo-construction-ltd,2022-07-17T07:47:57.000-04:00,NA,NA,NA,,"Shingle Roofing
Shake removal
Attic repair
Flat Roofing","Owens Corning
IKO
BP Vanguard
Malarkey","Roofing
",2021,6,Cash Debit Check E-Transfer,,,,TRUE,TRUE,,8.000,TRUE,FALSE,,2032533,Kleo Construction Ltd,4,4,20,10,"Roofing, Roofing Contractor, Metal Roofing, Roofing Material, Roofing Shingles, Roofing Company, cedar roofing, roofing repair, roof repair, cedar shingles, shingles, roof repair, slate roofing, slate roofs, cedar shakes, roof, how to roof, about roofing, at roofing, the roofing, roofing roofing, a roofing, roof roof roofing, shingles, roofs, shingles for roof, roof shingles, shingles roof, roofing shingles, shingles roofing, metal roof, roof metal, metal roofing, roofing metal, steel roof, steel roofing, roof repair, roof and repair, roofers, roofer, roof tiles, roof tile, tile roof, roofing contractors, roofing companies, metal roofs, roof shingle, shingle roof, contractor roofing, roofing contractor, Roofing Contractor for New Shingles, roofing canada, roofing companies, canadian roofing contractors, roof builders, roofing installers, contractor roofing, roofing calgary, roofing ottawa, roofers calgary, roofing jobs, roofing barrie, best roofing material, vancouver, roofing contractors, roof contractors, roofing supply , home roofing, roofing ontario, roof ontario, commercial roofing, residential roofers, roofing builders, shingle roof contractor, residential roofing company, roof types, best roofing company, fiberglass shingles,  canadian roofing company, flat roofing, industrail roofing, types of roofing, roofing options, list roofing companies, shinglers, roofing estimates, elk shingles,  roofing reviews, asphalt shingles prices, metal sheet roofing, roofing systems, flat roofing companies, roofing and siding, roofers review, new roofing, slate roofing contractors, roof installers, vinyl roofing material, roof sheets, commercial roof repairs,",0,,FALSE,0,0,23,0,FALSE,02204019760298a675222c731ad3f2d117d1d92f,TRUE,NA,TRUE,TRUE,2286070,89.7681465702,428,NA,NA,2022-07-17T07:50:06.000-04:00
https://homestars.com/on/rocky%20view%20county/roofing,47,"c(""https://homestars.com/on/rocky%20view%20county/roofing?&page=2&"", ""https://homestars.com/on/rocky%20view%20county/roofing?&page=3&"", ""https://homestars.com/on/rocky%20view%20county/roofing?&page=4&"", ""https://homestars.com/on/rocky%20view%20county/roofing?&page=5&"")",Roofing,2968959,https://www.spaar.ca,/companies/2968959-spaar-inc?searched_category_id=428&service_area=2282291,"With 40+ years in the industry, we are experts at what we do. What began as a small family run business has expanded into fully integrated interior and exterior construction company, servicing all Western Canada.

At SPAAR, we simplify the building and renovation process by providing a full-service approach. By owning the building envelope, we schedule, manage and complete projects for our clients in a quick and effective timeframe.

Our extensive list of services provides a seamless process from insulation, drywall, interior painting & roofing, allowing our clients to sit back and relax while we complete the project. With over 1400+ projects a year, our expertise and proven process allows for high quality work and on-time execution.

We specialize in the following services:

SPAAR Colours - Interior/Exterior Painting, Cabinet Refinishing, Trim & Doors, stucco refinishing, siding painting
SPAAR Exteriors - Residential Roofing (Asphalt shingles, Cedar Shakes, Metal Roofing), fascia, soffits and eavestroughs
SPAAR Spray Systems - Attic insulation, Attic inspections, Interior & Exterior Spray Foam applications",spaar-inc,2022-06-03T17:13:49.000-04:00,NA,NA,NA,,"SPAAR Colours - Interior/Exterior Painting, Cabinet Refinishing, Trim & Doors, stucco repainting/repair, siding painting, deck and fence staining/painting
SPAAR Exteriors - Residential Roofing (Asphalt shingles, Cedar Shakes, Metal Roofing) Installation of attic vents, eavestrough, soffits, fascia
SPAAR Spray Systems - Attic insulation, Interior & Exterior Spray Foam applications",,"Spray Foam Insulation
Drywall & Taping
Painting
Roofing",1981,88,"Visa, Mastercard, Cheque, EFT",,COR Safety Certified,"Better Business Bureau - Calgary, BILD Alberta, BILD Calgary, CHBA- Calgary & Edmonton",TRUE,TRUE,,,TRUE,FALSE,10-year workmanship warranty,2030877,SPAAR Inc.,3,2,37,10,"Insulation, Home Insulation, Foam Insulation, Thermal Insulation, Fiberglass Insulation, cellulose insulation, insullation, celulose insulation, sprayfoam insulation, spray foam, what is insulation, insulating, insulated, insulate, insulator, save energy, insulators, foam insulation, insulation foam, foam spray, insulating foam, wall insulation, energy savers, radiant heat, sound insulation, spray in insulation, insulation spray in, insulation spray, spray on insulation, spray insulation, owenscorning, board insulation, insulation board, insulation home, insulation for the home, home insulation, loft insulation, foam insulation spray, insulation foam spray, spray insulation foam, spray on foam insulation, spray in foam insulation, insulation spray foam, spray foam insulation, foam spray insulation, insulation for attic, insulation in attic, attic insulation, insulation attic, insulating board, insulating foam spray, insulating spray foam, house insulation, insulation for house, insulation house, sprayfoam insulation, insulated panels, insulating home, soundproofing,Insulation, ,Paint & Wallpaper Contractors, Paint Colors, Paint Store, Paint Brush, Paint Shop, Home Wallpaper,Wallpaper, Paint colour advice, paint colour consultants, wallpapering, painter, faux, painters painting, painters paint, business painting, find painting, painting and restoration, new jersey painting, oh painting, local painting, wall paper repair, ,Roofing, Roofing Contractor, Metal Roofing, Roofing Material, Roofing Shingles, Roofing Company, cedar roofing, roofing repair, roof repair, cedar shingles, shingles, roof repair, slate roofing, slate roofs, cedar shakes, roof, how to roof, about roofing, at roofing, the roofing, roofing roofing, a roofing, roof roof roofing, shingles, roofs, shingles for roof, roof shingles, shingles roof, roofing shingles, shingles roofing, metal roof, roof metal, metal roofing, roofing metal, steel roof, steel roofing, roof repair, roof and repair, roofers, roofer, roof tiles, roof tile, tile roof, roofing contractors, roofing companies, metal roofs, roof shingle, shingle roof, contractor roofing, roofing contractor, Roofing Contractor for New Shingles, roofing canada, roofing companies, canadian roofing contractors, roof builders, roofing installers, contractor roofing, roofing calgary, roofing ottawa, roofers calgary, roofing jobs, roofing barrie, best roofing material, vancouver, roofing contractors, roof contractors, roofing supply , home roofing, roofing ontario, roof ontario, commercial roofing, residential roofers, roofing builders, shingle roof contractor, residential roofing company, roof types, best roofing company, fiberglass shingles,  canadian roofing company, flat roofing, industrail roofing, types of roofing, roofing options, list roofing companies, shinglers, roofing estimates, elk shingles,  roofing reviews, asphalt shingles prices, metal sheet roofing, roofing systems, flat roofing companies, roofing and siding, roofers review, new roofing, slate roofing contractors, roof installers, vinyl roofing material, roof sheets, commercial roof repairs,Drywall Contractors, Dry Wall Repair, Dry Wall Installation, dry wall contracting, gypsum repair, gypsum installation, gypsum contractors, gyprock installers, gyprock intallation, dry wall installers, sheetrock, wall board, drywall, drywaller, waller, wall repair, drywall, plaster, how to drywall, drywall, what is drywall, sheetrock, dry wall, plastering, wall repair, drywall repair, how to repair drywall, repair drywall,  ,",0,,FALSE,0,0,38,0,FALSE,d744546a81b651b9e17080bc628f42c1dd3f8b0a,TRUE,2022-10-03T16:00:38.000-04:00,TRUE,TRUE,2282291,89.7290482305,428,NA,NA,2022-06-03T17:14:21.000-04:00
