Link,n_hits,all_links,category,id,url,hs_path,profile,permalink,created_at,sic_code,service_area,hours,products,services,brands,specialities,established,employee_cnt,payment_method,diplomas,licenses,memberships,liability_insurance,bonded,project_rate,project_minimum,written_contract,written_warranty,warranty_terms,parent_company_id,name,total_number_of_reviews_cache,total_number_of_approved_reviews_cache,number_of_photos_cache,avg_rating_cache,categories_info_cache,savings_count,subdomain,fraudulent,fraudulent_count,total_number_of_pending_reviews_cache,images_count,completion_percent_cache,bully,secret,replied_to_at_least_one_review_cache,latest_approved_review_created_at,has_set_tasks,lead_purchase_eligible,service_area_id,star_score,quote_button_category,direct_phone,direct_contact,claimed_at
https://homestars.com/on/east-york/sprinkler-systems,57,"c(""https://homestars.com/on/east-york/sprinkler-systems?&page=2&"", ""https://homestars.com/on/east-york/sprinkler-systems?&page=3&"", ""https://homestars.com/on/east-york/sprinkler-systems?&page=4&"", ""https://homestars.com/on/east-york/sprinkler-systems?&page=5&"", ""https://homestars.com/on/east-york/sprinkler-systems?&page=6&"")",Sprinkler Systems,2885810,NA,/companies/2885810-ecosprings-irrigation?searched_category_id=436&service_area=2090029,NA,ecosprings-irrigation,2016-03-29T16:22:34.000-04:00,NA,NA,NA,NA,NA,NA,NA,NA,NA,NA,NA,NA,NA,FALSE,FALSE,NA,NA,FALSE,FALSE,NA,1948234,Ecosprings Irrigation,0,0,0,NA,"Sprinkler Systems, Fire Sprinkler, Lawn Sprinkler, Garden Sprinkler, underground sprinklers, underground irrigation, irrigation systems, automatic sprinkler systems, what is irrigation, irrigation, sprinkler, sprinklers, irrigation sprinkler, sprinkler irrigation, the irrigation system, irrigation system, irrigation sprinklers, irrigation systems,  systems irrigation, how to sprinkler system, the sprinkler system, what is a sprinkler system, sprinkler system, bird rain, water irrigation, sprinkler systems how to, watering system, ,",0,NA,FALSE,0,0,0,0,FALSE,b2f044e6177280f058792bea20d21e9ee0ba1976,FALSE,NA,TRUE,FALSE,2090029,-1.0,436,NA,NA,NA
https://homestars.com/on/east-york/sprinkler-systems,57,"c(""https://homestars.com/on/east-york/sprinkler-systems?&page=2&"", ""https://homestars.com/on/east-york/sprinkler-systems?&page=3&"", ""https://homestars.com/on/east-york/sprinkler-systems?&page=4&"", ""https://homestars.com/on/east-york/sprinkler-systems?&page=5&"", ""https://homestars.com/on/east-york/sprinkler-systems?&page=6&"")",Sprinkler Systems,2879518,http://www.ecosprings.ca/,/companies/2879518-eco-springs-irrigation?searched_category_id=436&service_area=2066056,"We specialize in underground lawn sprinkler systems, installation and service. We install and service all brands of irrigation products to suit your needs and are specialists in repairs and retrofits of existing systems.

As irrigation specialists we also work with landscape designers and Green Roof companies.

We can design and install the perfect sprinkler system utilizing the very latest technology that will not only keep your garden beautiful, healthy and green, but also help you to conserve water and save money.

We always provide you with courteous, knowledgable and prompt service.

With over 13 years in the industry, our President is an expert in the field and has taught irrigation design and maintenance at Humber College for the past four years. Needless to say, our staff obtain the most cutting edge training to install the most up-to-date irrigation products.

Eco Springs Irrigation is a certified irrigation contractor through the Irrigation Association and a Certified Irrigation Technician through Landscape Ontario.",eco-springs-irrigation,2015-11-18T15:12:29.000-05:00,NA,NA,NA,NA,NA,NA,NA,NA,NA,NA,NA,NA,NA,FALSE,FALSE,NA,NA,FALSE,FALSE,NA,1941942,Eco Springs Irrigation,0,0,1,NA,"Sprinkler Systems, Fire Sprinkler, Lawn Sprinkler, Garden Sprinkler, underground sprinklers, underground irrigation, irrigation systems, automatic sprinkler systems, what is irrigation, irrigation, sprinkler, sprinklers, irrigation sprinkler, sprinkler irrigation, the irrigation system, irrigation system, irrigation sprinklers, irrigation systems,  systems irrigation, how to sprinkler system, the sprinkler system, what is a sprinkler system, sprinkler system, bird rain, water irrigation, sprinkler systems how to, watering system, ,",0,NA,FALSE,0,0,2,0,FALSE,172ddd5ecc50bdc5d79f14ecf31137ac4903ebf8,FALSE,NA,TRUE,FALSE,2066056,-1.0,436,NA,NA,2017-10-26T17:16:43.000-04:00
https://homestars.com/on/east-york/sprinkler-systems,57,"c(""https://homestars.com/on/east-york/sprinkler-systems?&page=2&"", ""https://homestars.com/on/east-york/sprinkler-systems?&page=3&"", ""https://homestars.com/on/east-york/sprinkler-systems?&page=4&"", ""https://homestars.com/on/east-york/sprinkler-systems?&page=5&"", ""https://homestars.com/on/east-york/sprinkler-systems?&page=6&"")",Sprinkler Systems,2968279,NA,/companies/2968279-robert-kitchen?searched_category_id=436&service_area=2280736,NA,robert-kitchen,2022-05-16T12:38:40.000-04:00,NA,NA,NA,NA,NA,NA,NA,NA,NA,NA,NA,NA,NA,FALSE,FALSE,NA,NA,FALSE,FALSE,NA,2030197,Robert Kitchen,0,0,0,NA,"Sprinkler Systems, Fire Sprinkler, Lawn Sprinkler, Garden Sprinkler, underground sprinklers, underground irrigation, irrigation systems, automatic sprinkler systems, what is irrigation, irrigation, sprinkler, sprinklers, irrigation sprinkler, sprinkler irrigation, the irrigation system, irrigation system, irrigation sprinklers, irrigation systems,  systems irrigation, how to sprinkler system, the sprinkler system, what is a sprinkler system, sprinkler system, bird rain, water irrigation, sprinkler systems how to, watering system, ,",0,NA,FALSE,0,0,0,0,FALSE,f72898d7af2a96d7dd2acb562c94d2926f3c0977,FALSE,NA,FALSE,FALSE,2280736,-1.0,436,NA,NA,2022-05-16T12:39:28.000-04:00
https://homestars.com/on/east-york/sprinkler-systems,57,"c(""https://homestars.com/on/east-york/sprinkler-systems?&page=2&"", ""https://homestars.com/on/east-york/sprinkler-systems?&page=3&"", ""https://homestars.com/on/east-york/sprinkler-systems?&page=4&"", ""https://homestars.com/on/east-york/sprinkler-systems?&page=5&"", ""https://homestars.com/on/east-york/sprinkler-systems?&page=6&"")",Sprinkler Systems,2962619,NA,/companies/2962619-aaaa-irrigation-lawn-sprinklers?searched_category_id=436&service_area=2267810,NA,aaaa-irrigation-lawn-sprinklers,2021-12-18T16:53:52.000-05:00,NA,NA,NA,NA,NA,NA,NA,NA,NA,NA,NA,NA,NA,FALSE,FALSE,NA,NA,FALSE,FALSE,NA,2024575,AAAA Irrigation & Lawn Sprinklers,0,0,0,NA,"Sprinkler Systems, Fire Sprinkler, Lawn Sprinkler, Garden Sprinkler, underground sprinklers, underground irrigation, irrigation systems, automatic sprinkler systems, what is irrigation, irrigation, sprinkler, sprinklers, irrigation sprinkler, sprinkler irrigation, the irrigation system, irrigation system, irrigation sprinklers, irrigation systems,  systems irrigation, how to sprinkler system, the sprinkler system, what is a sprinkler system, sprinkler system, bird rain, water irrigation, sprinkler systems how to, watering system, ,",0,NA,FALSE,0,0,0,0,FALSE,1040eee1d7d42e50505bd94ec9ff662374365785,FALSE,NA,FALSE,FALSE,2267810,-1.0,436,NA,NA,2021-12-18T16:54:46.000-05:00
https://homestars.com/on/east-york/sprinkler-systems,57,"c(""https://homestars.com/on/east-york/sprinkler-systems?&page=2&"", ""https://homestars.com/on/east-york/sprinkler-systems?&page=3&"", ""https://homestars.com/on/east-york/sprinkler-systems?&page=4&"", ""https://homestars.com/on/east-york/sprinkler-systems?&page=5&"", ""https://homestars.com/on/east-york/sprinkler-systems?&page=6&"")",Sprinkler Systems,2968507,NA,/companies/2968507-macao?searched_category_id=436&service_area=2281275,NA,macao,2022-05-23T06:57:00.000-04:00,NA,NA,NA,NA,NA,NA,NA,NA,NA,NA,NA,NA,NA,FALSE,FALSE,NA,NA,FALSE,FALSE,NA,2030425,MACAO,0,0,3,NA,"Sprinkler Systems, Fire Sprinkler, Lawn Sprinkler, Garden Sprinkler, underground sprinklers, underground irrigation, irrigation systems, automatic sprinkler systems, what is irrigation, irrigation, sprinkler, sprinklers, irrigation sprinkler, sprinkler irrigation, the irrigation system, irrigation system, irrigation sprinklers, irrigation systems,  systems irrigation, how to sprinkler system, the sprinkler system, what is a sprinkler system, sprinkler system, bird rain, water irrigation, sprinkler systems how to, watering system, ,",0,NA,FALSE,0,0,5,0,FALSE,eb71830d15e36819d92a98db09fba3e55c3ca29a,FALSE,NA,FALSE,FALSE,2281275,-1.0,436,NA,NA,2022-05-23T06:59:29.000-04:00
https://homestars.com/on/east-york/sprinkler-systems,57,"c(""https://homestars.com/on/east-york/sprinkler-systems?&page=2&"", ""https://homestars.com/on/east-york/sprinkler-systems?&page=3&"", ""https://homestars.com/on/east-york/sprinkler-systems?&page=4&"", ""https://homestars.com/on/east-york/sprinkler-systems?&page=5&"", ""https://homestars.com/on/east-york/sprinkler-systems?&page=6&"")",Sprinkler Systems,2875894,NA,/companies/2875894-kolbipol-irrigation-inc?searched_category_id=436&service_area=2052129,"KOLBIPOL IRRIGATION == 416-526-6447 == 

Our team members are trained through the Rain Bird Training Academy to ensure industry’s best practices and standards. We are commited to provide a high quality and water efficient irrigation services to our customers at reasonable price. 

Kolbipol Irrigation offers complete design, installation and maintenance for any size lawn. 

We offer variety of services such as: 
- Irrigation design and installation 
- Modification to existing sprinkler system and zones 
- Sprinkler repair and service 
- Spring start-up 
- Fall Winterization 
- Mid-season check-ups 

CALL US FOR A FREE QUOTE TODAY == 416-526-6447 === 

KOLBIPOL IRRIGATION 
phone: 416-526-6447 
email: info@kolbipol.com 
website: www.kolbipol.com",kolbipol-irrigation-inc,2015-09-07T13:24:21.000-04:00,NA,NA,NA,NA,NA,NA,NA,NA,NA,NA,NA,NA,NA,FALSE,FALSE,NA,NA,FALSE,FALSE,NA,1938318,Kolbipol Irrigation Inc.,0,0,0,NA,"Sprinkler Systems, Fire Sprinkler, Lawn Sprinkler, Garden Sprinkler, underground sprinklers, underground irrigation, irrigation systems, automatic sprinkler systems, what is irrigation, irrigation, sprinkler, sprinklers, irrigation sprinkler, sprinkler irrigation, the irrigation system, irrigation system, irrigation sprinklers, irrigation systems,  systems irrigation, how to sprinkler system, the sprinkler system, what is a sprinkler system, sprinkler system, bird rain, water irrigation, sprinkler systems how to, watering system, ,",0,NA,FALSE,0,0,0,0,FALSE,da381dd9154b915680638d0fa868de48fd68dca4,FALSE,NA,FALSE,FALSE,2052129,-1.0,436,NA,NA,NA
https://homestars.com/on/east-york/sprinkler-systems,57,"c(""https://homestars.com/on/east-york/sprinkler-systems?&page=2&"", ""https://homestars.com/on/east-york/sprinkler-systems?&page=3&"", ""https://homestars.com/on/east-york/sprinkler-systems?&page=4&"", ""https://homestars.com/on/east-york/sprinkler-systems?&page=5&"", ""https://homestars.com/on/east-york/sprinkler-systems?&page=6&"")",Sprinkler Systems,208220,http://www.globalgreen.ca,/companies/208220-global-green?searched_category_id=436&service_area=1817187,"Sprinkler system design, service and installation, landscape lighting.",global-green,2006-07-05T20:00:00.000-04:00,NA,,,,,,,0,0,,,,,FALSE,FALSE,,,FALSE,FALSE,,62860,Global Green,3,3,0,9.41667,"Sprinkler Systems, Fire Sprinkler, Lawn Sprinkler, Garden Sprinkler, underground sprinklers, underground irrigation, irrigation systems, automatic sprinkler systems, what is irrigation, irrigation, sprinkler, sprinklers, irrigation sprinkler, sprinkler irrigation, the irrigation system, irrigation system, irrigation sprinklers, irrigation systems,  systems irrigation, how to sprinkler system, the sprinkler system, what is a sprinkler system, sprinkler system, bird rain, water irrigation, sprinkler systems how to, watering system, ,",0,NA,FALSE,0,0,0,NA,FALSE,NA,FALSE,2007-04-22T20:00:00.000-04:00,FALSE,FALSE,1817187,85.4024978848,436,NA,NA,NA
https://homestars.com/on/east-york/sprinkler-systems,57,"c(""https://homestars.com/on/east-york/sprinkler-systems?&page=2&"", ""https://homestars.com/on/east-york/sprinkler-systems?&page=3&"", ""https://homestars.com/on/east-york/sprinkler-systems?&page=4&"", ""https://homestars.com/on/east-york/sprinkler-systems?&page=5&"", ""https://homestars.com/on/east-york/sprinkler-systems?&page=6&"")",Sprinkler Systems,2622142,NA,/companies/2622142-garden-irrigation-ltd?searched_category_id=436&service_area=1635346,NA,garden-irrigation-ltd,2008-03-04T16:55:15.000-05:00,NA,NA,NA,NA,NA,NA,NA,NA,NA,NA,NA,NA,NA,FALSE,FALSE,NA,NA,FALSE,FALSE,NA,1685194,Garden Irrigation Ltd,2,2,0,10,"Sprinkler Systems, Fire Sprinkler, Lawn Sprinkler, Garden Sprinkler, underground sprinklers, underground irrigation, irrigation systems, automatic sprinkler systems, what is irrigation, irrigation, sprinkler, sprinklers, irrigation sprinkler, sprinkler irrigation, the irrigation system, irrigation system, irrigation sprinklers, irrigation systems,  systems irrigation, how to sprinkler system, the sprinkler system, what is a sprinkler system, sprinkler system, bird rain, water irrigation, sprinkler systems how to, watering system, ,",0,NA,FALSE,0,0,0,NA,FALSE,NA,FALSE,2014-07-22T14:57:53.000-04:00,FALSE,FALSE,1635346,83.0082417582,436,NA,NA,NA
https://homestars.com/on/east-york/sprinkler-systems,57,"c(""https://homestars.com/on/east-york/sprinkler-systems?&page=2&"", ""https://homestars.com/on/east-york/sprinkler-systems?&page=3&"", ""https://homestars.com/on/east-york/sprinkler-systems?&page=4&"", ""https://homestars.com/on/east-york/sprinkler-systems?&page=5&"", ""https://homestars.com/on/east-york/sprinkler-systems?&page=6&"")",Sprinkler Systems,2813919,NA,/companies/2813919-harrison-sprinklers?searched_category_id=436&service_area=1889168,NA,harrison-sprinklers,2013-08-26T14:45:02.000-04:00,NA,NA,NA,NA,NA,NA,NA,NA,NA,NA,NA,NA,NA,FALSE,FALSE,NA,NA,FALSE,FALSE,NA,1876864,Harrison Sprinklers ,3,3,0,10,"Sprinkler Systems, Fire Sprinkler, Lawn Sprinkler, Garden Sprinkler, underground sprinklers, underground irrigation, irrigation systems, automatic sprinkler systems, what is irrigation, irrigation, sprinkler, sprinklers, irrigation sprinkler, sprinkler irrigation, the irrigation system, irrigation system, irrigation sprinklers, irrigation systems,  systems irrigation, how to sprinkler system, the sprinkler system, what is a sprinkler system, sprinkler system, bird rain, water irrigation, sprinkler systems how to, watering system, ,",0,NA,FALSE,0,0,0,0,FALSE,NA,FALSE,2015-05-26T09:26:54.000-04:00,FALSE,FALSE,1889168,70.0,436,NA,NA,NA
https://homestars.com/on/east-york/sprinkler-systems,57,"c(""https://homestars.com/on/east-york/sprinkler-systems?&page=2&"", ""https://homestars.com/on/east-york/sprinkler-systems?&page=3&"", ""https://homestars.com/on/east-york/sprinkler-systems?&page=4&"", ""https://homestars.com/on/east-york/sprinkler-systems?&page=5&"", ""https://homestars.com/on/east-york/sprinkler-systems?&page=6&"")",Sprinkler Systems,2757982,NA,/companies/2757982-precise-rain?searched_category_id=436&service_area=1771186,NA,precise-rain,2008-03-04T16:55:15.000-05:00,NA,NA,NA,NA,NA,NA,NA,NA,NA,NA,NA,NA,NA,FALSE,FALSE,NA,NA,FALSE,FALSE,NA,1821034,Precise Rain,5,5,0,10,"Sprinkler Systems, Fire Sprinkler, Lawn Sprinkler, Garden Sprinkler, underground sprinklers, underground irrigation, irrigation systems, automatic sprinkler systems, what is irrigation, irrigation, sprinkler, sprinklers, irrigation sprinkler, sprinkler irrigation, the irrigation system, irrigation system, irrigation sprinklers, irrigation systems,  systems irrigation, how to sprinkler system, the sprinkler system, what is a sprinkler system, sprinkler system, bird rain, water irrigation, sprinkler systems how to, watering system, ,",0,NA,FALSE,0,0,0,NA,FALSE,NA,FALSE,2012-11-06T20:32:43.000-05:00,FALSE,FALSE,1771186,39.6291208791,436,NA,NA,NA
https://homestars.com/on/east-york/sprinkler-systems,57,"c(""https://homestars.com/on/east-york/sprinkler-systems?&page=2&"", ""https://homestars.com/on/east-york/sprinkler-systems?&page=3&"", ""https://homestars.com/on/east-york/sprinkler-systems?&page=4&"", ""https://homestars.com/on/east-york/sprinkler-systems?&page=5&"", ""https://homestars.com/on/east-york/sprinkler-systems?&page=6&"")",Sprinkler Systems,2758146,NA,/companies/2758146-aviv-irrigation-systems?searched_category_id=436&service_area=1771350,NA,aviv-irrigation-systems,2008-03-04T16:55:15.000-05:00,NA,NA,NA,NA,NA,NA,NA,NA,NA,NA,NA,NA,NA,FALSE,FALSE,NA,NA,FALSE,FALSE,NA,1821198,Aviv Irrigation Systems,1,1,0,10,"Sprinkler Systems, Fire Sprinkler, Lawn Sprinkler, Garden Sprinkler, underground sprinklers, underground irrigation, irrigation systems, automatic sprinkler systems, what is irrigation, irrigation, sprinkler, sprinklers, irrigation sprinkler, sprinkler irrigation, the irrigation system, irrigation system, irrigation sprinklers, irrigation systems,  systems irrigation, how to sprinkler system, the sprinkler system, what is a sprinkler system, sprinkler system, bird rain, water irrigation, sprinkler systems how to, watering system, ,",0,NA,FALSE,0,0,0,NA,FALSE,NA,FALSE,NA,FALSE,FALSE,1771350,73.956043956,436,NA,NA,NA
