Link,n_hits,all_links,category,id,url,hs_path,profile,permalink,created_at,sic_code,service_area,hours,products,services,brands,specialities,established,employee_cnt,payment_method,diplomas,licenses,memberships,liability_insurance,bonded,project_rate,project_minimum,written_contract,written_warranty,warranty_terms,parent_company_id,name,total_number_of_reviews_cache,total_number_of_approved_reviews_cache,number_of_photos_cache,avg_rating_cache,categories_info_cache,savings_count,claimed_at,subdomain,fraudulent,fraudulent_count,total_number_of_pending_reviews_cache,images_count,completion_percent_cache,bully,secret,replied_to_at_least_one_review_cache,latest_approved_review_created_at,has_set_tasks,lead_purchase_eligible,service_area_id,star_score,quote_button_category,direct_phone,direct_contact
https://homestars.com/on/schomberg/tile-stone-contractors,24,"c(""https://homestars.com/on/schomberg/tile-stone-contractors?&page=2&"", ""https://homestars.com/on/schomberg/tile-stone-contractors?&page=3&"")",Tile & Stone Contractors,2962060,,/companies/2962060-tile-proactive?searched_category_id=442&service_area=2266523,"Tile proactive was established in 2001 in Turkey, we took part in large scale contracts such as universities, hospitals and government contracts, this gives us a competitive edge as we have foreign experience. Tile Proactive expanded into North America in 2016. Since then we have been part of a significant number of commercial and residential contracts here in Canada. ",tile-proactive,2021-11-26T15:56:00.000-05:00,NA,NA,NA,"Our products are supplied by squarefootflooring, we invite you to check out their website via this link: https://squarefootflooring.com","We do all types of tile work, Commercial and Residential at a Professional standard. These include but are not limited to Bathrooms, backsplashes, kitchens, Floors, Bathrooms, Fireplaces, Stone wall, Stairs.",,,2016,4,"Cash, cheque, PayPal, Interac",,Fully insured and licensed,,TRUE,FALSE,,,TRUE,FALSE,Satisfaction Guaranteed,2024019,Tile Proactive,12,9,351,10,"Tile & Stone Contractors, Natural Stone Tile, Stone Floor Tile, Ceramic Tile, Floor tile, Tile installers, Stone installers, stone counter top installers, tile counter top installers, stone backsplash intallers, granite installers, marble installers, limestone installers, linoleum installers, slate contractors, slate installers,install tite ,backsplash , fire place veenerneed someone to install blacksplash , wall stone veener bath room mosaic,",0,2021-11-26T15:57:19.000-05:00,tileproactive,FALSE,0,0,392,0,FALSE,5dc4cb84c7c0f995f4e457dd928c0c595887de6d,TRUE,2022-02-22T08:42:36.000-05:00,TRUE,TRUE,2266523,89.5416148214,442,NA,NA
https://homestars.com/on/schomberg/tile-stone-contractors,24,"c(""https://homestars.com/on/schomberg/tile-stone-contractors?&page=2&"", ""https://homestars.com/on/schomberg/tile-stone-contractors?&page=3&"")",Tile & Stone Contractors,2931375,https://www.wallsineden.com/,/companies/2931375-walls-in-eden?searched_category_id=442&service_area=2199126,"Our mandate is to capture and display the significant changes that we are capable of making in our homes.
Our homes present an opportunity for us to express a thought or creative idea in a tangible way.
Any practical and functional wall can be transformed into a feature wall by using stone veneer.
We take pleasure in displaying the natural beauty of stone, inside the walls of our homes, to create beautiful walls.",walls-in-eden,2019-05-23T21:46:03.000-04:00,NA,NA,NA,,,,,NA,NA,"Cash, Cheque, Etransfer",,,,FALSE,FALSE,,,TRUE,FALSE,,1993549,Walls in Eden,22,20,22,10,"Tile & Stone Contractors, Natural Stone Tile, Stone Floor Tile, Ceramic Tile, Floor tile, Tile installers, Stone installers, stone counter top installers, tile counter top installers, stone backsplash intallers, granite installers, marble installers, limestone installers, linoleum installers, slate contractors, slate installers,install tite ,backsplash , fire place veenerneed someone to install blacksplash , wall stone veener bath room mosaic,",0,2019-05-23T22:03:07.000-04:00,wallsineden,FALSE,0,0,29,0,FALSE,7eb5d1a4fb378623085513094c0b5465894937c8,TRUE,2022-09-28T11:14:44.000-04:00,TRUE,TRUE,2199126,98.9510778501,442,NA,NA
https://homestars.com/on/schomberg/tile-stone-contractors,24,"c(""https://homestars.com/on/schomberg/tile-stone-contractors?&page=2&"", ""https://homestars.com/on/schomberg/tile-stone-contractors?&page=3&"")",Tile & Stone Contractors,2945312,http://www.agcontractorsgroup.com,/companies/2945312-agcg-canada-ltd?searched_category_id=442&service_area=2272081,,agcg-canada-ltd,2020-07-07T11:38:48.000-04:00,NA,NA,NA,,,,,NA,NA,,,,,TRUE,FALSE,,,FALSE,FALSE,,2007449,AGCG Canada LTD,13,11,112,10,"Basement Renovation, Basement renovation, Basement remodeling, Basement remodelling, renovating your basement, renovation, waterproofing, remodeling, home renovation, house renovation, water in basement, basement waterproofing,finishing basement, moistureproof, remodeling the house, caulking,Bathroom Renovation, Bathroom renovation, bathroom remodeling, bathroom remodelling, renovating the bathroom, tearing out the bathroom, fixing up the bathroom, bathroom contractors, bathroom vanities, bathroom vanity, design of bathroom, bathroom and design, design for bathroom, design a bathroom, design a bath, bath design, bathroom tile, bathroom cabinets, remodeling a bathroom, bathroom remodeling, remodeling the bathroom, ,Bath renovation, New tub, caulking, ,Interlocking Stone, Interlocking Tile, Stone, tiles for, landscaping, paving, pavers, paver, stone step, wall stone, stone wall, landscape design, patios, interlock, retaining wall, stepping stones, interlocking, landscaping ideas, retaining walls, paving stones, paver stones, pavers stones, pavers and stones, stones pavers, stones and pavers, flagstone, concrete design, landscapers, natural stone, paving stone, stone paving, stone paving stone, walls stone, patio designs, stone and tiles, tiles and stone, stone flagstones, slate tiles, slate tile, stone veneer, pavers stone, stone and pavers, stone pavers, paver stone, stone paver, concrete driveway, stone brick, stone and brick, brick and stone, stone flooring, stone patio, stone for patio,,Tile & Stone Contractors, Natural Stone Tile, Stone Floor Tile, Ceramic Tile, Floor tile, Tile installers, Stone installers, stone counter top installers, tile counter top installers, stone backsplash intallers, granite installers, marble installers, limestone installers, linoleum installers, slate contractors, slate installers,install tite ,backsplash , fire place veenerneed someone to install blacksplash , wall stone veener bath room mosaic,",0,2020-07-07T11:40:43.000-04:00,,FALSE,0,0,111,0,FALSE,2f38c89f25722956bc8511f36eebbae8a7f57b4f,TRUE,2022-02-13T17:36:14.000-05:00,TRUE,TRUE,2272081,98.7843702477,442,NA,NA
https://homestars.com/on/schomberg/tile-stone-contractors,24,"c(""https://homestars.com/on/schomberg/tile-stone-contractors?&page=2&"", ""https://homestars.com/on/schomberg/tile-stone-contractors?&page=3&"")",Tile & Stone Contractors,2938917,https://www.landschaft.ca,/companies/2938917-landschaft-construction-ltd?searched_category_id=442&service_area=2276390,"Landschaft is a Toronto-based company with one goal in mind – to provide a high-level unique landscape services at an affordable price.
 
We cover all aspects of your outdoor space:
- Interlocking
- Concrete Paving
- Retaining walls
- Landscaping
- Wood/composite decks
 
We design and build low impact and low maintenance landscapes in GTA. With Landschaft services you will spend less time taking care of your yard and more time enjoying it.
 
Our company has grown its reputation as innovative and responsible team that is always ensure needs of our clients and provide excellent services.
 
Landschaft is a company built on a solid construction knowledge and experience over the years
 
Landscaping is what we are good at!",landschaft-construction-ltd,2020-01-13T11:22:26.000-05:00,NA,NA,NA,"Unit Pavers, granite, flagstone, precast wall blocks, asphalt, concrete, granular, planting soil, topsoil, Interlock, tree, shrubs, perennials, sodding, seeding, pressure treated, cedar, ipe, composite","Unit paving - precast concrete Interlock, granite, limestone, flagstone paving
Cast in Place concrete paving - with all types of finishes and colours
Retaining walls - precast block, cast in place concrete reinforced walls, seatwalls, planter walls/curbs
Wood Work - decks, pergolas, gazebo, fencing
Soft landscaping - trees, shrubs, grasses planting, sodding, seeding
Landscaping Design, 3D Models","Unilock, Techo Bloc, Oaks, Permacon, CBM, Dufferin, Lafarge",,2019,20,"Cash, PayPal, Credit Card, Cheque, Etransfer",,,,TRUE,FALSE,,,TRUE,FALSE,1 year warranty,2001091,Landschaft Construction Ltd.,9,9,102,9.88889,"Interlocking Stone, Interlocking Tile, Stone, tiles for, landscaping, paving, pavers, paver, stone step, wall stone, stone wall, landscape design, patios, interlock, retaining wall, stepping stones, interlocking, landscaping ideas, retaining walls, paving stones, paver stones, pavers stones, pavers and stones, stones pavers, stones and pavers, flagstone, concrete design, landscapers, natural stone, paving stone, stone paving, stone paving stone, walls stone, patio designs, stone and tiles, tiles and stone, stone flagstones, slate tiles, slate tile, stone veneer, pavers stone, stone and pavers, stone pavers, paver stone, stone paver, concrete driveway, stone brick, stone and brick, brick and stone, stone flooring, stone patio, stone for patio,,Landscape Contractors & Designers, Landscape Contractor Designer, Landscape Design, Landscape Contractor, Landscapers, Landscaping, Landscape, Backyard, patio, Fountain, Ponds and Waterfalls, garden, gardens, landscape, how to landscape, landscaping and, landscape garden, garden landscape, gardening, landscape gardens, pavers, garden design, design a garden, design for garden, design garden, how to design garden, lawn maintenance, how to design landscape, design landscape, landscape and design, design and landscape, how to design a landscape, landscape design, design a landscape, patios, architects landscape, landscape architects, garden designs, lawn service, garden landscaping, landscaping garden, landscape lighting, garden designer, designer garden,,landscapemakeover of backyard and improve front yard
build fence, landscape, Landscaping, retaining wall, grading,Masonry & Bricklaying, Masonry Supply, Masonry Contractor, Stone Masonry, Brick Laying, Technique, Brick Laying Pattern, stone wall, brick wall, masonry repair, brick repairs, masonry, brick masonry, masonry bricklaying, masonry work, mason contractors, york masonry, masonry companies, brick masonry construction, brick contractors, masonry brick laying, masonry workers, bricklaying firms, parging, ,Tile & Stone Contractors, Natural Stone Tile, Stone Floor Tile, Ceramic Tile, Floor tile, Tile installers, Stone installers, stone counter top installers, tile counter top installers, stone backsplash intallers, granite installers, marble installers, limestone installers, linoleum installers, slate contractors, slate installers,install tite ,backsplash , fire place veenerneed someone to install blacksplash , wall stone veener bath room mosaic,",0,2020-01-13T11:22:50.000-05:00,landschaft,FALSE,0,0,119,0,FALSE,23686dd8529f98241db71930de7c14172551924b,TRUE,2022-05-03T20:53:25.000-04:00,TRUE,TRUE,2276390,87.7088347064,442,NA,NA
https://homestars.com/on/schomberg/tile-stone-contractors,24,"c(""https://homestars.com/on/schomberg/tile-stone-contractors?&page=2&"", ""https://homestars.com/on/schomberg/tile-stone-contractors?&page=3&"")",Tile & Stone Contractors,2961522,,/companies/2961522-mak-tile-stone-inc?searched_category_id=442&service_area=2265435,"Hello! I've been in the construction business for over 20 years. My specialiaty is in large format tiles.
Bathroom and fireplace is my favourite.
I also have special tools to cut and install slabs.
The slabs sizes usually comes over 8 feet by 4 feet, 10 feet by 5 feet, which you have to have special tools to cut and also install.
I don't just install tiles or stones, I also prepare the job before installation and demolition of old materials.
Before tiling we do drypack in the bathroom and also put Derta on the floor where the plywoods are.
So besides tiling we provide drypack, Detra, waterproofing (which is important for steam showers).
I can go to any area for business from Downtown Toronto all the way to Collingwood and from Mississauga all the way to Port Perry or end East.

Give 416-400-6061 a call today. I look forward to hearing from you!",mak-tile-stone-inc,2021-11-08T16:03:41.000-05:00,NA,NA,NA,,,,,NA,NA,"Cheque, Cash, E-Transfer",,,,FALSE,FALSE,,,FALSE,FALSE,Yes. Please Inquire,2023492,Mak Tile&Stone Inc.,8,7,53,9.85714,"Tile & Stone Contractors, Natural Stone Tile, Stone Floor Tile, Ceramic Tile, Floor tile, Tile installers, Stone installers, stone counter top installers, tile counter top installers, stone backsplash intallers, granite installers, marble installers, limestone installers, linoleum installers, slate contractors, slate installers,install tite ,backsplash , fire place veenerneed someone to install blacksplash , wall stone veener bath room mosaic,",0,2021-11-08T16:05:14.000-05:00,maktileandstone,FALSE,0,0,65,0,FALSE,c67e480f604c31a4628715807bdce3bd5a50ae73,TRUE,2022-11-13T00:38:01.000-05:00,TRUE,TRUE,2265435,89.887166329,442,NA,NA
https://homestars.com/on/schomberg/tile-stone-contractors,24,"c(""https://homestars.com/on/schomberg/tile-stone-contractors?&page=2&"", ""https://homestars.com/on/schomberg/tile-stone-contractors?&page=3&"")",Tile & Stone Contractors,2789966,http://www.mirandatile.ca,/companies/2789966-miranda-tile?searched_category_id=442&service_area=1849014,"Miranda Tile is a family owned and operated company located in Holland Landing, Ontario.

We specialize in bathrooms, floors and any project that requires porcelain or stone tiles. At Miranda Tile, our goal is to provide quality workmanship, on time and provide the best customer service to our York Region customers.

Quality and Customer Service does not happen by accident. It takes commitment, organization and constant training. We strive to consistently improve our services in an effort to satisfy each and every customer. When we see a big smile on our customer's face at the end of each job, that‘s the best reward for us.

Your complete satisfaction will always be our priority.",miranda-tile,2011-08-19T22:49:19.000-04:00,NA,NA,NA,"We install all type of tile like Porcelain Tiles, Ceramic Tiles, Glass Tiles, Marble Tiles, Grant Tiles, Slate","Bathroom Renovations, Backsplash, Floors, Demolitions, Waterproofing of showers and much more",,Bathrooms and Flooring,2006,2,"Direct Deposits, e-Transfers, Cheques",,,,TRUE,FALSE,,,TRUE,FALSE,,1853018,Miranda Tile,34,27,28,10,"Tile & Stone Contractors, Natural Stone Tile, Stone Floor Tile, Ceramic Tile, Floor tile, Tile installers, Stone installers, stone counter top installers, tile counter top installers, stone backsplash intallers, granite installers, marble installers, limestone installers, linoleum installers, slate contractors, slate installers,install tite ,backsplash , fire place veenerneed someone to install blacksplash , wall stone veener bath room mosaic,Bathroom Renovation, Bathroom renovation, bathroom remodeling, bathroom remodelling, renovating the bathroom, tearing out the bathroom, fixing up the bathroom, bathroom contractors, bathroom vanities, bathroom vanity, design of bathroom, bathroom and design, design for bathroom, design a bathroom, design a bath, bath design, bathroom tile, bathroom cabinets, remodeling a bathroom, bathroom remodeling, remodeling the bathroom, ,Bath renovation, New tub, caulking, ,",0,2014-11-06T10:19:57.000-05:00,mirandatile,FALSE,0,0,12,NA,FALSE,fad10c1435562517ab6d02fea64a4e8866342175,TRUE,2021-05-06T13:08:56.000-04:00,TRUE,TRUE,1849014,95.0022989542,442,NA,NA
https://homestars.com/on/schomberg/tile-stone-contractors,24,"c(""https://homestars.com/on/schomberg/tile-stone-contractors?&page=2&"", ""https://homestars.com/on/schomberg/tile-stone-contractors?&page=3&"")",Tile & Stone Contractors,2937328,https://www.windowcity.com,/companies/2937328-masterbuild-windows-doors?searched_category_id=442&service_area=2297789,"Masterbuild windows and doors established in 1999 in toronto  . We provide professional instalation services on windows and doors replacement all across  GTA   .  Which includes building bay windows ,  brick  and concrete cut outs ,   aluminum glass enclosures , European tilt and turn windows , comertial windows and doors , garage doors , interior doors. multiple windows styles and glass options , triple glass with LowE glass and argon gas , foam field vinyl windows frames and more . All types and styles  of exterior doors  from steel and fiberglass doors to a solid wood doors with any style of stained glass designs  or wrought iron Disign finished any colour , with  any type of trim  and with hundreds of hardware choices to choose from   . Our locally  manufactured windows and doors all comes with highest energy ratings in canada . And all been tested for wind , water , heat , cold and pressure by energy star  . All of our windows and doors are installed by our in house friendly licensed insured and certified installers  with minimum of 15 years experience in a trade and compliments by a life time warranty  , one of the best warranties on the market  today . We provide a free no obligation in home professional  consultations or a tour at our showroom  . We have thousands of Successfully completed projects across ontario in the last over 20 years with thousands of  satisfied home owners . Call  us now to get best results , guaranteed energy savings and a pleasant windows and doors replacement experience .   ",masterbuild-windows-doors,2019-11-21T23:19:59.000-05:00,NA,NA,NA,,"Window and Doors, Interior and Exterior Stone, Tiling, Flooring, Painting, Plumbing, Electrical, Major Home renovations, Home Addition, Bathroom Renovation, Kitchen Renovations, Hardscape and Softscape Landscaping, Interior and Exterior Doors, Metal Doors, Lighting interior and exterior, Paving Driveways and Concrete, Emergency Repairs.",,Windows and Doors and all Renovations ,1999,70,"Cash, Cheque, Etransfer, Credt Card",,,,TRUE,TRUE,,,TRUE,FALSE,3-25 years,1999502,Masterbuild Windows & Doors,7,6,95,9.33333,"Windows & Doors Installation & Service, install Replacement Window, Screen Door, Wood door, metal door, fire door, sliding door, french door, glass paned door, sash windows, casement windows, bay windows, bow windows, energy star windows, lead-paned windows, Windows,  wondows, windowa, windwos, winows, windows canada, windows home, canadian windows and doors, window manufacturers canada, house windows canada, canada windows, vinyl windows and doors, windows and doors canada, windows and doors, house windows, vinyl windows, canadian windows, buy windows, windows price, doors canada, windows manufacturers, windows for houses, canada doors, canadian door, windows vinyl, new house windows, canadian made windows, exterior windows, residential windows, black vinyl windows, garden doors canada, windows house, window suppliers, window companies toronto, vinyl windows price, windows canada store, window stores, store windows, vinyl doors, gta windows, buy doors, new windows and doors, shop windows, replacement windows, buy home windows, cheap home windows,  phantom screens, doors ontario, doors canada, canada doors, phantom screen doors, custom sliding window, double french doors, phantom retractable screens, plywood doors, screen doors wood, exterior doors, barn doors, entrance doors, steel doors, sliding screen doors, sliding barn doors, retractable screen door, exterior french doors, saloon doors, french windows, barn style doors, wooden doors, french patio doors, loft doors, solid wood doors, types of doors, custom doors, wood front doors, window doors, invisible screen door, exterior wood doors, interior wood doors, panel doors, door screens,  shutter doors, swing doors, wood entry doors, office doors, barn windows, retractable door, patio screen door, basement doors, exterior glass, exterior glass doors, french door screens, rolling screen door, screens for french doors, wooden exterior door, custom front doors, solid wood exterior doors, unique doors, pocket doors toronto, cheap interior doors, front doors, entry doors, solid oak doors, shop windows, front screen doors, custom wood doors toronto, window installations, window installation companies, windows and doors installation, windows and door installer, door installer, window contractors, door installation toronto, home window installation, windows and doors replacement, door installer toronto, replacement window doors, door replacement toronto, door company, best windows and doors reviews, long life windows, longlife windows, custom windows toronto, replacement doors, certified windows and doors reviews, install vinyl windows, install a door, door contractors, interior door installation, door repair, windows repair, windows replacement, exterior door installation, shower door installation,  front door replacement, garden doors, caulking,Floor Laying & Refinishing, Hardwood Floor, Wood Floor, Floor Tile, Dance Floor, Ceramic Floor Tile, Floor Refinishing, bamboo floor, cork floor, FSC wood flooring, stone floor, marble floor, slate floor, squeaky floor repair, laminate, laminate repair, wood floor, floor and wood, wood flooring, wood floors, floors in wood, hardwood flooring, hardwood floors, hardwood floors and, hardwood floor, hardwood floor wood, wood floor flooring, refinishing, floor refinishing, floor refinishing in, refinishing floor, hardwood install, floor laying, laying a floor, flood sanding, wood floor refinishing, refinishing hardwood floors, flooring laying, wood floors refinishing, wood flooring refinishing, floor co, flooring hard wood, hard wood floors, laying floors, flooring company, flooring engineered hardwood, floor company, hard wood floor, cleaning hardwood floors, installing hardwood flooring, installing hardwood floors, installing wood flooring, installing wood floors, installing hardwood floors, installing wood flooring, installing wood floors, installing hardwood floor, hardwood flooring installation, business floor, wood flooring installation, hardwood floor installation, floor companies, lay hardwood flooring, lay hardwood floor, wood floor repair, repair wood floor, repair hardwood floor, hardwood floor repair, finishing a hardwood floor, squeeky floors,,Hardwood floors, Install hardwood floors, caulking,Interlocking Stone, Interlocking Tile, Stone, tiles for, landscaping, paving, pavers, paver, stone step, wall stone, stone wall, landscape design, patios, interlock, retaining wall, stepping stones, interlocking, landscaping ideas, retaining walls, paving stones, paver stones, pavers stones, pavers and stones, stones pavers, stones and pavers, flagstone, concrete design, landscapers, natural stone, paving stone, stone paving, stone paving stone, walls stone, patio designs, stone and tiles, tiles and stone, stone flagstones, slate tiles, slate tile, stone veneer, pavers stone, stone and pavers, stone pavers, paver stone, stone paver, concrete driveway, stone brick, stone and brick, brick and stone, stone flooring, stone patio, stone for patio,,Paving Contractors, Paver, Asphalt Paving, Paving Stones, Paving Commercial Paving, Asphalt Paving Material, Driveway Paving, residential paving, what is asphalt, asphalt, paving, slabs, pavers, driveway, paver, driveways, pavements, patios, tarmac, paving pavers, asfalt, blacktop, paving stones, paver stones, paving stone, stone paving, stamped concrete, flagstones, paving slabs, patio designs, concrete slabs, block paving, patio design, paving slab, patio ideas, paving flags, asphalt pavement, concrete driveway, driveway concrete, concrete patio, concrete calculator, paving asphalt, asphalt paving, asphalt and paving, concrete contractors, concrete contractors in, concrete driveways, patio pavers, concrete contractor, concrete pavers, seal coating, paving concrete, concrete paving, paving and concrete, paving or concrete, paver patio, sealcoating, paving blocks, ,Tile & Stone Contractors, Natural Stone Tile, Stone Floor Tile, Ceramic Tile, Floor tile, Tile installers, Stone installers, stone counter top installers, tile counter top installers, stone backsplash intallers, granite installers, marble installers, limestone installers, linoleum installers, slate contractors, slate installers,install tite ,backsplash , fire place veenerneed someone to install blacksplash , wall stone veener bath room mosaic,Stucco, Stuccos, stucco contractor, stucco surface, exterior stucco, popcorn, popcorn ceiling, popcorn ceilings, popcorn ceiling removal,,",0,2019-11-21T23:22:05.000-05:00,,FALSE,0,0,107,0,FALSE,c743bbcd5f9ebcc680a4d3a9d72828847b0125fe,TRUE,NA,TRUE,TRUE,2297789,80.957141548,442,NA,NA
