Link,n_hits,all_links,category,id,url,hs_path,profile,permalink,created_at,sic_code,service_area,hours,products,services,brands,specialities,established,employee_cnt,payment_method,diplomas,licenses,memberships,liability_insurance,bonded,project_rate,project_minimum,written_contract,written_warranty,warranty_terms,parent_company_id,name,total_number_of_reviews_cache,total_number_of_approved_reviews_cache,number_of_photos_cache,avg_rating_cache,categories_info_cache,savings_count,claimed_at,subdomain,fraudulent,fraudulent_count,total_number_of_pending_reviews_cache,images_count,completion_percent_cache,bully,secret,replied_to_at_least_one_review_cache,latest_approved_review_created_at,has_set_tasks,lead_purchase_eligible,service_area_id,star_score,quote_button_category,direct_phone,direct_contact
https://homestars.com/on/pompano-beach/fences-gates,72,"c(""https://homestars.com/on/pompano-beach/fences-gates?&page=2&"", ""https://homestars.com/on/pompano-beach/fences-gates?&page=3&"", ""https://homestars.com/on/pompano-beach/fences-gates?&page=4&"", ""https://homestars.com/on/pompano-beach/fences-gates?&page=5&"", ""https://homestars.com/on/pompano-beach/fences-gates?&page=6&"", ""https://homestars.com/on/pompano-beach/fences-gates?&page=7&"", ""https://homestars.com/on/pompano-beach/fences-gates?&page=8&"")",Fences & Gates,2780598,https://homestars.com/companies/2780598-pro-reno-fences-and-decks,/companies/2780598-pro-reno-fences-and-decks?searched_category_id=354&service_area=2086513,"We have been serving the GTA area for the last 15 years. Licenced and insured with refrences im many GTA areas.
Financing and seniors discount is available.
Services include-Fences, Decks, Shades/Garages, Retaining walls, Landscaping.",pro-reno-fences-and-decks,2010-08-21T20:19:22.000-04:00,NA,All areas with in two hours drive of Toronto.,Mon to Sat  8-6,,,,,1998,NA,"Cash,Check.",,Business licence.,,TRUE,TRUE,,,TRUE,FALSE,4 years labour and material.,1843650,"Pro Reno, Fences And Decks.",150,116,34,9.69828,"Fences & Gates, Dog Fence, Invisible Fence, Chain Link Fence, Pool Fence, Wood Fence, Fence Gates, Dog Gates, Pet Gates, friendly neighbour fence, friendly neighbor fence, picket fence, wrought iron fence, and gate, and gates, gates, the fence, a fence, fence, fences, fence with gate, gate and fence, gate for fence, fence & gate, gate fence, fence gate, fence and gate, gates and fence, gates fence, fence & gates, fence and gates, fence gates, railings, wrought iron, electronic gates, entrance gate, trellis, fence post, front gates, chain fence, fence panels, fence chain link, chain link fence, how to wood fence, fence wood, wood for fence, wood fence, fence panel, garden gate, fence posts, fencing panels, iron gate, chain link fencing, panel fencing, gates iron, iron gates, chain link fences, fences chain link, fencing post, dog fencing, ,",0,2010-08-21T20:19:23.000-04:00,proreno,FALSE,0,0,40,NA,FALSE,d45d63a5415e76b6d5bfd8da7731a01b065de494,TRUE,2022-05-24T20:21:45.000-04:00,TRUE,TRUE,2086513,95.6137048095,354,NA,NA
https://homestars.com/on/pompano-beach/fences-gates,72,"c(""https://homestars.com/on/pompano-beach/fences-gates?&page=2&"", ""https://homestars.com/on/pompano-beach/fences-gates?&page=3&"", ""https://homestars.com/on/pompano-beach/fences-gates?&page=4&"", ""https://homestars.com/on/pompano-beach/fences-gates?&page=5&"", ""https://homestars.com/on/pompano-beach/fences-gates?&page=6&"", ""https://homestars.com/on/pompano-beach/fences-gates?&page=7&"", ""https://homestars.com/on/pompano-beach/fences-gates?&page=8&"")",Fences & Gates,2958323,,/companies/2958323-contractorguzman?searched_category_id=354&service_area=2267182,"Contractor Guzman are experts on Fences and Basements.
A top builder of high-quality fences and basements for residential and commercial properties in Toronto. 
Our team is equipped with the right skills, tools, and technology to assist you with your project.

Why Choose Contractor Guzman?
At Guzman Fence and Deck, we understand that each type of fence and deck has its pros and cons, and we always work our way around them. 
We know that every project is determined by different factors like your preference, budget, choice of materials, and location.
We are always ready to help you create the perfect fence or basement for your residential property with an easy process.

To ensure the quality of your fence and basement, hiring a reliable, trusted, and professional service is the key. 
For an initial consultation, contact us at 647-471-9817",contractorguzman,2021-07-24T16:40:35.000-04:00,NA,NA,NA,,,,"Basement Renovation,
Fences",NA,NA,"Cash, Cheques, E-Transfer",,Fully Licensed,,TRUE,FALSE,,,TRUE,FALSE,,2020300,ContractorGuzman ,74,70,349,9.95714,"Fences & Gates, Dog Fence, Invisible Fence, Chain Link Fence, Pool Fence, Wood Fence, Fence Gates, Dog Gates, Pet Gates, friendly neighbour fence, friendly neighbor fence, picket fence, wrought iron fence, and gate, and gates, gates, the fence, a fence, fence, fences, fence with gate, gate and fence, gate for fence, fence & gate, gate fence, fence gate, fence and gate, gates and fence, gates fence, fence & gates, fence and gates, fence gates, railings, wrought iron, electronic gates, entrance gate, trellis, fence post, front gates, chain fence, fence panels, fence chain link, chain link fence, how to wood fence, fence wood, wood for fence, wood fence, fence panel, garden gate, fence posts, fencing panels, iron gate, chain link fencing, panel fencing, gates iron, iron gates, chain link fences, fences chain link, fencing post, dog fencing, ,Basement Renovation, Basement renovation, Basement remodeling, Basement remodelling, renovating your basement, renovation, waterproofing, remodeling, home renovation, house renovation, water in basement, basement waterproofing,finishing basement, moistureproof, remodeling the house, caulking,Paint & Wallpaper Contractors, Paint Colors, Paint Store, Paint Brush, Paint Shop, Home Wallpaper,Wallpaper, Paint colour advice, paint colour consultants, wallpapering, painter, faux, painters painting, painters paint, business painting, find painting, painting and restoration, new jersey painting, oh painting, local painting, wall paper repair, ,Decks, Deck, Wood Deck, Deck Patio Furniture, Patio Heater, Patio Deck, Patio Door, Patio Cover, Patio Umbrella, Patio Furniture Set, Patio Furniture Cushion, the deck, on deck, deck tech, patios, construction plans, how to build a deck, build decks, build a deck, deck plans, design deck, design a deck, deck design, deck building, building a deck, building deck, deck designs, how to make a deck, patio cover, wood deck, deck wood, deck board, patio designs, deck designs plans, deck plans designs, deck builder, deck stain, deck builders, ,",0,2021-07-24T17:25:34.000-04:00,ContractorGuzman,FALSE,0,0,392,0,FALSE,8c59efc8af4b99ea275cde02d5a4043d3fc7b778,TRUE,2022-11-08T10:18:43.000-05:00,TRUE,TRUE,2267182,98.6097039578,354,NA,NA
https://homestars.com/on/pompano-beach/fences-gates,72,"c(""https://homestars.com/on/pompano-beach/fences-gates?&page=2&"", ""https://homestars.com/on/pompano-beach/fences-gates?&page=3&"", ""https://homestars.com/on/pompano-beach/fences-gates?&page=4&"", ""https://homestars.com/on/pompano-beach/fences-gates?&page=5&"", ""https://homestars.com/on/pompano-beach/fences-gates?&page=6&"", ""https://homestars.com/on/pompano-beach/fences-gates?&page=7&"", ""https://homestars.com/on/pompano-beach/fences-gates?&page=8&"")",Fences & Gates,2909126,http://fencemasterconstructions.ca,/companies/2909126-fence-master?searched_category_id=354&service_area=2148637,"
Fence Master encourages you to review our website and learn all about us. We are guided by principles which we do not compromise on:

We offer quality work at a fair price – We complete your project properly, to stand the passage of time. No issues, no problems, no regrets!
Our staff is experienced. Every single person on every one of our jobs has the skills and experience to do the job right, the first time, to make it last.
Quality materials – We use the right supplies, from the ground up, and in the right quantities. We don’t skimp. We build properly!

Email:info@fencemasterconstructions.ca
Bus#: 416-315-0525
cell: 416-723-4495


Wood, Chain Link, Wrought Iron Fence
Free Estimate, we service GTA and surrounding area.
Reliable and Affordable
",fence-master,2018-02-07T17:44:23.000-05:00,NA,NA,NA,,"Wood, Chain Link, Wrought Iron Fence",,,2015,NA,"Credit Cards, Cheque, Cash and e-transfer",,,,FALSE,FALSE,,,TRUE,FALSE,1 Year on Workmanship. Please ask for more details,1971311,Fence Master Constructions Inc,88,80,36,9.9625,"Fences & Gates, Dog Fence, Invisible Fence, Chain Link Fence, Pool Fence, Wood Fence, Fence Gates, Dog Gates, Pet Gates, friendly neighbour fence, friendly neighbor fence, picket fence, wrought iron fence, and gate, and gates, gates, the fence, a fence, fence, fences, fence with gate, gate and fence, gate for fence, fence & gate, gate fence, fence gate, fence and gate, gates and fence, gates fence, fence & gates, fence and gates, fence gates, railings, wrought iron, electronic gates, entrance gate, trellis, fence post, front gates, chain fence, fence panels, fence chain link, chain link fence, how to wood fence, fence wood, wood for fence, wood fence, fence panel, garden gate, fence posts, fencing panels, iron gate, chain link fencing, panel fencing, gates iron, iron gates, chain link fences, fences chain link, fencing post, dog fencing, ,",0,2018-02-07T17:45:08.000-05:00,FenceMasterCon,FALSE,0,0,38,0,FALSE,a5e05bcaab6f6d29247467ab84b652b3aa716a10,TRUE,2022-07-07T13:16:34.000-04:00,TRUE,TRUE,2148637,98.4564352254,354,NA,NA
https://homestars.com/on/pompano-beach/fences-gates,72,"c(""https://homestars.com/on/pompano-beach/fences-gates?&page=2&"", ""https://homestars.com/on/pompano-beach/fences-gates?&page=3&"", ""https://homestars.com/on/pompano-beach/fences-gates?&page=4&"", ""https://homestars.com/on/pompano-beach/fences-gates?&page=5&"", ""https://homestars.com/on/pompano-beach/fences-gates?&page=6&"", ""https://homestars.com/on/pompano-beach/fences-gates?&page=7&"", ""https://homestars.com/on/pompano-beach/fences-gates?&page=8&"")",Fences & Gates,2912248,https://www.ontimecontracting.ca/,/companies/2912248-on-time-contracting?searched_category_id=354&service_area=2155125,"Welcome to On Time Contracting.  I've had my renovation business now for 15+ years.   I do one job at a time to finish on-time and on-budget.  When you hire me, I'm your contractor and I'm there each day from start to end.  Call Today For FREE ESTIMATE.  

I do both interior and exterior renovations.  In the summer, I do decks & fences, porches, custom sheds and cabanas.  I also do interior renovations in fall / winter including kitchens, bathrooms, basements and additions.

On Time Contracting specializes in:  Decks; Fences & Gates, Sheds, Cabanas, Pergolas, Over Handing Roofs, Stairs and Railings  ",on-time-contracting,2018-03-13T21:28:27.000-04:00,NA,NA,NA,,,,"Decks,Fences & Gates, Sheds, Cabanas, Pergolas, Over Handing Roofs, Landscaping, Stairs and Railings ",2004,15,"Cash, Cheque, E-Transfer ",,Yes ,,TRUE,TRUE,,,TRUE,FALSE,1 Year,1974433,On Time Contracting,47,43,522,10,"General Contractors, Residential General Contractor, Building Contractor, Additions, Remodeling Contractor,  Renovation, Builder, building construction, renovation, remodeling, construction builders, construction company, construction companies, home repair, construction jobs, home remodeling, general contractors, contractors general, contractor general, contractors construction, construction contractors, home improvement and remodeling, kitchen remodeling, construction contractor, builders contractors, home renovation, general contracting, building contractors, building companies, home renovations, builder contractor, building contractor, remodeling contractor, commercial construction, residential construction, house contractor, concrete contractors, home contractors, general construction, construction general, contractors remodeling, remodeling contractors, remodelers, remodel contractor, remodel contractors, general contract, commercial contractors, renovations contractors, home improvement contractor, licensed contractor, license general contractor, mud room, mudroom, caulking, ,Fences & Gates, Dog Fence, Invisible Fence, Chain Link Fence, Pool Fence, Wood Fence, Fence Gates, Dog Gates, Pet Gates, friendly neighbour fence, friendly neighbor fence, picket fence, wrought iron fence, and gate, and gates, gates, the fence, a fence, fence, fences, fence with gate, gate and fence, gate for fence, fence & gate, gate fence, fence gate, fence and gate, gates and fence, gates fence, fence & gates, fence and gates, fence gates, railings, wrought iron, electronic gates, entrance gate, trellis, fence post, front gates, chain fence, fence panels, fence chain link, chain link fence, how to wood fence, fence wood, wood for fence, wood fence, fence panel, garden gate, fence posts, fencing panels, iron gate, chain link fencing, panel fencing, gates iron, iron gates, chain link fences, fences chain link, fencing post, dog fencing, ,",0,2018-03-13T21:30:20.000-04:00,NA,FALSE,0,0,624,0,FALSE,05c8b6786ac30fbe54ca813878fd739722566475,TRUE,2021-10-08T13:11:36.000-04:00,TRUE,TRUE,2155125,98.3396030501,354,NA,NA
https://homestars.com/on/pompano-beach/fences-gates,72,"c(""https://homestars.com/on/pompano-beach/fences-gates?&page=2&"", ""https://homestars.com/on/pompano-beach/fences-gates?&page=3&"", ""https://homestars.com/on/pompano-beach/fences-gates?&page=4&"", ""https://homestars.com/on/pompano-beach/fences-gates?&page=5&"", ""https://homestars.com/on/pompano-beach/fences-gates?&page=6&"", ""https://homestars.com/on/pompano-beach/fences-gates?&page=7&"", ""https://homestars.com/on/pompano-beach/fences-gates?&page=8&"")",Fences & Gates,2955792,,/companies/2955792-monte-leo-construction-inc?searched_category_id=354&service_area=2252439,"Professional Decking and Fencing Installation
​
Operating in GTA, we offer full decking and fencing services for residential and commercial purposes with the best quality and workmanship at affordable prices. 

EXCELLENCE IN WORKMANSHIP

We provide a professional and customer-friendly outdoor carpentry service that adds style to your home. We offer expert project management and high skilled workmanship from initial consultation and project design through the final construction. We  only use the best materials to create your perfect space in your dreams.



EXPERIENCED, HONEST AND RELIABLE

Whether we’re dealing with a customer who knows the ins and outs about our work, or someone who doesn’t know at all, we are committed to the fair and equal treatment of everyone we deal with. We believe in taking an honest and sincere approach with our customers as we know the value of having a good reputation of being reliable and getting the job done is the key to having a successful business. 

We're social here: 

https://www.instagram.com/maple.custom.decks/",monte-leo-construction-inc,2021-04-30T19:45:38.000-04:00,NA,NA,NA,,"Our Services Include
​
Pressure Treated - Cedar - Composite Decks // Modern - Traditional Privacy Screens - Fences // Pergolas - Gazebos // Gates // Deck Lights // Much more..",,,2016,NA,"Cash, Cheque and e-transfer",,,,FALSE,FALSE,,,TRUE,FALSE,Yes. Kindly ask for details. Depends on project completed. ,2017770,Monte-Leo Construction Inc.,46,43,14,9.90698,"Fences & Gates, Dog Fence, Invisible Fence, Chain Link Fence, Pool Fence, Wood Fence, Fence Gates, Dog Gates, Pet Gates, friendly neighbour fence, friendly neighbor fence, picket fence, wrought iron fence, and gate, and gates, gates, the fence, a fence, fence, fences, fence with gate, gate and fence, gate for fence, fence & gate, gate fence, fence gate, fence and gate, gates and fence, gates fence, fence & gates, fence and gates, fence gates, railings, wrought iron, electronic gates, entrance gate, trellis, fence post, front gates, chain fence, fence panels, fence chain link, chain link fence, how to wood fence, fence wood, wood for fence, wood fence, fence panel, garden gate, fence posts, fencing panels, iron gate, chain link fencing, panel fencing, gates iron, iron gates, chain link fences, fences chain link, fencing post, dog fencing, ,Decks, Deck, Wood Deck, Deck Patio Furniture, Patio Heater, Patio Deck, Patio Door, Patio Cover, Patio Umbrella, Patio Furniture Set, Patio Furniture Cushion, the deck, on deck, deck tech, patios, construction plans, how to build a deck, build decks, build a deck, deck plans, design deck, design a deck, deck design, deck building, building a deck, building deck, deck designs, how to make a deck, patio cover, wood deck, deck wood, deck board, patio designs, deck designs plans, deck plans designs, deck builder, deck stain, deck builders, ,",0,2021-04-30T19:46:57.000-04:00,,FALSE,0,0,14,0,FALSE,952b3ac603b9e7aefd38daa836da9baf102f4332,TRUE,2022-08-18T11:53:01.000-04:00,TRUE,TRUE,2252439,98.198129207,354,NA,NA
https://homestars.com/on/pompano-beach/fences-gates,72,"c(""https://homestars.com/on/pompano-beach/fences-gates?&page=2&"", ""https://homestars.com/on/pompano-beach/fences-gates?&page=3&"", ""https://homestars.com/on/pompano-beach/fences-gates?&page=4&"", ""https://homestars.com/on/pompano-beach/fences-gates?&page=5&"", ""https://homestars.com/on/pompano-beach/fences-gates?&page=6&"", ""https://homestars.com/on/pompano-beach/fences-gates?&page=7&"", ""https://homestars.com/on/pompano-beach/fences-gates?&page=8&"")",Fences & Gates,2946577,http://sweethomeconstruction.ca,/companies/2946577-alpha-fence?searched_category_id=354&service_area=2232015,"My name is Erik Tibor and I am the owner and operator of Sweet Home Construction. I would first like to thank you for taking the time to read a bit about our company.

 At Sweet Home Construction we are a close-knit and family-built company that strive to provide our customers with an exemplary experience and flawless finished projects so they can be proud of their decision to entrust their current and future projects with us.

 We at Sweet Home Construction specialize in fences, interlocking, deck building, basement renovation and repair. We also are able to offer assistance on many other construction or renovations projects not listed upon request.

I started this company twelves years ago after realizing that there was a need for general contractors that were able to get projects done with great care, on time and on budget after going through many aches and pains with other contractors when trying to renovating my family home.  With the help and support of my family we were able to complete my family home for my parents.

Since then,I have added many trusted workers to my growing team to fulfill other projects for many businesses both large and small as well as families working to improve their living spaces.

 At Sweet Home Construction we believe that our commitment to superior quality and results will allow us to continue to take on larger projects and leave more smiles on the faces of those who see the results that we produce.

We are social:

Instagram: https://www.instagram.com/sweethomeconstruction/
",alpha-fence,2020-08-10T13:36:06.000-04:00,NA,NA,NA,,"Residential and Commercial:

Install Aluminum or Steel Fence
Repair Aluminum or Steel Fence
Install Barbed Wire Fence
Repair Barbed Wire Fence
Install Chain Link Fence
Repair Chain Link Fence
Clean or Seal Deck Fence or Patio
Install Electronic Pet Fence
Repair Electronic Pet Fence
Install or Replace Gate for Driveway and Security
Install Vinyl or PVC Fence
Repair Vinyl or PVC Fence
Install Wood Fence
Repair Wood Fence
Install Wrought Iron Fence
Repair Wrought Iron Fence",,,2019,NA,"e-transfer, cash, cheque. ",,,,FALSE,FALSE,,No job is too small,TRUE,FALSE,"Yes, kindly ask for details, depends on project completed ",2008714,Alpha Fence,43,43,107,9.93023,"Fences & Gates, Dog Fence, Invisible Fence, Chain Link Fence, Pool Fence, Wood Fence, Fence Gates, Dog Gates, Pet Gates, friendly neighbour fence, friendly neighbor fence, picket fence, wrought iron fence, and gate, and gates, gates, the fence, a fence, fence, fences, fence with gate, gate and fence, gate for fence, fence & gate, gate fence, fence gate, fence and gate, gates and fence, gates fence, fence & gates, fence and gates, fence gates, railings, wrought iron, electronic gates, entrance gate, trellis, fence post, front gates, chain fence, fence panels, fence chain link, chain link fence, how to wood fence, fence wood, wood for fence, wood fence, fence panel, garden gate, fence posts, fencing panels, iron gate, chain link fencing, panel fencing, gates iron, iron gates, chain link fences, fences chain link, fencing post, dog fencing, ,",0,2020-08-10T13:38:07.000-04:00,,FALSE,0,0,105,0,FALSE,99d31b3839aed4def9ad23db09b09dc0382ef2e0,TRUE,2022-11-13T22:44:37.000-05:00,TRUE,TRUE,2232015,97.5096364248,354,NA,NA
https://homestars.com/on/pompano-beach/fences-gates,72,"c(""https://homestars.com/on/pompano-beach/fences-gates?&page=2&"", ""https://homestars.com/on/pompano-beach/fences-gates?&page=3&"", ""https://homestars.com/on/pompano-beach/fences-gates?&page=4&"", ""https://homestars.com/on/pompano-beach/fences-gates?&page=5&"", ""https://homestars.com/on/pompano-beach/fences-gates?&page=6&"", ""https://homestars.com/on/pompano-beach/fences-gates?&page=7&"", ""https://homestars.com/on/pompano-beach/fences-gates?&page=8&"")",Fences & Gates,2893087,http://aztecaluminumrailings.ca,/companies/2893087-aztec-home-improvements?searched_category_id=354&service_area=2229133,,aztec-home-improvements,2017-01-12T21:16:18.000-05:00,NA,NA,NA,,"Aluminum Railings, Glass Railings, Gates, Fences and Aluminum Columns",,,2013,4,"Cash, Check, e-transfer, debit and credit",building renovation,,,TRUE,TRUE,,,TRUE,FALSE,10yr on Materials and 5 year Labor ,1955511,Aztec Aluminum Railings,46,42,118,9.95238,"Railings, stair railings, outdoor railings, iron railings, wrought iron railings, wood railings, rail, gates, fence, rails, fencing, rail times, fences, fence gate, fence gates, railing, wrought, wrought iron, handrail, handrails, balustrade, balconies, rail simulator, speed rail, iron works, stair steps, balusters, iron work, fence panels, hand rail, banister, hand railing, rail works, ironworks, balustrades, front gates, curtain rails, garden gate, iron gate, gate iron, gates iron, iron gates, ,Fences & Gates, Dog Fence, Invisible Fence, Chain Link Fence, Pool Fence, Wood Fence, Fence Gates, Dog Gates, Pet Gates, friendly neighbour fence, friendly neighbor fence, picket fence, wrought iron fence, and gate, and gates, gates, the fence, a fence, fence, fences, fence with gate, gate and fence, gate for fence, fence & gate, gate fence, fence gate, fence and gate, gates and fence, gates fence, fence & gates, fence and gates, fence gates, railings, wrought iron, electronic gates, entrance gate, trellis, fence post, front gates, chain fence, fence panels, fence chain link, chain link fence, how to wood fence, fence wood, wood for fence, wood fence, fence panel, garden gate, fence posts, fencing panels, iron gate, chain link fencing, panel fencing, gates iron, iron gates, chain link fences, fences chain link, fencing post, dog fencing, ,",0,NA,aztec,FALSE,0,0,188,0,FALSE,03fdcd3f6d409818571dfe0a92630a8fae1da257,TRUE,2021-05-21T11:40:17.000-04:00,TRUE,TRUE,2229133,97.1303467999,354,NA,NA
