Link,n_hits,all_links,category,id,url,hs_path,profile,permalink,created_at,sic_code,service_area,hours,products,services,brands,specialities,established,employee_cnt,payment_method,diplomas,licenses,memberships,liability_insurance,bonded,project_rate,project_minimum,written_contract,written_warranty,warranty_terms,parent_company_id,name,total_number_of_reviews_cache,total_number_of_approved_reviews_cache,number_of_photos_cache,avg_rating_cache,categories_info_cache,savings_count,claimed_at,subdomain,fraudulent,fraudulent_count,total_number_of_pending_reviews_cache,images_count,completion_percent_cache,bully,secret,replied_to_at_least_one_review_cache,latest_approved_review_created_at,has_set_tasks,lead_purchase_eligible,service_area_id,star_score,quote_button_category,direct_phone,direct_contact
https://homestars.com/on/georgetown/lawn-maintenance,16,https://homestars.com/on/georgetown/lawn-maintenance?&page=2&,Lawn Maintenance,2849073,https://www.lawntroopers.com/,/companies/2849073-lawn-troopers?searched_category_id=397&service_area=2202620,"
WELCOME TO LAWN TROOPERS
We take pride in offering an unprecedented level of quality and commitment to all of our clientele for the last 20 years. Our professional, uniformed and fully insured staff will make sure each job exceeds your expectations. Give us a call any time and we will be glad to answer any of your questions.

See our work here:

https://www.instagram.com/lawntroopers/",lawn-troopers,2014-02-20T20:21:02.000-05:00,NA,NA,NA,,"LAWN CUTTING PACKAGES

FERTILIZING AND WEED CONTROL PACKAGES



GARDEN CLEAN-UPS

TOP DRESSING",,,2003,70,Visa or Mastercard ,,,Landscape Ontario,TRUE,FALSE,,,FALSE,FALSE,,1911507,Lawn Troopers,388,354,51,9.61864,"Lawn Maintenance, Lawn Care, Lawn Mowers, Lawn Maintenance Companies, grass cutters, grass cutting, shrub pruning, lawns, a lawns, landscaping, mowing, lawn mowers, mowing lawn, lawn mowing, mowing the lawns, mowing lawns, lawns mowing, yard and garden, maintenance lawn, lawns maintenance, lawncare, service lawn, lawn service, grass mowing, lawn treatment, green grass, lawn repair, grass lawn mowers, lawn & landscape, lawn landscape, a lawn and landscape, landscape and lawn, lawn and landscape, lawn services, yard landscape, lawn maintenance service, lawn service maintenance, landscaping a yard, yard landscaping, lawn maintenance services, maintenance company, grass cutting, maintenance business, lawn business, leaf clean up, fall leaves, hedges ,",0,2016-02-25T17:37:45.000-05:00,troopers,FALSE,0,0,52,0,FALSE,328188baf0ced0878ea8681cc48269415b45a208,TRUE,2022-09-30T18:27:52.000-04:00,TRUE,TRUE,2202620,95.0613915668,397,NA,NA
https://homestars.com/on/georgetown/lawn-maintenance,16,https://homestars.com/on/georgetown/lawn-maintenance?&page=2&,Lawn Maintenance,213813,https://www.lawnsavers.com,/companies/213813-lawnsavers-plant-health-care-inc?searched_category_id=397&service_area=2086882,"For 32 years, LawnSavers has focused on providing proven, organic-based solutions for Lawn Care & Tree Health Care. Our Fertilizing, Weed Control and Insect Pest Control Solutions are top notch. Naturally, this allows us to provide environmentally sustainable, healthy lawns & trees for a greener environment! 
 
We are a family-owned local Canadian company that's BIG ON SERVICE and taking care of people, including those team members that take care of you. We value old fashioned customer service, communication and partnership with our customers. We've grown a reputation of excellence through partnering with our clients. Deeply embedded in our culture, is that we always focus on great service, integrity, doing the right thing and real value. We are proud to be recognized as the 2022 ""Best Lawn & Landscape Companies to work for"" from Lawn & Landscape Magazine. 
 
We provide Natural & Organic Lawn care programs that include (better-than-golf course) Fertilizer, Effective Weed Control, Natural Insect Control & Pest Management. 
 
We specialize in lawn care services such as Weed control, weed removal, Lawn Renovation, No-Mess Liquid Aeration, PowerSeeding, OverSeeding, Topdressing & Compost Application, Mosquito Control, Perimeter Spider & Ant Control, Flea & Tick Control, Chinch Bug Control & Grub Control.
 
We are also a leader in Professional Christmas Lighting and Elegant Holiday Decorations!
 
Call or text us at 905-707-9994  416-707-9994 or 1-888-503-LAWN(5296) or visit https://lawnsavers.com to learn more and get a fast estimate customized for your property.
 
Our Risk-Free Guarantee ensures you get the best program value for the best price to ensure the best results. We are your true lawn care partners.
 
Our Lawn Care, Tree Health and Pest Control Service Areas include:
Ajax, Aurora, Barrie, Bradford, Brampton, Brooklin, Concord, Gormley, Etobicoke, Holland Landing, Innisfil, King City, Kleinburg, Kettleby, Maple, Markham, Milton, Mississauga, Newmarket, Nobleton, North York, Oak Ridges, Oakville, Pickering, Pottageville, Queensville, Richmond Hill, Scarborough, Sharon, Stouffville, Thornhill, Toronto, Vaughan, Whitby, and Woodbridge",lawnsavers-plant-health-care-inc,2008-01-23T10:30:50.000-05:00,NA,"Ajax, Aurora, Barrie, Bradford, Brampton, Brooklin, Concord, Gormley, Etobicoke, Holland Landing, Innisfil, King City, Kettleby, Maple, Markham, Milton, Mississauga, Newmarket, Nobleton, North York, Oak Ridges, Oakville, Pickering, Pottageville, Queensville, Richmond Hill, Scarborough, Sharon, Stouffville, Thornhill, Toronto, Vaughan, Whitby, Woodbridge.",Mon-Fri 9:00-9:00,"Visible Results Guaranteed
FREE CALL/EMAIL AHEAD Notification included on every visit.
Green & Healthy Lawns & Trees - Fertilizing, Weed Control, Grub Control & Insect pest control, Aeration & OverSeeding; Everything for the treatment and promotion of healthy lawns & trees.","Lawn Care & Tree Health Care Services (Fertilization, Weed Control, Insect Control) PowerSeeding, Topdressing, Liquid and Core Aeration, Mosquito & Tick Control, Exterior Pest Control CHRISTMAS LIGHTS & Holiday Decorations","2014-2022 Consumer Choice Award Winner for Best Lawn Care Service!
Fiesta Weed Control, Custom POLYON Fertilizer, LawnSavers Signature growth nutrients, Custom Compost Topdressing, Soil Health, Seeding, LED Christmas lighting, Humic Acid, Carbon","Green & Healthy Lawn Care, Weed Control, Custom Lawn Fertilization, Slit Seeding, Liquid Aerating, Organic Compost, Lawn Restoration & Renovation,  Pest Control, Great Service, Professional Christmas Lights and Decorations!",1989,24,"Please Note: Service continues on an annual basis automatically, Please advise if you do NOT wish service to continue without contacting you first.","$5,000,000.00 Coverage, Fall Protection Awareness Certification, WHMIS","Ontario Ministry of Environment: Landscape Exterminator., Structural & Mosquito Licences","A+ BBB MEMBER, Landscape Ontario Member, CNLA, NALP (National Association of Landscape Professionals",TRUE,TRUE,"Pricing based on actual lawn area, or # and size of trees & shrubs. Not total lot/property size.",No lawn is too small for us to save! (and keep healthy and green),TRUE,FALSE,100% Satisfaction Guarantee  Simply Put: We won't rest until you're happy!,67328,LawnSavers Plant Health Care Inc,636,553,280,9.10307,"Lawn Maintenance, Lawn Care, Lawn Mowers, Lawn Maintenance Companies, grass cutters, grass cutting, shrub pruning, lawns, a lawns, landscaping, mowing, lawn mowers, mowing lawn, lawn mowing, mowing the lawns, mowing lawns, lawns mowing, yard and garden, maintenance lawn, lawns maintenance, lawncare, service lawn, lawn service, grass mowing, lawn treatment, green grass, lawn repair, grass lawn mowers, lawn & landscape, lawn landscape, a lawn and landscape, landscape and lawn, lawn and landscape, lawn services, yard landscape, lawn maintenance service, lawn service maintenance, landscaping a yard, yard landscaping, lawn maintenance services, maintenance company, grass cutting, maintenance business, lawn business, leaf clean up, fall leaves, hedges ,Weed Control, lawn maintenance, weeding companies, weed companies, weed and pest control,",10,2009-02-25T12:38:39.000-05:00,lawnsavers,FALSE,0,1,121,100,FALSE,3d26ca2ece2d7d9411400c2d6c9114829a56a470,TRUE,2022-10-19T05:26:56.000-04:00,TRUE,TRUE,2086882,91.546470837,397,NA,NA
https://homestars.com/on/georgetown/lawn-maintenance,16,https://homestars.com/on/georgetown/lawn-maintenance?&page=2&,Lawn Maintenance,210478,http://www.hometurf.ca,/companies/210478-hometurf-lawn-care-service?searched_category_id=397&service_area=2082311,"At Hometurf Lawn Care, we have been treating the lawns of our loyal customers for over 30 years. As a family-owned and -operated business, we have grown by delivering lush, healthy, green lawns while using only the highest quality products applied by professional lawn care technicians. Let us help you make your lawn look its best this season!

Our season-long lawn care programs take the guess work out of which products to use and when. Applications are scheduled to be applied four to six weeks apart throughout the season for optimal turf care. We strive to ensure everything your lawn needs is included in our programs. No telemarketing or sales calls pushing unnecessary extras.

Our services include: lawn care programs, lawn maintenance programs, fertilizer, weed control, insect control, aeration, grass seeding, dethatching, top dressing, chinch bug control and grub control. ",hometurf-lawn-care-service,2008-01-23T10:29:16.000-05:00,NA,"Brampton, Mississauga, Oakville, Burlington, Etobicoke, North York, Scarborough, Toronto, Markham, Richmond Hill, Vaughan, New Market, Aurora, Barrie, Pickering, Ajax, Whitby, Oshawa, Hamilton, Guelph, Cambridge, Kitchener, Waterloo,Milton, Georgetown",9AM to 7PM EST,"Lawn Care Programs, Fertilizer, Weed Control, Insect Control, Aeration, Grass Seeding, Dethatching, Top Dressing","Lawn Care Programs, Fertilizer, Weed Control, Insect Control, Aeration, Grass Seeding, Dethatching, Top Dressing",,,1988,50,"Cheque, Visa, MasterCard, Online Banking",,"Ministry of Ontario Landscape Exterminator, Ministry of Ontario Pesticide Operator License","Landscape Ontario, Professional Lawn Care Association of Ontario, CNLA, OIPMA, PLANET, PLCAA",TRUE,TRUE,Varies based on property size.,No project too small,TRUE,FALSE,,64667,Hometurf Lawn Care Service,3279,2958,94,8.93915,"Weed Control, lawn maintenance, weeding companies, weed companies, weed and pest control,Lawn Maintenance, Lawn Care, Lawn Mowers, Lawn Maintenance Companies, grass cutters, grass cutting, shrub pruning, lawns, a lawns, landscaping, mowing, lawn mowers, mowing lawn, lawn mowing, mowing the lawns, mowing lawns, lawns mowing, yard and garden, maintenance lawn, lawns maintenance, lawncare, service lawn, lawn service, grass mowing, lawn treatment, green grass, lawn repair, grass lawn mowers, lawn & landscape, lawn landscape, a lawn and landscape, landscape and lawn, lawn and landscape, lawn services, yard landscape, lawn maintenance service, lawn service maintenance, landscaping a yard, yard landscaping, lawn maintenance services, maintenance company, grass cutting, maintenance business, lawn business, leaf clean up, fall leaves, hedges ,",7,2012-03-09T16:51:04.000-05:00,hometurf,FALSE,0,0,105,100,FALSE,eb5cc0102fd54f2953313096478d09fec68576b3,TRUE,2022-10-26T17:10:45.000-04:00,TRUE,TRUE,2082311,89.1253686675,397,NA,NA
https://homestars.com/on/georgetown/lawn-maintenance,16,https://homestars.com/on/georgetown/lawn-maintenance?&page=2&,Lawn Maintenance,2893489,https://sprinklercompany.ca/,/companies/2893489-the-sprinkler-company-inc?searched_category_id=397&service_area=2157017,"The Sprinkler Company Inc. specializes in the design, installation and maintenance of automatic lawn and garden watering systems, garden lighting systems for private and commercial property and full services on Landscaping Design. Sprinkler company also offers servicing of all types of existing irrigation systems, including system opening, closure, and repairs. 
***
We provide 5 YEARS WARRANTY FOR ALL OUR INSTALLATIONS.
***
More information on www.SprinklerCompany.ca
***
Please call us for FREE ESTIMATION.
***
Due to the situation with Covid-19, our company has become available online consultation, in some cases it is possible to conduct an online assessment of the planned installation.
The company continue to work officially. If you need help with seasonal Start-Up/Testing of the sprinkler system or any emergency service, we are ready to help you! All our technicians respect the social distance and have all the necessary equipment in the current situation regarding to COVID-19!",the-sprinkler-company-inc,2017-01-26T15:55:48.000-05:00,NA,NA,NA,"IRRIGATION SPRINKLERS,
LED LIGHTING,
SODDING, LANDSCAPING SERVICE",Irrigation/Lighting/Sod/Landscaping,"For Irrigation:""Hunter"" and ""Rain Bird"",
For LED lights: ""Kichler"",
For SOD: ""Kentucky bluegrass""","Irrigation, LED landscape lighting,Landscaping",2005,19,All,yes, $5000000 Commercial general liability,WSIB,TRUE,FALSE,,$90 SERVICE,TRUE,FALSE,5 YEAR,1955913,The Sprinkler Company Inc.,202,170,97,9.85294,"Sprinkler Systems, Fire Sprinkler, Lawn Sprinkler, Garden Sprinkler, underground sprinklers, underground irrigation, irrigation systems, automatic sprinkler systems, what is irrigation, irrigation, sprinkler, sprinklers, irrigation sprinkler, sprinkler irrigation, the irrigation system, irrigation system, irrigation sprinklers, irrigation systems,  systems irrigation, how to sprinkler system, the sprinkler system, what is a sprinkler system, sprinkler system, bird rain, water irrigation, sprinkler systems how to, watering system, ,Landscape Lighting, Outdoor lights, solar light, outdoor lighting for, lighting outdoor, outdoor lighting, outdoor lights, lights for outdoor, the outdoor lights, solar lights, outdoor light, solar lighting, led lighting, outdoor lamps, how to landscape lighting, landscape lighting how to, lighting landscape, landscape and lighting, outdoor lighting lamps, exterior lighting, lights landscape, landscape lights, solar lamps, outside lights, exterior lights, lighting stores, outside lighting, garden lights, outdoor lighting, landscape lamps, lighting garden, landscape lighting outdoor, outdoor landscape lighting, ,Lawn Maintenance, Lawn Care, Lawn Mowers, Lawn Maintenance Companies, grass cutters, grass cutting, shrub pruning, lawns, a lawns, landscaping, mowing, lawn mowers, mowing lawn, lawn mowing, mowing the lawns, mowing lawns, lawns mowing, yard and garden, maintenance lawn, lawns maintenance, lawncare, service lawn, lawn service, grass mowing, lawn treatment, green grass, lawn repair, grass lawn mowers, lawn & landscape, lawn landscape, a lawn and landscape, landscape and lawn, lawn and landscape, lawn services, yard landscape, lawn maintenance service, lawn service maintenance, landscaping a yard, yard landscaping, lawn maintenance services, maintenance company, grass cutting, maintenance business, lawn business, leaf clean up, fall leaves, hedges ,",0,NA,sprinklercompany,FALSE,0,0,121,0,FALSE,5f8fccf0915651e1072cdab764bd7a76519b016c,TRUE,2022-06-20T14:21:06.000-04:00,TRUE,TRUE,2157017,97.6001012185,397,NA,NA
https://homestars.com/on/georgetown/lawn-maintenance,16,https://homestars.com/on/georgetown/lawn-maintenance?&page=2&,Lawn Maintenance,229512,https://weedaway.com/,/companies/229512-weed-a-way?searched_category_id=397&service_area=1814032,"<b>Lawn Care Specialists who guarantee a healthy & green lawn</b>
Weed-A-Way is one of Canada's largest independent, family-owned and operated green lawn care companies. For over 4 decades our professional lawn care and weed control services have served customers in Mississauga, Brampton, Oakville, Burlington, Milton, Georgetown, and Caledon.

Keeping a lawn vibrant, lush green, free of weeds, safe from insects and pests, is a shared responsibility between our professional staff and the home owner whose lawn we care for. A responsibility that we take very seriously and are deeply committed to.

Download our <b><a href= ""http://www.weedaway.com/download-guide.aspx""> Lawn Care Tips </a></b> to stay on top of lawn maintenance.

Now there’s a way to stop thinking ""The grass is greener on the other side""! Weed-A-Way’s premium lawn care products and services will make your dream lawn a stunning reality. Here’s how:

*As industry leaders and certified IPM (Integrated Pest Management) specialists, our lawn care programs utilize the most advanced turf management practices and products.

*Our lawn amendment treatments as well as lawn care programs promote a vibrant landscape.

*Depending upon weather conditions, we use a combination of Liquid and Granular fertilizers. Of course, if you prefer Granular, just let us know.

*We guarantee results with our fertilizer and weed control programs. If after an application stubborn weed persists we'll come back and re-spray at no charge.

<b>Our services consist of the following programs and additional services: </b>

<b>*Basic (Fertilizer & Weed Control) Lawn Care Program</b>

 <b>*Intermediate Organic Lawn Care Program</b>

 <b>*Advanced Lawn Care Program</b>

 <b>*Weed Control:</b> FIESTA: A highly-recommended timely weed control which is composed of iron and is odourless, Fiesta kills the weeds but does not harm the lawn. It is applied by our highly qualified technicians throughout your season long program. Weeds compete with grass and plants for nutrients, water and sunlight. Broadleaf weeds are usually the greatest threat. If not dealt with quickly, they can destroy all your hard work. Effective weed control solutions from Weed-A-Way lawn services will ensure a healthy and vibrant lawn. We have extensive experience in dealing with various types of weeds like dandelion, broadleaf plantain, etc., and know how to deal with each one.

 <b>*Core Aeration:</b> The secret to a lush, green lawn is core aeration. Soil compacts over time and especially with traffic. Core aeration allows nutrients, water and oxygen to reach grass roots more easily. However, lawn aeration is more than just punching holes in the ground. You must have the proper equipment and be willing to set aside a couple of hours for aeration. It’s also important to know when your garden needs core aeration. Weed-A-Way’s lawn services take the trial and error out of grass treatments. We make sure that the grass is always green on your side of the fence. 

 <b>*Grub Treatment:</b> Typically, grubs attack grass roots. A damaged root system results in a poor quality lawn with dirty, yellowish brown patches. Timely grub treatment from Weed-A-Way will avoid the huge expense of replacing your lawn as well as eliminate the threat of skunks and raccoons that feed on them. By using natural grub treatments like nematodes (naturally occurring microscopic worms) to destroy them and alfalfa treatments to stimulate roots, increase growth and drought resistance, our efficient lawn services will ensure a strong and healthy turf. 

 <b>*Crab Grass Control:</b> Crabgrass forms thick clumps of light green leaves that are highly competitive with turf grasses. It turns brownish red in mid to late summer. Timely treatments are the most effective way to deal with crabgrass. Since this lawn problem germinates from seeds in spring it’s extremely important to apply the crabgrass control treatment before germination takes place. 

 <b>*Lime Treatment:</b> In order to have healthy soil that supports grass growth, it is important to maintain the appropriate pH (acidity) balance. Using lime treatment is often the best solution. Although some lawn experts recommend lime treatment before starting a lawn, applications on mature turf also have several benefits. However, in order for your lime treatment to be effective, you must have knowledge of your soil’s pH levels. Our experienced lawn services will analyze a soil sample before applying lime treatment to your grass. We make sure we get it done right. 

 <b>*Surface Insect Control:</b> Chinch bugs, sod webworms, cutworms and other surface insects usually strike in the summer. They are so small and usually buried in the lawn thatch; that’s why it so hard to spot them. Very often insect ridden grass looks dry and you might think it simply needs watering. Since your lawn is already stressed with the heat, drought-like conditions, weeds and traffic, the damage is greater. Weed-A-Way surface insect treatment means identifying your problems quickly and correctly, and then taking the appropriate control measures to eliminate the pests. 

<b>*Overseeding and Core Aeration:</b> Core aeration makes your overseeding efforts worthwhile. By unplugging the soil in a methodical way, you can remove thatch and reduce soil compaction as well as increase success of weed, surface insect and lime treatments. But a significant benefit of core aeration with regard to overseeding is that it allows the nutrients to reach the seeds and roots faster. Our expert lawn services can handle your overseeding and core aeration requirements to ensure proper effectiveness.",weed-a-way,2008-01-23T10:37:56.000-05:00,NA,,,,,,,1976,20,"Visa/Masercard, Online Banking",,,BBB Acreditation,TRUE,FALSE,,,TRUE,FALSE,,79886,Weed A Way Ltd.,349,270,44,8.38889,"Lawn Maintenance, Lawn Care, Lawn Mowers, Lawn Maintenance Companies, grass cutters, grass cutting, shrub pruning, lawns, a lawns, landscaping, mowing, lawn mowers, mowing lawn, lawn mowing, mowing the lawns, mowing lawns, lawns mowing, yard and garden, maintenance lawn, lawns maintenance, lawncare, service lawn, lawn service, grass mowing, lawn treatment, green grass, lawn repair, grass lawn mowers, lawn & landscape, lawn landscape, a lawn and landscape, landscape and lawn, lawn and landscape, lawn services, yard landscape, lawn maintenance service, lawn service maintenance, landscaping a yard, yard landscaping, lawn maintenance services, maintenance company, grass cutting, maintenance business, lawn business, leaf clean up, fall leaves, hedges ,",0,2010-12-20T10:04:20.000-05:00,weedaway,FALSE,0,0,49,100,FALSE,3bfd47af91e2f14e8f6aa6e82c4a3375985ac1f0,TRUE,2022-02-14T09:43:13.000-05:00,TRUE,TRUE,1814032,81.9345988986,397,NA,NA
https://homestars.com/on/georgetown/lawn-maintenance,16,https://homestars.com/on/georgetown/lawn-maintenance?&page=2&,Lawn Maintenance,2925089,http://greenbladelawncare.ca,/companies/2925089-green-blade-lawn-care?searched_category_id=397&service_area=2184791,"An owner-operated company since 1983, provides green lawn care services to the Brampton, Milton, Mississauga, Oakville and Burlington areas. At Green Blade Lawn Care, we are committed to providing you with a beautiful, green, weed-free and insect-free lawn. Our guarantee is that we will work with you to create an organic, vibrant, deep-green lawn that will be the envy of all your neighbours. As our slogan promises, “The Grass is Always Greener on the Green Blade Side.”

Whether you are a new or continuing client, when you subscribe to our full year program, our staff is always happy to do touch-ups with our weed control product until you are happy! So, please feel free to talk to our staff, and it will be our pleasure to inform you of your role in helping us cultivate your beautiful, green, healthy lawn. We apply the highest quality fertilizer and weed control products and we provide seasonal aeration. Whenever concerns or questions about your lawn’s health arise, please call us at Green Blade Lawn Care and we’ll be happy to answer questions, diagnose specific problems and provide a solution to your lawn’s specific needs.

Let’s work together!",green-blade-lawn-care,2018-12-10T13:40:06.000-05:00,NA,NA,NA,,"Lawn Fertilizing | 
Weed Control | 
Micronutrient Treatment | 
Lawn Inspection | 
Greenest Lawn Guarantee | 
Core Aeration | Grub Control
Seeding Services | Crab-Grass | Lime Treatments",,Weed Control | Core Aeration | Grub Control |  Crab-Grass | Lime Treatments,NA,NA,,,,,FALSE,FALSE,,,FALSE,FALSE,,1987263,Green Blade Lawn Care,50,46,1,9.8913,"Lawn Maintenance, Lawn Care, Lawn Mowers, Lawn Maintenance Companies, grass cutters, grass cutting, shrub pruning, lawns, a lawns, landscaping, mowing, lawn mowers, mowing lawn, lawn mowing, mowing the lawns, mowing lawns, lawns mowing, yard and garden, maintenance lawn, lawns maintenance, lawncare, service lawn, lawn service, grass mowing, lawn treatment, green grass, lawn repair, grass lawn mowers, lawn & landscape, lawn landscape, a lawn and landscape, landscape and lawn, lawn and landscape, lawn services, yard landscape, lawn maintenance service, lawn service maintenance, landscaping a yard, yard landscaping, lawn maintenance services, maintenance company, grass cutting, maintenance business, lawn business, leaf clean up, fall leaves, hedges ,",0,2018-12-17T18:29:00.000-05:00,greenblade,FALSE,0,0,2,0,FALSE,0c57c31d2d04b98a5e9d3727771c38ece006981e,TRUE,2022-09-22T18:56:45.000-04:00,TRUE,TRUE,2184791,96.2496527143,397,NA,NA
