Link,n_hits,all_links,category,id,url,hs_path,profile,permalink,created_at,sic_code,service_area,hours,products,services,brands,specialities,established,employee_cnt,payment_method,diplomas,licenses,memberships,liability_insurance,bonded,project_rate,project_minimum,written_contract,written_warranty,warranty_terms,parent_company_id,name,total_number_of_reviews_cache,total_number_of_approved_reviews_cache,number_of_photos_cache,avg_rating_cache,categories_info_cache,savings_count,claimed_at,subdomain,fraudulent,fraudulent_count,total_number_of_pending_reviews_cache,images_count,completion_percent_cache,bully,secret,replied_to_at_least_one_review_cache,latest_approved_review_created_at,has_set_tasks,lead_purchase_eligible,service_area_id,star_score,quote_button_category,direct_phone,direct_contact
https://homestars.com/on/salem/alarm-systems,6,https://homestars.com/on/salem/alarm-systems,Alarm Systems,2780177,http://www.DeluxeAlarms.com,/companies/2780177-deluxe-alarms?searched_category_id=303&service_area=2058524,"Deluxe Alarms provides the best in home alarm systems to protect your home, family and loved ones.  With over a decade of know-how, we are the business families in the greater Toronto and surround areas have trusted for years to keep their homes and families protected. Never worry about your safety when you can have peace of mind delivered with Deluxe Alarms home security. When it comes to your home alarm, you can count on Deluxe Alarms to provide complete 24/7 safety.

Built into our service is the latest in home monitoring systems. We include emergency notification for your home with a fast response time for any kind of emergency from a prowler in your house to an unanticipated flood while you are away from home. 

Our home security alarm systems may also provide peace of mind with our special medical alert system. If you or a loved one is home alone with a health condition or at an age where the ability to call for help could be critical, we can help. This state of the art medical assistance system can aid anyone recovering from illness or facing lost mobility from aging to stay independent but always within reach of medical assistance. It can mean being able to enjoy life to the fullest and still have help available in an instant when needed.

Deluxe Alarms can create the right security package for your home. We offer complete home wiring packages, cell phone connections that allow you to monitor your homes safety from a distance (smart home monitoring), and security certificates that will bring your home insurance down and a wireless security system that works independent of the power grid to keep your home secure even in blackout conditions. We can deliver a home alarm security system for the best security money can buy at an affordable price only from Deluxe Alarms.  
",deluxe-alarms,2010-07-16T14:16:36.000-04:00,NA,"GTA, Vaughan, Toronto, Bradford, Kingston, Newmarket, Brooklyn, Ajax, Pickering, Caledon, Vaughan, Georgetown, Brampton, Milton, Halton Hills, Mississauga, Woodbridge, Oakville, Burlington and more.",,Home and Business Alarm Systems,,,,NA,NA,,,,,TRUE,TRUE,,,TRUE,FALSE,,1843229,Deluxe Alarms,809,654,5,9.29205,"Alarm Systems, Home Alarm Systems, Alarm System Monitoring, Fire Alarm Systems, Home Security Systems, The Alarm, At Home Security, Home Security, Security Systems, Alarm Security, Security Alarm, Security Cameras, Security Company, Security Companies, Home alarm, Alarm home, Alarm security, House security, house alarm, burglar alarm, carbon monoxide, carbon monoxide alarms, business cameras, commercial surveillance systems, surveillance, commercial security cameras, commercial security camera,,Home Automation, Home Automation System, Wireless Home Automation, Home Automation Software, Smart Homes, wire, x10, home theatre, home security security, in home security, home security home, at home security, home security, home home security, control 4, wireless home, light control, the smart home, smart home, a smart home, home smart home, in home security systems, home security systems, security systems home, security systems for home, security systems for the home, home security system, security system home, home system security, security home system, security system for home, in home security system, house of security, in home automation, automation home, about home automation, what is home automation, how to home automation, home automation how to, automation for home, smart house, crestron, automation house, house automation, house of automation, smart homes, automation system, homeautomation, i home remote, remote home, TV Install, TV Wall Mounting, Ceiling Speaker Automation, Ceiling Speaking Installation,Home Theater, Home Theatre System, Home Theatre Projector, Home Theatre Seating, Audio System, electronics, flat panel screen TV stereo, plasma, LCD, home theater how to, home theater home theater, home theatre, theatre home, home cinema, home theater system, home theatre system, surround sound, home theaters, home theaters system, home theater systems, home theatre systems, home theater 5.1, 5.1 home theater, home movie theater, in home movie theater, surround sound systems, samsung home theater, home theater samsung, home theater speaker, home theater lg, lg home theater, home theater best, best home theater, home theater wireless, wireless home theater, surround sound speakers, home theater blu ray, home theater with bly ray, bly ray home theater, speakers for home theater, home theater speakers, speakers home theater, philips home theater, 5.1 home theater system, home theater system 5.1, dvd home theater, bluray home theater, home theatre samsung, home audio systems, home theater receiver, receiver home theater, home theater review, home sounds systems, home theater price, home theater reviews, projectors home theater, antenna, antennas, home theatre, home theater, TV Install, TV Wall Mounting, Ceiling Speaker Automation,
Ceiling Speaking Installation,",0,2011-11-30T15:22:18.000-05:00,deluxealarms,FALSE,0,0,7,100,FALSE,c37cb2e86c85ca1d639b23cdb893eeb876ce95c2,FALSE,2022-05-24T11:20:08.000-04:00,TRUE,TRUE,2058524,80.9277224918,303,NA,NA
https://homestars.com/on/salem/alarm-systems,6,https://homestars.com/on/salem/alarm-systems,Alarm Systems,2783374,https://www.cspalarms.ca/,/companies/2783374-canadian-security-professionals?searched_category_id=303&service_area=2188147,"Canadian Security Professionals is one of the largest Canadian owned and operated Alarm System companies. We provide security and peace of mind for Canadian homes and businesses. Here at CSP we give special promotional offers on the newest and best Security Systems and Smart Home Systems. We are proud to be 100% Canadian with all of our monitoring, customer service, and tech support located in Canada. 

Alarm Systems, Home Alarm Systems, Business Alarm Systems, Security Systems, Home Security Systems, Business Security Systems, Smart Home Systems, Home Automation Systems, Security Cameras, Buy a Security System, Buy an Alarm System, GSM Security System, Wireless Security System, Wireless Alarm Systems, Motion Sensor Alarm Systems, Motion Senor Security, Wireless Security Cameras, Alarm System Door Contacts, Smart Home Alarm System, Interactive Security Systems, Best Alarm Systems, Best Security Systems, Top Alarm Company",canadian-security-professionals,2011-01-09T23:17:31.000-05:00,NA,All of Ontario and Lower Mainland British Columbia,,"Alarm Systems, Home Alarm Systems, Business Alarm Systems, Security Systems, Home Security Systems, Business Security Systems, Smart Home Systems, Home Automation Systems, Security Cameras, Buy a Security System, Buy an Alarm System, GSM Security System, Wireless Security System, Wireless Alarm Systems, Motion Sensor Alarm Systems, Motion Senor Security, Wireless Security Cameras, Alarm System Door Contacts, Smart Home Alarm System, Interactive Security Systems, Best Alarm Systems, Best Security Systems, Top Alarm Company","Install Alarm Systems, Service Alarm Systems, Install Security Systems, Service Security Systems, Home Security, Business Security, Alarm System Monitoring, Security System Monitoring, Alarm Monitoring, Alarm System Phone Apps, Security System Installation, Upgrade Home Alarm System, Upgrade Security System","CSP, Alarm.com, 2GIG, Qolsys, DSC, Hikvision, Weiser, Skybell, Liftmaster",,2010,NA,"Mastercard, Visa, AMEX, Cheque, Money Order, Cash",,,,TRUE,FALSE,,,TRUE,FALSE,Lifetime Warranty,1846426,Canadian Security Professionals,410,234,10,9.75214,"Alarm Systems, Home Alarm Systems, Alarm System Monitoring, Fire Alarm Systems, Home Security Systems, The Alarm, At Home Security, Home Security, Security Systems, Alarm Security, Security Alarm, Security Cameras, Security Company, Security Companies, Home alarm, Alarm home, Alarm security, House security, house alarm, burglar alarm, carbon monoxide, carbon monoxide alarms, business cameras, commercial surveillance systems, surveillance, commercial security cameras, commercial security camera,,",1,2011-01-09T23:17:33.000-05:00,cspalarms,FALSE,0,0,12,NA,FALSE,8836da7a8af6d956d2b4930fee24451f872bfb1c,TRUE,2020-11-05T17:21:54.000-05:00,TRUE,TRUE,2188147,97.6297368434,303,NA,NA
https://homestars.com/on/salem/alarm-systems,6,https://homestars.com/on/salem/alarm-systems,Alarm Systems,2970152,https://www.telus.com/en/smarthome-security/?CMP=aff_shs_aware_homestars,/companies/2970152-telus-smarthome-security?searched_category_id=303&service_area=2295259,"TELUS is Canada’s #1 home security provider (based on number of subscribers). 

Enjoy the peace of mind and control that comes with TELUS SmartHome Security.

Protect Your Home and Family
Keep an eye on what’s happening in and around your home in real-time, no matter where you are, with Indoor and Outdoor security cameras. You can also view recorded videos as well. 

Smart locks let you lock and unlock your door right from your smartphone. So whether you are leaving the house, or just climbing into bed, you never have to wonder if you forgot to lock the door.

Answer your door even if you’re not home, with a Wi-Fi doorbell camera. You can see and speak with whoever is at the door, even if you are at work or on vacation. 

You can get help when you need it - with 24/7 professional monitoring, you’ll get notifications if unexpected events occur, and our security experts are ready to send emergency services if needed.

Control Your Home with Your Voice or Smartphone
From your smartphone, you can use Amazon Alexa (with TELUS Home Assistant) or Siri to turn on your lights, warm up or cool down your home, arm your SmartHome security system, open or close your garage door, and so much more. 



Save Money on Insurance
According to The Electronic Security Association website alarm.org,  you can save up to 20% on home insurance with a professionally installed 24/7 home monitoring system. 

You can also save up to 6% on your heating bill with smart home automation devices - like a smart thermostat. Better for your wallet and mother nature.


Flexible Installation Options
You can do it yourself - self-install your system on your own time with our online guidance. Or we can do it for you - our professional technicians will safely install your order.
",telus-smarthome-security,2022-07-04T13:00:08.000-04:00,NA,NA,NA,"Security Cameras, Security Sensors, Hazard Detection, Home Automation, Control Panels","Security Cameras, Indoor Camera, Outdoor Camera, Doorbell Camera, Smart Thermostat, Smart Door Lock, Smart Garage Door Opener, Smart Plug, Smart Light Bulb, SmartHome Security Control Panel, Carbon Monoxide Detector, Flood Sensor, Glass Break Sensor, Smart Smoke Sensor, Motion Sensor, Window & Door Sensor, Home Automation, Home Monitoring, Home Alarm System, Smart Home, Professional Home Monitoring, Custom Home Security, Custom Home Monitoring",TELUS SmartHome Security,,1990,5000,,,,,FALSE,FALSE,,,TRUE,FALSE,https://www.telus.com/en/support/article/home-automation-service-terms,2032063,TELUS - SmartHome Security,6,4,6,9.5,"Alarm Systems, Home Alarm Systems, Alarm System Monitoring, Fire Alarm Systems, Home Security Systems, The Alarm, At Home Security, Home Security, Security Systems, Alarm Security, Security Alarm, Security Cameras, Security Company, Security Companies, Home alarm, Alarm home, Alarm security, House security, house alarm, burglar alarm, carbon monoxide, carbon monoxide alarms, business cameras, commercial surveillance systems, surveillance, commercial security cameras, commercial security camera,,Home Automation, Home Automation System, Wireless Home Automation, Home Automation Software, Smart Homes, wire, x10, home theatre, home security security, in home security, home security home, at home security, home security, home home security, control 4, wireless home, light control, the smart home, smart home, a smart home, home smart home, in home security systems, home security systems, security systems home, security systems for home, security systems for the home, home security system, security system home, home system security, security home system, security system for home, in home security system, house of security, in home automation, automation home, about home automation, what is home automation, how to home automation, home automation how to, automation for home, smart house, crestron, automation house, house automation, house of automation, smart homes, automation system, homeautomation, i home remote, remote home, TV Install, TV Wall Mounting, Ceiling Speaker Automation, Ceiling Speaking Installation,",0,2022-07-04T13:15:37.000-04:00,Telus,FALSE,0,0,6,0,FALSE,ddeb6ba038b91b3462a729205f563774fd7080a3,TRUE,NA,TRUE,TRUE,2295259,84.4934613628,303,NA,NA
https://homestars.com/on/salem/alarm-systems,6,https://homestars.com/on/salem/alarm-systems,Alarm Systems,2912494,http://www.correctfireandsecurity.ca,/companies/2912494-correct-fire-security?searched_category_id=303&service_area=2155646,"Established in 1997, Correct Fire & Security is proud to be a family owned & operated business. With this, we understand the importance of protecting what matters most to you:    your family.

Our business model is an old fashioned one where 'customer service comes first', so you can rest assured that we will be here for you day or night. 

All of our systems are monitored by ULC accredited monitoring stations. The monitoring stations have direct links to Police, Fire and Ambulance in your jurisdiction.

Correct Fire & Security offers you a full range of services to protect you and your family. With Correct Fire & Security protecting your home, we'll ""Help you sleep peacefully"" with the knowledge that you're doing your best and providing the utmost protection for the people and things that matter most.  

Please feel free to contact us with any questions or concerns at 1-866-308-8412 or 519-928-9900",correct-fire-security,2018-03-16T16:15:33.000-04:00,NA,NA,NA,NA,NA,NA,NA,NA,NA,NA,NA,NA,NA,FALSE,FALSE,NA,NA,FALSE,FALSE,NA,1974679,Correct Fire & Security,0,0,0,NA,"Alarm Systems, Home Alarm Systems, Alarm System Monitoring, Fire Alarm Systems, Home Security Systems, The Alarm, At Home Security, Home Security, Security Systems, Alarm Security, Security Alarm, Security Cameras, Security Company, Security Companies, Home alarm, Alarm home, Alarm security, House security, house alarm, burglar alarm, carbon monoxide, carbon monoxide alarms, business cameras, commercial surveillance systems, surveillance, commercial security cameras, commercial security camera,,",0,2018-03-16T16:16:13.000-04:00,NA,FALSE,0,0,0,0,FALSE,91c2feb862c1647144477f2b9d16a8c8d31b6bb7,FALSE,NA,FALSE,FALSE,2155646,-1.0,303,NA,NA
https://homestars.com/on/salem/alarm-systems,6,https://homestars.com/on/salem/alarm-systems,Alarm Systems,224335,NA,/companies/224335-shield-security?searched_category_id=303&service_area=1800682,NA,shield-security,2008-01-23T10:35:32.000-05:00,NA,NA,NA,NA,NA,NA,NA,0,0,NA,NA,NA,NA,FALSE,FALSE,NA,NA,FALSE,FALSE,NA,75641,Shield Security,0,0,0,NA,"Alarm Systems, Home Alarm Systems, Alarm System Monitoring, Fire Alarm Systems, Home Security Systems, The Alarm, At Home Security, Home Security, Security Systems, Alarm Security, Security Alarm, Security Cameras, Security Company, Security Companies, Home alarm, Alarm home, Alarm security, House security, house alarm, burglar alarm, carbon monoxide, carbon monoxide alarms, business cameras, commercial surveillance systems, surveillance, commercial security cameras, commercial security camera,,",0,NA,NA,FALSE,0,0,0,NA,FALSE,NA,FALSE,NA,FALSE,FALSE,1800682,-1.0,303,NA,NA
https://homestars.com/on/salem/alarm-systems,6,https://homestars.com/on/salem/alarm-systems,Alarm Systems,2912073,NA,/companies/2912073-correct-fire-and-security?searched_category_id=303&service_area=2154751,NA,correct-fire-and-security,2018-03-11T20:47:26.000-04:00,NA,NA,NA,NA,NA,NA,NA,NA,NA,NA,NA,NA,NA,FALSE,FALSE,NA,NA,FALSE,FALSE,NA,1974258,Correct Fire and Security,0,0,0,NA,"Alarm Systems, Home Alarm Systems, Alarm System Monitoring, Fire Alarm Systems, Home Security Systems, The Alarm, At Home Security, Home Security, Security Systems, Alarm Security, Security Alarm, Security Cameras, Security Company, Security Companies, Home alarm, Alarm home, Alarm security, House security, house alarm, burglar alarm, carbon monoxide, carbon monoxide alarms, business cameras, commercial surveillance systems, surveillance, commercial security cameras, commercial security camera,,",0,NA,NA,FALSE,0,0,0,0,FALSE,NA,FALSE,NA,FALSE,FALSE,2154751,-1.0,303,NA,NA
