Link,n_hits,all_links,category,id,url,hs_path,profile,permalink,created_at,sic_code,service_area,hours,products,services,brands,specialities,established,employee_cnt,payment_method,diplomas,licenses,memberships,liability_insurance,bonded,project_rate,project_minimum,written_contract,written_warranty,warranty_terms,parent_company_id,name,total_number_of_reviews_cache,total_number_of_approved_reviews_cache,number_of_photos_cache,avg_rating_cache,categories_info_cache,savings_count,subdomain,fraudulent,fraudulent_count,total_number_of_pending_reviews_cache,images_count,completion_percent_cache,bully,secret,replied_to_at_least_one_review_cache,latest_approved_review_created_at,has_set_tasks,lead_purchase_eligible,service_area_id,star_score,quote_button_category,direct_phone,direct_contact,claimed_at
https://homestars.com/on/nisku/solar-water-heating,5,https://homestars.com/on/nisku/solar-water-heating,Solar Water Heating,2639085,https://www.robsalbertan.ca,/companies/2639085-rob-s-albertan-service-experts?searched_category_id=486&service_area=1652289,"No one takes care of  Edmonton's HVAC repair needs like Service Experts Heating & Air Conditioning. We offer NATE-certified heating and cooling technicians to service ALL makes and models of HVAC equipment, such as Lennox, Rheem, Trane, Carrier and York to name just a few.

Our trained HVAC specialists are available to service all of your HVAC installation and maintenance needs and we offer HVAC service plans to make sure your heating and cooling equipment perform well, all year long. Service Experts Heating & Air Conditioning is not just your Edmonton air conditioning and furnace repair solution. We also specialize in other home services such as duct cleaning.

<b>The Heating, Air Conditioning & Air Quality Leaders </b>

As the HVAC industry leader we can do what no one else can - deliver a complete range of heating, air conditioning and air quality products and HVAC maintenance services to assure your home comfort.

We're also an official ENERGY STAR® Retail Partner, proudly providing the highest level of comfort and utility savings via our selection ENERGY STAR qualified central heating and air conditioning systems.

So whether you need furnace repair service, furnace maintenance or a new, high-efficiency heating system, call us today. You'll be glad you did. We guarantee it 100%, in writing.

*Accent Heating Service Experts is now Service Experts Heating & Air Conditioning",rob-s-albertan-service-experts,2008-03-04T16:55:15.000-05:00,NA,Edmonton,,,,,,1983,42,,,,,TRUE,TRUE,,,TRUE,FALSE,,1702137,Rob's Albertan Service Experts,74,55,10,8.41818,"Heating & Air Conditioning, Air Conditioning Installation, Air Conditioning Repair, Heating Oil, Heating System, heat, furnace, a/c, air conditioning, air conditioner, ac air conditioning, air conditioners, furnace, furnaces, airconditioner, lenneox, airconditioning, hvac, what is hvac, air condition, trane, hvac air conditioning, air conditioning hvac, a heating and air, air heating, heating & air, heating and air, heating air, heat pump, air conditioning units, air conditioning unit, unit air conditioning, air conditioner unit, air conditioner units, heating & cooling, heating and cooling, heating cooling, cooling and heating, system heating, heating system, air conditioning cooling, heat and air, heat air, heat & air, air and heat, air conditioning and heating, heating and air conditioning, air conditioning heating, air conditioning & heating, a and a heating and air conditioning, heating air conditioning, heat pumps, airconditioners, systems heating, heating systems, portable air conditioner, cooling system, Furnace Humidifier,  heating and cooling contractors, heat pump installation, home heating, heating ventilation and air conditioning, hvac industry, residential heat pump, heating services, heating contractor, homes heating, central heat, heat sources,  new heating systems, industrial air conditioning, radiant floor heating,  floor heating, central cooling and heating systems, residential heating, heat pump installers,  thermostat, in floor heating, ductless heat pump, programmable thermostat, mini split heat pump, heated floors, hvac systems, hvac technician, what is a heat pump, climate control, what does hvac stand for, electric heating, electric floor heating, new furnace, heat and temperature, h vac, heatpump, hvac design, electric heat, central heating, hvac engineer, home heating systems, hvac supply, thermo stat, heat pumps prices, heat pump efficiency, split heat pump, hvac maintenance, in floor heating cost, electric heat pumps, boiler heating systems, hvac unit, hvac mechanic, hvac repair, commercial hvac, hvac installation, heated tile floor, hvac specialist, hvac services, types of heating systems, hvac tech, air con unit,  air conditioner, canada air conditioner, air condition unit, air conditioning canada, portable air conditioner, room air conditioning, mobile air conditioning, portable ac, indoor air conditioner,Solar Panels, Solar Panels, Solar Panel, ,Solar Water Heating, Solar Water Heating, Solar Water Heating Installation, Heating,",4,RobsAlbertan,FALSE,0,0,11,NA,FALSE,f839c5fa42f5ff30da7cae1a817c6082d9e115d5,TRUE,2017-04-19T19:47:29.000-04:00,TRUE,TRUE,1652289,78.8065589666,486,NA,NA,2010-06-18T00:51:12.000-04:00
