Link,n_hits,all_links,category,id,url,hs_path,profile,permalink,created_at,sic_code,service_area,hours,products,services,brands,specialities,established,employee_cnt,payment_method,diplomas,licenses,memberships,liability_insurance,bonded,project_rate,project_minimum,written_contract,written_warranty,warranty_terms,parent_company_id,name,total_number_of_reviews_cache,total_number_of_approved_reviews_cache,number_of_photos_cache,avg_rating_cache,categories_info_cache,savings_count,claimed_at,subdomain,fraudulent,fraudulent_count,total_number_of_pending_reviews_cache,images_count,completion_percent_cache,bully,secret,replied_to_at_least_one_review_cache,has_set_tasks,lead_purchase_eligible,service_area_id,star_score,quote_button_category,direct_phone,direct_contact
https://homestars.com/on/dunrobin/renewable-energy,1,https://homestars.com/on/dunrobin/renewable-energy,Renewable Energy,2966152,https://www.xolar.ca,/companies/2966152-xolar-inc?searched_category_id=461&service_area=2275638,"Xolar is a full service turn-key platform for transitioning residential clients to solar energy. We support our clients with our done-for-you approach, taking you all the way from project design to construction.  We have completed projects all over Ontario, and have many happy customers.  Our customer referral program allows your system to pay for itself in more ways than one.

Visit our website at www.xolar.ca
Check out our work on instagram @xolar.energy",xolar-inc,2022-03-20T21:53:38.000-04:00,NA,NA,NA,Solar Panels,"Turnkey Installation
Maintenence
Electrical Contracting","Solar Edge
SMA",Turnkey Service,2021,9,Credit card or cheque,,Electrical Contracting License # 7016070,Electrical Safety Authority,TRUE,FALSE,"$20,000 to $40,000+ Turnkey installatin",5KW Minimum installation,TRUE,FALSE,Standard 1 year installation labor warranty,2028077,XOLAR INC,3,3,14,10,"Renewable Energy, eco energy, green solar panels geothermal tankless sustainable sun wind biofuel air turbines micro hydro ocean photovoltaic, solar panels, solar panel, solar cells, wind turbines, renewable, energy solar, about solar energy, solar energy, what is solar energy, what are renewable energy, energy renewable, what renewable energy, what is renewable energy, about renewable energy, renewable energy is, what is the renewable energy, what is a renewable energy, why renewable energy, what is wind energy, wind energy, wind power, efficiency energy, solar pv, renewables energy, renewableenergy, energy resources, source of energy, energy system, sources of energy, energy sources, what is green energy, green energy, alternative energy, alternative energy, sustainable energy, new energy, clean energy, green power, ,Solar Panels, Solar Panels, Solar Panel, ,",0,2022-03-20T21:53:58.000-04:00,xolar,FALSE,0,0,14,0,FALSE,8c8f78af50081a7367f6ef517dab0c507262e7c5,TRUE,TRUE,TRUE,2275638,90.7664835165,461,NA,NA
