Link,n_hits,all_links,category,id,url,hs_path,profile,permalink,created_at,sic_code,service_area,hours,products,services,brands,specialities,established,employee_cnt,payment_method,diplomas,licenses,memberships,liability_insurance,bonded,project_rate,project_minimum,written_contract,written_warranty,warranty_terms,parent_company_id,name,total_number_of_reviews_cache,total_number_of_approved_reviews_cache,number_of_photos_cache,avg_rating_cache,categories_info_cache,savings_count,claimed_at,subdomain,fraudulent,fraudulent_count,total_number_of_pending_reviews_cache,images_count,completion_percent_cache,bully,secret,replied_to_at_least_one_review_cache,latest_approved_review_created_at,has_set_tasks,lead_purchase_eligible,service_area_id,star_score,quote_button_category,direct_phone,direct_contact
https://homestars.com/on/becker/home-additions,25,"c(""https://homestars.com/on/becker/home-additions?&page=2&"", ""https://homestars.com/on/becker/home-additions?&page=3&"")",Home Additions,2721303,http://www.homeimprovementpeople.com,/companies/2721303-home-improvement-people?searched_category_id=378&service_area=2126387,"The Home Improvement People have completed literally thousands of renovations since our inception. We are a unique award winning contracting company, consulted by various media as industry experts. 
Please view our website at homeimprovementpeople.com to view images of some of our projects. 
For our clients' convenience, we've implemented progress billing as well as financing.
Regardless of scope, we approach every single home renovation with a foundation of strong design aesthetics, comprehensive product options, sound project management, and a commitment to craftsmanship.
 
Our projects range from remodelled bathrooms and kitchens, to rear additions,  hardwood flooring, basements, second story additions and other extensive renovations. We undertake work in all budget ranges.
 
Choosing a reputable contractor is the most important decision you will make regarding your renovation. From plans and permits, to last little finishing details, The Home Improvement People is committed to completing your renovations and home improvements in a professional manner and to your complete satisfaction.
We take pride in our personalized service and our high quality workmanship. 
Call us for quality, insured work - completed on time, and on budget.
416-782-7605.",home-improvement-people,2008-03-04T16:55:15.000-05:00,NA,"Ajax,Cobourg,Mississauga,Stouffville Aurora,Courtice,Newmarket,Thornhill Barrie,Etobicoke,North York,Toronto Bolton,Georgetown,Oakville,Vaughan Brampton,Hamilton,Paris,Whitby Brantford ,Kitchener,Pickering Burlington,Maple,Richmond Hill, Willowdale, Caledon, Markham Scarborough,Woodbridge Cambridge,Milton,North York ",,,,,,2002,80,Visa/MC/Cheque,,All ,,TRUE,TRUE,,,TRUE,FALSE,3 years,1784355,Home Improvement People Inc.,661,502,234,9.80279,"General Contractors, Residential General Contractor, Building Contractor, Additions, Remodeling Contractor,  Renovation, Builder, building construction, renovation, remodeling, construction builders, construction company, construction companies, home repair, construction jobs, home remodeling, general contractors, contractors general, contractor general, contractors construction, construction contractors, home improvement and remodeling, kitchen remodeling, construction contractor, builders contractors, home renovation, general contracting, building contractors, building companies, home renovations, builder contractor, building contractor, remodeling contractor, commercial construction, residential construction, house contractor, concrete contractors, home contractors, general construction, construction general, contractors remodeling, remodeling contractors, remodelers, remodel contractor, remodel contractors, general contract, commercial contractors, renovations contractors, home improvement contractor, licensed contractor, license general contractor, mud room, mudroom, caulking, ,Design/Build, Contracting, Renovation, Remodeling, Restoration, Project Management, Renovation Assistance, Reno Management, architect, architects, design build, build & design, design and build, build by design, design to build. building construction, building a house, house designs, house plans, home designs, house plan, how to design a house, design house, house design, remodeling, building and design, design for building, design building, building by design, a building design, design of building, building design, design a building, building & design,  playsets, playground, wooden playset, wooden playground, play set, ,Basement Renovation, Basement renovation, Basement remodeling, Basement remodelling, renovating your basement, renovation, waterproofing, remodeling, home renovation, house renovation, water in basement, basement waterproofing,finishing basement, moistureproof, remodeling the house, caulking,Kitchen & Bathroom - Cabinets & Design, Kitchen Cabinet And Counter, Kitchen Cabinet Hardware, Bathroom Cabinet, Bathroom Wall Cabinet, Bathroom Sink Cabinet, cabinets, kitchens, cabinetry, kitchen and cabinets, cabinets for kitchen, about kitchen cabinets, kitchen cabinets, kitchen cabinets in, cabinets for the kitchen, cabinets and kitchen, cabinets kitchen, kitchen cabinet, cabinet kitchen, the kitchen cabinet, kitchen by design, design kitchen, a kitchen design, design a kitchen, design for kitchen, design and kitchen, design by kitchen, kitchen design, cabinetry kitchen, kitchen cabinetry, designs kitchen, kitchen designs, bathroom vanities, vanity and bathroom, bath and vanity, designer kitchen, ,Kitchen Planning & Renovation, Kitchen Planning And Design, Kitchen Cabinet Planning, Kitchen Design, Kitchen Remodeling, kitchen or, and bathroom, a and a kitchens, kitchens and, for kitchens, a kitchens, kitchens, the house design, cabinets for kitchen, cabinets for the kitchen, cabinets and kitchen, kitchen cabinets, design a kitchen, about kitchen design, a kitchen design, how to kitchen design, design and kitchen, the kitchen design, design for kitchen, kitchen designs, renovation and remodeling, remodeling and renovation, kitchen designer,,Kitchen Renovation, caulking, ,Condominium Renovations, Condo, Apartment, remodeling, renovations, kitchen cabinet, home decor, condo apartments, home improvement, home improvements, remodeling home, home remodeling, remodeling a home, new condo, Condo facelift, 
I ,Condo RenovationsRenovations for a new condo that include removing a drywall and creating an island and a full kitchen remodeling. ,Small rodent in Attic,Bathroom Renovation, Bathroom renovation, bathroom remodeling, bathroom remodelling, renovating the bathroom, tearing out the bathroom, fixing up the bathroom, bathroom contractors, bathroom vanities, bathroom vanity, design of bathroom, bathroom and design, design for bathroom, design a bathroom, design a bath, bath design, bathroom tile, bathroom cabinets, remodeling a bathroom, bathroom remodeling, remodeling the bathroom, ,Bath renovation, New tub, caulking, ,Builders, Home Builders, Home Contractors, residential builders, home construction companies, residential building contractor, builder, construction builders, local home builders, custom home builders, master builders, general builders, new home builders, building contractors, custom home builders, luxury home builders, ,Cabinetry & Millwork, Kitchen Cabinetry, Custom Cabinetry, Bathroom Cabinetry, Architectural Millwork, Millwork, custom millwork, bathroom cabinets, Kitchen cabinets, built-in cabinets, built-in cabinetry,  cabinet makers, custom cabinets kitchen, cabinetry, thomasville kitchen cabinets, cabinet doors, millwork cabinetry, custom kitchen cabinets, kraftmaid cabinets, maple cabinets, wood cabinets, stock cabinets, thermofoil cabinets, laminate cabinets, kitchen cabinets design, cherry cabinets, kitchen cabinet designs, hickory cabinets, wholesale cabinets, custom made cabinets, cabinet millwork, cabinets kitchen, kitchen cabinetry, millwork cabinets, ready to assemble cabinets, quality cabinets, bamboo cabinets, caulking,
,Home Additions, General contractor, home improvement, building addition, home expansion, house expansion, house building, plans house, house plans from, plans for house, the house plans, house plans, renovation, in house design, home plans house, home house plans, house home plans, house plans home, remodeling, house plans and designs, designs house plans, house designs plans, house plans designs, home plans and designs, home designs plans, floor plans, house build, renovations, plans for building, kitchen cabinets, remodel, kitchen design, house plans for building, house plans building, ,Design/Project Management, Drafters, Drafting, Project Management, Building, General Contracting, Renovation Management, Project Manager, Design Management.,",0,2017-04-05T10:18:55.000-04:00,TheHIP,FALSE,0,0,279,100,FALSE,7fbc45f3170f9c9c4247a2eca79f1488f75c5fa0,TRUE,2022-09-09T20:23:14.000-04:00,TRUE,TRUE,2126387,95.8305828224,378,NA,NA
https://homestars.com/on/becker/home-additions,25,"c(""https://homestars.com/on/becker/home-additions?&page=2&"", ""https://homestars.com/on/becker/home-additions?&page=3&"")",Home Additions,2801413,http://www.npcrenovations.com,/companies/2801413-NPC-Building-and-Renovations-Limited?searched_category_id=378&service_area=2052587,"     Office: (289) 670 2494   Cell: (647) 407 2602      

NPC Building and Renovations Limited is a fully licensed Renovation Company. Meeting the needs of clients is our goal. We are pleased to provide personalized service, custom designs and work one-on-one with all our clients to ensure that the final product is just as they envisioned. Our professional workers will work diligently to ensure the quality of our work.",NPC-Building-and-Renovations-Limited,2012-09-13T10:16:31.000-04:00,NA,"Oakville, Milton, Burlington, Mississauga, Brampton, Caledon, Etobike, North York, Vaughan, woodbridge, Toronto, Markham, Ajax, Pickering and Whitby",8:00 am to 7:00 pm,All,"Our services goals go from framing, drywall, electrical & plumbing (subcontracted via licensed trades-persons), carpentry, basement finishing, tiling,flooring, kitchen, bathroom, decking, fence, garage, open concepts and demolitions, sun decks and exterior building.",All,Complete Home Renovation,2004,12,Cheque/Cash,,Ontario Business License Number,,TRUE,TRUE,,,TRUE,FALSE,NPC Renovations provides  two years of warranty in all its completed renovation's projects ,1864365,NPC Building and Renovations Limited,251,195,170,9.98462,"Bathroom Renovation, Bathroom renovation, bathroom remodeling, bathroom remodelling, renovating the bathroom, tearing out the bathroom, fixing up the bathroom, bathroom contractors, bathroom vanities, bathroom vanity, design of bathroom, bathroom and design, design for bathroom, design a bathroom, design a bath, bath design, bathroom tile, bathroom cabinets, remodeling a bathroom, bathroom remodeling, remodeling the bathroom, ,Bath renovation, New tub, caulking, ,General Contractors, Residential General Contractor, Building Contractor, Additions, Remodeling Contractor,  Renovation, Builder, building construction, renovation, remodeling, construction builders, construction company, construction companies, home repair, construction jobs, home remodeling, general contractors, contractors general, contractor general, contractors construction, construction contractors, home improvement and remodeling, kitchen remodeling, construction contractor, builders contractors, home renovation, general contracting, building contractors, building companies, home renovations, builder contractor, building contractor, remodeling contractor, commercial construction, residential construction, house contractor, concrete contractors, home contractors, general construction, construction general, contractors remodeling, remodeling contractors, remodelers, remodel contractor, remodel contractors, general contract, commercial contractors, renovations contractors, home improvement contractor, licensed contractor, license general contractor, mud room, mudroom, caulking, ,Kitchen Planning & Renovation, Kitchen Planning And Design, Kitchen Cabinet Planning, Kitchen Design, Kitchen Remodeling, kitchen or, and bathroom, a and a kitchens, kitchens and, for kitchens, a kitchens, kitchens, the house design, cabinets for kitchen, cabinets for the kitchen, cabinets and kitchen, kitchen cabinets, design a kitchen, about kitchen design, a kitchen design, how to kitchen design, design and kitchen, the kitchen design, design for kitchen, kitchen designs, renovation and remodeling, remodeling and renovation, kitchen designer,,Kitchen Renovation, caulking, ,Design/Build, Contracting, Renovation, Remodeling, Restoration, Project Management, Renovation Assistance, Reno Management, architect, architects, design build, build & design, design and build, build by design, design to build. building construction, building a house, house designs, house plans, home designs, house plan, how to design a house, design house, house design, remodeling, building and design, design for building, design building, building by design, a building design, design of building, building design, design a building, building & design,  playsets, playground, wooden playset, wooden playground, play set, ,Basement Renovation, Basement renovation, Basement remodeling, Basement remodelling, renovating your basement, renovation, waterproofing, remodeling, home renovation, house renovation, water in basement, basement waterproofing,finishing basement, moistureproof, remodeling the house, caulking,Home Additions, General contractor, home improvement, building addition, home expansion, house expansion, house building, plans house, house plans from, plans for house, the house plans, house plans, renovation, in house design, home plans house, home house plans, house home plans, house plans home, remodeling, house plans and designs, designs house plans, house designs plans, house plans designs, home plans and designs, home designs plans, floor plans, house build, renovations, plans for building, kitchen cabinets, remodel, kitchen design, house plans for building, house plans building, ,",0,2012-09-13T10:16:31.000-04:00,npcrenovations,FALSE,0,0,208,100,FALSE,74efea7a2d613e17943157469fc746cfa8c710cd,TRUE,2022-06-14T10:57:42.000-04:00,TRUE,TRUE,2052587,98.7223796793,378,NA,NA
https://homestars.com/on/becker/home-additions,25,"c(""https://homestars.com/on/becker/home-additions?&page=2&"", ""https://homestars.com/on/becker/home-additions?&page=3&"")",Home Additions,2777922,http://www.trocanada.com,/companies/2777922-the-renovators?searched_category_id=378&service_area=2109277,"Why choose The Renovators of Canada?  
 
For over the past 20 years our focus on customer experience has helped The Renovators of Canada grow to locations in Durham, Aurora, Stouffville, Markham, Vaughan, Toronto, Hamilton, Guelph, Kitchener, Waterloo, Barrie, Oshawa, Oakville and Cambridge. 
 
Unique to the industry, The Renovators of Canada provides a 10 year warranty on all craftsmanship. This home renovation warranty protection was established to provide peace of mind as home and business owners contemplate renovating a personal or commercial space. 
 
T-ROC is a fully licensed and insured including WSIB. Other affiliations include memberships with the National Kitchen and Bath Association, CARAHS, Better Business Bureau.  
 
We have a proven track record working with our customers with full transparency in every aspect of your project.  Can’t be present all the time during the renovation process?  No worries, we have specialized client software that allows you to see the entire schedule and pictures as the project happens in real time. We care for your home like it’s our own and always conduct ourselves respectfully and professionally.  
 
With our motivated and innovative professionals we will transform your house and make your dream home a reality.  Visit our website at www.trocanada.com
  ",the-renovators,2010-02-21T15:31:15.000-05:00,NA,"Markham, Toronto, Stouffville, Pickering, Oshawa, Richmondhill, Vaughan, Mississuaga, Brampton, Oakville, Cambridge, Burlington, Hamilton, Kitchener, Waterloo",M&F 8:30-4:30 TWTh 8:30-7:00 Sat by appt,"Custom Homes, Home Additions, Kitchen Cabinets, Kitchen and Bathroom accessories, Flooring, drywall, Light fixtures, tiles, hardwood flooring, engineered wood flooring, windows, doors, garage doors ","Home Additions, Kitchen Renovation, Bathroom Renovation, Basement Renovation, drywall, tiling, granite, custom cabinetry, painting, basements, Renovation Consulting","Bain Ultra, Ultra Bath, Artisan manufacturing corp, Azzura, Blanco, Brizo, Caesarstone, Cambria, Caml Tomlin, Contrac, Delta, Diamastone, Doors & More, Oduravit, Elkay, Emtek, Fairmont Designs, Foremeost, Franke, Grohe, Hansgrohe, Insinkerator, Oceana, kallista, Kindred, The Bold Look of Kohler, Maax, Maax Collection, Mirolin, MOen, Motiv, Mr. Marble, Native trails, Newport Brass, Novanni, Olsonite, OS&B Palmer Industries, Panasonic, Price Phister, Robern, Ronbow, Runtal Radiators, Slik portfolio, Soma Foremost, Sonoma Forge, Sterling Portfolio, Stone Forest, Supreme, Lighting,Thermasol, Tidal, Kroy Surfaces inc., Richelieu, Silestone, Toto, Victoria Albert, Warmly Yours Radiant Heating, American Standard","Home additions, Kitchen Renovations, Basement renovations, Bathroom renovations, Income properties, Home upgrades, house flips",2002,50,"Cheques, Visa, Mastercard, Debit, email transfer",,Fully Licensed ,"Better Business Bureau, Baeumler Approved, Erenovate, Trusted Pros",TRUE,FALSE,,5000,TRUE,FALSE,10 year waranty on craftmanship.,1840974,The Renovators Of Canada,185,139,266,9.05755,"Bathroom Renovation, Bathroom renovation, bathroom remodeling, bathroom remodelling, renovating the bathroom, tearing out the bathroom, fixing up the bathroom, bathroom contractors, bathroom vanities, bathroom vanity, design of bathroom, bathroom and design, design for bathroom, design a bathroom, design a bath, bath design, bathroom tile, bathroom cabinets, remodeling a bathroom, bathroom remodeling, remodeling the bathroom, ,Bath renovation, New tub, caulking, ,Home Additions, General contractor, home improvement, building addition, home expansion, house expansion, house building, plans house, house plans from, plans for house, the house plans, house plans, renovation, in house design, home plans house, home house plans, house home plans, house plans home, remodeling, house plans and designs, designs house plans, house designs plans, house plans designs, home plans and designs, home designs plans, floor plans, house build, renovations, plans for building, kitchen cabinets, remodel, kitchen design, house plans for building, house plans building, ,General Contractors, Residential General Contractor, Building Contractor, Additions, Remodeling Contractor,  Renovation, Builder, building construction, renovation, remodeling, construction builders, construction company, construction companies, home repair, construction jobs, home remodeling, general contractors, contractors general, contractor general, contractors construction, construction contractors, home improvement and remodeling, kitchen remodeling, construction contractor, builders contractors, home renovation, general contracting, building contractors, building companies, home renovations, builder contractor, building contractor, remodeling contractor, commercial construction, residential construction, house contractor, concrete contractors, home contractors, general construction, construction general, contractors remodeling, remodeling contractors, remodelers, remodel contractor, remodel contractors, general contract, commercial contractors, renovations contractors, home improvement contractor, licensed contractor, license general contractor, mud room, mudroom, caulking, ,Kitchen Planning & Renovation, Kitchen Planning And Design, Kitchen Cabinet Planning, Kitchen Design, Kitchen Remodeling, kitchen or, and bathroom, a and a kitchens, kitchens and, for kitchens, a kitchens, kitchens, the house design, cabinets for kitchen, cabinets for the kitchen, cabinets and kitchen, kitchen cabinets, design a kitchen, about kitchen design, a kitchen design, how to kitchen design, design and kitchen, the kitchen design, design for kitchen, kitchen designs, renovation and remodeling, remodeling and renovation, kitchen designer,,Kitchen Renovation, caulking, ,Basement Renovation, Basement renovation, Basement remodeling, Basement remodelling, renovating your basement, renovation, waterproofing, remodeling, home renovation, house renovation, water in basement, basement waterproofing,finishing basement, moistureproof, remodeling the house, caulking,",0,2010-09-21T20:32:23.000-04:00,therenovators,FALSE,0,0,254,NA,FALSE,1675c416d1c139a0ac43253ff49b0d5c1259bd4e,TRUE,2021-03-17T16:51:08.000-04:00,TRUE,TRUE,2109277,90.8280283274,378,NA,NA
https://homestars.com/on/becker/home-additions,25,"c(""https://homestars.com/on/becker/home-additions?&page=2&"", ""https://homestars.com/on/becker/home-additions?&page=3&"")",Home Additions,2797545,http://www.hidricontracting.com,/companies/2797545-hidri-contracting?searched_category_id=378&service_area=2212615,"We are professional home renovators providing high quality home renovations services in Toronto, GTA and across Ontario Canada.
Hidri Contracting brings an unprecedented knowledge and skill level to any home renovation projects,Bathroom, Kitchen,Basement Renovation, General Construction.We also handle everything else related to your home construction and renovation needs.Our focus has been on smaller,trendy renovations  such as, Bathroom,Kitchen and Basement Renovations.
Your Home - Your Most Important Investment.
Our Company is teamed up with a group of experienced and talented consultants that will provide a one- stop place for all your design and building permit needs.Architectural Services will assist you with building permits that will enhance your porch, deck, garage, basement, kitchen, bathroom, or the house overall. Services cover also such delicate matters as Stop Work Order, Order to Comply, Zoning Reviews, Land Severance, Committee of Adjustment Applications, and Ontario Municipal Board Applications.
Our Structural Consultant can provide services that vary in size and complexity, from just evaluating an existing building and providing the Owner with necessary documentation as required by City Officials and Ontario Building Code to designing structural components of a new building.

Our Services:
Bathroom renovation 
Basement renovation
Home Addition
Kitchen renovation
 Condo renovation
General Work",hidri-contracting,2012-04-24T14:52:07.000-04:00,NA,Greater Toronto Area,Please Call for Appointment,,,,,12,NA,Cheque,Construction Technitian,Yes,,TRUE,FALSE,,,TRUE,FALSE,Yes,1860597,Hidri Contracting,79,70,752,9.92857,"Basement Renovation, Basement renovation, Basement remodeling, Basement remodelling, renovating your basement, renovation, waterproofing, remodeling, home renovation, house renovation, water in basement, basement waterproofing,finishing basement, moistureproof, remodeling the house, caulking,Bathroom Renovation, Bathroom renovation, bathroom remodeling, bathroom remodelling, renovating the bathroom, tearing out the bathroom, fixing up the bathroom, bathroom contractors, bathroom vanities, bathroom vanity, design of bathroom, bathroom and design, design for bathroom, design a bathroom, design a bath, bath design, bathroom tile, bathroom cabinets, remodeling a bathroom, bathroom remodeling, remodeling the bathroom, ,Bath renovation, New tub, caulking, ,Home Additions, General contractor, home improvement, building addition, home expansion, house expansion, house building, plans house, house plans from, plans for house, the house plans, house plans, renovation, in house design, home plans house, home house plans, house home plans, house plans home, remodeling, house plans and designs, designs house plans, house designs plans, house plans designs, home plans and designs, home designs plans, floor plans, house build, renovations, plans for building, kitchen cabinets, remodel, kitchen design, house plans for building, house plans building, ,General Contractors, Residential General Contractor, Building Contractor, Additions, Remodeling Contractor,  Renovation, Builder, building construction, renovation, remodeling, construction builders, construction company, construction companies, home repair, construction jobs, home remodeling, general contractors, contractors general, contractor general, contractors construction, construction contractors, home improvement and remodeling, kitchen remodeling, construction contractor, builders contractors, home renovation, general contracting, building contractors, building companies, home renovations, builder contractor, building contractor, remodeling contractor, commercial construction, residential construction, house contractor, concrete contractors, home contractors, general construction, construction general, contractors remodeling, remodeling contractors, remodelers, remodel contractor, remodel contractors, general contract, commercial contractors, renovations contractors, home improvement contractor, licensed contractor, license general contractor, mud room, mudroom, caulking, ,",0,2012-04-24T14:52:09.000-04:00,Hidricontracting,FALSE,0,0,661,100,FALSE,475a57abfa4b56db73f80ab9a11315cd63bd0337,TRUE,2020-09-24T22:23:39.000-04:00,TRUE,TRUE,2212615,97.986586223,378,NA,NA
