Link,n_hits,all_links,category,id,url,hs_path,profile,permalink,created_at,sic_code,service_area,hours,products,services,brands,specialities,established,employee_cnt,payment_method,diplomas,licenses,memberships,liability_insurance,bonded,project_rate,project_minimum,written_contract,written_warranty,warranty_terms,parent_company_id,name,total_number_of_reviews_cache,total_number_of_approved_reviews_cache,number_of_photos_cache,avg_rating_cache,categories_info_cache,savings_count,claimed_at,subdomain,fraudulent,fraudulent_count,total_number_of_pending_reviews_cache,images_count,completion_percent_cache,bully,secret,replied_to_at_least_one_review_cache,latest_approved_review_created_at,has_set_tasks,lead_purchase_eligible,service_area_id,star_score,quote_button_category,direct_phone,direct_contact
https://homestars.com/on/komoka/heating-air-conditioning,7,https://homestars.com/on/komoka/heating-air-conditioning,Heating & Air Conditioning,199488,http://www.windowscanada.com,/companies/199488-canadian-choice?searched_category_id=376&service_area=1855637,"Save thousands by dealing directly with a manufacturer! Canadian Choice Windows and Doors Inc. is a leading manufacturer of windows in Canada, serving Ontario. Canadian Choice Windows and Doors offers a huge selection of replacement windows including energy efficient windows, vinyl windows, casement windows, awning windows and bow and bay windows.

Canadian Choice Windows and Doors has been serving Toronto, Richmond Hill, North York, Markham, Mississauga, Oakville, Burlington, Hamilton, Kitchener, Cambridge, Niagra Falls and the surrounding areas as well as in Calgary, Edmonton, Winnipeg and Northern Ontario. 

Why is Canadian Choice Windows and Doors your best solution for window replacement?

1. No Pressure Estimate: take your time & make informed decision

2. Save Money: Energy Star windows will reduce your energy bill by 30 %

3. Professional Installation: flawless installation and thorough clean up by courteous installers

4. High Quality: The highest quality windows in the industry, featuring foam injected honey comb structure.
 
5. Easy Financing: Financing solutions to fit anyone’s lifestyle

6. Maximum Comfort: low-E coating to reflect summer sun and retain winter heat with our Cardinal Smart Glass system.

7. Zero Maintenance: our windows are easy to clean from within the home and will never fade or discolor

Canadian Choice Windows and Doors is your smartest solution for window and door replacement.
",canadian-choice,2007-06-21T20:00:00.000-04:00,NA,"Alberta, Manitoba, Southwestern and Northwestern Ontario",Mon-Fri 9:00 am to 8:00 pm,"replacement windows, vinyl windows, basement windows, casement windows, double hung windows, awning windows, custom windows, energy efficient windows, energy start windows","replacement windows, windows manufacturer, windows installation, custom windows",Canadian Choice Windows and Doors,Factory-direct windows - save thousands by avoiding the middleman. Professional installation - our crews will install your windows on time and will do a thorough clean up of work area.  ,1976,70,"cash, cheque, Visa, MasterCard, financing",,"Better Business Bureau, CSA, Energy Star",,TRUE,TRUE,,,TRUE,FALSE,Lifetime warranty on all windows installed ,55794,Canadian Choice,4456,3184,133,9.35364,"Windows & Doors Installation & Service, install Replacement Window, Screen Door, Wood door, metal door, fire door, sliding door, french door, glass paned door, sash windows, casement windows, bay windows, bow windows, energy star windows, lead-paned windows, Windows,  wondows, windowa, windwos, winows, windows canada, windows home, canadian windows and doors, window manufacturers canada, house windows canada, canada windows, vinyl windows and doors, windows and doors canada, windows and doors, house windows, vinyl windows, canadian windows, buy windows, windows price, doors canada, windows manufacturers, windows for houses, canada doors, canadian door, windows vinyl, new house windows, canadian made windows, exterior windows, residential windows, black vinyl windows, garden doors canada, windows house, window suppliers, window companies toronto, vinyl windows price, windows canada store, window stores, store windows, vinyl doors, gta windows, buy doors, new windows and doors, shop windows, replacement windows, buy home windows, cheap home windows,  phantom screens, doors ontario, doors canada, canada doors, phantom screen doors, custom sliding window, double french doors, phantom retractable screens, plywood doors, screen doors wood, exterior doors, barn doors, entrance doors, steel doors, sliding screen doors, sliding barn doors, retractable screen door, exterior french doors, saloon doors, french windows, barn style doors, wooden doors, french patio doors, loft doors, solid wood doors, types of doors, custom doors, wood front doors, window doors, invisible screen door, exterior wood doors, interior wood doors, panel doors, door screens,  shutter doors, swing doors, wood entry doors, office doors, barn windows, retractable door, patio screen door, basement doors, exterior glass, exterior glass doors, french door screens, rolling screen door, screens for french doors, wooden exterior door, custom front doors, solid wood exterior doors, unique doors, pocket doors toronto, cheap interior doors, front doors, entry doors, solid oak doors, shop windows, front screen doors, custom wood doors toronto, window installations, window installation companies, windows and doors installation, windows and door installer, door installer, window contractors, door installation toronto, home window installation, windows and doors replacement, door installer toronto, replacement window doors, door replacement toronto, door company, best windows and doors reviews, long life windows, longlife windows, custom windows toronto, replacement doors, certified windows and doors reviews, install vinyl windows, install a door, door contractors, interior door installation, door repair, windows repair, windows replacement, exterior door installation, shower door installation,  front door replacement, garden doors, caulking,Insulation, Home Insulation, Foam Insulation, Thermal Insulation, Fiberglass Insulation, cellulose insulation, insullation, celulose insulation, sprayfoam insulation, spray foam, what is insulation, insulating, insulated, insulate, insulator, save energy, insulators, foam insulation, insulation foam, foam spray, insulating foam, wall insulation, energy savers, radiant heat, sound insulation, spray in insulation, insulation spray in, insulation spray, spray on insulation, spray insulation, owenscorning, board insulation, insulation board, insulation home, insulation for the home, home insulation, loft insulation, foam insulation spray, insulation foam spray, spray insulation foam, spray on foam insulation, spray in foam insulation, insulation spray foam, spray foam insulation, foam spray insulation, insulation for attic, insulation in attic, attic insulation, insulation attic, insulating board, insulating foam spray, insulating spray foam, house insulation, insulation for house, insulation house, sprayfoam insulation, insulated panels, insulating home, soundproofing,Insulation, ,Heating & Air Conditioning, Air Conditioning Installation, Air Conditioning Repair, Heating Oil, Heating System, heat, furnace, a/c, air conditioning, air conditioner, ac air conditioning, air conditioners, furnace, furnaces, airconditioner, lenneox, airconditioning, hvac, what is hvac, air condition, trane, hvac air conditioning, air conditioning hvac, a heating and air, air heating, heating & air, heating and air, heating air, heat pump, air conditioning units, air conditioning unit, unit air conditioning, air conditioner unit, air conditioner units, heating & cooling, heating and cooling, heating cooling, cooling and heating, system heating, heating system, air conditioning cooling, heat and air, heat air, heat & air, air and heat, air conditioning and heating, heating and air conditioning, air conditioning heating, air conditioning & heating, a and a heating and air conditioning, heating air conditioning, heat pumps, airconditioners, systems heating, heating systems, portable air conditioner, cooling system, Furnace Humidifier,  heating and cooling contractors, heat pump installation, home heating, heating ventilation and air conditioning, hvac industry, residential heat pump, heating services, heating contractor, homes heating, central heat, heat sources,  new heating systems, industrial air conditioning, radiant floor heating,  floor heating, central cooling and heating systems, residential heating, heat pump installers,  thermostat, in floor heating, ductless heat pump, programmable thermostat, mini split heat pump, heated floors, hvac systems, hvac technician, what is a heat pump, climate control, what does hvac stand for, electric heating, electric floor heating, new furnace, heat and temperature, h vac, heatpump, hvac design, electric heat, central heating, hvac engineer, home heating systems, hvac supply, thermo stat, heat pumps prices, heat pump efficiency, split heat pump, hvac maintenance, in floor heating cost, electric heat pumps, boiler heating systems, hvac unit, hvac mechanic, hvac repair, commercial hvac, hvac installation, heated tile floor, hvac specialist, hvac services, types of heating systems, hvac tech, air con unit,  air conditioner, canada air conditioner, air condition unit, air conditioning canada, portable air conditioner, room air conditioning, mobile air conditioning, portable ac, indoor air conditioner,",1,2010-09-16T12:35:09.000-04:00,canadianchoice,FALSE,1,1,72,100,FALSE,01b1bbd14f53d81bb09c4a1246b6ac5b5415033a,TRUE,2022-10-22T19:12:04.000-04:00,TRUE,TRUE,1855637,91.042133205,376,NA,NA
https://homestars.com/on/komoka/heating-air-conditioning,7,https://homestars.com/on/komoka/heating-air-conditioning,Heating & Air Conditioning,318259,https://www.reliancehomecomfort.com,/companies/318259-reliance-home-comfort?searched_category_id=376&service_area=1847054,"At Reliance, the safety and well-being of both our Customers and our Team Members is always our top priority. We are actively monitoring the Coronavirus (COVID-19) situation and are taking precautionary measures to aid in keeping our communities safe. We have implemented strict safety protocols to provide both our Customers and Team members with peace of mind during this challenging time. We continue to provide the exceptional customer experiences we are synonymous for and want you to know that we are here for you when you need us.

Reliance Home Comfort has been delivering high quality home comfort products and services for over 40 years. Specializing in furnaces, air conditioners, water heaters and plumbing, we provide our customers with peace of mind and are with you every step of the way. When you choose Reliance, you’re choosing one of the largest HVAC providers in Canada, with over 1.7 million customers and growing. You can expect your call to be answered 24 hours a day, 7 days a week, 365 days a year. With one of the largest networks of licensed technicians in Canada, we respond to over 500,000 service calls each year. 
After all, we believe you are investing in much more than home comfort equipment, you’re investing in a relationship and your satisfaction is our top priority.
888-837-1451 is a TOLL FREE No., please feel free to contact!! ",reliance-home-comfort,2007-11-14T16:14:24.000-05:00,NA,"Windsor, London, Sarnia, Chatham, Sudbury, North Bay, Timmins, Sturgeon Falls, Thunder Bay, Brantford, Niagara, Kitchener, Waterloo, Guelph, Hamilton, Burlington, Oakville, Brampton, Mississauga, Toronto, Pickering, Whitby, Oshawa, Kingston, Richmond Hill, Etobicoke, Sault Ste Marie ",24/7/365,"Furnaces, Air Conditioners, Water Heaters, Air Purifiers, Boilers, Water Softeners, Equipment Protection Plans ","Installation, Service, Repair, Plumbing","Carrier, Goodman, Rheem, Amana, Smart Air, Rinnai",,NA,NA,"Cheques, Cash, Credit Card, Pre-Authorized Payment",,,,TRUE,TRUE,,,TRUE,FALSE,,112549,Reliance Home Comfort,19026,12881,53,8.85824,"Heating & Air Conditioning, Air Conditioning Installation, Air Conditioning Repair, Heating Oil, Heating System, heat, furnace, a/c, air conditioning, air conditioner, ac air conditioning, air conditioners, furnace, furnaces, airconditioner, lenneox, airconditioning, hvac, what is hvac, air condition, trane, hvac air conditioning, air conditioning hvac, a heating and air, air heating, heating & air, heating and air, heating air, heat pump, air conditioning units, air conditioning unit, unit air conditioning, air conditioner unit, air conditioner units, heating & cooling, heating and cooling, heating cooling, cooling and heating, system heating, heating system, air conditioning cooling, heat and air, heat air, heat & air, air and heat, air conditioning and heating, heating and air conditioning, air conditioning heating, air conditioning & heating, a and a heating and air conditioning, heating air conditioning, heat pumps, airconditioners, systems heating, heating systems, portable air conditioner, cooling system, Furnace Humidifier,  heating and cooling contractors, heat pump installation, home heating, heating ventilation and air conditioning, hvac industry, residential heat pump, heating services, heating contractor, homes heating, central heat, heat sources,  new heating systems, industrial air conditioning, radiant floor heating,  floor heating, central cooling and heating systems, residential heating, heat pump installers,  thermostat, in floor heating, ductless heat pump, programmable thermostat, mini split heat pump, heated floors, hvac systems, hvac technician, what is a heat pump, climate control, what does hvac stand for, electric heating, electric floor heating, new furnace, heat and temperature, h vac, heatpump, hvac design, electric heat, central heating, hvac engineer, home heating systems, hvac supply, thermo stat, heat pumps prices, heat pump efficiency, split heat pump, hvac maintenance, in floor heating cost, electric heat pumps, boiler heating systems, hvac unit, hvac mechanic, hvac repair, commercial hvac, hvac installation, heated tile floor, hvac specialist, hvac services, types of heating systems, hvac tech, air con unit,  air conditioner, canada air conditioner, air condition unit, air conditioning canada, portable air conditioner, room air conditioning, mobile air conditioning, portable ac, indoor air conditioner,Plumbing, Plumber, Plumbers, Plumbing Contractor, Plumbing Repair, toilet repair, fixing toilet, fixing sink, broken faucet, faucet repair, tap repair, leaking toilet, leaking sink, leaking pipes, drain snaking, at plumbing, plumbing in, what is plumbing, a plumbing, the plumbing, plumbing and, how to plumbing, plumbing a, plumbing how to, an plumbing, a plumber, plumber, the plumber, plumber plumber, plumber in, how to plumber, plumbers in, the plumbers, plumbers, plumbing pipe, how to plumb, pipes and plumbing, plumbing pipes, pipes for plumbing, plummer, plumbing supplies, plumbing supply, plumbing heating, plumbing & heating, heating and plumbing, heating plumbing, plumbing and heating, pipe plumber, plumbing stores, plumbing suppliers, the plumbs centre, plumb centre, ,Water Filtration & Purification, water purification, bottled water service, water treatment, water delivery, water softener systems, hard water specialists, soft water systems,",30,2008-07-28T12:09:29.000-04:00,reliancehomecomfort,FALSE,0,2,83,100,FALSE,82df59a9f050fc335fa07b1bc5c9fbf0f9611cb7,TRUE,2022-11-14T16:34:22.000-05:00,TRUE,TRUE,1847054,85.1107663148,376,NA,NA
https://homestars.com/on/komoka/heating-air-conditioning,7,https://homestars.com/on/komoka/heating-air-conditioning,Heating & Air Conditioning,2675838,http://www.bowhomecomfort.ca/,/companies/2675838-bow-home-comfort-systems?searched_category_id=376&service_area=1689042,"BOW HOME COMFORT SYSTEMS HAS OVER 25 YEARS OF EXPERIENCE INSTALLING AND SERVICING HEATING AND COOLING SYSTEMS.

We strictly service residential customers, allowing us to focus on the things that matter most to homeowners: quality work done right the first time.

Russ Bow, owner of Bow Home Comfort Systems, has been taking care of any customer that comes his way since day one. He puts pride into his work, where he can truly show his customers how much he appreciates their business. Russ’ son, Andrew, also works for Bow Home Comfort Systems.

Russ has his gas and air conditioning tickets. Andrew holds his gas ticket. Bow Home Comfort is fully insured, and can also offer Ontario Power Authority rebates on applicable purchases.

Russ and Andrew always tell their customers to be wary of those who condemn your home comfort system. They know a fix is usually at hand, and they are happy to help their customers get a few more years out of their appliances before replacing. They know you have a budget and do what they can to suit it. Additionally, they put their efforts into the little things that separate decent work from fantastic work, like:

Using drop cloths to prevent a mess
Performing their work neatly
Respecting their customers’ homes
Putting customer satisfaction above all else
Bow Home Comfort respects you and your home – this isn’t just another job. There are no salespeople, no warehouse, and no ad campaigns. Just honesty and respect, at your service.

Contact us for a free consultation. We would love to hear from you!",bow-home-comfort-systems,2008-03-04T16:55:15.000-05:00,NA,NA,NA,"RESIDENTIAL FURNACES, CENTRAL AIR CONDITIONERS,GAS FIREPLACES AND GAS LINES",REPAIRS AND MAINTAINCE ON ALL MAKES OF RESIDENTIAL FURNACES AND AIR CONDITIONERS,"GOODMAN, AIRE-FLO, CONCORD, ARMSTRONG, AIREASE, ETC.",,1998,2,"chEque, CASH, VISA, MASTERCARD, SNAP FINANCIAL",,yes,,TRUE,FALSE,,,TRUE,FALSE,10 TEARS,1738890,Bow Home Comfort Systems,145,128,2,9.83594,"Heating & Air Conditioning, Air Conditioning Installation, Air Conditioning Repair, Heating Oil, Heating System, heat, furnace, a/c, air conditioning, air conditioner, ac air conditioning, air conditioners, furnace, furnaces, airconditioner, lenneox, airconditioning, hvac, what is hvac, air condition, trane, hvac air conditioning, air conditioning hvac, a heating and air, air heating, heating & air, heating and air, heating air, heat pump, air conditioning units, air conditioning unit, unit air conditioning, air conditioner unit, air conditioner units, heating & cooling, heating and cooling, heating cooling, cooling and heating, system heating, heating system, air conditioning cooling, heat and air, heat air, heat & air, air and heat, air conditioning and heating, heating and air conditioning, air conditioning heating, air conditioning & heating, a and a heating and air conditioning, heating air conditioning, heat pumps, airconditioners, systems heating, heating systems, portable air conditioner, cooling system, Furnace Humidifier,  heating and cooling contractors, heat pump installation, home heating, heating ventilation and air conditioning, hvac industry, residential heat pump, heating services, heating contractor, homes heating, central heat, heat sources,  new heating systems, industrial air conditioning, radiant floor heating,  floor heating, central cooling and heating systems, residential heating, heat pump installers,  thermostat, in floor heating, ductless heat pump, programmable thermostat, mini split heat pump, heated floors, hvac systems, hvac technician, what is a heat pump, climate control, what does hvac stand for, electric heating, electric floor heating, new furnace, heat and temperature, h vac, heatpump, hvac design, electric heat, central heating, hvac engineer, home heating systems, hvac supply, thermo stat, heat pumps prices, heat pump efficiency, split heat pump, hvac maintenance, in floor heating cost, electric heat pumps, boiler heating systems, hvac unit, hvac mechanic, hvac repair, commercial hvac, hvac installation, heated tile floor, hvac specialist, hvac services, types of heating systems, hvac tech, air con unit,  air conditioner, canada air conditioner, air condition unit, air conditioning canada, portable air conditioner, room air conditioning, mobile air conditioning, portable ac, indoor air conditioner,",0,2015-06-29T10:29:30.000-04:00,bowhome,FALSE,0,0,2,NA,FALSE,c83c9a8ab4e5581d3acd811ae41371140c1b40c6,TRUE,2017-06-17T20:55:29.000-04:00,TRUE,TRUE,1689042,98.1093023443,376,NA,NA
https://homestars.com/on/komoka/heating-air-conditioning,7,https://homestars.com/on/komoka/heating-air-conditioning,Heating & Air Conditioning,2810479,https://www.handybros.com,/companies/2810479-handy-bro-s-home-comfort?searched_category_id=376&service_area=2266340,"Handy Bros. Home Comfort is a Heating, Cooling, and Plumbing company serving Southwestern Ontario. We specialize in Air Conditioning, Heat Pump & Furnace, Boiler, Water Heater services and installation and more. We will send you the best technicians for your every need.",handy-bro-s-home-comfort,2013-05-27T00:57:47.000-04:00,NA,NA,Mon: - Sun: 8:00 AM - 5:00 PM,"Furnace, Air Conditioners, Indoor Air Quality, Thermostats, Fireplaces.","Heating and Cooling, Furnace Repair, Air Conditioner Repair, Air Conditioner Maintenance, Furnace Maintenance, Furnace Installation, AC Installation, Fireplace Installation, Fireplace Maintenance, HRV & ERV Maintenance. ","York, Mitsubishi, Movair, Regency, Rheem. ","Furnace Repair, Air Conditioner Repair, Air Conditioner Maintenance, Furnace Maintenance, Furnace Installation, AC Installation, Fireplace Installation, Fireplace Maintenance, HRV & ERV Maintenance, Boiler Installation, Boiler Heating, Water Heating, Water Heater installation, Heating and Cooling Service, Heating and Cooling Maintenance. ",1959,NA,,,,,FALSE,FALSE,,,FALSE,FALSE,,1873479,Handy Bro's. Home Comfort,39,34,6,9.91177,"Heating & Air Conditioning, Air Conditioning Installation, Air Conditioning Repair, Heating Oil, Heating System, heat, furnace, a/c, air conditioning, air conditioner, ac air conditioning, air conditioners, furnace, furnaces, airconditioner, lenneox, airconditioning, hvac, what is hvac, air condition, trane, hvac air conditioning, air conditioning hvac, a heating and air, air heating, heating & air, heating and air, heating air, heat pump, air conditioning units, air conditioning unit, unit air conditioning, air conditioner unit, air conditioner units, heating & cooling, heating and cooling, heating cooling, cooling and heating, system heating, heating system, air conditioning cooling, heat and air, heat air, heat & air, air and heat, air conditioning and heating, heating and air conditioning, air conditioning heating, air conditioning & heating, a and a heating and air conditioning, heating air conditioning, heat pumps, airconditioners, systems heating, heating systems, portable air conditioner, cooling system, Furnace Humidifier,  heating and cooling contractors, heat pump installation, home heating, heating ventilation and air conditioning, hvac industry, residential heat pump, heating services, heating contractor, homes heating, central heat, heat sources,  new heating systems, industrial air conditioning, radiant floor heating,  floor heating, central cooling and heating systems, residential heating, heat pump installers,  thermostat, in floor heating, ductless heat pump, programmable thermostat, mini split heat pump, heated floors, hvac systems, hvac technician, what is a heat pump, climate control, what does hvac stand for, electric heating, electric floor heating, new furnace, heat and temperature, h vac, heatpump, hvac design, electric heat, central heating, hvac engineer, home heating systems, hvac supply, thermo stat, heat pumps prices, heat pump efficiency, split heat pump, hvac maintenance, in floor heating cost, electric heat pumps, boiler heating systems, hvac unit, hvac mechanic, hvac repair, commercial hvac, hvac installation, heated tile floor, hvac specialist, hvac services, types of heating systems, hvac tech, air con unit,  air conditioner, canada air conditioner, air condition unit, air conditioning canada, portable air conditioner, room air conditioning, mobile air conditioning, portable ac, indoor air conditioner,",0,NA,,FALSE,0,0,2,NA,FALSE,e122ff64dc3b7becde032c03a0334f5296d18589,TRUE,NA,TRUE,TRUE,2266340,89.9484743885,376,NA,NA
