Link,n_hits,all_links,category,id,url,hs_path,profile,permalink,created_at,sic_code,service_area,hours,products,services,brands,specialities,established,employee_cnt,payment_method,diplomas,licenses,memberships,liability_insurance,bonded,project_rate,project_minimum,written_contract,written_warranty,warranty_terms,parent_company_id,name,total_number_of_reviews_cache,total_number_of_approved_reviews_cache,number_of_photos_cache,avg_rating_cache,categories_info_cache,savings_count,subdomain,fraudulent,fraudulent_count,total_number_of_pending_reviews_cache,images_count,completion_percent_cache,bully,secret,replied_to_at_least_one_review_cache,latest_approved_review_created_at,has_set_tasks,lead_purchase_eligible,service_area_id,star_score,quote_button_category,direct_phone,direct_contact,claimed_at
https://homestars.com/on/east-york/sprinkler-systems,57,"c(""https://homestars.com/on/east-york/sprinkler-systems?&page=2&"", ""https://homestars.com/on/east-york/sprinkler-systems?&page=3&"", ""https://homestars.com/on/east-york/sprinkler-systems?&page=4&"", ""https://homestars.com/on/east-york/sprinkler-systems?&page=5&"", ""https://homestars.com/on/east-york/sprinkler-systems?&page=6&"")",Sprinkler Systems,2796782,http://www.sprinklerkings.com/,/companies/2796782-sprinklerkings?searched_category_id=436&service_area=1859643,"At SprinklerKings, we know how vital it is to design and install a sprinkler system that will save you time, lower your water bills and keep your lawn looking healthy, lush and green. 
SprinklerKings understands how important customer service is for our clients. Our irrigation experts are always available to assist you with any of your issues, needs or requests. Even if you're just looking for some friendly advice, please don't hesitate to give us a call!",sprinklerkings,2012-03-26T18:51:10.000-04:00,NA,All across Ontario,,"Irrigation: Rainbird, Hunter

Landscape Lighting: Illumicare, Kichler, Cast, In-Lite
","*SprinklerKings custom designs and installs professional, state-of-the-art, underground sprinkler systems.
*Our team of experienced professionals can add additional sprinkler heads, install rain sensors, upgrade your controllers, or even convert your current out-of-date irrigation systems. 
* We provide seasonal opening and closing services to all our customers.",,"Residential Irrigation Installation & Service, Commercial Irrigation Installation & Service, Large Estate Properties, Landscape Lighting Systems, Rooftop Gardens & Terraces",2008,10,"Credit, Debit, Cheque, Money Order","B.A, B.Ed",CID,,TRUE,TRUE,,,TRUE,FALSE,5 Year,1859834,Sprinkler Kings,123,110,19,9.95455,"Sprinkler Systems, Fire Sprinkler, Lawn Sprinkler, Garden Sprinkler, underground sprinklers, underground irrigation, irrigation systems, automatic sprinkler systems, what is irrigation, irrigation, sprinkler, sprinklers, irrigation sprinkler, sprinkler irrigation, the irrigation system, irrigation system, irrigation sprinklers, irrigation systems,  systems irrigation, how to sprinkler system, the sprinkler system, what is a sprinkler system, sprinkler system, bird rain, water irrigation, sprinkler systems how to, watering system, ,Landscape Lighting, Outdoor lights, solar light, outdoor lighting for, lighting outdoor, outdoor lighting, outdoor lights, lights for outdoor, the outdoor lights, solar lights, outdoor light, solar lighting, led lighting, outdoor lamps, how to landscape lighting, landscape lighting how to, lighting landscape, landscape and lighting, outdoor lighting lamps, exterior lighting, lights landscape, landscape lights, solar lamps, outside lights, exterior lights, lighting stores, outside lighting, garden lights, outdoor lighting, landscape lamps, lighting garden, landscape lighting outdoor, outdoor landscape lighting, ,",0,sprinklerkings,FALSE,0,0,28,NA,FALSE,bdd0a08b940ab7451534a9bfc15f265d3be8ebba,TRUE,2022-10-17T09:22:38.000-04:00,TRUE,TRUE,1859643,99.2239838508,436,NA,NA,2012-03-26T18:51:12.000-04:00
https://homestars.com/on/east-york/sprinkler-systems,57,"c(""https://homestars.com/on/east-york/sprinkler-systems?&page=2&"", ""https://homestars.com/on/east-york/sprinkler-systems?&page=3&"", ""https://homestars.com/on/east-york/sprinkler-systems?&page=4&"", ""https://homestars.com/on/east-york/sprinkler-systems?&page=5&"", ""https://homestars.com/on/east-york/sprinkler-systems?&page=6&"")",Sprinkler Systems,228525,http://urbanlawnsprinklers.ca,/companies/228525-urban-lawn-sprinklers?searched_category_id=436&service_area=1829000,The grass is greener on our side! Urban Lawn Sprinklers has -Liability Insurance -Property Protection -Bonded - Criminal Background Check -No subcontractors.  Contact Urban Lawn Sprinklers today!,urban-lawn-sprinklers,2006-01-29T19:00:00.000-05:00,NA,"Brampton, Concord, Etobicoke, Markham, Mississauga, Newmarket, North York, Oakville, Richmond Hill, Scarborough, Thornhill, Toronto, Unionville, Vaughan, Woodbridge",,,"Maintenance Service - opening and closing, Design and New Installation, Spring Startup, Winterization",,,1990,NA,,,Yes,,TRUE,TRUE,,,TRUE,FALSE,Guarantee - 'Peace of Mind',79074,Urban Lawn Sprinklers,118,104,9,9.72356,"Landscape Contractors & Designers, Landscape Contractor Designer, Landscape Design, Landscape Contractor, Landscapers, Landscaping, Landscape, Backyard, patio, Fountain, Ponds and Waterfalls, garden, gardens, landscape, how to landscape, landscaping and, landscape garden, garden landscape, gardening, landscape gardens, pavers, garden design, design a garden, design for garden, design garden, how to design garden, lawn maintenance, how to design landscape, design landscape, landscape and design, design and landscape, how to design a landscape, landscape design, design a landscape, patios, architects landscape, landscape architects, garden designs, lawn service, garden landscaping, landscaping garden, landscape lighting, garden designer, designer garden,,landscapemakeover of backyard and improve front yard
build fence, landscape, Landscaping, retaining wall, grading,Sprinkler Systems, Fire Sprinkler, Lawn Sprinkler, Garden Sprinkler, underground sprinklers, underground irrigation, irrigation systems, automatic sprinkler systems, what is irrigation, irrigation, sprinkler, sprinklers, irrigation sprinkler, sprinkler irrigation, the irrigation system, irrigation system, irrigation sprinklers, irrigation systems,  systems irrigation, how to sprinkler system, the sprinkler system, what is a sprinkler system, sprinkler system, bird rain, water irrigation, sprinkler systems how to, watering system, ,Lawn Maintenance, Lawn Care, Lawn Mowers, Lawn Maintenance Companies, grass cutters, grass cutting, shrub pruning, lawns, a lawns, landscaping, mowing, lawn mowers, mowing lawn, lawn mowing, mowing the lawns, mowing lawns, lawns mowing, yard and garden, maintenance lawn, lawns maintenance, lawncare, service lawn, lawn service, grass mowing, lawn treatment, green grass, lawn repair, grass lawn mowers, lawn & landscape, lawn landscape, a lawn and landscape, landscape and lawn, lawn and landscape, lawn services, yard landscape, lawn maintenance service, lawn service maintenance, landscaping a yard, yard landscaping, lawn maintenance services, maintenance company, grass cutting, maintenance business, lawn business, leaf clean up, fall leaves, hedges ,",0,uls,FALSE,0,0,14,100,FALSE,d9a863e2562c3874ccbd48d2c304223c6f32eb43,TRUE,2022-06-14T13:35:18.000-04:00,TRUE,TRUE,1829000,96.3709015702,436,NA,NA,2008-06-23T08:31:23.000-04:00
https://homestars.com/on/east-york/sprinkler-systems,57,"c(""https://homestars.com/on/east-york/sprinkler-systems?&page=2&"", ""https://homestars.com/on/east-york/sprinkler-systems?&page=3&"", ""https://homestars.com/on/east-york/sprinkler-systems?&page=4&"", ""https://homestars.com/on/east-york/sprinkler-systems?&page=5&"", ""https://homestars.com/on/east-york/sprinkler-systems?&page=6&"")",Sprinkler Systems,2924834,https://homestars.com/companies/2924834-pt-irrigation,/companies/2924834-pt-lawn-sprinklers-inc?searched_category_id=436&service_area=2200479,"***
At Pt Lawn Sprinklers, we know how vital it is to design and install a sprinkler system that will save you time, lower your water bills and keep your lawn looking healthy, lush and green.

Pt Lawn Sprinklers understands how important customer service is for our clients. Our irrigation experts are always available to assist you with any of your issues, needs or requests. Even if you're just looking for some friendly advice, please don't hesitate to give us a call!

Pt Lawn Sprinklers takes pride in our collaborative approach with our clients. We believe in working together with you to nourish your lawn and plant material while being able to conserve water usage.

We specialize in services such as:

***

Spring Start-ups
Mid-Season Check-ups
Fall Winterizing
Modifications to existing systems such as additions and reworking zones
Our service technicians are very experienced and trained to tackle any project of any size.


We know our rates are affordable comparing to our competitors, We stick by our products and pricing by letting you know here so when you try another company you know off hand what our cost is . Here is a list of our prices.


Serving in Toronto, Mississauga, Brampton & GTA. We recommend top quality brand irrigation systems and lawn sprinklers like Rain Bird, Hunter Industries,


Start up is $ 75.00 ( plus a 9 volt battery if required )
Midseason check up is $ 75.00
Repairs hourly rate is $ 75.00 
Winterizing your system does not matter the size or how many zones $75.00
 
",pt-lawn-sprinklers-inc,2018-12-02T18:29:53.000-05:00,NA,NA,NA,,,,,NA,NA,"Cash, Cheque & E-transfer",,,,TRUE,FALSE,,,TRUE,FALSE,,1987008,PT Lawn Sprinklers Inc,172,112,52,9.75,"Sprinkler Systems, Fire Sprinkler, Lawn Sprinkler, Garden Sprinkler, underground sprinklers, underground irrigation, irrigation systems, automatic sprinkler systems, what is irrigation, irrigation, sprinkler, sprinklers, irrigation sprinkler, sprinkler irrigation, the irrigation system, irrigation system, irrigation sprinklers, irrigation systems,  systems irrigation, how to sprinkler system, the sprinkler system, what is a sprinkler system, sprinkler system, bird rain, water irrigation, sprinkler systems how to, watering system, ,",0,,FALSE,0,0,55,0,FALSE,8e1fceefde54c7b80a84e50e8ae7ce6ba735af78,TRUE,2022-04-03T07:21:11.000-04:00,TRUE,TRUE,2200479,95.095035631,436,NA,NA,2018-12-02T18:35:20.000-05:00
https://homestars.com/on/east-york/sprinkler-systems,57,"c(""https://homestars.com/on/east-york/sprinkler-systems?&page=2&"", ""https://homestars.com/on/east-york/sprinkler-systems?&page=3&"", ""https://homestars.com/on/east-york/sprinkler-systems?&page=4&"", ""https://homestars.com/on/east-york/sprinkler-systems?&page=5&"", ""https://homestars.com/on/east-york/sprinkler-systems?&page=6&"")",Sprinkler Systems,2815623,https://progreenirrigation.com/,/companies/2815623-progreen-irrigation?searched_category_id=436&service_area=2130784,"Pro Green Irrigation is a lawn sprinkler professional, offering a wide variety of services, which includes new installations, service to existing systems, and annual maintenance programs. Pro Green manufactures a time-controlled underground sprinkler system which eliminates the routine and monotonous job of hand watering and also savers water.  

***

The Automatic Sprinkler Systems from Pro Green Irrigation and gives your valuable landscape the uniform coverage it needs to stay healthy and vigorous.
Pro Green Irrigation is a family business with all of the advantages of a large company. While our focus is on residential customers, Pro Green also installs and services commercial systems in strip malls, warehouses, subway stations, hospitals, golf course club houses and office buildings. Whether you're a homeowner, developer, management company or general contractor, our goal is to give you the caring attention of a small family-run business, while maintaining a professional approach to our nearly 1500 customers.

***

One of the main advantages of working with Pro Green Irrigation is our experienced staff, including two full-time installation crews and three professional servicemen. We also have a full office staff, year round employees, and seven fully equipped vehicles. You can trust that Pro Green Irrigation will be around, year in and year out, to service your system and honor our comprehensive 5-Year Warranty *. For all these reasons and many more, Pro Green Irrigation is your lawn sprinkler professional. Pro Green Irrigation is a member of Landscape Ontario and the Canadian Nursery Landscape Association. We continually upgrade our skills with training that keeps us on the cutting edge of irrigation technology. If you would like to see a Pro Green Irrigation system in your area, we'll be happy to give you a list of referrals.

***

*Ask about our 5-year warranty",progreen-irrigation,2013-10-09T06:41:36.000-04:00,NA,NA,,,Irrigation & Sprinklers/Landscape Lighting,,"Pro Green Irrigation is a family business with all of the advantages of a large company. While our focus is mainly on residential customers, Pro Green also installs and services commercial systems in strip malls, warehouses, subway stations, hospitals, golf course club houses and office buildings. Whether you're a homeowner, developer, management company or general contractor, our goal is to give you the caring attention of a small family-run business, while maintaining a professional approach to thousands of customers.",1999,NA,Cheque and e-transfer,,Certified Irrigation Contractor (CIC),"Landscape Ontario, Canadian Nursery Landscape Association, Irrigation Association",TRUE,FALSE,,$3400,TRUE,FALSE,*Ask about our 5-year warranty,1878568,Pro Green Irrigation,73,67,70,9.67164,"Sprinkler Systems, Fire Sprinkler, Lawn Sprinkler, Garden Sprinkler, underground sprinklers, underground irrigation, irrigation systems, automatic sprinkler systems, what is irrigation, irrigation, sprinkler, sprinklers, irrigation sprinkler, sprinkler irrigation, the irrigation system, irrigation system, irrigation sprinklers, irrigation systems,  systems irrigation, how to sprinkler system, the sprinkler system, what is a sprinkler system, sprinkler system, bird rain, water irrigation, sprinkler systems how to, watering system, ,Landscape Lighting, Outdoor lights, solar light, outdoor lighting for, lighting outdoor, outdoor lighting, outdoor lights, lights for outdoor, the outdoor lights, solar lights, outdoor light, solar lighting, led lighting, outdoor lamps, how to landscape lighting, landscape lighting how to, lighting landscape, landscape and lighting, outdoor lighting lamps, exterior lighting, lights landscape, landscape lights, solar lamps, outside lights, exterior lights, lighting stores, outside lighting, garden lights, outdoor lighting, landscape lamps, lighting garden, landscape lighting outdoor, outdoor landscape lighting, ,",0,progreen,FALSE,0,0,71,0,FALSE,28f5953ab345d9a766d750e15085145deb6e09f3,TRUE,2022-09-15T18:01:04.000-04:00,TRUE,TRUE,2130784,95.8195775548,436,NA,NA,NA
https://homestars.com/on/east-york/sprinkler-systems,57,"c(""https://homestars.com/on/east-york/sprinkler-systems?&page=2&"", ""https://homestars.com/on/east-york/sprinkler-systems?&page=3&"", ""https://homestars.com/on/east-york/sprinkler-systems?&page=4&"", ""https://homestars.com/on/east-york/sprinkler-systems?&page=5&"", ""https://homestars.com/on/east-york/sprinkler-systems?&page=6&"")",Sprinkler Systems,193510,http://www.lawnsprinklerstoronto.com,/companies/193510-aa-waters-and-brookes-ltd?searched_category_id=436&service_area=1842403,"A,A Waters & Brookes is dedicated to installing and servicing lawn sprinklers that meet the specific needs of our customers. We use only top quality material and the latest technology to guarantee system reliability and longevity, and every system is designed to maintain uniformity of coverage. Our Team members are Certified Irrigation Technicians, Landscape Technicians, and Backflow Testers. We also employ a full office staff to answer all of your questions and ensure the best possible customer service.
 
A. A. Waters & Brookes has been in business for over 28 years and is owned and operated by a professional engineer who is a certified irrigation contractor and designer. We work with home owners, landscape contractors, home builders and general contractors throughout Toronto, the GTA and southern Ontario. The company ensures that your lawn sprinkler and irrigation systems are designed, installed and maintained to your satisfaction",aa-waters-and-brookes-ltd,2006-04-25T20:00:00.000-04:00,NA,"Brampton, Concord, Etobicoke, Markham, Mississauga, Newmarket, North York, Oakville, Richmond Hill, Scarborough, Thornhill, Toronto, Unionville, Vaughan, Woodbridge",,,"We design and install a lawn sprinkler or irrigation system to fit your specific application.
Materials are selected based on a proven track record of reliability and performance, not lowest cost.
Your system is installed by full-time, certified irrigation technicians who have the skills and experience to install your system properly with minimal disruption to your home and the utmost respect for your property
We service all makes of sprinkler systems
All our services, including installation, are supervised and directed by a Professional Engineer with more than 38 years experience in underground engineering and design",,,0,0,,,,,TRUE,TRUE,,,TRUE,FALSE,,50850,A.A. Waters & Brookes Ltd.,144,123,5,9.13618,"Sprinkler Systems, Fire Sprinkler, Lawn Sprinkler, Garden Sprinkler, underground sprinklers, underground irrigation, irrigation systems, automatic sprinkler systems, what is irrigation, irrigation, sprinkler, sprinklers, irrigation sprinkler, sprinkler irrigation, the irrigation system, irrigation system, irrigation sprinklers, irrigation systems,  systems irrigation, how to sprinkler system, the sprinkler system, what is a sprinkler system, sprinkler system, bird rain, water irrigation, sprinkler systems how to, watering system, ,",0,aawatersbrookes,FALSE,0,0,6,100,FALSE,0be37fc94daf6ad196ce6515a1d6407039fb81db,TRUE,2021-07-15T09:29:21.000-04:00,TRUE,TRUE,1842403,89.4877641288,436,NA,NA,2010-03-03T12:58:20.000-05:00
https://homestars.com/on/east-york/sprinkler-systems,57,"c(""https://homestars.com/on/east-york/sprinkler-systems?&page=2&"", ""https://homestars.com/on/east-york/sprinkler-systems?&page=3&"", ""https://homestars.com/on/east-york/sprinkler-systems?&page=4&"", ""https://homestars.com/on/east-york/sprinkler-systems?&page=5&"", ""https://homestars.com/on/east-york/sprinkler-systems?&page=6&"")",Sprinkler Systems,2895678,http://greenearthirrigation.ca/,/companies/2895678-green-earth-irrigation?searched_category_id=436&service_area=2119760,"Green Earth Irrigation was established in December, 2000. We design, install and maintain systems that save you time and money. We also save your lawn, flowers and trees by efficiently distributing water to your garden. By installing an Automatic Irrigation System, the ground will not get flooded. It gives control over where, when and how much water is being used, and the choice to apply small amounts of water over long periods of time. This allows the moisture to soak in to the ground for maximum efficiency, minimal water and evaporation, in addition to reducing water usage. The cost of water is increasing quickly across Canada and throughout the world. In today’s economic climate this is a big concern. Everyone is looking for ways to save money on energy and water costs….Green Earth Irrigation is the way to accomplish this! Please call……. ",green-earth-irrigation,2017-04-03T11:49:19.000-04:00,NA,NA,NA,,"Repair Irrigation System, Design & Install New System, Install Garden Lighting, Sprinkler Systems",,,2000,NA,,,,,FALSE,FALSE,,,FALSE,FALSE,,1958102,Green Earth Irrigation,79,62,86,9.46774,"Sprinkler Systems, Fire Sprinkler, Lawn Sprinkler, Garden Sprinkler, underground sprinklers, underground irrigation, irrigation systems, automatic sprinkler systems, what is irrigation, irrigation, sprinkler, sprinklers, irrigation sprinkler, sprinkler irrigation, the irrigation system, irrigation system, irrigation sprinklers, irrigation systems,  systems irrigation, how to sprinkler system, the sprinkler system, what is a sprinkler system, sprinkler system, bird rain, water irrigation, sprinkler systems how to, watering system, ,Landscape Lighting, Outdoor lights, solar light, outdoor lighting for, lighting outdoor, outdoor lighting, outdoor lights, lights for outdoor, the outdoor lights, solar lights, outdoor light, solar lighting, led lighting, outdoor lamps, how to landscape lighting, landscape lighting how to, lighting landscape, landscape and lighting, outdoor lighting lamps, exterior lighting, lights landscape, landscape lights, solar lamps, outside lights, exterior lights, lighting stores, outside lighting, garden lights, outdoor lighting, landscape lamps, lighting garden, landscape lighting outdoor, outdoor landscape lighting, ,",0,greenearthirr,FALSE,0,0,84,0,FALSE,567f4900d866de0bf64aaa086922c7a1f0ef7049,TRUE,2021-06-10T10:51:55.000-04:00,TRUE,TRUE,2119760,92.9791567862,436,NA,NA,2017-04-03T13:18:27.000-04:00
https://homestars.com/on/east-york/sprinkler-systems,57,"c(""https://homestars.com/on/east-york/sprinkler-systems?&page=2&"", ""https://homestars.com/on/east-york/sprinkler-systems?&page=3&"", ""https://homestars.com/on/east-york/sprinkler-systems?&page=4&"", ""https://homestars.com/on/east-york/sprinkler-systems?&page=5&"", ""https://homestars.com/on/east-york/sprinkler-systems?&page=6&"")",Sprinkler Systems,2785779,https://www.alwaysgreencanada.com/,/companies/2785779-always-green?searched_category_id=436&service_area=1842752,"We have been proudly serving the Greater Toronto Area for 20 years. We currently have 2 installation crews, 2 service technicians and 2 sales representatives. We know that the greatest sign of a job well done is a satisfied customer.



We provide every client with three unconditional practices:

1) Unparallel customer service.
2) We only use the highest quality parts and workmanship.
3) We will not quit until you are happy!",always-green,2011-03-19T23:35:37.000-04:00,NA,NA,NA,Hunter,"Residential and Commercial Systems
Spring turn-ons ""openings""
Winterizations ""Blow outs""
Installation of new systems
Repair and expansion of existing systems
On-demand service technicians
Free written estimates
Custom design and layout",,,NA,NA,"Cheque, Cash, E-transfer, Credit",,,,TRUE,FALSE,,,TRUE,FALSE,5 year warranty on all our Hunter parts.,1848831,Always Green ,72,61,11,8.81967,"Sprinkler Systems, Fire Sprinkler, Lawn Sprinkler, Garden Sprinkler, underground sprinklers, underground irrigation, irrigation systems, automatic sprinkler systems, what is irrigation, irrigation, sprinkler, sprinklers, irrigation sprinkler, sprinkler irrigation, the irrigation system, irrigation system, irrigation sprinklers, irrigation systems,  systems irrigation, how to sprinkler system, the sprinkler system, what is a sprinkler system, sprinkler system, bird rain, water irrigation, sprinkler systems how to, watering system, ,",0,NA,FALSE,0,0,12,NA,FALSE,a08071390609d9a7e1a74d9655542c6490dbe5cd,TRUE,2021-06-07T19:28:49.000-04:00,TRUE,TRUE,1842752,84.5771794626,436,NA,NA,2011-03-19T23:35:38.000-04:00
https://homestars.com/on/east-york/sprinkler-systems,57,"c(""https://homestars.com/on/east-york/sprinkler-systems?&page=2&"", ""https://homestars.com/on/east-york/sprinkler-systems?&page=3&"", ""https://homestars.com/on/east-york/sprinkler-systems?&page=4&"", ""https://homestars.com/on/east-york/sprinkler-systems?&page=5&"", ""https://homestars.com/on/east-york/sprinkler-systems?&page=6&"")",Sprinkler Systems,2954862,https://tedotsfinest.com/,/companies/2954862-tedot-s-finest-landscaping-sprinklers?searched_category_id=436&service_area=2251569,"Tedot’s Finest Landscaping & Sprinklers provides complete landscape design, construction and maintenance services in the Greater Toronto Area.  
Our special one-stop shop of highly skilled team members can fulfill all of your landscaping needs.  
Whether your dream is having beautiful green grass with an automated irrigation system in the front or a luxurious stone patio complete with an outdoor kitchen in the backyard, our team provides full service to manage your dream project end-to-end.  
Our unique approach saves you the time, money and frustration that comes with dealing with multiple contractors and companies to transform your space.",tedot-s-finest-landscaping-sprinklers,2021-04-05T19:58:48.000-04:00,NA,NA,NA,,"Sprinkler and irrigation Installation, repairs, closing and activation of system.","Hunter, Rainbird, Rachio",Sprinkler and Irrigation systems,NA,NA,"Cash, E-Transfer, Cheques",,,,FALSE,FALSE,,,FALSE,FALSE,,2016840,Tedot's Finest Landscaping & Sprinklers,45,42,13,9.7619,"Sprinkler Systems, Fire Sprinkler, Lawn Sprinkler, Garden Sprinkler, underground sprinklers, underground irrigation, irrigation systems, automatic sprinkler systems, what is irrigation, irrigation, sprinkler, sprinklers, irrigation sprinkler, sprinkler irrigation, the irrigation system, irrigation system, irrigation sprinklers, irrigation systems,  systems irrigation, how to sprinkler system, the sprinkler system, what is a sprinkler system, sprinkler system, bird rain, water irrigation, sprinkler systems how to, watering system, ,",0,tedots,FALSE,0,0,17,0,FALSE,128b5573d37c78ef0156a2163f891ed6a60b2586,TRUE,2022-06-01T00:05:50.000-04:00,TRUE,TRUE,2251569,96.2005132968,436,NA,NA,2021-04-05T19:59:29.000-04:00
