Link,n_hits,all_links,category,id,url,hs_path,profile,permalink,created_at,sic_code,service_area,hours,products,services,brands,specialities,established,employee_cnt,payment_method,diplomas,licenses,memberships,liability_insurance,bonded,project_rate,project_minimum,written_contract,written_warranty,warranty_terms,parent_company_id,name,total_number_of_reviews_cache,total_number_of_approved_reviews_cache,number_of_photos_cache,avg_rating_cache,categories_info_cache,savings_count,claimed_at,subdomain,fraudulent,fraudulent_count,total_number_of_pending_reviews_cache,images_count,completion_percent_cache,bully,secret,replied_to_at_least_one_review_cache,latest_approved_review_created_at,has_set_tasks,lead_purchase_eligible,service_area_id,star_score,quote_button_category,direct_phone,direct_contact
https://homestars.com/on/essa/fences-gates,2,https://homestars.com/on/essa/fences-gates,Fences & Gates,2777509,http://www.art-metal.ca,/companies/2777509-art-metal-workshop?searched_category_id=354&service_area=1872402,"Visit our new website:
<a href=""http://www.art-metal.ca"">www.art-metal.ca</a> 

We are a family owned and operated company manufacturing wrought iron railings and other iron products based in Toronto, Ontario.

Our mission is to provide you with highest quality iron products at a low cost and to ensure your satisfaction with our product and service.

Our core value: 
In today's construction business industry we encounter many companies who simply rush, cheat, and work around the right way of doing things.
Having work done with utmost integrity, honesty, and compassion is our number one value in a project.

We provide lifetime warranty on galvanized iron work.

We also provide services for: fences & gates, patios & decks, floor refinishing",art-metal-workshop,2010-01-29T16:55:05.000-05:00,NA,"Toronto, Etobicoke, North York, Markham, Scarborough, Richmond Hill, Caledon, Orangeville, Stoufville, Mississauga, GTA, King City, Kleinburg","Mon-Fri 9-5, Sat 9-2","Wrought iron railings, fences, gates, grates, garden and driveway gates, window grills, security bars, glass railings

Patios and Decks, Floor refinishing","Galvanizing, mobile welding, fence repairs",Wrought iron,"Interior & exterior iron railings, fences, gates, window bars, enclosures, safety grates",2003,NA,"PayPal (CC), Cash, Cheque, Debit","Best of Toronto 2010, 2011, 2012, 2013, 2014, 2016-2020 (HomeStars), A+ BBB rating","CWB, TSSA","BILD, BBB, HOMESTARS!!!, Better Building Guide, Home and Style",TRUE,FALSE,,,TRUE,FALSE,Galvanized warranty available ,1840561,Art Metal Workshop Inc.,828,751,276,9.8775,"Art Metal Work, Heavy Metal Art Work, Wall Metal Art Work, Metal Art Work Sign, sculptures, modern art, art of modern, art and modern, the wall art, wall art, art wall, art work, wrought iron, contemporary art, art with metal, metal in art, ,Fences & Gates, Dog Fence, Invisible Fence, Chain Link Fence, Pool Fence, Wood Fence, Fence Gates, Dog Gates, Pet Gates, friendly neighbour fence, friendly neighbor fence, picket fence, wrought iron fence, and gate, and gates, gates, the fence, a fence, fence, fences, fence with gate, gate and fence, gate for fence, fence & gate, gate fence, fence gate, fence and gate, gates and fence, gates fence, fence & gates, fence and gates, fence gates, railings, wrought iron, electronic gates, entrance gate, trellis, fence post, front gates, chain fence, fence panels, fence chain link, chain link fence, how to wood fence, fence wood, wood for fence, wood fence, fence panel, garden gate, fence posts, fencing panels, iron gate, chain link fencing, panel fencing, gates iron, iron gates, chain link fences, fences chain link, fencing post, dog fencing, ,Decks, Deck, Wood Deck, Deck Patio Furniture, Patio Heater, Patio Deck, Patio Door, Patio Cover, Patio Umbrella, Patio Furniture Set, Patio Furniture Cushion, the deck, on deck, deck tech, patios, construction plans, how to build a deck, build decks, build a deck, deck plans, design deck, design a deck, deck design, deck building, building a deck, building deck, deck designs, how to make a deck, patio cover, wood deck, deck wood, deck board, patio designs, deck designs plans, deck plans designs, deck builder, deck stain, deck builders, ,Railings, stair railings, outdoor railings, iron railings, wrought iron railings, wood railings, rail, gates, fence, rails, fencing, rail times, fences, fence gate, fence gates, railing, wrought, wrought iron, handrail, handrails, balustrade, balconies, rail simulator, speed rail, iron works, stair steps, balusters, iron work, fence panels, hand rail, banister, hand railing, rail works, ironworks, balustrades, front gates, curtain rails, garden gate, iron gate, gate iron, gates iron, iron gates, ,",1,2010-01-29T23:32:09.000-05:00,artmetal,FALSE,0,1,266,100,FALSE,4756189552bf30c51c2c5fc76f705c37e9f855e1,TRUE,2022-11-15T10:33:09.000-05:00,TRUE,TRUE,1872402,98.6636856478,354,NA,NA
https://homestars.com/on/essa/fences-gates,2,https://homestars.com/on/essa/fences-gates,Fences & Gates,2961209,,/companies/2961209-eagle-one-carpentry?searched_category_id=354&service_area=2275007,,eagle-one-carpentry,2021-11-01T14:03:54.000-04:00,NA,NA,NA,,,,,NA,NA,,,,,FALSE,FALSE,,,FALSE,FALSE,,2023180,Eagle One Carpentry,6,6,49,10,"Trim and Moldings, Wood Mouldings, Architectural Mouldings, Decorative Mouldings, Ornamental Mouldings, Mouldings For Picture Frame, Trimwork, wood moldings, architectural moldings, ornamental moldings, decorative moldings, decorative mouldings, dado rails, wood paneling, French baseboards, 9"" baseboards, stair rails, stair bannister, cornice moulding, crown moulding, crown molding, molding, moulding molding, molding or moulding, molding trim, molding and trim, trim molding, moulding and trim, moulding trim, trim moulding, mouldings, moldings, crown molding, molding crown, crown molding in, crown moulding, moulding crown, crown molding moulding, door trim molding, door trim moulding, trim mouldings, mouldings trim, mouldings and trim, moldings crown, crown moldings, crown mouldings, install crown molding, crown molding cut, cut crown molding, crown moulding cut, cut crown moulding, molding company, wood trim moulding, molding corner, corner molding, mold trim, plastic trim moulding, molding corner, corner molding, mold trim, plastic trim moulding, plastic moulding trim, moulding company, corner moulding, moulding corner, plastic trim molding, moldings and trim, moldings trim, trim moldings, molding co, molding companies, installing crown molding,,Carpenters, carpenter, finish carpenter, local carpenter, carpenter work, carpenter companies, master carpenter, carpenters and joiners, carpentry, union carpenter, carpenter co, carpenter services, carpenter construction, interior framing, mud room, mudroom, playsets, playground, wooden playset, wooden playground, play set, caulking,,Fences & Gates, Dog Fence, Invisible Fence, Chain Link Fence, Pool Fence, Wood Fence, Fence Gates, Dog Gates, Pet Gates, friendly neighbour fence, friendly neighbor fence, picket fence, wrought iron fence, and gate, and gates, gates, the fence, a fence, fence, fences, fence with gate, gate and fence, gate for fence, fence & gate, gate fence, fence gate, fence and gate, gates and fence, gates fence, fence & gates, fence and gates, fence gates, railings, wrought iron, electronic gates, entrance gate, trellis, fence post, front gates, chain fence, fence panels, fence chain link, chain link fence, how to wood fence, fence wood, wood for fence, wood fence, fence panel, garden gate, fence posts, fencing panels, iron gate, chain link fencing, panel fencing, gates iron, iron gates, chain link fences, fences chain link, fencing post, dog fencing, ,General Contractors, Residential General Contractor, Building Contractor, Additions, Remodeling Contractor,  Renovation, Builder, building construction, renovation, remodeling, construction builders, construction company, construction companies, home repair, construction jobs, home remodeling, general contractors, contractors general, contractor general, contractors construction, construction contractors, home improvement and remodeling, kitchen remodeling, construction contractor, builders contractors, home renovation, general contracting, building contractors, building companies, home renovations, builder contractor, building contractor, remodeling contractor, commercial construction, residential construction, house contractor, concrete contractors, home contractors, general construction, construction general, contractors remodeling, remodeling contractors, remodelers, remodel contractor, remodel contractors, general contract, commercial contractors, renovations contractors, home improvement contractor, licensed contractor, license general contractor, mud room, mudroom, caulking, ,",0,2021-11-02T16:37:55.000-04:00,eagleonecarpentry,FALSE,0,0,62,0,FALSE,2d62cc214894b99f3f6f91709b800970c1302b2b,TRUE,2022-01-26T12:08:24.000-05:00,TRUE,TRUE,2275007,90.7263512119,354,NA,NA
