Link,n_hits,all_links,category,id,url,hs_path,profile,permalink,created_at,sic_code,service_area,hours,products,services,brands,specialities,established,employee_cnt,payment_method,diplomas,licenses,memberships,liability_insurance,bonded,project_rate,project_minimum,written_contract,written_warranty,warranty_terms,parent_company_id,name,total_number_of_reviews_cache,total_number_of_approved_reviews_cache,number_of_photos_cache,avg_rating_cache,categories_info_cache,savings_count,claimed_at,subdomain,fraudulent,fraudulent_count,total_number_of_pending_reviews_cache,images_count,completion_percent_cache,bully,secret,replied_to_at_least_one_review_cache,has_set_tasks,lead_purchase_eligible,service_area_id,star_score,quote_button_category,direct_phone,direct_contact
https://homestars.com/on/saint%20jacobs/interior-design,1,https://homestars.com/on/saint%20jacobs/interior-design,Interior Design,2966424,https://www.lushdesigns.ca/,/companies/2966424-lush-designs?searched_category_id=390&service_area=2276251,"Lush Designs was born out of a passion for design and a love for all of the finer things in life.

We have been renovating and designing homes for well over a decade and that love for quality products grew into opening a custom millwork company. We know details and more importantly, we fully comprehend how things are manufactured.

We see interior design as a work of art and we only partner with clients who appreciate the environments we produce. We know how to help you develop a healthy budget for your project, indentify the needs and desires of your space, determine workable designs and ultimately execute those visions through delivery and installation.

We bring a set of fresh eyes to every space and can contribue new ideas that may not have been dreamt of. We look at the functionality of any space and ensure that we maximize every square inch so that your life becomes clutter free and systemized in a way that makes sense. We ensure that things go right the first time and everyone is held accountable for their timelines. In essence, we handle all of the stress so you can enjoy the process of your brand new space.

Lets see if we are a good fit, contact us today to get started.",lush-designs,2022-03-26T07:46:24.000-04:00,NA,NA,NA,,"3D renderings
layouts
moodboards
decor and styling
renovations
project management",,3D renderings,2010,NA,"Cash, E-Transfer, Cheque",,,,TRUE,FALSE,,,TRUE,FALSE,,2028342,Lush Designs,0,0,41,NA,"Interior Design, Home Interior Designers, Kitchen Interior Design, interior, what is interior design, about interior design, design interior, interior by design, home designs, interior designer, designer interior, how to be a interior designer, what is an interior designer, home design, decorating ideas, design and decorating, decorating and design, interior designers, interior decoration, room design, interior design decoration, interior decorating, house decorating, home decorating, desings homes, interior design decorating, interior decorating design, decorating and interior design, home building plans, decorating tips, room designs, design homes, decorating design ideas, design photos, interior house, interior decorator, bedroom design, architecture design, bedroom designs, careers in design, interior designs, office design, architectural design, ,Design/Project Management, Drafters, Drafting, Project Management, Building, General Contracting, Renovation Management, Project Manager, Design Management.,Drafting Service, residential drafting service, architectural drafting service, draftsmen, draftspeople, CAD services, residential CAD services, building permits, what is cad, to cad, architect, architects, house designs, house plans, plans house, plan house, plans home, home plans house plans, drafting, building plans, cad download, mechanical engineering, free cad, 3d cad, drawing cad, drawing in cad, cad drawing, 3d design, engineering companies, engineering design, design engineering, engineering services, cad software, architectural design, design architectural, houses plan, design house plans, house plans design, microstation, cad cam, engineering firms, design engineer, cad drawings, architects plan, cadd, cad files, cad design, cad and design, design cad, house plan design, architecture plan, architectural designs, home plan design, design home plan, engineering drawing, cad system, architectural plan, ,",0,2022-03-26T07:46:54.000-04:00,,FALSE,0,0,51,0,FALSE,f5278094da59d36537c36090ab2d61eb7e71900c,FALSE,TRUE,TRUE,2276251,-1.0,390,NA,NA
