Link,n_hits,all_links,category,id,url,hs_path,profile,permalink,created_at,sic_code,service_area,hours,products,services,brands,specialities,established,employee_cnt,payment_method,diplomas,licenses,memberships,liability_insurance,bonded,project_rate,project_minimum,written_contract,written_warranty,warranty_terms,parent_company_id,name,total_number_of_reviews_cache,total_number_of_approved_reviews_cache,number_of_photos_cache,avg_rating_cache,categories_info_cache,savings_count,claimed_at,subdomain,fraudulent,fraudulent_count,total_number_of_pending_reviews_cache,images_count,completion_percent_cache,bully,secret,replied_to_at_least_one_review_cache,latest_approved_review_created_at,has_set_tasks,lead_purchase_eligible,service_area_id,star_score,quote_button_category,direct_phone,direct_contact
https://homestars.com/on/georgetown/concrete-contractors,54,"c(""https://homestars.com/on/georgetown/concrete-contractors?&page=2&"", ""https://homestars.com/on/georgetown/concrete-contractors?&page=3&"", ""https://homestars.com/on/georgetown/concrete-contractors?&page=4&"", ""https://homestars.com/on/georgetown/concrete-contractors?&page=5&"", ""https://homestars.com/on/georgetown/concrete-contractors?&page=6&"")",Concrete Contractors,2775549,https://www.aamasonry.ca,/companies/2775549-a-a-masonry?searched_category_id=337&service_area=2291052,"Award Winning Specialists!
416-236-8721

A&A Masonry is an award-winning Toronto based firm specializing in almost everything exterior.  Specialties include Stone work, Interlock, Interlocking, Paver stones, paving stones, Natural Stone, Pavers, Stone Veneer Cladding, Tuckpointing, Masonry, brick repair, brick restoration, tuck pointing, waterproofing, foundation repairs, concrete steps, porches, walkways, caulking services (windows & doors), chimney repair and general exterior restorations for residential, commercial and industrial customers.

A&A is dedicated to providing the highest quality on every job. With a proud team of qualified artisans, we strive to complete every project in a timely and safe manner.

Our mission is to offer a unique and reliable service in anything Exterior within the Greater Toronto Area, differentiating ourselves from the competition by means of always delivering what we promise, on time and on budget.

Our commitment to excellence is our core value.
Customer satisfaction is our main goal, and we reach it every day by relying on our attention to customer service. By providing customized solutions for every job, we guarantee that we will never compromise on quality, safety and efficiency.

This approach together with our experience and knowledge allows us to effectively handle a wide variety of projects, from small to big, indoors or outdoors, renovations or repairs. 

We service:  Toronto, Etobicoke, Mississauga, Thornhill, Richmond Hill, York, North York, East York, Mimico, Hamilton, Brampton, Bolton and surrounding areas. 

For FREE ESTIMATE CALL: 416-236-8721

Being Masonry Contractors, Concrete Contractors, Stone  Contractors & Waterproofing Contractors we specialize in:
Stone work, Interlocking Natural Stone & Pavers, Stone Veneer Cladding, Tuckpointing, Tuck Pointing, Chimney Repair, Chimney Rebuild, Chimney Restoration, tuckpointing, Brickwork, Brick Repair, Brick Replacement, Parging, Waterproofing, Foundation Repair, Concrete Resurfacing, Concrete Porches, Concrete Steps, Patios and Walkways, Flagstone, Cultured Stone, Caulking services (windows and doors), Masonry, Masonry repair, steps, concrete porches, concrete walkways and patios, caulking services.

For the Hamilton area please visit out Hamilton websites
https://hamiltonmasonry.ca
https://hamiltonconcrete.ca
https://hamiltonwaterproofing.ca 

Licenses- 
City of Toronto license # T85-4429645
City of Mississauga license # 2022 005912 BR
Town of Oakville license # 22-114336
City Hamilton license # 20 298360 01 MA; No. 20 298361 01 CL
City of Brampton license # DW0062 21",a-a-masonry,2009-06-27T12:37:38.000-04:00,NA,"Toronto, Etobicoke, Mississauga, 
<br />Oakville, Bolton, Brampton, Caledon, Hamilton
<br />Thornhill, Richmond Hill, York, North York, East York, Mimico and surrounding areas. ",,,"Natural stone and stone veneer contractor, Interlocking Stone & Pavers, Hardscaping, Stone Fireplace, Brick Fireplace, Tuckpointing, Chimney Repair, Chimney Rebuild, Chimney Restoration, tuck pointing, Brickwork, Brick Repair, Brick Replacement, Parging, Foundation Repair, Concrete, Porches, Concrete Steps, Concrete Resurfacing, Patios and Concrete Walkways, Flagstone, Cultured Stone, Caulking services (windows and doors), Masonry, Masonry repair, Water Proofing, ",A&A Masonry,"Stone veneer cladding, Interlock, Interlocking Stone, Paver stones, Paving stones,  Stone Installation, Hardscaping, chimney rebuild and repair, tuckpointing, waterproofing, water proofing, foundation repair, concrete steps, concrete porches, concrete walkways, concrete patios.",2009,NA,check,,"Yes, All Applicable - See Profile Description For Full Details",BBB Accredited Business,TRUE,TRUE,,"Masonry $2800, Concrete $5000, Interlocking $3500",TRUE,FALSE,,1838601,A&A Masonry,875,745,73,9.93826,"Foundations, foundation repair, foundation pouring, foundation, the foundation, foundations, foundation for home, home foundation, foundation of home, foundation home, the home foundation, foundation house, house foundation, foundation of a house, foundation for a house, building foundation, homes foundation, foundation for homes, foundation homes, foundations home, foundations house, house foundations, foundations for homes, home foundation repair, building home foundation, manufactured homes foundation, types of home foundations, home foundations types, home foundation problems, mobile home foundations, home building foundations, home foundation cracks, cracks in home foundation, new home foundations, home foundation design, foundation design, foundation cracks, underpinning, ,Historical Restoration, heritage restoration, historical restoration, restorers, old houses, historic, preservation, historic buildings, buildings historic, historic district, historic property, historical homes, restoration homes, historic homes for sale, historical properties, repair contractors, repair contractor, brick repair, restoration company, historical preservation, restoration co, historical architecture, restoration contractors, building restoration, restoration building, masonry repair, restoration homes, homes restoration, restoration construction, construction restoration, historic restoration, historical conservation, building preservation, restoration brick, brick restoration, masonry restoration, restoration masonry, restoration corporation, antique buildings, restoration of buildings, ,Chimney Build & Repair, Chimney repairs, Chimney Building, Chimney maintenance, Chimney sweeping, chimney cleaning, chimney, fireplace and chimney, chimney sweep, chimney cleaning how to, chimney cleaning, chimney repair, repair chimney, chimney clean, chimney cleaners, brick chimney, chimney service, chimney cleaner, new chimney, chimney repair service, build chimney, chimney build, chimney restoration, fireplace chimney cleaning, fireplace chimney repair, chimney cleaning repair, chimney building, chimney building how to, ,Interlocking Stone, Interlocking Tile, Stone, tiles for, landscaping, paving, pavers, paver, stone step, wall stone, stone wall, landscape design, patios, interlock, retaining wall, stepping stones, interlocking, landscaping ideas, retaining walls, paving stones, paver stones, pavers stones, pavers and stones, stones pavers, stones and pavers, flagstone, concrete design, landscapers, natural stone, paving stone, stone paving, stone paving stone, walls stone, patio designs, stone and tiles, tiles and stone, stone flagstones, slate tiles, slate tile, stone veneer, pavers stone, stone and pavers, stone pavers, paver stone, stone paver, concrete driveway, stone brick, stone and brick, brick and stone, stone flooring, stone patio, stone for patio,,Tuck Pointing, Chimney Repair, Chimney Bricklaying, Chimney Masonry Repair, Chimney Sweeps, repointing, pointing, Chimney and Tuck Pointing, ,Concrete Contractors, Impressed concrete, poured concrete, stamped concrete, radiant heating, concrete floors, contractors, concrete repair, concrete in, masonry, asphalt, paving, pavers, in the driveway, driveway, construction companies, driveways, block of concrete, concrete block, concrete mix, concret, concrete blocks, concrete slab, cost of concrete, concrete cost, concrete wall, price of concrete, concrete price, concrete stain, stamped concrete, concrete prices, repair concrete, how to repair concrete, repair of concrete, concrete repair, concrete slabs, decorative concrete, concrete decorative, staining concrete, concrete staining, concrete walls, countertop concrete, concrete countertops, patio ideas, cement companies, ready mix concrete, concrete ready mix, slabjack, slabjacking, mudjack, mudjacking, Driveway, caulking,,Masonry & Bricklaying, Masonry Supply, Masonry Contractor, Stone Masonry, Brick Laying, Technique, Brick Laying Pattern, stone wall, brick wall, masonry repair, brick repairs, masonry, brick masonry, masonry bricklaying, masonry work, mason contractors, york masonry, masonry companies, brick masonry construction, brick contractors, masonry brick laying, masonry workers, bricklaying firms, parging, ,Waterproofing, Basement Waterproofing, Foundation Waterproofing, Waterproofing Contractor, Water, Waterproof, Wet Basement, Leaky Basement, Flood, Flooded Basement, Flooding ,Waterproofing, Basement leaks, underpinning, caulking,,",2,2009-06-27T12:37:37.000-04:00,aaconcrete,FALSE,0,0,62,100,FALSE,a5c33dc0b1e833fd530fc249a4facab54f125529,TRUE,2022-11-08T12:02:52.000-05:00,TRUE,TRUE,2291052,99.1864436423,337,NA,NA
https://homestars.com/on/georgetown/concrete-contractors,54,"c(""https://homestars.com/on/georgetown/concrete-contractors?&page=2&"", ""https://homestars.com/on/georgetown/concrete-contractors?&page=3&"", ""https://homestars.com/on/georgetown/concrete-contractors?&page=4&"", ""https://homestars.com/on/georgetown/concrete-contractors?&page=5&"", ""https://homestars.com/on/georgetown/concrete-contractors?&page=6&"")",Concrete Contractors,2847649,http://sealall.ca,/companies/2847649-sealallpavement-inc?searched_category_id=337&service_area=2096489,"Sealall    Provide Services To Residential and Commercial more then 20 years Experience Pressure washing,   and sealing  power washing Driveway, Concrete Sealing, Concrete Color Restoration, Stamped Concrete Sealing stamped concrete non Slip Sealing,  interlocking Pavers Pressure Washing & Sealing, Interlock Polymeric Sand Installation,  Interlock repair, Interlock Pressure washing, Driveway Interlock Sealing, Interlock pavers installation, Driveway sealing, Asphalt sealcoating, Parking lot clean and seal, Natural stone cleaning and sealing, Natural stone installation, Natural stone work, Toronto Richmond hill Brampton Vaughan Markham Mississauga Pickering Ajax New market Barrie Oakville Burlington Milton Whitby North York Scarborough Stouffville and more. Call US Today for Estimate 416 312 4453          ",sealallpavement-inc,2014-01-19T11:44:40.000-05:00,NA," Service Areas: GTA,Toronto, Brampton, king city, New market, Aurora, Blue Mountain, Wasaga Beach , Stayner, Barrie , Angus, Innisfil, Stroud, Thornton , Bethesda, Tottenham , Beeton , New Tecumseh , Cookstown, Simcoe, The grange, Boston Mills, Caledon , Caledon east , Mono Mills, George Town, Halton Hills, Orangeville, Shelburne, Borden, Midhurst, Bethesda, Caledon, Queens Ville , Keswick, Uxbridge, Whitchurch-stouffille, Ringwood, Bradford , Bond head , West Gwilimbury, Milton, Georgetown, Coppins Corner, Claremont, Sharon, Stoufville, Coppins Corner, Claremont, Sharon <br/>

<br/>Brock, Mount Albert, Durham Region.  Vaughan, Markham, Pickering  Mississauga Oakville ",7 days a week,Interlocking Concrete  Power Washing And Repairs Installation Concrete and Intelocking,"SEALALL  PROVIDES PROFESSIONAL CLEANING AND PROTECTIVE INTERLOCKING STONE, NATURAL STONE, DECORATIVE CONCRETE, STAMPED CONCRETE, AND THE RESIDENTIAL AND COMMERCIAL  FOR 18 YEARS. POWER WASHING INTERLOCKING STONE POWER WASHING PATTERN CONCRETE SEALING INTERLOCKING STONE SEALING STAMED CONCRETE NATURAL STONE SEALING  INSTALLATION CONCRETE AND INTEROCKING AND FLAGSTONE.
service areas include 
AURORA, MARKHAM, RICHMOND HILL, TORONTO, ETOBICOKE, NORTH YORK, SCARBOROUGH, VAUGHAN, STOUFFVILLE, WOODBRIDGE, MAPLE, THORNHILL, UNIONVILLE, MISSISSAUGH, KING CITY, NOBELTON, PICKERING, AJAX, WHITBY.

","Decorative/Natural stone/Interlock, Restoration and new Finish",interlock Restoration weed removal Decorative Concrete Renewal sealing Interlock Ripers Concrete sealing and striping old sealer  power washing home exterior,2001,5,,,yes ,,TRUE,TRUE,,$1500,TRUE,FALSE,1 year ,1910083,Sealallpavement Inc,394,362,294,9.9558,"Landscape Contractors & Designers, Landscape Contractor Designer, Landscape Design, Landscape Contractor, Landscapers, Landscaping, Landscape, Backyard, patio, Fountain, Ponds and Waterfalls, garden, gardens, landscape, how to landscape, landscaping and, landscape garden, garden landscape, gardening, landscape gardens, pavers, garden design, design a garden, design for garden, design garden, how to design garden, lawn maintenance, how to design landscape, design landscape, landscape and design, design and landscape, how to design a landscape, landscape design, design a landscape, patios, architects landscape, landscape architects, garden designs, lawn service, garden landscaping, landscaping garden, landscape lighting, garden designer, designer garden,,landscapemakeover of backyard and improve front yard
build fence, landscape, Landscaping, retaining wall, grading,Masonry & Bricklaying, Masonry Supply, Masonry Contractor, Stone Masonry, Brick Laying, Technique, Brick Laying Pattern, stone wall, brick wall, masonry repair, brick repairs, masonry, brick masonry, masonry bricklaying, masonry work, mason contractors, york masonry, masonry companies, brick masonry construction, brick contractors, masonry brick laying, masonry workers, bricklaying firms, parging, ,Design/Build, Contracting, Renovation, Remodeling, Restoration, Project Management, Renovation Assistance, Reno Management, architect, architects, design build, build & design, design and build, build by design, design to build. building construction, building a house, house designs, house plans, home designs, house plan, how to design a house, design house, house design, remodeling, building and design, design for building, design building, building by design, a building design, design of building, building design, design a building, building & design,  playsets, playground, wooden playset, wooden playground, play set, ,Paving Contractors, Paver, Asphalt Paving, Paving Stones, Paving Commercial Paving, Asphalt Paving Material, Driveway Paving, residential paving, what is asphalt, asphalt, paving, slabs, pavers, driveway, paver, driveways, pavements, patios, tarmac, paving pavers, asfalt, blacktop, paving stones, paver stones, paving stone, stone paving, stamped concrete, flagstones, paving slabs, patio designs, concrete slabs, block paving, patio design, paving slab, patio ideas, paving flags, asphalt pavement, concrete driveway, driveway concrete, concrete patio, concrete calculator, paving asphalt, asphalt paving, asphalt and paving, concrete contractors, concrete contractors in, concrete driveways, patio pavers, concrete contractor, concrete pavers, seal coating, paving concrete, concrete paving, paving and concrete, paving or concrete, paver patio, sealcoating, paving blocks, ,Interlocking Stone, Interlocking Tile, Stone, tiles for, landscaping, paving, pavers, paver, stone step, wall stone, stone wall, landscape design, patios, interlock, retaining wall, stepping stones, interlocking, landscaping ideas, retaining walls, paving stones, paver stones, pavers stones, pavers and stones, stones pavers, stones and pavers, flagstone, concrete design, landscapers, natural stone, paving stone, stone paving, stone paving stone, walls stone, patio designs, stone and tiles, tiles and stone, stone flagstones, slate tiles, slate tile, stone veneer, pavers stone, stone and pavers, stone pavers, paver stone, stone paver, concrete driveway, stone brick, stone and brick, brick and stone, stone flooring, stone patio, stone for patio,,Concrete Contractors, Impressed concrete, poured concrete, stamped concrete, radiant heating, concrete floors, contractors, concrete repair, concrete in, masonry, asphalt, paving, pavers, in the driveway, driveway, construction companies, driveways, block of concrete, concrete block, concrete mix, concret, concrete blocks, concrete slab, cost of concrete, concrete cost, concrete wall, price of concrete, concrete price, concrete stain, stamped concrete, concrete prices, repair concrete, how to repair concrete, repair of concrete, concrete repair, concrete slabs, decorative concrete, concrete decorative, staining concrete, concrete staining, concrete walls, countertop concrete, concrete countertops, patio ideas, cement companies, ready mix concrete, concrete ready mix, slabjack, slabjacking, mudjack, mudjacking, Driveway, caulking,,",1,NA,sealallhardscap,FALSE,0,0,283,0,FALSE,244a496808193cca63bf55e7e49a6016f2b287b7,TRUE,2022-10-02T20:57:36.000-04:00,TRUE,TRUE,2096489,99.1260991459,337,NA,NA
https://homestars.com/on/georgetown/concrete-contractors,54,"c(""https://homestars.com/on/georgetown/concrete-contractors?&page=2&"", ""https://homestars.com/on/georgetown/concrete-contractors?&page=3&"", ""https://homestars.com/on/georgetown/concrete-contractors?&page=4&"", ""https://homestars.com/on/georgetown/concrete-contractors?&page=5&"", ""https://homestars.com/on/georgetown/concrete-contractors?&page=6&"")",Concrete Contractors,2879877,https://tornado-plumbing.com/,/companies/2879877-tornado-plumbing?searched_category_id=337&service_area=2289149,"At Tornado Plumbing we work hard to fulfill all your plumbing needs, and offer some of the best service in the GTA. Our products are high quality, and all of our work is under warranty. By using the most recent technology we can offer you the best service to ensure your plumbing work is done efficiently and with quality. We provide free estimates, competitive rates, and city rebates are available.
Our services include waterproofing, pipe burst, plumbing repairs, backwater valve, concrete work, water service and repairs, drain camera inspections, drain snaking, and underpinning (basement lowering).
With appointments booked at your convenience, and 24 hour emergency service, you’re sure to get the job done with Tornado Plumbing.

Check us out here:
https://www.facebook.com/TornadoPlumbingCom
https://twitter.com/TornadoPlumbing
https://www.instagram.com/tornado_plumbing/

YouTube videos on various plumbing and drain services may be found in our photo gallery.

",tornado-plumbing,2015-11-24T22:06:11.000-05:00,NA,NA,NA,,"Waterproofing
Our skilled crews take all the necessary steps to clean and prepare your foundation wall prior to waterproofing.
We only use materials of the highest industry standard to seal your home from leaks.
With a 25 year warranty, you are guaranteed a dry basement and piece of mind.

Drains
When you need to replace your damaged sewer lines, we meet all city standards for drain work and backwater valves.
Using the minimally invasive pipe burst method, we can have your drains running again quickly.

Water Service
Using trench-less technology we can quickly replace your lead waterline or
upgrade your current water service, causing minimal damage to your property

Plumbing
We can take care of all your plumbing needs no matter the size.
Fixing small leaks to full plumbing line replacement, and everything in between.

Concrete work
From walkways to patio slabs we’ve got all your concrete needs covered.

Underpinning & Walkouts
If you’re looking for more living space, we can lower your basement to your desired height or add a second entrance.
Using approved engineer drawings, and following building codes, we will create the basement you want.

24/7 EMERGENCY SERVICE",,Ask about the City Rebates for Sump Pumps and Back Water Valves,2014,NA,ALL Major Payment types Accepted. ,Ontario College of Trades and Apprenticeships   (Plumbing)  ,"Drain Layer, Drain Contractor, Building Renovator.  See photo gallery. ",,TRUE,FALSE,,,TRUE,FALSE,25 years Labour and Warranty. Kindly ask for more details. ,1942301,Tornado Plumbing & Drains,406,366,2596,9.89891,"Drain Services, blocked drain, clogged drain, overflowing drain, roots in drain, sewage back up into house, drain repair, drain, plumber, plumbers, drains, sewer, drainage, clogged, septic tank, drain and sewer, sewer drain, sewer and drain, plumbing supplies, plummer, rooter rooter, plumbing and heating, heating and plumbing, plumbing heating, drain pipe, cleaning drain, cleaning the drain, drain cleaning, plumber heating, septic systems, cleaning drains, drain cleaner, water drainage, drain pipes, clean drain, drain clean, drainage pipe, plumbing service, service plumbing, drain cleaners, plumbing company, plumbing services, services plumbing, french drain, drainage systems, drainage pipes, septic plumbing, shower drains, drain systems, sewer line, french drains, caulking,,Foundations, foundation repair, foundation pouring, foundation, the foundation, foundations, foundation for home, home foundation, foundation of home, foundation home, the home foundation, foundation house, house foundation, foundation of a house, foundation for a house, building foundation, homes foundation, foundation for homes, foundation homes, foundations home, foundations house, house foundations, foundations for homes, home foundation repair, building home foundation, manufactured homes foundation, types of home foundations, home foundations types, home foundation problems, mobile home foundations, home building foundations, home foundation cracks, cracks in home foundation, new home foundations, home foundation design, foundation design, foundation cracks, underpinning, ,Plumbing, Plumber, Plumbers, Plumbing Contractor, Plumbing Repair, toilet repair, fixing toilet, fixing sink, broken faucet, faucet repair, tap repair, leaking toilet, leaking sink, leaking pipes, drain snaking, at plumbing, plumbing in, what is plumbing, a plumbing, the plumbing, plumbing and, how to plumbing, plumbing a, plumbing how to, an plumbing, a plumber, plumber, the plumber, plumber plumber, plumber in, how to plumber, plumbers in, the plumbers, plumbers, plumbing pipe, how to plumb, pipes and plumbing, plumbing pipes, pipes for plumbing, plummer, plumbing supplies, plumbing supply, plumbing heating, plumbing & heating, heating and plumbing, heating plumbing, plumbing and heating, pipe plumber, plumbing stores, plumbing suppliers, the plumbs centre, plumb centre, ,Waterproofing, Basement Waterproofing, Foundation Waterproofing, Waterproofing Contractor, Water, Waterproof, Wet Basement, Leaky Basement, Flood, Flooded Basement, Flooding ,Waterproofing, Basement leaks, underpinning, caulking,,Concrete Contractors, Impressed concrete, poured concrete, stamped concrete, radiant heating, concrete floors, contractors, concrete repair, concrete in, masonry, asphalt, paving, pavers, in the driveway, driveway, construction companies, driveways, block of concrete, concrete block, concrete mix, concret, concrete blocks, concrete slab, cost of concrete, concrete cost, concrete wall, price of concrete, concrete price, concrete stain, stamped concrete, concrete prices, repair concrete, how to repair concrete, repair of concrete, concrete repair, concrete slabs, decorative concrete, concrete decorative, staining concrete, concrete staining, concrete walls, countertop concrete, concrete countertops, patio ideas, cement companies, ready mix concrete, concrete ready mix, slabjack, slabjacking, mudjack, mudjacking, Driveway, caulking,,",0,NA,tornado,FALSE,0,0,1831,0,FALSE,71bf627bba9507016c570b3181652d89ec789754,TRUE,2022-07-01T12:41:08.000-04:00,TRUE,TRUE,2289149,96.643794688,337,NA,NA
