Link,n_hits,all_links,category,id,url,hs_path,profile,permalink,created_at,sic_code,service_area,hours,products,services,brands,specialities,established,employee_cnt,payment_method,diplomas,licenses,memberships,liability_insurance,bonded,project_rate,project_minimum,written_contract,written_warranty,warranty_terms,parent_company_id,name,total_number_of_reviews_cache,total_number_of_approved_reviews_cache,number_of_photos_cache,avg_rating_cache,categories_info_cache,savings_count,claimed_at,subdomain,fraudulent,fraudulent_count,total_number_of_pending_reviews_cache,images_count,bully,secret,replied_to_at_least_one_review_cache,latest_approved_review_created_at,has_set_tasks,lead_purchase_eligible,service_area_id,star_score,quote_button_category,direct_phone,direct_contact,completion_percent_cache
https://homestars.com/on/hawkesville/home-additions,5,https://homestars.com/on/hawkesville/home-additions,Home Additions,2777922,http://www.trocanada.com,/companies/2777922-the-renovators?searched_category_id=378&service_area=2109278,"Why choose The Renovators of Canada?  
 
For over the past 20 years our focus on customer experience has helped The Renovators of Canada grow to locations in Durham, Aurora, Stouffville, Markham, Vaughan, Toronto, Hamilton, Guelph, Kitchener, Waterloo, Barrie, Oshawa, Oakville and Cambridge. 
 
Unique to the industry, The Renovators of Canada provides a 10 year warranty on all craftsmanship. This home renovation warranty protection was established to provide peace of mind as home and business owners contemplate renovating a personal or commercial space. 
 
T-ROC is a fully licensed and insured including WSIB. Other affiliations include memberships with the National Kitchen and Bath Association, CARAHS, Better Business Bureau.  
 
We have a proven track record working with our customers with full transparency in every aspect of your project.  Can’t be present all the time during the renovation process?  No worries, we have specialized client software that allows you to see the entire schedule and pictures as the project happens in real time. We care for your home like it’s our own and always conduct ourselves respectfully and professionally.  
 
With our motivated and innovative professionals we will transform your house and make your dream home a reality.  Visit our website at www.trocanada.com
  ",the-renovators,2010-02-21T15:31:15.000-05:00,NA,"Markham, Toronto, Stouffville, Pickering, Oshawa, Richmondhill, Vaughan, Mississuaga, Brampton, Oakville, Cambridge, Burlington, Hamilton, Kitchener, Waterloo",M&F 8:30-4:30 TWTh 8:30-7:00 Sat by appt,"Custom Homes, Home Additions, Kitchen Cabinets, Kitchen and Bathroom accessories, Flooring, drywall, Light fixtures, tiles, hardwood flooring, engineered wood flooring, windows, doors, garage doors ","Home Additions, Kitchen Renovation, Bathroom Renovation, Basement Renovation, drywall, tiling, granite, custom cabinetry, painting, basements, Renovation Consulting","Bain Ultra, Ultra Bath, Artisan manufacturing corp, Azzura, Blanco, Brizo, Caesarstone, Cambria, Caml Tomlin, Contrac, Delta, Diamastone, Doors & More, Oduravit, Elkay, Emtek, Fairmont Designs, Foremeost, Franke, Grohe, Hansgrohe, Insinkerator, Oceana, kallista, Kindred, The Bold Look of Kohler, Maax, Maax Collection, Mirolin, MOen, Motiv, Mr. Marble, Native trails, Newport Brass, Novanni, Olsonite, OS&B Palmer Industries, Panasonic, Price Phister, Robern, Ronbow, Runtal Radiators, Slik portfolio, Soma Foremost, Sonoma Forge, Sterling Portfolio, Stone Forest, Supreme, Lighting,Thermasol, Tidal, Kroy Surfaces inc., Richelieu, Silestone, Toto, Victoria Albert, Warmly Yours Radiant Heating, American Standard","Home additions, Kitchen Renovations, Basement renovations, Bathroom renovations, Income properties, Home upgrades, house flips",2002,50,"Cheques, Visa, Mastercard, Debit, email transfer",,Fully Licensed ,"Better Business Bureau, Baeumler Approved, Erenovate, Trusted Pros",TRUE,FALSE,,5000,TRUE,FALSE,10 year waranty on craftmanship.,1840974,The Renovators Of Canada,185,139,266,9.05755,"Bathroom Renovation, Bathroom renovation, bathroom remodeling, bathroom remodelling, renovating the bathroom, tearing out the bathroom, fixing up the bathroom, bathroom contractors, bathroom vanities, bathroom vanity, design of bathroom, bathroom and design, design for bathroom, design a bathroom, design a bath, bath design, bathroom tile, bathroom cabinets, remodeling a bathroom, bathroom remodeling, remodeling the bathroom, ,Bath renovation, New tub, caulking, ,Home Additions, General contractor, home improvement, building addition, home expansion, house expansion, house building, plans house, house plans from, plans for house, the house plans, house plans, renovation, in house design, home plans house, home house plans, house home plans, house plans home, remodeling, house plans and designs, designs house plans, house designs plans, house plans designs, home plans and designs, home designs plans, floor plans, house build, renovations, plans for building, kitchen cabinets, remodel, kitchen design, house plans for building, house plans building, ,General Contractors, Residential General Contractor, Building Contractor, Additions, Remodeling Contractor,  Renovation, Builder, building construction, renovation, remodeling, construction builders, construction company, construction companies, home repair, construction jobs, home remodeling, general contractors, contractors general, contractor general, contractors construction, construction contractors, home improvement and remodeling, kitchen remodeling, construction contractor, builders contractors, home renovation, general contracting, building contractors, building companies, home renovations, builder contractor, building contractor, remodeling contractor, commercial construction, residential construction, house contractor, concrete contractors, home contractors, general construction, construction general, contractors remodeling, remodeling contractors, remodelers, remodel contractor, remodel contractors, general contract, commercial contractors, renovations contractors, home improvement contractor, licensed contractor, license general contractor, mud room, mudroom, caulking, ,Kitchen Planning & Renovation, Kitchen Planning And Design, Kitchen Cabinet Planning, Kitchen Design, Kitchen Remodeling, kitchen or, and bathroom, a and a kitchens, kitchens and, for kitchens, a kitchens, kitchens, the house design, cabinets for kitchen, cabinets for the kitchen, cabinets and kitchen, kitchen cabinets, design a kitchen, about kitchen design, a kitchen design, how to kitchen design, design and kitchen, the kitchen design, design for kitchen, kitchen designs, renovation and remodeling, remodeling and renovation, kitchen designer,,Kitchen Renovation, caulking, ,Basement Renovation, Basement renovation, Basement remodeling, Basement remodelling, renovating your basement, renovation, waterproofing, remodeling, home renovation, house renovation, water in basement, basement waterproofing,finishing basement, moistureproof, remodeling the house, caulking,",0,2010-09-21T20:32:23.000-04:00,therenovators,FALSE,0,0,254,FALSE,1675c416d1c139a0ac43253ff49b0d5c1259bd4e,TRUE,2021-03-17T16:51:08.000-04:00,TRUE,TRUE,2109278,90.8134145553,378,NA,NA,NA
https://homestars.com/on/hawkesville/home-additions,5,https://homestars.com/on/hawkesville/home-additions,Home Additions,2903296,http://www.gcgeneralcontracting.com,/companies/2903296-gc-general-contracting-inc?searched_category_id=378&service_area=2269608,"10% OFF FOR CUSTOMERS DOING HOME RENOVATIONS!!!

Welcome to GC Contracting
Our commitment to your project is reflected in the over 20 years committed from learning from master trade and journeymen.  We will execute on your desired outcome while being transparent and enlightening  on the process.
We love what we do and it will show in the quality and craftsmanship. 
Contact us today to see what is possible.
Services: Kitchens, Flooring & Tiling, Decks & Fencing, Wainscoting, Rough Carpentry, Basement Renovations, Bathroom Renovations, Home Renovations.
",gc-general-contracting-inc,2017-10-10T10:44:13.000-04:00,NA,NA,NA,,"Bathroom Renovations, Kitchen Renovations, Flooring & Tiling, Decks & Fencing, Wainscoting, Rough Carpentry, Basement Reno",,Trust us to do the job once and do it right.,2012,5,"Cash, Cheque and e-transfer",,All technicians are licensed as required ,,TRUE,FALSE,,,TRUE,FALSE,YES. Ask for details. Depends on Project. ,1965481,GC General Contracting Inc.,43,31,260,9.58065,"General Contractors, Residential General Contractor, Building Contractor, Additions, Remodeling Contractor,  Renovation, Builder, building construction, renovation, remodeling, construction builders, construction company, construction companies, home repair, construction jobs, home remodeling, general contractors, contractors general, contractor general, contractors construction, construction contractors, home improvement and remodeling, kitchen remodeling, construction contractor, builders contractors, home renovation, general contracting, building contractors, building companies, home renovations, builder contractor, building contractor, remodeling contractor, commercial construction, residential construction, house contractor, concrete contractors, home contractors, general construction, construction general, contractors remodeling, remodeling contractors, remodelers, remodel contractor, remodel contractors, general contract, commercial contractors, renovations contractors, home improvement contractor, licensed contractor, license general contractor, mud room, mudroom, caulking, ,Framing, carpentry, carpenter, building a house, house building, house designs, home designs, house plan, design house, house design, how to build a house. build a house, building plans, houseplans, home builders in, building house, house building plans, house builders, construction of house, house construction, building homes, design homes, modular home, house builder, homebuilders,Carpenters, interior framing, ,Home Additions, General contractor, home improvement, building addition, home expansion, house expansion, house building, plans house, house plans from, plans for house, the house plans, house plans, renovation, in house design, home plans house, home house plans, house home plans, house plans home, remodeling, house plans and designs, designs house plans, house designs plans, house plans designs, home plans and designs, home designs plans, floor plans, house build, renovations, plans for building, kitchen cabinets, remodel, kitchen design, house plans for building, house plans building, ,Basement Renovation, Basement renovation, Basement remodeling, Basement remodelling, renovating your basement, renovation, waterproofing, remodeling, home renovation, house renovation, water in basement, basement waterproofing,finishing basement, moistureproof, remodeling the house, caulking,Kitchen Planning & Renovation, Kitchen Planning And Design, Kitchen Cabinet Planning, Kitchen Design, Kitchen Remodeling, kitchen or, and bathroom, a and a kitchens, kitchens and, for kitchens, a kitchens, kitchens, the house design, cabinets for kitchen, cabinets for the kitchen, cabinets and kitchen, kitchen cabinets, design a kitchen, about kitchen design, a kitchen design, how to kitchen design, design and kitchen, the kitchen design, design for kitchen, kitchen designs, renovation and remodeling, remodeling and renovation, kitchen designer,,Kitchen Renovation, caulking, ,Bathroom Renovation, Bathroom renovation, bathroom remodeling, bathroom remodelling, renovating the bathroom, tearing out the bathroom, fixing up the bathroom, bathroom contractors, bathroom vanities, bathroom vanity, design of bathroom, bathroom and design, design for bathroom, design a bathroom, design a bath, bath design, bathroom tile, bathroom cabinets, remodeling a bathroom, bathroom remodeling, remodeling the bathroom, ,Bath renovation, New tub, caulking, ,Fences & Gates, Dog Fence, Invisible Fence, Chain Link Fence, Pool Fence, Wood Fence, Fence Gates, Dog Gates, Pet Gates, friendly neighbour fence, friendly neighbor fence, picket fence, wrought iron fence, and gate, and gates, gates, the fence, a fence, fence, fences, fence with gate, gate and fence, gate for fence, fence & gate, gate fence, fence gate, fence and gate, gates and fence, gates fence, fence & gates, fence and gates, fence gates, railings, wrought iron, electronic gates, entrance gate, trellis, fence post, front gates, chain fence, fence panels, fence chain link, chain link fence, how to wood fence, fence wood, wood for fence, wood fence, fence panel, garden gate, fence posts, fencing panels, iron gate, chain link fencing, panel fencing, gates iron, iron gates, chain link fences, fences chain link, fencing post, dog fencing, ,Floor Laying & Refinishing, Hardwood Floor, Wood Floor, Floor Tile, Dance Floor, Ceramic Floor Tile, Floor Refinishing, bamboo floor, cork floor, FSC wood flooring, stone floor, marble floor, slate floor, squeaky floor repair, laminate, laminate repair, wood floor, floor and wood, wood flooring, wood floors, floors in wood, hardwood flooring, hardwood floors, hardwood floors and, hardwood floor, hardwood floor wood, wood floor flooring, refinishing, floor refinishing, floor refinishing in, refinishing floor, hardwood install, floor laying, laying a floor, flood sanding, wood floor refinishing, refinishing hardwood floors, flooring laying, wood floors refinishing, wood flooring refinishing, floor co, flooring hard wood, hard wood floors, laying floors, flooring company, flooring engineered hardwood, floor company, hard wood floor, cleaning hardwood floors, installing hardwood flooring, installing hardwood floors, installing wood flooring, installing wood floors, installing hardwood floors, installing wood flooring, installing wood floors, installing hardwood floor, hardwood flooring installation, business floor, wood flooring installation, hardwood floor installation, floor companies, lay hardwood flooring, lay hardwood floor, wood floor repair, repair wood floor, repair hardwood floor, hardwood floor repair, finishing a hardwood floor, squeeky floors,,Hardwood floors, Install hardwood floors, caulking,",0,2017-10-11T17:11:26.000-04:00,gccontracting,FALSE,0,0,448,FALSE,9cb00eedf7098d91a9978269096ade087e7d9e5e,TRUE,2020-09-03T05:47:04.000-04:00,TRUE,TRUE,2269608,91.5527383054,378,NA,NA,0
https://homestars.com/on/hawkesville/home-additions,5,https://homestars.com/on/hawkesville/home-additions,Home Additions,2972795,https://www.onenessrenovation.com/,/companies/2972795-oneness-renovation-inc?searched_category_id=378&service_area=2291784,"Specialist in Home & Basement Renovation. We believe in excellence, quality, and honesty.",oneness-renovation-inc,2022-09-08T16:01:27.000-04:00,NA,NA,NA,,,,"Home Additions
Basement Renovations",NA,NA,,,,,FALSE,FALSE,,,FALSE,FALSE,,2034706,Oneness Renovation Inc.,4,2,293,10,"Home Additions, General contractor, home improvement, building addition, home expansion, house expansion, house building, plans house, house plans from, plans for house, the house plans, house plans, renovation, in house design, home plans house, home house plans, house home plans, house plans home, remodeling, house plans and designs, designs house plans, house designs plans, house plans designs, home plans and designs, home designs plans, floor plans, house build, renovations, plans for building, kitchen cabinets, remodel, kitchen design, house plans for building, house plans building, ,Basement Renovation, Basement renovation, Basement remodeling, Basement remodelling, renovating your basement, renovation, waterproofing, remodeling, home renovation, house renovation, water in basement, basement waterproofing,finishing basement, moistureproof, remodeling the house, caulking,",0,2022-09-08T16:03:35.000-04:00,,FALSE,0,0,294,FALSE,bfaf987d9eb097c234603fddb3a67ce13aad7e86,TRUE,NA,TRUE,TRUE,2291784,90.5883388059,378,NA,NA,0
https://homestars.com/on/hawkesville/home-additions,5,https://homestars.com/on/hawkesville/home-additions,Home Additions,2960709,https://www.reliablechoicepainters.com/renovation/,/companies/2960709-reliable-choice-painters-and-drywall?searched_category_id=378&service_area=2264729,"Reliable Choice Painters and Drywall is a privately owned and corporately managed general contracting company.

We provide Commercial and Residential renovation services, that also includes framing, drywall installation & finishing and pride 
ourselves in delivering the highest quality construction service at a competitive price/rate, for businesses and home owners, within 
the the GTA, and Western Ontario.

Our services can also be tailored to suite your needs,  or the specific service demand of your business or home. 

Our staff are well trained, motivated and supported by knowledgeable operation managers and supervisors to ensure timely 
completion and the highest quality standard of service. 

We invest in our team so that we can invest in you..!!",reliable-choice-painters-and-drywall,2021-10-20T09:32:48.000-04:00,NA,NA,NA,,,,,2010,9,Check/Electronic payment,,Construction Contractor,,TRUE,FALSE,,$2500.00,TRUE,FALSE,3 yrs,2022680,Reliable Choice Painters and Drywall,21,16,119,10,"Home Additions, General contractor, home improvement, building addition, home expansion, house expansion, house building, plans house, house plans from, plans for house, the house plans, house plans, renovation, in house design, home plans house, home house plans, house home plans, house plans home, remodeling, house plans and designs, designs house plans, house designs plans, house plans designs, home plans and designs, home designs plans, floor plans, house build, renovations, plans for building, kitchen cabinets, remodel, kitchen design, house plans for building, house plans building, ,Drywall Contractors, Dry Wall Repair, Dry Wall Installation, dry wall contracting, gypsum repair, gypsum installation, gypsum contractors, gyprock installers, gyprock intallation, dry wall installers, sheetrock, wall board, drywall, drywaller, waller, wall repair, drywall, plaster, how to drywall, drywall, what is drywall, sheetrock, dry wall, plastering, wall repair, drywall repair, how to repair drywall, repair drywall,  ,General Contractors, Residential General Contractor, Building Contractor, Additions, Remodeling Contractor,  Renovation, Builder, building construction, renovation, remodeling, construction builders, construction company, construction companies, home repair, construction jobs, home remodeling, general contractors, contractors general, contractor general, contractors construction, construction contractors, home improvement and remodeling, kitchen remodeling, construction contractor, builders contractors, home renovation, general contracting, building contractors, building companies, home renovations, builder contractor, building contractor, remodeling contractor, commercial construction, residential construction, house contractor, concrete contractors, home contractors, general construction, construction general, contractors remodeling, remodeling contractors, remodelers, remodel contractor, remodel contractors, general contract, commercial contractors, renovations contractors, home improvement contractor, licensed contractor, license general contractor, mud room, mudroom, caulking, ,Trim and Moldings, Wood Mouldings, Architectural Mouldings, Decorative Mouldings, Ornamental Mouldings, Mouldings For Picture Frame, Trimwork, wood moldings, architectural moldings, ornamental moldings, decorative moldings, decorative mouldings, dado rails, wood paneling, French baseboards, 9"" baseboards, stair rails, stair bannister, cornice moulding, crown moulding, crown molding, molding, moulding molding, molding or moulding, molding trim, molding and trim, trim molding, moulding and trim, moulding trim, trim moulding, mouldings, moldings, crown molding, molding crown, crown molding in, crown moulding, moulding crown, crown molding moulding, door trim molding, door trim moulding, trim mouldings, mouldings trim, mouldings and trim, moldings crown, crown moldings, crown mouldings, install crown molding, crown molding cut, cut crown molding, crown moulding cut, cut crown moulding, molding company, wood trim moulding, molding corner, corner molding, mold trim, plastic trim moulding, molding corner, corner molding, mold trim, plastic trim moulding, plastic moulding trim, moulding company, corner moulding, moulding corner, plastic trim molding, moldings and trim, moldings trim, trim moldings, molding co, molding companies, installing crown molding,,",0,2021-10-20T09:34:39.000-04:00,reliablechoice,FALSE,0,0,120,FALSE,cdf40f18e47fb7eb51395b6641d6eff70c6aca5c,TRUE,2022-06-20T13:11:43.000-04:00,TRUE,TRUE,2264729,98.7623828007,378,NA,NA,0
https://homestars.com/on/hawkesville/home-additions,5,https://homestars.com/on/hawkesville/home-additions,Home Additions,2702240,NA,/companies/2702240-ducharme-designed?searched_category_id=378&service_area=1715444,NA,ducharme-designed,2008-03-04T16:55:15.000-05:00,NA,NA,NA,NA,NA,NA,NA,NA,NA,NA,NA,NA,NA,FALSE,FALSE,NA,NA,FALSE,FALSE,NA,1765292,Ducharme Designed,0,0,0,NA,"Home Additions, General contractor, home improvement, building addition, home expansion, house expansion, house building, plans house, house plans from, plans for house, the house plans, house plans, renovation, in house design, home plans house, home house plans, house home plans, house plans home, remodeling, house plans and designs, designs house plans, house designs plans, house plans designs, home plans and designs, home designs plans, floor plans, house build, renovations, plans for building, kitchen cabinets, remodel, kitchen design, house plans for building, house plans building, ,",0,NA,NA,FALSE,0,0,0,FALSE,NA,FALSE,NA,FALSE,FALSE,1715444,0,378,NA,NA,NA
