Link,n_hits,all_links,category,id,url,hs_path,profile,permalink,created_at,sic_code,service_area,hours,products,services,brands,specialities,established,employee_cnt,payment_method,diplomas,licenses,memberships,liability_insurance,bonded,project_rate,project_minimum,written_contract,written_warranty,warranty_terms,parent_company_id,name,total_number_of_reviews_cache,total_number_of_approved_reviews_cache,number_of_photos_cache,avg_rating_cache,categories_info_cache,savings_count,claimed_at,subdomain,fraudulent,fraudulent_count,total_number_of_pending_reviews_cache,images_count,completion_percent_cache,bully,secret,replied_to_at_least_one_review_cache,has_set_tasks,lead_purchase_eligible,service_area_id,star_score,quote_button_category,direct_phone,direct_contact
https://homestars.com/on/oak%20bay/kitchen-bathroom-cabinets-design,1,https://homestars.com/on/oak%20bay/kitchen-bathroom-cabinets-design,Kitchen & Bathroom - Cabinets & Design,2955191,https://www.proproservices.com/,/companies/2955191-provincial-cabinets-and-flooring?searched_category_id=392&service_area=2251117,"Provincial Building Services has completed some of the most challenging updates the country has ever seen. Company first opened its doors to clients in 1999. 

As the world has recently gotten smaller in the times of COVID the need for space solutions have never been greater.  Provincial Cabinetry seems too good to be true. At big box prices but with custom box quality. 100% solid wood cabinetry. Cabinet grade plywood boxes, solid wood doors and drawers all with custom style dovetail joinery.

LOCATION - VICTORIA, VANCOUVER, EDMONTON, SASKATOON, FORT MCMURRAY.",provincial-cabinets-and-flooring,2021-04-15T15:15:08.000-04:00,NA,NA,NA,,"Residential/Commercial Window Cleaning, Pressure Washing, Eavestrough Cleaning, 
Parkade Remediation and Cleaning, 
High Rise Remediation - Painting, Caulking and Window Replacement, Engineering Inspections - High Rope access of Glass Curtain Walls and Building Envelopes, 
High Rope Stand by Rescue and Supervision, Renovations - Bathrooms, Kitchens, Carpentry, Tiling, Roofing, Electrical, Plumbing, New Home Construction, Design and General Contracting",,,1999,NA,"Cheque, Cash & E-Transfer",,,,TRUE,FALSE,,,TRUE,FALSE,"Yes, please ask for more detail ",2017169,Provincial Cabinets and Flooring,5,4,78,10,"Kitchen & Bathroom - Cabinets & Design, Kitchen Cabinet And Counter, Kitchen Cabinet Hardware, Bathroom Cabinet, Bathroom Wall Cabinet, Bathroom Sink Cabinet, cabinets, kitchens, cabinetry, kitchen and cabinets, cabinets for kitchen, about kitchen cabinets, kitchen cabinets, kitchen cabinets in, cabinets for the kitchen, cabinets and kitchen, cabinets kitchen, kitchen cabinet, cabinet kitchen, the kitchen cabinet, kitchen by design, design kitchen, a kitchen design, design a kitchen, design for kitchen, design and kitchen, design by kitchen, kitchen design, cabinetry kitchen, kitchen cabinetry, designs kitchen, kitchen designs, bathroom vanities, vanity and bathroom, bath and vanity, designer kitchen, ,",0,2021-04-15T15:19:34.000-04:00,proproservices,FALSE,0,0,83,0,FALSE,eafa7cb4b3d8851735320f5b23cf2e45d273761d,TRUE,TRUE,TRUE,2251117,88.3921966625,392,NA,NA
