Link,n_hits,all_links,category,id,url,hs_path,profile,permalink,created_at,sic_code,service_area,hours,products,services,brands,specialities,established,employee_cnt,payment_method,diplomas,licenses,memberships,liability_insurance,bonded,project_rate,project_minimum,written_contract,written_warranty,warranty_terms,parent_company_id,name,total_number_of_reviews_cache,total_number_of_approved_reviews_cache,number_of_photos_cache,avg_rating_cache,categories_info_cache,savings_count,claimed_at,subdomain,fraudulent,fraudulent_count,total_number_of_pending_reviews_cache,images_count,bully,secret,replied_to_at_least_one_review_cache,latest_approved_review_created_at,has_set_tasks,lead_purchase_eligible,service_area_id,star_score,quote_button_category,direct_phone,direct_contact,completion_percent_cache
https://homestars.com/on/abbotsford/window-gutter-cleaning,9,https://homestars.com/on/abbotsford/window-gutter-cleaning,Window & Gutter Cleaning,2802083,http://www.buhlerpainting.ca,/companies/2802083-buhler-painting-ltd?searched_category_id=450&service_area=1867353,"Welcome to Buhler Painting Ltd!
Buhler Painting is committed to managing our projects with integrity and attention to detail. We have experience in painting homes, new residential projects, commercial properties and businesses with excellence!

Buhler Painting Ltd is a full-service painting company located in Abbotsford, British Columbia servicing Vancouver and the entire Fraser Valley.  When the company was founded in 2006, we quickly realized that by taking care of our clients, offering fair prices, and delivering what we promised on time, people wanted to do business with us. This foundation of Buhler Painting has allowed us to work with hundreds of clients over the years.

Thanks to our remarkable clients who have referred us to others, we have grown to be a reputable and reliable painting company known for our fair prices, quality work, and reliable staff-a reputation known throughout the Lower Mainland.

We finish with distinction - Quality workmanship you can trust

If you have any questions, or would like to book a quote, please do not hesitate in contacting our Project Coordinator, Karen Denevers at 604-855-1042.

We appreciate your time in viewing our galleries and considering Buhler Painting for your next residential or commercial project.
",buhler-painting-ltd,2012-10-10T22:30:19.000-04:00,NA,NA,NA,,,,"1- Very Fair Prices: We guarantee a competitive price and a detailed estimate leaving you confident that our work will fit within your budget and bring your vision to reality.

2- Quality Work: Our top of the line equipment and well trained staff provide professional service and quality work you can trust.

3- Reliability: We work hard to complete your project with a quality finish, meet your timeline and save you money.
",2006,20,"Cheque, Cash, Visa, Mastercard",BBA in Business & Finance,,BBB,TRUE,TRUE,,,TRUE,FALSE,2 YEAR LIMITED WARRANTY,1865084,Buhler Painting Ltd.,15,12,88,9.83333,"Paint & Wallpaper Contractors, Paint Colors, Paint Store, Paint Brush, Paint Shop, Home Wallpaper,Wallpaper, Paint colour advice, paint colour consultants, wallpapering, painter, faux, painters painting, painters paint, business painting, find painting, painting and restoration, new jersey painting, oh painting, local painting, wall paper repair, ,General Contractors, Residential General Contractor, Building Contractor, Additions, Remodeling Contractor,  Renovation, Builder, building construction, renovation, remodeling, construction builders, construction company, construction companies, home repair, construction jobs, home remodeling, general contractors, contractors general, contractor general, contractors construction, construction contractors, home improvement and remodeling, kitchen remodeling, construction contractor, builders contractors, home renovation, general contracting, building contractors, building companies, home renovations, builder contractor, building contractor, remodeling contractor, commercial construction, residential construction, house contractor, concrete contractors, home contractors, general construction, construction general, contractors remodeling, remodeling contractors, remodelers, remodel contractor, remodel contractors, general contract, commercial contractors, renovations contractors, home improvement contractor, licensed contractor, license general contractor, mud room, mudroom, caulking, ,Window & Gutter Cleaning, Window Cleaning, Eavestrough cleaning, residential window cleaning, Windows, caulking,",0,2012-10-10T22:30:19.000-04:00,buhlerpainting,FALSE,0,0,93,FALSE,48efaf5738245cb44f7d26d4cab6b2b25ed5e2fb,TRUE,2016-09-28T15:17:00.000-04:00,TRUE,TRUE,1867353,94.8322308417,450,NA,NA,NA
https://homestars.com/on/abbotsford/window-gutter-cleaning,9,https://homestars.com/on/abbotsford/window-gutter-cleaning,Window & Gutter Cleaning,2776764,http://www.clearviewwindows.ca/,/companies/2776764-clearview-window-cleaning?searched_category_id=450&service_area=1829138,"Clearview Cleaning Services Ltd. offers residential & commercial cleaning services company specializing & operating the Fraser Valley for over 13 years. When you hire Clearview, you bring quality to the forefront with a professional company that provides excellent detail services. Call us today for your free estimate!",clearview-window-cleaning,2009-10-20T18:31:33.000-04:00,NA,"Abbotsford, Aldergrove, Langley, Surrey, Cloverdale, Whiterock, Mission, Chilliwack, Maple Ridge, Pitt Meadows, Burnaby, Coquitlam, Port Moody, Port Coquitlam, Vancouver ",,,,,,NA,NA,,,,,FALSE,FALSE,,,FALSE,FALSE,,1839816,Clearview Cleaning Services Ltd.,16,14,0,9.21429,"Window & Gutter Cleaning, Window Cleaning, Eavestrough cleaning, residential window cleaning, Windows, caulking,",0,2009-10-28T04:43:35.000-04:00,,FALSE,0,0,0,FALSE,24814eabeb13ff2f9f32390ef0ad4d620c0fbf0d,TRUE,2015-06-14T13:29:37.000-04:00,TRUE,FALSE,1829138,88.8353761132,450,NA,NA,NA
https://homestars.com/on/abbotsford/window-gutter-cleaning,9,https://homestars.com/on/abbotsford/window-gutter-cleaning,Window & Gutter Cleaning,2878538,NA,/companies/2878538-window-wizard?searched_category_id=450&service_area=2062092,NA,window-wizard,2015-10-27T01:19:22.000-04:00,NA,NA,NA,NA,NA,NA,NA,NA,NA,NA,NA,NA,NA,FALSE,FALSE,NA,NA,FALSE,FALSE,NA,1940962,Window Wizard,0,0,0,NA,"Window & Gutter Cleaning, Window Cleaning, Eavestrough cleaning, residential window cleaning, Windows, caulking,",0,NA,NA,FALSE,0,0,0,FALSE,e44a66d6dbf13b53affd400da09dd8b566c7b715,FALSE,NA,FALSE,FALSE,2062092,0,450,NA,NA,0
https://homestars.com/on/abbotsford/window-gutter-cleaning,9,https://homestars.com/on/abbotsford/window-gutter-cleaning,Window & Gutter Cleaning,2951212,https://gorillapropertyservices.com/franchisees/abbotsford-property-services/,/companies/2951212-gorilla-property-services?searched_category_id=450&service_area=2242411,"There seemed to be a lot of companies like ours, but nobody had that extra little ""Spark"". Some claimed to be the fastest pressure washers, some claimed to be the best at graffiti removal and a good chunk of them claimed to be the ""cheapest"" price in town. Our system is simple. When one of the ""Monkey Trucks"" (this is what most of the kids call our vehicle when they see them!) pulls up for service, the Gorilla technician will perform the highest level of service possible.",gorilla-property-services,2020-12-23T15:31:08.000-05:00,NA,NA,NA,NA,NA,NA,NA,NA,NA,NA,NA,NA,NA,FALSE,FALSE,NA,NA,FALSE,FALSE,NA,2013308,Gorilla Property Services,0,0,1,NA,"Window & Gutter Cleaning, Window Cleaning, Eavestrough cleaning, residential window cleaning, Windows, caulking,",0,2020-12-23T15:32:20.000-05:00,NA,FALSE,0,0,2,FALSE,7b1ed176447a5930f052fddadd445668bb119180,FALSE,NA,FALSE,FALSE,2242411,0,450,NA,NA,0
https://homestars.com/on/abbotsford/window-gutter-cleaning,9,https://homestars.com/on/abbotsford/window-gutter-cleaning,Window & Gutter Cleaning,225546,,/companies/225546-stayclean-gutters?searched_category_id=450&service_area=1826573,gutter installation,stayclean-gutters,2006-11-23T19:00:00.000-05:00,NA,,,,,,,0,0,,,,,FALSE,FALSE,,,FALSE,FALSE,,76603,Stayclean gutters - No Longer In Business,1,1,0,3,"Window & Gutter Cleaning, Window Cleaning, Eavestrough cleaning, residential window cleaning, Windows, caulking,",0,NA,NA,FALSE,0,0,0,FALSE,NA,FALSE,2006-11-21T19:00:00.000-05:00,FALSE,FALSE,1826573,0.0,450,NA,NA,NA
https://homestars.com/on/abbotsford/window-gutter-cleaning,9,https://homestars.com/on/abbotsford/window-gutter-cleaning,Window & Gutter Cleaning,2658852,NA,/companies/2658852-ryan-s-window-cleaning?searched_category_id=450&service_area=1672056,NA,ryan-s-window-cleaning,2008-03-04T16:55:15.000-05:00,NA,NA,NA,NA,NA,NA,NA,NA,NA,NA,NA,NA,NA,FALSE,FALSE,NA,NA,FALSE,FALSE,NA,1721904,Ryan's Window Cleaning,0,0,0,NA,"Window & Gutter Cleaning, Window Cleaning, Eavestrough cleaning, residential window cleaning, Windows, caulking,",0,NA,NA,FALSE,0,0,0,FALSE,NA,FALSE,NA,FALSE,FALSE,1672056,0,450,NA,NA,NA
https://homestars.com/on/abbotsford/window-gutter-cleaning,9,https://homestars.com/on/abbotsford/window-gutter-cleaning,Window & Gutter Cleaning,2641792,NA,/companies/2641792-abbotsford-sign-services?searched_category_id=450&service_area=1654996,NA,abbotsford-sign-services,2008-03-04T16:55:15.000-05:00,NA,NA,NA,NA,NA,NA,NA,NA,NA,NA,NA,NA,NA,FALSE,FALSE,NA,NA,FALSE,FALSE,NA,1704844,Abbotsford Sign Services,0,0,0,NA,"Window & Gutter Cleaning, Window Cleaning, Eavestrough cleaning, residential window cleaning, Windows, caulking,",0,NA,NA,FALSE,0,0,0,FALSE,NA,FALSE,NA,FALSE,FALSE,1654996,0,450,NA,NA,NA
https://homestars.com/on/abbotsford/window-gutter-cleaning,9,https://homestars.com/on/abbotsford/window-gutter-cleaning,Window & Gutter Cleaning,2660299,NA,/companies/2660299-west-coast-window-cleaning?searched_category_id=450&service_area=1673503,NA,west-coast-window-cleaning,2008-03-04T16:55:15.000-05:00,NA,NA,NA,NA,NA,NA,NA,NA,NA,NA,NA,NA,NA,FALSE,FALSE,NA,NA,FALSE,FALSE,NA,1723351,West Coast Window Cleaning,0,0,0,NA,"Window & Gutter Cleaning, Window Cleaning, Eavestrough cleaning, residential window cleaning, Windows, caulking,",0,NA,NA,FALSE,0,0,0,FALSE,NA,FALSE,NA,FALSE,FALSE,1673503,0,450,NA,NA,NA
https://homestars.com/on/abbotsford/window-gutter-cleaning,9,https://homestars.com/on/abbotsford/window-gutter-cleaning,Window & Gutter Cleaning,2601506,NA,/companies/2601506-all-washed-up-exterior-home-maintenance?searched_category_id=450&service_area=1614710,NA,all-washed-up-exterior-home-maintenance,2008-03-04T16:55:15.000-05:00,NA,NA,NA,NA,NA,NA,NA,NA,NA,NA,NA,NA,NA,FALSE,FALSE,NA,NA,FALSE,FALSE,NA,1664558,All Washed Up Exterior Home Maintenance,0,0,0,NA,"Window & Gutter Cleaning, Window Cleaning, Eavestrough cleaning, residential window cleaning, Windows, caulking,",0,NA,NA,FALSE,0,0,0,FALSE,NA,FALSE,NA,FALSE,FALSE,1614710,0,450,NA,NA,NA
