Link,n_hits,all_links,category,id,url,hs_path,profile,permalink,created_at,sic_code,service_area,hours,products,services,brands,specialities,established,employee_cnt,payment_method,diplomas,licenses,memberships,liability_insurance,bonded,project_rate,project_minimum,written_contract,written_warranty,warranty_terms,parent_company_id,name,total_number_of_reviews_cache,total_number_of_approved_reviews_cache,number_of_photos_cache,avg_rating_cache,categories_info_cache,savings_count,claimed_at,fraudulent,fraudulent_count,total_number_of_pending_reviews_cache,images_count,completion_percent_cache,bully,secret,replied_to_at_least_one_review_cache,latest_approved_review_created_at,has_set_tasks,lead_purchase_eligible,service_area_id,star_score,quote_button_category,direct_phone,direct_contact,subdomain
https://homestars.com/on/mono/tree-service,2,https://homestars.com/on/mono/tree-service,Tree Service,2902526,NA,/companies/2902526-ultimate-tree-care-removal?searched_category_id=444&service_area=2282207,NA,ultimate-tree-care-removal,2017-09-21T19:53:44.000-04:00,NA,NA,NA,NA,NA,NA,NA,NA,NA,NA,NA,NA,NA,FALSE,FALSE,NA,NA,FALSE,FALSE,NA,1964711,Ultimate Tree Care & Removal,3,3,1,10,"Tree Service, tree pruning, arborist, tree health, sick tree, unhealthy tree, tree diagnostic, pruning a tree, hedges
 ,",0,2017-09-21T19:54:26.000-04:00,FALSE,0,0,2,0,FALSE,d8a42685bdab13699f616f797ca9b66de58ddd41,FALSE,2022-10-06T08:52:48.000-04:00,TRUE,TRUE,2282207,81.252408466,444,NA,NA,NA
https://homestars.com/on/mono/tree-service,2,https://homestars.com/on/mono/tree-service,Tree Service,2947006,https://www.facebook.com/certifiedlandscapinganddesign,/companies/2947006-certified-landscaping-inc?searched_category_id=444&service_area=2232986,"Certified Landscaping Inc. was founded by Avraham and William, with more than 10 years of experience under their belts. Certified Landscaping Inc. provides excellent services that's tailored to your needs. We specialize in landscape design, tree services, interlocking and more. 

Check out our social media here:
Facebook: https://www.facebook.com/certifiedlandscapinganddesign
Instagram: https://www.instagram.com/certifiedlandscaping/",certified-landscaping-inc,2020-08-24T13:30:17.000-04:00,NA,NA,NA,,,,,NA,NA,"E-Transfer, Cash, Cheques",,ISA Certified Arborists,,TRUE,FALSE,,,TRUE,FALSE,"Yes, kindly ask for more detail",2009143,Certified Landscaping Inc.,29,28,230,9.21429,"Landscape Contractors & Designers, Landscape Contractor Designer, Landscape Design, Landscape Contractor, Landscapers, Landscaping, Landscape, Backyard, patio, Fountain, Ponds and Waterfalls, garden, gardens, landscape, how to landscape, landscaping and, landscape garden, garden landscape, gardening, landscape gardens, pavers, garden design, design a garden, design for garden, design garden, how to design garden, lawn maintenance, how to design landscape, design landscape, landscape and design, design and landscape, how to design a landscape, landscape design, design a landscape, patios, architects landscape, landscape architects, garden designs, lawn service, garden landscaping, landscaping garden, landscape lighting, garden designer, designer garden,,landscapemakeover of backyard and improve front yard
build fence, landscape, Landscaping, retaining wall, grading,Tree Service, tree pruning, arborist, tree health, sick tree, unhealthy tree, tree diagnostic, pruning a tree, hedges
 ,",0,2020-08-24T13:35:02.000-04:00,FALSE,0,0,249,0,FALSE,d3924bd414efff7256eb482085b13a6d4ca8547e,TRUE,2022-08-23T20:56:11.000-04:00,TRUE,TRUE,2232986,88.9572220256,444,NA,NA,
