Link,n_hits,all_links,category,id,url,hs_path,profile,permalink,created_at,sic_code,service_area,hours,products,services,brands,specialities,established,employee_cnt,payment_method,diplomas,licenses,memberships,liability_insurance,bonded,project_rate,project_minimum,written_contract,written_warranty,warranty_terms,parent_company_id,name,total_number_of_reviews_cache,total_number_of_approved_reviews_cache,number_of_photos_cache,avg_rating_cache,categories_info_cache,savings_count,claimed_at,subdomain,fraudulent,fraudulent_count,total_number_of_pending_reviews_cache,images_count,completion_percent_cache,bully,secret,replied_to_at_least_one_review_cache,latest_approved_review_created_at,has_set_tasks,lead_purchase_eligible,service_area_id,star_score,quote_button_category,direct_phone,direct_contact
https://homestars.com/on/pottageville/cabinetry-millwork,34,"c(""https://homestars.com/on/pottageville/cabinetry-millwork?&page=2&"", ""https://homestars.com/on/pottageville/cabinetry-millwork?&page=3&"", ""https://homestars.com/on/pottageville/cabinetry-millwork?&page=4&"")",Cabinetry & Millwork,2794452,http://premieremantel.com/,/companies/2794452-premiere-custom-millwork-fireplaces-ltd?searched_category_id=322&service_area=2096691,"Thanks for visiting us at HomeStars. At Premiere Custom Millwork & Fireplaces Ltd, our philosophy is simple; to be the best we can be in servicing your needs. We believe that our customers come first; it is not just a cliché but a commitment we make to all our past and future customers. 

To be successful in business, it takes a winning combination of services, competitive pricing and dedication by all employees to excel at customer service excellence. Our continued growth is testament to our pledge to provide you with products of the highest quality and unmatched customer service; we have built our reputation on this belief. 

We encourage you to look around our site and see what we have to offer. If you don’t see what you are looking for, call us at 905-671-3473 and we will be happy to discuss your needs. ",premiere-custom-millwork-fireplaces-ltd,2012-01-25T09:04:16.000-05:00,NA,"Toronto, Etobicoke, Mississauga, Brampton, Oakville, Burlington, Richmond Hill, Vaughan, Woodbridge, Maple, Markham, North York, Concord, Thornhill, Milton, Caledon, New Market, Aurora, Oshawa, Pickering, Berrie, Hamilton, Orangeville, Bolton, king City, Georgetown, Scarborough.",Mon-Fri 7:30am - 5:00pm / Sat-Sun By Appt.,"Kitchen, Wall Units, Entertainment Units (indoors/outdoors), Mantels, Closets, Vanities, Fireplaces, Bathrooms, Store Fixtures, Bars. Stone Facing, Counter Tops, Outodoor Products.","Manufacture, Installation, Design, Gas hook up, Consultation, Delivery, Mansonry.","Napoleon, Kingsman, Dimplex, Marquis, Regency, Valor, Monessen, Majestic, Montigo and Custom Fireplaces.","Kitchen, Cabinetry, Commercial Millwork , Residential millwork and Fireplaces.",2010,10,"Debit Card, Credit Card, and Cheque",,,,TRUE,TRUE,,,TRUE,FALSE,,1857504,Premiere Custom Millwork & Fireplaces Ltd,149,124,310,9.75,"Cabinetry & Millwork, Kitchen Cabinetry, Custom Cabinetry, Bathroom Cabinetry, Architectural Millwork, Millwork, custom millwork, bathroom cabinets, Kitchen cabinets, built-in cabinets, built-in cabinetry,  cabinet makers, custom cabinets kitchen, cabinetry, thomasville kitchen cabinets, cabinet doors, millwork cabinetry, custom kitchen cabinets, kraftmaid cabinets, maple cabinets, wood cabinets, stock cabinets, thermofoil cabinets, laminate cabinets, kitchen cabinets design, cherry cabinets, kitchen cabinet designs, hickory cabinets, wholesale cabinets, custom made cabinets, cabinet millwork, cabinets kitchen, kitchen cabinetry, millwork cabinets, ready to assemble cabinets, quality cabinets, bamboo cabinets, caulking,
,Kitchen Planning & Renovation, Kitchen Planning And Design, Kitchen Cabinet Planning, Kitchen Design, Kitchen Remodeling, kitchen or, and bathroom, a and a kitchens, kitchens and, for kitchens, a kitchens, kitchens, the house design, cabinets for kitchen, cabinets for the kitchen, cabinets and kitchen, kitchen cabinets, design a kitchen, about kitchen design, a kitchen design, how to kitchen design, design and kitchen, the kitchen design, design for kitchen, kitchen designs, renovation and remodeling, remodeling and renovation, kitchen designer,,Kitchen Renovation, caulking, ,Fireplace Mantels, marble fireplace mantels, wood fireplace mantels, stone mantels, fireplace mantles, wood mantles, stone mantles, the fireplace, fireplace, fireplaces, mantel, the mantel, hearth, mantle, what is a mantle, surrounds, mantels, the mantels, mantles, the mantles, fireplace with mantel, mantel fireplace, ,Fireplaces, Electric Fireplace, Fireplace Mantel, Fireplace Chimney, Gas Fireplace, Fireplace Screen, Outdoor Fireplace, Fireplace Accessory, Ventless Fireplace, Fieplace Mantle, fireplace, the fireplace, fire place, fireplace stoves, fireplace chimney, fireplace gas, gas fireplace, fireplace heaters, gas fireplaces, fireplaces gas, wood fireplace, wood for fireplace, fireplace electric, electric fireplace, wood stove fireplace, fireplace hearth, electric fireplaces, fireplaces electric, fireplace heater, insert for fireplace, insert fireplace, fireplace insert, gas fireplaces and stoves, wood fireplaces, insert fireplaces, inserts for fireplaces, fireplaces inserts, wood burning fireplace, gas fireplace stoves, fireplace door, gas stove fireplace, fire places, fireplace screen, outdoor fireplace, fireplace outdoor, gas log, wood burning fireplaces, fireplace mantels, mantels for fireplace, fireplace mantle, fireplace mantels, ethanol fireplace, caulking,Basement Renovation, Basement renovation, Basement remodeling, Basement remodelling, renovating your basement, renovation, waterproofing, remodeling, home renovation, house renovation, water in basement, basement waterproofing,finishing basement, moistureproof, remodeling the house, caulking,Kitchen & Bathroom - Cabinets & Design, Kitchen Cabinet And Counter, Kitchen Cabinet Hardware, Bathroom Cabinet, Bathroom Wall Cabinet, Bathroom Sink Cabinet, cabinets, kitchens, cabinetry, kitchen and cabinets, cabinets for kitchen, about kitchen cabinets, kitchen cabinets, kitchen cabinets in, cabinets for the kitchen, cabinets and kitchen, cabinets kitchen, kitchen cabinet, cabinet kitchen, the kitchen cabinet, kitchen by design, design kitchen, a kitchen design, design a kitchen, design for kitchen, design and kitchen, design by kitchen, kitchen design, cabinetry kitchen, kitchen cabinetry, designs kitchen, kitchen designs, bathroom vanities, vanity and bathroom, bath and vanity, designer kitchen, ,",1,2012-01-25T09:04:18.000-05:00,premieremantel,FALSE,0,0,316,NA,FALSE,668647c74e9281d15a0714676ec73a0ae4cc2a08,TRUE,2022-08-10T11:05:34.000-04:00,TRUE,TRUE,2096691,97.5841429422,322,NA,NA
https://homestars.com/on/pottageville/cabinetry-millwork,34,"c(""https://homestars.com/on/pottageville/cabinetry-millwork?&page=2&"", ""https://homestars.com/on/pottageville/cabinetry-millwork?&page=3&"", ""https://homestars.com/on/pottageville/cabinetry-millwork?&page=4&"")",Cabinetry & Millwork,2929902,http://paint2decor.com,/companies/2929902-paint-2-decor-inc?searched_category_id=322&service_area=2194640,"Paint2Decor INC. offers a unique combination of ongoing, personal communication with you, from the comfort of your own home. Because our website is equipped with a top-of-the-line communication system, both providing and receiving helpful information about the process is quick, easy, and virtually painless. Our Paint2Decor INC. team is accessible both directly by phone or via email, and we strive to return correspondence within hours. Because all of our consultation services are free, there is no obligation on your part. Only when you are completely satisfied with your choice of color and pricing, we will proceed to the ordering stage without any hidden costs, markups, or “up-sells.”

",paint-2-decor-inc,2019-04-14T14:22:03.000-04:00,NA,NA,NA,,,,"23 Reasons to Hire Paint2Decor INC. Kitchen Cabinet Refinishing
We are High Quality & Trusted Cabinets Professionals. This is our passion.
We have been refinishing cabinets for 15 years
We have professional spray booth and shop for a factory finish.
We have the best sprayer team in Canada
We work within your budget. Sounds cliché but we actually do
We use the best lacquers, paints on the market
We respond to your calls, email inquires immediately
We give 20 % discount to references for cabinet refinishing
We wear dedicated ‘indoor’ shoes in your home
We tape to get a laser beam line for the fixed pieces
We clean and degrease all surfaces prior to sanding
We sand all surfaces prior to priming
We clean the sand dust prior to priming
We ensure that surfaces are dust free
We are very quiet, discreet and polite while on-site
We are the most trustworthy company in Canada
We offer unlimited colours
We guarantee all our work against peeling, chipping and fading
We bubble wrap all doors and drawers after they’re done.
We are only interested in making our customers say “Wow”.
We are ranked # 1 on Google
We care for your cabinets more than anyone
We Proudly Serving Toronto and Surrounding area",2007,NA,"Cash, Cheque and e-transfer",,Working at Heights and all Safety Certifications ,,TRUE,FALSE,,,TRUE,FALSE,Yes.  Kindly ask for more details. ,1992076,Paint 2 Decor Inc.,98,93,182,9.95699,"Cabinetry & Millwork, Kitchen Cabinetry, Custom Cabinetry, Bathroom Cabinetry, Architectural Millwork, Millwork, custom millwork, bathroom cabinets, Kitchen cabinets, built-in cabinets, built-in cabinetry,  cabinet makers, custom cabinets kitchen, cabinetry, thomasville kitchen cabinets, cabinet doors, millwork cabinetry, custom kitchen cabinets, kraftmaid cabinets, maple cabinets, wood cabinets, stock cabinets, thermofoil cabinets, laminate cabinets, kitchen cabinets design, cherry cabinets, kitchen cabinet designs, hickory cabinets, wholesale cabinets, custom made cabinets, cabinet millwork, cabinets kitchen, kitchen cabinetry, millwork cabinets, ready to assemble cabinets, quality cabinets, bamboo cabinets, caulking,
,Paint & Wallpaper Contractors, Paint Colors, Paint Store, Paint Brush, Paint Shop, Home Wallpaper,Wallpaper, Paint colour advice, paint colour consultants, wallpapering, painter, faux, painters painting, painters paint, business painting, find painting, painting and restoration, new jersey painting, oh painting, local painting, wall paper repair, ,",0,2019-04-14T14:23:11.000-04:00,,FALSE,0,0,51,0,FALSE,6b8b1df4bf17471a0f09c2b7b7757b8493040997,TRUE,2022-09-28T16:12:52.000-04:00,TRUE,TRUE,2194640,98.2399299539,322,NA,NA
https://homestars.com/on/pottageville/cabinetry-millwork,34,"c(""https://homestars.com/on/pottageville/cabinetry-millwork?&page=2&"", ""https://homestars.com/on/pottageville/cabinetry-millwork?&page=3&"", ""https://homestars.com/on/pottageville/cabinetry-millwork?&page=4&"")",Cabinetry & Millwork,2962158,https://newageproducts.com/,/companies/2962158-newage-products?searched_category_id=322&service_area=2268515,"Plan. Design. Install.

We offer a wide assortment of premium products and services within your Garage, Home, and Outdoor Living Spaces. Get your home reno project off the ground quicker, with a FREE CONSULTATION from one of our award-winning design experts.

NewAge Products is a Home Improvement Industry Disruptor and thought-leader. Founded in 2008, we’ve designed and manufactured hundreds of innovative, modular systems for customers throughout North America while maintaining retail partnerships with Costco, Home Depot, Amazon, and Lowes.",newage-products,2021-12-01T13:37:36.000-05:00,NA,NA,NA,"Garage Cabinets, Shelving and Racking, Outdoor Kitchen, Outdoor Appliances, Outdoor Furniture, Flooring","Free Virtual Design Consultation, Installation, Measurement Services",,"Garage Organization and Design, Outdoor Organization and Design",2008,400,Credit Card,,,,TRUE,FALSE,,,FALSE,FALSE,,2024117,NewAge Products,122,99,151,9.74747,"Garage Design & Organization, shed design, shed organization, garage renovation, garage, car garage, storage systems, starage sheds, storage cabinets, cabinets & storage, storage cabinet, storage system, shop door, storage solutions, garage floor, shed plans, garage and storage, storage for garage, garage storage, storage in garage, garage plans, storage for the home, garage kits, cabinets garage, cabinets for the garage, garage cabinets, metal cabinets, metal cabinet, new garage, new barn, ,Cabinetry & Millwork, Kitchen Cabinetry, Custom Cabinetry, Bathroom Cabinetry, Architectural Millwork, Millwork, custom millwork, bathroom cabinets, Kitchen cabinets, built-in cabinets, built-in cabinetry,  cabinet makers, custom cabinets kitchen, cabinetry, thomasville kitchen cabinets, cabinet doors, millwork cabinetry, custom kitchen cabinets, kraftmaid cabinets, maple cabinets, wood cabinets, stock cabinets, thermofoil cabinets, laminate cabinets, kitchen cabinets design, cherry cabinets, kitchen cabinet designs, hickory cabinets, wholesale cabinets, custom made cabinets, cabinet millwork, cabinets kitchen, kitchen cabinetry, millwork cabinets, ready to assemble cabinets, quality cabinets, bamboo cabinets, caulking,
,Kitchen Planning & Renovation, Kitchen Planning And Design, Kitchen Cabinet Planning, Kitchen Design, Kitchen Remodeling, kitchen or, and bathroom, a and a kitchens, kitchens and, for kitchens, a kitchens, kitchens, the house design, cabinets for kitchen, cabinets for the kitchen, cabinets and kitchen, kitchen cabinets, design a kitchen, about kitchen design, a kitchen design, how to kitchen design, design and kitchen, the kitchen design, design for kitchen, kitchen designs, renovation and remodeling, remodeling and renovation, kitchen designer,,Kitchen Renovation, caulking, ,Floor Retailers, Flooring, Hardwood Floors, Wood Floors, Floor & Tile Stores, laminate, and tile, carpet and, flooring flooring, the flooring, a flooring, floors floors floors, the floors, floors on floors, a floors, floor flooring, flooring floor, flooring and tiles, floor and wood, wood flooring, wood and flooring, wood floors, hardwood flooring, hardwood floors, flooring and tile, tile and flooring, tile flooring, tiles floors, floors and tiles, tile and floor, floor and tile, linoleum, laminate flooring, flooring and laminate, laminate flooring, laminate floor, wooden floors, wooden flooring, laminate floors, laminated flooring, vinyl flooring, tiles and floors, tile floors, carpet and tile, floor covering, carpets and tiles, slate, ceramic, concrete, herringbone,",0,2021-12-01T13:38:43.000-05:00,,FALSE,0,0,175,0,FALSE,2ac1c8a94cf80b4d46cd022ce7a0676b2d5832b2,TRUE,2022-07-25T10:26:43.000-04:00,TRUE,TRUE,2268515,96.0399610163,322,NA,NA
https://homestars.com/on/pottageville/cabinetry-millwork,34,"c(""https://homestars.com/on/pottageville/cabinetry-millwork?&page=2&"", ""https://homestars.com/on/pottageville/cabinetry-millwork?&page=3&"", ""https://homestars.com/on/pottageville/cabinetry-millwork?&page=4&"")",Cabinetry & Millwork,2781859,http://www.newkitchentoronto.ca,/companies/2781859-newkitchentoronto-ca?searched_category_id=322&service_area=2104923,"Welcome to NewKitchenToronto ! Ikea kitchens are beautiful and inexpensive. But do you find it difficult not only selecting all the components but also designing and fitting the kitchen to your space? <b>We specialize in custom Ikea kitchens!

***
 
We will work with you to design your project, help you choose which components to buy and also custom fit everything to your space. We are faster and less expensive than Ikea's installers, and we give you that personalized custom service.
 
Customer satisfaction is our top priority. Let's work together to get you that <b>beautiful new kitchen for less money than you ever thought possible.
 
With our 25 years of experience and hundreds of satisfied customers in the Toronto and Greater Toronto Area, we can guarantee, you will be completely satisfied with our honesty, customer service, quality, and prices.
 
In addition to custom Ikea kitchens we offer complete services for:
 
    * Custom Made Kitchens Cupboards,
    * Kitchens Cabinets Re-facing and Remodeling
    * Countertops Replacement
    * Bathroom Vanity Cabinets
    * Walk-in Closet Organizers
    * Laundry Room Organizer Cabinets
    * Bars and Entertainment Center Units
    * Home Office and Library Cabinets
    * Commercial projects
    * Design & Consultation
    * Drywall
    * Complete Renovations
 
About Us:

Dmitriy Rozenberg is the General Manager at New Kitchen Toronto. He began his career as a quality home renovator in 1986 after graduating from university as a Civil Engineer.
In 1987 he began making custom cabinets and doing his own millwork for his projects.
From 1991 he was specializing exclusively on custom cabinetry and woodworking.
Under his supervision New Kitchen Toronto designs, manufactures and installs cabinets with exceptional quality and highest attention to details.

***

We at New Kitchen Toronto use a wide variety of Canadian-manufactured cabinets, countertops, components and accessories that, together with our craftsmanship will ensure your complete satisfaction with the project.
We offer any product or service that exists on the woodworking market today at affordable prices. ",newkitchentoronto-ca,2010-10-08T20:13:12.000-04:00,NA,all GTA,call anytime,IKEA INSTALLER and Designer ,All of GTA,IKEA,Installation and design ,2000,3,"cheque, cash or credit card ",civil engineer ,"$2,000,000 liability insurance",,TRUE,FALSE,$50 per hour ,$250 ,TRUE,FALSE,1 year standard workmanship warranty ,1844911,New Kitchen Toronto,96,85,14,9.85882,"Cabinetry & Millwork, Kitchen Cabinetry, Custom Cabinetry, Bathroom Cabinetry, Architectural Millwork, Millwork, custom millwork, bathroom cabinets, Kitchen cabinets, built-in cabinets, built-in cabinetry,  cabinet makers, custom cabinets kitchen, cabinetry, thomasville kitchen cabinets, cabinet doors, millwork cabinetry, custom kitchen cabinets, kraftmaid cabinets, maple cabinets, wood cabinets, stock cabinets, thermofoil cabinets, laminate cabinets, kitchen cabinets design, cherry cabinets, kitchen cabinet designs, hickory cabinets, wholesale cabinets, custom made cabinets, cabinet millwork, cabinets kitchen, kitchen cabinetry, millwork cabinets, ready to assemble cabinets, quality cabinets, bamboo cabinets, caulking,
,Kitchen Planning & Renovation, Kitchen Planning And Design, Kitchen Cabinet Planning, Kitchen Design, Kitchen Remodeling, kitchen or, and bathroom, a and a kitchens, kitchens and, for kitchens, a kitchens, kitchens, the house design, cabinets for kitchen, cabinets for the kitchen, cabinets and kitchen, kitchen cabinets, design a kitchen, about kitchen design, a kitchen design, how to kitchen design, design and kitchen, the kitchen design, design for kitchen, kitchen designs, renovation and remodeling, remodeling and renovation, kitchen designer,,Kitchen Renovation, caulking, ,",0,2010-10-20T11:14:03.000-04:00,newIKEAkitchen,FALSE,0,0,12,100,FALSE,3516ffc0ff49b3aee0651f430692eb9728c18e78,TRUE,2021-05-20T11:07:15.000-04:00,TRUE,TRUE,2104923,95.6741001595,322,NA,NA
https://homestars.com/on/pottageville/cabinetry-millwork,34,"c(""https://homestars.com/on/pottageville/cabinetry-millwork?&page=2&"", ""https://homestars.com/on/pottageville/cabinetry-millwork?&page=3&"", ""https://homestars.com/on/pottageville/cabinetry-millwork?&page=4&"")",Cabinetry & Millwork,2848202,http://www.sweetrefinishing.com,/companies/2848202-sweet-refinishing-painting?searched_category_id=322&service_area=2212022,"We are a professional Kitchen Cabinet Refinishing & Refacing, Painting, Kitchen & general contracting company servicing Toronto, Mississauga, Brampton, Oakville, Milton, Vaughan, Scarborough and the GTA. With years of experience under our belt there is nothing we cant tackle.

Feel free to call us for a FREE estimate 416-925-2115.

#kitchencabinetpainting #spraypaintingkitchencabinets #cabinetpainting #kitchencabinetrefinishing #cabinetrefacing #kitchenrefacing  #quartz #kitchenrenovation #quartzcountertops

LINKS TO CHECK OUT:
Instagram Page   |   https://www.instagram.com/sweetrefinishing/
Additional Work Pictures 2021   |   https://goo.gl/photos/3msBmSzgc6rY4XrX6 ",sweet-refinishing-painting,2014-02-01T21:02:03.000-05:00,NA,NA,8am - 8pm,"Sweet Refinishing & Painting is a full service painting company for your all kinds of painting, refinishing, contracting needs. It’s a one-stop shop for residential and commercial spaces. We provide the best painting solutions throughout the GTA to beautify your home or work place with the best results.

For many years, we have been providing quality-painting services to our clients with the promise of reliability, excellence and affordability. Within Toronto and GTA we are renowned as leading painting service providers that are always committed to exceeding your expectations. Our wonderful clients consist of Homeowners, Real Estate Agents, Property Managers, General Contractors and Facilities Managers. Our services include the following.


A. Kitchen Cabinet Refinishing / Refacing
B. Painting
C. Countertops
D. Backsplash
E. General Renovations

Sweet Painters & Refinishing is the perfect team for you’re kitchen cabinets, renovations, home and commercial painting. We professionally spray paint kitchen cabinets and paint houses, condos, apartments and any type of residential or commercial property in Toronto and throughout the GTA.","Our residential painting services include :

Home Painting
Kitchen Cabinet Refinishing
Kitchen Cabinet Refacing
Countertops
Custom Home Painting
Condominium & Apartments
Exterior Painting
Interior Painting
General Handyman services
Application and removal of wallpaper
Kitchen Cabinet Painting & Staining

EXTERIOR PAINTING:

Exterior Home Painting
Aluminium Siding Painting
Brick Painting
Deck Staining & Fence Staining
Driveway & Patrio Concrete
Power & Pressure Washing

COMMERCIAL PAINTING:

Our commercial painting services consist of painting the following and more. We offer great pricing for bulk and large projects. We are fully licensed and insured for all your commercial painting needs. 

Office painting
Medical offices
Townhouse and apartment complexes
Daycares and nurseries
Small and large businesses
Retail stores
Fast food outlets and restaurants
Hospitals and nursing homes
School
Factories
New industrial building renovations
Pre-construction painting
Underground parking garage painting
Hotels and motels
Dance studios and gyms
Arenas and entertainment venues
Graffiti removal
Line painting and line marking
Epoxy and concrete floor painting","We use Eco Friendly premium paints and lacquers from various brands including but not limited to Benjamin Moore, Sherwin Williams etc.. For Kitchen cabinet refinishing we use commercial grade water and oil based lacquers.","Kitchen Cabinet Refinishing, Kitchen Cabinet Painting, Cabinet Painting, Kitchen Cabinet Refacing, House Painting, Quartz Countertops, Backsplash, Kitchen Renovation, Tiling, Pot lights, General Renovations",7,18,"Cash, Cheque, Debit, All Credit Cards",,"Fully Insured, WSIB",,TRUE,FALSE,,,TRUE,FALSE,All projects guaranteed from six months to 1 Year depending on the service,1910636,Sweet Refinishing & Painting,99,88,547,9.27273,"Paint & Wallpaper Contractors, Paint Colors, Paint Store, Paint Brush, Paint Shop, Home Wallpaper,Wallpaper, Paint colour advice, paint colour consultants, wallpapering, painter, faux, painters painting, painters paint, business painting, find painting, painting and restoration, new jersey painting, oh painting, local painting, wall paper repair, ,Cabinetry & Millwork, Kitchen Cabinetry, Custom Cabinetry, Bathroom Cabinetry, Architectural Millwork, Millwork, custom millwork, bathroom cabinets, Kitchen cabinets, built-in cabinets, built-in cabinetry,  cabinet makers, custom cabinets kitchen, cabinetry, thomasville kitchen cabinets, cabinet doors, millwork cabinetry, custom kitchen cabinets, kraftmaid cabinets, maple cabinets, wood cabinets, stock cabinets, thermofoil cabinets, laminate cabinets, kitchen cabinets design, cherry cabinets, kitchen cabinet designs, hickory cabinets, wholesale cabinets, custom made cabinets, cabinet millwork, cabinets kitchen, kitchen cabinetry, millwork cabinets, ready to assemble cabinets, quality cabinets, bamboo cabinets, caulking,
,",1,NA,sweetrefinishing,FALSE,0,0,282,0,FALSE,11a2f5cbef8ea2119187505c1f77c8b66d41318b,TRUE,2021-07-05T00:32:15.000-04:00,TRUE,TRUE,2212022,91.7904051567,322,NA,NA
