Link,n_hits,all_links,category,id,url,hs_path,profile,permalink,created_at,sic_code,service_area,hours,products,services,brands,specialities,established,employee_cnt,payment_method,diplomas,licenses,memberships,liability_insurance,bonded,project_rate,project_minimum,written_contract,written_warranty,warranty_terms,parent_company_id,name,total_number_of_reviews_cache,total_number_of_approved_reviews_cache,number_of_photos_cache,avg_rating_cache,categories_info_cache,savings_count,subdomain,fraudulent,fraudulent_count,total_number_of_pending_reviews_cache,images_count,completion_percent_cache,bully,secret,replied_to_at_least_one_review_cache,latest_approved_review_created_at,has_set_tasks,lead_purchase_eligible,service_area_id,star_score,quote_button_category,direct_phone,direct_contact,claimed_at
https://homestars.com/on/lakefield/drapery-curtains,7,https://homestars.com/on/lakefield/drapery-curtains,Drapery & Curtains,2848841,http://www.madeintheshadedurham.com,/companies/2848841-made-in-the-shade-blinds-and-more-durham?searched_category_id=343&service_area=1982258,"Made In The Shade Blinds and More Durham is a Total Window Treatment Solutions company.  We service residential and commercial window covering needs for the entire Durham Region area including Pickering, Uxbridge, Ajax, Whitby, Oshawa, Port Perry, Courtice and Bowmanville.  Our mobile showroom will come right to your house so you can view and sample our products from the comfort of your own home.  We offer a full range of blinds, shades, shutters and drapes from leading manufacturers such as Hunter Douglas, Shade-O-Matic, Graber and Horizons.  We offer free in-home consultations, window measuring and installation.  Let us earn your business and your trust.",made-in-the-shade-blinds-and-more-durham,2014-02-16T10:19:55.000-05:00,NA,Made in the Shade Blinds and More is a mobile window covering service and that means we are coming to ...,"any day, any time.","We offer only the highest quality of products in the industry such as Hunter Douglas, Shade O Matic, Graber/Springs, and Horizons.  We carry the full compliment of aluminum, wood, faux wood and now fabric blinds.  We carry sun shades, roller shades and roman shades. We carry shadings such as silhouette and shadow magic.  We carry vinyl, faux wood and wood shutters.  We also carry a unique line of hand painted blinds and shades to give you the unique and exact look you seek.","Our in-home shopping experience is second to none.  We bring the product samples to your home and do a great consultation in the comfort of your home.  We will measure all your windows and provide you with a quote you will love.  We will then order your custom made window coverings, deliver and install.","We carry Hunter Douglas, Shadeomatic, Maxxmar, Graber and Horizons window fashions. We also carry an awesome line of Sphinx indoor and outdoor area rugs by Oriental Weavers.","For a real unique look to your window (and especially for retail and home businesses) Made in the Shade Blinds and More is pleased to offer hand painted window coverings.  We can hand paint anything from corporate logos to natural setting to artwork on coverings such as aluminum and faux wood blinds, vertical PVC blinds and roller and sun shades.",2014,NA,"cash, cheque or credit card",,,,FALSE,FALSE,,,TRUE,FALSE,,1911275,Made In The Shade Blinds And More Durham,66,56,88,9.66071,"Drapery & Curtains, Drapery, Custom Drapery, Blinds, Curtain Rods, Drapery Hardware, Curtain stores, Drapes, custom window coverings, drapery fabric, soft furnishings, roman blinds, custom blinds,  custom curtains, the curtain, curtain, curtains, drapery, drapes, drapery curtain, curtain drapery, drapery and curtain, curtain and drapery, drapery curtains, curtains and drapery, curtains drapery, drapery and curtains, valence, drapes and curtains, curtains drapes, curtains & drapes, curtains and drapes, drapes curtains, drapes & curtains, draperies, curtain and drapes, ,",1,madeintheshade,FALSE,0,0,74,0,FALSE,ccbf7e0b1a6c50d28239a146d7fb493f601f495f,TRUE,2018-04-26T20:21:59.000-04:00,TRUE,FALSE,1982258,83.7015680913,343,NA,NA,NA
https://homestars.com/on/lakefield/drapery-curtains,7,https://homestars.com/on/lakefield/drapery-curtains,Drapery & Curtains,2923289,https://budgetblinds.com/peterborough,/companies/2923289-budget-blinds-of-peterborough?searched_category_id=343&service_area=2179240,"Welcome to Budget Blinds of Peterborough. We're your local experts and are proud to be backed by the #1 provider of custom window coverings in North America that has provided design-driven solutions for over 25 years. With the highest levels of customer satisfaction, you'll have the peace of mind and security that comes with choosing the proven leader. We’ll get to know you and your unique style so we can deliver the perfect solution for your home. 

***

Explore what Beautiful can do for your windows. Contact us today to schedule your appointment. We’re looking forward to working with you.
",budget-blinds-of-peterborough,2018-10-25T17:38:01.000-04:00,NA,NA,NA,,,,,NA,NA,,,,,FALSE,FALSE,,,FALSE,FALSE,,1985463,Budget Blinds Of Peterborough,3,3,45,10,"Drapery & Curtains, Drapery, Custom Drapery, Blinds, Curtain Rods, Drapery Hardware, Curtain stores, Drapes, custom window coverings, drapery fabric, soft furnishings, roman blinds, custom blinds,  custom curtains, the curtain, curtain, curtains, drapery, drapes, drapery curtain, curtain drapery, drapery and curtain, curtain and drapery, drapery curtains, curtains and drapery, curtains drapery, drapery and curtains, valence, drapes and curtains, curtains drapes, curtains & drapes, curtains and drapes, drapes curtains, drapes & curtains, draperies, curtain and drapes, ,",0,NA,FALSE,0,0,57,0,FALSE,60bc9b84e9b0a3da756c5651257fe7715bed0c72,TRUE,NA,TRUE,FALSE,2179240,76.4213874182,343,NA,NA,2018-10-25T17:38:40.000-04:00
https://homestars.com/on/lakefield/drapery-curtains,7,https://homestars.com/on/lakefield/drapery-curtains,Drapery & Curtains,2845548,http://flexblinds.com,/companies/2845548-flex-custom-blinds?searched_category_id=343&service_area=1971066,"Flex Custom Blinds is a turn key shop at home Window Covering  business that has been serving  the GTA and Ottawa  since 1985. We specialize in finding the perfect custom made window treatments to suit your lifestyle,taste and budget. 
Ask for our free at home consultation services. Motorization is our speciality


We offer a wide variety of blinds,shades, California shutters, drapery,romans, sliding panels, motorization, multi shades, silhouettes ,pirhouettes,speciality shapes and so much more",flex-custom-blinds,2013-11-18T09:52:29.000-05:00,NA,"Toronto, Markham Vaughan, Oakville, Burlington, Durham, Aurora, Muskoka, Barrie GTA- 416-277-5807 Ottawa, Nepean, Kanata, Gloucester, Baarhaven, Orleans, Carelton place, 613-698-5539 ",7 days a week,"We offer a wide variety of blinds,shades,interior shutters, drapery,romans, honeycomb,multi shades,silhouettes,pirouettes,speciality shapes and so much more

Motorization is our speciality","Free shop at home consultation.
Complete Warrantied Installation Service.
","All the Industry leaders including 
Hunter Douglas, Maxxmar, Elite, 
Levolor, Somfy motors
 All high quality Fabric and Drapery suppliers.","Multi functional blinds, Energy Efficiency, Child Safety, Privacy, Lite Blocking,Speciality Shape windows.Top notch customer service- before and after the Install.",NA,NA,"Credit Cards,Cheque,Cash,Internet transfer",,,,TRUE,FALSE,,,TRUE,FALSE,Limited lifetime,1907984,Flex Custom Blinds,7,5,10,9.8,"Drapery & Curtains, Drapery, Custom Drapery, Blinds, Curtain Rods, Drapery Hardware, Curtain stores, Drapes, custom window coverings, drapery fabric, soft furnishings, roman blinds, custom blinds,  custom curtains, the curtain, curtain, curtains, drapery, drapes, drapery curtain, curtain drapery, drapery and curtain, curtain and drapery, drapery curtains, curtains and drapery, curtains drapery, drapery and curtains, valence, drapes and curtains, curtains drapes, curtains & drapes, curtains and drapes, drapes curtains, drapes & curtains, draperies, curtain and drapes, ,",0,flexblinds,FALSE,0,0,8,0,FALSE,2a6aacb036bb527bfb177ea30b6e9de72300edf7,TRUE,2014-07-15T21:58:15.000-04:00,FALSE,FALSE,1971066,42.5032558902,343,NA,NA,NA
https://homestars.com/on/lakefield/drapery-curtains,7,https://homestars.com/on/lakefield/drapery-curtains,Drapery & Curtains,2657658,NA,/companies/2657658-r-p-blinds?searched_category_id=343&service_area=1670862,NA,r-p-blinds,2008-03-04T16:55:15.000-05:00,NA,NA,NA,NA,NA,NA,NA,NA,NA,NA,NA,NA,NA,FALSE,FALSE,NA,NA,FALSE,FALSE,NA,1720710,R & P Blinds,0,0,0,NA,"Drapery & Curtains, Drapery, Custom Drapery, Blinds, Curtain Rods, Drapery Hardware, Curtain stores, Drapes, custom window coverings, drapery fabric, soft furnishings, roman blinds, custom blinds,  custom curtains, the curtain, curtain, curtains, drapery, drapes, drapery curtain, curtain drapery, drapery and curtain, curtain and drapery, drapery curtains, curtains and drapery, curtains drapery, drapery and curtains, valence, drapes and curtains, curtains drapes, curtains & drapes, curtains and drapes, drapes curtains, drapes & curtains, draperies, curtain and drapes, ,",0,NA,FALSE,0,0,0,NA,FALSE,962fe13c421fd976c3a70715b297b0b2ba33e4c6,FALSE,NA,FALSE,FALSE,1670862,-1.0,343,NA,NA,2020-08-11T19:59:28.000-04:00
https://homestars.com/on/lakefield/drapery-curtains,7,https://homestars.com/on/lakefield/drapery-curtains,Drapery & Curtains,2672690,NA,/companies/2672690-first-stitch?searched_category_id=343&service_area=1685894,NA,first-stitch,2008-03-04T16:55:15.000-05:00,NA,NA,NA,NA,NA,NA,NA,NA,NA,NA,NA,NA,NA,FALSE,FALSE,NA,NA,FALSE,FALSE,NA,1735742,First Stitch,0,0,0,NA,"Drapery & Curtains, Drapery, Custom Drapery, Blinds, Curtain Rods, Drapery Hardware, Curtain stores, Drapes, custom window coverings, drapery fabric, soft furnishings, roman blinds, custom blinds,  custom curtains, the curtain, curtain, curtains, drapery, drapes, drapery curtain, curtain drapery, drapery and curtain, curtain and drapery, drapery curtains, curtains and drapery, curtains drapery, drapery and curtains, valence, drapes and curtains, curtains drapes, curtains & drapes, curtains and drapes, drapes curtains, drapes & curtains, draperies, curtain and drapes, ,",0,NA,FALSE,0,0,0,NA,FALSE,NA,FALSE,NA,FALSE,FALSE,1685894,-1.0,343,NA,NA,NA
https://homestars.com/on/lakefield/drapery-curtains,7,https://homestars.com/on/lakefield/drapery-curtains,Drapery & Curtains,2761463,NA,/companies/2761463-alice-draperies?searched_category_id=343&service_area=1774667,NA,alice-draperies,2008-03-04T16:55:15.000-05:00,NA,NA,NA,NA,NA,NA,NA,NA,NA,NA,NA,NA,NA,FALSE,FALSE,NA,NA,FALSE,FALSE,NA,1824515,Alice Draperies,0,0,0,NA,"Drapery & Curtains, Drapery, Custom Drapery, Blinds, Curtain Rods, Drapery Hardware, Curtain stores, Drapes, custom window coverings, drapery fabric, soft furnishings, roman blinds, custom blinds,  custom curtains, the curtain, curtain, curtains, drapery, drapes, drapery curtain, curtain drapery, drapery and curtain, curtain and drapery, drapery curtains, curtains and drapery, curtains drapery, drapery and curtains, valence, drapes and curtains, curtains drapes, curtains & drapes, curtains and drapes, drapes curtains, drapes & curtains, draperies, curtain and drapes, ,",0,NA,FALSE,0,0,0,NA,FALSE,NA,FALSE,NA,FALSE,FALSE,1774667,-1.0,343,NA,NA,NA
https://homestars.com/on/lakefield/drapery-curtains,7,https://homestars.com/on/lakefield/drapery-curtains,Drapery & Curtains,2618947,NA,/companies/2618947-anna-s-draperies?searched_category_id=343&service_area=1632151,NA,anna-s-draperies,2008-03-04T16:55:15.000-05:00,NA,NA,NA,NA,NA,NA,NA,NA,NA,NA,NA,NA,NA,FALSE,FALSE,NA,NA,FALSE,FALSE,NA,1681999,Anna's Draperies,0,0,0,NA,"Drapery & Curtains, Drapery, Custom Drapery, Blinds, Curtain Rods, Drapery Hardware, Curtain stores, Drapes, custom window coverings, drapery fabric, soft furnishings, roman blinds, custom blinds,  custom curtains, the curtain, curtain, curtains, drapery, drapes, drapery curtain, curtain drapery, drapery and curtain, curtain and drapery, drapery curtains, curtains and drapery, curtains drapery, drapery and curtains, valence, drapes and curtains, curtains drapes, curtains & drapes, curtains and drapes, drapes curtains, drapes & curtains, draperies, curtain and drapes, ,",0,NA,FALSE,0,0,0,NA,FALSE,NA,FALSE,NA,FALSE,FALSE,1632151,-1.0,343,NA,NA,NA
