Link,n_hits,all_links,category,id,url,hs_path,profile,permalink,created_at,sic_code,service_area,hours,products,services,brands,specialities,established,employee_cnt,payment_method,diplomas,licenses,memberships,liability_insurance,bonded,project_rate,project_minimum,written_contract,written_warranty,warranty_terms,parent_company_id,name,total_number_of_reviews_cache,total_number_of_approved_reviews_cache,number_of_photos_cache,avg_rating_cache,categories_info_cache,savings_count,subdomain,fraudulent,fraudulent_count,total_number_of_pending_reviews_cache,images_count,completion_percent_cache,bully,secret,replied_to_at_least_one_review_cache,latest_approved_review_created_at,has_set_tasks,lead_purchase_eligible,service_area_id,star_score,quote_button_category,direct_phone,direct_contact,claimed_at
https://homestars.com/on/caledon/moldings,2,https://homestars.com/on/caledon/moldings,Trim and Moldings,2878823,http://www.miskaswoodproducts.com,/companies/2878823-miskas-wood-products-inc?searched_category_id=406&service_area=2063288,"Miskas Wood Products Inc is a family owned wholesaler which now sells Pine Mouldings and other wood products directly to the public. We’ve got years of experience in the manufacturing industry and our products are used and trusted by contractors all over Canada.

We like to make things easy for our customers; Most of our trim & moulding range is available unprimed, primed and even painted for your installation convenience.

We do everything under one roof. We chop, finger joint and mill. By keeping all our operations under one roof, we can double check for quality throughout the entire manufacturing process.",miskas-wood-products-inc,2015-11-03T12:48:02.000-05:00,NA,NA,NA,"Primed and/or Painted Trim & Mouldings - Finger-Jointed White Pine Products :          

Baseboards - Casings - Crown Moulding - Chair Rail - Panel Mould - Doorstops - Backband - Shiplap (Paint Grade) - Tongue & Groove (Paint Grade) - Knotty Pine T&G - Wood Pillars - Fiberglass Columns ",,,Specializing in Manufacturing 100% North American White Pine Trim and Mouldings Products. ,2001,10,"Visa, Mastercard, Cash, E-Transfer, Interac",,,,FALSE,FALSE,,,FALSE,FALSE,,1941247,Miskas Wood Products Inc.,48,36,58,9.94444,"Trim and Moldings, Wood Mouldings, Architectural Mouldings, Decorative Mouldings, Ornamental Mouldings, Mouldings For Picture Frame, Trimwork, wood moldings, architectural moldings, ornamental moldings, decorative moldings, decorative mouldings, dado rails, wood paneling, French baseboards, 9"" baseboards, stair rails, stair bannister, cornice moulding, crown moulding, crown molding, molding, moulding molding, molding or moulding, molding trim, molding and trim, trim molding, moulding and trim, moulding trim, trim moulding, mouldings, moldings, crown molding, molding crown, crown molding in, crown moulding, moulding crown, crown molding moulding, door trim molding, door trim moulding, trim mouldings, mouldings trim, mouldings and trim, moldings crown, crown moldings, crown mouldings, install crown molding, crown molding cut, cut crown molding, crown moulding cut, cut crown moulding, molding company, wood trim moulding, molding corner, corner molding, mold trim, plastic trim moulding, molding corner, corner molding, mold trim, plastic trim moulding, plastic moulding trim, moulding company, corner moulding, moulding corner, plastic trim molding, moldings and trim, moldings trim, trim moldings, molding co, molding companies, installing crown molding,,",0,miskaswood,FALSE,0,0,87,0,FALSE,9230d4d484ba90180313ddc2bba3109325697390,TRUE,2020-07-04T14:35:55.000-04:00,TRUE,TRUE,2063288,87.4814603038,406,NA,NA,NA
https://homestars.com/on/caledon/moldings,2,https://homestars.com/on/caledon/moldings,Trim and Moldings,2937551,https://www.instagram.com/updatemoulding/,/companies/2937551-update-precast-moulding-inc?searched_category_id=406&service_area=2211893,"Update Precast Moulding is founded on the tradition of manufacturing and installation of timeless and contemporary artistic designs using plaster materials. All products and designs are exclusively hand crafted by our staff. We improve and grow our diverse lines of products through feedback from our customers as well as developing and enhancing our products as industry trends evolve. Choose Update Precast Moulding for your next residential, commercial or industrial renovation. We are the smart choice for your project, your healthy lifestyle, and the environment. We can help you achieve your vision of a sophisticated and elegant space. Custom Ceiling Design, Crown Moulding, and Waffle Ceilings. 
 ",update-precast-moulding-inc,2019-11-27T14:12:48.000-05:00,NA,NA,NA,,,,"-Custom Ceiling Designs 
-Crown Moulding
-Waffle Ceilings ",NA,NA,,,,,FALSE,FALSE,,,FALSE,FALSE,,1999725,Update Precast Moulding Inc,24,20,69,10,"Trim and Moldings, Wood Mouldings, Architectural Mouldings, Decorative Mouldings, Ornamental Mouldings, Mouldings For Picture Frame, Trimwork, wood moldings, architectural moldings, ornamental moldings, decorative moldings, decorative mouldings, dado rails, wood paneling, French baseboards, 9"" baseboards, stair rails, stair bannister, cornice moulding, crown moulding, crown molding, molding, moulding molding, molding or moulding, molding trim, molding and trim, trim molding, moulding and trim, moulding trim, trim moulding, mouldings, moldings, crown molding, molding crown, crown molding in, crown moulding, moulding crown, crown molding moulding, door trim molding, door trim moulding, trim mouldings, mouldings trim, mouldings and trim, moldings crown, crown moldings, crown mouldings, install crown molding, crown molding cut, cut crown molding, crown moulding cut, cut crown moulding, molding company, wood trim moulding, molding corner, corner molding, mold trim, plastic trim moulding, molding corner, corner molding, mold trim, plastic trim moulding, plastic moulding trim, moulding company, corner moulding, moulding corner, plastic trim molding, moldings and trim, moldings trim, trim moldings, molding co, molding companies, installing crown molding,,",0,updateprecast,FALSE,0,0,81,0,FALSE,0fa4559d96a66ccd4cdfd04204e86c36901e1aa7,FALSE,2019-12-16T17:55:28.000-05:00,TRUE,FALSE,2211893,86.9266177726,406,NA,NA,2019-11-27T14:14:09.000-05:00
