Link,n_hits,all_links,category,id,url,hs_path,profile,permalink,created_at,sic_code,service_area,hours,products,services,brands,specialities,established,employee_cnt,payment_method,diplomas,licenses,memberships,liability_insurance,bonded,project_rate,project_minimum,written_contract,written_warranty,warranty_terms,parent_company_id,name,total_number_of_reviews_cache,total_number_of_approved_reviews_cache,number_of_photos_cache,avg_rating_cache,categories_info_cache,savings_count,claimed_at,subdomain,fraudulent,fraudulent_count,total_number_of_pending_reviews_cache,images_count,completion_percent_cache,bully,secret,replied_to_at_least_one_review_cache,latest_approved_review_created_at,has_set_tasks,lead_purchase_eligible,service_area_id,star_score,quote_button_category,direct_phone,direct_contact
https://homestars.com/on/shanty-bay/shutters-blinds,1,https://homestars.com/on/shanty-bay/shutters-blinds,Shutters & Blinds,2886777,http://www.dcshutters.ca,/companies/2886777-dc-shutters?searched_category_id=431&service_area=2218321,"***CALL TO HEAR OUR SPECIAL OFFERS TODAY***

DC SHUTTERS specializes in quality Canadian Manufacturer Shutters that withstand our harsh Canadian climate. 

Customers are happy because we provide custom shutters at great prices tailored to their needs. Our consultants and have over 22 years experience EACH so they are able to help you choose wisely. 

Our installers have over 25 years installing shutters so your shutters will function perfectly for many years. Your shutter is fabricated using quality wood, vinyl and paints so it will continue to look great for many years. Everyone we show them to agrees that the quality is easy to see and feel - so see for yourself. 

You provide the coffee and we will provide FREE advice in the comfort of your home. We’ll even bring our Plantation and California Wood Shutters samples for you to review.
 
Once you review what customers say about our offering - 
 
Check Out Our Website To:
 
- BOOK APPOINTMENT
- GET A QUICK QUOTE 
- REVIEW OUR OUR OFFERING
- CHECK OUT SPECIAL OFFERS",dc-shutters,2016-04-28T09:48:36.000-04:00,NA,NA,NA,"Our most popular wood shutter is manufactured by a local company 
that uses the highest high quality wood and paints, so your shutters
look better and last longer at a fraction of the price.

More important - we are able to custom design and install your 
shutters quickly. No long wait period.

Have a look at our samples and see the quality difference.

Our most popular vinyl shutter is made by Canada's 
premier manufacturers of windows - your vinyl is made of
the same pure un-recycled vinyl resin that will not change 
colour or warp.

CHECK OUT OUR WEBSITE FOR MORE PRODUCT DETAILS.
","In home consultations -- view samples - Free no obligation.
 
Custom Shutter Design
Shutter Installation
Blinds Installation

To further enhance your home we also offer:

Rod Iron door inserts
Glass door inserts

View more detail of the services we provide on our website (click the link below)",Custom wood and vinyl shutters from local manufacturers ,"We specializes in custom wood and vinyl shutters and glass and wrought iron door inserts.

Check out details on our website.",1997,5,"E-Transfer, Cash or Cheque",Not Applicable,Yes,HomeStars,TRUE,TRUE,Based on your requirement,None,TRUE,FALSE,25 Years Warranty,1949201,Dc Shutters,274,244,42,9.95082,"Shutters & Blinds, Window Shutter, Hurricane Shutter, Exterior Shutter, Window Blinds, Venetian Blinds, California shutters, plantation shutters, wood shutters, metal shutters,  roller blinds, roman blinds, custom blinds, sunscreens, vertical blinds, blind, curtains, shutter, for blinds, about blinds, blinds blinds blinds, blinds, blinds blinds, blinds to, and blinds, shades, shutters, the shutters, curtains and drapes, drapes and curtains, blinds and shade, blinds shade, window treatments and, window treatments, what are window treatments, shades and blinds, blinds & shades, shades blinds, shades and blinds, shades or blinds, blinds or shades, blinds and shades, window treatment, window coverings, window blinds, window blinds for, windows and blinds, window with blinds, blinds in window, blinds and window, blinds for window, ,Shades,",0,2016-05-06T16:35:57.000-04:00,dcshutters,FALSE,0,0,47,0,FALSE,d68e8ea2da1db8be8e0ea99de2d1551c6719f824,TRUE,2022-04-27T17:06:51.000-04:00,TRUE,TRUE,2218321,99.3747130236,431,NA,NA
