Link,n_hits,all_links,category,id,url,hs_path,profile,permalink,created_at,sic_code,service_area,hours,products,services,brands,specialities,established,employee_cnt,payment_method,diplomas,licenses,memberships,liability_insurance,bonded,project_rate,project_minimum,written_contract,written_warranty,warranty_terms,parent_company_id,name,total_number_of_reviews_cache,total_number_of_approved_reviews_cache,number_of_photos_cache,avg_rating_cache,categories_info_cache,savings_count,claimed_at,subdomain,fraudulent,fraudulent_count,total_number_of_pending_reviews_cache,images_count,completion_percent_cache,bully,secret,replied_to_at_least_one_review_cache,latest_approved_review_created_at,has_set_tasks,lead_purchase_eligible,service_area_id,star_score,quote_button_category,direct_phone,direct_contact
https://homestars.com/on/becker/home-additions,25,"c(""https://homestars.com/on/becker/home-additions?&page=2&"", ""https://homestars.com/on/becker/home-additions?&page=3&"")",Home Additions,2773872,https://novacon.ca/,/companies/2773872-novacon-home-additions-renovations-toronto?searched_category_id=378&service_area=1787076,"We have been providing our construction services for almost 15 years helping our clients to renovate and enhance their living space. Novacon Construction Inc are a full DESIGN-BUILD firm focusing on large scale higher end Major renovations, Home additions and full Custom Homes. We are a very well planned company that work well with clients that are looking for a high end/professional building experience and not a jack of all trades approach. Our clients work with a professional DESIGN-BUILD team that consists of in house designer, Project manager, Site supervisor and tradesman for the duration of their build.
 
Our aim is to produce a high quality product, to perform in the most efficient way possible, and to make your renovation a positive and rewarding experience. All our trades people are highly skilled and bring with them a wealth of experience. NOVACON Custom Builders & Renovators are equipped to work on any area of your home, from major additions, basements, to bathrooms, including kitchen development and we can even build your dream home!
 
A satisfied customer is our best advertisement!!!.
 ",novacon-home-additions-renovations-toronto,2009-02-01T20:26:10.000-05:00,NA,"Pickering, Concord,  Markham, , Newmarket, North York, Richmond Hill, Scarborough, Thornhill, Toronto, Unionville, Vaughan, Woodbridge, Stouffville, Uxbridge",MONDAY-FRIDAY 7am-6pm( 416)-881-7176,ALL PRODUCTS AVAILABLE THROUGHOUT NORTH AMERICA,"Novacon is a toronto area renovator/general contractor providing professional construction services and project management for new home construction, custom homes, home renovations, additions, home improvements, kitchens, basements, bathrooms and light commercial.

Proudly servicing Toronto, Vaughan, Richmond Hill, Markham, Ajax and Pickering!
",,"HOME ADDITIONS, CUSTOM HOMES and FULL INTERIOR RENOVATIONS",1998,7," CHEQUE, CASH",BUSINESS MANAGEMENT,TORONTO BUILDERS LICENSE,"BILD, Renomark, Baeumler approved, Canadian home builders association",TRUE,FALSE,VARIES DEPENDING ON PROJECT,"$50,000.00 and up",TRUE,FALSE,FULL 2 YEAR WARRANTY ON ALL NEW CONSTRUCTION,1836924,Novacon Construction Inc,85,71,293,9.97183,"Home Additions, General contractor, home improvement, building addition, home expansion, house expansion, house building, plans house, house plans from, plans for house, the house plans, house plans, renovation, in house design, home plans house, home house plans, house home plans, house plans home, remodeling, house plans and designs, designs house plans, house designs plans, house plans designs, home plans and designs, home designs plans, floor plans, house build, renovations, plans for building, kitchen cabinets, remodel, kitchen design, house plans for building, house plans building, ,General Contractors, Residential General Contractor, Building Contractor, Additions, Remodeling Contractor,  Renovation, Builder, building construction, renovation, remodeling, construction builders, construction company, construction companies, home repair, construction jobs, home remodeling, general contractors, contractors general, contractor general, contractors construction, construction contractors, home improvement and remodeling, kitchen remodeling, construction contractor, builders contractors, home renovation, general contracting, building contractors, building companies, home renovations, builder contractor, building contractor, remodeling contractor, commercial construction, residential construction, house contractor, concrete contractors, home contractors, general construction, construction general, contractors remodeling, remodeling contractors, remodelers, remodel contractor, remodel contractors, general contract, commercial contractors, renovations contractors, home improvement contractor, licensed contractor, license general contractor, mud room, mudroom, caulking, ,Design/Build, Contracting, Renovation, Remodeling, Restoration, Project Management, Renovation Assistance, Reno Management, architect, architects, design build, build & design, design and build, build by design, design to build. building construction, building a house, house designs, house plans, home designs, house plan, how to design a house, design house, house design, remodeling, building and design, design for building, design building, building by design, a building design, design of building, building design, design a building, building & design,  playsets, playground, wooden playset, wooden playground, play set, ,Design/Project Management, Drafters, Drafting, Project Management, Building, General Contracting, Renovation Management, Project Manager, Design Management.,Bathroom Renovation, Bathroom renovation, bathroom remodeling, bathroom remodelling, renovating the bathroom, tearing out the bathroom, fixing up the bathroom, bathroom contractors, bathroom vanities, bathroom vanity, design of bathroom, bathroom and design, design for bathroom, design a bathroom, design a bath, bath design, bathroom tile, bathroom cabinets, remodeling a bathroom, bathroom remodeling, remodeling the bathroom, ,Bath renovation, New tub, caulking, ,Builders, Home Builders, Home Contractors, residential builders, home construction companies, residential building contractor, builder, construction builders, local home builders, custom home builders, master builders, general builders, new home builders, building contractors, custom home builders, luxury home builders, ,Condominium Renovations, Condo, Apartment, remodeling, renovations, kitchen cabinet, home decor, condo apartments, home improvement, home improvements, remodeling home, home remodeling, remodeling a home, new condo, Condo facelift, 
I ,Condo RenovationsRenovations for a new condo that include removing a drywall and creating an island and a full kitchen remodeling. ,Small rodent in Attic,Basement Renovation, Basement renovation, Basement remodeling, Basement remodelling, renovating your basement, renovation, waterproofing, remodeling, home renovation, house renovation, water in basement, basement waterproofing,finishing basement, moistureproof, remodeling the house, caulking,",3,2009-02-01T20:26:10.000-05:00,novacon,FALSE,0,0,398,100,FALSE,26a6da1b79859b4102d56351a40b2c13857e7a36,TRUE,2020-12-15T13:27:11.000-05:00,TRUE,TRUE,1787076,90.9091912775,378,NA,NA
https://homestars.com/on/becker/home-additions,25,"c(""https://homestars.com/on/becker/home-additions?&page=2&"", ""https://homestars.com/on/becker/home-additions?&page=3&"")",Home Additions,2778565,http://www.completehomeconstruction.ca,/companies/2778565-complete-home-construction-inc?searched_category_id=378&service_area=2213680,"CHC is the Canadian exclusive dealer for Patio Enclosures Products Proudly serving Ontario and not limited to Toronto, Surrounding GTA and Tri-Cites areas.
Patio Enclosures has been building and creating beautiful living spaces since 1966. We have had the opportunity to transform many dreams into reality by designing rooms where you can relax and your children can safely play. We have enjoyed being a part of homeowners’ lives and strive to continue to provide our customers with the best technology on the market.

This dedication and care has made Patio Enclosures the largest manufacturer and installer of Sunrooms, Solariums and Conservatories in the industry. As an award winning company, we take great pride in every new room or addition we produce. Patio Enclosures products are distributed to  branches, franchises and dealers to provide you quick service at a competitive price.

All of our Sunrooms, Solariums, Additions and Conservatories are designed and custom-manufactured in our factory. As a NARI certified remodeler, we work to make sure every product you receive from Patio Enclosures is the best quality and fit for your home. If your design requires special attention, one of our engineers will work closely with you to create and design a Sunroom, Solarium, Traditional Addition or Conservatory that works with your home, lifestyle and budget.",complete-home-construction-inc,2010-03-13T17:35:38.000-05:00,NA,NA,NA,TRADITIONAL ADDITIONS | THREE SEASON SUNROOMS | FOUR SEASON SUNROOMS | SOLARIUMS | WHOLE FLOOR RENOVATIONS | WINDOWS & DOORS | BASEMENTS | CONSERVATORIES | ARCHITECTURAL DESIGN & PERMIT PLANS ,"Don't just renovate your home, rejuvenate your life with a Patio Enclosures brand sunroom, addition, solarium, renovation or any construction project. From modest to extravagant, our rooms are custom-designed and custom-manufactured to meet your needs, budget and lifestyle.",PATIO ENCLOSURES INC.,DESIGN & BUILD ,50,NA,,ARCHITECTURAL TECHNOLOGY | GEORGE BROWN COLLEGE,,,TRUE,FALSE,,,TRUE,FALSE,Life Time Warranty,1841617,Complete Home Construction Inc,45,39,222,9.69231,"Sunrooms, Solariums & Greenhouses, Four Season Sun Room, Sun Room Kit, Sun Room Addition, Solarium Furniture, Green House Nursery, Portable Green House, Green House Manufacturer, conservatory, conservatories,Home Additions, General contractor, home improvement, building addition, home expansion, house expansion, house building, plans house, house plans from, plans for house, the house plans, house plans, renovation, in house design, home plans house, home house plans, house home plans, house plans home, remodeling, house plans and designs, designs house plans, house designs plans, house plans designs, home plans and designs, home designs plans, floor plans, house build, renovations, plans for building, kitchen cabinets, remodel, kitchen design, house plans for building, house plans building, ,Design/Build, Contracting, Renovation, Remodeling, Restoration, Project Management, Renovation Assistance, Reno Management, architect, architects, design build, build & design, design and build, build by design, design to build. building construction, building a house, house designs, house plans, home designs, house plan, how to design a house, design house, house design, remodeling, building and design, design for building, design building, building by design, a building design, design of building, building design, design a building, building & design,  playsets, playground, wooden playset, wooden playground, play set, ,",0,2013-09-05T13:33:50.000-04:00,homeconcepts,FALSE,0,0,231,NA,FALSE,cf7b80285b4fc0f452554d9c72a22c7ca9eeeafd,TRUE,2022-01-06T10:31:17.000-05:00,TRUE,TRUE,2213680,96.2239035844,378,NA,NA
https://homestars.com/on/becker/home-additions,25,"c(""https://homestars.com/on/becker/home-additions?&page=2&"", ""https://homestars.com/on/becker/home-additions?&page=3&"")",Home Additions,2903296,http://www.gcgeneralcontracting.com,/companies/2903296-gc-general-contracting-inc?searched_category_id=378&service_area=2269607,"10% OFF FOR CUSTOMERS DOING HOME RENOVATIONS!!!

Welcome to GC Contracting
Our commitment to your project is reflected in the over 20 years committed from learning from master trade and journeymen.  We will execute on your desired outcome while being transparent and enlightening  on the process.
We love what we do and it will show in the quality and craftsmanship. 
Contact us today to see what is possible.
Services: Kitchens, Flooring & Tiling, Decks & Fencing, Wainscoting, Rough Carpentry, Basement Renovations, Bathroom Renovations, Home Renovations.
",gc-general-contracting-inc,2017-10-10T10:44:13.000-04:00,NA,NA,NA,,"Bathroom Renovations, Kitchen Renovations, Flooring & Tiling, Decks & Fencing, Wainscoting, Rough Carpentry, Basement Reno",,Trust us to do the job once and do it right.,2012,5,"Cash, Cheque and e-transfer",,All technicians are licensed as required ,,TRUE,FALSE,,,TRUE,FALSE,YES. Ask for details. Depends on Project. ,1965481,GC General Contracting Inc.,43,31,260,9.58065,"General Contractors, Residential General Contractor, Building Contractor, Additions, Remodeling Contractor,  Renovation, Builder, building construction, renovation, remodeling, construction builders, construction company, construction companies, home repair, construction jobs, home remodeling, general contractors, contractors general, contractor general, contractors construction, construction contractors, home improvement and remodeling, kitchen remodeling, construction contractor, builders contractors, home renovation, general contracting, building contractors, building companies, home renovations, builder contractor, building contractor, remodeling contractor, commercial construction, residential construction, house contractor, concrete contractors, home contractors, general construction, construction general, contractors remodeling, remodeling contractors, remodelers, remodel contractor, remodel contractors, general contract, commercial contractors, renovations contractors, home improvement contractor, licensed contractor, license general contractor, mud room, mudroom, caulking, ,Framing, carpentry, carpenter, building a house, house building, house designs, home designs, house plan, design house, house design, how to build a house. build a house, building plans, houseplans, home builders in, building house, house building plans, house builders, construction of house, house construction, building homes, design homes, modular home, house builder, homebuilders,Carpenters, interior framing, ,Home Additions, General contractor, home improvement, building addition, home expansion, house expansion, house building, plans house, house plans from, plans for house, the house plans, house plans, renovation, in house design, home plans house, home house plans, house home plans, house plans home, remodeling, house plans and designs, designs house plans, house designs plans, house plans designs, home plans and designs, home designs plans, floor plans, house build, renovations, plans for building, kitchen cabinets, remodel, kitchen design, house plans for building, house plans building, ,Basement Renovation, Basement renovation, Basement remodeling, Basement remodelling, renovating your basement, renovation, waterproofing, remodeling, home renovation, house renovation, water in basement, basement waterproofing,finishing basement, moistureproof, remodeling the house, caulking,Kitchen Planning & Renovation, Kitchen Planning And Design, Kitchen Cabinet Planning, Kitchen Design, Kitchen Remodeling, kitchen or, and bathroom, a and a kitchens, kitchens and, for kitchens, a kitchens, kitchens, the house design, cabinets for kitchen, cabinets for the kitchen, cabinets and kitchen, kitchen cabinets, design a kitchen, about kitchen design, a kitchen design, how to kitchen design, design and kitchen, the kitchen design, design for kitchen, kitchen designs, renovation and remodeling, remodeling and renovation, kitchen designer,,Kitchen Renovation, caulking, ,Bathroom Renovation, Bathroom renovation, bathroom remodeling, bathroom remodelling, renovating the bathroom, tearing out the bathroom, fixing up the bathroom, bathroom contractors, bathroom vanities, bathroom vanity, design of bathroom, bathroom and design, design for bathroom, design a bathroom, design a bath, bath design, bathroom tile, bathroom cabinets, remodeling a bathroom, bathroom remodeling, remodeling the bathroom, ,Bath renovation, New tub, caulking, ,Fences & Gates, Dog Fence, Invisible Fence, Chain Link Fence, Pool Fence, Wood Fence, Fence Gates, Dog Gates, Pet Gates, friendly neighbour fence, friendly neighbor fence, picket fence, wrought iron fence, and gate, and gates, gates, the fence, a fence, fence, fences, fence with gate, gate and fence, gate for fence, fence & gate, gate fence, fence gate, fence and gate, gates and fence, gates fence, fence & gates, fence and gates, fence gates, railings, wrought iron, electronic gates, entrance gate, trellis, fence post, front gates, chain fence, fence panels, fence chain link, chain link fence, how to wood fence, fence wood, wood for fence, wood fence, fence panel, garden gate, fence posts, fencing panels, iron gate, chain link fencing, panel fencing, gates iron, iron gates, chain link fences, fences chain link, fencing post, dog fencing, ,Floor Laying & Refinishing, Hardwood Floor, Wood Floor, Floor Tile, Dance Floor, Ceramic Floor Tile, Floor Refinishing, bamboo floor, cork floor, FSC wood flooring, stone floor, marble floor, slate floor, squeaky floor repair, laminate, laminate repair, wood floor, floor and wood, wood flooring, wood floors, floors in wood, hardwood flooring, hardwood floors, hardwood floors and, hardwood floor, hardwood floor wood, wood floor flooring, refinishing, floor refinishing, floor refinishing in, refinishing floor, hardwood install, floor laying, laying a floor, flood sanding, wood floor refinishing, refinishing hardwood floors, flooring laying, wood floors refinishing, wood flooring refinishing, floor co, flooring hard wood, hard wood floors, laying floors, flooring company, flooring engineered hardwood, floor company, hard wood floor, cleaning hardwood floors, installing hardwood flooring, installing hardwood floors, installing wood flooring, installing wood floors, installing hardwood floors, installing wood flooring, installing wood floors, installing hardwood floor, hardwood flooring installation, business floor, wood flooring installation, hardwood floor installation, floor companies, lay hardwood flooring, lay hardwood floor, wood floor repair, repair wood floor, repair hardwood floor, hardwood floor repair, finishing a hardwood floor, squeeky floors,,Hardwood floors, Install hardwood floors, caulking,",0,2017-10-11T17:11:26.000-04:00,gccontracting,FALSE,0,0,448,0,FALSE,9cb00eedf7098d91a9978269096ade087e7d9e5e,TRUE,2020-09-03T05:47:04.000-04:00,TRUE,TRUE,2269607,91.5673593845,378,NA,NA
https://homestars.com/on/becker/home-additions,25,"c(""https://homestars.com/on/becker/home-additions?&page=2&"", ""https://homestars.com/on/becker/home-additions?&page=3&"")",Home Additions,2774552,http://www.lyonsconstruction.ca,/companies/2774552-lyons-construction-inc--formerly-lyons-home-improvements?searched_category_id=378&service_area=1787756,"Thank you for visiting us here on Homestars. We are a full service home renovation company (formerly Lyons Home Improvements) serving the GTA and surrounding areas since 2005.

From minor renovations to complete remodels, we offer a wide range of residential and commercial services. We work closely with our clients to ensure that they receive a finished product that is what they want, not what we want. Our goal is to exceed expectations and develop long-term relationships. We want to be the company you choose for all your renovation needs.

We take pride not only in our work but in the customer service we provide everyone.  Once we begin your project, we promise to be there every day until it is complete, and only then will we move on.  Your satisfaction is our top priority, and our commitment to you remains after the project as we guarantee our work for two years after the date of completion.  

We would love the opportunity to meet with you, discuss your renovation needs, and provide you with a free estimate for any work you would like completed.

For more information, please visit our website at www.lyonsconstruction.ca or contact us at either (905) 427-7776 or info@lyonsconstruction.ca .
",lyons-construction-inc--formerly-lyons-home-improvements,2009-03-06T17:27:19.000-05:00,NA,,,,"Kitchens, bathrooms, basements, additions, decks, fences, siding, windows / doors, painting, flooring, as well as most other areas of renovations.",,,2005,NA,,,,,TRUE,TRUE,,,TRUE,FALSE,2 Years,1837604,Lyons Construction Inc.,35,32,253,9.96875,"Basement Renovation, Basement renovation, Basement remodeling, Basement remodelling, renovating your basement, renovation, waterproofing, remodeling, home renovation, house renovation, water in basement, basement waterproofing,finishing basement, moistureproof, remodeling the house, caulking,Bathroom Renovation, Bathroom renovation, bathroom remodeling, bathroom remodelling, renovating the bathroom, tearing out the bathroom, fixing up the bathroom, bathroom contractors, bathroom vanities, bathroom vanity, design of bathroom, bathroom and design, design for bathroom, design a bathroom, design a bath, bath design, bathroom tile, bathroom cabinets, remodeling a bathroom, bathroom remodeling, remodeling the bathroom, ,Bath renovation, New tub, caulking, ,Home Additions, General contractor, home improvement, building addition, home expansion, house expansion, house building, plans house, house plans from, plans for house, the house plans, house plans, renovation, in house design, home plans house, home house plans, house home plans, house plans home, remodeling, house plans and designs, designs house plans, house designs plans, house plans designs, home plans and designs, home designs plans, floor plans, house build, renovations, plans for building, kitchen cabinets, remodel, kitchen design, house plans for building, house plans building, ,General Contractors, Residential General Contractor, Building Contractor, Additions, Remodeling Contractor,  Renovation, Builder, building construction, renovation, remodeling, construction builders, construction company, construction companies, home repair, construction jobs, home remodeling, general contractors, contractors general, contractor general, contractors construction, construction contractors, home improvement and remodeling, kitchen remodeling, construction contractor, builders contractors, home renovation, general contracting, building contractors, building companies, home renovations, builder contractor, building contractor, remodeling contractor, commercial construction, residential construction, house contractor, concrete contractors, home contractors, general construction, construction general, contractors remodeling, remodeling contractors, remodelers, remodel contractor, remodel contractors, general contract, commercial contractors, renovations contractors, home improvement contractor, licensed contractor, license general contractor, mud room, mudroom, caulking, ,",0,2009-03-09T09:56:30.000-04:00,lyonshomeimprovements,FALSE,0,0,317,10,FALSE,d59e71a6790ef0e01e5e3225f31cd312e9934c80,FALSE,2016-01-04T16:36:01.000-05:00,TRUE,TRUE,1787756,84.5733253006,378,NA,NA
