Link,n_hits,all_links,category,id,url,hs_path,profile,permalink,created_at,sic_code,service_area,hours,products,services,brands,specialities,established,employee_cnt,payment_method,diplomas,licenses,memberships,liability_insurance,bonded,project_rate,project_minimum,written_contract,written_warranty,warranty_terms,parent_company_id,name,total_number_of_reviews_cache,total_number_of_approved_reviews_cache,number_of_photos_cache,avg_rating_cache,categories_info_cache,savings_count,claimed_at,subdomain,fraudulent,fraudulent_count,total_number_of_pending_reviews_cache,images_count,completion_percent_cache,bully,secret,replied_to_at_least_one_review_cache,latest_approved_review_created_at,has_set_tasks,lead_purchase_eligible,service_area_id,star_score,quote_button_category,direct_phone,direct_contact
https://homestars.com/on/cheltenham/cabinetry-millwork,10,https://homestars.com/on/cheltenham/cabinetry-millwork,Cabinetry & Millwork,2962158,https://newageproducts.com/,/companies/2962158-newage-products?searched_category_id=322&service_area=2268530,"Plan. Design. Install.

We offer a wide assortment of premium products and services within your Garage, Home, and Outdoor Living Spaces. Get your home reno project off the ground quicker, with a FREE CONSULTATION from one of our award-winning design experts.

NewAge Products is a Home Improvement Industry Disruptor and thought-leader. Founded in 2008, we’ve designed and manufactured hundreds of innovative, modular systems for customers throughout North America while maintaining retail partnerships with Costco, Home Depot, Amazon, and Lowes.",newage-products,2021-12-01T13:37:36.000-05:00,NA,NA,NA,"Garage Cabinets, Shelving and Racking, Outdoor Kitchen, Outdoor Appliances, Outdoor Furniture, Flooring","Free Virtual Design Consultation, Installation, Measurement Services",,"Garage Organization and Design, Outdoor Organization and Design",2008,400,Credit Card,,,,TRUE,FALSE,,,FALSE,FALSE,,2024117,NewAge Products,121,97,151,9.76289,"Garage Design & Organization, shed design, shed organization, garage renovation, garage, car garage, storage systems, starage sheds, storage cabinets, cabinets & storage, storage cabinet, storage system, shop door, storage solutions, garage floor, shed plans, garage and storage, storage for garage, garage storage, storage in garage, garage plans, storage for the home, garage kits, cabinets garage, cabinets for the garage, garage cabinets, metal cabinets, metal cabinet, new garage, new barn, ,Cabinetry & Millwork, Kitchen Cabinetry, Custom Cabinetry, Bathroom Cabinetry, Architectural Millwork, Millwork, custom millwork, bathroom cabinets, Kitchen cabinets, built-in cabinets, built-in cabinetry,  cabinet makers, custom cabinets kitchen, cabinetry, thomasville kitchen cabinets, cabinet doors, millwork cabinetry, custom kitchen cabinets, kraftmaid cabinets, maple cabinets, wood cabinets, stock cabinets, thermofoil cabinets, laminate cabinets, kitchen cabinets design, cherry cabinets, kitchen cabinet designs, hickory cabinets, wholesale cabinets, custom made cabinets, cabinet millwork, cabinets kitchen, kitchen cabinetry, millwork cabinets, ready to assemble cabinets, quality cabinets, bamboo cabinets, caulking,
,Kitchen Planning & Renovation, Kitchen Planning And Design, Kitchen Cabinet Planning, Kitchen Design, Kitchen Remodeling, kitchen or, and bathroom, a and a kitchens, kitchens and, for kitchens, a kitchens, kitchens, the house design, cabinets for kitchen, cabinets for the kitchen, cabinets and kitchen, kitchen cabinets, design a kitchen, about kitchen design, a kitchen design, how to kitchen design, design and kitchen, the kitchen design, design for kitchen, kitchen designs, renovation and remodeling, remodeling and renovation, kitchen designer,,Kitchen Renovation, caulking, ,Floor Retailers, Flooring, Hardwood Floors, Wood Floors, Floor & Tile Stores, laminate, and tile, carpet and, flooring flooring, the flooring, a flooring, floors floors floors, the floors, floors on floors, a floors, floor flooring, flooring floor, flooring and tiles, floor and wood, wood flooring, wood and flooring, wood floors, hardwood flooring, hardwood floors, flooring and tile, tile and flooring, tile flooring, tiles floors, floors and tiles, tile and floor, floor and tile, linoleum, laminate flooring, flooring and laminate, laminate flooring, laminate floor, wooden floors, wooden flooring, laminate floors, laminated flooring, vinyl flooring, tiles and floors, tile floors, carpet and tile, floor covering, carpets and tiles, slate, ceramic, concrete, herringbone,",0,2021-12-01T13:38:43.000-05:00,,FALSE,0,1,175,0,FALSE,2ac1c8a94cf80b4d46cd022ce7a0676b2d5832b2,TRUE,2022-07-25T10:26:43.000-04:00,TRUE,TRUE,2268530,95.8906619749,322,NA,NA
https://homestars.com/on/cheltenham/cabinetry-millwork,10,https://homestars.com/on/cheltenham/cabinetry-millwork,Cabinetry & Millwork,198439,http://www.bramptonkitchen.com,/companies/198439-brampton-kitchen-and-cabinets-ltd?searched_category_id=322&service_area=1804991,"From the year 1989 Brampton Kitchen & Cabinets Ltd. has been designing and manufacturing Custom Cabinetry, with Custom Kitchens being its flagship service. Brampton Kitchen follows a set of ethical values and professional procedures. We operate with the highest level of integrity and rigidly adhere to the policy of customer service, accountability and skill. We are a credible organization that stands behind its product. 
Extensive experience of several years and expertise of best artisans and craftsmen, we create designs that stand out. Be it your Kitchen, Bathroom, Vanity, Entertainment Unit, Bar or Walk-in Closet we have the skills to meet your every need. Our thorough knowledge of our trade is our biggest asset. We learn about your lifestyle while working alongside with you, so as to tailor your kitchen or cabinetry according to your specifications. From Planning to Designing to Manufacturing, we make sure you love every step along the way. We educate you about the industry, current trends and styles so that you make an informed decision.  We can turn your dream into reality without having to compromise on budget or quality.
",brampton-kitchen-and-cabinets-ltd,2008-01-23T10:23:40.000-05:00,NA,"Southern Ontario - Brampton, Toronto, Mississauga, Oakville, Caledon, Burlington, Vaughan, Malton, Niagara, GTA, Milton, Scarborough, Woodbridge, Richmond Hill, Orangeville, Markham, Georgetown, London, Barrie, Kingston, Kitchener, Ajax and suburbs of Toronto","Mon to Fri : 8 AM - 6 PM, Sat : 8 AM - 4 PM, Sunday - By appointment Only","All Custom Cabinetry - Custom Kitchens, Custom Bathroom Vanities, Bars, Entertainment Units, Walk-in Closets, Offices, Counter-tops. Kitchen Doors, Kitchen Cabinets, Bathroom Cabinets, Wall Units, TV units, Custom bars, Custom built-ins, custom bars, custom cabinetry, custom entertainment units, custom walk in closets, custom vanities, Custom bathroom cabinets, Custom kitchen","Kitchen / Bathroom / Offices / Entertainment Units / Closets / Bars- Manufacturing, Planning and Designing. Cabinet Installation, Servicing, Refacing of Cabinetry, Kitchen Renovation, Kitchen styles, Kitchen Manufacturing, Kitchen Designing, Bathroom Designing, Kitchen planning, kitchen redesigning, kitchen cabinetry design, counter-top installation, cabinet removal, post installation services, Kitchen designer available, custom kitchen designing, customized manufacturing, customized kitchen styles
","Richelieu, Blum, Caesarstone, Diamastone, Brampton Kitchen and Cabinets, Silestone","Over 25 years of experience, Kitchens manufactured in our own 25,000 sq.ft. facility, In-house designers, ",1989,25,"All major credit cards accepted, Debit cards, Cheques",,,"C.K.C.A, B.B.B.",TRUE,FALSE,,,TRUE,FALSE,,54939,Brampton Kitchen & Cabinets Ltd,213,153,47,9.11111,"Countertops, Granite Counter Tops, Kitchen Counter Tops, Marble Counter Tops, Laminate Counter Top, Quartz Counter Top, Corian counter top, tile counter top, silestone counter tops, arborite counter tops, custom counter tops, kitchen, remodeling, kitchen cabinet, kitchen design, ,Bathroom & Kitchen - Fixtures & Accessories, bathroom fixtures, kitchen fixtures, kitchen accessories, bathroom accessories, sink, faucet, tub, bathtub, shower, taps, kitchen reno, grouting, cabinet refinishing, custom cabinets, appliances, new appliances, kitchen island, waterfall island,,Cabinetry & Millwork, Kitchen Cabinetry, Custom Cabinetry, Bathroom Cabinetry, Architectural Millwork, Millwork, custom millwork, bathroom cabinets, Kitchen cabinets, built-in cabinets, built-in cabinetry,  cabinet makers, custom cabinets kitchen, cabinetry, thomasville kitchen cabinets, cabinet doors, millwork cabinetry, custom kitchen cabinets, kraftmaid cabinets, maple cabinets, wood cabinets, stock cabinets, thermofoil cabinets, laminate cabinets, kitchen cabinets design, cherry cabinets, kitchen cabinet designs, hickory cabinets, wholesale cabinets, custom made cabinets, cabinet millwork, cabinets kitchen, kitchen cabinetry, millwork cabinets, ready to assemble cabinets, quality cabinets, bamboo cabinets, caulking,
,Kitchen & Bathroom - Cabinets & Design, Kitchen Cabinet And Counter, Kitchen Cabinet Hardware, Bathroom Cabinet, Bathroom Wall Cabinet, Bathroom Sink Cabinet, cabinets, kitchens, cabinetry, kitchen and cabinets, cabinets for kitchen, about kitchen cabinets, kitchen cabinets, kitchen cabinets in, cabinets for the kitchen, cabinets and kitchen, cabinets kitchen, kitchen cabinet, cabinet kitchen, the kitchen cabinet, kitchen by design, design kitchen, a kitchen design, design a kitchen, design for kitchen, design and kitchen, design by kitchen, kitchen design, cabinetry kitchen, kitchen cabinetry, designs kitchen, kitchen designs, bathroom vanities, vanity and bathroom, bath and vanity, designer kitchen, ,Kitchen Planning & Renovation, Kitchen Planning And Design, Kitchen Cabinet Planning, Kitchen Design, Kitchen Remodeling, kitchen or, and bathroom, a and a kitchens, kitchens and, for kitchens, a kitchens, kitchens, the house design, cabinets for kitchen, cabinets for the kitchen, cabinets and kitchen, kitchen cabinets, design a kitchen, about kitchen design, a kitchen design, how to kitchen design, design and kitchen, the kitchen design, design for kitchen, kitchen designs, renovation and remodeling, remodeling and renovation, kitchen designer,,Kitchen Renovation, caulking, ,",0,2014-02-18T17:10:21.000-05:00,bramptonkitchens,FALSE,0,0,65,NA,FALSE,4f3a0f3d10af718f751def185f95430deb56e60d,TRUE,2019-06-27T12:57:23.000-04:00,TRUE,TRUE,1804991,87.3674208547,322,NA,NA
https://homestars.com/on/cheltenham/cabinetry-millwork,10,https://homestars.com/on/cheltenham/cabinetry-millwork,Cabinetry & Millwork,2975061,https://www.rekbuilddesign.com/,/companies/2975061-rek-build-design?searched_category_id=322&service_area=2297619,,rek-build-design,2022-10-28T13:07:37.000-04:00,NA,NA,NA,,,,,NA,NA,,,,,FALSE,FALSE,,,FALSE,FALSE,,2036959,Rek Build&Design,4,4,44,10,"Cabinetry & Millwork, Kitchen Cabinetry, Custom Cabinetry, Bathroom Cabinetry, Architectural Millwork, Millwork, custom millwork, bathroom cabinets, Kitchen cabinets, built-in cabinets, built-in cabinetry,  cabinet makers, custom cabinets kitchen, cabinetry, thomasville kitchen cabinets, cabinet doors, millwork cabinetry, custom kitchen cabinets, kraftmaid cabinets, maple cabinets, wood cabinets, stock cabinets, thermofoil cabinets, laminate cabinets, kitchen cabinets design, cherry cabinets, kitchen cabinet designs, hickory cabinets, wholesale cabinets, custom made cabinets, cabinet millwork, cabinets kitchen, kitchen cabinetry, millwork cabinets, ready to assemble cabinets, quality cabinets, bamboo cabinets, caulking,
,",0,2022-10-28T13:07:46.000-04:00,rekbuild,FALSE,0,0,48,0,FALSE,af7159393abcd327ca0de09260d099101519d0b8,TRUE,NA,TRUE,TRUE,2297619,90.8986848442,322,NA,NA
https://homestars.com/on/cheltenham/cabinetry-millwork,10,https://homestars.com/on/cheltenham/cabinetry-millwork,Cabinetry & Millwork,2959200,https://www.kowalskikonstruction.ca,/companies/2959200-kowalski-konstruction?searched_category_id=322&service_area=2260054,,kowalski-konstruction,2021-08-27T15:01:33.000-04:00,NA,NA,NA,,"✕ General Contractor
✕ Renovations | House Additions | Garages | Installations | Residential | Commercial",,,2017,NA,"Cash, Check, E-Transfer",,,,TRUE,FALSE,,,TRUE,FALSE,,2021177,Kowalski Konstruction,7,7,16,10,"Basement Renovation, Basement renovation, Basement remodeling, Basement remodelling, renovating your basement, renovation, waterproofing, remodeling, home renovation, house renovation, water in basement, basement waterproofing,finishing basement, moistureproof, remodeling the house, caulking,Carpenters, carpenter, finish carpenter, local carpenter, carpenter work, carpenter companies, master carpenter, carpenters and joiners, carpentry, union carpenter, carpenter co, carpenter services, carpenter construction, interior framing, mud room, mudroom, playsets, playground, wooden playset, wooden playground, play set, caulking,,General Contractors, Residential General Contractor, Building Contractor, Additions, Remodeling Contractor,  Renovation, Builder, building construction, renovation, remodeling, construction builders, construction company, construction companies, home repair, construction jobs, home remodeling, general contractors, contractors general, contractor general, contractors construction, construction contractors, home improvement and remodeling, kitchen remodeling, construction contractor, builders contractors, home renovation, general contracting, building contractors, building companies, home renovations, builder contractor, building contractor, remodeling contractor, commercial construction, residential construction, house contractor, concrete contractors, home contractors, general construction, construction general, contractors remodeling, remodeling contractors, remodelers, remodel contractor, remodel contractors, general contract, commercial contractors, renovations contractors, home improvement contractor, licensed contractor, license general contractor, mud room, mudroom, caulking, ,Cabinetry & Millwork, Kitchen Cabinetry, Custom Cabinetry, Bathroom Cabinetry, Architectural Millwork, Millwork, custom millwork, bathroom cabinets, Kitchen cabinets, built-in cabinets, built-in cabinetry,  cabinet makers, custom cabinets kitchen, cabinetry, thomasville kitchen cabinets, cabinet doors, millwork cabinetry, custom kitchen cabinets, kraftmaid cabinets, maple cabinets, wood cabinets, stock cabinets, thermofoil cabinets, laminate cabinets, kitchen cabinets design, cherry cabinets, kitchen cabinet designs, hickory cabinets, wholesale cabinets, custom made cabinets, cabinet millwork, cabinets kitchen, kitchen cabinetry, millwork cabinets, ready to assemble cabinets, quality cabinets, bamboo cabinets, caulking,
,",0,2021-08-27T15:03:29.000-04:00,KowalskiKonstruction,FALSE,0,0,6,0,FALSE,d380be95a79e2ad5ebfef05119605a165826a53e,TRUE,2022-10-12T13:57:38.000-04:00,TRUE,TRUE,2260054,90.7713571028,322,NA,NA
https://homestars.com/on/cheltenham/cabinetry-millwork,10,https://homestars.com/on/cheltenham/cabinetry-millwork,Cabinetry & Millwork,2907615,http://wildwoodkitchens.ca,/companies/2907615-wildwood-kitchens?searched_category_id=322&service_area=2296252,"We are specialized in the production of fine kitchen cabinets, custom shelving, and high-end closet storage solutions . We are confident in the products we make, as well as the services we provide, on every project will suit your vision.

20 years of experience
Our 20 years of experience led to remodeling any kitchen, wall unit, home office, or walk-in closet style you like

Whether meeting with you and your family or collaborating with architects, contractors, and interior decorators, we’re here to help you define your scope of work and articulate a vision that’s uniquely yours.


The experienced design team will turn your vision into a reality detailed plan, creating custom solutions that blend form a function to fit all your family’s needs.

Build
Our designs of combining the old and the new world approach to the top of craftsmanship and that mean you can have the best rich design from both worlds for kitchens or bathrooms. We make every piece of cabinetry in our shop in Toronto, Proudly 100% Canadian-made. To this regard, we offer a warranty against defects in materials and/or workmanship for a period of two years under average residential usage.  

Our Values
We believe in building durable and functional cabinetry that will make things easy to store, easy to find, and easy to clean. By choosing to work with us you will get the real value for your investment and your cabinets will look as good up close as they do from a distance.",wildwood-kitchens,2018-01-19T17:03:35.000-05:00,NA,NA,NA,,,,,2016,NA,"Cash, Cheque & E-transfer",Woodworking,,,FALSE,FALSE,,,FALSE,FALSE,2 years,1969800,Wildwood Kitchens,5,5,47,10,"Cabinetry & Millwork, Kitchen Cabinetry, Custom Cabinetry, Bathroom Cabinetry, Architectural Millwork, Millwork, custom millwork, bathroom cabinets, Kitchen cabinets, built-in cabinets, built-in cabinetry,  cabinet makers, custom cabinets kitchen, cabinetry, thomasville kitchen cabinets, cabinet doors, millwork cabinetry, custom kitchen cabinets, kraftmaid cabinets, maple cabinets, wood cabinets, stock cabinets, thermofoil cabinets, laminate cabinets, kitchen cabinets design, cherry cabinets, kitchen cabinet designs, hickory cabinets, wholesale cabinets, custom made cabinets, cabinet millwork, cabinets kitchen, kitchen cabinetry, millwork cabinets, ready to assemble cabinets, quality cabinets, bamboo cabinets, caulking,
,Kitchen & Bathroom - Cabinets & Design, Kitchen Cabinet And Counter, Kitchen Cabinet Hardware, Bathroom Cabinet, Bathroom Wall Cabinet, Bathroom Sink Cabinet, cabinets, kitchens, cabinetry, kitchen and cabinets, cabinets for kitchen, about kitchen cabinets, kitchen cabinets, kitchen cabinets in, cabinets for the kitchen, cabinets and kitchen, cabinets kitchen, kitchen cabinet, cabinet kitchen, the kitchen cabinet, kitchen by design, design kitchen, a kitchen design, design a kitchen, design for kitchen, design and kitchen, design by kitchen, kitchen design, cabinetry kitchen, kitchen cabinetry, designs kitchen, kitchen designs, bathroom vanities, vanity and bathroom, bath and vanity, designer kitchen, ,Kitchen Planning & Renovation, Kitchen Planning And Design, Kitchen Cabinet Planning, Kitchen Design, Kitchen Remodeling, kitchen or, and bathroom, a and a kitchens, kitchens and, for kitchens, a kitchens, kitchens, the house design, cabinets for kitchen, cabinets for the kitchen, cabinets and kitchen, kitchen cabinets, design a kitchen, about kitchen design, a kitchen design, how to kitchen design, design and kitchen, the kitchen design, design for kitchen, kitchen designs, renovation and remodeling, remodeling and renovation, kitchen designer,,Kitchen Renovation, caulking, ,Carpenters, carpenter, finish carpenter, local carpenter, carpenter work, carpenter companies, master carpenter, carpenters and joiners, carpentry, union carpenter, carpenter co, carpenter services, carpenter construction, interior framing, mud room, mudroom, playsets, playground, wooden playset, wooden playground, play set, caulking,,Closet & Storage Solutions, Closets, Closet, Storage, Closet Organizer, Closet And Room Organizer, Storage Cabinet, Storage Container, Interior closet shelves, custom fitted interior closets, custom closets, interior closet organizer, shelving, built-in shelving, built-in shelves, storage, the container, the closet, a closet, closet and, closet closet, closet to closet, closet, shelves, wardrobe, the closets, shelving, wardrobes, pantry, storage boxes, container store, storage containers, storage and containers, shoe rack, storage bins, storage systems, shoe racks, storage cabinets, storage cabinet, food storage, wall shelves, solutions storage, storage solutions, clothes rack, closet and organizer, the closet organizer, organizer for closet, closet organizer, closet organizers, organizers closet, wardrobe closet, Custom Shelves, ,",0,2018-01-19T17:04:22.000-05:00,,FALSE,0,0,48,0,FALSE,ac63e38a765ce26c609b851e859eb132655c6bdf,TRUE,NA,TRUE,TRUE,2296252,87.8980121983,322,NA,NA
https://homestars.com/on/cheltenham/cabinetry-millwork,10,https://homestars.com/on/cheltenham/cabinetry-millwork,Cabinetry & Millwork,2924697,http://aerokitchen.ca/,/companies/2924697-aero-kitchen-cabinets?searched_category_id=322&service_area=2241920,"AERO KITCHEN CABINETS Serving the GTA area for more than 18 years with quality cabinetry and accessories to countless clients. We realize that you may need a little help for planning your kitchen space and our team will be happy to cast an eye on your plan and offer advice. Weather you are looking for a wooden kitchen for a contemporary or traditional setting, the flexibility of our range allows you to design your solid wood kitchen around the way you like .

https://www.instagram.com/aerokitchen/",aero-kitchen-cabinets,2018-11-28T09:54:00.000-05:00,NA,NA,NA,,,,,NA,NA,,,,,FALSE,FALSE,,,FALSE,FALSE,,1986871,Aero Kitchen Cabinets,25,19,45,10,"Kitchen & Bathroom - Cabinets & Design, Kitchen Cabinet And Counter, Kitchen Cabinet Hardware, Bathroom Cabinet, Bathroom Wall Cabinet, Bathroom Sink Cabinet, cabinets, kitchens, cabinetry, kitchen and cabinets, cabinets for kitchen, about kitchen cabinets, kitchen cabinets, kitchen cabinets in, cabinets for the kitchen, cabinets and kitchen, cabinets kitchen, kitchen cabinet, cabinet kitchen, the kitchen cabinet, kitchen by design, design kitchen, a kitchen design, design a kitchen, design for kitchen, design and kitchen, design by kitchen, kitchen design, cabinetry kitchen, kitchen cabinetry, designs kitchen, kitchen designs, bathroom vanities, vanity and bathroom, bath and vanity, designer kitchen, ,Cabinetry & Millwork, Kitchen Cabinetry, Custom Cabinetry, Bathroom Cabinetry, Architectural Millwork, Millwork, custom millwork, bathroom cabinets, Kitchen cabinets, built-in cabinets, built-in cabinetry,  cabinet makers, custom cabinets kitchen, cabinetry, thomasville kitchen cabinets, cabinet doors, millwork cabinetry, custom kitchen cabinets, kraftmaid cabinets, maple cabinets, wood cabinets, stock cabinets, thermofoil cabinets, laminate cabinets, kitchen cabinets design, cherry cabinets, kitchen cabinet designs, hickory cabinets, wholesale cabinets, custom made cabinets, cabinet millwork, cabinets kitchen, kitchen cabinetry, millwork cabinets, ready to assemble cabinets, quality cabinets, bamboo cabinets, caulking,
,",0,2018-11-28T09:56:05.000-05:00,AeroKitchen,FALSE,0,0,58,0,FALSE,5788b53f75ac86eb321231a64693960fc13cfb37,TRUE,2021-06-06T15:42:51.000-04:00,TRUE,TRUE,2241920,97.3739237386,322,NA,NA
https://homestars.com/on/cheltenham/cabinetry-millwork,10,https://homestars.com/on/cheltenham/cabinetry-millwork,Cabinetry & Millwork,2857250,http://marcianokitchens.com/,/companies/2857250-marciano-kitchens?searched_category_id=322&service_area=1984360,"We, at MARCIANO KITCHENS, have been producing the finest kitchen furnishing on the market.

Since the first days We began building a reputation for creating Extraordinary Kitchen Environments. Through the years we have assembled a remarkable team of designers, cabinet specialists, craftsmen, and finishers who together have made the company one of the industry’s leading manufacturers. Marciano Kitchens dedicate themselves to the highest standards of quality, service, style and function continues with a focus on providing cabinetry solutions for the entire home.

We are social:

Instagram: https://www.instagram.com/marcianokitchens/",marciano-kitchens,2014-08-01T19:08:25.000-04:00,NA,NA,NA,,,,,2008,NA,"E-transfer, Cash, Cheque ",,,,TRUE,FALSE,,No job is too small or big,TRUE,FALSE,"Yes, kindly ask for details",1919680,Marciano Kitchens,36,25,1,8.08,"Kitchen Planning & Renovation, Kitchen Planning And Design, Kitchen Cabinet Planning, Kitchen Design, Kitchen Remodeling, kitchen or, and bathroom, a and a kitchens, kitchens and, for kitchens, a kitchens, kitchens, the house design, cabinets for kitchen, cabinets for the kitchen, cabinets and kitchen, kitchen cabinets, design a kitchen, about kitchen design, a kitchen design, how to kitchen design, design and kitchen, the kitchen design, design for kitchen, kitchen designs, renovation and remodeling, remodeling and renovation, kitchen designer,,Kitchen Renovation, caulking, ,Cabinetry & Millwork, Kitchen Cabinetry, Custom Cabinetry, Bathroom Cabinetry, Architectural Millwork, Millwork, custom millwork, bathroom cabinets, Kitchen cabinets, built-in cabinets, built-in cabinetry,  cabinet makers, custom cabinets kitchen, cabinetry, thomasville kitchen cabinets, cabinet doors, millwork cabinetry, custom kitchen cabinets, kraftmaid cabinets, maple cabinets, wood cabinets, stock cabinets, thermofoil cabinets, laminate cabinets, kitchen cabinets design, cherry cabinets, kitchen cabinet designs, hickory cabinets, wholesale cabinets, custom made cabinets, cabinet millwork, cabinets kitchen, kitchen cabinetry, millwork cabinets, ready to assemble cabinets, quality cabinets, bamboo cabinets, caulking,
,",0,2017-01-31T23:10:18.000-05:00,,FALSE,0,0,2,0,FALSE,98ede0abc17d9dfd9768a092b57950885ae55497,TRUE,2016-11-11T17:59:35.000-05:00,TRUE,TRUE,1984360,84.767092345,322,NA,NA
