Link,n_hits,all_links,category,id,url,hs_path,profile,permalink,created_at,sic_code,service_area,hours,products,services,brands,specialities,established,employee_cnt,payment_method,diplomas,licenses,memberships,liability_insurance,bonded,project_rate,project_minimum,written_contract,written_warranty,warranty_terms,parent_company_id,name,total_number_of_reviews_cache,total_number_of_approved_reviews_cache,number_of_photos_cache,avg_rating_cache,categories_info_cache,savings_count,claimed_at,subdomain,fraudulent,fraudulent_count,total_number_of_pending_reviews_cache,images_count,completion_percent_cache,bully,secret,replied_to_at_least_one_review_cache,latest_approved_review_created_at,has_set_tasks,lead_purchase_eligible,service_area_id,star_score,quote_button_category,direct_phone,direct_contact
https://homestars.com/on/sandford/design-project-management,3,https://homestars.com/on/sandford/design-project-management,Design/Project Management,2721303,http://www.homeimprovementpeople.com,/companies/2721303-home-improvement-people?searched_category_id=456&service_area=2126386,"The Home Improvement People have completed literally thousands of renovations since our inception. We are a unique award winning contracting company, consulted by various media as industry experts. 
Please view our website at homeimprovementpeople.com to view images of some of our projects. 
For our clients' convenience, we've implemented progress billing as well as financing.
Regardless of scope, we approach every single home renovation with a foundation of strong design aesthetics, comprehensive product options, sound project management, and a commitment to craftsmanship.
 
Our projects range from remodelled bathrooms and kitchens, to rear additions,  hardwood flooring, basements, second story additions and other extensive renovations. We undertake work in all budget ranges.
 
Choosing a reputable contractor is the most important decision you will make regarding your renovation. From plans and permits, to last little finishing details, The Home Improvement People is committed to completing your renovations and home improvements in a professional manner and to your complete satisfaction.
We take pride in our personalized service and our high quality workmanship. 
Call us for quality, insured work - completed on time, and on budget.
416-782-7605.",home-improvement-people,2008-03-04T16:55:15.000-05:00,NA,"Ajax,Cobourg,Mississauga,Stouffville Aurora,Courtice,Newmarket,Thornhill Barrie,Etobicoke,North York,Toronto Bolton,Georgetown,Oakville,Vaughan Brampton,Hamilton,Paris,Whitby Brantford ,Kitchener,Pickering Burlington,Maple,Richmond Hill, Willowdale, Caledon, Markham Scarborough,Woodbridge Cambridge,Milton,North York ",,,,,,2002,80,Visa/MC/Cheque,,All ,,TRUE,TRUE,,,TRUE,FALSE,3 years,1784355,Home Improvement People Inc.,663,504,234,9.80357,"General Contractors, Residential General Contractor, Building Contractor, Additions, Remodeling Contractor,  Renovation, Builder, building construction, renovation, remodeling, construction builders, construction company, construction companies, home repair, construction jobs, home remodeling, general contractors, contractors general, contractor general, contractors construction, construction contractors, home improvement and remodeling, kitchen remodeling, construction contractor, builders contractors, home renovation, general contracting, building contractors, building companies, home renovations, builder contractor, building contractor, remodeling contractor, commercial construction, residential construction, house contractor, concrete contractors, home contractors, general construction, construction general, contractors remodeling, remodeling contractors, remodelers, remodel contractor, remodel contractors, general contract, commercial contractors, renovations contractors, home improvement contractor, licensed contractor, license general contractor, mud room, mudroom, caulking, ,Design/Build, Contracting, Renovation, Remodeling, Restoration, Project Management, Renovation Assistance, Reno Management, architect, architects, design build, build & design, design and build, build by design, design to build. building construction, building a house, house designs, house plans, home designs, house plan, how to design a house, design house, house design, remodeling, building and design, design for building, design building, building by design, a building design, design of building, building design, design a building, building & design,  playsets, playground, wooden playset, wooden playground, play set, ,Basement Renovation, Basement renovation, Basement remodeling, Basement remodelling, renovating your basement, renovation, waterproofing, remodeling, home renovation, house renovation, water in basement, basement waterproofing,finishing basement, moistureproof, remodeling the house, caulking,Kitchen & Bathroom - Cabinets & Design, Kitchen Cabinet And Counter, Kitchen Cabinet Hardware, Bathroom Cabinet, Bathroom Wall Cabinet, Bathroom Sink Cabinet, cabinets, kitchens, cabinetry, kitchen and cabinets, cabinets for kitchen, about kitchen cabinets, kitchen cabinets, kitchen cabinets in, cabinets for the kitchen, cabinets and kitchen, cabinets kitchen, kitchen cabinet, cabinet kitchen, the kitchen cabinet, kitchen by design, design kitchen, a kitchen design, design a kitchen, design for kitchen, design and kitchen, design by kitchen, kitchen design, cabinetry kitchen, kitchen cabinetry, designs kitchen, kitchen designs, bathroom vanities, vanity and bathroom, bath and vanity, designer kitchen, ,Kitchen Planning & Renovation, Kitchen Planning And Design, Kitchen Cabinet Planning, Kitchen Design, Kitchen Remodeling, kitchen or, and bathroom, a and a kitchens, kitchens and, for kitchens, a kitchens, kitchens, the house design, cabinets for kitchen, cabinets for the kitchen, cabinets and kitchen, kitchen cabinets, design a kitchen, about kitchen design, a kitchen design, how to kitchen design, design and kitchen, the kitchen design, design for kitchen, kitchen designs, renovation and remodeling, remodeling and renovation, kitchen designer,,Kitchen Renovation, caulking, ,Condominium Renovations, Condo, Apartment, remodeling, renovations, kitchen cabinet, home decor, condo apartments, home improvement, home improvements, remodeling home, home remodeling, remodeling a home, new condo, Condo facelift, 
I ,Condo RenovationsRenovations for a new condo that include removing a drywall and creating an island and a full kitchen remodeling. ,Small rodent in Attic,Bathroom Renovation, Bathroom renovation, bathroom remodeling, bathroom remodelling, renovating the bathroom, tearing out the bathroom, fixing up the bathroom, bathroom contractors, bathroom vanities, bathroom vanity, design of bathroom, bathroom and design, design for bathroom, design a bathroom, design a bath, bath design, bathroom tile, bathroom cabinets, remodeling a bathroom, bathroom remodeling, remodeling the bathroom, ,Bath renovation, New tub, caulking, ,Builders, Home Builders, Home Contractors, residential builders, home construction companies, residential building contractor, builder, construction builders, local home builders, custom home builders, master builders, general builders, new home builders, building contractors, custom home builders, luxury home builders, ,Cabinetry & Millwork, Kitchen Cabinetry, Custom Cabinetry, Bathroom Cabinetry, Architectural Millwork, Millwork, custom millwork, bathroom cabinets, Kitchen cabinets, built-in cabinets, built-in cabinetry,  cabinet makers, custom cabinets kitchen, cabinetry, thomasville kitchen cabinets, cabinet doors, millwork cabinetry, custom kitchen cabinets, kraftmaid cabinets, maple cabinets, wood cabinets, stock cabinets, thermofoil cabinets, laminate cabinets, kitchen cabinets design, cherry cabinets, kitchen cabinet designs, hickory cabinets, wholesale cabinets, custom made cabinets, cabinet millwork, cabinets kitchen, kitchen cabinetry, millwork cabinets, ready to assemble cabinets, quality cabinets, bamboo cabinets, caulking,
,Home Additions, General contractor, home improvement, building addition, home expansion, house expansion, house building, plans house, house plans from, plans for house, the house plans, house plans, renovation, in house design, home plans house, home house plans, house home plans, house plans home, remodeling, house plans and designs, designs house plans, house designs plans, house plans designs, home plans and designs, home designs plans, floor plans, house build, renovations, plans for building, kitchen cabinets, remodel, kitchen design, house plans for building, house plans building, ,Design/Project Management, Drafters, Drafting, Project Management, Building, General Contracting, Renovation Management, Project Manager, Design Management.,",0,2017-04-05T10:18:55.000-04:00,TheHIP,FALSE,0,0,279,100,FALSE,7fbc45f3170f9c9c4247a2eca79f1488f75c5fa0,TRUE,2022-09-09T20:23:14.000-04:00,TRUE,TRUE,2126386,96.3063198007,456,NA,NA
https://homestars.com/on/sandford/design-project-management,3,https://homestars.com/on/sandford/design-project-management,Design/Project Management,2772085,http://www.TorontoConstruction.com,/companies/2772085-tc-homes?searched_category_id=456&service_area=2283400,"Founded in 2009, TC Homes is a Luxury Custom Home Builder specializing in development amongst the most prominent areas within the Greater Toronto Area and the GTA.

TC Homes is proud to work with the highly experienced architects and designers of this industry.

TC Homes has two main purposes: to bring quality and safety to life and to exceed customers’ expectations by building every element to perfection.

TC Homes Contracting has provided diverse services for clients and architects throughout the GTA region for more than 20 years. As a full service contractor, we have the skills and experience to manage, build and support a wide variety of project types and client needs; we strive to provide excellent services …",tc-homes,2008-05-14T07:07:17.000-04:00,NA,"We serve all of GTA including, Toronto, Markham, NorthYork, Richmondhill, Mississauga, Scarborough, Vaughn, Brampton, Woodbidge, Whitby...
",24 hour Service,,"At any scale, TC Homes presents each client with superior service and attention throughout the project. 

Services include:

new construction 
renovation/tenant improvements 
project management 
construction management 
bobcat excavation
estimating and scheduling 
in-house services 
renovations 
From beginning to end, effective construction management is essential to any project. The Project Manager coordinates all aspects of the project and is the primary contact for all needs and concerns for the duration of the project. TC Homes has a commitment to the project and team and employs pre-construction value engineering, savings through negotiated projects, and project-specific construction strategy, while presenting and maintaining the construction schedule with expert project coordination.
The In-House Service Division provides TC Homes clients with continued service after construction is complete. This includes:

facilities management 
monthly or yearly inspections 
cost analysis for budgets 
hourly rates for in-house work 
third party negotiations for other services 
24-hour emergency service 
commercial painting 
exotic coatings 
occupied painting 
",,,2009,200,,,,,TRUE,FALSE,,,TRUE,FALSE,,1835137,TC Homes,15,9,242,10,"Builders, Home Builders, Home Contractors, residential builders, home construction companies, residential building contractor, builder, construction builders, local home builders, custom home builders, master builders, general builders, new home builders, building contractors, custom home builders, luxury home builders, ,Design/Build, Contracting, Renovation, Remodeling, Restoration, Project Management, Renovation Assistance, Reno Management, architect, architects, design build, build & design, design and build, build by design, design to build. building construction, building a house, house designs, house plans, home designs, house plan, how to design a house, design house, house design, remodeling, building and design, design for building, design building, building by design, a building design, design of building, building design, design a building, building & design,  playsets, playground, wooden playset, wooden playground, play set, ,Design/Project Management, Drafters, Drafting, Project Management, Building, General Contracting, Renovation Management, Project Manager, Design Management.,",0,2008-12-16T07:25:39.000-05:00,tchomes,FALSE,0,0,285,NA,FALSE,ad299a6c1c410130a8ef822581971090e14a196c,TRUE,2009-03-04T10:55:43.000-05:00,TRUE,TRUE,2283400,97.0773591052,456,NA,NA
https://homestars.com/on/sandford/design-project-management,3,https://homestars.com/on/sandford/design-project-management,Design/Project Management,2942219,NA,/companies/2942219-lcm-project-management-general-contracting?searched_category_id=456&service_area=2222147,NA,lcm-project-management-general-contracting,2020-04-03T16:18:21.000-04:00,NA,NA,NA,NA,NA,NA,NA,NA,NA,NA,NA,NA,NA,FALSE,FALSE,NA,NA,FALSE,FALSE,NA,2004393,LCM Project Management & General Contracting,0,0,0,NA,"Design/Project Management, Drafters, Drafting, Project Management, Building, General Contracting, Renovation Management, Project Manager, Design Management.,",0,2020-04-03T16:19:58.000-04:00,NA,FALSE,0,0,0,0,FALSE,b4dbe374cdbf98274e50757388e8345469a1adf1,FALSE,NA,FALSE,FALSE,2222147,-1.0,456,NA,NA
