Link,n_hits,all_links,category,id,url,hs_path,profile,permalink,created_at,sic_code,service_area,hours,products,services,brands,specialities,established,employee_cnt,payment_method,diplomas,licenses,memberships,liability_insurance,bonded,project_rate,project_minimum,written_contract,written_warranty,warranty_terms,parent_company_id,name,total_number_of_reviews_cache,total_number_of_approved_reviews_cache,number_of_photos_cache,avg_rating_cache,categories_info_cache,savings_count,claimed_at,subdomain,fraudulent,fraudulent_count,total_number_of_pending_reviews_cache,images_count,completion_percent_cache,bully,secret,replied_to_at_least_one_review_cache,latest_approved_review_created_at,has_set_tasks,lead_purchase_eligible,service_area_id,star_score,quote_button_category,direct_phone,direct_contact
https://homestars.com/on/bramalea/tile-stone-contractors,94,"c(""https://homestars.com/on/bramalea/tile-stone-contractors?&page=2&"", ""https://homestars.com/on/bramalea/tile-stone-contractors?&page=3&"", ""https://homestars.com/on/bramalea/tile-stone-contractors?&page=4&"", ""https://homestars.com/on/bramalea/tile-stone-contractors?&page=5&"", ""https://homestars.com/on/bramalea/tile-stone-contractors?&page=6&"", ""https://homestars.com/on/bramalea/tile-stone-contractors?&page=7&"", ""https://homestars.com/on/bramalea/tile-stone-contractors?&page=8&"", ""https://homestars.com/on/bramalea/tile-stone-contractors?&page=9&"", 
""https://homestars.com/on/bramalea/tile-stone-contractors?&page=10&"")",Tile & Stone Contractors,206925,http://foreverstonedesign.com,/companies/206925-forever-stone-design-inc?searched_category_id=442&service_area=1827879,"Forever Stone Design is dedicated to excellence.  We take pride in our work with over 25 years of experience in this field, client satisfaction is number one.  From designing a project to completing it, you can rest assured the client is always happy.  We specialize in all types of stone work ranging from natural stone walls, flagstone, interlock, steps, pillars, waterfalls, retaining walls.  If you can imagine it, we can create it.
 
 ",forever-stone-design-inc,2006-01-13T19:00:00.000-05:00,NA,"Brampton, Concord, Etobicoke, Markham, Mississauga, Newmarket, North York,  Richmond Hill, Scarborough, Thornhill, Toronto, Vaughan, Woodbridge<br/>

<br/>",,,Email us at: foreverstonedesign@gmail.com,,"All types of stonework (natural stone, flagstone and interlock)          ",NA,NA,"Cheque, E-Transfers",,,,TRUE,FALSE,,"over $10,000.00 to obtain a quote",TRUE,TRUE,,61777,Forever Stone Design Inc.,411,373,87,9.93499,"Interlocking Stone, Interlocking Tile, Stone, tiles for, landscaping, paving, pavers, paver, stone step, wall stone, stone wall, landscape design, patios, interlock, retaining wall, stepping stones, interlocking, landscaping ideas, retaining walls, paving stones, paver stones, pavers stones, pavers and stones, stones pavers, stones and pavers, flagstone, concrete design, landscapers, natural stone, paving stone, stone paving, stone paving stone, walls stone, patio designs, stone and tiles, tiles and stone, stone flagstones, slate tiles, slate tile, stone veneer, pavers stone, stone and pavers, stone pavers, paver stone, stone paver, concrete driveway, stone brick, stone and brick, brick and stone, stone flooring, stone patio, stone for patio,,Landscape Contractors & Designers, Landscape Contractor Designer, Landscape Design, Landscape Contractor, Landscapers, Landscaping, Landscape, Backyard, patio, Fountain, Ponds and Waterfalls, garden, gardens, landscape, how to landscape, landscaping and, landscape garden, garden landscape, gardening, landscape gardens, pavers, garden design, design a garden, design for garden, design garden, how to design garden, lawn maintenance, how to design landscape, design landscape, landscape and design, design and landscape, how to design a landscape, landscape design, design a landscape, patios, architects landscape, landscape architects, garden designs, lawn service, garden landscaping, landscaping garden, landscape lighting, garden designer, designer garden,,landscapemakeover of backyard and improve front yard
build fence, landscape, Landscaping, retaining wall, grading,Tile & Stone Contractors, Natural Stone Tile, Stone Floor Tile, Ceramic Tile, Floor tile, Tile installers, Stone installers, stone counter top installers, tile counter top installers, stone backsplash intallers, granite installers, marble installers, limestone installers, linoleum installers, slate contractors, slate installers,install tite ,backsplash , fire place veenerneed someone to install blacksplash , wall stone veener bath room mosaic,",0,2006-01-13T19:00:00.000-05:00,foreverstonedes,FALSE,0,0,110,100,FALSE,8aaffb40e032b22574b239366c463edd10394041,TRUE,2022-11-02T10:55:25.000-04:00,TRUE,TRUE,1827879,99.2063717191,442,NA,NA
https://homestars.com/on/bramalea/tile-stone-contractors,94,"c(""https://homestars.com/on/bramalea/tile-stone-contractors?&page=2&"", ""https://homestars.com/on/bramalea/tile-stone-contractors?&page=3&"", ""https://homestars.com/on/bramalea/tile-stone-contractors?&page=4&"", ""https://homestars.com/on/bramalea/tile-stone-contractors?&page=5&"", ""https://homestars.com/on/bramalea/tile-stone-contractors?&page=6&"", ""https://homestars.com/on/bramalea/tile-stone-contractors?&page=7&"", ""https://homestars.com/on/bramalea/tile-stone-contractors?&page=8&"", ""https://homestars.com/on/bramalea/tile-stone-contractors?&page=9&"", 
""https://homestars.com/on/bramalea/tile-stone-contractors?&page=10&"")",Tile & Stone Contractors,2773609,https://www.purpleproperties.ca/,/companies/2773609-purple-properties-inc-luxury-interiors-exteriors?searched_category_id=442&service_area=1891036,"If you want QUALITY, CREATIVITY, RELIABILITY, and an overall ENJOYABLE experience, Purple Properties is the company you're looking for! For nearly 24 years now we have grown to understand what is needed in our market space, now allowing us to service happy clients all over the GTA.  

We have enjoyed producing an impressive body of work, lead by the Vision of our clients. The results naturally happen based on our core principles of PASSION, EXCELLENCE, & COMMITMENT. Our work and knowledge base is extremely diverse. We love to use STONE, HORTICULTURE, WOOD, TILES,  PAINTS along with other materials that become our art, your property being the canvas. Whether your project is interior or exterior, we can help! We look forward to co-creating with you in your next project! 

Purple Properties is fully licensed, insured, and up to date with WSIB. Our insurance and license are valid in the GTA for Interior and exterior projects.

Process:

Call for free estimate: 416-899-1572

Please visit our website at: www.purpleproperties.ca


Service area Keywords: Landscaing, Renovations, Kitchens, Bathrooms, Additions, Gardens, Design, Decks, Permits
GTA Home Additions, GTA Renovations, Toronto Home Additions, Toronto Renovations, Toronto Kitchen Renovations, Oakville Kitchen Renovations, Burlington Kitchen Renovations, Mississauga Kitchen Renovations, Vaughan Kitchen Renovations, Toronto Bathroom Renovations, Oakville Bathroom Renovations, Burlington Bathroom Renovations, Mississauga Bathroom Renovations, Vaughan Bathroom Renovations, Oakville Landscaping, Burlington landscaping, Mississauga Landscaping, Toronto Landscaping, Toronto Landscaping Companies, Vaughan Landscaping,

Free consultation, recommended design and material options. (Cost for drawings if applicable.)

Written contract will be provided prior to commencement of work.

Our Services Include:
Any Interior and Exterior makeover we design & build, whether its a new kitchen, bathroom, basement, addition, cabinetry, Interlocking & natural stone, Trees and shrubs, flooring, painting, drywall, plumbing, electrical, concrete, asphalt, exposed aggregates, irrigation, carpentry, carpet installation, retaining walls, fences, waterfalls.  ",purple-properties-inc-luxury-interiors-exteriors,2008-12-15T07:00:31.000-05:00,NA,"GTA, Mississauga, Toronto",,,"Any Interior and Exterior makeover we design & build, whether its a new kitchen, bathroom, basement, addition, cabinetry, Interlocking & natural stone, Trees and shrubs, flooring, painting, drywall, plumbing, electrical, concrete, asphalt, exposed aggregates, irrigation, carpentry, carpet installation, retaining walls, fences, waterfalls.  ","Purple Properties,
SKYLIFE Developments","Custom Builds, home renovations, home additions",1997,20,"Credit, cheque",,"carpentry, plumbing, electrical, ",,TRUE,TRUE,,,TRUE,FALSE,2 year warranty on all workmanship,1836661,Purple Properties Inc. - Luxury Interiors & Exteriors,263,237,932,9.97468,"Bathroom Renovation, Bathroom renovation, bathroom remodeling, bathroom remodelling, renovating the bathroom, tearing out the bathroom, fixing up the bathroom, bathroom contractors, bathroom vanities, bathroom vanity, design of bathroom, bathroom and design, design for bathroom, design a bathroom, design a bath, bath design, bathroom tile, bathroom cabinets, remodeling a bathroom, bathroom remodeling, remodeling the bathroom, ,Bath renovation, New tub, caulking, ,Kitchen Planning & Renovation, Kitchen Planning And Design, Kitchen Cabinet Planning, Kitchen Design, Kitchen Remodeling, kitchen or, and bathroom, a and a kitchens, kitchens and, for kitchens, a kitchens, kitchens, the house design, cabinets for kitchen, cabinets for the kitchen, cabinets and kitchen, kitchen cabinets, design a kitchen, about kitchen design, a kitchen design, how to kitchen design, design and kitchen, the kitchen design, design for kitchen, kitchen designs, renovation and remodeling, remodeling and renovation, kitchen designer,,Kitchen Renovation, caulking, ,Condominium Renovations, Condo, Apartment, remodeling, renovations, kitchen cabinet, home decor, condo apartments, home improvement, home improvements, remodeling home, home remodeling, remodeling a home, new condo, Condo facelift, 
I ,Condo RenovationsRenovations for a new condo that include removing a drywall and creating an island and a full kitchen remodeling. ,Small rodent in Attic,General Contractors, Residential General Contractor, Building Contractor, Additions, Remodeling Contractor,  Renovation, Builder, building construction, renovation, remodeling, construction builders, construction company, construction companies, home repair, construction jobs, home remodeling, general contractors, contractors general, contractor general, contractors construction, construction contractors, home improvement and remodeling, kitchen remodeling, construction contractor, builders contractors, home renovation, general contracting, building contractors, building companies, home renovations, builder contractor, building contractor, remodeling contractor, commercial construction, residential construction, house contractor, concrete contractors, home contractors, general construction, construction general, contractors remodeling, remodeling contractors, remodelers, remodel contractor, remodel contractors, general contract, commercial contractors, renovations contractors, home improvement contractor, licensed contractor, license general contractor, mud room, mudroom, caulking, ,Tile & Stone Contractors, Natural Stone Tile, Stone Floor Tile, Ceramic Tile, Floor tile, Tile installers, Stone installers, stone counter top installers, tile counter top installers, stone backsplash intallers, granite installers, marble installers, limestone installers, linoleum installers, slate contractors, slate installers,install tite ,backsplash , fire place veenerneed someone to install blacksplash , wall stone veener bath room mosaic,",0,2013-09-19T10:46:00.000-04:00,PurpleProperties,FALSE,0,0,1000,NA,FALSE,c71ca3d277d3a61e70493113fbed9c33873ca7f7,TRUE,2022-08-07T20:21:02.000-04:00,TRUE,TRUE,1891036,99.3189502313,442,NA,NA
