Link,n_hits,all_links,category,id,url,hs_path,profile,permalink,created_at,sic_code,service_area,hours,products,services,brands,specialities,established,employee_cnt,payment_method,diplomas,licenses,memberships,liability_insurance,bonded,project_rate,project_minimum,written_contract,written_warranty,warranty_terms,parent_company_id,name,total_number_of_reviews_cache,total_number_of_approved_reviews_cache,number_of_photos_cache,avg_rating_cache,categories_info_cache,savings_count,subdomain,fraudulent,fraudulent_count,total_number_of_pending_reviews_cache,images_count,completion_percent_cache,bully,secret,replied_to_at_least_one_review_cache,latest_approved_review_created_at,has_set_tasks,lead_purchase_eligible,service_area_id,star_score,quote_button_category,direct_phone,direct_contact,claimed_at
https://homestars.com/on/georgina/sprinkler-systems,6,https://homestars.com/on/georgina/sprinkler-systems,Sprinkler Systems,2893489,https://sprinklercompany.ca/,/companies/2893489-the-sprinkler-company-inc?searched_category_id=436&service_area=2275884,"The Sprinkler Company Inc. specializes in the design, installation and maintenance of automatic lawn and garden watering systems, garden lighting systems for private and commercial property and full services on Landscaping Design. Sprinkler company also offers servicing of all types of existing irrigation systems, including system opening, closure, and repairs. 
***
We provide 5 YEARS WARRANTY FOR ALL OUR INSTALLATIONS.
***
More information on www.SprinklerCompany.ca
***
Please call us for FREE ESTIMATION.
***
Due to the situation with Covid-19, our company has become available online consultation, in some cases it is possible to conduct an online assessment of the planned installation.
The company continue to work officially. If you need help with seasonal Start-Up/Testing of the sprinkler system or any emergency service, we are ready to help you! All our technicians respect the social distance and have all the necessary equipment in the current situation regarding to COVID-19!",the-sprinkler-company-inc,2017-01-26T15:55:48.000-05:00,NA,NA,NA,"IRRIGATION SPRINKLERS,
LED LIGHTING,
SODDING, LANDSCAPING SERVICE",Irrigation/Lighting/Sod/Landscaping,"For Irrigation:""Hunter"" and ""Rain Bird"",
For LED lights: ""Kichler"",
For SOD: ""Kentucky bluegrass""","Irrigation, LED landscape lighting,Landscaping",2005,19,All,yes, $5000000 Commercial general liability,WSIB,TRUE,FALSE,,$90 SERVICE,TRUE,FALSE,5 YEAR,1955913,The Sprinkler Company Inc.,202,170,97,9.85294,"Sprinkler Systems, Fire Sprinkler, Lawn Sprinkler, Garden Sprinkler, underground sprinklers, underground irrigation, irrigation systems, automatic sprinkler systems, what is irrigation, irrigation, sprinkler, sprinklers, irrigation sprinkler, sprinkler irrigation, the irrigation system, irrigation system, irrigation sprinklers, irrigation systems,  systems irrigation, how to sprinkler system, the sprinkler system, what is a sprinkler system, sprinkler system, bird rain, water irrigation, sprinkler systems how to, watering system, ,Landscape Lighting, Outdoor lights, solar light, outdoor lighting for, lighting outdoor, outdoor lighting, outdoor lights, lights for outdoor, the outdoor lights, solar lights, outdoor light, solar lighting, led lighting, outdoor lamps, how to landscape lighting, landscape lighting how to, lighting landscape, landscape and lighting, outdoor lighting lamps, exterior lighting, lights landscape, landscape lights, solar lamps, outside lights, exterior lights, lighting stores, outside lighting, garden lights, outdoor lighting, landscape lamps, lighting garden, landscape lighting outdoor, outdoor landscape lighting, ,Lawn Maintenance, Lawn Care, Lawn Mowers, Lawn Maintenance Companies, grass cutters, grass cutting, shrub pruning, lawns, a lawns, landscaping, mowing, lawn mowers, mowing lawn, lawn mowing, mowing the lawns, mowing lawns, lawns mowing, yard and garden, maintenance lawn, lawns maintenance, lawncare, service lawn, lawn service, grass mowing, lawn treatment, green grass, lawn repair, grass lawn mowers, lawn & landscape, lawn landscape, a lawn and landscape, landscape and lawn, lawn and landscape, lawn services, yard landscape, lawn maintenance service, lawn service maintenance, landscaping a yard, yard landscaping, lawn maintenance services, maintenance company, grass cutting, maintenance business, lawn business, leaf clean up, fall leaves, hedges ,",0,sprinklercompany,FALSE,0,0,121,0,FALSE,5f8fccf0915651e1072cdab764bd7a76519b016c,TRUE,2022-06-20T14:21:06.000-04:00,TRUE,TRUE,2275884,97.6001012185,436,NA,NA,NA
https://homestars.com/on/georgina/sprinkler-systems,6,https://homestars.com/on/georgina/sprinkler-systems,Sprinkler Systems,2896686,https://www.gwarriors.ca/,/companies/2896686-green-warriors?searched_category_id=436&service_area=2144280,"Green Warriors is the Landscaping and Construction company covering all GTA.
Are tired of fighting with weeds and dandelions? Do you want to have a fresh and healthy lawn? Green Warriors is your solution!! 

Give us a call today to schedule your appointment. We look forward to hearing from you.",green-warriors,2017-05-02T17:31:55.000-04:00,NA,NA,NA,,"sodding, interlock, snow removal, property maintenance, irrigation, sprinkler systems, basement finishing, home renovation",,,NA,NA,"cash, cheque, credit card, e-transfer",,,,TRUE,FALSE,,,TRUE,FALSE,,1959110,Green Warriors,171,139,88,9.76978,"Landscape Contractors & Designers, Landscape Contractor Designer, Landscape Design, Landscape Contractor, Landscapers, Landscaping, Landscape, Backyard, patio, Fountain, Ponds and Waterfalls, garden, gardens, landscape, how to landscape, landscaping and, landscape garden, garden landscape, gardening, landscape gardens, pavers, garden design, design a garden, design for garden, design garden, how to design garden, lawn maintenance, how to design landscape, design landscape, landscape and design, design and landscape, how to design a landscape, landscape design, design a landscape, patios, architects landscape, landscape architects, garden designs, lawn service, garden landscaping, landscaping garden, landscape lighting, garden designer, designer garden,,landscapemakeover of backyard and improve front yard
build fence, landscape, Landscaping, retaining wall, grading,Landscape Lighting, Outdoor lights, solar light, outdoor lighting for, lighting outdoor, outdoor lighting, outdoor lights, lights for outdoor, the outdoor lights, solar lights, outdoor light, solar lighting, led lighting, outdoor lamps, how to landscape lighting, landscape lighting how to, lighting landscape, landscape and lighting, outdoor lighting lamps, exterior lighting, lights landscape, landscape lights, solar lamps, outside lights, exterior lights, lighting stores, outside lighting, garden lights, outdoor lighting, landscape lamps, lighting garden, landscape lighting outdoor, outdoor landscape lighting, ,Sprinkler Systems, Fire Sprinkler, Lawn Sprinkler, Garden Sprinkler, underground sprinklers, underground irrigation, irrigation systems, automatic sprinkler systems, what is irrigation, irrigation, sprinkler, sprinklers, irrigation sprinkler, sprinkler irrigation, the irrigation system, irrigation system, irrigation sprinklers, irrigation systems,  systems irrigation, how to sprinkler system, the sprinkler system, what is a sprinkler system, sprinkler system, bird rain, water irrigation, sprinkler systems how to, watering system, ,",0,,FALSE,0,0,89,0,FALSE,c43218e0ccc238545aab64bf2c298360a5b73491,TRUE,2022-09-28T16:15:32.000-04:00,TRUE,TRUE,2144280,94.6767044552,436,NA,NA,2017-05-02T17:32:07.000-04:00
https://homestars.com/on/georgina/sprinkler-systems,6,https://homestars.com/on/georgina/sprinkler-systems,Sprinkler Systems,2926482,https://www.lcsconstructioncompany.com,/companies/2926482-lcs-construction-company?searched_category_id=436&service_area=2186469,"At LCS Construction Company, we specialize in irrigation repairs and service at the residential and commercial level.  We respond to all service calls quickly and efficiently.  We have over 20 years experience in the irrigation and landscaping industry. 

LCS Construction Company is focused on providing a reliable and high-quality service.  Rest assured, we will do everything we can to meet your expectations. 

If you are in need of one of our services, please contact us via text or email for an immediate response.  We would be happy to schedule you in for an appointment and help you out! ",lcs-construction-company,2019-01-19T20:28:33.000-05:00,NA,NA,NA,,Irrigation and landscape lighting,"Rain Bird, Hunter, Lasco, and Hydro-Rain",Irrigation service and repair,2015,NA,e-transfer & cheque,,,,TRUE,FALSE,From $80,$2000,TRUE,FALSE,*Ask us about our 2 year parts and labour warranty,1988656,LCS Construction Company,17,15,19,9.93333,"Sprinkler Systems, Fire Sprinkler, Lawn Sprinkler, Garden Sprinkler, underground sprinklers, underground irrigation, irrigation systems, automatic sprinkler systems, what is irrigation, irrigation, sprinkler, sprinklers, irrigation sprinkler, sprinkler irrigation, the irrigation system, irrigation system, irrigation sprinklers, irrigation systems,  systems irrigation, how to sprinkler system, the sprinkler system, what is a sprinkler system, sprinkler system, bird rain, water irrigation, sprinkler systems how to, watering system, ,",0,NA,FALSE,0,0,20,0,FALSE,b1979d667ad7eda10589a63339ccc887ed86f652,TRUE,2019-07-28T18:35:35.000-04:00,TRUE,FALSE,2186469,86.9724932763,436,NA,NA,2019-01-19T20:29:06.000-05:00
https://homestars.com/on/georgina/sprinkler-systems,6,https://homestars.com/on/georgina/sprinkler-systems,Sprinkler Systems,2633183,NA,/companies/2633183-lawn-tech-ont?searched_category_id=436&service_area=1646387,NA,lawn-tech-ont,2008-03-04T16:55:15.000-05:00,NA,NA,NA,NA,NA,NA,NA,NA,NA,NA,NA,NA,NA,FALSE,FALSE,NA,NA,FALSE,FALSE,NA,1696235,Lawn Tech Ont,0,0,0,NA,"Sprinkler Systems, Fire Sprinkler, Lawn Sprinkler, Garden Sprinkler, underground sprinklers, underground irrigation, irrigation systems, automatic sprinkler systems, what is irrigation, irrigation, sprinkler, sprinklers, irrigation sprinkler, sprinkler irrigation, the irrigation system, irrigation system, irrigation sprinklers, irrigation systems,  systems irrigation, how to sprinkler system, the sprinkler system, what is a sprinkler system, sprinkler system, bird rain, water irrigation, sprinkler systems how to, watering system, ,",0,NA,FALSE,0,0,0,NA,FALSE,NA,FALSE,NA,FALSE,FALSE,1646387,-1.0,436,NA,NA,NA
https://homestars.com/on/georgina/sprinkler-systems,6,https://homestars.com/on/georgina/sprinkler-systems,Sprinkler Systems,2646595,NA,/companies/2646595-taylor-irrigation-inc?searched_category_id=436&service_area=1659799,NA,taylor-irrigation-inc,2008-03-04T16:55:15.000-05:00,NA,NA,NA,NA,NA,NA,NA,NA,NA,NA,NA,NA,NA,FALSE,FALSE,NA,NA,FALSE,FALSE,NA,1709647,Taylor Irrigation Inc,0,0,0,NA,"Sprinkler Systems, Fire Sprinkler, Lawn Sprinkler, Garden Sprinkler, underground sprinklers, underground irrigation, irrigation systems, automatic sprinkler systems, what is irrigation, irrigation, sprinkler, sprinklers, irrigation sprinkler, sprinkler irrigation, the irrigation system, irrigation system, irrigation sprinklers, irrigation systems,  systems irrigation, how to sprinkler system, the sprinkler system, what is a sprinkler system, sprinkler system, bird rain, water irrigation, sprinkler systems how to, watering system, ,",0,NA,FALSE,0,0,0,NA,FALSE,NA,FALSE,NA,FALSE,FALSE,1659799,0,436,NA,NA,NA
https://homestars.com/on/georgina/sprinkler-systems,6,https://homestars.com/on/georgina/sprinkler-systems,Sprinkler Systems,2651465,NA,/companies/2651465-forevergreen-lawn-sprinklers-and-property-maintenance?searched_category_id=436&service_area=1664669,NA,forevergreen-lawn-sprinklers-and-property-maintenance,2008-03-04T16:55:15.000-05:00,NA,NA,NA,NA,NA,NA,NA,NA,NA,NA,NA,NA,NA,FALSE,FALSE,NA,NA,FALSE,FALSE,NA,1714517,Forevergreen Lawn Sprinklers And Property Maintenance,0,0,0,NA,"Sprinkler Systems, Fire Sprinkler, Lawn Sprinkler, Garden Sprinkler, underground sprinklers, underground irrigation, irrigation systems, automatic sprinkler systems, what is irrigation, irrigation, sprinkler, sprinklers, irrigation sprinkler, sprinkler irrigation, the irrigation system, irrigation system, irrigation sprinklers, irrigation systems,  systems irrigation, how to sprinkler system, the sprinkler system, what is a sprinkler system, sprinkler system, bird rain, water irrigation, sprinkler systems how to, watering system, ,",0,NA,FALSE,0,0,0,NA,FALSE,NA,FALSE,NA,FALSE,FALSE,1664669,0,436,NA,NA,NA
