Link,n_hits,all_links,category,id,url,hs_path,profile,permalink,created_at,sic_code,service_area,hours,products,services,brands,specialities,established,employee_cnt,payment_method,diplomas,licenses,memberships,liability_insurance,bonded,project_rate,project_minimum,written_contract,written_warranty,warranty_terms,parent_company_id,name,total_number_of_reviews_cache,total_number_of_approved_reviews_cache,number_of_photos_cache,avg_rating_cache,categories_info_cache,savings_count,claimed_at,subdomain,fraudulent,fraudulent_count,total_number_of_pending_reviews_cache,images_count,completion_percent_cache,bully,secret,replied_to_at_least_one_review_cache,latest_approved_review_created_at,has_set_tasks,lead_purchase_eligible,service_area_id,star_score,quote_button_category,direct_phone,direct_contact
https://homestars.com/on/kemptville/interlocking-stone,1,https://homestars.com/on/kemptville/interlocking-stone,Interlocking Stone,2935581,https://www.droycontracting.com,/companies/2935581-d-roy-contracting-inc?searched_category_id=391&service_area=2207916,"D. Roy Contracting company is based out of Ottawa, Ontario.
We have been in business for over a decade. 
We are an energetic team of general contractors with the goal to help improve the look and feel of your home. 
Our mission is to provide the best quality work in a timely fashion with an affordable price to ensure an all-around great customer experience. 
All jobs include a limited warranty because we stand behind what we do. 
",d-roy-contracting-inc,2019-10-03T10:21:15.000-04:00,NA,NA,NA,,"Wood Flooring, Carpet Flooring, Tile Flooring, Tiling
Trim, Painting: High-Rise
Painting: Low-Rise, Door Installations, Fire Place Improvements, Dry Wall,
Bathroom,Kitchen, Landscaping, Interlock, Soil Aggregates, Sod Jobs, Gardens, Gravel, Retaining Walls, Gazebos, Pergola, Decks, Fences, Large Steps, Tree Pruning, Hedge Trimming, Roofing",,,2010,10,"Cash, Cheques, E-Transfer",,,Ottawa Construction Association,TRUE,FALSE,,,TRUE,FALSE,Limited Warranty on All Work,1997755,D. Roy Contracting Inc.,52,49,62,9.97959,"Landscape Contractors & Designers, Landscape Contractor Designer, Landscape Design, Landscape Contractor, Landscapers, Landscaping, Landscape, Backyard, patio, Fountain, Ponds and Waterfalls, garden, gardens, landscape, how to landscape, landscaping and, landscape garden, garden landscape, gardening, landscape gardens, pavers, garden design, design a garden, design for garden, design garden, how to design garden, lawn maintenance, how to design landscape, design landscape, landscape and design, design and landscape, how to design a landscape, landscape design, design a landscape, patios, architects landscape, landscape architects, garden designs, lawn service, garden landscaping, landscaping garden, landscape lighting, garden designer, designer garden,,landscapemakeover of backyard and improve front yard
build fence, landscape, Landscaping, retaining wall, grading,General Contractors, Residential General Contractor, Building Contractor, Additions, Remodeling Contractor,  Renovation, Builder, building construction, renovation, remodeling, construction builders, construction company, construction companies, home repair, construction jobs, home remodeling, general contractors, contractors general, contractor general, contractors construction, construction contractors, home improvement and remodeling, kitchen remodeling, construction contractor, builders contractors, home renovation, general contracting, building contractors, building companies, home renovations, builder contractor, building contractor, remodeling contractor, commercial construction, residential construction, house contractor, concrete contractors, home contractors, general construction, construction general, contractors remodeling, remodeling contractors, remodelers, remodel contractor, remodel contractors, general contract, commercial contractors, renovations contractors, home improvement contractor, licensed contractor, license general contractor, mud room, mudroom, caulking, ,Interlocking Stone, Interlocking Tile, Stone, tiles for, landscaping, paving, pavers, paver, stone step, wall stone, stone wall, landscape design, patios, interlock, retaining wall, stepping stones, interlocking, landscaping ideas, retaining walls, paving stones, paver stones, pavers stones, pavers and stones, stones pavers, stones and pavers, flagstone, concrete design, landscapers, natural stone, paving stone, stone paving, stone paving stone, walls stone, patio designs, stone and tiles, tiles and stone, stone flagstones, slate tiles, slate tile, stone veneer, pavers stone, stone and pavers, stone pavers, paver stone, stone paver, concrete driveway, stone brick, stone and brick, brick and stone, stone flooring, stone patio, stone for patio,,",0,2019-10-03T10:23:41.000-04:00,droy,FALSE,0,0,38,0,FALSE,59cb85ed1d83a6ced5c2155b8cb9b272c4d704e3,TRUE,2022-09-10T13:26:46.000-04:00,TRUE,TRUE,2207916,97.8940010944,391,NA,NA
