Link,n_hits,all_links,category,id,url,hs_path,profile,permalink,created_at,sic_code,service_area,hours,products,services,brands,specialities,established,employee_cnt,payment_method,diplomas,licenses,memberships,liability_insurance,bonded,project_rate,project_minimum,written_contract,written_warranty,warranty_terms,parent_company_id,name,total_number_of_reviews_cache,total_number_of_approved_reviews_cache,number_of_photos_cache,avg_rating_cache,categories_info_cache,savings_count,claimed_at,subdomain,fraudulent,fraudulent_count,total_number_of_pending_reviews_cache,images_count,bully,secret,replied_to_at_least_one_review_cache,latest_approved_review_created_at,has_set_tasks,lead_purchase_eligible,service_area_id,star_score,quote_button_category,direct_phone,direct_contact
https://homestars.com/on/nisku/drainage-contractors,1,https://homestars.com/on/nisku/drainage-contractors,Drainage Contractors,2775117,https://www.mrrooter.ca/edmonton/,/companies/2775117-mr-rooter-plumbing-of-edmonton?searched_category_id=342&service_area=2138722,"Mr Rooter Plumbing Edmonton strives to be the best plumbing company Edmonton has to offer! Our technicians are also drain repair specialists in the main drain, floor drain, & sewer drain services. Mr. Rooter Plumbing Edmonton provides 24/7 emergency Edmonton plumbing & drain cleaning service. Your plumbing and drain repairs are done right, the first time! Our local Edmonton plumbers will arrive on time, consult with you before starting anything, work rapidly and efficiently on the exact issues discussed while respecting you and your Edmonton home. For prompt quality workmanship and professional plumbers call Mr. Rooter Plumbing Edmonton at 780-429-3600 today!

Providing Fast Repairs & Maintenance in Sherwood Park & Beyond
 
Want a plumbing company that provides outstanding customer service paired with skilled results? Look no further than Mr. Rooter® Plumbing of Edmonton! We proudly serve residential and commercial customers throughout Sherwood Park and the surrounding areas, tackling everything from pipe leaks to new fixture installation. We are your top choice for professional plumbing services in Edmonton, so do not hesitate to call us around-the-clock for trusted service.
 
We deliver professional and knowledgeable service here at Mr. Rooter Plumbing. 
Reach out to (780) 429-3600 for an appointment.",mr-rooter-plumbing-of-edmonton,2009-04-20T07:16:14.000-04:00,NA,NA,,,,,,NA,NA,"Cash, Cheques, Interact, Visa, MasterCard",,Yes,,TRUE,FALSE,,,TRUE,FALSE,,1838169,Mr. Rooter Plumbing of Edmonton,288,230,10,9.06522,"Drain Services, blocked drain, clogged drain, overflowing drain, roots in drain, sewage back up into house, drain repair, drain, plumber, plumbers, drains, sewer, drainage, clogged, septic tank, drain and sewer, sewer drain, sewer and drain, plumbing supplies, plummer, rooter rooter, plumbing and heating, heating and plumbing, plumbing heating, drain pipe, cleaning drain, cleaning the drain, drain cleaning, plumber heating, septic systems, cleaning drains, drain cleaner, water drainage, drain pipes, clean drain, drain clean, drainage pipe, plumbing service, service plumbing, drain cleaners, plumbing company, plumbing services, services plumbing, french drain, drainage systems, drainage pipes, septic plumbing, shower drains, drain systems, sewer line, french drains, caulking,,Drainage Contractors, clogged drain, blocked drain, clogged drain, overflowing drain, roots in drain, sewage backup , drain repair, drain, the drains, drains, drainage, septic tank, sewer drain, drain pipe, stormwater, drain cleaning, culvert, cleaning drains, manhole covers, water drainage, drain pipes, culverts, drainage pipe, drainage system, drainage systems, drainage pipes, shower drains, drain systems, french drains, drain opener, drain clearing, blocked drain, drain blocked, drain repair, drains blocked, blocked drains, drainage basin, storm drain, caulking,,Plumbing, Plumber, Plumbers, Plumbing Contractor, Plumbing Repair, toilet repair, fixing toilet, fixing sink, broken faucet, faucet repair, tap repair, leaking toilet, leaking sink, leaking pipes, drain snaking, at plumbing, plumbing in, what is plumbing, a plumbing, the plumbing, plumbing and, how to plumbing, plumbing a, plumbing how to, an plumbing, a plumber, plumber, the plumber, plumber plumber, plumber in, how to plumber, plumbers in, the plumbers, plumbers, plumbing pipe, how to plumb, pipes and plumbing, plumbing pipes, pipes for plumbing, plummer, plumbing supplies, plumbing supply, plumbing heating, plumbing & heating, heating and plumbing, heating plumbing, plumbing and heating, pipe plumber, plumbing stores, plumbing suppliers, the plumbs centre, plumb centre, ,",0,2009-07-02T07:03:01.000-04:00,mrrooteredmonton,FALSE,0,1,9,FALSE,8eff1fc58cd3950e89874d3a34ceea4820ccd0a1,TRUE,2020-07-16T15:36:33.000-04:00,TRUE,TRUE,2138722,91.8421369077,342,NA,NA
