Link,n_hits,all_links,category,id,url,hs_path,profile,permalink,created_at,sic_code,service_area,hours,products,services,brands,specialities,established,employee_cnt,payment_method,diplomas,licenses,memberships,liability_insurance,bonded,project_rate,project_minimum,written_contract,written_warranty,warranty_terms,parent_company_id,name,total_number_of_reviews_cache,total_number_of_approved_reviews_cache,number_of_photos_cache,avg_rating_cache,categories_info_cache,savings_count,claimed_at,subdomain,fraudulent,fraudulent_count,total_number_of_pending_reviews_cache,images_count,completion_percent_cache,bully,secret,replied_to_at_least_one_review_cache,latest_approved_review_created_at,has_set_tasks,lead_purchase_eligible,service_area_id,star_score,quote_button_category,direct_phone,direct_contact
https://homestars.com/on/grant-town/kitchen-bathroom-cabinets-design,55,"c(""https://homestars.com/on/grant-town/kitchen-bathroom-cabinets-design?&page=2&"", ""https://homestars.com/on/grant-town/kitchen-bathroom-cabinets-design?&page=3&"", ""https://homestars.com/on/grant-town/kitchen-bathroom-cabinets-design?&page=4&"", ""https://homestars.com/on/grant-town/kitchen-bathroom-cabinets-design?&page=5&"", ""https://homestars.com/on/grant-town/kitchen-bathroom-cabinets-design?&page=6&"")",Kitchen & Bathroom - Cabinets & Design,2894527,https://www.fantasykitchens.ca/,/companies/2894527-fantasy-kitchens?searched_category_id=392&service_area=2116382,"Established in 2015, we are a fast growing, full service, detail-oriented custom cabinetry company trusted by customers in the Greater Toronto Area.

Fantasy Kitchen specializes in offering top-quality custom kitchen cabinets in Markham. We are passionate about enhancing the beauty and functionality of your home. As the most trusted cabinet manufacturer in GTA, we craft and install custom bathroom vanities in Richmond Hill.

Our goal is to exceed your expectations on every project, regardless of size. We have a team of skilled craftsmen for designing and installing custom wall units in Markham. Whether you need custom kitchen cabinets, bathroom vanity, walk-in closet, or home bar, we can customize cabinetry to suit your taste, style, and budget. Our team can also install custom wall units in Richmond Hill homes and commercial spaces. As a full-service cabinetry installer, we can make your home more stylish, comfortable, and spacious.

When it comes to kitchen cabinets and bathroom vanities, you need products that can withstand temperature fluctuations due to heat from stoves and ovens and moisture from showers, sinks, and dishwashers.

We focus on using the highest quality material and durable fixtures that can stand the test of time. Our process involves taking accurate measurements and understanding your vision to deliver tailored solutions. When we install custom bathroom vanities in Vaughan, we make sure to provide you a product that complements the size and style of your space.

We strive to turn your bathroom into a sanctuary. When we work on any project, our designers consider aesthetics, as well as functionality. Our experts will not only help you choose the right cabinetry material but can also guide you to select the best hardware and finishes that look phenomenal and can stand up to the challenges of a bathroom or kitchen environment. Our services include:

• Kitchen & Bathroom Design Consultation
• Custom Cabinets Manufacturer
• Kitchen Cabinetry Installation
• Bathroom Vanity Installation
• Walk-In Closet Installation
• Home Bar & Pantry
• And More!

At Fantasy Kitchen, we take great pride in our workmanship. From crafting custom Kitchen cabinets in Markham to installing bathroom vanities in Richmond Hill, we provide a wide range of superior quality products and spectacular installation services for almost every budget and style. We always respect your time and consider your ideas to ensure that the project is completed as per your requirements and expectations. We provide you the freedom to choose from our wide assortment of premium materials. In addition to this, we always provide accurate project quote to keep you informed. The cabinets we install provide a great storage solution to provide you an organized and attractive-looking space.",fantasy-kitchens,2017-02-27T13:02:08.000-05:00,NA,NA,NA,,,,,2015,7,"Cheque, Cash, E-Transfer",,,WSIB,TRUE,FALSE,,,TRUE,FALSE,1 year Warranty,1956951,Fantasy Kitchens,0,0,35,NA,"Countertops, Granite Counter Tops, Kitchen Counter Tops, Marble Counter Tops, Laminate Counter Top, Quartz Counter Top, Corian counter top, tile counter top, silestone counter tops, arborite counter tops, custom counter tops, kitchen, remodeling, kitchen cabinet, kitchen design, ,Cabinetry & Millwork, Kitchen Cabinetry, Custom Cabinetry, Bathroom Cabinetry, Architectural Millwork, Millwork, custom millwork, bathroom cabinets, Kitchen cabinets, built-in cabinets, built-in cabinetry,  cabinet makers, custom cabinets kitchen, cabinetry, thomasville kitchen cabinets, cabinet doors, millwork cabinetry, custom kitchen cabinets, kraftmaid cabinets, maple cabinets, wood cabinets, stock cabinets, thermofoil cabinets, laminate cabinets, kitchen cabinets design, cherry cabinets, kitchen cabinet designs, hickory cabinets, wholesale cabinets, custom made cabinets, cabinet millwork, cabinets kitchen, kitchen cabinetry, millwork cabinets, ready to assemble cabinets, quality cabinets, bamboo cabinets, caulking,
,Kitchen & Bathroom - Cabinets & Design, Kitchen Cabinet And Counter, Kitchen Cabinet Hardware, Bathroom Cabinet, Bathroom Wall Cabinet, Bathroom Sink Cabinet, cabinets, kitchens, cabinetry, kitchen and cabinets, cabinets for kitchen, about kitchen cabinets, kitchen cabinets, kitchen cabinets in, cabinets for the kitchen, cabinets and kitchen, cabinets kitchen, kitchen cabinet, cabinet kitchen, the kitchen cabinet, kitchen by design, design kitchen, a kitchen design, design a kitchen, design for kitchen, design and kitchen, design by kitchen, kitchen design, cabinetry kitchen, kitchen cabinetry, designs kitchen, kitchen designs, bathroom vanities, vanity and bathroom, bath and vanity, designer kitchen, ,",0,NA,fantasykitchens,FALSE,0,0,36,0,FALSE,750e082da9c527d8aa98e5d645fb328009756b3e,FALSE,NA,TRUE,TRUE,2116382,-1.0,392,NA,NA
https://homestars.com/on/grant-town/kitchen-bathroom-cabinets-design,55,"c(""https://homestars.com/on/grant-town/kitchen-bathroom-cabinets-design?&page=2&"", ""https://homestars.com/on/grant-town/kitchen-bathroom-cabinets-design?&page=3&"", ""https://homestars.com/on/grant-town/kitchen-bathroom-cabinets-design?&page=4&"", ""https://homestars.com/on/grant-town/kitchen-bathroom-cabinets-design?&page=5&"", ""https://homestars.com/on/grant-town/kitchen-bathroom-cabinets-design?&page=6&"")",Kitchen & Bathroom - Cabinets & Design,2915571,NA,/companies/2915571-quartz-city?searched_category_id=392&service_area=2162184,NA,quartz-city,2018-04-30T14:27:48.000-04:00,NA,NA,NA,NA,NA,NA,NA,NA,NA,NA,NA,NA,NA,FALSE,FALSE,NA,NA,FALSE,FALSE,NA,1977755,Quartz City,2,2,0,10,"Kitchen & Bathroom - Cabinets & Design, Kitchen Cabinet And Counter, Kitchen Cabinet Hardware, Bathroom Cabinet, Bathroom Wall Cabinet, Bathroom Sink Cabinet, cabinets, kitchens, cabinetry, kitchen and cabinets, cabinets for kitchen, about kitchen cabinets, kitchen cabinets, kitchen cabinets in, cabinets for the kitchen, cabinets and kitchen, cabinets kitchen, kitchen cabinet, cabinet kitchen, the kitchen cabinet, kitchen by design, design kitchen, a kitchen design, design a kitchen, design for kitchen, design and kitchen, design by kitchen, kitchen design, cabinetry kitchen, kitchen cabinetry, designs kitchen, kitchen designs, bathroom vanities, vanity and bathroom, bath and vanity, designer kitchen, ,",0,2018-04-30T14:28:33.000-04:00,NA,FALSE,0,0,0,0,FALSE,2b2d7b4c3fee50add7efdba6abd62f557b6df3ad,FALSE,2021-02-09T14:43:56.000-05:00,FALSE,FALSE,2162184,84.9938607726,392,NA,NA
https://homestars.com/on/grant-town/kitchen-bathroom-cabinets-design,55,"c(""https://homestars.com/on/grant-town/kitchen-bathroom-cabinets-design?&page=2&"", ""https://homestars.com/on/grant-town/kitchen-bathroom-cabinets-design?&page=3&"", ""https://homestars.com/on/grant-town/kitchen-bathroom-cabinets-design?&page=4&"", ""https://homestars.com/on/grant-town/kitchen-bathroom-cabinets-design?&page=5&"", ""https://homestars.com/on/grant-town/kitchen-bathroom-cabinets-design?&page=6&"")",Kitchen & Bathroom - Cabinets & Design,2787203,NA,/companies/2787203-cmr-contracting-ceara-kitchens?searched_category_id=392&service_area=1844928,"Ceara KITCHENS has been serving the Toronto / GTA community since 1992. We specialize in custom design / fabrication and installation of Kitchens / Remodelling and Renovations.Our staff offers quality and reliable services that you can count on.

Whether you need a new kitchen, bathroom or an entire renovation, we have the skills and experience to help achieve the renovation that you want at prices you can afford. At Ceara KITCHENS our goal is to provide you with courteous, expedient, professional service of the highest caliber.

If you have any questions regarding our services, please email us at cearakitchens@hotmail.com, call us at 905-235-7380 or feel free to stop by our showroom at 17915 Leslie Street in Newmarket ON.

At Ceara KITCHENS, the customer always comes first, and we're not satisfied until you are!
",cmr-contracting-ceara-kitchens,2011-05-02T16:15:06.000-04:00,NA,NA,NA,NA,NA,NA,NA,NA,NA,NA,NA,NA,NA,FALSE,FALSE,NA,NA,FALSE,FALSE,NA,1850255,Cmr Contracting / Ceara Kitchens,13,5,0,7.4,"Kitchen & Bathroom - Cabinets & Design, Kitchen Cabinet And Counter, Kitchen Cabinet Hardware, Bathroom Cabinet, Bathroom Wall Cabinet, Bathroom Sink Cabinet, cabinets, kitchens, cabinetry, kitchen and cabinets, cabinets for kitchen, about kitchen cabinets, kitchen cabinets, kitchen cabinets in, cabinets for the kitchen, cabinets and kitchen, cabinets kitchen, kitchen cabinet, cabinet kitchen, the kitchen cabinet, kitchen by design, design kitchen, a kitchen design, design a kitchen, design for kitchen, design and kitchen, design by kitchen, kitchen design, cabinetry kitchen, kitchen cabinetry, designs kitchen, kitchen designs, bathroom vanities, vanity and bathroom, bath and vanity, designer kitchen, ,",0,NA,NA,FALSE,0,0,0,NA,FALSE,b3e6b0bbb81a60cb05c6c82f54d72c8b96bebe31,TRUE,2017-03-28T11:21:04.000-04:00,TRUE,FALSE,1844928,70.0391674631,392,NA,NA
https://homestars.com/on/grant-town/kitchen-bathroom-cabinets-design,55,"c(""https://homestars.com/on/grant-town/kitchen-bathroom-cabinets-design?&page=2&"", ""https://homestars.com/on/grant-town/kitchen-bathroom-cabinets-design?&page=3&"", ""https://homestars.com/on/grant-town/kitchen-bathroom-cabinets-design?&page=4&"", ""https://homestars.com/on/grant-town/kitchen-bathroom-cabinets-design?&page=5&"", ""https://homestars.com/on/grant-town/kitchen-bathroom-cabinets-design?&page=6&"")",Kitchen & Bathroom - Cabinets & Design,2790759,http://www.tacomawoodworks.ca,/companies/2790759-tacoma-woodworks?searched_category_id=392&service_area=1849952,"Tacoma Woodworks designs and manufactures custom cabinetry including kitchens, bars, bathroom vanities, entertainment centres and furniture.  We build everything in our Aurora shop to meet your specific requirements.  Contact us for a free quote of your next project.  Find us on Facebook to see pictures of previous projects.",tacoma-woodworks,2011-08-27T09:42:41.000-04:00,NA,"Toronto, North York, Vaughan, Thornhill, Richmond Hill, Aurora, Newmarket, Stoufville, Bradford, Georgina, Concord, Mount Albert, Uxbridge, Bolton, Woodbridge, Mississauga, Brampton, ...",,"Custom designed and built kitchens, bars, wall units, bookcases, buil-ins, entertainment units, vanities and fireplaces.",,,,2010,4,"Cash, Cheque, Visa, MasterCard, AMEX",,,"NKBA, CFIB",TRUE,FALSE,Each job is quoted on an individual basis,,FALSE,FALSE,See contract,1853811,Tacoma Woodworks,10,9,68,10,"Kitchen & Bathroom - Cabinets & Design, Kitchen Cabinet And Counter, Kitchen Cabinet Hardware, Bathroom Cabinet, Bathroom Wall Cabinet, Bathroom Sink Cabinet, cabinets, kitchens, cabinetry, kitchen and cabinets, cabinets for kitchen, about kitchen cabinets, kitchen cabinets, kitchen cabinets in, cabinets for the kitchen, cabinets and kitchen, cabinets kitchen, kitchen cabinet, cabinet kitchen, the kitchen cabinet, kitchen by design, design kitchen, a kitchen design, design a kitchen, design for kitchen, design and kitchen, design by kitchen, kitchen design, cabinetry kitchen, kitchen cabinetry, designs kitchen, kitchen designs, bathroom vanities, vanity and bathroom, bath and vanity, designer kitchen, ,",0,2011-08-27T09:42:42.000-04:00,tacomawoodworks,FALSE,0,0,69,NA,FALSE,0698ebc54e8004d07cabb274f4a7da8b9ab6c84a,FALSE,2017-05-17T12:44:12.000-04:00,TRUE,FALSE,1849952,82.7365703023,392,NA,NA
https://homestars.com/on/grant-town/kitchen-bathroom-cabinets-design,55,"c(""https://homestars.com/on/grant-town/kitchen-bathroom-cabinets-design?&page=2&"", ""https://homestars.com/on/grant-town/kitchen-bathroom-cabinets-design?&page=3&"", ""https://homestars.com/on/grant-town/kitchen-bathroom-cabinets-design?&page=4&"", ""https://homestars.com/on/grant-town/kitchen-bathroom-cabinets-design?&page=5&"", ""https://homestars.com/on/grant-town/kitchen-bathroom-cabinets-design?&page=6&"")",Kitchen & Bathroom - Cabinets & Design,2865926,http://www.araxa.ca,/companies/2865926-araxa-kitchens-by-design?searched_category_id=392&service_area=2071959,We specialize in creating the perfect kitchen for that special space. We offer a service personally fitted to your needs.,araxa-kitchens-by-design,2015-02-08T12:59:12.000-05:00,NA,"Toronto, North York, Richmond Hill, Aurora, Markham, Mississauga, Vaughan, New Market , Bradford, Mount Albert ",10Am-5:00PM,"RTA Cabinets, RTA Closets 
Costum made Cabinets and Closets
Bathroom Vanity","All Kind of Counter Top
Faucet
Sink
knobs and handles ","Cambria Quartz, 
Caesar Stone","All Kind of Custom Made Cabinets, Closets, Vanities, Wall unites
Laundry room",NA,NA,,,,,TRUE,TRUE,,,TRUE,FALSE,,1928351,Araxa Kitchens By Design,10,3,17,10,"Kitchen & Bathroom - Cabinets & Design, Kitchen Cabinet And Counter, Kitchen Cabinet Hardware, Bathroom Cabinet, Bathroom Wall Cabinet, Bathroom Sink Cabinet, cabinets, kitchens, cabinetry, kitchen and cabinets, cabinets for kitchen, about kitchen cabinets, kitchen cabinets, kitchen cabinets in, cabinets for the kitchen, cabinets and kitchen, cabinets kitchen, kitchen cabinet, cabinet kitchen, the kitchen cabinet, kitchen by design, design kitchen, a kitchen design, design a kitchen, design for kitchen, design and kitchen, design by kitchen, kitchen design, cabinetry kitchen, kitchen cabinetry, designs kitchen, kitchen designs, bathroom vanities, vanity and bathroom, bath and vanity, designer kitchen, ,",3,NA,araxa-kitchens,FALSE,0,0,23,0,FALSE,24f4d9443830e5e8412d23d3f484596f6d47e1c1,TRUE,2016-02-08T11:36:21.000-05:00,TRUE,FALSE,2071959,75.695273433,392,NA,NA
https://homestars.com/on/grant-town/kitchen-bathroom-cabinets-design,55,"c(""https://homestars.com/on/grant-town/kitchen-bathroom-cabinets-design?&page=2&"", ""https://homestars.com/on/grant-town/kitchen-bathroom-cabinets-design?&page=3&"", ""https://homestars.com/on/grant-town/kitchen-bathroom-cabinets-design?&page=4&"", ""https://homestars.com/on/grant-town/kitchen-bathroom-cabinets-design?&page=5&"", ""https://homestars.com/on/grant-town/kitchen-bathroom-cabinets-design?&page=6&"")",Kitchen & Bathroom - Cabinets & Design,2904053,NA,/companies/2904053-goup-services?searched_category_id=392&service_area=2137818,"GoUp Services knows the ins and outs of furniture assembly installation processes, kitchen installation and more. We work hard to have your projects up and running in no time.We will be glad to help you at any time. 
Sincerely, Your professional GoUP team.",goup-services,2017-10-27T15:38:45.000-04:00,NA,NA,NA,NA,NA,NA,NA,NA,NA,NA,NA,NA,NA,FALSE,FALSE,NA,NA,FALSE,FALSE,NA,1966238,Go Up Services,1,1,3,10,"Kitchen & Bathroom - Cabinets & Design, Kitchen Cabinet And Counter, Kitchen Cabinet Hardware, Bathroom Cabinet, Bathroom Wall Cabinet, Bathroom Sink Cabinet, cabinets, kitchens, cabinetry, kitchen and cabinets, cabinets for kitchen, about kitchen cabinets, kitchen cabinets, kitchen cabinets in, cabinets for the kitchen, cabinets and kitchen, cabinets kitchen, kitchen cabinet, cabinet kitchen, the kitchen cabinet, kitchen by design, design kitchen, a kitchen design, design a kitchen, design for kitchen, design and kitchen, design by kitchen, kitchen design, cabinetry kitchen, kitchen cabinetry, designs kitchen, kitchen designs, bathroom vanities, vanity and bathroom, bath and vanity, designer kitchen, ,",0,2017-10-27T15:39:26.000-04:00,NA,FALSE,0,0,11,0,FALSE,c52686235eff1c6991dec3252a418daff51f0d6e,TRUE,NA,TRUE,FALSE,2137818,80.0769565879,392,NA,NA
https://homestars.com/on/grant-town/kitchen-bathroom-cabinets-design,55,"c(""https://homestars.com/on/grant-town/kitchen-bathroom-cabinets-design?&page=2&"", ""https://homestars.com/on/grant-town/kitchen-bathroom-cabinets-design?&page=3&"", ""https://homestars.com/on/grant-town/kitchen-bathroom-cabinets-design?&page=4&"", ""https://homestars.com/on/grant-town/kitchen-bathroom-cabinets-design?&page=5&"", ""https://homestars.com/on/grant-town/kitchen-bathroom-cabinets-design?&page=6&"")",Kitchen & Bathroom - Cabinets & Design,227596,NA,/companies/227596-total-kitchen-refacing?searched_category_id=392&service_area=1812523,NA,total-kitchen-refacing,2008-01-23T10:37:00.000-05:00,NA,NA,NA,NA,NA,NA,NA,0,0,NA,NA,NA,NA,FALSE,FALSE,NA,NA,FALSE,FALSE,NA,78293,Total Kitchen Refacing,25,19,0,6.57895,"Kitchen & Bathroom - Cabinets & Design, Kitchen Cabinet And Counter, Kitchen Cabinet Hardware, Bathroom Cabinet, Bathroom Wall Cabinet, Bathroom Sink Cabinet, cabinets, kitchens, cabinetry, kitchen and cabinets, cabinets for kitchen, about kitchen cabinets, kitchen cabinets, kitchen cabinets in, cabinets for the kitchen, cabinets and kitchen, cabinets kitchen, kitchen cabinet, cabinet kitchen, the kitchen cabinet, kitchen by design, design kitchen, a kitchen design, design a kitchen, design for kitchen, design and kitchen, design by kitchen, kitchen design, cabinetry kitchen, kitchen cabinetry, designs kitchen, kitchen designs, bathroom vanities, vanity and bathroom, bath and vanity, designer kitchen, ,",0,2013-10-01T14:30:58.000-04:00,NA,FALSE,0,0,0,NA,FALSE,7bc709288abdc7106c92acac902ffd3b412cc696,TRUE,2016-07-18T17:53:55.000-04:00,TRUE,FALSE,1812523,64.6367782457,392,NA,NA
https://homestars.com/on/grant-town/kitchen-bathroom-cabinets-design,55,"c(""https://homestars.com/on/grant-town/kitchen-bathroom-cabinets-design?&page=2&"", ""https://homestars.com/on/grant-town/kitchen-bathroom-cabinets-design?&page=3&"", ""https://homestars.com/on/grant-town/kitchen-bathroom-cabinets-design?&page=4&"", ""https://homestars.com/on/grant-town/kitchen-bathroom-cabinets-design?&page=5&"", ""https://homestars.com/on/grant-town/kitchen-bathroom-cabinets-design?&page=6&"")",Kitchen & Bathroom - Cabinets & Design,2974025,NA,/companies/2974025-ceara-kitchens-customs-cabinetry?searched_category_id=392&service_area=2293976,NA,ceara-kitchens-customs-cabinetry,2022-10-07T16:02:30.000-04:00,NA,NA,NA,NA,NA,NA,NA,NA,NA,NA,NA,NA,NA,FALSE,FALSE,NA,NA,FALSE,FALSE,NA,2035926,Ceara Kitchens Customs Cabinetry,6,6,0,6.5,"Kitchen & Bathroom - Cabinets & Design, Kitchen Cabinet And Counter, Kitchen Cabinet Hardware, Bathroom Cabinet, Bathroom Wall Cabinet, Bathroom Sink Cabinet, cabinets, kitchens, cabinetry, kitchen and cabinets, cabinets for kitchen, about kitchen cabinets, kitchen cabinets, kitchen cabinets in, cabinets for the kitchen, cabinets and kitchen, cabinets kitchen, kitchen cabinet, cabinet kitchen, the kitchen cabinet, kitchen by design, design kitchen, a kitchen design, design a kitchen, design for kitchen, design and kitchen, design by kitchen, kitchen design, cabinetry kitchen, kitchen cabinetry, designs kitchen, kitchen designs, bathroom vanities, vanity and bathroom, bath and vanity, designer kitchen, ,",0,2022-10-07T16:04:22.000-04:00,NA,FALSE,0,0,0,0,FALSE,060fb4a05297f22666ef9387ff9ab957afa514bb,TRUE,NA,FALSE,FALSE,2293976,46.2606511913,392,NA,NA
https://homestars.com/on/grant-town/kitchen-bathroom-cabinets-design,55,"c(""https://homestars.com/on/grant-town/kitchen-bathroom-cabinets-design?&page=2&"", ""https://homestars.com/on/grant-town/kitchen-bathroom-cabinets-design?&page=3&"", ""https://homestars.com/on/grant-town/kitchen-bathroom-cabinets-design?&page=4&"", ""https://homestars.com/on/grant-town/kitchen-bathroom-cabinets-design?&page=5&"", ""https://homestars.com/on/grant-town/kitchen-bathroom-cabinets-design?&page=6&"")",Kitchen & Bathroom - Cabinets & Design,2802278,NA,/companies/2802278-matero-kitchens?searched_category_id=392&service_area=1867644,NA,matero-kitchens,2012-10-17T20:10:43.000-04:00,NA,NA,NA,NA,NA,NA,NA,NA,NA,NA,NA,NA,NA,FALSE,FALSE,NA,NA,FALSE,FALSE,NA,1865279,Matero Kitchens,1,1,0,0,"Kitchen & Bathroom - Cabinets & Design, Kitchen Cabinet And Counter, Kitchen Cabinet Hardware, Bathroom Cabinet, Bathroom Wall Cabinet, Bathroom Sink Cabinet, cabinets, kitchens, cabinetry, kitchen and cabinets, cabinets for kitchen, about kitchen cabinets, kitchen cabinets, kitchen cabinets in, cabinets for the kitchen, cabinets and kitchen, cabinets kitchen, kitchen cabinet, cabinet kitchen, the kitchen cabinet, kitchen by design, design kitchen, a kitchen design, design a kitchen, design for kitchen, design and kitchen, design by kitchen, kitchen design, cabinetry kitchen, kitchen cabinetry, designs kitchen, kitchen designs, bathroom vanities, vanity and bathroom, bath and vanity, designer kitchen, ,",0,2012-12-16T17:08:44.000-05:00,NA,FALSE,0,0,0,NA,FALSE,9fafca4b4b4bc0bb24b17ee7e555f83fc3e2d4bf,FALSE,2012-10-17T20:18:38.000-04:00,FALSE,FALSE,1867644,0.0,392,NA,NA
https://homestars.com/on/grant-town/kitchen-bathroom-cabinets-design,55,"c(""https://homestars.com/on/grant-town/kitchen-bathroom-cabinets-design?&page=2&"", ""https://homestars.com/on/grant-town/kitchen-bathroom-cabinets-design?&page=3&"", ""https://homestars.com/on/grant-town/kitchen-bathroom-cabinets-design?&page=4&"", ""https://homestars.com/on/grant-town/kitchen-bathroom-cabinets-design?&page=5&"", ""https://homestars.com/on/grant-town/kitchen-bathroom-cabinets-design?&page=6&"")",Kitchen & Bathroom - Cabinets & Design,2889723,NA,/companies/2889723-canadian-kitchen-cabinets-company?searched_category_id=392&service_area=2102264,NA,canadian-kitchen-cabinets-company,2016-08-21T12:29:37.000-04:00,NA,NA,NA,NA,NA,NA,NA,NA,NA,NA,NA,NA,NA,FALSE,FALSE,NA,NA,FALSE,FALSE,NA,1952147,Canadian Kitchen Cabinets Company ,0,0,0,NA,"Kitchen & Bathroom - Cabinets & Design, Kitchen Cabinet And Counter, Kitchen Cabinet Hardware, Bathroom Cabinet, Bathroom Wall Cabinet, Bathroom Sink Cabinet, cabinets, kitchens, cabinetry, kitchen and cabinets, cabinets for kitchen, about kitchen cabinets, kitchen cabinets, kitchen cabinets in, cabinets for the kitchen, cabinets and kitchen, cabinets kitchen, kitchen cabinet, cabinet kitchen, the kitchen cabinet, kitchen by design, design kitchen, a kitchen design, design a kitchen, design for kitchen, design and kitchen, design by kitchen, kitchen design, cabinetry kitchen, kitchen cabinetry, designs kitchen, kitchen designs, bathroom vanities, vanity and bathroom, bath and vanity, designer kitchen, ,",0,NA,NA,FALSE,0,0,0,0,FALSE,bfb80a1d644861a4144b754a578a881050add683,FALSE,NA,FALSE,FALSE,2102264,-1.0,392,NA,NA
https://homestars.com/on/grant-town/kitchen-bathroom-cabinets-design,55,"c(""https://homestars.com/on/grant-town/kitchen-bathroom-cabinets-design?&page=2&"", ""https://homestars.com/on/grant-town/kitchen-bathroom-cabinets-design?&page=3&"", ""https://homestars.com/on/grant-town/kitchen-bathroom-cabinets-design?&page=4&"", ""https://homestars.com/on/grant-town/kitchen-bathroom-cabinets-design?&page=5&"", ""https://homestars.com/on/grant-town/kitchen-bathroom-cabinets-design?&page=6&"")",Kitchen & Bathroom - Cabinets & Design,2952729,NA,/companies/2952729-morra-fine-cabinetry?searched_category_id=392&service_area=2245703,NA,morra-fine-cabinetry,2021-02-03T15:43:11.000-05:00,NA,NA,NA,NA,NA,NA,NA,NA,NA,NA,NA,NA,NA,FALSE,FALSE,NA,NA,FALSE,FALSE,NA,2014825,Morra Fine Cabinetry,0,0,0,NA,"Kitchen & Bathroom - Cabinets & Design, Kitchen Cabinet And Counter, Kitchen Cabinet Hardware, Bathroom Cabinet, Bathroom Wall Cabinet, Bathroom Sink Cabinet, cabinets, kitchens, cabinetry, kitchen and cabinets, cabinets for kitchen, about kitchen cabinets, kitchen cabinets, kitchen cabinets in, cabinets for the kitchen, cabinets and kitchen, cabinets kitchen, kitchen cabinet, cabinet kitchen, the kitchen cabinet, kitchen by design, design kitchen, a kitchen design, design a kitchen, design for kitchen, design and kitchen, design by kitchen, kitchen design, cabinetry kitchen, kitchen cabinetry, designs kitchen, kitchen designs, bathroom vanities, vanity and bathroom, bath and vanity, designer kitchen, ,",0,2021-02-03T15:45:19.000-05:00,NA,FALSE,0,0,0,0,FALSE,adc63da3f35bb3e44d050abbafb63f6d8f54fb09,FALSE,NA,TRUE,FALSE,2245703,0,392,NA,NA
