Link,n_hits,all_links,category,id,url,hs_path,profile,permalink,created_at,sic_code,service_area,hours,products,services,brands,specialities,established,employee_cnt,payment_method,diplomas,licenses,memberships,liability_insurance,bonded,project_rate,project_minimum,written_contract,written_warranty,warranty_terms,parent_company_id,name,total_number_of_reviews_cache,total_number_of_approved_reviews_cache,number_of_photos_cache,avg_rating_cache,categories_info_cache,savings_count,subdomain,fraudulent,fraudulent_count,total_number_of_pending_reviews_cache,images_count,completion_percent_cache,bully,secret,replied_to_at_least_one_review_cache,latest_approved_review_created_at,has_set_tasks,lead_purchase_eligible,service_area_id,star_score,quote_button_category,direct_phone,direct_contact,claimed_at
https://homestars.com/on/caledon-village/design-build,6,https://homestars.com/on/caledon-village/design-build,Design/Build,2890343,http://www.concepts2completion.ca,/companies/2890343-concepts-2-completion?searched_category_id=458&service_area=2104046,"SPECIALIZING IN COMMERCIAL & RESIDENTIAL
At Concepts 2 Completion Inc., we are proud to focus our services on homes and businesses in the surrounding areas.

We have Over 25 years of experience . We have the tools and expertise to get the job done right from your concept to the completed product.

When you enlist the help of our contractors, you can rest assured that the systems in your home or business are safe, fortified, and built to last for years to come.

A COMMITMENT TO CUSTOMER SATISFACTION
When it comes to delivering superior electrical services, one must focus on what is important. For us, what's important is providing safe and reliable repairs and New installations and maintaining the satisfaction of our valued customers. We owe our clients the continued success of our business, and it is for them that we make sure to never waver in our commitment to excellence.

Before we perform any job or service for our clientele, we map out a detailed plan to ensure that the work is done efficiently and with the expertise that our clients have come to expect.

When you work with our team, you can anticipate:

24/7 availability
Free quotes
Licensed experts
Insured and bonded services
Customer satisfaction follow-ups
2-year labour warranty
Courteous contractors

CONCEPTS 2 COMPLETION INC.: TIMELY AND COURTEOUS 

The business world is extremely fast-paced because, as the saying goes, time is money. Unfortunately, because of this mindset, we have lost some of the most important aspects of human interaction. While many companies will prioritize finishing the job as quickly as possible, at Concepts 2 Completion Inc., we make time for our clients. We want our clients to know that when you deal with us, it is not business as usual. We take the time necessary not only to get the job done but also to get to know our clients and provide high-quality services that meet their unique needs. We encourage our clients to speak freely with us so that we can make sure that their expectations are met and exceeded.",concepts-2-completion,2016-09-15T11:16:00.000-04:00,NA,NA,NA,Full Service Contracting,Any thing to do with your home ,All,Customer Service Life Time Warranty,2014,8,"E-transfer, cash, cheque. All Card payments debit and credit",,,,TRUE,TRUE,115.99per hr,"$30,000",TRUE,FALSE,Lifetime,1952767,Concepts 2 Completion,18,17,35,9.88235,"Design/Build, Contracting, Renovation, Remodeling, Restoration, Project Management, Renovation Assistance, Reno Management, architect, architects, design build, build & design, design and build, build by design, design to build. building construction, building a house, house designs, house plans, home designs, house plan, how to design a house, design house, house design, remodeling, building and design, design for building, design building, building by design, a building design, design of building, building design, design a building, building & design,  playsets, playground, wooden playset, wooden playground, play set, ,General Contractors, Residential General Contractor, Building Contractor, Additions, Remodeling Contractor,  Renovation, Builder, building construction, renovation, remodeling, construction builders, construction company, construction companies, home repair, construction jobs, home remodeling, general contractors, contractors general, contractor general, contractors construction, construction contractors, home improvement and remodeling, kitchen remodeling, construction contractor, builders contractors, home renovation, general contracting, building contractors, building companies, home renovations, builder contractor, building contractor, remodeling contractor, commercial construction, residential construction, house contractor, concrete contractors, home contractors, general construction, construction general, contractors remodeling, remodeling contractors, remodelers, remodel contractor, remodel contractors, general contract, commercial contractors, renovations contractors, home improvement contractor, licensed contractor, license general contractor, mud room, mudroom, caulking, ,",0,,FALSE,0,0,44,0,FALSE,1bbf3c261b646a3adac6a05d7061842103a34475,TRUE,2021-03-21T11:49:07.000-04:00,TRUE,TRUE,2104046,94.297723591,458,NA,NA,NA
https://homestars.com/on/caledon-village/design-build,6,https://homestars.com/on/caledon-village/design-build,Design/Build,2946848,,/companies/2946848-samra-contracting?searched_category_id=458&service_area=2232639,"Samra Contracting provides a full range of residential and commercial construction services, and general contracting from idea to completion. Jas Samra is a general contractor who has extensive knowledge and experience in home construction, remodeling, maintenance, basement finishing and project consultations. Samra Contracting has established great relationships with suppliers, interior designers and sub trades to ensure your project is completed on schedule and on budget, we have remained loyally committed to single factor that has meant more to our continue success than any other – our status for standard craftsmanship.",samra-contracting,2020-08-18T23:50:37.000-04:00,NA,NA,NA,,,,,NA,NA,,,,,FALSE,FALSE,,,FALSE,FALSE,,2008985,Samra Contracting,3,3,3,10,"Design/Build, Contracting, Renovation, Remodeling, Restoration, Project Management, Renovation Assistance, Reno Management, architect, architects, design build, build & design, design and build, build by design, design to build. building construction, building a house, house designs, house plans, home designs, house plan, how to design a house, design house, house design, remodeling, building and design, design for building, design building, building by design, a building design, design of building, building design, design a building, building & design,  playsets, playground, wooden playset, wooden playground, play set, ,",0,,FALSE,0,0,4,0,FALSE,c54f8ecb58fb25ebfbf0eff174c06d25d4835d1d,FALSE,NA,TRUE,FALSE,2232639,85.0492381705,458,NA,NA,2020-08-18T23:50:59.000-04:00
https://homestars.com/on/caledon-village/design-build,6,https://homestars.com/on/caledon-village/design-build,Design/Build,2931632,https://www.foresthilldb.com/,/companies/2931632-forest-hill-design-build?searched_category_id=458&service_area=2198388,"Forest Hill Design Build specializes in new construction projects, home remodelling, basement, kitchen and bath renovations and full interior design services.

We provide an extraordinary and unique construction project experience. We design, build and deliver all of our customers’ dreams.",forest-hill-design-build,2019-05-30T18:39:33.000-04:00,NA,NA,NA,NA,NA,NA,NA,NA,NA,NA,NA,NA,NA,FALSE,FALSE,NA,NA,FALSE,FALSE,NA,1993806,Forest Hill Design Build,11,10,14,10,"Design/Build, Contracting, Renovation, Remodeling, Restoration, Project Management, Renovation Assistance, Reno Management, architect, architects, design build, build & design, design and build, build by design, design to build. building construction, building a house, house designs, house plans, home designs, house plan, how to design a house, design house, house design, remodeling, building and design, design for building, design building, building by design, a building design, design of building, building design, design a building, building & design,  playsets, playground, wooden playset, wooden playground, play set, ,",0,NA,FALSE,0,0,17,0,FALSE,af6b607b3c73b1370a36bb8f0519c6bc3f42d574,FALSE,NA,TRUE,FALSE,2198388,92.6542133012,458,NA,NA,2019-05-30T18:40:13.000-04:00
https://homestars.com/on/caledon-village/design-build,6,https://homestars.com/on/caledon-village/design-build,Design/Build,2925452,NA,/companies/2925452-truspec-contracting?searched_category_id=458&service_area=2184211,"Truspec contracting is your one stop residential and commercial renovation specialists and project management. We have been in the construction industry providing professional and honest service for many years. From start to finish, we make your renovation dream a reality. ",truspec-contracting,2018-12-21T10:55:31.000-05:00,NA,NA,NA,NA,NA,NA,NA,NA,NA,NA,NA,NA,NA,FALSE,FALSE,NA,NA,FALSE,FALSE,NA,1987626,Truspec Contracting,4,4,0,10,"Design/Build, Contracting, Renovation, Remodeling, Restoration, Project Management, Renovation Assistance, Reno Management, architect, architects, design build, build & design, design and build, build by design, design to build. building construction, building a house, house designs, house plans, home designs, house plan, how to design a house, design house, house design, remodeling, building and design, design for building, design building, building by design, a building design, design of building, building design, design a building, building & design,  playsets, playground, wooden playset, wooden playground, play set, ,",0,NA,FALSE,0,0,1,0,FALSE,2389ba6f52cc510d9b9e7ca0c04a1f5430781610,FALSE,2018-12-28T22:39:14.000-05:00,TRUE,FALSE,2184211,75.9383591846,458,NA,NA,2018-12-21T10:55:55.000-05:00
https://homestars.com/on/caledon-village/design-build,6,https://homestars.com/on/caledon-village/design-build,Design/Build,2906172,NA,/companies/2906172-bernard-design-and-build?searched_category_id=458&service_area=2142368,NA,bernard-design-and-build,2017-12-08T21:01:48.000-05:00,NA,NA,NA,NA,NA,NA,NA,NA,NA,NA,NA,NA,NA,FALSE,FALSE,NA,NA,FALSE,FALSE,NA,1968357,Bernard Design And Build,0,0,0,NA,"Design/Build, Contracting, Renovation, Remodeling, Restoration, Project Management, Renovation Assistance, Reno Management, architect, architects, design build, build & design, design and build, build by design, design to build. building construction, building a house, house designs, house plans, home designs, house plan, how to design a house, design house, house design, remodeling, building and design, design for building, design building, building by design, a building design, design of building, building design, design a building, building & design,  playsets, playground, wooden playset, wooden playground, play set, ,",0,NA,FALSE,0,0,0,0,FALSE,2b109ff6589b2bdb206e22e40561015589a453d8,FALSE,NA,FALSE,FALSE,2142368,-1.0,458,NA,NA,2017-12-08T21:02:28.000-05:00
https://homestars.com/on/caledon-village/design-build,6,https://homestars.com/on/caledon-village/design-build,Design/Build,2914816,NA,/companies/2914816-detail-renivationa?searched_category_id=458&service_area=2160572,NA,detail-renivationa,2018-04-18T23:14:07.000-04:00,NA,NA,NA,NA,NA,NA,NA,NA,NA,NA,NA,NA,NA,FALSE,FALSE,NA,NA,FALSE,FALSE,NA,1977000,Detail Renivationa,0,0,0,NA,"Design/Build, Contracting, Renovation, Remodeling, Restoration, Project Management, Renovation Assistance, Reno Management, architect, architects, design build, build & design, design and build, build by design, design to build. building construction, building a house, house designs, house plans, home designs, house plan, how to design a house, design house, house design, remodeling, building and design, design for building, design building, building by design, a building design, design of building, building design, design a building, building & design,  playsets, playground, wooden playset, wooden playground, play set, ,",0,NA,FALSE,0,0,0,0,FALSE,f00d4169db4999a13d7ef91601ade3ca69cdbd9f,FALSE,NA,FALSE,FALSE,2160572,-1.0,458,NA,NA,2018-04-18T23:15:20.000-04:00
