Link,n_hits,all_links,category,id,url,hs_path,profile,permalink,created_at,sic_code,service_area,hours,products,services,brands,specialities,established,employee_cnt,payment_method,diplomas,licenses,memberships,liability_insurance,bonded,project_rate,project_minimum,written_contract,written_warranty,warranty_terms,parent_company_id,name,total_number_of_reviews_cache,total_number_of_approved_reviews_cache,number_of_photos_cache,avg_rating_cache,categories_info_cache,savings_count,claimed_at,subdomain,fraudulent,fraudulent_count,total_number_of_pending_reviews_cache,images_count,completion_percent_cache,bully,secret,replied_to_at_least_one_review_cache,latest_approved_review_created_at,has_set_tasks,lead_purchase_eligible,service_area_id,star_score,quote_button_category,direct_phone,direct_contact
https://homestars.com/on/schomberg/tile-stone-contractors,24,"c(""https://homestars.com/on/schomberg/tile-stone-contractors?&page=2&"", ""https://homestars.com/on/schomberg/tile-stone-contractors?&page=3&"")",Tile & Stone Contractors,206925,http://foreverstonedesign.com,/companies/206925-forever-stone-design-inc?searched_category_id=442&service_area=1816168,"Forever Stone Design is dedicated to excellence.  We take pride in our work with over 25 years of experience in this field, client satisfaction is number one.  From designing a project to completing it, you can rest assured the client is always happy.  We specialize in all types of stone work ranging from natural stone walls, flagstone, interlock, steps, pillars, waterfalls, retaining walls.  If you can imagine it, we can create it.
 
 ",forever-stone-design-inc,2006-01-13T19:00:00.000-05:00,NA,"Brampton, Concord, Etobicoke, Markham, Mississauga, Newmarket, North York,  Richmond Hill, Scarborough, Thornhill, Toronto, Vaughan, Woodbridge<br/>

<br/>",,,Email us at: foreverstonedesign@gmail.com,,"All types of stonework (natural stone, flagstone and interlock)          ",NA,NA,"Cheque, E-Transfers",,,,TRUE,FALSE,,"over $10,000.00 to obtain a quote",TRUE,TRUE,,61777,Forever Stone Design Inc.,411,373,87,9.93499,"Interlocking Stone, Interlocking Tile, Stone, tiles for, landscaping, paving, pavers, paver, stone step, wall stone, stone wall, landscape design, patios, interlock, retaining wall, stepping stones, interlocking, landscaping ideas, retaining walls, paving stones, paver stones, pavers stones, pavers and stones, stones pavers, stones and pavers, flagstone, concrete design, landscapers, natural stone, paving stone, stone paving, stone paving stone, walls stone, patio designs, stone and tiles, tiles and stone, stone flagstones, slate tiles, slate tile, stone veneer, pavers stone, stone and pavers, stone pavers, paver stone, stone paver, concrete driveway, stone brick, stone and brick, brick and stone, stone flooring, stone patio, stone for patio,,Landscape Contractors & Designers, Landscape Contractor Designer, Landscape Design, Landscape Contractor, Landscapers, Landscaping, Landscape, Backyard, patio, Fountain, Ponds and Waterfalls, garden, gardens, landscape, how to landscape, landscaping and, landscape garden, garden landscape, gardening, landscape gardens, pavers, garden design, design a garden, design for garden, design garden, how to design garden, lawn maintenance, how to design landscape, design landscape, landscape and design, design and landscape, how to design a landscape, landscape design, design a landscape, patios, architects landscape, landscape architects, garden designs, lawn service, garden landscaping, landscaping garden, landscape lighting, garden designer, designer garden,,landscapemakeover of backyard and improve front yard
build fence, landscape, Landscaping, retaining wall, grading,Tile & Stone Contractors, Natural Stone Tile, Stone Floor Tile, Ceramic Tile, Floor tile, Tile installers, Stone installers, stone counter top installers, tile counter top installers, stone backsplash intallers, granite installers, marble installers, limestone installers, linoleum installers, slate contractors, slate installers,install tite ,backsplash , fire place veenerneed someone to install blacksplash , wall stone veener bath room mosaic,",0,2006-01-13T19:00:00.000-05:00,foreverstonedes,FALSE,0,0,110,100,FALSE,8aaffb40e032b22574b239366c463edd10394041,TRUE,2022-11-02T10:55:25.000-04:00,TRUE,TRUE,1816168,99.1680700001,442,NA,NA
https://homestars.com/on/schomberg/tile-stone-contractors,24,"c(""https://homestars.com/on/schomberg/tile-stone-contractors?&page=2&"", ""https://homestars.com/on/schomberg/tile-stone-contractors?&page=3&"")",Tile & Stone Contractors,216746,http://miloradtiling.HomeStars.com,/companies/216746-milorad-tiling?searched_category_id=442&service_area=1827919,"Due to high demand, Milorad Tiling will only be accepting new tile projects and not repair projects (tile, grout or other).

Milorad Tiling is a company specializing in the preparation and application of all types of tiles from ceramics to marble and other natural stones. We take pride in our workmanship, and strive to go beyond our clients' expectations with our great attention to detail. We have a wealth of knowledge and experience in designer stone tiles, heated floors, as well as custom shower stalls and bathrooms designed for either regular or handicap access. We use only the highest quality materials. <br/><br/><br/><br/><br/><br/><br/><br/><br/><br/><br/><br/>

<br/><br/><br/><br/><br/><br/><br/><br/><br/><br/><br/><br/><b>Please visit our website listed above if you would like to see some of our previous projects, or if you would like some ideas for your upcoming projects</b>.EMAIL:vlaskalinm@gmail.com",milorad-tiling,2006-05-10T20:00:00.000-04:00,NA,The Greater Toronto Area,Mon-Fri 9-7,,"backsplash, floors, walls, shower cabins/stalls, etc.",,"Custom shower stalls (including step-in, Handicap/Wheelchair access), Kitchen Backsplashes, Foyers, floors and accent walls.",1985,0,"Cash, Cheque",,,,FALSE,FALSE,,,TRUE,FALSE,,69575,Milorad Tiling,213,198,220,9.88131,"Tile & Stone Contractors, Natural Stone Tile, Stone Floor Tile, Ceramic Tile, Floor tile, Tile installers, Stone installers, stone counter top installers, tile counter top installers, stone backsplash intallers, granite installers, marble installers, limestone installers, linoleum installers, slate contractors, slate installers,install tite ,backsplash , fire place veenerneed someone to install blacksplash , wall stone veener bath room mosaic,",0,2006-05-10T20:00:00.000-04:00,miloradtiling,FALSE,0,0,201,100,FALSE,83222be2934b1f0cb4ecfc3dfa9fdc6639ec35cf,TRUE,2022-10-28T08:12:25.000-04:00,TRUE,TRUE,1827919,98.3893571074,442,NA,NA
https://homestars.com/on/schomberg/tile-stone-contractors,24,"c(""https://homestars.com/on/schomberg/tile-stone-contractors?&page=2&"", ""https://homestars.com/on/schomberg/tile-stone-contractors?&page=3&"")",Tile & Stone Contractors,2795562,http://www.kasa-bella.ca,/companies/2795562-kasa-bella?searched_category_id=442&service_area=1866888,"Make your home truly yours. A custom kitchen, bathroom or fireplace can add beauty and personality while adding value to your home. Your personal, custom space is closer and more affordable than you think. From new installations to complete renovations let Kasa Bella measure, design and quote your project free of charge.

Our services include:
*Tile & Stone
*Design and Installation from backsplashes to entire bathrooms and kitchens.
*Remove and disposal of old flooring.
*Subfloors; scratch coat, drypack, Ditra.
* Design and Installation; floors, walls, backsplashes, feature walls, fireplaces, balconies & porches. ",kasa-bella,2012-02-27T10:55:18.000-05:00,NA,"Ajax 
<br />Vaughan 
<br />Woodbridge 
<br />Miss 
<br />Oakville 
<br />Burlington 
<br />Brampton 
<br />Toronto 
<br />Etobicoke",,"Porcelain, granite, marble, limestone, slate, ceramics, medallions and mosaics.  ","Design and Installation from backsplashes to entire bathrooms and kitchens.
Remove and disposal of old flooring.
Subfloors; scratch coat, drypack, Ditra.
Design and Installation; floors, walls, backsplashes, feature walls, fireplaces, balconies & porches.  
",,,2002,NA,,,,Union 183 Labourer's International Union of North America,TRUE,FALSE,,,TRUE,FALSE,6 Months Warranty on Workmanship,1858614,Kasa Bella,144,131,950,9.94656,"Kitchen Planning & Renovation, Kitchen Planning And Design, Kitchen Cabinet Planning, Kitchen Design, Kitchen Remodeling, kitchen or, and bathroom, a and a kitchens, kitchens and, for kitchens, a kitchens, kitchens, the house design, cabinets for kitchen, cabinets for the kitchen, cabinets and kitchen, kitchen cabinets, design a kitchen, about kitchen design, a kitchen design, how to kitchen design, design and kitchen, the kitchen design, design for kitchen, kitchen designs, renovation and remodeling, remodeling and renovation, kitchen designer,,Kitchen Renovation, caulking, ,Tile & Stone Contractors, Natural Stone Tile, Stone Floor Tile, Ceramic Tile, Floor tile, Tile installers, Stone installers, stone counter top installers, tile counter top installers, stone backsplash intallers, granite installers, marble installers, limestone installers, linoleum installers, slate contractors, slate installers,install tite ,backsplash , fire place veenerneed someone to install blacksplash , wall stone veener bath room mosaic,Bathroom Renovation, Bathroom renovation, bathroom remodeling, bathroom remodelling, renovating the bathroom, tearing out the bathroom, fixing up the bathroom, bathroom contractors, bathroom vanities, bathroom vanity, design of bathroom, bathroom and design, design for bathroom, design a bathroom, design a bath, bath design, bathroom tile, bathroom cabinets, remodeling a bathroom, bathroom remodeling, remodeling the bathroom, ,Bath renovation, New tub, caulking, ,Basement Renovation, Basement renovation, Basement remodeling, Basement remodelling, renovating your basement, renovation, waterproofing, remodeling, home renovation, house renovation, water in basement, basement waterproofing,finishing basement, moistureproof, remodeling the house, caulking,",1,2012-02-27T10:55:20.000-05:00,kasabella,FALSE,0,0,607,100,FALSE,1109f8444aea873fa3faa2e5416ba77dda1fd982,TRUE,2021-04-09T13:16:31.000-04:00,TRUE,TRUE,1866888,99.1208487934,442,NA,NA
https://homestars.com/on/schomberg/tile-stone-contractors,24,"c(""https://homestars.com/on/schomberg/tile-stone-contractors?&page=2&"", ""https://homestars.com/on/schomberg/tile-stone-contractors?&page=3&"")",Tile & Stone Contractors,2800376,http://www.stoneselex.com,/companies/2800376-stone-selex?searched_category_id=442&service_area=2121114,"Siding, Stucco, Stone, Brick, Masonry and Fireplaces
From design to installation, Stone Selex Design is a premier company with over 20 years of experience providing both residential and commercial customers with quality installation and a high level of customer satisfaction. 

Stone Selex Design is committed to providing full service installation for your exterior or interior stone veneer project. We also provide installation of stone veneer, stucco, brick, masonry and fireplace transformations. 
Design your own project with the NEW Stone Veneer Visualizer and have Stone Selex Design install it for you. The Visualizer gives you the ability to envision your project from the comfort of your computer screen. It has the power to transform a photo of your home into a professional digital rendering by adding siding, stucco and stone. 
Make your home the talk of the neighbourhood with stone and <a href=""http://en.wikipedia.org/wiki/Stucco"">stucco</a>, or stone and brick, or siding and <a href=""http://www.en.wikipedia.org/wiki/Brick"">brick</a>, stone tile and wood siding. The possibilities of style and colour combinations are endless. A Stone Selex Design project manager will help you with each stage of your project from where to add stone, stucco, siding, brick and <a href=""http://en.wikipedia.org/wiki/Masonry"">masonry</a> and provide you with a quote for our installation services provided by our experienced masonry installers.  
If it’s a fireplace that you want to create or just simply add stone or masonry, Stone Selex Design and the visualizer can help you with this too. While you are in the planning stages of your <a href="" http://en.wikipedia.org/wiki/Fireplace"">fireplaces</a> transformation the visualizer is a great tool to use. Look through photos for ideas and see what others are doing and then come to Stone Selex Design and ask us to install it for you.


Visit us here:
https://twitter.com/StoneSelex
https://www.facebook.com/StoneSelexInc/",stone-selex,2012-07-27T11:47:40.000-04:00,NA,"St. Catharines, Niagara Falls, Welland, Burlington, Hamilton, Oakville, Milton, Mississauga, Port Credit, Georgetown, Brampton, Bramalea, Etobicoke, Toronto, Willowdale, North York, Scarborough, Woodbridge, Maple, King City, Concord, Richmond Hill, Markham, Unionville, Stratford, Oshawa, Whitby, Clarington, Acton, Erin, Kitchener, Waterloo, Cambridge, Guelph, Brantford, Brant, Brockville, Woodstock, Barrie, Carp, Innisfil, Midland including Tay and Penetanguishene, Orillia, Ramara, Leamington including Kingsville, Sudbury, Chatham, Kent, London, Kingston, South Frontenac, Peterborough including Smith-Ennismore-Lakefield, Belleville, Cornwall, North Bay, Sault Ste. Marie, Kawartha Lake, Muskoka, Norfolk, Timmins, Owen Sound ","Monday to Friday 8am - 6pm, Saturday 10am - 3pm","Manufactured Stone, Decorative stone, Natural Stone Veneer, Canyon Stone Veneer, Canyon Brick Veneer, Stone Fireplace, Natural Stone, Stone Panel,Stone Wall,Home Stone, Cladding Stone ","Stone Installation, Exterior and Interior Installation, Stone Fireplace Package Installation, Stone Sales, Design Consultation, Free Quotation, Sample Board Rentals ","Canyon Stone, Canyon Stone Canada Natural Stone Veneer, DIMPLEX Electric Fireplaces","lightweight manufactured stone veneer, natural stone veneer, brick veneer, thin cut stone panel, interior stone, exterior stone, wall stone panels",2007,15,"Visa, Master Card, Debit, Cheque",,T85-3953274,"BILD, Canadian Home Builder's Association",TRUE,FALSE,,No Minimum,TRUE,FALSE,3 years,1863428,Stone Selex Design,164,139,147,9.54676,"Tile & Stone Contractors, Natural Stone Tile, Stone Floor Tile, Ceramic Tile, Floor tile, Tile installers, Stone installers, stone counter top installers, tile counter top installers, stone backsplash intallers, granite installers, marble installers, limestone installers, linoleum installers, slate contractors, slate installers,install tite ,backsplash , fire place veenerneed someone to install blacksplash , wall stone veener bath room mosaic,Masonry & Bricklaying, Masonry Supply, Masonry Contractor, Stone Masonry, Brick Laying, Technique, Brick Laying Pattern, stone wall, brick wall, masonry repair, brick repairs, masonry, brick masonry, masonry bricklaying, masonry work, mason contractors, york masonry, masonry companies, brick masonry construction, brick contractors, masonry brick laying, masonry workers, bricklaying firms, parging, ,Siding, vinyl siding, wood siding, exterior siding, aluminum siding, cedar shakes, cedar shingles, composite wood siding, seamless steel siding, wood clapboard, stone siding, brick siding, exterior, side, sides, how to siding, the siding, the other side, stucco,  how to vinyl siding, about vinyl siding, what is vinyl siding, in vinyl siding, vinyl siding how to, vinyl siding, siding vinyl, how to install vinyl, cement fiber, fiber cement, siding house, house with siding, siding on a house, what is siding on a house, siding for house, siding a house, how to siding a house, siding on house, house siding, siding for a house, ,Stucco, Stuccos, stucco contractor, stucco surface, exterior stucco, popcorn, popcorn ceiling, popcorn ceilings, popcorn ceiling removal,,Fireplaces, Electric Fireplace, Fireplace Mantel, Fireplace Chimney, Gas Fireplace, Fireplace Screen, Outdoor Fireplace, Fireplace Accessory, Ventless Fireplace, Fieplace Mantle, fireplace, the fireplace, fire place, fireplace stoves, fireplace chimney, fireplace gas, gas fireplace, fireplace heaters, gas fireplaces, fireplaces gas, wood fireplace, wood for fireplace, fireplace electric, electric fireplace, wood stove fireplace, fireplace hearth, electric fireplaces, fireplaces electric, fireplace heater, insert for fireplace, insert fireplace, fireplace insert, gas fireplaces and stoves, wood fireplaces, insert fireplaces, inserts for fireplaces, fireplaces inserts, wood burning fireplace, gas fireplace stoves, fireplace door, gas stove fireplace, fire places, fireplace screen, outdoor fireplace, fireplace outdoor, gas log, wood burning fireplaces, fireplace mantels, mantels for fireplace, fireplace mantle, fireplace mantels, ethanol fireplace, caulking,Interlocking Stone, Interlocking Tile, Stone, tiles for, landscaping, paving, pavers, paver, stone step, wall stone, stone wall, landscape design, patios, interlock, retaining wall, stepping stones, interlocking, landscaping ideas, retaining walls, paving stones, paver stones, pavers stones, pavers and stones, stones pavers, stones and pavers, flagstone, concrete design, landscapers, natural stone, paving stone, stone paving, stone paving stone, walls stone, patio designs, stone and tiles, tiles and stone, stone flagstones, slate tiles, slate tile, stone veneer, pavers stone, stone and pavers, stone pavers, paver stone, stone paver, concrete driveway, stone brick, stone and brick, brick and stone, stone flooring, stone patio, stone for patio,,",0,2014-05-07T16:31:42.000-04:00,stoneselex,FALSE,3,0,207,100,FALSE,8b6ea0190938baafcad801bd126a80361dd521e3,TRUE,2021-09-17T15:58:57.000-04:00,TRUE,TRUE,2121114,91.3599330583,442,NA,NA
https://homestars.com/on/schomberg/tile-stone-contractors,24,"c(""https://homestars.com/on/schomberg/tile-stone-contractors?&page=2&"", ""https://homestars.com/on/schomberg/tile-stone-contractors?&page=3&"")",Tile & Stone Contractors,2900429,http://www.summitcontractors.ca,/companies/2900429-summit-contractors?searched_category_id=442&service_area=2130342,"'Providing top-notch services at competitive prices for over 12 years across the GTA. Summit contractors have been awarded best of HomeStars contractors for three years in a row since 2018. We specialize in quality home improvement, renovation and remodeling including bathroom renovation, full basement renovation, kitchen renovation and heating and cooling. Our professional team consisting of operating and project management, in-house trades, licensed plumbers, electricians, HVAC technicians and renovation specialists enable us to fulfill our clients’ needs within the budget and timelines with precision, clarity, a unique understanding of the design-build process.'",summit-contractors,2017-08-06T22:32:00.000-04:00,NA,NA,NA,,"Construction services; Residential/Commercial sector. We Do Bathrooms, Kitchens, Basements, Decks, Cabinets, Countertops, Custom Home Building, Demolition, Disposal, Drywall, Taping, Plastering, Electrical, Plumbing, Fencing, Laminate floors, Hardwood floors, Carpet, Foundation wall, Retaining Wall, Garages, Sheds,  Handyman Services, Gas Fireplace Heating & Ventilation (subcontracted), Hot Tubs, Landscaping, Painting, Property Maintenance, Addition, Roofing, Sun Room, Carpentry, Framing, Tile, Water Proofing, Windows, Doors. Also provide a service for Home and business maintenance. We are your one stop shop for all your contracting needs.",,"Remodeling, Home renovation, Basement Finishing, Construction, Contracting services, Build, Design, Maintenance, Additions, Carpentry, Framing, Drywall, Basements, Washrooms, Kitchens, flooring, Painting, Demolition",2005,20,"Visa, MC, Cheques, Cash and e-transfer, Financing Available. ",,Plumbing & Electrical,,TRUE,FALSE,,,TRUE,FALSE,5 Years (Some Restriction may apply) ,1962808,Summit Contractors,109,94,148,9.80851,"General Contractors, Residential General Contractor, Building Contractor, Additions, Remodeling Contractor,  Renovation, Builder, building construction, renovation, remodeling, construction builders, construction company, construction companies, home repair, construction jobs, home remodeling, general contractors, contractors general, contractor general, contractors construction, construction contractors, home improvement and remodeling, kitchen remodeling, construction contractor, builders contractors, home renovation, general contracting, building contractors, building companies, home renovations, builder contractor, building contractor, remodeling contractor, commercial construction, residential construction, house contractor, concrete contractors, home contractors, general construction, construction general, contractors remodeling, remodeling contractors, remodelers, remodel contractor, remodel contractors, general contract, commercial contractors, renovations contractors, home improvement contractor, licensed contractor, license general contractor, mud room, mudroom, caulking, ,Bathroom Renovation, Bathroom renovation, bathroom remodeling, bathroom remodelling, renovating the bathroom, tearing out the bathroom, fixing up the bathroom, bathroom contractors, bathroom vanities, bathroom vanity, design of bathroom, bathroom and design, design for bathroom, design a bathroom, design a bath, bath design, bathroom tile, bathroom cabinets, remodeling a bathroom, bathroom remodeling, remodeling the bathroom, ,Bath renovation, New tub, caulking, ,Kitchen Planning & Renovation, Kitchen Planning And Design, Kitchen Cabinet Planning, Kitchen Design, Kitchen Remodeling, kitchen or, and bathroom, a and a kitchens, kitchens and, for kitchens, a kitchens, kitchens, the house design, cabinets for kitchen, cabinets for the kitchen, cabinets and kitchen, kitchen cabinets, design a kitchen, about kitchen design, a kitchen design, how to kitchen design, design and kitchen, the kitchen design, design for kitchen, kitchen designs, renovation and remodeling, remodeling and renovation, kitchen designer,,Kitchen Renovation, caulking, ,Tile & Stone Contractors, Natural Stone Tile, Stone Floor Tile, Ceramic Tile, Floor tile, Tile installers, Stone installers, stone counter top installers, tile counter top installers, stone backsplash intallers, granite installers, marble installers, limestone installers, linoleum installers, slate contractors, slate installers,install tite ,backsplash , fire place veenerneed someone to install blacksplash , wall stone veener bath room mosaic,Basement Renovation, Basement renovation, Basement remodeling, Basement remodelling, renovating your basement, renovation, waterproofing, remodeling, home renovation, house renovation, water in basement, basement waterproofing,finishing basement, moistureproof, remodeling the house, caulking,",0,2017-08-06T22:32:57.000-04:00,Summit,FALSE,0,0,565,0,FALSE,fa21281d10ee69597489f3b63b6202b950a69425,TRUE,2022-11-11T13:27:17.000-05:00,TRUE,TRUE,2130342,97.0513885302,442,NA,NA
https://homestars.com/on/schomberg/tile-stone-contractors,24,"c(""https://homestars.com/on/schomberg/tile-stone-contractors?&page=2&"", ""https://homestars.com/on/schomberg/tile-stone-contractors?&page=3&"")",Tile & Stone Contractors,2929989,http://showerrestorationtoronto.com/,/companies/2929989-shower-restoration-of-toronto?searched_category_id=442&service_area=2235923,"Shower Restoration of Toronto is committed to delivering outstanding customer service. Not only does the owner meet directly with each client to provide a free estimate, but he also returns directly to the site to complete the work himself.

We're a small local family run business which began operations in the early 2000's in Toronto, Ontario where we completed extensive training in the marble restoration industry. Our first work experience was varied and included large scale commercial marble repairs. Our customers were so impressed with our service, that when it came time to refinish or restore their bathrooms, they naturally turned to us.

We pride ourselves in continuing to deliver outstanding results in shower renovations.

Providing exceptional customer service in our hallmark. We respond to every inquiry as though you are the only client.",shower-restoration-of-toronto,2019-04-16T13:50:19.000-04:00,NA,NA,NA,,Residential ,,,NA,NA,"e-transfer, cash, cheque. All Card payments debit and credit",,,,TRUE,TRUE,,,TRUE,FALSE,,1992163,Shower Restoration Of Toronto ,41,40,38,9.95,"Tile & Stone Contractors, Natural Stone Tile, Stone Floor Tile, Ceramic Tile, Floor tile, Tile installers, Stone installers, stone counter top installers, tile counter top installers, stone backsplash intallers, granite installers, marble installers, limestone installers, linoleum installers, slate contractors, slate installers,install tite ,backsplash , fire place veenerneed someone to install blacksplash , wall stone veener bath room mosaic,Tile and Grout Cleaning, Tiles, grout, cleaning, ,",0,2019-04-16T13:51:21.000-04:00,,FALSE,0,0,18,0,FALSE,1cdfa1a186c41a40821517b1b46e0994bb687869,TRUE,2022-04-15T13:14:32.000-04:00,TRUE,TRUE,2235923,98.3549269468,442,NA,NA
