Link,n_hits,all_links,category,id,url,hs_path,profile,permalink,created_at,sic_code,service_area,hours,products,services,brands,specialities,established,employee_cnt,payment_method,diplomas,licenses,memberships,liability_insurance,bonded,project_rate,project_minimum,written_contract,written_warranty,warranty_terms,parent_company_id,name,total_number_of_reviews_cache,total_number_of_approved_reviews_cache,number_of_photos_cache,avg_rating_cache,categories_info_cache,savings_count,subdomain,fraudulent,fraudulent_count,total_number_of_pending_reviews_cache,images_count,completion_percent_cache,bully,secret,replied_to_at_least_one_review_cache,has_set_tasks,lead_purchase_eligible,service_area_id,star_score,quote_button_category,direct_phone,direct_contact
https://homestars.com/on/namao/interior-decorators,1,https://homestars.com/on/namao/interior-decorators,Interior Decorators,2868705,https://www.freshlookdesignbylori.com/,/companies/2868705-fresh-look-design?searched_category_id=389&service_area=2025282,"AT FRESH LOOK DESIGN, IT’S ALL ABOUT YOU!

INTERIOR DECORATING

We help homeowners elevate their homes so they can come home to a space that they enjoy and want to spend time in.  By working with them, they can save time, energy, stay on budget and have it done right the first time.

At Fresh Look Design, our mission is simple - We strive to offer a relationship-based approach to Interior Design. By listening and understanding our client’s ideas, goals and budget to ensure your home is functional, stylish and cohesive. 

We specialize in Custom Blinds, Shades and Window Treatments.

Livening Up Your Living Spaces since 2004!

REAL ESTATE STAGING

We help your Buyers fall in love with your property.  Did you know that approximately 40% of all active listings expire?  The difference between listing or selling your property is how it looks to Buyers.  The way you live in your home is not necessarily what the Buyer is looking for.

We neutralize your house so that it appeals to the most Buyers in the market.  It also involves showcasing the selling features, traffic flow, sight lines, spaciousness and value of the property.

Our professional advice helps you hang onto more of your hard-earned equity. Real Estate Staging is valuable in both a Buyer’s and Seller’s market.  In a Buyer’s market, it will make your property stand out and sell faster.  In a Seller’s market, it is the difference between an offer and multiple offers.

We help you uncover the hidden potential of your property and boost your Buyer appeal!",fresh-look-design,2015-04-06T15:47:57.000-04:00,NA,NA,NA,Blinds & Shades,"Interior Decorating, Home Staging, Blinds & Shades, On-line Artwork and Accessories Store",Shade-O-Matic,"Blinds & Shades
On-line accessory and artwork store @ www.freshlookdesign.store.",2004,NA,"Debit, Visa, Mastercard",,"St. Albert, Edmonton",,TRUE,TRUE,,,TRUE,FALSE,,1931129,Fresh Look Design,1,1,38,10,"Interior Decorators, Home Decorators, Holiday Decorators, decorating, what is interior design, about interior design, house designs, interiors, designer interior, interior designer, house design, decorating ideas, interiordesign, designers interior, interior designers, la interior designers, decoration interior, interior decoration, room design, design a room, kitchen cabinets, interior decoration design, interior design decoration, interior design and decoration, interior decoration and design, decorating interior, what is interior decorating, about interior decorating, interior decorating, decorator, decorators, house decor, home furnishings, in home furnishings, decoration ideas, house decorating, home decorating, kitchen design, interior decorating design, interior design and decorating, interior decorating and design, home furnishings, interior home, home interior, home accessories, house interior, interior decorator, interior decorator in, and interior decorator, decorator interior, ,Interior Design, Home Interior Designers, Kitchen Interior Design, interior, what is interior design, about interior design, design interior, interior by design, home designs, interior designer, designer interior, how to be a interior designer, what is an interior designer, home design, decorating ideas, design and decorating, decorating and design, interior designers, interior decoration, room design, interior design decoration, interior decorating, house decorating, home decorating, desings homes, interior design decorating, interior decorating design, decorating and interior design, home building plans, decorating tips, room designs, design homes, decorating design ideas, design photos, interior house, interior decorator, bedroom design, architecture design, bedroom designs, careers in design, interior designs, office design, architectural design, ,Home Staging, Home Staging, Real Estate Staging, House Staging, staging a house for sale, staging a home for sale, fluffing a house, fluffing a home, home fluffer, house fluffer, decorate, furniture rental,",0,freshlookdesign,FALSE,0,0,43,0,FALSE,efc214fc009e667f3eaf3ba4c378766f8b2f2933,TRUE,TRUE,TRUE,2025282,90.5741758242,389,NA,NA
