Link,n_hits,all_links,category,id,url,hs_path,profile,permalink,created_at,sic_code,service_area,hours,products,services,brands,specialities,established,employee_cnt,payment_method,diplomas,licenses,memberships,liability_insurance,bonded,project_rate,project_minimum,written_contract,written_warranty,warranty_terms,parent_company_id,name,total_number_of_reviews_cache,total_number_of_approved_reviews_cache,number_of_photos_cache,avg_rating_cache,categories_info_cache,savings_count,claimed_at,subdomain,fraudulent,fraudulent_count,total_number_of_pending_reviews_cache,images_count,completion_percent_cache,bully,secret,replied_to_at_least_one_review_cache,latest_approved_review_created_at,has_set_tasks,lead_purchase_eligible,service_area_id,star_score,quote_button_category,direct_phone,direct_contact
https://homestars.com/on/fulton/duct-cleaning,7,https://homestars.com/on/fulton/duct-cleaning,Duct Cleaning,2904655,http://airforceduct.com/,/companies/2904655-air-force-duct-cleaning?searched_category_id=346&service_area=2286980,"For Air Force COVID-19 - Infectious Disease Preparedness Response Plan, pls see: 
https://www.airforceduct.com/covid-19.html

We are fully open for business and are here to talk with you and assist you with your cleaning needs. 

**** Air Force Duct Cleaning is a certified & locally owned company that specializes in residential Air Ducts cleaning ****

We have been providing comfort & Order for your busy lifestyle since 2003. Our Cleaning equipment are truck mounted, Cleans Deeper.  We guarantee you the most professional and thorough Air Duct Cleaning Ever or its FREE. Guaranteed. We accept VISA, Master Card, AMEX, Cheques & Cash. 

For upfront no hidden cost pricing: http://www.airforceduct.com/online-quote.html",air-force-duct-cleaning,2017-11-10T15:33:31.000-05:00,NA,NA,NA,,Air Duct Cleaning,,Air Duct Cleaning ,2003,10,"VISA, Master Card, AMEX, Cheques & Cash ",,,,TRUE,TRUE,http://www.airforceduct.com/online-quote.html,,TRUE,FALSE,Ask Us about our LOVE IT or DON'T PAY Guarantee,1966840,Air Force Duct Cleaning,975,919,340,9.94453,"Duct Cleaning, Air Duct Cleaning, Furnace Duct Cleaning, vent cleaning, air vent cleaning, duct, ducts, air duct, duct air, cleaning the air, cleaning air, what is duct cleaning, cleaning duct, air ducts, cleaning ducts, cleaning the ducts, ducts cleaning, ducts and vents, vent cleaning, cleaning vent, air conditioning duct, what is air duct cleaning, air duct cleaning in, air duct cleaning, cleaning air duct, duct cleaning company, duct cleaning price, ac duc cleaning, duct cleaning prices, duct and carpet cleaning, duct cleaning canada, home air duct cleaning, air duct cleaning services reviews, residential duct cleaning, how much is duct cleaning, professional duct cleaning toronto, home duct cleaning services, heating duct cleaning, duct cleaning machine, professional duct cleaning, duct clean, hvac duct cleaning, duct cleaning service, duck cleaning, ducts cleaning, fresh air duct cleaning, commercial duct cleaning, industrial duct cleaning, canada duct cleaning, duct cleaning costs,",0,2017-11-10T15:36:37.000-05:00,AirForce,FALSE,0,0,57,0,FALSE,3c1ea32e0ae4818578adfd949a155aa4568bb476,TRUE,2022-11-20T08:42:24.000-05:00,TRUE,TRUE,2286980,99.4742251385,346,NA,NA
https://homestars.com/on/fulton/duct-cleaning,7,https://homestars.com/on/fulton/duct-cleaning,Duct Cleaning,2798983,https://www.davesducts.com,/companies/2798983-davesducts?searched_category_id=346&service_area=1951969,"DAVESDUCTS (formerly DAVE'S DUCT CLEANING)are CERTIFIED members of the NATIONAL AIR DUCT CLEANER'S ASSOCIATION (NADCA), HRAI, TSSA and Ambassadors of the QUALIFIED AIR DUCT CLEANING AFFILIATION (QUADCA) We are also an ACCREDITED BUSINESS listed with the BETTER BUSINESS BUREAU (BBB), AN OFFICIAL BAEUMLER APPROVED CONTRACTOR an OFFICIAL AIR MILES Reward Miles Sponsor and are the OFFICIAL DUCT CLEANING PARTNERS of HABITAT FOR HUMANITY Durham and Greater Toronto Area.

SERVICES INCLUDE: Furnace and AC Repair, Service and Installation, Tankless Water Heater Installation, HVAC installation and Design, Indoor Air Quality, AEROSEAL Duct Sealing and NADCA Certified Duct Cleaning

STANDARDIZED PRICING: $379 + tax up to 16 vents, each additional vent is $5

Give us a call at 416-668-4607 or email info@davesducts.com, we PROMISE we won't let you down!

-----------
FOLLOW US ON INSTAGRAM! www.instagram.com/davesducts
LIKE US ON FACEBOOK!
https://www.facebook.com/davesductsinc",davesducts,2012-06-19T17:37:50.000-04:00,NA,"DID YOU KNOW?
<br />- our rate is standardized for residential duct cleaning: $299 + hst up to 15 vents, each additional vent is $5.
<br />- for crawlspaces, multiple furnaces, condos, commercial buildings, industrial spaces, furnace blower/ac coil cleaning and dryer vent cleaning - please call 416-668-4607 or email info@davesducts.com
<br />- we want you to be happy with our service, if there is anything that you are not happy with before, during or after our service; let us know - we'll be happy to correct it; we want you to know that we value your business and will always ensure we perform this service properly and thoroughly for you and your home.
<br />- we encourage you to shadow us as we work; we have nothing to hide; we want you to know everything about the work we are doing in your home so if you've got questions...ask away!
<br />- all our air duct cleaning technicians have passed numerous background checks for your security, comfort and peace of mind!  We are all BackCheck verified!
<br />- we believe that consumers have the right to know everything about the services they're receiving in their home; QUADCA was created to help and protect consumers from ""blow and go"" air duct cleaning companies - we are the official QUADCA Ambassador for the Greater Toronto Area.  Visit www.quadca.com for more information!
<br />- for a company to be considered NADCA certified, they are only required to have 1 ASCS (Air Systems Cleaning Specialist); We have EIGHT (8) ASCS Technicians and NINE (9) VMTs (Ventilation Maintenance Technicians) to serve you and your home!
<br />- we also have (6) SIX CVI (Certified Ventilation Inspectors) on staff that can inspect your residential, commercial or industrial HVAC systems.
<br />- NADCA publishes the names of individuals that hold the ASCS designation, make sure your home is being cleaned by a certified and qualified individual; to find out if your technician is certified, please visit: www.nadca.com
<br />- ASCS is the HIGHEST level of certification you can possess; VMT is the bare MINIMUM level of certification your cleaning technician should possess
<br />- We will only send ASCS cleaning technicians to perform our service in your home!
<br />- we DO NOT sub-contract our work and DO NOT telemarket
<br />- we maintain 3 vehicles, 1 inspection vehicle and have 10 employees on payroll with full health benefits
<br />- we are members of WSIB and have $5M in comprehensive business liability insurance
<br />- we provide PROOF OF WORK by taking before/after pictures;  this is the only way we know an HVAC system is thoroughly cleaned!
<br />- your service should take between 2-3 hours with a 2 person crew (based on a 2000-3000 sq ft home)
<br />- we are only able to accommodate 3 jobs maximum per day per vehicle
<br />- if a job takes longer than anticipated to complete, we will always stay as long as it takes to complete the job properly and will always advise our customers accordingly
<br />- your service can be performed with either truck mounted, van mounted or portable HEPA filtered vacuums; all these machines conform to NADCA standards and will yield the same results: CHECK OUT THIS VIDEO: http://bit.ly/1h78y0X
<br />- the length of time it takes to clean an HVAC system is NOT dependent on type of equipment used; provided equipment conforms to NADCA standards
<br />- time it takes to clean an HVAC system is dependent on: 1) ACCESS 2) SIZE OF HVAC  SYSTEM 3) TYPE OF HVAC SYSTEM 4) OTHER SERVICES PERFORMED - each HVAC system is different and should be treated as such!
<br />- NADCA certified professionals have the ability to properly assess, maintain and restore all types of HVAC systems
<br />- your vents should always be sealed during the cleaning process
<br />- when done properly, your HVAC system need not be cleaned for at least 5-7 years (under normal living conditions).
<br />- for more information, we've compiled various resources (videos and cleaning standards) to educate you and your family better, copy and paste the following link: http://www.davesducts.com/faq/consumer-education<br/>

<br/>To view our service area map, copy and paste the following link: http://bit.ly/U3Pt5c<br/>

<br/>For references (as early as today) or questions about your HVAC system or just to say 'hello' - please call! (416) 668-4607 or visit: www.davesducts.com - WE LOOK FORWARD TO SERVING YOU AND YOUR HOME!",8:30am - 3pm (We budget 3 jobs MAX per vehicle per day),"AMAIRCARE PORTABLE HEPA FILTERS, WHOLE HOUSE HEPA FILTERS, AEROSEAL DUCT SEALING, DRYER VENT CLEANING, CENTRAL VAC, FURNACE & AC COIL CLEANING","AEROSEAL DUCT SEALING, RESIDENTIAL AND COMMERCIAL AIR DUCT CLEANING, DRYER VENT CLEANING, INDOOR AIR QUALITY ANALYSIS, FURNACE CLEANING, FILTER MAINTENANCE, CAMERA INSPECTION, ROBOTIC INSPECTION, CENTRAL VAC CLEANING, SANITIZING AND DEODORIZING","AMAIRCARE, AEROSEAL, BOSCH, AMANA, GOODMAN, DAIKIN","NADCA CERTIFIED (www.nadca.com), QUADCA AMBASSADORS (www.quadca.com), VENTILATION MAINTENANCE TECHNICAN, AIR SYSTEMS CLEANING SPECIALIST, VENTILATION SYSTEMS MOLD REMEDIATOR, CERTIFIED VENTILATION INVESTIGATOR, AEROSEAL Certified Technicians and TSSA Licensed G2 Technicians.",2011,12,"VISA, MASTERCARD, AMEX, DEBIT, CASH",UNIVERSITY OF TORONTO (COMPUTER SCIENCE & ENGLISH),"G2 TSSA LICENSE, VMT, ASCS, VSMR, CVI CERTIFICATIONS FROM NADCA (www.nadca.com)","TSSA, HRAI, NADCA, QUADCA, WSIB, BBB, BILD, CHBA, OHBA, DHBA, BAEUMLER APPROVED and AIRMILES SPONSOR",TRUE,FALSE,,"$379 + HST upto 16 vents, each additional vent is $5 (for RESIDENTIAL AIR DUCT CLEANING)",TRUE,FALSE,AMAIRCARE HEPA FILTERS - 5 YEAR LIMITED WARRANTY REUSABLE FILTERS - LIFETIME MANUFACTURER'S WARRANTY,1862035,Davesducts,1128,935,274,9.94759,"Duct Cleaning, Air Duct Cleaning, Furnace Duct Cleaning, vent cleaning, air vent cleaning, duct, ducts, air duct, duct air, cleaning the air, cleaning air, what is duct cleaning, cleaning duct, air ducts, cleaning ducts, cleaning the ducts, ducts cleaning, ducts and vents, vent cleaning, cleaning vent, air conditioning duct, what is air duct cleaning, air duct cleaning in, air duct cleaning, cleaning air duct, duct cleaning company, duct cleaning price, ac duc cleaning, duct cleaning prices, duct and carpet cleaning, duct cleaning canada, home air duct cleaning, air duct cleaning services reviews, residential duct cleaning, how much is duct cleaning, professional duct cleaning toronto, home duct cleaning services, heating duct cleaning, duct cleaning machine, professional duct cleaning, duct clean, hvac duct cleaning, duct cleaning service, duck cleaning, ducts cleaning, fresh air duct cleaning, commercial duct cleaning, industrial duct cleaning, canada duct cleaning, duct cleaning costs,Heating & Air Conditioning, Air Conditioning Installation, Air Conditioning Repair, Heating Oil, Heating System, heat, furnace, a/c, air conditioning, air conditioner, ac air conditioning, air conditioners, furnace, furnaces, airconditioner, lenneox, airconditioning, hvac, what is hvac, air condition, trane, hvac air conditioning, air conditioning hvac, a heating and air, air heating, heating & air, heating and air, heating air, heat pump, air conditioning units, air conditioning unit, unit air conditioning, air conditioner unit, air conditioner units, heating & cooling, heating and cooling, heating cooling, cooling and heating, system heating, heating system, air conditioning cooling, heat and air, heat air, heat & air, air and heat, air conditioning and heating, heating and air conditioning, air conditioning heating, air conditioning & heating, a and a heating and air conditioning, heating air conditioning, heat pumps, airconditioners, systems heating, heating systems, portable air conditioner, cooling system, Furnace Humidifier,  heating and cooling contractors, heat pump installation, home heating, heating ventilation and air conditioning, hvac industry, residential heat pump, heating services, heating contractor, homes heating, central heat, heat sources,  new heating systems, industrial air conditioning, radiant floor heating,  floor heating, central cooling and heating systems, residential heating, heat pump installers,  thermostat, in floor heating, ductless heat pump, programmable thermostat, mini split heat pump, heated floors, hvac systems, hvac technician, what is a heat pump, climate control, what does hvac stand for, electric heating, electric floor heating, new furnace, heat and temperature, h vac, heatpump, hvac design, electric heat, central heating, hvac engineer, home heating systems, hvac supply, thermo stat, heat pumps prices, heat pump efficiency, split heat pump, hvac maintenance, in floor heating cost, electric heat pumps, boiler heating systems, hvac unit, hvac mechanic, hvac repair, commercial hvac, hvac installation, heated tile floor, hvac specialist, hvac services, types of heating systems, hvac tech, air con unit,  air conditioner, canada air conditioner, air condition unit, air conditioning canada, portable air conditioner, room air conditioning, mobile air conditioning, portable ac, indoor air conditioner,",14,2012-06-19T17:37:50.000-04:00,davesducts,FALSE,0,0,305,100,FALSE,8a47af9a8ca5542d6bd8dd068c80975a2c9d4804,TRUE,2022-11-18T18:19:34.000-05:00,TRUE,TRUE,1951969,96.951365032,346,NA,NA
https://homestars.com/on/fulton/duct-cleaning,7,https://homestars.com/on/fulton/duct-cleaning,Duct Cleaning,2846806,http://www.steamdrycanada.com/,/companies/2846806-steam-dry-canada?searched_category_id=346&service_area=2115495,"At Steam Dry Canada, our customers are our business. Whether it is our carpet, upholstery, area rug, furnace and duct cleaning, indoor air quality division or the flood rescue division, we strive to give our customers superior, detailed and precise results. Our service technicians will provide these superior services with integrity and sincere customer service. We don't send salespeople into our customers homes, we send qualified technicians that are focused on meeting and exceeding our customers expectations. We want to give our customers the most enjoyable in-home service that they have ever received and we are not satisfied until our customers are satisfied, guaranteed.",steam-dry-canada,2013-12-22T13:40:18.000-05:00,NA,,,,"Carpet Cleaning, Air Duct Cleaning, Furnace Cleaning, Upholstery Cleaning, Area Rug Cleaning",,,2002,80,"Visa, MasterCard, Debit",,,BBB,TRUE,TRUE,,,TRUE,FALSE,,1909242,Steam Dry Canada,795,596,4,9.01846,"Duct Cleaning, Air Duct Cleaning, Furnace Duct Cleaning, vent cleaning, air vent cleaning, duct, ducts, air duct, duct air, cleaning the air, cleaning air, what is duct cleaning, cleaning duct, air ducts, cleaning ducts, cleaning the ducts, ducts cleaning, ducts and vents, vent cleaning, cleaning vent, air conditioning duct, what is air duct cleaning, air duct cleaning in, air duct cleaning, cleaning air duct, duct cleaning company, duct cleaning price, ac duc cleaning, duct cleaning prices, duct and carpet cleaning, duct cleaning canada, home air duct cleaning, air duct cleaning services reviews, residential duct cleaning, how much is duct cleaning, professional duct cleaning toronto, home duct cleaning services, heating duct cleaning, duct cleaning machine, professional duct cleaning, duct clean, hvac duct cleaning, duct cleaning service, duck cleaning, ducts cleaning, fresh air duct cleaning, commercial duct cleaning, industrial duct cleaning, canada duct cleaning, duct cleaning costs,Carpet & Rug Cleaning & Repairing, Carpet Cleaning, Carpet Cleaners, Rug Cleaning, rug cleaners, area rug cleaners, area rug cleaning, persian rug cleaning, Rug repair, carpet repair, persian rug repair, persian carpet repair, area rug repair, carpet rug cleaning, oriental rug cleaning, area rug cleaning service, rug cleaning and repair, professional rug cleaning, carpet and rug cleaning, rug cleaning services, wool rug cleaning, rug cleaning service, carpet cleaning repair, rug cleaning company, rug clean, industrial carpet cleaning, area rug cleaning services, ,Drapery & Upholstery Cleaning, soft furnishing cleaning, curtain cleaning, drape cleaning, drapes cleaning, blind cleaning, furniture cleaning, upholstery cleaning, sofa cleaning, chesterfield cleaning, armchair cleaning, ,Drapery & Curtains, Drapery, Custom Drapery, Blinds, Curtain Rods, Drapery Hardware, Curtain stores, Drapes, custom window coverings, drapery fabric, soft furnishings, roman blinds, custom blinds,  custom curtains, the curtain, curtain, curtains, drapery, drapes, drapery curtain, curtain drapery, drapery and curtain, curtain and drapery, drapery curtains, curtains and drapery, curtains drapery, drapery and curtains, valence, drapes and curtains, curtains drapes, curtains & drapes, curtains and drapes, drapes curtains, drapes & curtains, draperies, curtain and drapes, ,",0,2014-04-08T14:34:25.000-04:00,steamdrycanada,FALSE,0,0,5,0,FALSE,d23b0390300260ae42109efb5ef01c1743a9e154,TRUE,2022-08-11T10:26:57.000-04:00,TRUE,TRUE,2115495,88.7436719826,346,NA,NA
https://homestars.com/on/fulton/duct-cleaning,7,https://homestars.com/on/fulton/duct-cleaning,Duct Cleaning,2859204,http://www.integratedcleanair.com,/companies/2859204-integrated-clean-air-services?searched_category_id=346&service_area=1991245,"***Please note that we are an essential service and are open during the Covid-19 pandemic.***

Integrated Clean Air Services is certified by the North American Duct Cleaning Association or NADCA. 
We provide ""Health care for your indoor air"". 
We can not only clean your air ducts and dryer vent cleaning, but we also provide IAQ (indoor air quality) testing for both residential and commercial clients. 

We were founded in 2004 and have an A+ rating with the Better Business Bureau (BBB). 
We pride ourselves in the way we do business. 
Our owner, Stephen Worrall, is one of only 14 Certified Ventilation Inspectors (CVI) in Ontario. 
He serves on the Industry, Public Relations committee and is a founding member of the Anti-Fraud task force for NADCA. 
He also serves on the Small Business committee for the Oakville Chamber of Commerce. 

Give us a call today for a free quote.
905-741-0670",integrated-clean-air-services,2014-09-15T09:34:55.000-04:00,NA,"Residential clients: Mississauga, Oakville, Burlington, Milton and the Hamilton area. 
<br />Commercial clients: greater southern Ontario ",9am - 8pm 7 days,Suppy and install Sanuvox air purification systems and Amaircare Hepa filters,"Air duct and dryer vent cleaning
Indoor Air Qualtiy Testing 
Mould Testing
Asbestos Testing
Radon radiation measurement",,,2004,3,"E-transfer, Debit, Cash, cheque, Visa, Mastercard",ASCS VSMR CVI CRT,"NADCA, IICRC","NADCA, BBB, IICRC, Oakville Chamber of Commerce, CARST",TRUE,TRUE,,,FALSE,FALSE,"100% Satisfaction Guaranteed. If it's not right, we will clean it again for free. ",1921634,Integrated Clean Air Services,152,128,46,9.98438,"Duct Cleaning, Air Duct Cleaning, Furnace Duct Cleaning, vent cleaning, air vent cleaning, duct, ducts, air duct, duct air, cleaning the air, cleaning air, what is duct cleaning, cleaning duct, air ducts, cleaning ducts, cleaning the ducts, ducts cleaning, ducts and vents, vent cleaning, cleaning vent, air conditioning duct, what is air duct cleaning, air duct cleaning in, air duct cleaning, cleaning air duct, duct cleaning company, duct cleaning price, ac duc cleaning, duct cleaning prices, duct and carpet cleaning, duct cleaning canada, home air duct cleaning, air duct cleaning services reviews, residential duct cleaning, how much is duct cleaning, professional duct cleaning toronto, home duct cleaning services, heating duct cleaning, duct cleaning machine, professional duct cleaning, duct clean, hvac duct cleaning, duct cleaning service, duck cleaning, ducts cleaning, fresh air duct cleaning, commercial duct cleaning, industrial duct cleaning, canada duct cleaning, duct cleaning costs,",2,NA,integratedclean,FALSE,0,0,34,0,FALSE,cab7f0b164fb952b74d65f0823dde87e0d97e93b,TRUE,2022-06-01T15:27:00.000-04:00,TRUE,TRUE,1991245,99.3056227378,346,NA,NA
https://homestars.com/on/fulton/duct-cleaning,7,https://homestars.com/on/fulton/duct-cleaning,Duct Cleaning,2565511,http://www.superioradc.com,/companies/2565511-superior-air-duct-cleaning?searched_category_id=346&service_area=2163534,Providing the GTA with the best certified services in Air Duct Cleaning and Indoor Air Quality related products and services. Full written guarantees on all of our products and services.,superior-air-duct-cleaning,2008-03-04T16:55:15.000-05:00,NA,We service the entire GTA with no travel fees guaranteed!!,,"WE provide filter replacements for any furnace, humidifier or air cleaner ever manufactured as well as upgraded filtration units and central humidifers.","Providing top quality duct cleaning services in:
Residential and commercial HVAC systems, dryer exhausts, kitchen exhausts, bathroom exhausts, make up air systems, slab coil units, vacuum extraction systems and much more. Please contact us to find out more.","We carry only quality brands such as Honeywell, April Aire, General Aire, Amair Care, Dustfree and more....","We are a company specializing in performing thorough and efficient cleanings of HVAC and other duct systems with a strong emphasis on customer relationships from start to
 finish.",2004,7,We are a NADCA (HVAC Inspection Maintenance and Restoration Association) certfied company with trained ASCS (Air System Cleaning Specialists) on staff,,"We are members of NADCA, the Better Business Bureau and the Indoor Air Quality Association.","We are fully Insured and Bonded up to $1,000,000 of Liability coverage. Proof available upon request",TRUE,TRUE,WE provide written agreements for Residential and commercial applications at no charge.,"We are fully Insured and Bonded up to $2,000,000 of Liability coverage. Proof available upon request",TRUE,FALSE,We provide a written 30 day guarantee on all of our services with upon completion of service.,1628563,Superior Air Duct Cleaning,145,135,15,9.82222,"Duct Cleaning, Air Duct Cleaning, Furnace Duct Cleaning, vent cleaning, air vent cleaning, duct, ducts, air duct, duct air, cleaning the air, cleaning air, what is duct cleaning, cleaning duct, air ducts, cleaning ducts, cleaning the ducts, ducts cleaning, ducts and vents, vent cleaning, cleaning vent, air conditioning duct, what is air duct cleaning, air duct cleaning in, air duct cleaning, cleaning air duct, duct cleaning company, duct cleaning price, ac duc cleaning, duct cleaning prices, duct and carpet cleaning, duct cleaning canada, home air duct cleaning, air duct cleaning services reviews, residential duct cleaning, how much is duct cleaning, professional duct cleaning toronto, home duct cleaning services, heating duct cleaning, duct cleaning machine, professional duct cleaning, duct clean, hvac duct cleaning, duct cleaning service, duck cleaning, ducts cleaning, fresh air duct cleaning, commercial duct cleaning, industrial duct cleaning, canada duct cleaning, duct cleaning costs,",1,2010-07-19T07:54:07.000-04:00,superiorair,FALSE,0,0,15,100,FALSE,b659c5018425727e7f997fd7129ba22b911c3d1a,TRUE,2021-06-01T09:14:16.000-04:00,TRUE,TRUE,2163534,97.9550940709,346,NA,NA
https://homestars.com/on/fulton/duct-cleaning,7,https://homestars.com/on/fulton/duct-cleaning,Duct Cleaning,2578842,https://www.nationalduct.ca,/companies/2578842-power-vac-ontario?searched_category_id=346&service_area=2181290,Welcome to Power Vac Ontario. We've been providing  professional Duct Cleaning Services since 1966. We specialize in residential and commercial/industrial services. We Feature INGRAD Vacuum Technology on our Vacuum Trucks. Repeat business and word of mouth referrals is the foundation of our business model. ,power-vac-ontario,2008-03-04T16:55:15.000-05:00,NA,,,,"Air Duct Cleaning Services
Dryer Duct Cleaning",,,1966,47,"E-Transfer, Cash, Cheque, All Major Credit Cards",,,"Nadca, Better Business Bureau",TRUE,TRUE,,,TRUE,FALSE,"Yes, ask for details. ",1641894,Power Vac Ontario,109,94,13,9.8617,"Duct Cleaning, Air Duct Cleaning, Furnace Duct Cleaning, vent cleaning, air vent cleaning, duct, ducts, air duct, duct air, cleaning the air, cleaning air, what is duct cleaning, cleaning duct, air ducts, cleaning ducts, cleaning the ducts, ducts cleaning, ducts and vents, vent cleaning, cleaning vent, air conditioning duct, what is air duct cleaning, air duct cleaning in, air duct cleaning, cleaning air duct, duct cleaning company, duct cleaning price, ac duc cleaning, duct cleaning prices, duct and carpet cleaning, duct cleaning canada, home air duct cleaning, air duct cleaning services reviews, residential duct cleaning, how much is duct cleaning, professional duct cleaning toronto, home duct cleaning services, heating duct cleaning, duct cleaning machine, professional duct cleaning, duct clean, hvac duct cleaning, duct cleaning service, duck cleaning, ducts cleaning, fresh air duct cleaning, commercial duct cleaning, industrial duct cleaning, canada duct cleaning, duct cleaning costs,",0,2011-04-14T14:00:23.000-04:00,powervacontario,FALSE,0,0,14,NA,FALSE,c04ee98ca285c8c0e4a05b25743f75079c9fa728,TRUE,2020-10-06T14:38:44.000-04:00,TRUE,TRUE,2181290,88.7012539051,346,NA,NA
