Link,n_hits,all_links,category,id,url,hs_path,profile,permalink,created_at,sic_code,service_area,hours,products,services,brands,specialities,established,employee_cnt,payment_method,diplomas,licenses,memberships,liability_insurance,bonded,project_rate,project_minimum,written_contract,written_warranty,warranty_terms,parent_company_id,name,total_number_of_reviews_cache,total_number_of_approved_reviews_cache,number_of_photos_cache,avg_rating_cache,categories_info_cache,savings_count,subdomain,fraudulent,fraudulent_count,total_number_of_pending_reviews_cache,images_count,completion_percent_cache,bully,secret,replied_to_at_least_one_review_cache,latest_approved_review_created_at,has_set_tasks,lead_purchase_eligible,service_area_id,star_score,quote_button_category,direct_phone,direct_contact
https://homestars.com/on/oxford-station/electricians,1,https://homestars.com/on/oxford-station/electricians,Electricians,2886952,http://www.litelectric.ca/,/companies/2886952-lit-electric-inc?searched_category_id=348&service_area=2276086,"We are a licensed and ESA certified electrical contractor operating in the Ottawa/ Ottawa South region. 

We do new buids, tenant fitups, renovations and service work. Please visit our website at: www.litelectric.ca


ESA Contractor # 7010902

We're social here:
https://www.facebook.com/LitElectric/",lit-electric-inc,2016-05-04T20:30:30.000-04:00,NA,NA,NA,,,,,2015,NA,"Cash, Cheque and e-transfer",,ESA Contractor # 7010902,,TRUE,FALSE,,$215,TRUE,FALSE,Yes. Kindly ask for details. Depends on service completed. ,1949376,Lit Electric Inc,28,27,33,10,"Electricians, Residential Electricians, Electrical Contractors, Electrical Wiring, knob and tube contractors, electrician, which electrician, electrical companies, electrical work, electrical contractors, jobs electrician, electrical contractor, electrical services, electric contractors, electric contractor, generator, generators, ,",0,litelectric,FALSE,0,0,32,0,FALSE,afdc98f838f4831fb06acc26f419e66896a1d2eb,TRUE,2019-03-18T11:32:37.000-04:00,TRUE,TRUE,2276086,98.2465017148,348,NA,NA
