Link,n_hits,all_links,category,id,url,hs_path,profile,permalink,created_at,sic_code,service_area,hours,products,services,brands,specialities,established,employee_cnt,payment_method,diplomas,licenses,memberships,liability_insurance,bonded,project_rate,project_minimum,written_contract,written_warranty,warranty_terms,parent_company_id,name,total_number_of_reviews_cache,total_number_of_approved_reviews_cache,number_of_photos_cache,avg_rating_cache,categories_info_cache,savings_count,claimed_at,subdomain,fraudulent,fraudulent_count,total_number_of_pending_reviews_cache,images_count,completion_percent_cache,bully,secret,replied_to_at_least_one_review_cache,latest_approved_review_created_at,has_set_tasks,lead_purchase_eligible,service_area_id,star_score,quote_button_category,direct_phone,direct_contact
https://homestars.com/on/kars/alarm-systems,69,"c(""https://homestars.com/on/kars/alarm-systems?&page=2&"", ""https://homestars.com/on/kars/alarm-systems?&page=3&"", ""https://homestars.com/on/kars/alarm-systems?&page=4&"", ""https://homestars.com/on/kars/alarm-systems?&page=5&"", ""https://homestars.com/on/kars/alarm-systems?&page=6&"", ""https://homestars.com/on/kars/alarm-systems?&page=7&"")",Alarm Systems,2868973,NA,/companies/2868973-imranili?searched_category_id=303&service_area=2026466,NA,imranili,2015-04-12T01:54:40.000-04:00,NA,NA,NA,NA,NA,NA,NA,NA,NA,NA,NA,NA,NA,FALSE,FALSE,NA,NA,FALSE,FALSE,NA,1931397,Imranili,0,0,0,NA,"Alarm Systems, Home Alarm Systems, Alarm System Monitoring, Fire Alarm Systems, Home Security Systems, The Alarm, At Home Security, Home Security, Security Systems, Alarm Security, Security Alarm, Security Cameras, Security Company, Security Companies, Home alarm, Alarm home, Alarm security, House security, house alarm, burglar alarm, carbon monoxide, carbon monoxide alarms, business cameras, commercial surveillance systems, surveillance, commercial security cameras, commercial security camera,,",0,NA,NA,FALSE,0,0,0,0,FALSE,8daccb2988c74e65ef8e2247c85a93fa68017371,FALSE,NA,FALSE,FALSE,2026466,-1.0,303,NA,NA
https://homestars.com/on/kars/alarm-systems,69,"c(""https://homestars.com/on/kars/alarm-systems?&page=2&"", ""https://homestars.com/on/kars/alarm-systems?&page=3&"", ""https://homestars.com/on/kars/alarm-systems?&page=4&"", ""https://homestars.com/on/kars/alarm-systems?&page=5&"", ""https://homestars.com/on/kars/alarm-systems?&page=6&"", ""https://homestars.com/on/kars/alarm-systems?&page=7&"")",Alarm Systems,2783041,NA,/companies/2783041-adt-security-services?searched_category_id=303&service_area=1837153,"Find home security and home surveillance products from ADT. Get expert advice, a free home security review, and home security products. Your home security needs will be met with ADT Security System's reliable service & latest technologies.",adt-security-services,2010-12-16T20:15:03.000-05:00,NA,,"Mon-Sun, 9 am-11 pm",NA,NA,NA,NA,NA,NA,NA,NA,NA,NA,FALSE,FALSE,NA,NA,FALSE,FALSE,NA,1846093,ADT Security Services - No Longer in Business,11,6,0,8,"Alarm Systems, Home Alarm Systems, Alarm System Monitoring, Fire Alarm Systems, Home Security Systems, The Alarm, At Home Security, Home Security, Security Systems, Alarm Security, Security Alarm, Security Cameras, Security Company, Security Companies, Home alarm, Alarm home, Alarm security, House security, house alarm, burglar alarm, carbon monoxide, carbon monoxide alarms, business cameras, commercial surveillance systems, surveillance, commercial security cameras, commercial security camera,,",0,2010-12-16T20:15:05.000-05:00,NA,FALSE,0,0,0,NA,FALSE,4dc971a2ea264d0ed6fb81361d9bf8d53fa3456e,FALSE,2013-03-17T21:31:38.000-04:00,FALSE,FALSE,1837153,11.9182881606,303,NA,NA
https://homestars.com/on/kars/alarm-systems,69,"c(""https://homestars.com/on/kars/alarm-systems?&page=2&"", ""https://homestars.com/on/kars/alarm-systems?&page=3&"", ""https://homestars.com/on/kars/alarm-systems?&page=4&"", ""https://homestars.com/on/kars/alarm-systems?&page=5&"", ""https://homestars.com/on/kars/alarm-systems?&page=6&"", ""https://homestars.com/on/kars/alarm-systems?&page=7&"")",Alarm Systems,2640948,NA,/companies/2640948-chubb?searched_category_id=303&service_area=1654152,NA,chubb,2008-03-04T16:55:15.000-05:00,NA,NA,NA,NA,NA,NA,NA,NA,NA,NA,NA,NA,NA,FALSE,FALSE,NA,NA,FALSE,FALSE,NA,1704000,Chubb,0,0,0,NA,"Alarm Systems, Home Alarm Systems, Alarm System Monitoring, Fire Alarm Systems, Home Security Systems, The Alarm, At Home Security, Home Security, Security Systems, Alarm Security, Security Alarm, Security Cameras, Security Company, Security Companies, Home alarm, Alarm home, Alarm security, House security, house alarm, burglar alarm, carbon monoxide, carbon monoxide alarms, business cameras, commercial surveillance systems, surveillance, commercial security cameras, commercial security camera,,",0,NA,NA,FALSE,0,0,0,NA,FALSE,NA,FALSE,NA,FALSE,FALSE,1654152,-1.0,303,NA,NA
https://homestars.com/on/kars/alarm-systems,69,"c(""https://homestars.com/on/kars/alarm-systems?&page=2&"", ""https://homestars.com/on/kars/alarm-systems?&page=3&"", ""https://homestars.com/on/kars/alarm-systems?&page=4&"", ""https://homestars.com/on/kars/alarm-systems?&page=5&"", ""https://homestars.com/on/kars/alarm-systems?&page=6&"", ""https://homestars.com/on/kars/alarm-systems?&page=7&"")",Alarm Systems,2650487,NA,/companies/2650487-global-securite-inc?searched_category_id=303&service_area=1663691,NA,global-securite-inc,2008-03-04T16:55:15.000-05:00,NA,NA,NA,NA,NA,NA,NA,NA,NA,NA,NA,NA,NA,FALSE,FALSE,NA,NA,FALSE,FALSE,NA,1713539,Global S,0,0,0,NA,"Alarm Systems, Home Alarm Systems, Alarm System Monitoring, Fire Alarm Systems, Home Security Systems, The Alarm, At Home Security, Home Security, Security Systems, Alarm Security, Security Alarm, Security Cameras, Security Company, Security Companies, Home alarm, Alarm home, Alarm security, House security, house alarm, burglar alarm, carbon monoxide, carbon monoxide alarms, business cameras, commercial surveillance systems, surveillance, commercial security cameras, commercial security camera,,",0,NA,NA,FALSE,0,0,0,NA,FALSE,NA,FALSE,NA,FALSE,FALSE,1663691,-1.0,303,NA,NA
https://homestars.com/on/kars/alarm-systems,69,"c(""https://homestars.com/on/kars/alarm-systems?&page=2&"", ""https://homestars.com/on/kars/alarm-systems?&page=3&"", ""https://homestars.com/on/kars/alarm-systems?&page=4&"", ""https://homestars.com/on/kars/alarm-systems?&page=5&"", ""https://homestars.com/on/kars/alarm-systems?&page=6&"", ""https://homestars.com/on/kars/alarm-systems?&page=7&"")",Alarm Systems,2604509,NA,/companies/2604509-a-all-security-a-toute-securite-inc?searched_category_id=303&service_area=1617713,NA,a-all-security-a-toute-securite-inc,2008-03-04T16:55:15.000-05:00,NA,NA,NA,NA,NA,NA,NA,NA,NA,NA,NA,NA,NA,FALSE,FALSE,NA,NA,FALSE,FALSE,NA,1667561,A All Security/A Toute S,0,0,0,NA,"Alarm Systems, Home Alarm Systems, Alarm System Monitoring, Fire Alarm Systems, Home Security Systems, The Alarm, At Home Security, Home Security, Security Systems, Alarm Security, Security Alarm, Security Cameras, Security Company, Security Companies, Home alarm, Alarm home, Alarm security, House security, house alarm, burglar alarm, carbon monoxide, carbon monoxide alarms, business cameras, commercial surveillance systems, surveillance, commercial security cameras, commercial security camera,,",0,NA,NA,FALSE,0,0,0,NA,FALSE,NA,FALSE,NA,FALSE,FALSE,1617713,-1.0,303,NA,NA
https://homestars.com/on/kars/alarm-systems,69,"c(""https://homestars.com/on/kars/alarm-systems?&page=2&"", ""https://homestars.com/on/kars/alarm-systems?&page=3&"", ""https://homestars.com/on/kars/alarm-systems?&page=4&"", ""https://homestars.com/on/kars/alarm-systems?&page=5&"", ""https://homestars.com/on/kars/alarm-systems?&page=6&"", ""https://homestars.com/on/kars/alarm-systems?&page=7&"")",Alarm Systems,2575813,NA,/companies/2575813-accurate-security-authorized-voxcom-dlr?searched_category_id=303&service_area=1589017,NA,accurate-security-authorized-voxcom-dlr,2008-03-04T16:55:15.000-05:00,NA,NA,NA,NA,NA,NA,NA,NA,NA,NA,NA,NA,NA,FALSE,FALSE,NA,NA,FALSE,FALSE,NA,1638865,Accurate Security Authorized Voxcom Dlr,0,0,0,NA,"Alarm Systems, Home Alarm Systems, Alarm System Monitoring, Fire Alarm Systems, Home Security Systems, The Alarm, At Home Security, Home Security, Security Systems, Alarm Security, Security Alarm, Security Cameras, Security Company, Security Companies, Home alarm, Alarm home, Alarm security, House security, house alarm, burglar alarm, carbon monoxide, carbon monoxide alarms, business cameras, commercial surveillance systems, surveillance, commercial security cameras, commercial security camera,,",0,NA,NA,FALSE,0,0,0,NA,FALSE,NA,FALSE,NA,FALSE,FALSE,1589017,-1.0,303,NA,NA
https://homestars.com/on/kars/alarm-systems,69,"c(""https://homestars.com/on/kars/alarm-systems?&page=2&"", ""https://homestars.com/on/kars/alarm-systems?&page=3&"", ""https://homestars.com/on/kars/alarm-systems?&page=4&"", ""https://homestars.com/on/kars/alarm-systems?&page=5&"", ""https://homestars.com/on/kars/alarm-systems?&page=6&"", ""https://homestars.com/on/kars/alarm-systems?&page=7&"")",Alarm Systems,2762888,NA,/companies/2762888-apa-systemes?searched_category_id=303&service_area=1776092,NA,apa-systemes,2008-03-04T16:55:15.000-05:00,NA,NA,NA,NA,NA,NA,NA,NA,NA,NA,NA,NA,NA,FALSE,FALSE,NA,NA,FALSE,FALSE,NA,1825940,APA Systemes,0,0,0,NA,"Alarm Systems, Home Alarm Systems, Alarm System Monitoring, Fire Alarm Systems, Home Security Systems, The Alarm, At Home Security, Home Security, Security Systems, Alarm Security, Security Alarm, Security Cameras, Security Company, Security Companies, Home alarm, Alarm home, Alarm security, House security, house alarm, burglar alarm, carbon monoxide, carbon monoxide alarms, business cameras, commercial surveillance systems, surveillance, commercial security cameras, commercial security camera,,",0,NA,NA,FALSE,0,0,0,NA,FALSE,NA,FALSE,NA,FALSE,FALSE,1776092,-1.0,303,NA,NA
https://homestars.com/on/kars/alarm-systems,69,"c(""https://homestars.com/on/kars/alarm-systems?&page=2&"", ""https://homestars.com/on/kars/alarm-systems?&page=3&"", ""https://homestars.com/on/kars/alarm-systems?&page=4&"", ""https://homestars.com/on/kars/alarm-systems?&page=5&"", ""https://homestars.com/on/kars/alarm-systems?&page=6&"", ""https://homestars.com/on/kars/alarm-systems?&page=7&"")",Alarm Systems,2632414,NA,/companies/2632414-amesos-drasis-response-centers-inc?searched_category_id=303&service_area=1645618,NA,amesos-drasis-response-centers-inc,2008-03-04T16:55:15.000-05:00,NA,NA,NA,NA,NA,NA,NA,NA,NA,NA,NA,NA,NA,FALSE,FALSE,NA,NA,FALSE,FALSE,NA,1695466,Amesos Drasis Response Centers Inc,0,0,0,NA,"Alarm Systems, Home Alarm Systems, Alarm System Monitoring, Fire Alarm Systems, Home Security Systems, The Alarm, At Home Security, Home Security, Security Systems, Alarm Security, Security Alarm, Security Cameras, Security Company, Security Companies, Home alarm, Alarm home, Alarm security, House security, house alarm, burglar alarm, carbon monoxide, carbon monoxide alarms, business cameras, commercial surveillance systems, surveillance, commercial security cameras, commercial security camera,,",0,NA,NA,FALSE,0,0,0,NA,FALSE,NA,FALSE,NA,FALSE,FALSE,1645618,-1.0,303,NA,NA
https://homestars.com/on/kars/alarm-systems,69,"c(""https://homestars.com/on/kars/alarm-systems?&page=2&"", ""https://homestars.com/on/kars/alarm-systems?&page=3&"", ""https://homestars.com/on/kars/alarm-systems?&page=4&"", ""https://homestars.com/on/kars/alarm-systems?&page=5&"", ""https://homestars.com/on/kars/alarm-systems?&page=6&"", ""https://homestars.com/on/kars/alarm-systems?&page=7&"")",Alarm Systems,2646010,NA,/companies/2646010-deslauriers-lionel-les-entreprises?searched_category_id=303&service_area=1659214,NA,deslauriers-lionel-les-entreprises,2008-03-04T16:55:15.000-05:00,NA,NA,NA,NA,NA,NA,NA,NA,NA,NA,NA,NA,NA,FALSE,FALSE,NA,NA,FALSE,FALSE,NA,1709062,DesLauriers Lionel Les Entreprises,0,0,0,NA,"Alarm Systems, Home Alarm Systems, Alarm System Monitoring, Fire Alarm Systems, Home Security Systems, The Alarm, At Home Security, Home Security, Security Systems, Alarm Security, Security Alarm, Security Cameras, Security Company, Security Companies, Home alarm, Alarm home, Alarm security, House security, house alarm, burglar alarm, carbon monoxide, carbon monoxide alarms, business cameras, commercial surveillance systems, surveillance, commercial security cameras, commercial security camera,,",0,NA,NA,FALSE,0,0,0,NA,FALSE,NA,FALSE,NA,FALSE,FALSE,1659214,-1.0,303,NA,NA
https://homestars.com/on/kars/alarm-systems,69,"c(""https://homestars.com/on/kars/alarm-systems?&page=2&"", ""https://homestars.com/on/kars/alarm-systems?&page=3&"", ""https://homestars.com/on/kars/alarm-systems?&page=4&"", ""https://homestars.com/on/kars/alarm-systems?&page=5&"", ""https://homestars.com/on/kars/alarm-systems?&page=6&"", ""https://homestars.com/on/kars/alarm-systems?&page=7&"")",Alarm Systems,2754241,NA,/companies/2754241-gps-securite?searched_category_id=303&service_area=1767445,NA,gps-securite,2008-03-04T16:55:15.000-05:00,NA,NA,NA,NA,NA,NA,NA,NA,NA,NA,NA,NA,NA,FALSE,FALSE,NA,NA,FALSE,FALSE,NA,1817293,Gps S,0,0,0,NA,"Alarm Systems, Home Alarm Systems, Alarm System Monitoring, Fire Alarm Systems, Home Security Systems, The Alarm, At Home Security, Home Security, Security Systems, Alarm Security, Security Alarm, Security Cameras, Security Company, Security Companies, Home alarm, Alarm home, Alarm security, House security, house alarm, burglar alarm, carbon monoxide, carbon monoxide alarms, business cameras, commercial surveillance systems, surveillance, commercial security cameras, commercial security camera,,",0,NA,NA,FALSE,0,0,0,NA,FALSE,NA,FALSE,NA,FALSE,FALSE,1767445,-1.0,303,NA,NA
https://homestars.com/on/kars/alarm-systems,69,"c(""https://homestars.com/on/kars/alarm-systems?&page=2&"", ""https://homestars.com/on/kars/alarm-systems?&page=3&"", ""https://homestars.com/on/kars/alarm-systems?&page=4&"", ""https://homestars.com/on/kars/alarm-systems?&page=5&"", ""https://homestars.com/on/kars/alarm-systems?&page=6&"", ""https://homestars.com/on/kars/alarm-systems?&page=7&"")",Alarm Systems,2653246,NA,/companies/2653246-in-telcam-peter-mclean?searched_category_id=303&service_area=1666450,NA,in-telcam-peter-mclean,2008-03-04T16:55:15.000-05:00,NA,NA,NA,NA,NA,NA,NA,NA,NA,NA,NA,NA,NA,FALSE,FALSE,NA,NA,FALSE,FALSE,NA,1716298,In Telcam Peter Mclean,0,0,0,NA,"Alarm Systems, Home Alarm Systems, Alarm System Monitoring, Fire Alarm Systems, Home Security Systems, The Alarm, At Home Security, Home Security, Security Systems, Alarm Security, Security Alarm, Security Cameras, Security Company, Security Companies, Home alarm, Alarm home, Alarm security, House security, house alarm, burglar alarm, carbon monoxide, carbon monoxide alarms, business cameras, commercial surveillance systems, surveillance, commercial security cameras, commercial security camera,,",0,NA,NA,FALSE,0,0,0,NA,FALSE,NA,FALSE,NA,FALSE,FALSE,1666450,-1.0,303,NA,NA
https://homestars.com/on/kars/alarm-systems,69,"c(""https://homestars.com/on/kars/alarm-systems?&page=2&"", ""https://homestars.com/on/kars/alarm-systems?&page=3&"", ""https://homestars.com/on/kars/alarm-systems?&page=4&"", ""https://homestars.com/on/kars/alarm-systems?&page=5&"", ""https://homestars.com/on/kars/alarm-systems?&page=6&"", ""https://homestars.com/on/kars/alarm-systems?&page=7&"")",Alarm Systems,2660348,NA,/companies/2660348-p-c-s-sdi?searched_category_id=303&service_area=1673552,NA,p-c-s-sdi,2008-03-04T16:55:15.000-05:00,NA,NA,NA,NA,NA,NA,NA,NA,NA,NA,NA,NA,NA,FALSE,FALSE,NA,NA,FALSE,FALSE,NA,1723400,P C S Sdi,0,0,0,NA,"Alarm Systems, Home Alarm Systems, Alarm System Monitoring, Fire Alarm Systems, Home Security Systems, The Alarm, At Home Security, Home Security, Security Systems, Alarm Security, Security Alarm, Security Cameras, Security Company, Security Companies, Home alarm, Alarm home, Alarm security, House security, house alarm, burglar alarm, carbon monoxide, carbon monoxide alarms, business cameras, commercial surveillance systems, surveillance, commercial security cameras, commercial security camera,,",0,NA,NA,FALSE,0,0,0,NA,FALSE,NA,FALSE,NA,FALSE,FALSE,1673552,-1.0,303,NA,NA
https://homestars.com/on/kars/alarm-systems,69,"c(""https://homestars.com/on/kars/alarm-systems?&page=2&"", ""https://homestars.com/on/kars/alarm-systems?&page=3&"", ""https://homestars.com/on/kars/alarm-systems?&page=4&"", ""https://homestars.com/on/kars/alarm-systems?&page=5&"", ""https://homestars.com/on/kars/alarm-systems?&page=6&"", ""https://homestars.com/on/kars/alarm-systems?&page=7&"")",Alarm Systems,2604517,NA,/companies/2604517-abstract-technologies?searched_category_id=303&service_area=1617721,NA,abstract-technologies,2008-03-04T16:55:15.000-05:00,NA,NA,NA,NA,NA,NA,NA,NA,NA,NA,NA,NA,NA,FALSE,FALSE,NA,NA,FALSE,FALSE,NA,1667569,Abstract Technologies,0,0,0,NA,"Alarm Systems, Home Alarm Systems, Alarm System Monitoring, Fire Alarm Systems, Home Security Systems, The Alarm, At Home Security, Home Security, Security Systems, Alarm Security, Security Alarm, Security Cameras, Security Company, Security Companies, Home alarm, Alarm home, Alarm security, House security, house alarm, burglar alarm, carbon monoxide, carbon monoxide alarms, business cameras, commercial surveillance systems, surveillance, commercial security cameras, commercial security camera,,",0,NA,NA,FALSE,0,0,0,NA,FALSE,NA,FALSE,NA,FALSE,FALSE,1617721,-1.0,303,NA,NA
https://homestars.com/on/kars/alarm-systems,69,"c(""https://homestars.com/on/kars/alarm-systems?&page=2&"", ""https://homestars.com/on/kars/alarm-systems?&page=3&"", ""https://homestars.com/on/kars/alarm-systems?&page=4&"", ""https://homestars.com/on/kars/alarm-systems?&page=5&"", ""https://homestars.com/on/kars/alarm-systems?&page=6&"", ""https://homestars.com/on/kars/alarm-systems?&page=7&"")",Alarm Systems,2645568,NA,/companies/2645568-b-sure-security-ltd?searched_category_id=303&service_area=1658772,NA,b-sure-security-ltd,2008-03-04T16:55:15.000-05:00,NA,NA,NA,NA,NA,NA,NA,NA,NA,NA,NA,NA,NA,FALSE,FALSE,NA,NA,FALSE,FALSE,NA,1708620,B Sure Security Ltd,0,0,0,NA,"Alarm Systems, Home Alarm Systems, Alarm System Monitoring, Fire Alarm Systems, Home Security Systems, The Alarm, At Home Security, Home Security, Security Systems, Alarm Security, Security Alarm, Security Cameras, Security Company, Security Companies, Home alarm, Alarm home, Alarm security, House security, house alarm, burglar alarm, carbon monoxide, carbon monoxide alarms, business cameras, commercial surveillance systems, surveillance, commercial security cameras, commercial security camera,,",0,NA,NA,FALSE,0,0,0,NA,FALSE,NA,FALSE,NA,FALSE,FALSE,1658772,-1.0,303,NA,NA
https://homestars.com/on/kars/alarm-systems,69,"c(""https://homestars.com/on/kars/alarm-systems?&page=2&"", ""https://homestars.com/on/kars/alarm-systems?&page=3&"", ""https://homestars.com/on/kars/alarm-systems?&page=4&"", ""https://homestars.com/on/kars/alarm-systems?&page=5&"", ""https://homestars.com/on/kars/alarm-systems?&page=6&"", ""https://homestars.com/on/kars/alarm-systems?&page=7&"")",Alarm Systems,2645567,NA,/companies/2645567-boxma-total-security-inc?searched_category_id=303&service_area=1658771,NA,boxma-total-security-inc,2008-03-04T16:55:15.000-05:00,NA,NA,NA,NA,NA,NA,NA,NA,NA,NA,NA,NA,NA,FALSE,FALSE,NA,NA,FALSE,FALSE,NA,1708619,Boxma Total Security Inc,0,0,0,NA,"Alarm Systems, Home Alarm Systems, Alarm System Monitoring, Fire Alarm Systems, Home Security Systems, The Alarm, At Home Security, Home Security, Security Systems, Alarm Security, Security Alarm, Security Cameras, Security Company, Security Companies, Home alarm, Alarm home, Alarm security, House security, house alarm, burglar alarm, carbon monoxide, carbon monoxide alarms, business cameras, commercial surveillance systems, surveillance, commercial security cameras, commercial security camera,,",0,NA,NA,FALSE,0,0,0,NA,FALSE,NA,FALSE,NA,FALSE,FALSE,1658771,-1.0,303,NA,NA
https://homestars.com/on/kars/alarm-systems,69,"c(""https://homestars.com/on/kars/alarm-systems?&page=2&"", ""https://homestars.com/on/kars/alarm-systems?&page=3&"", ""https://homestars.com/on/kars/alarm-systems?&page=4&"", ""https://homestars.com/on/kars/alarm-systems?&page=5&"", ""https://homestars.com/on/kars/alarm-systems?&page=6&"", ""https://homestars.com/on/kars/alarm-systems?&page=7&"")",Alarm Systems,2595382,NA,/companies/2595382-gms-securite-communication?searched_category_id=303&service_area=1608586,NA,gms-securite-communication,2008-03-04T16:55:15.000-05:00,NA,NA,NA,NA,NA,NA,NA,NA,NA,NA,NA,NA,NA,FALSE,FALSE,NA,NA,FALSE,FALSE,NA,1658434,GMS S,0,0,0,NA,"Alarm Systems, Home Alarm Systems, Alarm System Monitoring, Fire Alarm Systems, Home Security Systems, The Alarm, At Home Security, Home Security, Security Systems, Alarm Security, Security Alarm, Security Cameras, Security Company, Security Companies, Home alarm, Alarm home, Alarm security, House security, house alarm, burglar alarm, carbon monoxide, carbon monoxide alarms, business cameras, commercial surveillance systems, surveillance, commercial security cameras, commercial security camera,,",0,NA,NA,FALSE,0,0,0,NA,FALSE,NA,FALSE,NA,FALSE,FALSE,1608586,-1.0,303,NA,NA
https://homestars.com/on/kars/alarm-systems,69,"c(""https://homestars.com/on/kars/alarm-systems?&page=2&"", ""https://homestars.com/on/kars/alarm-systems?&page=3&"", ""https://homestars.com/on/kars/alarm-systems?&page=4&"", ""https://homestars.com/on/kars/alarm-systems?&page=5&"", ""https://homestars.com/on/kars/alarm-systems?&page=6&"", ""https://homestars.com/on/kars/alarm-systems?&page=7&"")",Alarm Systems,2658949,NA,/companies/2658949-ontario-alarm-and-protection-services-ltd?searched_category_id=303&service_area=1672153,NA,ontario-alarm-and-protection-services-ltd,2008-03-04T16:55:15.000-05:00,NA,NA,NA,NA,NA,NA,NA,NA,NA,NA,NA,NA,NA,FALSE,FALSE,NA,NA,FALSE,FALSE,NA,1722001,Ontario Alarm and Protection Services Ltd,0,0,0,NA,"Alarm Systems, Home Alarm Systems, Alarm System Monitoring, Fire Alarm Systems, Home Security Systems, The Alarm, At Home Security, Home Security, Security Systems, Alarm Security, Security Alarm, Security Cameras, Security Company, Security Companies, Home alarm, Alarm home, Alarm security, House security, house alarm, burglar alarm, carbon monoxide, carbon monoxide alarms, business cameras, commercial surveillance systems, surveillance, commercial security cameras, commercial security camera,,",0,NA,NA,FALSE,0,0,0,NA,FALSE,NA,FALSE,NA,FALSE,FALSE,1672153,-1.0,303,NA,NA
https://homestars.com/on/kars/alarm-systems,69,"c(""https://homestars.com/on/kars/alarm-systems?&page=2&"", ""https://homestars.com/on/kars/alarm-systems?&page=3&"", ""https://homestars.com/on/kars/alarm-systems?&page=4&"", ""https://homestars.com/on/kars/alarm-systems?&page=5&"", ""https://homestars.com/on/kars/alarm-systems?&page=6&"", ""https://homestars.com/on/kars/alarm-systems?&page=7&"")",Alarm Systems,2670121,NA,/companies/2670121-systmes-de-securite-chubb?searched_category_id=303&service_area=1683325,NA,systmes-de-securite-chubb,2008-03-04T16:55:15.000-05:00,NA,NA,NA,NA,NA,NA,NA,NA,NA,NA,NA,NA,NA,FALSE,FALSE,NA,NA,FALSE,FALSE,NA,1733173,Syst,0,0,0,NA,"Alarm Systems, Home Alarm Systems, Alarm System Monitoring, Fire Alarm Systems, Home Security Systems, The Alarm, At Home Security, Home Security, Security Systems, Alarm Security, Security Alarm, Security Cameras, Security Company, Security Companies, Home alarm, Alarm home, Alarm security, House security, house alarm, burglar alarm, carbon monoxide, carbon monoxide alarms, business cameras, commercial surveillance systems, surveillance, commercial security cameras, commercial security camera,,",0,NA,NA,FALSE,0,0,0,NA,FALSE,NA,FALSE,NA,FALSE,FALSE,1683325,-1.0,303,NA,NA
https://homestars.com/on/kars/alarm-systems,69,"c(""https://homestars.com/on/kars/alarm-systems?&page=2&"", ""https://homestars.com/on/kars/alarm-systems?&page=3&"", ""https://homestars.com/on/kars/alarm-systems?&page=4&"", ""https://homestars.com/on/kars/alarm-systems?&page=5&"", ""https://homestars.com/on/kars/alarm-systems?&page=6&"", ""https://homestars.com/on/kars/alarm-systems?&page=7&"")",Alarm Systems,2671562,NA,/companies/2671562-tri-ed-ltd?searched_category_id=303&service_area=1684766,NA,tri-ed-ltd,2008-03-04T16:55:15.000-05:00,NA,NA,NA,NA,NA,NA,NA,NA,NA,NA,NA,NA,NA,FALSE,FALSE,NA,NA,FALSE,FALSE,NA,1734614,Tri-Ed Ltd,0,0,0,NA,"Alarm Systems, Home Alarm Systems, Alarm System Monitoring, Fire Alarm Systems, Home Security Systems, The Alarm, At Home Security, Home Security, Security Systems, Alarm Security, Security Alarm, Security Cameras, Security Company, Security Companies, Home alarm, Alarm home, Alarm security, House security, house alarm, burglar alarm, carbon monoxide, carbon monoxide alarms, business cameras, commercial surveillance systems, surveillance, commercial security cameras, commercial security camera,,",0,NA,NA,FALSE,0,0,0,NA,FALSE,NA,FALSE,NA,FALSE,FALSE,1684766,-1.0,303,NA,NA
