Link,n_hits,all_links,category,id,url,hs_path,profile,permalink,created_at,sic_code,service_area,hours,products,services,brands,specialities,established,employee_cnt,payment_method,diplomas,licenses,memberships,liability_insurance,bonded,project_rate,project_minimum,written_contract,written_warranty,warranty_terms,parent_company_id,name,total_number_of_reviews_cache,total_number_of_approved_reviews_cache,number_of_photos_cache,avg_rating_cache,categories_info_cache,savings_count,subdomain,fraudulent,fraudulent_count,total_number_of_pending_reviews_cache,images_count,completion_percent_cache,bully,secret,replied_to_at_least_one_review_cache,latest_approved_review_created_at,has_set_tasks,lead_purchase_eligible,service_area_id,star_score,quote_button_category,direct_phone,direct_contact,claimed_at
https://homestars.com/on/cedar-valley/paint-wallpaper-contractors,90,"c(""https://homestars.com/on/cedar-valley/paint-wallpaper-contractors?&page=2&"", ""https://homestars.com/on/cedar-valley/paint-wallpaper-contractors?&page=3&"", ""https://homestars.com/on/cedar-valley/paint-wallpaper-contractors?&page=4&"", ""https://homestars.com/on/cedar-valley/paint-wallpaper-contractors?&page=5&"", ""https://homestars.com/on/cedar-valley/paint-wallpaper-contractors?&page=6&"", ""https://homestars.com/on/cedar-valley/paint-wallpaper-contractors?&page=7&"", ""https://homestars.com/on/cedar-valley/paint-wallpaper-contractors?&page=8&"", 
""https://homestars.com/on/cedar-valley/paint-wallpaper-contractors?&page=9&"")",Paint & Wallpaper Contractors,2865799,https://www.wow1day.com/locations/house-painting-york/,/companies/2865799-wow-1-day-painting-york-durham-region?searched_category_id=409&service_area=2013795,"THE PAINTING COMPANY WITH THE 1 DAY DIFFERENCE 

Imagine leaving for work in the morning and coming home to a freshly painted space. That’s exactly what you’ll experience with WOW 1 DAY PAINTING. We’ve perfected our painting process, which means we’re able to give you a quality paint job in just 1 day. Our customers love us because we really deliver on our promise of SPEED + QUALITY = WOW.

Here’s what you can expect when you work with our painting company:

Friendly, uniformed painters who truly care - NO Sub-Contractors like many of our competitors
Exceptional communication
Jobs that start and finish on time

A PAINTING COMPANY LIKE NO OTHER

At WOW 1 DAY PAINTING, we offer a fast, high-quality solution for all of your interior or exterior residential and commercial painting projects. 

What makes us different from other painting companies? Our smart painting process and precision house painters eliminate all of the hassle and mess you usually get with painting projects. Here’s the secret: We make sure to bring enough painters to complete the work quickly, so you can get a freshly painted space without the disruption you typically see with large painting projects.

Remember when you go with Home Painters we value your business and referrals and are committed to getting it done right the first time. GUARANTEED!

Why use WOW 1 DAY PAINTING to paint your house/office?

• LIFETIME GUARANTEE On All Interior Painting
• Full Workplace Safety Insurance Board (WSIB)
• 5 Million Liability Insurance
• Fully Bonded Workers
• 10+ Years Experience in the Painting Industry
• Thousands of Satisfied Clients
• Top Quality Paints 
• Paper & Drop sheets to Protect Your Floors and Belongings
• 100% Satisfaction Guaranteed!!

Interior Painting Services Include:

• Painting (i.e. walls, trim, doors, floors, ceilings, etc.)
• Staining (i.e. banisters, hardwood floors, cabinets, etc.)
• Faux finishing
• Stucco Painting and Repair
• Wallpapering and Removal
• Drywall Repair and Replacement
• Plaster

Exterior Painting Services Include:

• Painting Exterior Surfaces (ie. windows, brick, doors, eaves, soffits, aluminum siding, etc.)
• Deck/Fence Staining and Refinishing
• Power Washing
• Caulking
",wow-1-day-painting-york-durham-region,2015-02-04T12:19:44.000-05:00,NA,"Vaughan, King City, Woodbridge, Newmarket, Aurora, East Gwillimbury, Richmond Hill, Thornhill, Markham and the surrounding GTA",7am-9pm,Sherwin Williams & Benjamin Moore full product lines,"Interior painting, exterior painting, residential painting, commercial painting, plaster repair, drywall repair and installation, handyman projects, condo painting, townhouse painting, stucco ceiling flattening, wallpaper installation, wallpaper removal, kitchen cabinet painting, kitchen cabinet spraying, staircase painting, staircase staining, carpentry, crown moulding installation, trim installations, custom carpentry solutions, exterior wood repair, colour consultations, aluminum siding painting, brick painting, deck staining, fence painting, exterior caulking, interior caulking, storefront painting, office painting, home renovations.","Top quality brands from Sherwin Williams, Benjamin Moore, Dulux and many other specialty suppliers.","SPEED + QUALITY = WOW

If we say your project will be done in 1 day. It will. We guarantee it!
",2012,25,"Cheque, Credit Card*, Interac",Carleton University & Sheridan College Graduate,WSIB,Markham Board of Trade,TRUE,TRUE,$1000 minimum,$1000,TRUE,FALSE,2 Year Warranty - Certain conditions apply,1928224,WOW 1 DAY PAINTING  York & Durham Region,589,541,239,9.72458,"Paint & Wallpaper Contractors, Paint Colors, Paint Store, Paint Brush, Paint Shop, Home Wallpaper,Wallpaper, Paint colour advice, paint colour consultants, wallpapering, painter, faux, painters painting, painters paint, business painting, find painting, painting and restoration, new jersey painting, oh painting, local painting, wall paper repair, ,",0,wow1day-york,FALSE,0,0,251,0,FALSE,81a3af54dd3995f6ebcf166993523a6591e69724,TRUE,2022-08-08T18:22:21.000-04:00,TRUE,TRUE,2013795,97.3538961025,409,NA,NA,NA
https://homestars.com/on/cedar-valley/paint-wallpaper-contractors,90,"c(""https://homestars.com/on/cedar-valley/paint-wallpaper-contractors?&page=2&"", ""https://homestars.com/on/cedar-valley/paint-wallpaper-contractors?&page=3&"", ""https://homestars.com/on/cedar-valley/paint-wallpaper-contractors?&page=4&"", ""https://homestars.com/on/cedar-valley/paint-wallpaper-contractors?&page=5&"", ""https://homestars.com/on/cedar-valley/paint-wallpaper-contractors?&page=6&"", ""https://homestars.com/on/cedar-valley/paint-wallpaper-contractors?&page=7&"", ""https://homestars.com/on/cedar-valley/paint-wallpaper-contractors?&page=8&"", 
""https://homestars.com/on/cedar-valley/paint-wallpaper-contractors?&page=9&"")",Paint & Wallpaper Contractors,2778508,http://www.encorepaintingltd.com,/companies/2778508-encore-painting-ltd?searched_category_id=409&service_area=2269532,"Interior Painting
We understand that we are guests in your house. The utmost respect is paid to maintaining an environment that is as safe and clean as possible.

Preparation
We use clean plastic drop sheets on all furniture.
Durable canvas drop sheets cover the floor.
During sanding, plastic sheets will be taped over entrances to contain the dust.
If requested by customer, all holes and cracks are filled and feather sanded to ensure all edges are smoothed.
Finish Coat

Top grade paints are applied to ensure quality and a job that is washable and durable.
All cut lines and edging are neat and clean.

Commercial
We know that your company’s appearance leaves a lasting impression with your clients, and with the help of experienced painters, you can make it a great one. We understand that work must go on in the work place so we endeavour to work around your business schedule. We do this by painting one room at a time or scheduling weekend work to make sure your business is not disturbed.

No VOC (volatile organic compound) paints are used, keeping office air fresh and healthy for all employees. From start to finish, your commercial painting project will receive attention to detail that only experience can offer.
Back to Top


Exterior Painting
Proper preparation of any painting project is the ground work to ensuring a long-lasting, quality job. With this in mind, our painters will:

Thoroughly power wash entire exterior surface if requested, or the project requires it
Cover all landscaping, bushes, driveways and other non-painted areas as required
Seal all cracks in wood, brick or stucco to seal out moisture
Hard scrape to remove all loose and peeling paint
Light sand all scraped areas to take some of the edges off
Provide optional feather sanding, using power sanders and additional hand sanding which leaves no edges where the previous layers existed
High grade primers are applied to the thoroughly prepped areas to seal in bare spots. The Finish Coat is what seals the thoroughly prepped surface and is what gives the fresh look that you and your neighbours will admire. Top of the line Sherwin William, Homestead House and Benjamin Moore paints are typically used to ensure a quality, long lasting job. Even paint coverage is done to provide visual consistency.

Exterior painting serves two important functions:

Protect your investment. Nature’s elements, like UV rays, moisture and Canada’s gruelling winters take their toll on exposed brick and wood over time. It is much more cost effective to prepare the surface and re-paint than to have to replace the material. The second is to provide an aesthetically pleasing finish to your home.

Pride of ownership is evident in many neighbourhoods. The best way to achieve that is that have your biggest investment looking fresh and updated.
Back to Top


Pressure Washing
In addition to painting, we offer pressure washing, which is used for freshening the siding and decking of your property. Many types of mildew, mould and other foreign substances can grow on and around buildings. Pressure cleaning will revitalize siding and wood surfaces making them look new again. These are also used for preparing them for their new finish.

Pressure washing technology combines your household water with environmentally friendly cleansers designed not only to clean, but to deter future mildew growth. Our cleansers are biodegradable and safe around gardens and trees.

This cleaning will be followed by a high pressure rinse to remove the detergents and any remaining dirt, mold, mildew, and peeling paint.",encore-painting-ltd,2010-03-09T18:02:58.000-05:00,NA,Greater Toronto Area,,,,,,2008,35,"E - transfer, cheque or cash",,,,TRUE,TRUE,,,TRUE,FALSE,Exterior: 2 year guaranteeInterior: If something fails due to workmanship we will come back and fi,1841560,Encore Painting Ltd,604,532,533,9.7312,"Paint & Wallpaper Contractors, Paint Colors, Paint Store, Paint Brush, Paint Shop, Home Wallpaper,Wallpaper, Paint colour advice, paint colour consultants, wallpapering, painter, faux, painters painting, painters paint, business painting, find painting, painting and restoration, new jersey painting, oh painting, local painting, wall paper repair, ,",0,encorepaintingltd,FALSE,0,1,392,NA,FALSE,864b1160b42344699514aa61f2899fe7086b6e76,TRUE,2022-11-07T11:53:04.000-05:00,TRUE,TRUE,2269532,97.3551778785,409,NA,NA,2010-07-05T16:48:21.000-04:00
https://homestars.com/on/cedar-valley/paint-wallpaper-contractors,90,"c(""https://homestars.com/on/cedar-valley/paint-wallpaper-contractors?&page=2&"", ""https://homestars.com/on/cedar-valley/paint-wallpaper-contractors?&page=3&"", ""https://homestars.com/on/cedar-valley/paint-wallpaper-contractors?&page=4&"", ""https://homestars.com/on/cedar-valley/paint-wallpaper-contractors?&page=5&"", ""https://homestars.com/on/cedar-valley/paint-wallpaper-contractors?&page=6&"", ""https://homestars.com/on/cedar-valley/paint-wallpaper-contractors?&page=7&"", ""https://homestars.com/on/cedar-valley/paint-wallpaper-contractors?&page=8&"", 
""https://homestars.com/on/cedar-valley/paint-wallpaper-contractors?&page=9&"")",Paint & Wallpaper Contractors,2787784,http://www.richmondhillhousepainters.com/,/companies/2787784-five-star-painting-vaughan-markham-and-richmond-hill-aurora?searched_category_id=409&service_area=1845777,"Five Star Painting is an international company,  locally owned and operated house painting company since 2010 servicing the Richmond Hill, Markham, Aurora, Woodbridge, Thornhill, King City, Kleinberg, Maple and Vaughan areas. As a part of an international painting  company, we give you the peace of mind as a well established professional contractor that provides top quality customer service.

We have won the Homestars Best of 2018 award.

Because we are a professional painting company we only use experienced and reliable painters who know the difference between quality and quantity. We provide timely customer service and the expected care on each job from start to finish.
A 2 year labor warranty
A responsive management team should there be any challenges
competitive reasonable pricing
Detailed pricing that lets you know what you are getting for your money

We are a licensed and insured company that differentiates our company from smaller and insecure businesses. We strive to exceed your expectations and focus all of our energy and resources on delivering outstanding results.",five-star-painting-vaughan-markham-and-richmond-hill-aurora,2011-05-26T15:25:39.000-04:00,NA,"Richmond Hill, Vaughan, Aurora, Thornhill, Markham, King City, Woodbridge, Maple, Kleinberg, Brampton",8-6 PM,"Benjamin Moore, Dulux/PPG, Sherwin Williams","house painting, interior painting, exterior painting, residential painting, and commercial painting. ","Sherwin Williams, Dulux, Benjamin Moore, PPG","Exterior House Painting and Staining including Deck/Fence Paint and Stain Wood & Siding Repairs Power Washing Drywall
Repairs Stucco Repairs and Painting Commercial Painting and Staining Minor repairs 
Interior entire house painting and can paint cupboards in a smooth durable finish ",2006,8,"cheque, online, credit card",,,"Richmond Hill Board of Trade, Markham Board of Trade, Renovantage",TRUE,TRUE,,$600,TRUE,FALSE,2 year written warranty,1850836,Five Star Painting Vaughan/Markham and Richmond Hill/Aurora,221,194,41,9.68557,"Paint & Wallpaper Contractors, Paint Colors, Paint Store, Paint Brush, Paint Shop, Home Wallpaper,Wallpaper, Paint colour advice, paint colour consultants, wallpapering, painter, faux, painters painting, painters paint, business painting, find painting, painting and restoration, new jersey painting, oh painting, local painting, wall paper repair, ,",3,fivestarpainting,FALSE,0,0,62,100,FALSE,e83803ac75606d75e5f4e510b2a94adcf4f3393e,TRUE,2020-07-27T00:08:41.000-04:00,TRUE,TRUE,1845777,93.5822624909,409,NA,NA,2011-05-26T15:25:41.000-04:00
https://homestars.com/on/cedar-valley/paint-wallpaper-contractors,90,"c(""https://homestars.com/on/cedar-valley/paint-wallpaper-contractors?&page=2&"", ""https://homestars.com/on/cedar-valley/paint-wallpaper-contractors?&page=3&"", ""https://homestars.com/on/cedar-valley/paint-wallpaper-contractors?&page=4&"", ""https://homestars.com/on/cedar-valley/paint-wallpaper-contractors?&page=5&"", ""https://homestars.com/on/cedar-valley/paint-wallpaper-contractors?&page=6&"", ""https://homestars.com/on/cedar-valley/paint-wallpaper-contractors?&page=7&"", ""https://homestars.com/on/cedar-valley/paint-wallpaper-contractors?&page=8&"", 
""https://homestars.com/on/cedar-valley/paint-wallpaper-contractors?&page=9&"")",Paint & Wallpaper Contractors,2794779,https://renosbymatt.com/,/companies/2794779-renovations-by-matt-ltd?searched_category_id=409&service_area=2286507,"At Renovations By Matt we are committed to excellent service and quality workmanship. Whether your looking for a TO-DO LIST you cant seem to finish, Plumbing issues and installations by our licensed staff or a Full Reno Project, We are here to Help 

From designing to finished products, our expert staff will make your renovation ideas come to life. 

We use top quality trades and materials to ensure the repair or project is done right. 
 
 
Email or Call us for more Details.
 
We Offer Plumbing and Waterproofing Services.  
 
Services include: Plumbing repairs and new installations, drain services, waterproofing and More!!",renovations-by-matt-ltd,2012-02-02T17:11:11.000-05:00,NA,GTA AND SURROUNDING AREAS,,"PLUMBING FIXTURES, BATHROOM FIXTURES, DRYWALL PAINT TRIM WORK AND MORE!","Drywalling, painting, framing, tiling, Decks, Baths, Kitchens & More. 
We are now offering Plumbing Waterproofing, drain services and repairs/replacements, affordable pricing and quality guaranteed workmanship.
We Will Provide Quality Workmanship @ Great Prices",,"Handyman work, Renovations, Painting, Plumbing Waterproofing, Drain repair and Replacement and much more",10,4,Cash/Electronic Payments,"Architectural Technician, Plumbing Certificate","Architectural Tech, Plumbing Certificate",,TRUE,TRUE,Flat Rate for Service Calls and Quotation provided for larger scaled work,,TRUE,FALSE,One year warranty (conditions apply),1857831,Renovations By Matt Ltd.,250,198,92,9.84848,"Bathroom Renovation, Bathroom renovation, bathroom remodeling, bathroom remodelling, renovating the bathroom, tearing out the bathroom, fixing up the bathroom, bathroom contractors, bathroom vanities, bathroom vanity, design of bathroom, bathroom and design, design for bathroom, design a bathroom, design a bath, bath design, bathroom tile, bathroom cabinets, remodeling a bathroom, bathroom remodeling, remodeling the bathroom, ,Bath renovation, New tub, caulking, ,Plumbing, Plumber, Plumbers, Plumbing Contractor, Plumbing Repair, toilet repair, fixing toilet, fixing sink, broken faucet, faucet repair, tap repair, leaking toilet, leaking sink, leaking pipes, drain snaking, at plumbing, plumbing in, what is plumbing, a plumbing, the plumbing, plumbing and, how to plumbing, plumbing a, plumbing how to, an plumbing, a plumber, plumber, the plumber, plumber plumber, plumber in, how to plumber, plumbers in, the plumbers, plumbers, plumbing pipe, how to plumb, pipes and plumbing, plumbing pipes, pipes for plumbing, plummer, plumbing supplies, plumbing supply, plumbing heating, plumbing & heating, heating and plumbing, heating plumbing, plumbing and heating, pipe plumber, plumbing stores, plumbing suppliers, the plumbs centre, plumb centre, ,General Contractors, Residential General Contractor, Building Contractor, Additions, Remodeling Contractor,  Renovation, Builder, building construction, renovation, remodeling, construction builders, construction company, construction companies, home repair, construction jobs, home remodeling, general contractors, contractors general, contractor general, contractors construction, construction contractors, home improvement and remodeling, kitchen remodeling, construction contractor, builders contractors, home renovation, general contracting, building contractors, building companies, home renovations, builder contractor, building contractor, remodeling contractor, commercial construction, residential construction, house contractor, concrete contractors, home contractors, general construction, construction general, contractors remodeling, remodeling contractors, remodelers, remodel contractor, remodel contractors, general contract, commercial contractors, renovations contractors, home improvement contractor, licensed contractor, license general contractor, mud room, mudroom, caulking, ,Paint & Wallpaper Contractors, Paint Colors, Paint Store, Paint Brush, Paint Shop, Home Wallpaper,Wallpaper, Paint colour advice, paint colour consultants, wallpapering, painter, faux, painters painting, painters paint, business painting, find painting, painting and restoration, new jersey painting, oh painting, local painting, wall paper repair, ,",1,MattRenoPlumbing,FALSE,0,0,103,100,FALSE,bd062d8ae14b4663083f1b87ec7581826a028f20,TRUE,2021-03-22T19:26:17.000-04:00,TRUE,TRUE,2286507,97.383695377,409,NA,NA,2012-09-24T17:01:37.000-04:00
https://homestars.com/on/cedar-valley/paint-wallpaper-contractors,90,"c(""https://homestars.com/on/cedar-valley/paint-wallpaper-contractors?&page=2&"", ""https://homestars.com/on/cedar-valley/paint-wallpaper-contractors?&page=3&"", ""https://homestars.com/on/cedar-valley/paint-wallpaper-contractors?&page=4&"", ""https://homestars.com/on/cedar-valley/paint-wallpaper-contractors?&page=5&"", ""https://homestars.com/on/cedar-valley/paint-wallpaper-contractors?&page=6&"", ""https://homestars.com/on/cedar-valley/paint-wallpaper-contractors?&page=7&"", ""https://homestars.com/on/cedar-valley/paint-wallpaper-contractors?&page=8&"", 
""https://homestars.com/on/cedar-valley/paint-wallpaper-contractors?&page=9&"")",Paint & Wallpaper Contractors,317262,http://www.cleancutpainting.ca,/companies/317262-the-clean-cut-painting-company?searched_category_id=409&service_area=1980135," Providing professional personal solutions is the core value of the Clean Cut Painting Company. We pride ourselves in delivering an enjoyable experience from start to finish; honest communication and workmanship, value, competence and understanding, our commitment to you is more than just the paint on the walls. Building relationships is the key to our success!",the-clean-cut-painting-company,2007-09-17T20:00:00.000-04:00,NA,"From Oakville to Oshawa, Bradford to the Beaches and everywhere in between.
<br />Willing to travel, call to discuss.",24/7,"Benjamin Moore, Sherwin Williams, Farrow & Ball, PPG, Dulux","residential, commercial, industrial painting both interior and exterior, wallpaper hanging, wood staining and refinishing, faux finishes, murals, patina and gilding architectural finishes","With decades of experience we have developed vast product knowledge and built strong relationships with all major paint manufacturers which gives us the ability to properly match product with project in order to meet the expectations of our clients taking into account longevity, desired finish and budgetary constraints.","faux finishes, murals, patina and true gilding (gold leaf etc...)",1972,12,"cash, chq, debit, credit",,,"BBB, CCI, GTAA, PDCA, TCA,",TRUE,TRUE,,,TRUE,FALSE,"one year to a maximum of five years, depending on project specifics",111560,Clean Cut Painting And Decorating Corp.,236,195,32,9.84103,"Paint & Wallpaper Contractors, Paint Colors, Paint Store, Paint Brush, Paint Shop, Home Wallpaper,Wallpaper, Paint colour advice, paint colour consultants, wallpapering, painter, faux, painters painting, painters paint, business painting, find painting, painting and restoration, new jersey painting, oh painting, local painting, wall paper repair, ,",0,thecleancutpaintingcompany,FALSE,0,0,64,100,FALSE,fd4c6ca843365ef06f847506549a2d08c21f1678,TRUE,2022-04-05T13:43:13.000-04:00,TRUE,TRUE,1980135,96.9730460864,409,NA,NA,2007-09-17T20:00:00.000-04:00
https://homestars.com/on/cedar-valley/paint-wallpaper-contractors,90,"c(""https://homestars.com/on/cedar-valley/paint-wallpaper-contractors?&page=2&"", ""https://homestars.com/on/cedar-valley/paint-wallpaper-contractors?&page=3&"", ""https://homestars.com/on/cedar-valley/paint-wallpaper-contractors?&page=4&"", ""https://homestars.com/on/cedar-valley/paint-wallpaper-contractors?&page=5&"", ""https://homestars.com/on/cedar-valley/paint-wallpaper-contractors?&page=6&"", ""https://homestars.com/on/cedar-valley/paint-wallpaper-contractors?&page=7&"", ""https://homestars.com/on/cedar-valley/paint-wallpaper-contractors?&page=8&"", 
""https://homestars.com/on/cedar-valley/paint-wallpaper-contractors?&page=9&"")",Paint & Wallpaper Contractors,2902595,http://ctpainters.ca/,/companies/2902595-ct-painters?searched_category_id=409&service_area=2195620,"For beautiful painting results, trust CT Painters! Our quality service, on-time delivery and professional attitude have made us popular in GTA. We believe in hard work and our #1 priority is your satisfaction! every work that we do manifests our dedication in creating beautiful spaces. We go the extra mile in pleasing our customers and don’t stop until we have transformed your property from ordinary to attractive.",ct-painters,2017-09-23T14:54:43.000-04:00,NA,NA,NA,,"CEILING AND WALL PAINTING,
STUCCO CEILING REMOVAL | POPCORN CEILING REMOVAL, 
HOUSE FIXING,
WALLPAPER REMOVAL,
STAIRCASE PAINTING AND STAINING,
DRYWALL INSTALLATION, REPLACEMENT AND REPAIRS, 
CONDOMINIUM PAINTING AND APARTMENT PAINTING, 
PROFESSIONAL COLOR CONSULTATION",,,NA,NA,,,,,FALSE,FALSE,,,TRUE,FALSE,,1964780,CT Painters,107,95,308,9.98947,"Paint & Wallpaper Contractors, Paint Colors, Paint Store, Paint Brush, Paint Shop, Home Wallpaper,Wallpaper, Paint colour advice, paint colour consultants, wallpapering, painter, faux, painters painting, painters paint, business painting, find painting, painting and restoration, new jersey painting, oh painting, local painting, wall paper repair, ,",0,ctpainters,FALSE,0,0,339,0,FALSE,3e54de40b0ddac883eb7df262b5a317fc14ff1d3,TRUE,2022-11-17T21:22:20.000-05:00,TRUE,TRUE,2195620,98.9268183129,409,NA,NA,2017-09-23T14:55:50.000-04:00
