Link,n_hits,all_links,category,id,url,hs_path,profile,permalink,created_at,sic_code,service_area,hours,products,services,brands,specialities,established,employee_cnt,payment_method,diplomas,licenses,memberships,liability_insurance,bonded,project_rate,project_minimum,written_contract,written_warranty,warranty_terms,parent_company_id,name,total_number_of_reviews_cache,total_number_of_approved_reviews_cache,number_of_photos_cache,avg_rating_cache,categories_info_cache,savings_count,subdomain,fraudulent,fraudulent_count,total_number_of_pending_reviews_cache,images_count,completion_percent_cache,bully,secret,replied_to_at_least_one_review_cache,latest_approved_review_created_at,has_set_tasks,lead_purchase_eligible,service_area_id,star_score,quote_button_category,direct_phone,direct_contact,claimed_at
https://homestars.com/on/rocky%20view%20county/roofing,47,"c(""https://homestars.com/on/rocky%20view%20county/roofing?&page=2&"", ""https://homestars.com/on/rocky%20view%20county/roofing?&page=3&"", ""https://homestars.com/on/rocky%20view%20county/roofing?&page=4&"", ""https://homestars.com/on/rocky%20view%20county/roofing?&page=5&"")",Roofing,2801701,http://www.NationalStarRoofing.ca,/companies/2801701-national-star-roofing-inc?searched_category_id=428&service_area=1866805,"National Star Roofing is a family owned and operated company specializing in sloped and flat roofs in the Calgary area since July 2003. It has been rated the Best Roofing Company/Contractor in Calgary by HomeStars and holds an A+ rating with the BBB. 

National Star Roofing is a Preferred Contractor with Owen's Corning, is fully licensed and insured with WCB and is covered by a General Liability Insurance of up $10 million per job. 

Consistently quality work, attention to detail and great customer service is what tells us apart. 
Customer satisfaction is our first priority. 
No payment is required until the job is complete to the owner's satisfaction. Extra charges apply to payments by credit card. 

National Star Roofing's services include sloped roof replacements as well as flat roof repairs/replacements. 

",national-star-roofing-inc,2012-09-25T14:19:46.000-04:00,NA,Calgary and Area,8am-8pm,www.NationalStarRoofing.ca/products-partners,"Asphalt shingles.
SBS Membrane Flar roofing systems. 
Roofing contracting services.
Re-roof.
Roof Repair.
Residential roofing.
Commercial roofing.
Flat roofing.","Owens Corning, IKO, Malarkey",,2003,9,"cheque, cash, VISA, MasterCard",,"WCB, CGL",,TRUE,TRUE,,,TRUE,FALSE,10 Years Labor,1864702,National Star Roofing Inc.,426,368,105,9.99185,"Roofing, Roofing Contractor, Metal Roofing, Roofing Material, Roofing Shingles, Roofing Company, cedar roofing, roofing repair, roof repair, cedar shingles, shingles, roof repair, slate roofing, slate roofs, cedar shakes, roof, how to roof, about roofing, at roofing, the roofing, roofing roofing, a roofing, roof roof roofing, shingles, roofs, shingles for roof, roof shingles, shingles roof, roofing shingles, shingles roofing, metal roof, roof metal, metal roofing, roofing metal, steel roof, steel roofing, roof repair, roof and repair, roofers, roofer, roof tiles, roof tile, tile roof, roofing contractors, roofing companies, metal roofs, roof shingle, shingle roof, contractor roofing, roofing contractor, Roofing Contractor for New Shingles, roofing canada, roofing companies, canadian roofing contractors, roof builders, roofing installers, contractor roofing, roofing calgary, roofing ottawa, roofers calgary, roofing jobs, roofing barrie, best roofing material, vancouver, roofing contractors, roof contractors, roofing supply , home roofing, roofing ontario, roof ontario, commercial roofing, residential roofers, roofing builders, shingle roof contractor, residential roofing company, roof types, best roofing company, fiberglass shingles,  canadian roofing company, flat roofing, industrail roofing, types of roofing, roofing options, list roofing companies, shinglers, roofing estimates, elk shingles,  roofing reviews, asphalt shingles prices, metal sheet roofing, roofing systems, flat roofing companies, roofing and siding, roofers review, new roofing, slate roofing contractors, roof installers, vinyl roofing material, roof sheets, commercial roof repairs,",3,nationalstar,FALSE,0,0,185,100,FALSE,fcbf31c7c5c816e5d8d2a51f5eb445f8aa137b24,TRUE,2022-02-21T18:58:01.000-05:00,TRUE,TRUE,1866805,98.1435048971,428,NA,NA,NA
https://homestars.com/on/rocky%20view%20county/roofing,47,"c(""https://homestars.com/on/rocky%20view%20county/roofing?&page=2&"", ""https://homestars.com/on/rocky%20view%20county/roofing?&page=3&"", ""https://homestars.com/on/rocky%20view%20county/roofing?&page=4&"", ""https://homestars.com/on/rocky%20view%20county/roofing?&page=5&"")",Roofing,2784604,http://www.hubbardexteriors.com,/companies/2784604-hubbard-roofing-exteriors-inc?searched_category_id=428&service_area=1840902,"Celebrating 35 Years Serving Calgary & Surrounding Areas!

Hubbard Roofing and Exteriors is an established, professional, family owned and operated exterior renovation company. We have over 40 years of experience and have been in business in Calgary and the surrounding area since 1985. As a family business, we are dedicated to providing our customers with the best customer service while remaining focused on our commitment to provide high quality products and workmanship. This approach has resulted in a long list of customer referrals and continuous repeat business that has made us the leader residential Exterior Renovations. 

Our reputation is one of reliability, trust, high quality workmanship and competitive prices. As an A+ member of the Better Business Bureau, we have a reputation to uphold.",hubbard-roofing-exteriors-inc,2011-02-25T08:55:36.000-05:00,NA,"FREE ESTIMATES / INSPECTIONS: Calgary, Okotoks, Airdrie, Bragg Creek, Cochrane, Chestmere, Strathmore, High River, Canmore, and other surrounding Areas","""Monday to Friday 8:30am to 5:00pm  Onsite Appointments available during da","ROOFING, WINDOWS, DOORS, SIDING, SKYLIGHTS, SUN TUBES, SOFFIT, FASCIA, EAVESTROUGH & TRIM","Your complete exterior specialists

Free Estimates, Roof Inspections, Roof Repair, Steep Slope Roofing, Low Slope Roofing, Flat Roofing, Rubber Roofing, Cedar Shakes, Rubber Roofing Repairs, Vinyl Windows, Wood Windows, Metal Clad Windows, Doors (Steel, Fiberglass, double, garden, and sliding patio), Vinyl Siding, Concrete Siding, Eavestroughing, Soffit, Fascia & Trim","IKO, BP, MALARKY, OWENS CORNING, GENTEK, JAMES HARDIE, WAYNE, ROYAL, CODEL, FIRST IMPRESSIONS, GEM-EURO SHAKE/SLATE","When you contact us, a qualifed representative will provide detailed information about our product options, promotions, work schedules, prices and answers to your questions. 
We provide: 
Written or electronic quotes for all projects. 
On-site consulation with one of our exterior renovations specialists prior to any commitment.
Workmanship Guarantee. 
All of our warranties (product, installation, etc) are provided in writing!",1985,11,Payment on completion ,"HAAG Certified Inspector - ""Residential"", IKO Shield PRO Plus Certified Contractor ","City of Calgary, Town of Okotoks","Gentek Premium Renovator, Better Business Bureau (A+ member since 1985)  ",TRUE,TRUE,,,TRUE,FALSE,Excellent Workmanship Warranty,1847656,Hubbard Roofing & Exteriors Inc.,280,257,18,9.80156,"Roofing, Roofing Contractor, Metal Roofing, Roofing Material, Roofing Shingles, Roofing Company, cedar roofing, roofing repair, roof repair, cedar shingles, shingles, roof repair, slate roofing, slate roofs, cedar shakes, roof, how to roof, about roofing, at roofing, the roofing, roofing roofing, a roofing, roof roof roofing, shingles, roofs, shingles for roof, roof shingles, shingles roof, roofing shingles, shingles roofing, metal roof, roof metal, metal roofing, roofing metal, steel roof, steel roofing, roof repair, roof and repair, roofers, roofer, roof tiles, roof tile, tile roof, roofing contractors, roofing companies, metal roofs, roof shingle, shingle roof, contractor roofing, roofing contractor, Roofing Contractor for New Shingles, roofing canada, roofing companies, canadian roofing contractors, roof builders, roofing installers, contractor roofing, roofing calgary, roofing ottawa, roofers calgary, roofing jobs, roofing barrie, best roofing material, vancouver, roofing contractors, roof contractors, roofing supply , home roofing, roofing ontario, roof ontario, commercial roofing, residential roofers, roofing builders, shingle roof contractor, residential roofing company, roof types, best roofing company, fiberglass shingles,  canadian roofing company, flat roofing, industrail roofing, types of roofing, roofing options, list roofing companies, shinglers, roofing estimates, elk shingles,  roofing reviews, asphalt shingles prices, metal sheet roofing, roofing systems, flat roofing companies, roofing and siding, roofers review, new roofing, slate roofing contractors, roof installers, vinyl roofing material, roof sheets, commercial roof repairs,Siding, vinyl siding, wood siding, exterior siding, aluminum siding, cedar shakes, cedar shingles, composite wood siding, seamless steel siding, wood clapboard, stone siding, brick siding, exterior, side, sides, how to siding, the siding, the other side, stucco,  how to vinyl siding, about vinyl siding, what is vinyl siding, in vinyl siding, vinyl siding how to, vinyl siding, siding vinyl, how to install vinyl, cement fiber, fiber cement, siding house, house with siding, siding on a house, what is siding on a house, siding for house, siding a house, how to siding a house, siding on house, house siding, siding for a house, ,",1,hubbardexteriors,FALSE,0,0,20,NA,FALSE,d66dd3ecc06f277e481a237efc5792006d34d485,TRUE,2022-03-22T23:17:40.000-04:00,TRUE,TRUE,1840902,97.3814605647,428,NA,NA,2011-02-25T08:55:37.000-05:00
https://homestars.com/on/rocky%20view%20county/roofing,47,"c(""https://homestars.com/on/rocky%20view%20county/roofing?&page=2&"", ""https://homestars.com/on/rocky%20view%20county/roofing?&page=3&"", ""https://homestars.com/on/rocky%20view%20county/roofing?&page=4&"", ""https://homestars.com/on/rocky%20view%20county/roofing?&page=5&"")",Roofing,2855361,http://www.citybossroofingcalgary.com,/companies/2855361-city-boss-residential-roofing?searched_category_id=428&service_area=1977830,"CITY BOSS RESIDENTIAL ROOFING


Family owned and operated.

",city-boss-residential-roofing,2014-06-18T18:31:03.000-04:00,NA,"CALGARY , AIRDRIE , OKOTOKS , LANGDON",,ASPHALT SHINGLES,REROOF SERVICES,"OWENS CORNING
IKO
",,2012,NA,CHEQUE OR ETRANSFER,,WE ARE LICENSED ,"OWENS CORNING APPROVED CONTRACTOR, BAEULMER APPROVED CONTRACTOR, BBB, HAAG CERTIFIED,WCB, AARA",TRUE,FALSE,,,TRUE,FALSE,WORKMANSHIP WARRANTY,1917791,City Boss Residential Roofing,205,182,1941,9.87363,"Roofing, Roofing Contractor, Metal Roofing, Roofing Material, Roofing Shingles, Roofing Company, cedar roofing, roofing repair, roof repair, cedar shingles, shingles, roof repair, slate roofing, slate roofs, cedar shakes, roof, how to roof, about roofing, at roofing, the roofing, roofing roofing, a roofing, roof roof roofing, shingles, roofs, shingles for roof, roof shingles, shingles roof, roofing shingles, shingles roofing, metal roof, roof metal, metal roofing, roofing metal, steel roof, steel roofing, roof repair, roof and repair, roofers, roofer, roof tiles, roof tile, tile roof, roofing contractors, roofing companies, metal roofs, roof shingle, shingle roof, contractor roofing, roofing contractor, Roofing Contractor for New Shingles, roofing canada, roofing companies, canadian roofing contractors, roof builders, roofing installers, contractor roofing, roofing calgary, roofing ottawa, roofers calgary, roofing jobs, roofing barrie, best roofing material, vancouver, roofing contractors, roof contractors, roofing supply , home roofing, roofing ontario, roof ontario, commercial roofing, residential roofers, roofing builders, shingle roof contractor, residential roofing company, roof types, best roofing company, fiberglass shingles,  canadian roofing company, flat roofing, industrail roofing, types of roofing, roofing options, list roofing companies, shinglers, roofing estimates, elk shingles,  roofing reviews, asphalt shingles prices, metal sheet roofing, roofing systems, flat roofing companies, roofing and siding, roofers review, new roofing, slate roofing contractors, roof installers, vinyl roofing material, roof sheets, commercial roof repairs,",1,cityboss,FALSE,0,0,1632,0,FALSE,55ea7bf917a52691cf48f96dc89fd67641303ead,TRUE,2022-09-02T17:09:51.000-04:00,TRUE,TRUE,1977830,98.1759451674,428,NA,NA,NA
https://homestars.com/on/rocky%20view%20county/roofing,47,"c(""https://homestars.com/on/rocky%20view%20county/roofing?&page=2&"", ""https://homestars.com/on/rocky%20view%20county/roofing?&page=3&"", ""https://homestars.com/on/rocky%20view%20county/roofing?&page=4&"", ""https://homestars.com/on/rocky%20view%20county/roofing?&page=5&"")",Roofing,2880376,https://www.southpeak.ca/calgary/,/companies/2880376-south-peak-roofing-exteriors?searched_category_id=428&service_area=2069818,"We at South Peak Roofing & Exteriors are setting our sites on one goal, to become Calgary's most trusted roofing company. Trusted to meet each individual customers unique and distinct needs. We aim to leave each and every customer with the feeling that their needs have been met with care and concern for themselves and their property. South Peak Roofing & Exteriors. ""We'd rather be trusted.""",south-peak-roofing-exteriors,2015-12-02T14:37:50.000-05:00,NA,NA,NA,"Asphalt Shingles, Rubber Shingles, Metal Shingles,
Torch On, TPO, EPDM, and Tremco Flat Roofing
Vinyl Siding, Hardie Siding
","Free estimates and Inspections
Storm Scopes and Inspections
Replace and Repair
New Construction Install","Malarkey, Owens Corning, CertainTeed, Euroshield (Rubber)
Rare Manufacturing (Metal Shingles)",We are Preferred Contractors for both Owens Corning and CertainTeed. We are able to offer 50 Year full coverage warranties for both of those products.,2013,NA,"Cheque, Visa, of Mastercard",,Calgary City Business,Better Business Bureau,TRUE,FALSE,,,TRUE,FALSE,10 yr workmanship warranty on roofs.,1942800,South Peak Roofing & Exteriors,172,155,61,9.95484,"Roofing, Roofing Contractor, Metal Roofing, Roofing Material, Roofing Shingles, Roofing Company, cedar roofing, roofing repair, roof repair, cedar shingles, shingles, roof repair, slate roofing, slate roofs, cedar shakes, roof, how to roof, about roofing, at roofing, the roofing, roofing roofing, a roofing, roof roof roofing, shingles, roofs, shingles for roof, roof shingles, shingles roof, roofing shingles, shingles roofing, metal roof, roof metal, metal roofing, roofing metal, steel roof, steel roofing, roof repair, roof and repair, roofers, roofer, roof tiles, roof tile, tile roof, roofing contractors, roofing companies, metal roofs, roof shingle, shingle roof, contractor roofing, roofing contractor, Roofing Contractor for New Shingles, roofing canada, roofing companies, canadian roofing contractors, roof builders, roofing installers, contractor roofing, roofing calgary, roofing ottawa, roofers calgary, roofing jobs, roofing barrie, best roofing material, vancouver, roofing contractors, roof contractors, roofing supply , home roofing, roofing ontario, roof ontario, commercial roofing, residential roofers, roofing builders, shingle roof contractor, residential roofing company, roof types, best roofing company, fiberglass shingles,  canadian roofing company, flat roofing, industrail roofing, types of roofing, roofing options, list roofing companies, shinglers, roofing estimates, elk shingles,  roofing reviews, asphalt shingles prices, metal sheet roofing, roofing systems, flat roofing companies, roofing and siding, roofers review, new roofing, slate roofing contractors, roof installers, vinyl roofing material, roof sheets, commercial roof repairs,Siding, vinyl siding, wood siding, exterior siding, aluminum siding, cedar shakes, cedar shingles, composite wood siding, seamless steel siding, wood clapboard, stone siding, brick siding, exterior, side, sides, how to siding, the siding, the other side, stucco,  how to vinyl siding, about vinyl siding, what is vinyl siding, in vinyl siding, vinyl siding how to, vinyl siding, siding vinyl, how to install vinyl, cement fiber, fiber cement, siding house, house with siding, siding on a house, what is siding on a house, siding for house, siding a house, how to siding a house, siding on house, house siding, siding for a house, ,",1,southpeak,FALSE,0,0,56,0,FALSE,fc7f2afcbaebefdaf408d95c5e5fdf8e9cf5bd9d,TRUE,2021-06-22T17:36:50.000-04:00,TRUE,TRUE,2069818,99.2570487388,428,NA,NA,NA
https://homestars.com/on/rocky%20view%20county/roofing,47,"c(""https://homestars.com/on/rocky%20view%20county/roofing?&page=2&"", ""https://homestars.com/on/rocky%20view%20county/roofing?&page=3&"", ""https://homestars.com/on/rocky%20view%20county/roofing?&page=4&"", ""https://homestars.com/on/rocky%20view%20county/roofing?&page=5&"")",Roofing,2626648,http://www.greatcanadian.ca,/companies/2626648-great-canadian-roofing-siding-ltd?searched_category_id=428&service_area=2140817,"Great Canadian is a fully integrated residential and commercial renovation company dedicated to providing sustainable energy solutions for your home or commercial property.

Experienced, professional and trusted, Great Canadian will provide you with the right advice, quality workmanship, excellent service and the best brands of products no matter what your need. All services are competitively priced for your project and include roofing, attic insulation, siding, windows and doors, soffits and fascia, eavestroughs and any related insurance needs. Great Canadian combines skill and technology to provide you the best service possible.",great-canadian-roofing-siding-ltd,2008-03-04T16:55:15.000-05:00,NA,"Roofing, Siding, Windows & Doors, Attic Insulation, Heating & Air Conditioning, Eavestroughing, Soffit & Fascia, Thermal Imaging and Insurance Claims",8:00 am to 4:30 pm M-F,"Asphalt Shingles, Cedar Shakes, Metal roofing, Vinyl Siding, Fiber cement board, Windows, Exterior Doors","Sloped Roofing - shingles, cedar, metal, vinyl & James Hardie installations, attic insulation, windows & doors, skylights, soffit, fascia, eavestroughs","IKO, Malarkey, BP, Royal Building Products, James Hardie, Kaycan, Mitten, Velux",,1997,NA,"Visa & Mastercard, Cheques, Cash, Financing Options ",,,"CHBA, SCAA, AARA, Master Elite Contractors",TRUE,FALSE,,,TRUE,FALSE,"Yes, ask for details. ",1689700,Great Canadian Roofing And Siding Ltd,250,204,1,8.93627,"Roofing, Roofing Contractor, Metal Roofing, Roofing Material, Roofing Shingles, Roofing Company, cedar roofing, roofing repair, roof repair, cedar shingles, shingles, roof repair, slate roofing, slate roofs, cedar shakes, roof, how to roof, about roofing, at roofing, the roofing, roofing roofing, a roofing, roof roof roofing, shingles, roofs, shingles for roof, roof shingles, shingles roof, roofing shingles, shingles roofing, metal roof, roof metal, metal roofing, roofing metal, steel roof, steel roofing, roof repair, roof and repair, roofers, roofer, roof tiles, roof tile, tile roof, roofing contractors, roofing companies, metal roofs, roof shingle, shingle roof, contractor roofing, roofing contractor, Roofing Contractor for New Shingles, roofing canada, roofing companies, canadian roofing contractors, roof builders, roofing installers, contractor roofing, roofing calgary, roofing ottawa, roofers calgary, roofing jobs, roofing barrie, best roofing material, vancouver, roofing contractors, roof contractors, roofing supply , home roofing, roofing ontario, roof ontario, commercial roofing, residential roofers, roofing builders, shingle roof contractor, residential roofing company, roof types, best roofing company, fiberglass shingles,  canadian roofing company, flat roofing, industrail roofing, types of roofing, roofing options, list roofing companies, shinglers, roofing estimates, elk shingles,  roofing reviews, asphalt shingles prices, metal sheet roofing, roofing systems, flat roofing companies, roofing and siding, roofers review, new roofing, slate roofing contractors, roof installers, vinyl roofing material, roof sheets, commercial roof repairs,Gutters & Eavestroughs, Eavestrough Cleaning, Eavestrough Installation, Eavestrough Maintenance, gutter cleaning, gutter installation, gutter maintenance, installing gutters, installing eavestroughs, Eavestrough Repair, ,Insulation, Home Insulation, Foam Insulation, Thermal Insulation, Fiberglass Insulation, cellulose insulation, insullation, celulose insulation, sprayfoam insulation, spray foam, what is insulation, insulating, insulated, insulate, insulator, save energy, insulators, foam insulation, insulation foam, foam spray, insulating foam, wall insulation, energy savers, radiant heat, sound insulation, spray in insulation, insulation spray in, insulation spray, spray on insulation, spray insulation, owenscorning, board insulation, insulation board, insulation home, insulation for the home, home insulation, loft insulation, foam insulation spray, insulation foam spray, spray insulation foam, spray on foam insulation, spray in foam insulation, insulation spray foam, spray foam insulation, foam spray insulation, insulation for attic, insulation in attic, attic insulation, insulation attic, insulating board, insulating foam spray, insulating spray foam, house insulation, insulation for house, insulation house, sprayfoam insulation, insulated panels, insulating home, soundproofing,Insulation, ,Siding, vinyl siding, wood siding, exterior siding, aluminum siding, cedar shakes, cedar shingles, composite wood siding, seamless steel siding, wood clapboard, stone siding, brick siding, exterior, side, sides, how to siding, the siding, the other side, stucco,  how to vinyl siding, about vinyl siding, what is vinyl siding, in vinyl siding, vinyl siding how to, vinyl siding, siding vinyl, how to install vinyl, cement fiber, fiber cement, siding house, house with siding, siding on a house, what is siding on a house, siding for house, siding a house, how to siding a house, siding on house, house siding, siding for a house, ,",0,Greatcanadian,FALSE,0,0,4,NA,FALSE,747e4d4655e6a5d2260ee704cfcb25ff813d44dd,TRUE,2019-05-26T21:23:44.000-04:00,TRUE,TRUE,2140817,90.9745545984,428,NA,NA,2011-04-08T15:37:49.000-04:00
