Link,n_hits,all_links,category,id,url,hs_path,profile,permalink,created_at,sic_code,service_area,hours,products,services,brands,specialities,established,employee_cnt,payment_method,diplomas,licenses,memberships,liability_insurance,bonded,project_rate,project_minimum,written_contract,written_warranty,warranty_terms,parent_company_id,name,total_number_of_reviews_cache,total_number_of_approved_reviews_cache,number_of_photos_cache,avg_rating_cache,categories_info_cache,savings_count,fraudulent,fraudulent_count,total_number_of_pending_reviews_cache,images_count,completion_percent_cache,bully,secret,replied_to_at_least_one_review_cache,latest_approved_review_created_at,has_set_tasks,lead_purchase_eligible,service_area_id,star_score,quote_button_category,direct_phone,direct_contact,claimed_at
https://homestars.com/on/port%20coquitlam/railings,25,"c(""https://homestars.com/on/port%20coquitlam/railings?&page=2&"", ""https://homestars.com/on/port%20coquitlam/railings?&page=3&"")",Railings,2849985,NA,/companies/2849985-ldh-aluminum?searched_category_id=422&service_area=1960635,"   www.LDHAluminum.com.    We specialize in Aluminum and Glass Railings.  We have many options to choose from - such as various picket sizes, topless and frameless glass systems.  Other products we carry are Aluminum Staircases with a variety of step options , Fencing, Pedestrian and Driveway Gates. We have many powder coated colors to choose from.  Please visit our website at: LDHAluminum.com",ldh-aluminum,2014-03-12T15:27:11.000-04:00,NA,NA,,NA,NA,NA,NA,NA,NA,NA,NA,NA,NA,FALSE,FALSE,NA,NA,FALSE,FALSE,NA,1912419,Ldh Aluminum,10,6,0,10,"Railings, stair railings, outdoor railings, iron railings, wrought iron railings, wood railings, rail, gates, fence, rails, fencing, rail times, fences, fence gate, fence gates, railing, wrought, wrought iron, handrail, handrails, balustrade, balconies, rail simulator, speed rail, iron works, stair steps, balusters, iron work, fence panels, hand rail, banister, hand railing, rail works, ironworks, balustrades, front gates, curtain rails, garden gate, iron gate, gate iron, gates iron, iron gates, ,",0,FALSE,0,0,0,0,FALSE,de6df426309d67566e8584ad3e53f95fab7c1f8c,TRUE,2015-09-11T16:05:07.000-04:00,TRUE,FALSE,1960635,75.8315697371,422,NA,NA,NA
https://homestars.com/on/port%20coquitlam/railings,25,"c(""https://homestars.com/on/port%20coquitlam/railings?&page=2&"", ""https://homestars.com/on/port%20coquitlam/railings?&page=3&"")",Railings,2785273,NA,/companies/2785273-artisan-glazing?searched_category_id=422&service_area=1841977,,artisan-glazing,2011-03-05T23:49:19.000-05:00,NA,NA,,NA,NA,NA,NA,NA,NA,NA,NA,NA,NA,FALSE,FALSE,NA,NA,FALSE,FALSE,NA,1848325,Artisan Glazing ,2,2,0,10,"Railings, stair railings, outdoor railings, iron railings, wrought iron railings, wood railings, rail, gates, fence, rails, fencing, rail times, fences, fence gate, fence gates, railing, wrought, wrought iron, handrail, handrails, balustrade, balconies, rail simulator, speed rail, iron works, stair steps, balusters, iron work, fence panels, hand rail, banister, hand railing, rail works, ironworks, balustrades, front gates, curtain rails, garden gate, iron gate, gate iron, gates iron, iron gates, ,",0,FALSE,0,0,0,NA,FALSE,8670e9041f322faa0cc7549e8aa5bc37965840af,FALSE,2013-07-25T15:49:23.000-04:00,FALSE,FALSE,1841977,63.1848331851,422,NA,NA,NA
https://homestars.com/on/port%20coquitlam/railings,25,"c(""https://homestars.com/on/port%20coquitlam/railings?&page=2&"", ""https://homestars.com/on/port%20coquitlam/railings?&page=3&"")",Railings,2801887,NA,/companies/2801887-ellerman-woodworking?searched_category_id=422&service_area=1867070,NA,ellerman-woodworking,2012-10-03T20:44:00.000-04:00,NA,NA,NA,NA,NA,NA,NA,NA,NA,NA,NA,NA,NA,FALSE,FALSE,NA,NA,FALSE,FALSE,NA,1864888,Ellerman Woodworking,1,1,0,10,"Railings, stair railings, outdoor railings, iron railings, wrought iron railings, wood railings, rail, gates, fence, rails, fencing, rail times, fences, fence gate, fence gates, railing, wrought, wrought iron, handrail, handrails, balustrade, balconies, rail simulator, speed rail, iron works, stair steps, balusters, iron work, fence panels, hand rail, banister, hand railing, rail works, ironworks, balustrades, front gates, curtain rails, garden gate, iron gate, gate iron, gates iron, iron gates, ,",0,FALSE,0,0,0,NA,FALSE,9affda5a8d7b77a55a3f168fd3c4664a99ab5609,FALSE,2016-08-03T10:55:41.000-04:00,TRUE,FALSE,1867070,73.8235563302,422,NA,NA,NA
https://homestars.com/on/port%20coquitlam/railings,25,"c(""https://homestars.com/on/port%20coquitlam/railings?&page=2&"", ""https://homestars.com/on/port%20coquitlam/railings?&page=3&"")",Railings,2577660,NA,/companies/2577660-a-m-aluminum?searched_category_id=422&service_area=1590864,NA,a-m-aluminum,2008-03-04T16:55:15.000-05:00,NA,NA,NA,NA,NA,NA,NA,NA,NA,NA,NA,NA,NA,FALSE,FALSE,NA,NA,FALSE,FALSE,NA,1640712,A & M Aluminum,12,5,0,4,"Railings, stair railings, outdoor railings, iron railings, wrought iron railings, wood railings, rail, gates, fence, rails, fencing, rail times, fences, fence gate, fence gates, railing, wrought, wrought iron, handrail, handrails, balustrade, balconies, rail simulator, speed rail, iron works, stair steps, balusters, iron work, fence panels, hand rail, banister, hand railing, rail works, ironworks, balustrades, front gates, curtain rails, garden gate, iron gate, gate iron, gates iron, iron gates, ,",0,FALSE,0,0,0,NA,FALSE,c182ba5d08fd2eb818cafaaf936c717849bc6c27,TRUE,2014-05-20T14:16:50.000-04:00,FALSE,FALSE,1590864,19.6681622064,422,NA,NA,2012-04-20T03:48:56.000-04:00
https://homestars.com/on/port%20coquitlam/railings,25,"c(""https://homestars.com/on/port%20coquitlam/railings?&page=2&"", ""https://homestars.com/on/port%20coquitlam/railings?&page=3&"")",Railings,225197,http://spectrumskyworks.com,/companies/225197-spectrum-skyworks-inc?searched_category_id=422&service_area=1823564,"Spectrum Skyworks provides overhead glazing solutions and has done so since the 90's. We provide all solutions for large custom skylights, canopies, trellis skin systems, drop on opening skylights, fixed drop on skylights, roof hatches and roof doors. We also have a retractable enclosure line and railing division. We will be happy to offer a free consultation and fair quote for your project. Please contact Steve and mention you found our information on Homestars.

A few good reasons to choose Spectrum Skyworks:

Spectrum Skyworks is, as our name suggests, a company dedicated to custom skylight design and construction. But Spectrum Skyworks is more than just a company delivering a product – albeit a great one.

We’re a team. Project managers, designers, fabricators and installers. Professionals working seamlessly together to take care of every detail of creating and installing your new skylight on time, on budget, whether the project is monumental, commercial or residential.

When you work with us, we become your team. Your vision, your specifications, your project forms our blueprint and we put all our considerable expertise and experience to work on your behalf.

You won’t find any ‘off the shelf’ solutions rehashed here. Your skylight is custom engineered. From the first on-site consultation to our post installation inspection, we aren’t happy until you are.

Design Assistance:

You may, or may not be working with an architect. If you are, we’ll liaise with them regarding design details and specifications. If not, we’ll help you choose a design that best suits your application. Part of this process involves our experienced designers offering you cost-saving suggestions based on our considerable experience. The aim is to maximize the quality and aesthetic appeal while working within your budget.

Once the design is decided upon, shop drawings are produced using the latest C.A.D. (computer aided design) technology. Not only is this a best practice approach, but it also gives the architect and contractor confidence in the integrity of the structure. Drawings of typical designs and construction details are available on disk in Autocad DWG and DXF format and Solidworks.

We now have our own in-house, state of the art, powder coat line with 5 stage pretreatment to meet or exceed AAMA 2605-98 , Voluntary Specification, Performance Requirements and Test Procedures for Superior Performing Organic Coatings on Aluminum Extrusions and Panels.

Peace of mind assured by professional engineering:

Your final skylight design is reviewed, signed, and sealed by a licensed professional engineer to ensure the structural adequacy of the skylight and its component parts. All applicable codes are rigorously observed.

During the process:

To ensure that you have the best possible experience, we assign you your own personal project manager whose responsibility it is to look after your project. They’ll schedule, track and oversee each step of the process and are always available to update you on the progress by phone or email. This helps ensure that your skylight is delivered on schedule and if there are any potential delays, they’re immediately communicated.

",spectrum-skyworks-inc,2006-09-21T20:00:00.000-04:00,NA,,730am - 4 pm,"What kind of skylight would you like today?

Being experts in the area of custom skylight construction means that we","RESIDENTIAL: Aside from providing natural day light, skylights also help in minimizing heating, cooling, and lighting costs, as well as health benefits. Spectrum Skyworks has been manufacturing natural lighting solutions for over 18 years and pride ourselves on our uncompromising standard of quality.
COMMERCIAL: Spectrum Skyworks provides customized versatility for commercial skylight projects, and our skylights meet stringent design criteria. We provide superior product turnaround and continual support from inception to completed project for architects and contractors.
RESTORATION: Do you have an old skylight or aluminum enclosure that needs some attention? Every repair is different and it needs to be assessed by our trained skylight repair specialists.
DEALER INQUIRIES: Spectrum Skyworks fabricates and manufactures custom skylights, and glass canopies, maintaining conscientious attention and quality workmanship on each and every project. We also offer timely engineered shop drawings in AutoCAD and Solid Works.


","For more information on all our services, brands and styles please visit:
www.spectrumskyworks.com
www.spectrumcustomrailings.com
www.dayliter.com
Dayliter designs and manufactures quality skylights, roof doors and awnings, which can be used in Residential, Institutional, Industrial and Commercial applications.","Spectrum Custom Railings has been a quality fabricator and installer of aluminum products through out Western Canada with over 15 years experience. We have a strong history of satisfying customers needs, both in the residential and commercial field and are continuously developing new designs and expanding our product line.

Spectrum Custom Railings is able to provide customers with structurally engineered glass and/or picket guardrails, interior and exterior handrails, fencing, stair railings, gates as well as a wide variety of other aluminum products. Our in house design team will work with you to ensure your custom requirements are met to suit your next project.

We will work closely with Architects, Developers, and Contractors to design a railing system that is not only a key element of the project but is also cost effective solution to meet your needs. We offer standard and custom color powder coated paint with a durable UV resistant paint.

We Provide:
",0,0,,,,,TRUE,TRUE,,,TRUE,FALSE,,76326,Spectrum Skyworks,0,0,38,NA,"Railings, stair railings, outdoor railings, iron railings, wrought iron railings, wood railings, rail, gates, fence, rails, fencing, rail times, fences, fence gate, fence gates, railing, wrought, wrought iron, handrail, handrails, balustrade, balconies, rail simulator, speed rail, iron works, stair steps, balusters, iron work, fence panels, hand rail, banister, hand railing, rail works, ironworks, balustrades, front gates, curtain rails, garden gate, iron gate, gate iron, gates iron, iron gates, ,",0,FALSE,0,0,23,NA,FALSE,f53eeb52a54091f3bf72d20e99a817aec178b772,FALSE,NA,FALSE,FALSE,1823564,-1.0,422,NA,NA,2014-02-21T20:57:51.000-05:00
https://homestars.com/on/port%20coquitlam/railings,25,"c(""https://homestars.com/on/port%20coquitlam/railings?&page=2&"", ""https://homestars.com/on/port%20coquitlam/railings?&page=3&"")",Railings,2911512,NA,/companies/2911512-siam-marine-canada?searched_category_id=422&service_area=2153587,NA,siam-marine-canada,2018-03-05T17:56:06.000-05:00,NA,NA,NA,NA,NA,NA,NA,NA,NA,NA,NA,NA,NA,FALSE,FALSE,NA,NA,FALSE,FALSE,NA,1973697,Siam Marine Canada ,0,0,0,NA,"Railings, stair railings, outdoor railings, iron railings, wrought iron railings, wood railings, rail, gates, fence, rails, fencing, rail times, fences, fence gate, fence gates, railing, wrought, wrought iron, handrail, handrails, balustrade, balconies, rail simulator, speed rail, iron works, stair steps, balusters, iron work, fence panels, hand rail, banister, hand railing, rail works, ironworks, balustrades, front gates, curtain rails, garden gate, iron gate, gate iron, gates iron, iron gates, ,",0,FALSE,0,0,1,0,FALSE,b8ad5b605a4b79362625ce1d2b60af8147849aa7,FALSE,NA,TRUE,FALSE,2153587,-1.0,422,NA,NA,2019-01-05T20:03:50.000-05:00
https://homestars.com/on/port%20coquitlam/railings,25,"c(""https://homestars.com/on/port%20coquitlam/railings?&page=2&"", ""https://homestars.com/on/port%20coquitlam/railings?&page=3&"")",Railings,2863948,NA,/companies/2863948-touch-of-class-aluminum-ironworks?searched_category_id=422&service_area=2006356,"Touch of Class Aluminum & Ironworks is a specialist in designing, production, installation and maintenance of metal gates, metal doors, aluminum and iron gates, iron railings and fences, aluminum railings and fences and other metal products in Coquitlam. It offers a wide range of durable and high quality metal products for homes and businesses in the region.",touch-of-class-aluminum-ironworks,2014-12-19T05:43:40.000-05:00,NA,NA,"Monday to Friday, 8 am to 4:30 pm (PST)",NA,NA,NA,NA,NA,NA,NA,NA,NA,NA,FALSE,FALSE,NA,NA,FALSE,FALSE,NA,1926374,Touch Of Class Aluminum & Ironworks,0,0,0,NA,"Railings, stair railings, outdoor railings, iron railings, wrought iron railings, wood railings, rail, gates, fence, rails, fencing, rail times, fences, fence gate, fence gates, railing, wrought, wrought iron, handrail, handrails, balustrade, balconies, rail simulator, speed rail, iron works, stair steps, balusters, iron work, fence panels, hand rail, banister, hand railing, rail works, ironworks, balustrades, front gates, curtain rails, garden gate, iron gate, gate iron, gates iron, iron gates, ,",0,FALSE,0,0,0,0,FALSE,890d0b1196b8024f26e757398d25fa1edd25dd39,FALSE,NA,FALSE,FALSE,2006356,0,422,NA,NA,NA
https://homestars.com/on/port%20coquitlam/railings,25,"c(""https://homestars.com/on/port%20coquitlam/railings?&page=2&"", ""https://homestars.com/on/port%20coquitlam/railings?&page=3&"")",Railings,2803317,NA,/companies/2803317-elite-aluminum?searched_category_id=422&service_area=1869266,,elite-aluminum,2012-11-23T00:37:47.000-05:00,NA,NA,Mon-Fri 8:00-4:30,NA,NA,NA,NA,NA,NA,NA,NA,NA,NA,FALSE,FALSE,NA,NA,FALSE,FALSE,NA,1866318,Elite Aluminum,0,0,0,NA,"Railings, stair railings, outdoor railings, iron railings, wrought iron railings, wood railings, rail, gates, fence, rails, fencing, rail times, fences, fence gate, fence gates, railing, wrought, wrought iron, handrail, handrails, balustrade, balconies, rail simulator, speed rail, iron works, stair steps, balusters, iron work, fence panels, hand rail, banister, hand railing, rail works, ironworks, balustrades, front gates, curtain rails, garden gate, iron gate, gate iron, gates iron, iron gates, ,",0,FALSE,0,0,0,NA,FALSE,f5bbea44e4f56fcab43edeefbe41fff6e6d9298f,FALSE,NA,FALSE,FALSE,1869266,0,422,NA,NA,NA
https://homestars.com/on/port%20coquitlam/railings,25,"c(""https://homestars.com/on/port%20coquitlam/railings?&page=2&"", ""https://homestars.com/on/port%20coquitlam/railings?&page=3&"")",Railings,2915943,NA,/companies/2915943-tri-city-trim?searched_category_id=422&service_area=2162962,NA,tri-city-trim,2018-05-05T10:49:14.000-04:00,NA,NA,NA,NA,NA,NA,NA,NA,NA,NA,NA,NA,NA,FALSE,FALSE,NA,NA,FALSE,FALSE,NA,1978127,Tri City Trim,0,0,0,NA,"Railings, stair railings, outdoor railings, iron railings, wrought iron railings, wood railings, rail, gates, fence, rails, fencing, rail times, fences, fence gate, fence gates, railing, wrought, wrought iron, handrail, handrails, balustrade, balconies, rail simulator, speed rail, iron works, stair steps, balusters, iron work, fence panels, hand rail, banister, hand railing, rail works, ironworks, balustrades, front gates, curtain rails, garden gate, iron gate, gate iron, gates iron, iron gates, ,",0,FALSE,0,0,1,0,FALSE,1bfd64ef92a0e9a5cdd1c361d08470017a77676a,FALSE,NA,TRUE,FALSE,2162962,-1.0,422,NA,NA,2018-05-05T10:50:31.000-04:00
https://homestars.com/on/port%20coquitlam/railings,25,"c(""https://homestars.com/on/port%20coquitlam/railings?&page=2&"", ""https://homestars.com/on/port%20coquitlam/railings?&page=3&"")",Railings,2965999,NA,/companies/2965999-jp-mechanical-services-inc?searched_category_id=422&service_area=2275303,NA,jp-mechanical-services-inc,2022-03-16T17:21:22.000-04:00,NA,NA,NA,NA,NA,NA,NA,NA,NA,NA,NA,NA,NA,FALSE,FALSE,NA,NA,FALSE,FALSE,NA,2027929,JP Mechanical Services Inc.,0,0,0,NA,"Railings, stair railings, outdoor railings, iron railings, wrought iron railings, wood railings, rail, gates, fence, rails, fencing, rail times, fences, fence gate, fence gates, railing, wrought, wrought iron, handrail, handrails, balustrade, balconies, rail simulator, speed rail, iron works, stair steps, balusters, iron work, fence panels, hand rail, banister, hand railing, rail works, ironworks, balustrades, front gates, curtain rails, garden gate, iron gate, gate iron, gates iron, iron gates, ,",0,FALSE,0,0,1,0,FALSE,4abc577f23e4cfdd41db3de5106ed8382751df8f,FALSE,NA,FALSE,FALSE,2275303,0,422,NA,NA,2022-03-16T17:22:08.000-04:00
https://homestars.com/on/port%20coquitlam/railings,25,"c(""https://homestars.com/on/port%20coquitlam/railings?&page=2&"", ""https://homestars.com/on/port%20coquitlam/railings?&page=3&"")",Railings,2579914,NA,/companies/2579914-empire-aluminum-works-ltd?searched_category_id=422&service_area=1593118,NA,empire-aluminum-works-ltd,2008-03-04T16:55:15.000-05:00,NA,NA,NA,NA,NA,NA,NA,NA,NA,NA,NA,NA,NA,FALSE,FALSE,NA,NA,FALSE,FALSE,NA,1642966,Empire Aluminum Works Ltd,3,3,0,10,"Railings, stair railings, outdoor railings, iron railings, wrought iron railings, wood railings, rail, gates, fence, rails, fencing, rail times, fences, fence gate, fence gates, railing, wrought, wrought iron, handrail, handrails, balustrade, balconies, rail simulator, speed rail, iron works, stair steps, balusters, iron work, fence panels, hand rail, banister, hand railing, rail works, ironworks, balustrades, front gates, curtain rails, garden gate, iron gate, gate iron, gates iron, iron gates, ,",0,FALSE,0,0,0,NA,FALSE,NA,FALSE,2014-06-16T23:28:18.000-04:00,FALSE,FALSE,1593118,84.0286350221,422,NA,NA,NA
https://homestars.com/on/port%20coquitlam/railings,25,"c(""https://homestars.com/on/port%20coquitlam/railings?&page=2&"", ""https://homestars.com/on/port%20coquitlam/railings?&page=3&"")",Railings,2611123,NA,/companies/2611123-arc-aluminum-works?searched_category_id=422&service_area=1624327,NA,arc-aluminum-works,2008-03-04T16:55:15.000-05:00,NA,NA,NA,NA,NA,NA,NA,NA,NA,NA,NA,NA,NA,FALSE,FALSE,NA,NA,FALSE,FALSE,NA,1674175,Arc Aluminum Works,1,1,0,10,"Railings, stair railings, outdoor railings, iron railings, wrought iron railings, wood railings, rail, gates, fence, rails, fencing, rail times, fences, fence gate, fence gates, railing, wrought, wrought iron, handrail, handrails, balustrade, balconies, rail simulator, speed rail, iron works, stair steps, balusters, iron work, fence panels, hand rail, banister, hand railing, rail works, ironworks, balustrades, front gates, curtain rails, garden gate, iron gate, gate iron, gates iron, iron gates, ,",0,FALSE,0,0,0,NA,FALSE,NA,FALSE,NA,FALSE,FALSE,1624327,85.9372378827,422,NA,NA,NA
https://homestars.com/on/port%20coquitlam/railings,25,"c(""https://homestars.com/on/port%20coquitlam/railings?&page=2&"", ""https://homestars.com/on/port%20coquitlam/railings?&page=3&"")",Railings,2871290,NA,/companies/2871290-accurate-contracting?searched_category_id=422&service_area=2035363,NA,accurate-contracting,2015-05-30T15:54:08.000-04:00,NA,NA,NA,NA,NA,NA,NA,NA,NA,NA,NA,NA,NA,FALSE,FALSE,NA,NA,FALSE,FALSE,NA,1933714,Accurate Contracting,1,1,0,3,"Railings, stair railings, outdoor railings, iron railings, wrought iron railings, wood railings, rail, gates, fence, rails, fencing, rail times, fences, fence gate, fence gates, railing, wrought, wrought iron, handrail, handrails, balustrade, balconies, rail simulator, speed rail, iron works, stair steps, balusters, iron work, fence panels, hand rail, banister, hand railing, rail works, ironworks, balustrades, front gates, curtain rails, garden gate, iron gate, gate iron, gates iron, iron gates, ,",0,FALSE,0,0,0,0,FALSE,NA,FALSE,2015-05-30T16:22:48.000-04:00,FALSE,FALSE,2035363,14.0904731421,422,NA,NA,NA
https://homestars.com/on/port%20coquitlam/railings,25,"c(""https://homestars.com/on/port%20coquitlam/railings?&page=2&"", ""https://homestars.com/on/port%20coquitlam/railings?&page=3&"")",Railings,2611115,NA,/companies/2611115-a-m-aluminum?searched_category_id=422&service_area=1624319,NA,a-m-aluminum,2008-03-04T16:55:15.000-05:00,NA,NA,NA,NA,NA,NA,NA,NA,NA,NA,NA,NA,NA,FALSE,FALSE,NA,NA,FALSE,FALSE,NA,1674167,A M Aluminum,0,0,0,NA,"Railings, stair railings, outdoor railings, iron railings, wrought iron railings, wood railings, rail, gates, fence, rails, fencing, rail times, fences, fence gate, fence gates, railing, wrought, wrought iron, handrail, handrails, balustrade, balconies, rail simulator, speed rail, iron works, stair steps, balusters, iron work, fence panels, hand rail, banister, hand railing, rail works, ironworks, balustrades, front gates, curtain rails, garden gate, iron gate, gate iron, gates iron, iron gates, ,",0,FALSE,0,0,0,NA,FALSE,NA,FALSE,NA,FALSE,FALSE,1624319,0,422,NA,NA,NA
https://homestars.com/on/port%20coquitlam/railings,25,"c(""https://homestars.com/on/port%20coquitlam/railings?&page=2&"", ""https://homestars.com/on/port%20coquitlam/railings?&page=3&"")",Railings,2585940,NA,/companies/2585940-loyal-iron?searched_category_id=422&service_area=1599144,NA,loyal-iron,2008-03-04T16:55:15.000-05:00,NA,NA,NA,NA,NA,NA,NA,NA,NA,NA,NA,NA,NA,FALSE,FALSE,NA,NA,FALSE,FALSE,NA,1648992,Loyal Iron,0,0,0,NA,"Railings, stair railings, outdoor railings, iron railings, wrought iron railings, wood railings, rail, gates, fence, rails, fencing, rail times, fences, fence gate, fence gates, railing, wrought, wrought iron, handrail, handrails, balustrade, balconies, rail simulator, speed rail, iron works, stair steps, balusters, iron work, fence panels, hand rail, banister, hand railing, rail works, ironworks, balustrades, front gates, curtain rails, garden gate, iron gate, gate iron, gates iron, iron gates, ,",0,FALSE,0,0,0,NA,FALSE,NA,FALSE,NA,FALSE,FALSE,1599144,0,422,NA,NA,NA
https://homestars.com/on/port%20coquitlam/railings,25,"c(""https://homestars.com/on/port%20coquitlam/railings?&page=2&"", ""https://homestars.com/on/port%20coquitlam/railings?&page=3&"")",Railings,2587892,NA,/companies/2587892-topline-aluminum?searched_category_id=422&service_area=1601096,NA,topline-aluminum,2008-03-04T16:55:15.000-05:00,NA,NA,NA,NA,NA,NA,NA,NA,NA,NA,NA,NA,NA,FALSE,FALSE,NA,NA,FALSE,FALSE,NA,1650944,TopLine Aluminum,0,0,0,NA,"Railings, stair railings, outdoor railings, iron railings, wrought iron railings, wood railings, rail, gates, fence, rails, fencing, rail times, fences, fence gate, fence gates, railing, wrought, wrought iron, handrail, handrails, balustrade, balconies, rail simulator, speed rail, iron works, stair steps, balusters, iron work, fence panels, hand rail, banister, hand railing, rail works, ironworks, balustrades, front gates, curtain rails, garden gate, iron gate, gate iron, gates iron, iron gates, ,",0,FALSE,0,0,0,NA,FALSE,NA,FALSE,NA,FALSE,FALSE,1601096,0,422,NA,NA,NA
https://homestars.com/on/port%20coquitlam/railings,25,"c(""https://homestars.com/on/port%20coquitlam/railings?&page=2&"", ""https://homestars.com/on/port%20coquitlam/railings?&page=3&"")",Railings,2603034,NA,/companies/2603034-mgs-metal-works?searched_category_id=422&service_area=1616238,NA,mgs-metal-works,2008-03-04T16:55:15.000-05:00,NA,NA,NA,NA,NA,NA,NA,NA,NA,NA,NA,NA,NA,FALSE,FALSE,NA,NA,FALSE,FALSE,NA,1666086,MGS Metal Works,0,0,0,NA,"Railings, stair railings, outdoor railings, iron railings, wrought iron railings, wood railings, rail, gates, fence, rails, fencing, rail times, fences, fence gate, fence gates, railing, wrought, wrought iron, handrail, handrails, balustrade, balconies, rail simulator, speed rail, iron works, stair steps, balusters, iron work, fence panels, hand rail, banister, hand railing, rail works, ironworks, balustrades, front gates, curtain rails, garden gate, iron gate, gate iron, gates iron, iron gates, ,",0,FALSE,0,0,0,NA,FALSE,NA,FALSE,NA,FALSE,FALSE,1616238,0,422,NA,NA,NA
