Link,n_hits,all_links,category,id,url,hs_path,profile,permalink,created_at,sic_code,service_area,hours,products,services,brands,specialities,established,employee_cnt,payment_method,diplomas,licenses,memberships,liability_insurance,bonded,project_rate,project_minimum,written_contract,written_warranty,warranty_terms,parent_company_id,name,total_number_of_reviews_cache,total_number_of_approved_reviews_cache,number_of_photos_cache,avg_rating_cache,categories_info_cache,savings_count,claimed_at,subdomain,fraudulent,fraudulent_count,total_number_of_pending_reviews_cache,images_count,completion_percent_cache,bully,secret,replied_to_at_least_one_review_cache,latest_approved_review_created_at,has_set_tasks,lead_purchase_eligible,service_area_id,star_score,quote_button_category,direct_phone,direct_contact
https://homestars.com/on/airdrie/home-automation,6,https://homestars.com/on/airdrie/home-automation,Home Automation,2852410,http://www.libertysecurity.ca,/companies/2852410-liberty-security?searched_category_id=379&service_area=2066340,"Liberty Security provides security, automation, and energy management solutions to residential, commercial and health care customers across Canada. We have installed over 65,000 residential and commercial systems in 9 provinces and 3 territories. We also service more than 90 Health Care facilities in Western Canada. Learn more at www.libertysecurity.ca",liberty-security,2014-04-22T12:16:16.000-04:00,NA,"Calgary, Airdrie, Okotoks, High River, Cochrane, Chestermere, Strathmore, Black Diamond, Turner Valley, Olds, Carstairs, Crossfield, Red Deer, Lethbridge, Priddis, Langdon, ",,"Video Doorbell Cameras, Door/Window Sensors, Motion Detectors, Glass Break Sensors, Flood Sensors, Security Panels, Smoke/Heat Detectors, Freeze Sensors, Medical Pendants, Life Safety alerts, Carbon Monoxide Detectors, Smart Door Locks, Smart Thermostats, Garage Door Modules, Keyfobs, Power Smart Lighting and Appliance Modules.","Security systems, Smart Home Solutions, Business Automation, Alarm Systems, Card Access, Access Control, Video Surveillance systems, Camera systems, CCTV, Life Safety ","GE, Axis, Mobotix, Eyesonic, ",,2005,150,"Visa, Mastercard, Cheque",,,"Better Business Bureau A+, Canadian Security Association, Seniors Association of Greater Edmonton",TRUE,TRUE,Varies,100,TRUE,FALSE,,1914841,Liberty Security,281,210,13,8.66667,"Alarm Systems, Home Alarm Systems, Alarm System Monitoring, Fire Alarm Systems, Home Security Systems, The Alarm, At Home Security, Home Security, Security Systems, Alarm Security, Security Alarm, Security Cameras, Security Company, Security Companies, Home alarm, Alarm home, Alarm security, House security, house alarm, burglar alarm, carbon monoxide, carbon monoxide alarms, business cameras, commercial surveillance systems, surveillance, commercial security cameras, commercial security camera,,Home Automation, Home Automation System, Wireless Home Automation, Home Automation Software, Smart Homes, wire, x10, home theatre, home security security, in home security, home security home, at home security, home security, home home security, control 4, wireless home, light control, the smart home, smart home, a smart home, home smart home, in home security systems, home security systems, security systems home, security systems for home, security systems for the home, home security system, security system home, home system security, security home system, security system for home, in home security system, house of security, in home automation, automation home, about home automation, what is home automation, how to home automation, home automation how to, automation for home, smart house, crestron, automation house, house automation, house of automation, smart homes, automation system, homeautomation, i home remote, remote home, TV Install, TV Wall Mounting, Ceiling Speaker Automation, Ceiling Speaking Installation,Locks & Locksmiths, Door Lock, Master Lock, 24 Hour Locksmiths, key cutting, key cutters, cutting keys, lock in lock, locks, about locks, lock and locks, lock locks, locksmith, the locksmith, locksmith locksmith, a locksmith, be a locksmith, how to be a locksmith, locksmith in, locksmiths in, locksmiths, safes, locksmithing, door lock, padlock, door locks, padlocks, locked out, car keys, locksmith lock, lock and locksmith, lock locksmith, lock smith, smith lock, lockpicking, lock and security, combination lock, lock locksmiths, lock change, change lock, key locks, lock repair, o lock, 24 locksmith, locksmith key, best locks, locks security, locks and security, security locks, 24 hour locksmith, locksmith 24 hour, ,",0,2014-06-05T14:17:31.000-04:00,libertysecurity,FALSE,0,0,17,0,FALSE,0db11fc8c08feaa6f055726e95a9dcf64d572814,TRUE,2018-11-01T13:52:44.000-04:00,TRUE,TRUE,2066340,75.7754218808,379,NA,NA
https://homestars.com/on/airdrie/home-automation,6,https://homestars.com/on/airdrie/home-automation,Home Automation,2855665,http://Audovation.com,/companies/2855665-audovation-inc?searched_category_id=379&service_area=1978831,"Professional Home Audio/Video & Network Services
 
We are a fully insured and licensed company serving Calgary and all surrounding areas.  We offer everything from a basic TV wall mount to whole-home networked audio, video and automation systems.  Best prices and top notch service.
 
Services Include:
Basic and custom TV wall mounting
Multi-room Audio Systems
Audiophile 2-channel Audio Systems
Home Theatre Setup and Troubleshooting
Networking and WiFi boosters
Pre-wire and retrofit
Universal Remote Control Programming
Home Automation and Control Systems
LED Lighting
 
We are an authorized dealer of many top brands including Anthem, Martin Logan, Cambridge Audio, RBH, Marantz, Panasonic Projectors, Epson Projectors and Elunevision Screens.
 
 ",audovation-inc,2014-06-25T19:39:32.000-04:00,NA,NA,,,,,,NA,NA,,,,,FALSE,FALSE,,,FALSE,FALSE,,1918095,Audovation Inc.,39,36,6,9.83333,"Home Theater, Home Theatre System, Home Theatre Projector, Home Theatre Seating, Audio System, electronics, flat panel screen TV stereo, plasma, LCD, home theater how to, home theater home theater, home theatre, theatre home, home cinema, home theater system, home theatre system, surround sound, home theaters, home theaters system, home theater systems, home theatre systems, home theater 5.1, 5.1 home theater, home movie theater, in home movie theater, surround sound systems, samsung home theater, home theater samsung, home theater speaker, home theater lg, lg home theater, home theater best, best home theater, home theater wireless, wireless home theater, surround sound speakers, home theater blu ray, home theater with bly ray, bly ray home theater, speakers for home theater, home theater speakers, speakers home theater, philips home theater, 5.1 home theater system, home theater system 5.1, dvd home theater, bluray home theater, home theatre samsung, home audio systems, home theater receiver, receiver home theater, home theater review, home sounds systems, home theater price, home theater reviews, projectors home theater, antenna, antennas, home theatre, home theater, TV Install, TV Wall Mounting, Ceiling Speaker Automation,
Ceiling Speaking Installation,Home Automation, Home Automation System, Wireless Home Automation, Home Automation Software, Smart Homes, wire, x10, home theatre, home security security, in home security, home security home, at home security, home security, home home security, control 4, wireless home, light control, the smart home, smart home, a smart home, home smart home, in home security systems, home security systems, security systems home, security systems for home, security systems for the home, home security system, security system home, home system security, security home system, security system for home, in home security system, house of security, in home automation, automation home, about home automation, what is home automation, how to home automation, home automation how to, automation for home, smart house, crestron, automation house, house automation, house of automation, smart homes, automation system, homeautomation, i home remote, remote home, TV Install, TV Wall Mounting, Ceiling Speaker Automation, Ceiling Speaking Installation,",1,NA,audovation,FALSE,0,0,6,0,FALSE,9e1c5a1d1eedd1888181edd73d636bd61953f5c2,TRUE,2017-12-29T14:50:15.000-05:00,TRUE,TRUE,1978831,73.8376407558,379,NA,NA
https://homestars.com/on/airdrie/home-automation,6,https://homestars.com/on/airdrie/home-automation,Home Automation,2970152,https://www.telus.com/en/smarthome-security/?CMP=aff_shs_aware_homestars,/companies/2970152-telus-smarthome-security?searched_category_id=379&service_area=2295189,"TELUS is Canada’s #1 home security provider (based on number of subscribers). 

Enjoy the peace of mind and control that comes with TELUS SmartHome Security.

Protect Your Home and Family
Keep an eye on what’s happening in and around your home in real-time, no matter where you are, with Indoor and Outdoor security cameras. You can also view recorded videos as well. 

Smart locks let you lock and unlock your door right from your smartphone. So whether you are leaving the house, or just climbing into bed, you never have to wonder if you forgot to lock the door.

Answer your door even if you’re not home, with a Wi-Fi doorbell camera. You can see and speak with whoever is at the door, even if you are at work or on vacation. 

You can get help when you need it - with 24/7 professional monitoring, you’ll get notifications if unexpected events occur, and our security experts are ready to send emergency services if needed.

Control Your Home with Your Voice or Smartphone
From your smartphone, you can use Amazon Alexa (with TELUS Home Assistant) or Siri to turn on your lights, warm up or cool down your home, arm your SmartHome security system, open or close your garage door, and so much more. 



Save Money on Insurance
According to The Electronic Security Association website alarm.org,  you can save up to 20% on home insurance with a professionally installed 24/7 home monitoring system. 

You can also save up to 6% on your heating bill with smart home automation devices - like a smart thermostat. Better for your wallet and mother nature.


Flexible Installation Options
You can do it yourself - self-install your system on your own time with our online guidance. Or we can do it for you - our professional technicians will safely install your order.
",telus-smarthome-security,2022-07-04T13:00:08.000-04:00,NA,NA,NA,,"Security Cameras, Indoor Camera, Outdoor Camera, Doorbell Camera, Smart Thermostat, Smart Door Lock, Smart Garage Door Opener, Smart Plug, Smart Light Bulb, SmartHome Security Control Panel, Carbon Monoxide Detector, Flood Sensor, Glass Break Sensor, Smart Smoke Sensor, Motion Sensor, Window & Door Sensor, Home Automation, Home Monitoring, Home Alarm System, Smart Home, Professional Home Monitoring, Custom Home Security, Custom Home Monitoring",,,1990,5000,,,,,FALSE,FALSE,,,TRUE,FALSE,,2032063,TELUS - SmartHome Security,6,4,1,9.5,"Alarm Systems, Home Alarm Systems, Alarm System Monitoring, Fire Alarm Systems, Home Security Systems, The Alarm, At Home Security, Home Security, Security Systems, Alarm Security, Security Alarm, Security Cameras, Security Company, Security Companies, Home alarm, Alarm home, Alarm security, House security, house alarm, burglar alarm, carbon monoxide, carbon monoxide alarms, business cameras, commercial surveillance systems, surveillance, commercial security cameras, commercial security camera,,Home Automation, Home Automation System, Wireless Home Automation, Home Automation Software, Smart Homes, wire, x10, home theatre, home security security, in home security, home security home, at home security, home security, home home security, control 4, wireless home, light control, the smart home, smart home, a smart home, home smart home, in home security systems, home security systems, security systems home, security systems for home, security systems for the home, home security system, security system home, home system security, security home system, security system for home, in home security system, house of security, in home automation, automation home, about home automation, what is home automation, how to home automation, home automation how to, automation for home, smart house, crestron, automation house, house automation, house of automation, smart homes, automation system, homeautomation, i home remote, remote home, TV Install, TV Wall Mounting, Ceiling Speaker Automation, Ceiling Speaking Installation,",0,2022-07-04T13:15:37.000-04:00,Telus,FALSE,0,0,2,0,FALSE,ddeb6ba038b91b3462a729205f563774fd7080a3,TRUE,NA,TRUE,TRUE,2295189,83.3513658386,379,NA,NA
https://homestars.com/on/airdrie/home-automation,6,https://homestars.com/on/airdrie/home-automation,Home Automation,2972464,NA,/companies/2972464-tav-group?searched_category_id=379&service_area=2290325,NA,tav-group,2022-08-31T22:37:23.000-04:00,NA,NA,NA,NA,NA,NA,NA,NA,NA,NA,NA,NA,NA,FALSE,FALSE,NA,NA,FALSE,FALSE,NA,2034375,TAV Group,1,1,0,10,"Home Automation, Home Automation System, Wireless Home Automation, Home Automation Software, Smart Homes, wire, x10, home theatre, home security security, in home security, home security home, at home security, home security, home home security, control 4, wireless home, light control, the smart home, smart home, a smart home, home smart home, in home security systems, home security systems, security systems home, security systems for home, security systems for the home, home security system, security system home, home system security, security home system, security system for home, in home security system, house of security, in home automation, automation home, about home automation, what is home automation, how to home automation, home automation how to, automation for home, smart house, crestron, automation house, house automation, house of automation, smart homes, automation system, homeautomation, i home remote, remote home, TV Install, TV Wall Mounting, Ceiling Speaker Automation, Ceiling Speaking Installation,",0,2022-08-31T22:37:58.000-04:00,NA,FALSE,0,0,0,0,FALSE,bb3d04e6e99023425009d55e798e5c6ec07f5e96,FALSE,NA,TRUE,FALSE,2290325,89.3651047863,379,NA,NA
https://homestars.com/on/airdrie/home-automation,6,https://homestars.com/on/airdrie/home-automation,Home Automation,2916690,https://www.firstresponsetech.com/,/companies/2916690-first-response-technical-services-inc?searched_category_id=379&service_area=2164556,"Welcome to First Response Technical Services Inc. Our team are experts in Audit and Business Risk Services and audio visual technology, IT and we specialize in commercial applications. If you are looking to develop small huddle rooms, or large multi purpose rooms, we have the right solution for you. We also offer comprehensive consulting services that can be of real benefit to your next project.  If you are strictly looking to have a non-bias third party review your needs and offer a comprehensive design of your space that would include full schematics, equipment and topologies we can help.  We can provide full bid packages when looking for someone to just help design your spaces and help you open to tender.

***

Contact us today to schedule your appointment. ",first-response-technical-services-inc,2018-05-17T15:21:53.000-04:00,NA,NA,NA,,,,,NA,5,,,,,TRUE,FALSE,,,TRUE,FALSE,,1978874,First Response Technical Services Inc.,1,1,5,8,"Home Automation, Home Automation System, Wireless Home Automation, Home Automation Software, Smart Homes, wire, x10, home theatre, home security security, in home security, home security home, at home security, home security, home home security, control 4, wireless home, light control, the smart home, smart home, a smart home, home smart home, in home security systems, home security systems, security systems home, security systems for home, security systems for the home, home security system, security system home, home system security, security home system, security system for home, in home security system, house of security, in home automation, automation home, about home automation, what is home automation, how to home automation, home automation how to, automation for home, smart house, crestron, automation house, house automation, house of automation, smart homes, automation system, homeautomation, i home remote, remote home, TV Install, TV Wall Mounting, Ceiling Speaker Automation, Ceiling Speaking Installation,",0,2018-05-17T15:22:25.000-04:00,firstresponse,FALSE,0,0,7,0,FALSE,355c85ad42b1cbeffef46fc6e77164618388f421,TRUE,NA,TRUE,FALSE,2164556,51.8906593407,379,NA,NA
https://homestars.com/on/airdrie/home-automation,6,https://homestars.com/on/airdrie/home-automation,Home Automation,2935785,http://www.rynostructured.com,/companies/2935785-ryno-structured-cabling-inc?searched_category_id=379&service_area=2207887,"As an Audio/Visual installer serving Calgary and the surrounding area, my goal is to introduce electronics into your home that enhance your time at home.  Whether it's the TV you've always wanted, or the remote to help you operate it, Ryno offers clean installations at a great price.  We handle everything from wiring to your home network and everything in between.  Electronics can often be confusing and overwhelming as technology evolves so rapidly which makes showing you how to use your system the best part of our job.",ryno-structured-cabling-inc,2019-10-09T09:32:42.000-04:00,NA,NA,NA,NA,NA,NA,NA,NA,NA,NA,NA,NA,NA,FALSE,FALSE,NA,NA,FALSE,FALSE,NA,1997959,Ryno Structured Cabling Inc.,0,0,10,NA,"Home Automation, Home Automation System, Wireless Home Automation, Home Automation Software, Smart Homes, wire, x10, home theatre, home security security, in home security, home security home, at home security, home security, home home security, control 4, wireless home, light control, the smart home, smart home, a smart home, home smart home, in home security systems, home security systems, security systems home, security systems for home, security systems for the home, home security system, security system home, home system security, security home system, security system for home, in home security system, house of security, in home automation, automation home, about home automation, what is home automation, how to home automation, home automation how to, automation for home, smart house, crestron, automation house, house automation, house of automation, smart homes, automation system, homeautomation, i home remote, remote home, TV Install, TV Wall Mounting, Ceiling Speaker Automation, Ceiling Speaking Installation,",0,2019-10-09T09:33:01.000-04:00,NA,FALSE,0,0,11,0,FALSE,33023c3c349441509d200b1a6bef31c04b648628,FALSE,NA,TRUE,FALSE,2207887,0,379,NA,NA
