Link,n_hits,all_links,category,id,url,hs_path,profile,permalink,created_at,sic_code,service_area,hours,products,services,brands,specialities,established,employee_cnt,payment_method,diplomas,licenses,memberships,liability_insurance,bonded,project_rate,project_minimum,written_contract,written_warranty,warranty_terms,parent_company_id,name,total_number_of_reviews_cache,total_number_of_approved_reviews_cache,number_of_photos_cache,avg_rating_cache,categories_info_cache,savings_count,claimed_at,subdomain,fraudulent,fraudulent_count,total_number_of_pending_reviews_cache,images_count,bully,secret,replied_to_at_least_one_review_cache,latest_approved_review_created_at,has_set_tasks,lead_purchase_eligible,service_area_id,star_score,quote_button_category,direct_phone,direct_contact,completion_percent_cache
https://homestars.com/on/orton/general-contractors,11,https://homestars.com/on/orton/general-contractors?&page=2&,General Contractors,2621803,https://www.gni.ca/,/companies/2621803-great-northern-insulation?searched_category_id=372&service_area=2021580,"For over 40 years, we have helped Ontario homeowners and builders build safer, more energy-efficient and sustainable communities. With a broad range of products and services, we are your insulation experts for existing home renovation upgrades and new residential home construction—satisfaction guaranteed. Proudly serving all of Southern Ontario, we are Ontario's largest insulation company and are Energy Star and Foam Masters™ certified. Get in touch for a Free In-Home Assessment—contact us today to learn more. ",great-northern-insulation,2008-03-04T16:55:15.000-05:00,NA,Serving ALL of Ontario,"7 to 5, Mon to Fri","✓ Spray Foam (1/2 lb open cell)
✓ HFO Spray Foam (2 lb closed cell), 
✓ Cellulose (Blown and dense-pack)
✓ Fibreglass (Batts, blown and blanket wrap)
✓ Mineral Wool (Batts)
✓ Hemp (Batts)","We install insulation throughout the home:
✓ Attic Insulation 
✓ Walls Insulation 
✓ Basement Insulation 
✓ Crawlspace Insulation 
✓ Garage Insulation 
✓ Floors Insulation ","We offer high performance, brand name insulation backed by third party warranties. Our certified installers are professionally trained to install all types of insulation.","Spray Foam Insulation, Blown Fibre Insulation, Air Barriers, Old Insulation Removal, Air Sealing & Draft Proofing, Fire Protection, Batts & Vapour Barriers, Specialty Coatings, Soundproofing, Thermal Barrier, Under Slab Insulation.
",1980,300,,,,,TRUE,FALSE,,,TRUE,FALSE,https://www.gni.ca/about/service-commitment-great-northern-insulation,1684855,Great Northern Insulation,1157,881,23,9.49035,"Home Inspection, Home Inspection Service, Checklist Home Inspection, Home Inspector, inspections, how to home inspection, inspection home, ashi, inspection house, house inspection, at home inspections, home inspections, a home inspections, inspections house, house inspections, inspector home, how to be home inspector, home inspector, property inspection, house to home inspections, house inspector, house inspectors, inspectors home, home inspectors, property inspector, homeinspection, inspection checklist, nachi, inspection service, building inspection, building inspector, inspection services, mold inspection, inspection forms, home inspecting, homeinspections, home building inspection, housing inspection, quality inspection, homes inspection, home inspection checklist, checklist for home inspection, house inspection checklist, homes inspections, home building inspections, housing inspector, property inspection checklist, home inspection list, holmes inspection, house inspection list, new home inspection, home inspection check list, new garage, new barn, ,General Contractors, Residential General Contractor, Building Contractor, Additions, Remodeling Contractor,  Renovation, Builder, building construction, renovation, remodeling, construction builders, construction company, construction companies, home repair, construction jobs, home remodeling, general contractors, contractors general, contractor general, contractors construction, construction contractors, home improvement and remodeling, kitchen remodeling, construction contractor, builders contractors, home renovation, general contracting, building contractors, building companies, home renovations, builder contractor, building contractor, remodeling contractor, commercial construction, residential construction, house contractor, concrete contractors, home contractors, general construction, construction general, contractors remodeling, remodeling contractors, remodelers, remodel contractor, remodel contractors, general contract, commercial contractors, renovations contractors, home improvement contractor, licensed contractor, license general contractor, mud room, mudroom, caulking, ,Renovation Advisors, renovation consultant, remodelling advisor, remodeling consultant, remodeling advisor, remodelling consultant, construction consultant, construction advisor, structural, engineer, Renovation Coaching, Renovation Coaching, Coach, home building project management, renovation advisor,,Insulation, Home Insulation, Foam Insulation, Thermal Insulation, Fiberglass Insulation, cellulose insulation, insullation, celulose insulation, sprayfoam insulation, spray foam, what is insulation, insulating, insulated, insulate, insulator, save energy, insulators, foam insulation, insulation foam, foam spray, insulating foam, wall insulation, energy savers, radiant heat, sound insulation, spray in insulation, insulation spray in, insulation spray, spray on insulation, spray insulation, owenscorning, board insulation, insulation board, insulation home, insulation for the home, home insulation, loft insulation, foam insulation spray, insulation foam spray, spray insulation foam, spray on foam insulation, spray in foam insulation, insulation spray foam, spray foam insulation, foam spray insulation, insulation for attic, insulation in attic, attic insulation, insulation attic, insulating board, insulating foam spray, insulating spray foam, house insulation, insulation for house, insulation house, sprayfoam insulation, insulated panels, insulating home, soundproofing,Insulation, ,",1,2009-01-16T10:03:46.000-05:00,gninsulation,FALSE,0,0,29,FALSE,2b7191e9648bac6661136603e296d86a4b669822,TRUE,2022-07-21T22:31:59.000-04:00,TRUE,TRUE,2021580,92.3792522776,372,NA,NA,NA
https://homestars.com/on/orton/general-contractors,11,https://homestars.com/on/orton/general-contractors?&page=2&,General Contractors,2807659,http://www.agmrenovations.com/,/companies/2807659-agm-renovations?searched_category_id=372&service_area=2285067,"AGM Renovations experts provide quality basement and Bathroom Renovation services throughout the GTA and the surrounding area. See our Service Area for the complete list of towns where our  renovation services are offered. We offer 100% satisfaction guarantee on our workmanship and offer competitive prices with exceptional quality.

Expect more and when you need the best; trust AGM Renovations. We guarantee that you will be completely satisfied, which means that you don't pay until you are satisfied.
Our mission is to be committed to excel in the work we do. We are committed to excel and maintain a sense of pride in our all we do! 

AGM Basements, Basement finishing, Basement Renovations, Basement Reno, Finishing Basements, Basement Company, Finished Basements, Basement Expert, Finished Basements Company, Bathroom Renovations, Bathroom remodeling.",agm-renovations,2013-03-21T13:05:30.000-04:00,NA,"Ajax, Aurora, Barrie, Bradford, Brampton, Brock, Brantford, Burlington, Etobicoke, Georgetown, Georgina, East Gwillimbury, West Gwillimbury, Halton Hills, Hamilton, King City, London, Maple, Markham, Milton, Mississauga, Newmarket, Oakville, Oshawa, Pickering, Richmond Hill, Scarborough, Scugog, Stoufville, Thornhill, Toronto, Uxbridge, Vaughan, Whitby, Woodbridge",,"AGM Renovations, Basement finishing, Basement Renovations, Basement Reno, Finishing Basements, Basement Company, Finished Basements, Basement Expert, Finished Basements Company, Bathroom Renovations","AGM Renovations offers Complete basement and Bathroom renovations packages from the professional design through the professional cleaning including:

Drywall- We employ only professional drywall installers and our goal is deliver complete satisfaction to each and every client with the quality of our workmanship and our prompt, reliable service.
    
Taping- Our drywall taping techniques will bring a high quality smooth finish, with a level of excellence you will take pride in.

Painting- We include all wall priming, painting of ceilings, baseboards, casing, crown and cove moldings into our basement construction packages
    
High Grade Laminate Flooring- is standard in our basement renovations packages.

Tiling- Shower, bathroom, or kitchenette tiling will be done by professional tile installers who are employed directly by AGM. A 2 year unlimited warranty is provided to you standard when you finish your basement with AGM
   
Plumbing- Our licensed plumbers will ensure that no problem is left unsolved and you can be sure that any drain or other plumbing defects left by the original house builder will be fixed effectively.

Electrical- We are committed to providing fully licensed electrician service as part of our standard package. Should you ever require an electrical certificate when you decide to sell your property, we will be happy to provide it to you

AGM Basements, Basement finishing, Basement Renovations, Basement Reno, Finishing Basements, Basement Company, Finished Basements, Basement Expert, Finished Basements Company",,"AGM Renovations - offers complete basement and Bathroom renovations packages from professional design to professional cleaning.

AGM Basements, Basement finishing, Basement Renovations, Basement Reno, Finishing Basements, Basement Company, Finished Basements, Basement Expert, Finished Basements Company",18,80,,,"Master Business Licence, Toronto Builder's licence","Built,",TRUE,TRUE,,,TRUE,FALSE,2 year unlimited warranty,1870659,AGM Renovations,613,477,79,9.3522,"Basement Renovation, Basement renovation, Basement remodeling, Basement remodelling, renovating your basement, renovation, waterproofing, remodeling, home renovation, house renovation, water in basement, basement waterproofing,finishing basement, moistureproof, remodeling the house, caulking,General Contractors, Residential General Contractor, Building Contractor, Additions, Remodeling Contractor,  Renovation, Builder, building construction, renovation, remodeling, construction builders, construction company, construction companies, home repair, construction jobs, home remodeling, general contractors, contractors general, contractor general, contractors construction, construction contractors, home improvement and remodeling, kitchen remodeling, construction contractor, builders contractors, home renovation, general contracting, building contractors, building companies, home renovations, builder contractor, building contractor, remodeling contractor, commercial construction, residential construction, house contractor, concrete contractors, home contractors, general construction, construction general, contractors remodeling, remodeling contractors, remodelers, remodel contractor, remodel contractors, general contract, commercial contractors, renovations contractors, home improvement contractor, licensed contractor, license general contractor, mud room, mudroom, caulking, ,Bathroom Renovation, Bathroom renovation, bathroom remodeling, bathroom remodelling, renovating the bathroom, tearing out the bathroom, fixing up the bathroom, bathroom contractors, bathroom vanities, bathroom vanity, design of bathroom, bathroom and design, design for bathroom, design a bathroom, design a bath, bath design, bathroom tile, bathroom cabinets, remodeling a bathroom, bathroom remodeling, remodeling the bathroom, ,Bath renovation, New tub, caulking, ,Kitchen Planning & Renovation, Kitchen Planning And Design, Kitchen Cabinet Planning, Kitchen Design, Kitchen Remodeling, kitchen or, and bathroom, a and a kitchens, kitchens and, for kitchens, a kitchens, kitchens, the house design, cabinets for kitchen, cabinets for the kitchen, cabinets and kitchen, kitchen cabinets, design a kitchen, about kitchen design, a kitchen design, how to kitchen design, design and kitchen, the kitchen design, design for kitchen, kitchen designs, renovation and remodeling, remodeling and renovation, kitchen designer,,Kitchen Renovation, caulking, ,Kitchen & Bathroom - Cabinets & Design, Kitchen Cabinet And Counter, Kitchen Cabinet Hardware, Bathroom Cabinet, Bathroom Wall Cabinet, Bathroom Sink Cabinet, cabinets, kitchens, cabinetry, kitchen and cabinets, cabinets for kitchen, about kitchen cabinets, kitchen cabinets, kitchen cabinets in, cabinets for the kitchen, cabinets and kitchen, cabinets kitchen, kitchen cabinet, cabinet kitchen, the kitchen cabinet, kitchen by design, design kitchen, a kitchen design, design a kitchen, design for kitchen, design and kitchen, design by kitchen, kitchen design, cabinetry kitchen, kitchen cabinetry, designs kitchen, kitchen designs, bathroom vanities, vanity and bathroom, bath and vanity, designer kitchen, ,",0,NA,agm,FALSE,0,2,80,FALSE,a0b9b6e67166497359f0fe46f88ee02725bb0fb4,TRUE,2022-10-23T13:04:19.000-04:00,TRUE,TRUE,2285067,91.6552799888,372,NA,NA,NA
https://homestars.com/on/orton/general-contractors,11,https://homestars.com/on/orton/general-contractors?&page=2&,General Contractors,2941180,NA,/companies/2941180-sts-homes-ltd?searched_category_id=372&service_area=2225040,"Started 2005 as a Small renovation company 
Small project and handy work to the next level of professional renovation with excellent customer service 
We build homes, renovate entire homes, basement and bathrooms, build decks and fences summer time ",sts-homes-ltd,2020-03-02T21:36:18.000-05:00,NA,NA,NA,NA,NA,NA,NA,NA,NA,NA,NA,NA,NA,FALSE,FALSE,NA,NA,FALSE,FALSE,NA,2003354,STS HOMES LTD,37,33,92,9.90909,"General Contractors, Residential General Contractor, Building Contractor, Additions, Remodeling Contractor,  Renovation, Builder, building construction, renovation, remodeling, construction builders, construction company, construction companies, home repair, construction jobs, home remodeling, general contractors, contractors general, contractor general, contractors construction, construction contractors, home improvement and remodeling, kitchen remodeling, construction contractor, builders contractors, home renovation, general contracting, building contractors, building companies, home renovations, builder contractor, building contractor, remodeling contractor, commercial construction, residential construction, house contractor, concrete contractors, home contractors, general construction, construction general, contractors remodeling, remodeling contractors, remodelers, remodel contractor, remodel contractors, general contract, commercial contractors, renovations contractors, home improvement contractor, licensed contractor, license general contractor, mud room, mudroom, caulking, ,Decks, Deck, Wood Deck, Deck Patio Furniture, Patio Heater, Patio Deck, Patio Door, Patio Cover, Patio Umbrella, Patio Furniture Set, Patio Furniture Cushion, the deck, on deck, deck tech, patios, construction plans, how to build a deck, build decks, build a deck, deck plans, design deck, design a deck, deck design, deck building, building a deck, building deck, deck designs, how to make a deck, patio cover, wood deck, deck wood, deck board, patio designs, deck designs plans, deck plans designs, deck builder, deck stain, deck builders, ,",0,2020-03-02T21:36:33.000-05:00,NA,FALSE,0,0,84,FALSE,0461d281d7402732e54d5bfe4447dceb4fc6605d,TRUE,2022-03-29T17:17:21.000-04:00,TRUE,TRUE,2225040,98.0275166342,372,NA,NA,0
https://homestars.com/on/orton/general-contractors,11,https://homestars.com/on/orton/general-contractors?&page=2&,General Contractors,2966360,,/companies/2966360-mareno-services-inc?searched_category_id=372&service_area=2289677,,mareno-services-inc,2022-03-24T18:30:43.000-04:00,NA,NA,NA,,,,,NA,NA,,,,,FALSE,FALSE,,,FALSE,FALSE,,2028278,Mareno Services Inc,8,6,26,10,"Bathroom Renovation, Bathroom renovation, bathroom remodeling, bathroom remodelling, renovating the bathroom, tearing out the bathroom, fixing up the bathroom, bathroom contractors, bathroom vanities, bathroom vanity, design of bathroom, bathroom and design, design for bathroom, design a bathroom, design a bath, bath design, bathroom tile, bathroom cabinets, remodeling a bathroom, bathroom remodeling, remodeling the bathroom, ,Bath renovation, New tub, caulking, ,Basement Renovation, Basement renovation, Basement remodeling, Basement remodelling, renovating your basement, renovation, waterproofing, remodeling, home renovation, house renovation, water in basement, basement waterproofing,finishing basement, moistureproof, remodeling the house, caulking,General Contractors, Residential General Contractor, Building Contractor, Additions, Remodeling Contractor,  Renovation, Builder, building construction, renovation, remodeling, construction builders, construction company, construction companies, home repair, construction jobs, home remodeling, general contractors, contractors general, contractor general, contractors construction, construction contractors, home improvement and remodeling, kitchen remodeling, construction contractor, builders contractors, home renovation, general contracting, building contractors, building companies, home renovations, builder contractor, building contractor, remodeling contractor, commercial construction, residential construction, house contractor, concrete contractors, home contractors, general construction, construction general, contractors remodeling, remodeling contractors, remodelers, remodel contractor, remodel contractors, general contract, commercial contractors, renovations contractors, home improvement contractor, licensed contractor, license general contractor, mud room, mudroom, caulking, ,Kitchen Planning & Renovation, Kitchen Planning And Design, Kitchen Cabinet Planning, Kitchen Design, Kitchen Remodeling, kitchen or, and bathroom, a and a kitchens, kitchens and, for kitchens, a kitchens, kitchens, the house design, cabinets for kitchen, cabinets for the kitchen, cabinets and kitchen, kitchen cabinets, design a kitchen, about kitchen design, a kitchen design, how to kitchen design, design and kitchen, the kitchen design, design for kitchen, kitchen designs, renovation and remodeling, remodeling and renovation, kitchen designer,,Kitchen Renovation, caulking, ,Condominium Renovations, Condo, Apartment, remodeling, renovations, kitchen cabinet, home decor, condo apartments, home improvement, home improvements, remodeling home, home remodeling, remodeling a home, new condo, Condo facelift, 
I ,Condo RenovationsRenovations for a new condo that include removing a drywall and creating an island and a full kitchen remodeling. ,Small rodent in Attic,",0,2022-03-24T18:32:26.000-04:00,marenoservicesinc,FALSE,0,0,22,FALSE,3cd1bd9740434308db86d0350dc7fda89decfb46,TRUE,2022-08-10T21:45:10.000-04:00,TRUE,TRUE,2289677,88.6382432245,372,NA,NA,0
https://homestars.com/on/orton/general-contractors,11,https://homestars.com/on/orton/general-contractors?&page=2&,General Contractors,2962152,https://homecreators.ca/,/companies/2962152-home-creators-renovations?searched_category_id=372&service_area=2266756,"We specialize in interior renovations including bathrooms, kitchen, basement, main floor, second floor, home addition, full home renovations, exterior renovations, and we also do handyman services and repairs.
We offer an end-to-end client experience that includes planning, design, budgeting, staffing, on-site organization, and easy communication ensuring a high quality craftsmanship of our trades every time. 
Our company has a wide range of project experience, and a team with qualified professionals that love what we do.
So we strive for much more than customers satisfaction, but delighted customers with the high quality standards we offer every time.",home-creators-renovations,2021-12-01T09:22:13.000-05:00,NA,NA,NA,,"Kitchen and Bathroom Remodel, Basement and Interior Renovations, Handyman services, Exterior Renovations",,Interior and Exterior Renovations,2019,NA,"Cash, Cheque, E- Transfer",,,,TRUE,FALSE,,,TRUE,FALSE,Yes,2024111,Home Creators Renovations,12,12,73,10,"General Contractors, Residential General Contractor, Building Contractor, Additions, Remodeling Contractor,  Renovation, Builder, building construction, renovation, remodeling, construction builders, construction company, construction companies, home repair, construction jobs, home remodeling, general contractors, contractors general, contractor general, contractors construction, construction contractors, home improvement and remodeling, kitchen remodeling, construction contractor, builders contractors, home renovation, general contracting, building contractors, building companies, home renovations, builder contractor, building contractor, remodeling contractor, commercial construction, residential construction, house contractor, concrete contractors, home contractors, general construction, construction general, contractors remodeling, remodeling contractors, remodelers, remodel contractor, remodel contractors, general contract, commercial contractors, renovations contractors, home improvement contractor, licensed contractor, license general contractor, mud room, mudroom, caulking, ,",0,2021-12-01T09:30:48.000-05:00,homecreatorsrenovation,FALSE,0,0,85,FALSE,6c8359217d19ced003d5ffa22e902369199565bd,TRUE,2022-05-14T12:12:35.000-04:00,TRUE,TRUE,2266756,98.6758941025,372,NA,NA,0
https://homestars.com/on/orton/general-contractors,11,https://homestars.com/on/orton/general-contractors?&page=2&,General Contractors,2959200,https://www.kowalskikonstruction.ca,/companies/2959200-kowalski-konstruction?searched_category_id=372&service_area=2260054,,kowalski-konstruction,2021-08-27T15:01:33.000-04:00,NA,NA,NA,,"✕ General Contractor
✕ Renovations | House Additions | Garages | Installations | Residential | Commercial",,,2017,NA,"Cash, Check, E-Transfer",,,,TRUE,FALSE,,,TRUE,FALSE,,2021177,Kowalski Konstruction,7,7,16,10,"Basement Renovation, Basement renovation, Basement remodeling, Basement remodelling, renovating your basement, renovation, waterproofing, remodeling, home renovation, house renovation, water in basement, basement waterproofing,finishing basement, moistureproof, remodeling the house, caulking,Carpenters, carpenter, finish carpenter, local carpenter, carpenter work, carpenter companies, master carpenter, carpenters and joiners, carpentry, union carpenter, carpenter co, carpenter services, carpenter construction, interior framing, mud room, mudroom, playsets, playground, wooden playset, wooden playground, play set, caulking,,General Contractors, Residential General Contractor, Building Contractor, Additions, Remodeling Contractor,  Renovation, Builder, building construction, renovation, remodeling, construction builders, construction company, construction companies, home repair, construction jobs, home remodeling, general contractors, contractors general, contractor general, contractors construction, construction contractors, home improvement and remodeling, kitchen remodeling, construction contractor, builders contractors, home renovation, general contracting, building contractors, building companies, home renovations, builder contractor, building contractor, remodeling contractor, commercial construction, residential construction, house contractor, concrete contractors, home contractors, general construction, construction general, contractors remodeling, remodeling contractors, remodelers, remodel contractor, remodel contractors, general contract, commercial contractors, renovations contractors, home improvement contractor, licensed contractor, license general contractor, mud room, mudroom, caulking, ,Cabinetry & Millwork, Kitchen Cabinetry, Custom Cabinetry, Bathroom Cabinetry, Architectural Millwork, Millwork, custom millwork, bathroom cabinets, Kitchen cabinets, built-in cabinets, built-in cabinetry,  cabinet makers, custom cabinets kitchen, cabinetry, thomasville kitchen cabinets, cabinet doors, millwork cabinetry, custom kitchen cabinets, kraftmaid cabinets, maple cabinets, wood cabinets, stock cabinets, thermofoil cabinets, laminate cabinets, kitchen cabinets design, cherry cabinets, kitchen cabinet designs, hickory cabinets, wholesale cabinets, custom made cabinets, cabinet millwork, cabinets kitchen, kitchen cabinetry, millwork cabinets, ready to assemble cabinets, quality cabinets, bamboo cabinets, caulking,
,",0,2021-08-27T15:03:29.000-04:00,KowalskiKonstruction,FALSE,0,0,6,FALSE,d380be95a79e2ad5ebfef05119605a165826a53e,TRUE,2022-10-12T13:57:38.000-04:00,TRUE,TRUE,2260054,90.7479065493,372,NA,NA,0
