Link,n_hits,all_links,category,id,url,hs_path,profile,permalink,created_at,sic_code,service_area,hours,products,services,brands,specialities,established,employee_cnt,payment_method,diplomas,licenses,memberships,liability_insurance,bonded,project_rate,project_minimum,written_contract,written_warranty,warranty_terms,parent_company_id,name,total_number_of_reviews_cache,total_number_of_approved_reviews_cache,number_of_photos_cache,avg_rating_cache,categories_info_cache,savings_count,subdomain,fraudulent,fraudulent_count,total_number_of_pending_reviews_cache,images_count,completion_percent_cache,bully,secret,replied_to_at_least_one_review_cache,latest_approved_review_created_at,has_set_tasks,lead_purchase_eligible,service_area_id,star_score,quote_button_category,direct_phone,direct_contact,claimed_at
https://homestars.com/on/nisku/solar-water-heating,5,https://homestars.com/on/nisku/solar-water-heating,Solar Water Heating,2866726,http://www.eazypeazyplumbing.ca,/companies/2866726-eazy-peazy-plumbing-gas?searched_category_id=486&service_area=2017009,"Here at EAZY PEAZY Plumbing & Gas every job small or large has our top priority in quality & efficiency! We like to make a stressful situation or a home renovation as comfortable and ""eazy"" as possible! We want to build relationships with our clients and do future work for years to come. For any details or questions about our company or services please feel free to contact us anytime or have a look through our site! 

""We're #1 at fixing all your #2 problems!""

Thank you for your future business!
EAZY PEAZY Plumbing & Gas LTD.
(780)995-0040
Jeff@eazypeazyplumbing.ca
www.eazypeazyplumbing.ca",eazy-peazy-plumbing-gas,2015-02-25T17:54:21.000-05:00,NA,"Edmonton, St.Albert, Morinville, Sherwoodpark, Spruce Grove, Stony Plain & Area",7am-7pm,"Bio organic products for clogged drains. Use for dishwashers, LAV sinks and or tubs/showers","Hot water tanks, furnaces, fixture upgrades, faucet repairs, shower/tub upgrade or repairs, building maintenance, garden hoses, gas line services. Any plumbing or gas fitting required. ","Delta, Kohler, Moen, Waltec, AO SMITH, Bradford white, Lennox, etc.","Basement developments, renovations, smaller unique jobs, speciality landscaping, underground gas lines, BBQ gas lines, hot water tanks.",NA,NA,"Cash, cheque, credit cards",,Fully licensed ,,TRUE,TRUE,,$120,TRUE,FALSE,Specified per job,1929151,Eazy Peazy Plumbing & Gas,103,90,6,9.75556,"Plumbing, Plumber, Plumbers, Plumbing Contractor, Plumbing Repair, toilet repair, fixing toilet, fixing sink, broken faucet, faucet repair, tap repair, leaking toilet, leaking sink, leaking pipes, drain snaking, at plumbing, plumbing in, what is plumbing, a plumbing, the plumbing, plumbing and, how to plumbing, plumbing a, plumbing how to, an plumbing, a plumber, plumber, the plumber, plumber plumber, plumber in, how to plumber, plumbers in, the plumbers, plumbers, plumbing pipe, how to plumb, pipes and plumbing, plumbing pipes, pipes for plumbing, plummer, plumbing supplies, plumbing supply, plumbing heating, plumbing & heating, heating and plumbing, heating plumbing, plumbing and heating, pipe plumber, plumbing stores, plumbing suppliers, the plumbs centre, plumb centre, ,Heating & Air Conditioning, Air Conditioning Installation, Air Conditioning Repair, Heating Oil, Heating System, heat, furnace, a/c, air conditioning, air conditioner, ac air conditioning, air conditioners, furnace, furnaces, airconditioner, lenneox, airconditioning, hvac, what is hvac, air condition, trane, hvac air conditioning, air conditioning hvac, a heating and air, air heating, heating & air, heating and air, heating air, heat pump, air conditioning units, air conditioning unit, unit air conditioning, air conditioner unit, air conditioner units, heating & cooling, heating and cooling, heating cooling, cooling and heating, system heating, heating system, air conditioning cooling, heat and air, heat air, heat & air, air and heat, air conditioning and heating, heating and air conditioning, air conditioning heating, air conditioning & heating, a and a heating and air conditioning, heating air conditioning, heat pumps, airconditioners, systems heating, heating systems, portable air conditioner, cooling system, Furnace Humidifier,  heating and cooling contractors, heat pump installation, home heating, heating ventilation and air conditioning, hvac industry, residential heat pump, heating services, heating contractor, homes heating, central heat, heat sources,  new heating systems, industrial air conditioning, radiant floor heating,  floor heating, central cooling and heating systems, residential heating, heat pump installers,  thermostat, in floor heating, ductless heat pump, programmable thermostat, mini split heat pump, heated floors, hvac systems, hvac technician, what is a heat pump, climate control, what does hvac stand for, electric heating, electric floor heating, new furnace, heat and temperature, h vac, heatpump, hvac design, electric heat, central heating, hvac engineer, home heating systems, hvac supply, thermo stat, heat pumps prices, heat pump efficiency, split heat pump, hvac maintenance, in floor heating cost, electric heat pumps, boiler heating systems, hvac unit, hvac mechanic, hvac repair, commercial hvac, hvac installation, heated tile floor, hvac specialist, hvac services, types of heating systems, hvac tech, air con unit,  air conditioner, canada air conditioner, air condition unit, air conditioning canada, portable air conditioner, room air conditioning, mobile air conditioning, portable ac, indoor air conditioner,Solar Panels, Solar Panels, Solar Panel, ,Solar Water Heating, Solar Water Heating, Solar Water Heating Installation, Heating,",4,eazypeazy,FALSE,0,0,5,0,FALSE,8742ae5bfc068f7406765936c32ae0f3af3d4d60,TRUE,2020-10-07T07:35:12.000-04:00,TRUE,TRUE,2017009,84.5265994688,486,NA,NA,NA
https://homestars.com/on/nisku/solar-water-heating,5,https://homestars.com/on/nisku/solar-water-heating,Solar Water Heating,2613336,http://www.hydro-flo.ca,/companies/2613336-hydro-flo-plumbing-and-heating?searched_category_id=486&service_area=2123424,"Hydro-Flo Plumbing and Heating Ltd offers HVAC, plumbing and sewer service and installations in Edmonton Alberta and surrounding areas. The includes Leduc, Beaumont, Saint Albert, Spruce Grove, Stoney Plain, Nisku, Millet, Sherwood Park, Sturgeon County, and Fort Saskatchewan.

We operate 24 hours a day for all air conditioning, heating, sewer and plumbing emergencies.

In addition, we offer new installation of major HVAC Equipment like hot water heaters, boilers, rooftop units, furnaces, and plumbing systems.  

We also offer 24 hour drain cleaning, sewer steaming  and video line inspection.

All estimates are free and services are guaranteed. 

Financing Options are available for major equipment.

We are licensed, bonded and insured and can tackle any project from a simple service to large new construction or retrofit project. ",hydro-flo-plumbing-and-heating,2008-03-04T16:55:15.000-05:00,NA,NA,NA,"hot water heaters, tankless water heaters, boilers, furnaces, water softeners, ventilation, back flow preventers, cross connection devices, plumbing and drainage systems, ventilation systems, HRV's, back water valves, gas lines, air conditioning, and HVAC.","HVAC, heating, cooling, plumbing and drain cleaning","Payne, Carrier, Bryant, Heil, Trane, Rheem, Grundfos, Bell and Gossett, John Woods, Bradford Whyte, AO Smith, LAARS, Munchkin, Watts, Tamas, Viessmann, Navien, Takagi, Rheem, Giant, American Standard, Delta, Price Pfister, Moen, Kholer, Delta, Armstrong, Fusion, NTI, Rheem","Hydronics, Boilers, Pumps, Hot Water Tanks, HVAC,  Furnaces and Air Conditioning. ",2006,16,Visa/Mastercard/Amex/Cash/Certified Cheque,"Provincal Gas, Plumbing, and HVAC trained and certified. Epcor certified backflow preventer testing,",Provincial Gas Fitting/Plumbing/Bonded,ECA/BBB/AWWA/BOMA/CSA,TRUE,TRUE,TBA - Negotiated ,$100,TRUE,FALSE,1 Year Warranty Workmanship/Equipment as per Manufacturer,1676388,Hydro Flo Plumbing And Heating,82,70,435,9.72857,"Plumbing, Plumber, Plumbers, Plumbing Contractor, Plumbing Repair, toilet repair, fixing toilet, fixing sink, broken faucet, faucet repair, tap repair, leaking toilet, leaking sink, leaking pipes, drain snaking, at plumbing, plumbing in, what is plumbing, a plumbing, the plumbing, plumbing and, how to plumbing, plumbing a, plumbing how to, an plumbing, a plumber, plumber, the plumber, plumber plumber, plumber in, how to plumber, plumbers in, the plumbers, plumbers, plumbing pipe, how to plumb, pipes and plumbing, plumbing pipes, pipes for plumbing, plummer, plumbing supplies, plumbing supply, plumbing heating, plumbing & heating, heating and plumbing, heating plumbing, plumbing and heating, pipe plumber, plumbing stores, plumbing suppliers, the plumbs centre, plumb centre, ,Heating & Air Conditioning, Air Conditioning Installation, Air Conditioning Repair, Heating Oil, Heating System, heat, furnace, a/c, air conditioning, air conditioner, ac air conditioning, air conditioners, furnace, furnaces, airconditioner, lenneox, airconditioning, hvac, what is hvac, air condition, trane, hvac air conditioning, air conditioning hvac, a heating and air, air heating, heating & air, heating and air, heating air, heat pump, air conditioning units, air conditioning unit, unit air conditioning, air conditioner unit, air conditioner units, heating & cooling, heating and cooling, heating cooling, cooling and heating, system heating, heating system, air conditioning cooling, heat and air, heat air, heat & air, air and heat, air conditioning and heating, heating and air conditioning, air conditioning heating, air conditioning & heating, a and a heating and air conditioning, heating air conditioning, heat pumps, airconditioners, systems heating, heating systems, portable air conditioner, cooling system, Furnace Humidifier,  heating and cooling contractors, heat pump installation, home heating, heating ventilation and air conditioning, hvac industry, residential heat pump, heating services, heating contractor, homes heating, central heat, heat sources,  new heating systems, industrial air conditioning, radiant floor heating,  floor heating, central cooling and heating systems, residential heating, heat pump installers,  thermostat, in floor heating, ductless heat pump, programmable thermostat, mini split heat pump, heated floors, hvac systems, hvac technician, what is a heat pump, climate control, what does hvac stand for, electric heating, electric floor heating, new furnace, heat and temperature, h vac, heatpump, hvac design, electric heat, central heating, hvac engineer, home heating systems, hvac supply, thermo stat, heat pumps prices, heat pump efficiency, split heat pump, hvac maintenance, in floor heating cost, electric heat pumps, boiler heating systems, hvac unit, hvac mechanic, hvac repair, commercial hvac, hvac installation, heated tile floor, hvac specialist, hvac services, types of heating systems, hvac tech, air con unit,  air conditioner, canada air conditioner, air condition unit, air conditioning canada, portable air conditioner, room air conditioning, mobile air conditioning, portable ac, indoor air conditioner,Drain Services, blocked drain, clogged drain, overflowing drain, roots in drain, sewage back up into house, drain repair, drain, plumber, plumbers, drains, sewer, drainage, clogged, septic tank, drain and sewer, sewer drain, sewer and drain, plumbing supplies, plummer, rooter rooter, plumbing and heating, heating and plumbing, plumbing heating, drain pipe, cleaning drain, cleaning the drain, drain cleaning, plumber heating, septic systems, cleaning drains, drain cleaner, water drainage, drain pipes, clean drain, drain clean, drainage pipe, plumbing service, service plumbing, drain cleaners, plumbing company, plumbing services, services plumbing, french drain, drainage systems, drainage pipes, septic plumbing, shower drains, drain systems, sewer line, french drains, caulking,,Gas Line Installation, natural gas, propane, water heater, furnace, barbeque, bbq, appliance servicing repair,Furnace Humidifier, ,Solar Panels, Solar Panels, Solar Panel, ,Solar Water Heating, Solar Water Heating, Solar Water Heating Installation, Heating,",2,hydro-flo,FALSE,0,0,437,NA,FALSE,d6a7fb56d9e634d584e771762e639f08f68a0fb7,TRUE,2022-05-17T12:40:08.000-04:00,TRUE,TRUE,2123424,96.9448513089,486,NA,NA,2016-02-17T11:14:31.000-05:00
https://homestars.com/on/nisku/solar-water-heating,5,https://homestars.com/on/nisku/solar-water-heating,Solar Water Heating,2673398,https://www.mckinleyheating.com/,/companies/2673398-mckinley-heating-service-experts?searched_category_id=486&service_area=1686602,"
Always Expert Service in Edmonton – Guaranteed. 

If you need a job done right, you call in the experts. At McKinley Heating Service Experts Heating & Air Conditioning in Edmonton, we’re passionate about performing quality HVAC repair and installation work. We’re so confident in our work, we even put it in writing. Our 100% Satisfaction Guarantee shows our commitment to upholding the highest level of heating and air conditioning services in the industry. Moreover, McKinley Heating Service Experts in Edmonton repairs, sells and installs more heating and cooling systems than any other HVAC repair and service company in the U.S. and Canada – more people trust us with their home comfort, so you know your home is in good hands.
 
McKinley Heating Service Experts in Edmonton will take care of all your home comfort needs. Whether your air conditioner or furnace breaks on the day you need it most or you’re in search of indoor air quality solutions that reach the highest EPA and ENERGY STAR® standards, you can count on our Edmonton team. We’re experts in heating and cooling, and superior service is what we do best.
",mckinley-heating-service-experts,2008-03-04T16:55:15.000-05:00,NA,,,,"McKinley Heating Service Experts in Edmonton repairs, sells and installs heating and cooling systems","We are a Premier Lennox dealer, with expert service for all HVAC brands and models.
",,1968,NA,,,,,TRUE,TRUE,,,TRUE,FALSE,,1736450,Mc Kinley Heating Service Experts,92,78,20,9.80769,"Heating & Air Conditioning, Air Conditioning Installation, Air Conditioning Repair, Heating Oil, Heating System, heat, furnace, a/c, air conditioning, air conditioner, ac air conditioning, air conditioners, furnace, furnaces, airconditioner, lenneox, airconditioning, hvac, what is hvac, air condition, trane, hvac air conditioning, air conditioning hvac, a heating and air, air heating, heating & air, heating and air, heating air, heat pump, air conditioning units, air conditioning unit, unit air conditioning, air conditioner unit, air conditioner units, heating & cooling, heating and cooling, heating cooling, cooling and heating, system heating, heating system, air conditioning cooling, heat and air, heat air, heat & air, air and heat, air conditioning and heating, heating and air conditioning, air conditioning heating, air conditioning & heating, a and a heating and air conditioning, heating air conditioning, heat pumps, airconditioners, systems heating, heating systems, portable air conditioner, cooling system, Furnace Humidifier,  heating and cooling contractors, heat pump installation, home heating, heating ventilation and air conditioning, hvac industry, residential heat pump, heating services, heating contractor, homes heating, central heat, heat sources,  new heating systems, industrial air conditioning, radiant floor heating,  floor heating, central cooling and heating systems, residential heating, heat pump installers,  thermostat, in floor heating, ductless heat pump, programmable thermostat, mini split heat pump, heated floors, hvac systems, hvac technician, what is a heat pump, climate control, what does hvac stand for, electric heating, electric floor heating, new furnace, heat and temperature, h vac, heatpump, hvac design, electric heat, central heating, hvac engineer, home heating systems, hvac supply, thermo stat, heat pumps prices, heat pump efficiency, split heat pump, hvac maintenance, in floor heating cost, electric heat pumps, boiler heating systems, hvac unit, hvac mechanic, hvac repair, commercial hvac, hvac installation, heated tile floor, hvac specialist, hvac services, types of heating systems, hvac tech, air con unit,  air conditioner, canada air conditioner, air condition unit, air conditioning canada, portable air conditioner, room air conditioning, mobile air conditioning, portable ac, indoor air conditioner,Solar Panels, Solar Panels, Solar Panel, ,Solar Water Heating, Solar Water Heating, Solar Water Heating Installation, Heating,",3,mckinleyheating,FALSE,0,0,31,NA,FALSE,04a2fa1dddb5374102f6eb1782ba99af82ea1ab4,TRUE,2020-06-01T17:28:10.000-04:00,TRUE,TRUE,1686602,88.096775905,486,NA,NA,2011-06-28T14:30:32.000-04:00
https://homestars.com/on/nisku/solar-water-heating,5,https://homestars.com/on/nisku/solar-water-heating,Solar Water Heating,2786028,http://www.thefurnacecompany.com/,/companies/2786028-the-furnace-company?searched_category_id=486&service_area=1843135,"At Reliance The Furnace Company, the safety and well-being of both our Customers and our Team Members is always our top priority. We are actively monitoring the Coronavirus (COVID-19) situation and are taking precautionary measures to aid in keeping our communities safe. We have implemented strict safety protocols to provide both our Customers and Team members with peace of mind during this challenging time. We continue to provide the exceptional customer experiences we are so well known for and want you to know that we are here for you when you need us.

To help with prevention, we are taking the following precautionary measures to protect our Customers.

Our Team Members have been equipped with an ample supply of:

* Hand sanitizers
* Disinfectant wipes
* Masks
* Single-use gloves
* Boot covers

We know that this is a difficult time for all and we want you to know that we will be there for you and are taking all the necessary precautions to keep you and your family comfortable and safe.



Reliance™ - The Furnace Company has been delivering high quality home comfort products and services to the Edmonton market for over 10 years. We were the first Lennox Premier Dealer in Edmonton and are the only Capital Region based dealer to have won the prestigious Dave Lennox Award, as one of the Top 25 Dealers in North America out of over 6500 dealers.  Now part of the Reliance™ national network, we bring over 40 years of experience with a full service of heating and cooling solutions, ranging from sales and service, financing to rental options. This means you can trust that Reliance™ - The Furnace Company will be here for the long haul and continue to offer you the same exceptional service our customers have come to expect.
When you choose Reliance™- The Furnace Company, you’re choosing one of the largest HVAC providers in Canada, with over 1.2 million customers and growing. You can expect your call to be answered 24 hours a day, 7 days a week, 365 days a year and one of the largest networks of licensed technicians in Canada.
After all, we believe you are buying much more than home comfort equipment, you’re buying a relationship. As you can see, it really is all about you! Your satisfaction is our top priority.

Some services that we offer are, Furnaces, Air-Conditioners and Water Heaters

Our Mission:
We provide our customers peace of mind. We take the risk out of products and services that are essential to their lives and businesses. We make it easy.
888-837-1451 is a TOLL FREE No., please feel free to contact!! ",the-furnace-company,2011-03-25T19:44:27.000-04:00,NA,,,"Furnaces, Air-Conditioners and Water Heaters",,"Lennox, RHEEM, Enviro-Sense",,NA,NA,,,,,TRUE,TRUE,,,TRUE,FALSE,,1849080,Reliance The Furnace Company   Edmonton,679,579,13,8.86528,"Heating & Air Conditioning, Air Conditioning Installation, Air Conditioning Repair, Heating Oil, Heating System, heat, furnace, a/c, air conditioning, air conditioner, ac air conditioning, air conditioners, furnace, furnaces, airconditioner, lenneox, airconditioning, hvac, what is hvac, air condition, trane, hvac air conditioning, air conditioning hvac, a heating and air, air heating, heating & air, heating and air, heating air, heat pump, air conditioning units, air conditioning unit, unit air conditioning, air conditioner unit, air conditioner units, heating & cooling, heating and cooling, heating cooling, cooling and heating, system heating, heating system, air conditioning cooling, heat and air, heat air, heat & air, air and heat, air conditioning and heating, heating and air conditioning, air conditioning heating, air conditioning & heating, a and a heating and air conditioning, heating air conditioning, heat pumps, airconditioners, systems heating, heating systems, portable air conditioner, cooling system, Furnace Humidifier,  heating and cooling contractors, heat pump installation, home heating, heating ventilation and air conditioning, hvac industry, residential heat pump, heating services, heating contractor, homes heating, central heat, heat sources,  new heating systems, industrial air conditioning, radiant floor heating,  floor heating, central cooling and heating systems, residential heating, heat pump installers,  thermostat, in floor heating, ductless heat pump, programmable thermostat, mini split heat pump, heated floors, hvac systems, hvac technician, what is a heat pump, climate control, what does hvac stand for, electric heating, electric floor heating, new furnace, heat and temperature, h vac, heatpump, hvac design, electric heat, central heating, hvac engineer, home heating systems, hvac supply, thermo stat, heat pumps prices, heat pump efficiency, split heat pump, hvac maintenance, in floor heating cost, electric heat pumps, boiler heating systems, hvac unit, hvac mechanic, hvac repair, commercial hvac, hvac installation, heated tile floor, hvac specialist, hvac services, types of heating systems, hvac tech, air con unit,  air conditioner, canada air conditioner, air condition unit, air conditioning canada, portable air conditioner, room air conditioning, mobile air conditioning, portable ac, indoor air conditioner,Solar Panels, Solar Panels, Solar Panel, ,Solar Water Heating, Solar Water Heating, Solar Water Heating Installation, Heating,Water Filtration & Purification, water purification, bottled water service, water treatment, water delivery, water softener systems, hard water specialists, soft water systems,Plumbing, Plumber, Plumbers, Plumbing Contractor, Plumbing Repair, toilet repair, fixing toilet, fixing sink, broken faucet, faucet repair, tap repair, leaking toilet, leaking sink, leaking pipes, drain snaking, at plumbing, plumbing in, what is plumbing, a plumbing, the plumbing, plumbing and, how to plumbing, plumbing a, plumbing how to, an plumbing, a plumber, plumber, the plumber, plumber plumber, plumber in, how to plumber, plumbers in, the plumbers, plumbers, plumbing pipe, how to plumb, pipes and plumbing, plumbing pipes, pipes for plumbing, plummer, plumbing supplies, plumbing supply, plumbing heating, plumbing & heating, heating and plumbing, heating plumbing, plumbing and heating, pipe plumber, plumbing stores, plumbing suppliers, the plumbs centre, plumb centre, ,",0,Reliancethefurnaceco,FALSE,0,0,12,100,FALSE,96468f999b92c6b5f42da6c65a35d3bceaf2ff7f,TRUE,2017-08-11T15:15:49.000-04:00,TRUE,TRUE,1843135,86.8933276359,486,NA,NA,2011-05-29T17:09:49.000-04:00
