Link,n_hits,all_links,category,id,url,hs_path,profile,permalink,created_at,sic_code,service_area,hours,products,services,brands,specialities,established,employee_cnt,payment_method,diplomas,licenses,memberships,liability_insurance,bonded,project_rate,project_minimum,written_contract,written_warranty,warranty_terms,parent_company_id,name,total_number_of_reviews_cache,total_number_of_approved_reviews_cache,number_of_photos_cache,avg_rating_cache,categories_info_cache,savings_count,claimed_at,subdomain,fraudulent,fraudulent_count,total_number_of_pending_reviews_cache,images_count,completion_percent_cache,bully,secret,replied_to_at_least_one_review_cache,latest_approved_review_created_at,has_set_tasks,lead_purchase_eligible,service_area_id,star_score,quote_button_category,direct_phone,direct_contact
https://homestars.com/on/bayview/furniture,80,"c(""https://homestars.com/on/bayview/furniture?&page=2&"", ""https://homestars.com/on/bayview/furniture?&page=3&"", ""https://homestars.com/on/bayview/furniture?&page=4&"", ""https://homestars.com/on/bayview/furniture?&page=5&"", ""https://homestars.com/on/bayview/furniture?&page=6&"", ""https://homestars.com/on/bayview/furniture?&page=7&"", ""https://homestars.com/on/bayview/furniture?&page=8&"")",Furniture,225943,http://www.suite22.ca,/companies/225943-suite-22-interiors?searched_category_id=364&service_area=1816462,"Visit our 4000 sq. ft. showroom in the Toronto Design District or our 22,000 sq. ft. showroom in Markham and immerse yourself in Italian furniture and design. We offer a wide selection of modern furniture ranging from the perfect bed to your dream extendable dining table. We offer custom pieces designed to suit your lifestyle and space whether it be space-saving furniture for your modern condo or large sectional sofas for your grand living room.",suite-22-interiors,2006-02-14T19:00:00.000-05:00,NA,"Brampton, Concord, Etobicoke, Markham, Mississauga, Newmarket, North York, Oakville, Richmond Hill, Scarborough, Thornhill, Toronto, Unionville, Vaughan, Woodbridge ",,NA,NA,NA,NA,0,0,NA,NA,NA,NA,FALSE,FALSE,NA,NA,FALSE,FALSE,NA,76909,Suite 22 Interiors,2,2,0,5,"Furniture, Bedroom Furniture, Office Furniture, Furniture Store, Kid Furniture, Patio Furniture, Baby Furniture, Contemporary Furniture, Dining Room Furniture, furniture stores, the furniture store, furniture store, furniture shops, office furniture, patio furniture, home furnishings, the furniture warehouse, warehouse furniture, furniture warehouse, home furniture, furniture shop, bedroom furniture, furniture bedroom, home decorating, outdoor furniture, room furniture, room to room furniture, outside furniture, used furniture, bed furniture, house furniture, city furniture, furniture city, outlet furniture, furniture outlet, wood furniture, furniture for sale, furniture sale, sale furniture, furniture on sale, out door furniture, cheap furniture, furniture cheap, furnitures, sofa furniture, furniture modern, modern furniture, furniture discount, discount furniture, old furniture, furniture outlets, ,",0,2010-11-02T12:34:04.000-04:00,NA,FALSE,0,0,0,NA,FALSE,69824e26f9585df80a5414785df147d4ffefdd34,FALSE,2007-07-02T20:00:00.000-04:00,FALSE,FALSE,1816462,34.6185731912,364,NA,NA
https://homestars.com/on/bayview/furniture,80,"c(""https://homestars.com/on/bayview/furniture?&page=2&"", ""https://homestars.com/on/bayview/furniture?&page=3&"", ""https://homestars.com/on/bayview/furniture?&page=4&"", ""https://homestars.com/on/bayview/furniture?&page=5&"", ""https://homestars.com/on/bayview/furniture?&page=6&"", ""https://homestars.com/on/bayview/furniture?&page=7&"", ""https://homestars.com/on/bayview/furniture?&page=8&"")",Furniture,2857407,NA,/companies/2857407-homesource?searched_category_id=364&service_area=1984885,NA,homesource,2014-08-06T20:35:32.000-04:00,NA,NA,NA,NA,NA,NA,NA,NA,NA,NA,NA,NA,NA,FALSE,FALSE,NA,NA,FALSE,FALSE,NA,1919837,Homesource,1,1,0,0,"Furniture, Bedroom Furniture, Office Furniture, Furniture Store, Kid Furniture, Patio Furniture, Baby Furniture, Contemporary Furniture, Dining Room Furniture, furniture stores, the furniture store, furniture store, furniture shops, office furniture, patio furniture, home furnishings, the furniture warehouse, warehouse furniture, furniture warehouse, home furniture, furniture shop, bedroom furniture, furniture bedroom, home decorating, outdoor furniture, room furniture, room to room furniture, outside furniture, used furniture, bed furniture, house furniture, city furniture, furniture city, outlet furniture, furniture outlet, wood furniture, furniture for sale, furniture sale, sale furniture, furniture on sale, out door furniture, cheap furniture, furniture cheap, furnitures, sofa furniture, furniture modern, modern furniture, furniture discount, discount furniture, old furniture, furniture outlets, ,",0,NA,NA,FALSE,0,0,0,0,FALSE,da8ceb9b3dbb9ebe8c2a470a710ab251e46df797,FALSE,NA,TRUE,FALSE,1984885,0.0,364,NA,NA
https://homestars.com/on/bayview/furniture,80,"c(""https://homestars.com/on/bayview/furniture?&page=2&"", ""https://homestars.com/on/bayview/furniture?&page=3&"", ""https://homestars.com/on/bayview/furniture?&page=4&"", ""https://homestars.com/on/bayview/furniture?&page=5&"", ""https://homestars.com/on/bayview/furniture?&page=6&"", ""https://homestars.com/on/bayview/furniture?&page=7&"", ""https://homestars.com/on/bayview/furniture?&page=8&"")",Furniture,192927,,/companies/192927-4-u-furniture-centrepoint?searched_category_id=364&service_area=1801284,Specializing in solid wood furniture.  Delivery available,4-u-furniture-centrepoint,2008-02-13T10:14:13.000-05:00,NA,"Etobicoke, Markham, Mississauga, North York, Richmond Hill, Scarborough, Thornhill, Toronto, Unionville, Vaughan, Woodbridge ","M-F 10am-9pm, Sat 10am-6pm, Sun 12pm-5pm",,,,,0,0,,,,,FALSE,FALSE,,,FALSE,FALSE,,50324,4 U Furniture  Centrepoint,100,67,0,1.27612,"Furniture, Bedroom Furniture, Office Furniture, Furniture Store, Kid Furniture, Patio Furniture, Baby Furniture, Contemporary Furniture, Dining Room Furniture, furniture stores, the furniture store, furniture store, furniture shops, office furniture, patio furniture, home furnishings, the furniture warehouse, warehouse furniture, furniture warehouse, home furniture, furniture shop, bedroom furniture, furniture bedroom, home decorating, outdoor furniture, room furniture, room to room furniture, outside furniture, used furniture, bed furniture, house furniture, city furniture, furniture city, outlet furniture, furniture outlet, wood furniture, furniture for sale, furniture sale, sale furniture, furniture on sale, out door furniture, cheap furniture, furniture cheap, furnitures, sofa furniture, furniture modern, modern furniture, furniture discount, discount furniture, old furniture, furniture outlets, ,",0,2008-07-28T08:45:11.000-04:00,NA,FALSE,0,0,0,NA,FALSE,16fc3689faa09facb050c5f23c2081fb2e40c43f,TRUE,2013-12-18T16:58:12.000-05:00,FALSE,FALSE,1801284,0.0,364,NA,NA
https://homestars.com/on/bayview/furniture,80,"c(""https://homestars.com/on/bayview/furniture?&page=2&"", ""https://homestars.com/on/bayview/furniture?&page=3&"", ""https://homestars.com/on/bayview/furniture?&page=4&"", ""https://homestars.com/on/bayview/furniture?&page=5&"", ""https://homestars.com/on/bayview/furniture?&page=6&"", ""https://homestars.com/on/bayview/furniture?&page=7&"", ""https://homestars.com/on/bayview/furniture?&page=8&"")",Furniture,2813407,NA,/companies/2813407-public-site-furniture?searched_category_id=364&service_area=1888128,"Public Site Furniture is a leading site furnishings manufacturer in Canada. They have been in this business for decades and have built their name in this industry. They are famous for manufacturing products like park benches, trash containers, etc.

Public Site Furniture provides furnishing services to contractors, banks, commercial landscape architects, property management companies, educational & government institutions, hospitals, community centers, and hotels in North America.
",public-site-furniture,2013-08-09T06:59:28.000-04:00,NA,NA,,NA,NA,NA,NA,NA,NA,NA,NA,NA,NA,FALSE,FALSE,NA,NA,FALSE,FALSE,NA,1876351,Public Site Furniture,0,0,0,NA,"Furniture, Bedroom Furniture, Office Furniture, Furniture Store, Kid Furniture, Patio Furniture, Baby Furniture, Contemporary Furniture, Dining Room Furniture, furniture stores, the furniture store, furniture store, furniture shops, office furniture, patio furniture, home furnishings, the furniture warehouse, warehouse furniture, furniture warehouse, home furniture, furniture shop, bedroom furniture, furniture bedroom, home decorating, outdoor furniture, room furniture, room to room furniture, outside furniture, used furniture, bed furniture, house furniture, city furniture, furniture city, outlet furniture, furniture outlet, wood furniture, furniture for sale, furniture sale, sale furniture, furniture on sale, out door furniture, cheap furniture, furniture cheap, furnitures, sofa furniture, furniture modern, modern furniture, furniture discount, discount furniture, old furniture, furniture outlets, ,",0,NA,NA,FALSE,0,0,0,0,FALSE,e6e8a04306b6876dd860d1502800a35977739f8c,FALSE,NA,FALSE,FALSE,1888128,-1.0,364,NA,NA
https://homestars.com/on/bayview/furniture,80,"c(""https://homestars.com/on/bayview/furniture?&page=2&"", ""https://homestars.com/on/bayview/furniture?&page=3&"", ""https://homestars.com/on/bayview/furniture?&page=4&"", ""https://homestars.com/on/bayview/furniture?&page=5&"", ""https://homestars.com/on/bayview/furniture?&page=6&"", ""https://homestars.com/on/bayview/furniture?&page=7&"", ""https://homestars.com/on/bayview/furniture?&page=8&"")",Furniture,2906970,NA,/companies/2906970-wallbeds-online?searched_category_id=364&service_area=2144051,NA,wallbeds-online,2018-01-06T03:43:47.000-05:00,NA,NA,NA,NA,NA,NA,NA,NA,NA,NA,NA,NA,NA,FALSE,FALSE,NA,NA,FALSE,FALSE,NA,1969155,Wallbeds Online,0,0,7,NA,"Furniture, Bedroom Furniture, Office Furniture, Furniture Store, Kid Furniture, Patio Furniture, Baby Furniture, Contemporary Furniture, Dining Room Furniture, furniture stores, the furniture store, furniture store, furniture shops, office furniture, patio furniture, home furnishings, the furniture warehouse, warehouse furniture, furniture warehouse, home furniture, furniture shop, bedroom furniture, furniture bedroom, home decorating, outdoor furniture, room furniture, room to room furniture, outside furniture, used furniture, bed furniture, house furniture, city furniture, furniture city, outlet furniture, furniture outlet, wood furniture, furniture for sale, furniture sale, sale furniture, furniture on sale, out door furniture, cheap furniture, furniture cheap, furnitures, sofa furniture, furniture modern, modern furniture, furniture discount, discount furniture, old furniture, furniture outlets, ,",0,2018-01-06T03:46:14.000-05:00,NA,FALSE,0,0,9,0,FALSE,dbe15f608a20ca25c3b6613d7fd6a16e0fb77fe9,FALSE,NA,TRUE,FALSE,2144051,0,364,NA,NA
https://homestars.com/on/bayview/furniture,80,"c(""https://homestars.com/on/bayview/furniture?&page=2&"", ""https://homestars.com/on/bayview/furniture?&page=3&"", ""https://homestars.com/on/bayview/furniture?&page=4&"", ""https://homestars.com/on/bayview/furniture?&page=5&"", ""https://homestars.com/on/bayview/furniture?&page=6&"", ""https://homestars.com/on/bayview/furniture?&page=7&"", ""https://homestars.com/on/bayview/furniture?&page=8&"")",Furniture,2812732,NA,/companies/2812732-streamline-furniture?searched_category_id=364&service_area=1886750,NA,streamline-furniture,2013-07-19T16:58:32.000-04:00,NA,NA,NA,NA,NA,NA,NA,NA,NA,NA,NA,NA,NA,FALSE,FALSE,NA,NA,FALSE,FALSE,NA,1875676,Streamline Furniture,0,0,0,NA,"Furniture, Bedroom Furniture, Office Furniture, Furniture Store, Kid Furniture, Patio Furniture, Baby Furniture, Contemporary Furniture, Dining Room Furniture, furniture stores, the furniture store, furniture store, furniture shops, office furniture, patio furniture, home furnishings, the furniture warehouse, warehouse furniture, furniture warehouse, home furniture, furniture shop, bedroom furniture, furniture bedroom, home decorating, outdoor furniture, room furniture, room to room furniture, outside furniture, used furniture, bed furniture, house furniture, city furniture, furniture city, outlet furniture, furniture outlet, wood furniture, furniture for sale, furniture sale, sale furniture, furniture on sale, out door furniture, cheap furniture, furniture cheap, furnitures, sofa furniture, furniture modern, modern furniture, furniture discount, discount furniture, old furniture, furniture outlets, ,",0,2013-07-19T16:58:33.000-04:00,NA,FALSE,0,0,0,NA,FALSE,054711f08cf0691224cddd2ac2749f98a4d62d2c,FALSE,NA,FALSE,FALSE,1886750,-1.0,364,NA,NA
https://homestars.com/on/bayview/furniture,80,"c(""https://homestars.com/on/bayview/furniture?&page=2&"", ""https://homestars.com/on/bayview/furniture?&page=3&"", ""https://homestars.com/on/bayview/furniture?&page=4&"", ""https://homestars.com/on/bayview/furniture?&page=5&"", ""https://homestars.com/on/bayview/furniture?&page=6&"", ""https://homestars.com/on/bayview/furniture?&page=7&"", ""https://homestars.com/on/bayview/furniture?&page=8&"")",Furniture,2857835,NA,/companies/2857835-mikga?searched_category_id=364&service_area=1986330,"Mikga specializes in commercial projects with designers, hospitality, restaurants, commercial and residential customers by offering transitional and contemporary furniture.",mikga,2014-08-17T21:42:18.000-04:00,NA,NA,,NA,NA,NA,NA,NA,NA,NA,NA,NA,NA,FALSE,FALSE,NA,NA,FALSE,FALSE,NA,1920265,Mikga,0,0,0,NA,"Furniture, Bedroom Furniture, Office Furniture, Furniture Store, Kid Furniture, Patio Furniture, Baby Furniture, Contemporary Furniture, Dining Room Furniture, furniture stores, the furniture store, furniture store, furniture shops, office furniture, patio furniture, home furnishings, the furniture warehouse, warehouse furniture, furniture warehouse, home furniture, furniture shop, bedroom furniture, furniture bedroom, home decorating, outdoor furniture, room furniture, room to room furniture, outside furniture, used furniture, bed furniture, house furniture, city furniture, furniture city, outlet furniture, furniture outlet, wood furniture, furniture for sale, furniture sale, sale furniture, furniture on sale, out door furniture, cheap furniture, furniture cheap, furnitures, sofa furniture, furniture modern, modern furniture, furniture discount, discount furniture, old furniture, furniture outlets, ,",0,NA,NA,FALSE,0,0,0,0,FALSE,66288718eff55cc68ea7d3e51547cc114f2a1f26,FALSE,NA,FALSE,FALSE,1986330,-1.0,364,NA,NA
https://homestars.com/on/bayview/furniture,80,"c(""https://homestars.com/on/bayview/furniture?&page=2&"", ""https://homestars.com/on/bayview/furniture?&page=3&"", ""https://homestars.com/on/bayview/furniture?&page=4&"", ""https://homestars.com/on/bayview/furniture?&page=5&"", ""https://homestars.com/on/bayview/furniture?&page=6&"", ""https://homestars.com/on/bayview/furniture?&page=7&"", ""https://homestars.com/on/bayview/furniture?&page=8&"")",Furniture,2852218,NA,/companies/2852218-source-office-furnishings-markham?searched_category_id=364&service_area=1966948,"Come visit our showroom with over 40,000 sq ft of the top brands: Performance, HON, Basyx, Nightingale and Tayco Office Furniture.",source-office-furnishings-markham,2014-04-17T16:26:37.000-04:00,NA,NA,"Mon - Fri 8:30 - 5:30, Sat Closed",NA,NA,NA,NA,NA,NA,NA,NA,NA,NA,FALSE,FALSE,NA,NA,FALSE,FALSE,NA,1914649,Source Office Furnishings   Markham,0,0,0,NA,"Furniture, Bedroom Furniture, Office Furniture, Furniture Store, Kid Furniture, Patio Furniture, Baby Furniture, Contemporary Furniture, Dining Room Furniture, furniture stores, the furniture store, furniture store, furniture shops, office furniture, patio furniture, home furnishings, the furniture warehouse, warehouse furniture, furniture warehouse, home furniture, furniture shop, bedroom furniture, furniture bedroom, home decorating, outdoor furniture, room furniture, room to room furniture, outside furniture, used furniture, bed furniture, house furniture, city furniture, furniture city, outlet furniture, furniture outlet, wood furniture, furniture for sale, furniture sale, sale furniture, furniture on sale, out door furniture, cheap furniture, furniture cheap, furnitures, sofa furniture, furniture modern, modern furniture, furniture discount, discount furniture, old furniture, furniture outlets, ,",0,2014-04-17T16:26:39.000-04:00,NA,FALSE,0,0,0,0,FALSE,7701d6ef01a8189f8df7e59db82244e189c0390d,FALSE,NA,FALSE,FALSE,1966948,-1.0,364,NA,NA
https://homestars.com/on/bayview/furniture,80,"c(""https://homestars.com/on/bayview/furniture?&page=2&"", ""https://homestars.com/on/bayview/furniture?&page=3&"", ""https://homestars.com/on/bayview/furniture?&page=4&"", ""https://homestars.com/on/bayview/furniture?&page=5&"", ""https://homestars.com/on/bayview/furniture?&page=6&"", ""https://homestars.com/on/bayview/furniture?&page=7&"", ""https://homestars.com/on/bayview/furniture?&page=8&"")",Furniture,2962943,NA,/companies/2962943-home-decor-furnishing?searched_category_id=364&service_area=2268513,NA,home-decor-furnishing,2021-12-24T13:42:42.000-05:00,NA,NA,NA,NA,NA,NA,NA,NA,NA,NA,NA,NA,NA,FALSE,FALSE,NA,NA,FALSE,FALSE,NA,2024894,Home Décor Furnishing,0,0,0,NA,"Furniture, Bedroom Furniture, Office Furniture, Furniture Store, Kid Furniture, Patio Furniture, Baby Furniture, Contemporary Furniture, Dining Room Furniture, furniture stores, the furniture store, furniture store, furniture shops, office furniture, patio furniture, home furnishings, the furniture warehouse, warehouse furniture, furniture warehouse, home furniture, furniture shop, bedroom furniture, furniture bedroom, home decorating, outdoor furniture, room furniture, room to room furniture, outside furniture, used furniture, bed furniture, house furniture, city furniture, furniture city, outlet furniture, furniture outlet, wood furniture, furniture for sale, furniture sale, sale furniture, furniture on sale, out door furniture, cheap furniture, furniture cheap, furnitures, sofa furniture, furniture modern, modern furniture, furniture discount, discount furniture, old furniture, furniture outlets, ,",0,2021-12-24T13:44:39.000-05:00,NA,FALSE,0,0,0,0,FALSE,44f90f46166eee3a23f51c5149d32ef24c3a228b,FALSE,NA,FALSE,FALSE,2268513,-1.0,364,NA,NA
https://homestars.com/on/bayview/furniture,80,"c(""https://homestars.com/on/bayview/furniture?&page=2&"", ""https://homestars.com/on/bayview/furniture?&page=3&"", ""https://homestars.com/on/bayview/furniture?&page=4&"", ""https://homestars.com/on/bayview/furniture?&page=5&"", ""https://homestars.com/on/bayview/furniture?&page=6&"", ""https://homestars.com/on/bayview/furniture?&page=7&"", ""https://homestars.com/on/bayview/furniture?&page=8&"")",Furniture,2850247,NA,/companies/2850247-studio-22-interiors?searched_category_id=364&service_area=1961179,NA,studio-22-interiors,2014-03-17T11:10:31.000-04:00,NA,NA,NA,NA,NA,NA,NA,NA,NA,NA,NA,NA,NA,FALSE,FALSE,NA,NA,FALSE,FALSE,NA,1912681,Studio 22 Interiors,0,0,0,NA,"Furniture, Bedroom Furniture, Office Furniture, Furniture Store, Kid Furniture, Patio Furniture, Baby Furniture, Contemporary Furniture, Dining Room Furniture, furniture stores, the furniture store, furniture store, furniture shops, office furniture, patio furniture, home furnishings, the furniture warehouse, warehouse furniture, furniture warehouse, home furniture, furniture shop, bedroom furniture, furniture bedroom, home decorating, outdoor furniture, room furniture, room to room furniture, outside furniture, used furniture, bed furniture, house furniture, city furniture, furniture city, outlet furniture, furniture outlet, wood furniture, furniture for sale, furniture sale, sale furniture, furniture on sale, out door furniture, cheap furniture, furniture cheap, furnitures, sofa furniture, furniture modern, modern furniture, furniture discount, discount furniture, old furniture, furniture outlets, ,",0,2014-03-17T11:10:32.000-04:00,NA,FALSE,0,0,0,0,FALSE,b44a41bcdb408c363e2624ef7048e5c721abc40e,FALSE,NA,FALSE,FALSE,1961179,-1.0,364,NA,NA
https://homestars.com/on/bayview/furniture,80,"c(""https://homestars.com/on/bayview/furniture?&page=2&"", ""https://homestars.com/on/bayview/furniture?&page=3&"", ""https://homestars.com/on/bayview/furniture?&page=4&"", ""https://homestars.com/on/bayview/furniture?&page=5&"", ""https://homestars.com/on/bayview/furniture?&page=6&"", ""https://homestars.com/on/bayview/furniture?&page=7&"", ""https://homestars.com/on/bayview/furniture?&page=8&"")",Furniture,2858582,NA,/companies/2858582-shabby?searched_category_id=364&service_area=1988850,NA,shabby,2014-09-01T17:09:29.000-04:00,NA,NA,NA,NA,NA,NA,NA,NA,NA,NA,NA,NA,NA,FALSE,FALSE,NA,NA,FALSE,FALSE,NA,1921012,Shabby,0,0,0,NA,"Furniture, Bedroom Furniture, Office Furniture, Furniture Store, Kid Furniture, Patio Furniture, Baby Furniture, Contemporary Furniture, Dining Room Furniture, furniture stores, the furniture store, furniture store, furniture shops, office furniture, patio furniture, home furnishings, the furniture warehouse, warehouse furniture, furniture warehouse, home furniture, furniture shop, bedroom furniture, furniture bedroom, home decorating, outdoor furniture, room furniture, room to room furniture, outside furniture, used furniture, bed furniture, house furniture, city furniture, furniture city, outlet furniture, furniture outlet, wood furniture, furniture for sale, furniture sale, sale furniture, furniture on sale, out door furniture, cheap furniture, furniture cheap, furnitures, sofa furniture, furniture modern, modern furniture, furniture discount, discount furniture, old furniture, furniture outlets, ,",0,NA,NA,FALSE,0,0,0,0,FALSE,f21c8e8b3d92939b2ac20c872fb624cfdb174279,FALSE,NA,FALSE,FALSE,1988850,-1.0,364,NA,NA
https://homestars.com/on/bayview/furniture,80,"c(""https://homestars.com/on/bayview/furniture?&page=2&"", ""https://homestars.com/on/bayview/furniture?&page=3&"", ""https://homestars.com/on/bayview/furniture?&page=4&"", ""https://homestars.com/on/bayview/furniture?&page=5&"", ""https://homestars.com/on/bayview/furniture?&page=6&"", ""https://homestars.com/on/bayview/furniture?&page=7&"", ""https://homestars.com/on/bayview/furniture?&page=8&"")",Furniture,2807924,NA,/companies/2807924-directbuy-of-toronto-north?searched_category_id=364&service_area=1877252,,directbuy-of-toronto-north,2013-03-27T05:18:41.000-04:00,NA,NA,,NA,NA,NA,NA,NA,NA,NA,NA,NA,NA,FALSE,FALSE,NA,NA,FALSE,FALSE,NA,1870924,Direct Buy Of Toronto North,0,0,0,NA,"Furniture, Bedroom Furniture, Office Furniture, Furniture Store, Kid Furniture, Patio Furniture, Baby Furniture, Contemporary Furniture, Dining Room Furniture, furniture stores, the furniture store, furniture store, furniture shops, office furniture, patio furniture, home furnishings, the furniture warehouse, warehouse furniture, furniture warehouse, home furniture, furniture shop, bedroom furniture, furniture bedroom, home decorating, outdoor furniture, room furniture, room to room furniture, outside furniture, used furniture, bed furniture, house furniture, city furniture, furniture city, outlet furniture, furniture outlet, wood furniture, furniture for sale, furniture sale, sale furniture, furniture on sale, out door furniture, cheap furniture, furniture cheap, furnitures, sofa furniture, furniture modern, modern furniture, furniture discount, discount furniture, old furniture, furniture outlets, ,",0,2013-03-27T05:18:41.000-04:00,NA,FALSE,0,0,0,NA,FALSE,018b70a36f6d627e137a3492b48788e646626bf2,FALSE,NA,FALSE,FALSE,1877252,-1.0,364,NA,NA
https://homestars.com/on/bayview/furniture,80,"c(""https://homestars.com/on/bayview/furniture?&page=2&"", ""https://homestars.com/on/bayview/furniture?&page=3&"", ""https://homestars.com/on/bayview/furniture?&page=4&"", ""https://homestars.com/on/bayview/furniture?&page=5&"", ""https://homestars.com/on/bayview/furniture?&page=6&"", ""https://homestars.com/on/bayview/furniture?&page=7&"", ""https://homestars.com/on/bayview/furniture?&page=8&"")",Furniture,2812730,NA,/companies/2812730-streamline-interiors-inc?searched_category_id=364&service_area=1886747,NA,streamline-interiors-inc,2013-07-19T16:54:33.000-04:00,NA,NA,NA,NA,NA,NA,NA,NA,NA,NA,NA,NA,NA,FALSE,FALSE,NA,NA,FALSE,FALSE,NA,1875674,Streamline Interiors Inc.,0,0,0,NA,"Furniture, Bedroom Furniture, Office Furniture, Furniture Store, Kid Furniture, Patio Furniture, Baby Furniture, Contemporary Furniture, Dining Room Furniture, furniture stores, the furniture store, furniture store, furniture shops, office furniture, patio furniture, home furnishings, the furniture warehouse, warehouse furniture, furniture warehouse, home furniture, furniture shop, bedroom furniture, furniture bedroom, home decorating, outdoor furniture, room furniture, room to room furniture, outside furniture, used furniture, bed furniture, house furniture, city furniture, furniture city, outlet furniture, furniture outlet, wood furniture, furniture for sale, furniture sale, sale furniture, furniture on sale, out door furniture, cheap furniture, furniture cheap, furnitures, sofa furniture, furniture modern, modern furniture, furniture discount, discount furniture, old furniture, furniture outlets, ,",0,NA,NA,FALSE,0,0,0,NA,FALSE,b0962cd032dd198f40fa93143793d279e47e99d4,FALSE,NA,FALSE,FALSE,1886747,0,364,NA,NA
