Link,n_hits,all_links,category,id,url,hs_path,profile,permalink,created_at,sic_code,service_area,hours,products,services,brands,specialities,established,employee_cnt,payment_method,diplomas,licenses,memberships,liability_insurance,bonded,project_rate,project_minimum,written_contract,written_warranty,warranty_terms,parent_company_id,name,total_number_of_reviews_cache,total_number_of_approved_reviews_cache,number_of_photos_cache,avg_rating_cache,categories_info_cache,savings_count,claimed_at,subdomain,fraudulent,fraudulent_count,total_number_of_pending_reviews_cache,images_count,completion_percent_cache,bully,secret,replied_to_at_least_one_review_cache,latest_approved_review_created_at,has_set_tasks,lead_purchase_eligible,service_area_id,star_score,quote_button_category,direct_phone,direct_contact
https://homestars.com/on/pompano-beach/fences-gates,72,"c(""https://homestars.com/on/pompano-beach/fences-gates?&page=2&"", ""https://homestars.com/on/pompano-beach/fences-gates?&page=3&"", ""https://homestars.com/on/pompano-beach/fences-gates?&page=4&"", ""https://homestars.com/on/pompano-beach/fences-gates?&page=5&"", ""https://homestars.com/on/pompano-beach/fences-gates?&page=6&"", ""https://homestars.com/on/pompano-beach/fences-gates?&page=7&"", ""https://homestars.com/on/pompano-beach/fences-gates?&page=8&"")",Fences & Gates,2775513,http://www.candofenceanddeck.com,/companies/2775513-can-do-fence-deck?searched_category_id=354&service_area=1854246,"Can Do Fence & Deck Is the top in Fences & Gates across the GTA and beyond. Our builders have experience spanning over 20 years. To understand the quality of our workmanship, you only have to read our reviews to see what kind of company Cando Fence and Deck is!
 
We service most of the GTA and Vaughan as well as Stouffville,   ",can-do-fence-deck,2009-06-22T09:46:36.000-04:00,NA,,,Fence ,Fence Installation ,,,1998,NA,,,,,TRUE,TRUE,,100 linear feet,TRUE,FALSE,5 Years *details on website,1838565,Can Do Fence & Deck,503,432,25,9.7037,"Fences & Gates, Dog Fence, Invisible Fence, Chain Link Fence, Pool Fence, Wood Fence, Fence Gates, Dog Gates, Pet Gates, friendly neighbour fence, friendly neighbor fence, picket fence, wrought iron fence, and gate, and gates, gates, the fence, a fence, fence, fences, fence with gate, gate and fence, gate for fence, fence & gate, gate fence, fence gate, fence and gate, gates and fence, gates fence, fence & gates, fence and gates, fence gates, railings, wrought iron, electronic gates, entrance gate, trellis, fence post, front gates, chain fence, fence panels, fence chain link, chain link fence, how to wood fence, fence wood, wood for fence, wood fence, fence panel, garden gate, fence posts, fencing panels, iron gate, chain link fencing, panel fencing, gates iron, iron gates, chain link fences, fences chain link, fencing post, dog fencing, ,",0,2011-05-20T16:33:55.000-04:00,candofence,FALSE,0,0,27,100,FALSE,18f00f138850e1ebc66ad4c330839897f6a85ab9,TRUE,2022-09-17T08:35:34.000-04:00,TRUE,TRUE,1854246,96.9485618584,354,NA,NA
https://homestars.com/on/pompano-beach/fences-gates,72,"c(""https://homestars.com/on/pompano-beach/fences-gates?&page=2&"", ""https://homestars.com/on/pompano-beach/fences-gates?&page=3&"", ""https://homestars.com/on/pompano-beach/fences-gates?&page=4&"", ""https://homestars.com/on/pompano-beach/fences-gates?&page=5&"", ""https://homestars.com/on/pompano-beach/fences-gates?&page=6&"", ""https://homestars.com/on/pompano-beach/fences-gates?&page=7&"", ""https://homestars.com/on/pompano-beach/fences-gates?&page=8&"")",Fences & Gates,2885902,https://www.gnfp905.ca,/companies/2885902-gnfp-ltd?searched_category_id=354&service_area=2295125,"Whether you’re a do-it-yourselfer and need posts or deck footings, or you’re looking for a complete fence solution, GNFP is here to assist you!

The hardest part about building your own fence or deck is digging the post holes. Many new construction sites, as well as existing yards, are filled with rock and other debris, making post hole construction a real problem.

Don't pay to rent a dangerous gas auger and still end up struggling for days in the hot sun! Call on the experts at GNFP!",gnfp-ltd,2016-03-31T23:47:13.000-04:00,NA,NA,NA,,"Hole Digging,

Gas Line Hand Hole Digging,

Post Setting,

Fence Design,

Fence Construction, 
– Pre-Fabricated & Custom Fence Repairs,

Rotted Fence Post Replacement,

Fence Reconstruction,

Deck Piers & Footings,

Bollards",,,2005,NA,"Cash, Certified Cheque, E-Transfer",,,,TRUE,TRUE,,,TRUE,FALSE,,1948326,GNFP Ltd.,273,256,69,9.88672,"Fences & Gates, Dog Fence, Invisible Fence, Chain Link Fence, Pool Fence, Wood Fence, Fence Gates, Dog Gates, Pet Gates, friendly neighbour fence, friendly neighbor fence, picket fence, wrought iron fence, and gate, and gates, gates, the fence, a fence, fence, fences, fence with gate, gate and fence, gate for fence, fence & gate, gate fence, fence gate, fence and gate, gates and fence, gates fence, fence & gates, fence and gates, fence gates, railings, wrought iron, electronic gates, entrance gate, trellis, fence post, front gates, chain fence, fence panels, fence chain link, chain link fence, how to wood fence, fence wood, wood for fence, wood fence, fence panel, garden gate, fence posts, fencing panels, iron gate, chain link fencing, panel fencing, gates iron, iron gates, chain link fences, fences chain link, fencing post, dog fencing, ,Decks, Deck, Wood Deck, Deck Patio Furniture, Patio Heater, Patio Deck, Patio Door, Patio Cover, Patio Umbrella, Patio Furniture Set, Patio Furniture Cushion, the deck, on deck, deck tech, patios, construction plans, how to build a deck, build decks, build a deck, deck plans, design deck, design a deck, deck design, deck building, building a deck, building deck, deck designs, how to make a deck, patio cover, wood deck, deck wood, deck board, patio designs, deck designs plans, deck plans designs, deck builder, deck stain, deck builders, ,",0,NA,GNFP,FALSE,0,0,97,0,FALSE,b8e719c8a836e46b85eae248c194dca417e1cb63,TRUE,2022-09-20T19:47:41.000-04:00,TRUE,TRUE,2295125,99.0643562113,354,NA,NA
