Link,n_hits,all_links,category,id,url,hs_path,profile,permalink,created_at,sic_code,service_area,hours,products,services,brands,specialities,established,employee_cnt,payment_method,diplomas,licenses,memberships,liability_insurance,bonded,project_rate,project_minimum,written_contract,written_warranty,warranty_terms,parent_company_id,name,total_number_of_reviews_cache,total_number_of_approved_reviews_cache,number_of_photos_cache,avg_rating_cache,categories_info_cache,savings_count,claimed_at,subdomain,fraudulent,fraudulent_count,total_number_of_pending_reviews_cache,images_count,completion_percent_cache,bully,secret,replied_to_at_least_one_review_cache,latest_approved_review_created_at,has_set_tasks,lead_purchase_eligible,service_area_id,star_score,quote_button_category,direct_phone,direct_contact
https://homestars.com/on/bowen%20island/interior-design,6,https://homestars.com/on/bowen%20island/interior-design,Interior Design,198873,http://www.budgetpainters.ca/,/companies/198873-budget-painters?searched_category_id=390&service_area=1826511,"MOST TRUSTED PAINTING & DECORATING COMPANY!
 
We are a full service locally owned Painting & Decorating and Restoration Company with a full service Interior Designer. Budget & Save Painters is dedicated to providing exceptional Painting & Decorating Solutions to residential and commercial clients throughout the Metro Vancouver area.
 
Service Areas: all of Metro Vancouver including: Burnaby, Downtown Vancouver, Yaletown, the West End, Coal Harbour, Kitsilano, Dunbar, UBC, Kerrisdale, Shaughnessy, Richmond, Delta, Surrey, the North Shore including, (the British Properties, West Vancouver, and Deep Cove), Coquitlam area, Port Coquitlam, New Westminster, and Langley.
 
We Specialize in Color Consultations, and Interior Designs for Residential & Commercial Projects, Condos, Town-homes, Apartments, Design, Heritage Homes, Small repair jobs, and Maintenance of painting services!
 
Our Customer Service lines are available 24 hours a day - 7 days a week. We always provide references of our many satisfied customers. We use Top Quality Paints, Primers & Stains! Zero VOC Products - Our Business rating with the Better Business Bureau is A+. Look for our continually GREAT PROMOTIONAL DISCOUNTS - CALL FOR A FREE NO OBLIGATION ESTIMATION!
 
Great reliable painters!
Top-Line General Paint, Benjamin Moore Paints, Cloverdale, ICI Paints & Sherwin-Williams. Other Suggested Brands Offered. TOP QUALITY PAINTS, PRIMERS & STAINS. We use the right brands for each project!
Full Interior & Exterior Painting - Commercial projects and Residential projects - Drywall Repairs -Power Washing and Waterproofing. Colour Consultations - GREAT DISCOUNTS OFFERED!
Most brands supplied - Customer brands on request.
Specializing in Condos, Strata's, Multi-residential, Heritage homes, Maintenance, Tenant Improvements, Additions, Renovating, Changes or Moves & Complete Home Projects. SMALL JOBS WELCOME!
 
Our outstanding services have been catering to a number of locations across Metro Vancouver including Whistler, North Shore, Burnaby, Delta, Richmond, the city of Surrey, Langley Coquitlam, Port Coquitlam and many other outline areas. We are experts in providing exceptional customer service in painting & decorating for our residential and commercial clients throughout Metro Vancouver.
 
We are strong believers in safe (ZERO VOC) paint products and practices that save money, and are good for the environment. Budget & Save Painters and Creative Design offers a full range of luxury paint products.
 
We understand that when we are working on your house, you are inviting us into your home. Trust is of the utmost importance to us; we have an impeccable reputation with many local satisfied customers over the years, and being a fully insured company with WCB coverage, so you can feel confident that the construction process will run seamlessly and efficiently. Some have even gone as far as to say that they have enjoyed the process while working with us.
 
We specialize in Color Consulting, Custom Design/Decorating, Full Interior and Exterior Projects, Renovations, Pressure Washing and full Property Maintenance.",budget-painters,2006-11-13T19:00:00.000-05:00,NA,"BUDGET & SAVE PAINTERS HAS THE SKILLS,RESOURCES, & EXPERTISE TO SUCCESSFULLY COMPLETE ANY PROJECT, RANGING FROM SMALL RESIDENTIAL VISITS TO LARGE COMMERCIAL PAINTING PROJECTS. OUR SERVICE AREA: Vancouver, Burnaby, Coquitlam, Delta, Langley, Maple Ridge, New Westminster, North Vancouver/West Vancouver, Port Coquitlam, Port Moody, Richmond, Surrey, White Rock Fraser Valley -(Larger projects ""Whistler and Vancouver Island"").",Customer Service Lines Open 24 hours a day-7 days a week,"Top-Line Delux,Benjamin Moore Paints, Cloverdale, ICI Paints & Sherwin-Williams.Other Suggested Brands Offered. TOP QUALITY PAINTS, PRIMERS & STAINS. We use the right brands for each project!",Full Interior & Exterior Painting - Commercial projects and Residential projects - Drywall Repairs -Power Washing and Waterproofing. Colour Consultations - GREAT DISCOUNTS OFFERED!,Most brands supplied - Customer brands on request.,"Specializing in Condos, Stratas, Multi-residential,Heritage homes,Maintenance, Tenant Improvements, Additions, Renovating, Changes or Moves & Complete Home Projects. SMALL JOBS WELCOME!",16,0,,"Marketing/Communications Senior Certificate in the field of public relations,customer service and ad","CITY OF VANCOUVER, Richmond, North Shore, Burnaby, Coquitlam, Fraser Valley t",,TRUE,TRUE,Straight Forward Pricing (In Writing)No Job is Too Big or Small!,Big or Small Projects,TRUE,FALSE,"All of our work is (""Guaranteed"")! We offer a 2 year, 5 year, 10 year, and 15 year warranty",55284,Budget & Save Painters And Color Design,864,731,288,9.91518,"Interior Decorators, Home Decorators, Holiday Decorators, decorating, what is interior design, about interior design, house designs, interiors, designer interior, interior designer, house design, decorating ideas, interiordesign, designers interior, interior designers, la interior designers, decoration interior, interior decoration, room design, design a room, kitchen cabinets, interior decoration design, interior design decoration, interior design and decoration, interior decoration and design, decorating interior, what is interior decorating, about interior decorating, interior decorating, decorator, decorators, house decor, home furnishings, in home furnishings, decoration ideas, house decorating, home decorating, kitchen design, interior decorating design, interior design and decorating, interior decorating and design, home furnishings, interior home, home interior, home accessories, house interior, interior decorator, interior decorator in, and interior decorator, decorator interior, ,Paint & Wallpaper Contractors, Paint Colors, Paint Store, Paint Brush, Paint Shop, Home Wallpaper,Wallpaper, Paint colour advice, paint colour consultants, wallpapering, painter, faux, painters painting, painters paint, business painting, find painting, painting and restoration, new jersey painting, oh painting, local painting, wall paper repair, ,Interior Design, Home Interior Designers, Kitchen Interior Design, interior, what is interior design, about interior design, design interior, interior by design, home designs, interior designer, designer interior, how to be a interior designer, what is an interior designer, home design, decorating ideas, design and decorating, decorating and design, interior designers, interior decoration, room design, interior design decoration, interior decorating, house decorating, home decorating, desings homes, interior design decorating, interior decorating design, decorating and interior design, home building plans, decorating tips, room designs, design homes, decorating design ideas, design photos, interior house, interior decorator, bedroom design, architecture design, bedroom designs, careers in design, interior designs, office design, architectural design, ,General Contractors, Residential General Contractor, Building Contractor, Additions, Remodeling Contractor,  Renovation, Builder, building construction, renovation, remodeling, construction builders, construction company, construction companies, home repair, construction jobs, home remodeling, general contractors, contractors general, contractor general, contractors construction, construction contractors, home improvement and remodeling, kitchen remodeling, construction contractor, builders contractors, home renovation, general contracting, building contractors, building companies, home renovations, builder contractor, building contractor, remodeling contractor, commercial construction, residential construction, house contractor, concrete contractors, home contractors, general construction, construction general, contractors remodeling, remodeling contractors, remodelers, remodel contractor, remodel contractors, general contract, commercial contractors, renovations contractors, home improvement contractor, licensed contractor, license general contractor, mud room, mudroom, caulking, ,Bathroom Renovation, Bathroom renovation, bathroom remodeling, bathroom remodelling, renovating the bathroom, tearing out the bathroom, fixing up the bathroom, bathroom contractors, bathroom vanities, bathroom vanity, design of bathroom, bathroom and design, design for bathroom, design a bathroom, design a bath, bath design, bathroom tile, bathroom cabinets, remodeling a bathroom, bathroom remodeling, remodeling the bathroom, ,Bath renovation, New tub, caulking, ,Carpenters, carpenter, finish carpenter, local carpenter, carpenter work, carpenter companies, master carpenter, carpenters and joiners, carpentry, union carpenter, carpenter co, carpenter services, carpenter construction, interior framing, mud room, mudroom, playsets, playground, wooden playset, wooden playground, play set, caulking,,Drywall Contractors, Dry Wall Repair, Dry Wall Installation, dry wall contracting, gypsum repair, gypsum installation, gypsum contractors, gyprock installers, gyprock intallation, dry wall installers, sheetrock, wall board, drywall, drywaller, waller, wall repair, drywall, plaster, how to drywall, drywall, what is drywall, sheetrock, dry wall, plastering, wall repair, drywall repair, how to repair drywall, repair drywall,  ,",3,2010-05-31T13:22:45.000-04:00,budgetpainters,FALSE,0,0,291,100,FALSE,8bf32aa7d78f175bef5d00ede57991e53f506876,TRUE,2021-12-25T15:58:00.000-05:00,TRUE,TRUE,1826511,98.9027574988,390,NA,NA
https://homestars.com/on/bowen%20island/interior-design,6,https://homestars.com/on/bowen%20island/interior-design,Interior Design,2801437,https://www.pierina.ca/?fbclid=IwAR0JxzdxS1oZVUZzJPbSDeU6p0gjXnnc9lBgyW-6QfckRJcOaB0iRHVWO_Q,/companies/2801437-pierina-and-associates-interior-design?searched_category_id=390&service_area=1866282,Welcome to Pierina and Associates Interior Design.We work on all residential and commercial projects. Your home is an extension and a reflection of yourself. Most people know what to do but they just need a sense of direction. We are here to give you the guidance you need and the on going support that will make it happen. Together we can make a difference. We are all very passionate about what we do. Integrity is what we thrive on. Contact us today to schedule a consultation. ,pierina-and-associates-interior-design,2012-09-13T20:19:31.000-04:00,NA,NA,Monday to Friday,,,,,NA,NA,,,,,FALSE,FALSE,,,TRUE,FALSE,,1864385,Pierina And Associates Interior Design,33,31,62,9.67742,"Interior Design, Home Interior Designers, Kitchen Interior Design, interior, what is interior design, about interior design, design interior, interior by design, home designs, interior designer, designer interior, how to be a interior designer, what is an interior designer, home design, decorating ideas, design and decorating, decorating and design, interior designers, interior decoration, room design, interior design decoration, interior decorating, house decorating, home decorating, desings homes, interior design decorating, interior decorating design, decorating and interior design, home building plans, decorating tips, room designs, design homes, decorating design ideas, design photos, interior house, interior decorator, bedroom design, architecture design, bedroom designs, careers in design, interior designs, office design, architectural design, ,General Contractors, Residential General Contractor, Building Contractor, Additions, Remodeling Contractor,  Renovation, Builder, building construction, renovation, remodeling, construction builders, construction company, construction companies, home repair, construction jobs, home remodeling, general contractors, contractors general, contractor general, contractors construction, construction contractors, home improvement and remodeling, kitchen remodeling, construction contractor, builders contractors, home renovation, general contracting, building contractors, building companies, home renovations, builder contractor, building contractor, remodeling contractor, commercial construction, residential construction, house contractor, concrete contractors, home contractors, general construction, construction general, contractors remodeling, remodeling contractors, remodelers, remodel contractor, remodel contractors, general contract, commercial contractors, renovations contractors, home improvement contractor, licensed contractor, license general contractor, mud room, mudroom, caulking, ,",0,NA,pierinaandassoc,FALSE,0,0,65,NA,FALSE,3564c4ddfc97dd37a1728ac0e5b93609fa5b3105,TRUE,2016-04-13T20:26:22.000-04:00,TRUE,TRUE,1866282,87.9955947651,390,NA,NA
https://homestars.com/on/bowen%20island/interior-design,6,https://homestars.com/on/bowen%20island/interior-design,Interior Design,2973722,http://q-living.ca,/companies/2973722-quintessential-living-inc?searched_category_id=390&service_area=2293277,"Interior design and decorating specializing in home furnishing, custom millwork, minor renovations, and stylizing. ",quintessential-living-inc,2022-09-30T12:41:01.000-04:00,NA,NA,NA,,"Furnishing, Space Planning, Renovations, Custom Millwork, Project Managing, Stylizing",,,2015,NA,,,Licence # 22-137290,,FALSE,FALSE,,,TRUE,FALSE,,2035633,Quintessential Living Inc.,10,10,17,10,"Interior Design, Home Interior Designers, Kitchen Interior Design, interior, what is interior design, about interior design, design interior, interior by design, home designs, interior designer, designer interior, how to be a interior designer, what is an interior designer, home design, decorating ideas, design and decorating, decorating and design, interior designers, interior decoration, room design, interior design decoration, interior decorating, house decorating, home decorating, desings homes, interior design decorating, interior decorating design, decorating and interior design, home building plans, decorating tips, room designs, design homes, decorating design ideas, design photos, interior house, interior decorator, bedroom design, architecture design, bedroom designs, careers in design, interior designs, office design, architectural design, ,",0,2022-09-30T16:58:04.000-04:00,QuintessentialLiving,FALSE,0,0,18,0,FALSE,22a42c907a79b0d8847ceeffc970cdd162caea2a,TRUE,NA,TRUE,TRUE,2293277,89.2971433608,390,NA,NA
https://homestars.com/on/bowen%20island/interior-design,6,https://homestars.com/on/bowen%20island/interior-design,Interior Design,2972095,https://wallaceconsultinginc.ca/,/companies/2972095-wallace-consulting-interiors?searched_category_id=390&service_area=2289493,"We LOVE kitchens!  As a team who cooks, bakes and loves to create – we want your kitchen to be the happy place in your house too. You could call us the kitchen nerds.  We are always up to date on the newest technologies and space-saving solutions and work to blend those with livability and comfort. Our first step is a comprehensive consultation to help best achieve your vision while working with the budget and space. We listen actively to ensure the design suits you, your home and how it's intended to function.

We will create a beautiful conceptual design based on measurements and create the best layout and design for you and how your household functions. We provide a spec book, construction drawings and samples as needed for your contractor and cabinet maker.  We are happy to liaise with your contracting service but are not construction experts.

6+ years of experience, BID from a CIDA accredited program and National Kitchen and Bath Association member.",wallace-consulting-interiors,2022-08-23T12:03:07.000-04:00,NA,NA,NA,,Kitchen and Bathroom Planning,,Kitchen Design ,2021,2,E-transfer or cheque,Bachelor of Interior Design,,National Kitchen and Bath Association ,FALSE,FALSE,$80/hr,"$15,000",TRUE,FALSE,,2034006,Wallace Consulting Interiors ,3,2,15,10,"Kitchen Planning & Renovation, Kitchen Planning And Design, Kitchen Cabinet Planning, Kitchen Design, Kitchen Remodeling, kitchen or, and bathroom, a and a kitchens, kitchens and, for kitchens, a kitchens, kitchens, the house design, cabinets for kitchen, cabinets for the kitchen, cabinets and kitchen, kitchen cabinets, design a kitchen, about kitchen design, a kitchen design, how to kitchen design, design and kitchen, the kitchen design, design for kitchen, kitchen designs, renovation and remodeling, remodeling and renovation, kitchen designer,,Kitchen Renovation, caulking, ,Interior Design, Home Interior Designers, Kitchen Interior Design, interior, what is interior design, about interior design, design interior, interior by design, home designs, interior designer, designer interior, how to be a interior designer, what is an interior designer, home design, decorating ideas, design and decorating, decorating and design, interior designers, interior decoration, room design, interior design decoration, interior decorating, house decorating, home decorating, desings homes, interior design decorating, interior decorating design, decorating and interior design, home building plans, decorating tips, room designs, design homes, decorating design ideas, design photos, interior house, interior decorator, bedroom design, architecture design, bedroom designs, careers in design, interior designs, office design, architectural design, ,",0,2022-08-23T17:07:32.000-04:00,,FALSE,0,0,23,0,FALSE,a49e12981ef6207d3a9fceb396d70249e56fd7eb,TRUE,NA,TRUE,TRUE,2289493,90.3578092489,390,NA,NA
