Link,n_hits,all_links,category,id,url,hs_path,profile,permalink,created_at,sic_code,service_area,hours,products,services,brands,specialities,established,employee_cnt,payment_method,diplomas,licenses,memberships,liability_insurance,bonded,project_rate,project_minimum,written_contract,written_warranty,warranty_terms,parent_company_id,name,total_number_of_reviews_cache,total_number_of_approved_reviews_cache,number_of_photos_cache,avg_rating_cache,categories_info_cache,savings_count,claimed_at,fraudulent,fraudulent_count,total_number_of_pending_reviews_cache,images_count,completion_percent_cache,bully,secret,replied_to_at_least_one_review_cache,latest_approved_review_created_at,has_set_tasks,lead_purchase_eligible,service_area_id,star_score,quote_button_category,direct_phone,direct_contact
https://homestars.com/on/port-colborne/siding,3,https://homestars.com/on/port-colborne/siding,Siding,2940922,https://www.lincolncontractors.ca/,/companies/2940922-lincoln-contractors?searched_category_id=432&service_area=2219328,"Lincoln Contractors is a fully licensed and insured family-owned business in the Niagara Region & GTA, specializing in Custom Exteriors, Siding, Seamless Eavestroughs, Soffit & Fascia, Windows & Doors. We are proud to provide services that will alleviate stress, making your experience as comfortable as possible. Our services exceed the industry's expectations, using the latest practices we identify and address all issues, matched with a dedication to safety and quality workmanship. We can't wait to work with you!
 
We are located in the Niagara region and we strive to provide the highest quality of services for you and your household.

We also offer free estimates! Send us an email or give us a call! We can't wait to work with you.
 


",lincoln-contractors,2020-02-26T13:44:12.000-05:00,NA,NA,NA,"Custom Exteriors, Aluminum & Copper: Seamless Eavestrough Systems, Soffit, Fascia, Siding, Leafguard Systems & Gutter Protection, Window & Doors, and More;","We Service All Of The Niagara Region, and Surrounding Areas Bringing Exterior Services That Highly Exceeds The Industries Expectations With A Warm Family Feel.","Residential Building Products, Kaycan, Gentek, Alu-rex, T-rex, GAF, Certain Teed and more...","Custom Exteriors, Seamless Eavestrough, Leafguards, Siding and Windows
",2017,5,ALL Major Payment Methods Accepted.,"Alu Rex Certified, Gentek Premium Renovator","Working at Heights,Lift Ticket and all Safety Certifications",Lincoln Contractors Ltd.,TRUE,FALSE,Lincoln Contractors Ltd.,$ 450+hst,TRUE,FALSE,3 Yr Workmanship & 25 Yr Manufacturer Warranty,2003096,Lincoln Contractors,10,10,14,10,"Siding, vinyl siding, wood siding, exterior siding, aluminum siding, cedar shakes, cedar shingles, composite wood siding, seamless steel siding, wood clapboard, stone siding, brick siding, exterior, side, sides, how to siding, the siding, the other side, stucco,  how to vinyl siding, about vinyl siding, what is vinyl siding, in vinyl siding, vinyl siding how to, vinyl siding, siding vinyl, how to install vinyl, cement fiber, fiber cement, siding house, house with siding, siding on a house, what is siding on a house, siding for house, siding a house, how to siding a house, siding on house, house siding, siding for a house, ,",0,2020-02-26T13:45:46.000-05:00,FALSE,0,0,18,0,FALSE,4029d06e6249ff06d341b2578e888a61d74faae4,TRUE,2020-06-07T12:25:27.000-04:00,TRUE,TRUE,2219328,89.7140501417,432,NA,NA
https://homestars.com/on/port-colborne/siding,3,https://homestars.com/on/port-colborne/siding,Siding,2916679,,/companies/2916679-golden-horse-shu-living-inc?searched_category_id=432&service_area=2260485,"While located in Mississauga, Ontario Golden Horse Shu Living Inc. offers our renovation services all over the GTA even covering the Niagara region. We are a family run business, strongly committed to providing a high quality of craftsmanship and customer service to each and every customer, no matter the size of the job. Over eighty percent of our business is from repeat and referral customers. This success stems, in part, from the reputation GHSL Inc. has built over the past 3 years in business.
 
While other companies may send their representatives to your home, the owners of Golden Horse Shu Living Inc. personally estimates each job and works side-by-side with you on every aspect of your project from start to finish. We are a start to finish company we will get your work done in a timely manner and minimize any down time that may occur during your project.
 
Golden Horse Shu Living Inc. licensed and for your protection we carry both liability and WSIB for all of our workers and employees. Our Company stand behind all work performed and backs all projects with a full 1 year warranty.
 
GHSL Inc. offers comprehensive remodeling services and is dedicated to ensuring complete satisfaction on each and every job. Whether you want to remodel the kitchen or redo the bathroom, our team of professional craftsmen can transform your wish list into the reality of a beautifully remodeled home.
 
",golden-horse-shu-living-inc,2018-05-17T10:46:00.000-04:00,NA,NA,NA,,,,,2015,7,"E-transfer, Certified cheque, Cash, Financing (contact for further details)",construction engineering/building renovations,,,TRUE,FALSE,,,FALSE,FALSE,1-Year on Workmanship,1978863,Golden Horse Shu Living Inc.,30,24,214,9.875,"General Contractors, Residential General Contractor, Building Contractor, Additions, Remodeling Contractor,  Renovation, Builder, building construction, renovation, remodeling, construction builders, construction company, construction companies, home repair, construction jobs, home remodeling, general contractors, contractors general, contractor general, contractors construction, construction contractors, home improvement and remodeling, kitchen remodeling, construction contractor, builders contractors, home renovation, general contracting, building contractors, building companies, home renovations, builder contractor, building contractor, remodeling contractor, commercial construction, residential construction, house contractor, concrete contractors, home contractors, general construction, construction general, contractors remodeling, remodeling contractors, remodelers, remodel contractor, remodel contractors, general contract, commercial contractors, renovations contractors, home improvement contractor, licensed contractor, license general contractor, mud room, mudroom, caulking, ,Siding, vinyl siding, wood siding, exterior siding, aluminum siding, cedar shakes, cedar shingles, composite wood siding, seamless steel siding, wood clapboard, stone siding, brick siding, exterior, side, sides, how to siding, the siding, the other side, stucco,  how to vinyl siding, about vinyl siding, what is vinyl siding, in vinyl siding, vinyl siding how to, vinyl siding, siding vinyl, how to install vinyl, cement fiber, fiber cement, siding house, house with siding, siding on a house, what is siding on a house, siding for house, siding a house, how to siding a house, siding on house, house siding, siding for a house, ,Tile & Stone Contractors, Natural Stone Tile, Stone Floor Tile, Ceramic Tile, Floor tile, Tile installers, Stone installers, stone counter top installers, tile counter top installers, stone backsplash intallers, granite installers, marble installers, limestone installers, linoleum installers, slate contractors, slate installers,install tite ,backsplash , fire place veenerneed someone to install blacksplash , wall stone veener bath room mosaic,",0,2018-05-17T10:46:39.000-04:00,FALSE,0,0,71,0,FALSE,4ae3284a54d3edc824ffa253c9443566dc521252,TRUE,NA,TRUE,TRUE,2260485,97.7930644649,432,NA,NA
https://homestars.com/on/port-colborne/siding,3,https://homestars.com/on/port-colborne/siding,Siding,2759212,NA,/companies/2759212-richard-siding?searched_category_id=432&service_area=1772416,NA,richard-siding,2008-03-04T16:55:15.000-05:00,NA,NA,NA,NA,NA,NA,NA,NA,NA,NA,NA,NA,NA,FALSE,FALSE,NA,NA,FALSE,FALSE,NA,1822264,Richard Siding,0,0,0,NA,"Siding, vinyl siding, wood siding, exterior siding, aluminum siding, cedar shakes, cedar shingles, composite wood siding, seamless steel siding, wood clapboard, stone siding, brick siding, exterior, side, sides, how to siding, the siding, the other side, stucco,  how to vinyl siding, about vinyl siding, what is vinyl siding, in vinyl siding, vinyl siding how to, vinyl siding, siding vinyl, how to install vinyl, cement fiber, fiber cement, siding house, house with siding, siding on a house, what is siding on a house, siding for house, siding a house, how to siding a house, siding on house, house siding, siding for a house, ,",0,NA,FALSE,0,0,0,NA,FALSE,NA,FALSE,NA,FALSE,FALSE,1772416,0,432,NA,NA
