Link,n_hits,all_links,category,id,url,hs_path,profile,permalink,created_at,sic_code,service_area,hours,products,services,brands,specialities,established,employee_cnt,payment_method,diplomas,licenses,memberships,liability_insurance,bonded,project_rate,project_minimum,written_contract,written_warranty,warranty_terms,parent_company_id,name,total_number_of_reviews_cache,total_number_of_approved_reviews_cache,number_of_photos_cache,avg_rating_cache,categories_info_cache,savings_count,claimed_at,subdomain,fraudulent,fraudulent_count,total_number_of_pending_reviews_cache,images_count,completion_percent_cache,bully,secret,replied_to_at_least_one_review_cache,latest_approved_review_created_at,has_set_tasks,lead_purchase_eligible,service_area_id,star_score,quote_button_category,direct_phone,direct_contact
https://homestars.com/on/schomberg/tile-stone-contractors,24,"c(""https://homestars.com/on/schomberg/tile-stone-contractors?&page=2&"", ""https://homestars.com/on/schomberg/tile-stone-contractors?&page=3&"")",Tile & Stone Contractors,2924698,,/companies/2924698-gena-tile-demolition?searched_category_id=442&service_area=2182450,"As a professional Construction Company, the talented team at Gena tile & stone only works with the best materials. Our staff members produce consistent results and offer reliable work ethics on every project they work on. Everything we work on is built on a strong foundation, which means it’s built to last",gena-tile-demolition,2018-11-28T09:58:28.000-05:00,NA,NA,NA,,"tile installation
tile demolition
Tile design ",,,2019,2,cash,,,,FALSE,FALSE,,,FALSE,FALSE,1 year limited warranty,1986872,Gena Tile & Demolition,24,23,51,9.52174,"Tile & Stone Contractors, Natural Stone Tile, Stone Floor Tile, Ceramic Tile, Floor tile, Tile installers, Stone installers, stone counter top installers, tile counter top installers, stone backsplash intallers, granite installers, marble installers, limestone installers, linoleum installers, slate contractors, slate installers,install tite ,backsplash , fire place veenerneed someone to install blacksplash , wall stone veener bath room mosaic,Demolition, demolition, excavation, salvage, city demolition, demolition city, demolition company, demolition companies, demolition co, demolition inc, demolition business, concrete removal, demolition of building, building demolition, demolition building, demolition contractors, demolition of house, demolition house, house demolition, house for demolition, demolition removal, demolition and removal, demolition home, home demolition, demolish house, how to demolish a house, demo companies, demolition and construction, demolition construction, construction and demolition, construction demolition, demolition contractor, demolition tools, cost of demolition, demolition cost, demolishing a house, demolition concrete, demolition of concrete, concrete demolition, ,",0,2018-11-28T10:00:15.000-05:00,genatileandstone,FALSE,0,0,53,0,FALSE,070bd33483a6eef8afba38a4a7f9639b351b5d61,TRUE,2022-01-04T19:28:24.000-05:00,TRUE,TRUE,2182450,91.8603984532,442,NA,NA
https://homestars.com/on/schomberg/tile-stone-contractors,24,"c(""https://homestars.com/on/schomberg/tile-stone-contractors?&page=2&"", ""https://homestars.com/on/schomberg/tile-stone-contractors?&page=3&"")",Tile & Stone Contractors,2973477,,/companies/2973477-david-gta-hardwood-flooring?searched_category_id=442&service_area=2292927,,david-gta-hardwood-flooring,2022-09-26T08:08:58.000-04:00,NA,NA,NA,,,,,NA,NA,,,,,FALSE,FALSE,,,FALSE,FALSE,,2035388,David GTA Hardwood Flooring,2,1,2,10,"Tile & Stone Contractors, Natural Stone Tile, Stone Floor Tile, Ceramic Tile, Floor tile, Tile installers, Stone installers, stone counter top installers, tile counter top installers, stone backsplash intallers, granite installers, marble installers, limestone installers, linoleum installers, slate contractors, slate installers,install tite ,backsplash , fire place veenerneed someone to install blacksplash , wall stone veener bath room mosaic,Floor Laying & Refinishing, Hardwood Floor, Wood Floor, Floor Tile, Dance Floor, Ceramic Floor Tile, Floor Refinishing, bamboo floor, cork floor, FSC wood flooring, stone floor, marble floor, slate floor, squeaky floor repair, laminate, laminate repair, wood floor, floor and wood, wood flooring, wood floors, floors in wood, hardwood flooring, hardwood floors, hardwood floors and, hardwood floor, hardwood floor wood, wood floor flooring, refinishing, floor refinishing, floor refinishing in, refinishing floor, hardwood install, floor laying, laying a floor, flood sanding, wood floor refinishing, refinishing hardwood floors, flooring laying, wood floors refinishing, wood flooring refinishing, floor co, flooring hard wood, hard wood floors, laying floors, flooring company, flooring engineered hardwood, floor company, hard wood floor, cleaning hardwood floors, installing hardwood flooring, installing hardwood floors, installing wood flooring, installing wood floors, installing hardwood floors, installing wood flooring, installing wood floors, installing hardwood floor, hardwood flooring installation, business floor, wood flooring installation, hardwood floor installation, floor companies, lay hardwood flooring, lay hardwood floor, wood floor repair, repair wood floor, repair hardwood floor, hardwood floor repair, finishing a hardwood floor, squeeky floors,,Hardwood floors, Install hardwood floors, caulking,Stair Builders, stairs, spiral stairways, spiral stairs, wood stairs, staircase, staircases,stairsSimple ten stairs instillation straigth,stairs instalation, ,",0,2022-09-26T08:16:12.000-04:00,,FALSE,0,0,3,0,FALSE,5435bfffb5ed97222bb187884b36993d3ced826c,TRUE,2022-09-29T22:59:15.000-04:00,TRUE,TRUE,2292927,89.8409131739,442,NA,NA
https://homestars.com/on/schomberg/tile-stone-contractors,24,"c(""https://homestars.com/on/schomberg/tile-stone-contractors?&page=2&"", ""https://homestars.com/on/schomberg/tile-stone-contractors?&page=3&"")",Tile & Stone Contractors,2971494,http://rockstarstonery.ca,/companies/2971494-rockstar-stonery-inc?searched_category_id=442&service_area=2288066,"We provide all kind of stone products such as kitchen countertops, full backsplash, vanity top, fireplace surroundings also table top. Our company offer competitive pricing, free measuring around the GTA as well as free estimates.
All of our materials are sourced, processed and manufactured to the highest possible standards.
We're able to price our works more competitively than some larger companies who use lifestyle and design as justification for higher prices, where in fact customers are only paying extra to support large marketing campaigns. We cut out the middle man, passing on those savings directly to our customers.",rockstar-stonery-inc,2022-08-08T21:07:11.000-04:00,NA,NA,NA,Stone Countertops,Fabrication and installation,"Caesorstone, MSI, SIO4, Lucent, and much more",,2000,5,"Cash, E-transfer and check",,,,FALSE,FALSE,,,FALSE,FALSE,Limited Warranty/Varies by Supplier,2033405,Rockstar stonery Inc,1,1,35,10,"Countertops, Granite Counter Tops, Kitchen Counter Tops, Marble Counter Tops, Laminate Counter Top, Quartz Counter Top, Corian counter top, tile counter top, silestone counter tops, arborite counter tops, custom counter tops, kitchen, remodeling, kitchen cabinet, kitchen design, ,Tile & Stone Contractors, Natural Stone Tile, Stone Floor Tile, Ceramic Tile, Floor tile, Tile installers, Stone installers, stone counter top installers, tile counter top installers, stone backsplash intallers, granite installers, marble installers, limestone installers, linoleum installers, slate contractors, slate installers,install tite ,backsplash , fire place veenerneed someone to install blacksplash , wall stone veener bath room mosaic,",0,2022-08-08T21:09:08.000-04:00,rockstarstonery,FALSE,0,0,36,0,FALSE,769e215096134d348d05941d20fd97159477af8a,TRUE,NA,TRUE,TRUE,2288066,90.4934242211,442,NA,NA
https://homestars.com/on/schomberg/tile-stone-contractors,24,"c(""https://homestars.com/on/schomberg/tile-stone-contractors?&page=2&"", ""https://homestars.com/on/schomberg/tile-stone-contractors?&page=3&"")",Tile & Stone Contractors,2968421,,/companies/2968421-ehr-tiles?searched_category_id=442&service_area=2284587,"EHR Tiles is a local tile installation company. We specialize in custom bathrooms and kitchen design and installation. 

Kindly send us a message and we will be happy to speak to you about your project. 

",ehr-tiles,2022-05-19T16:28:58.000-04:00,NA,NA,NA,,,,,NA,NA,,,,,FALSE,FALSE,,,FALSE,FALSE,,2030339,EHR Tiles,1,1,140,10,"Tile & Stone Contractors, Natural Stone Tile, Stone Floor Tile, Ceramic Tile, Floor tile, Tile installers, Stone installers, stone counter top installers, tile counter top installers, stone backsplash intallers, granite installers, marble installers, limestone installers, linoleum installers, slate contractors, slate installers,install tite ,backsplash , fire place veenerneed someone to install blacksplash , wall stone veener bath room mosaic,",0,2022-05-19T16:31:46.000-04:00,ehrtiles,FALSE,0,0,193,0,FALSE,64b6c88000f323a3a783c1a3899c738c931ab3bf,TRUE,NA,TRUE,TRUE,2284587,78.5848381335,442,NA,NA
https://homestars.com/on/schomberg/tile-stone-contractors,24,"c(""https://homestars.com/on/schomberg/tile-stone-contractors?&page=2&"", ""https://homestars.com/on/schomberg/tile-stone-contractors?&page=3&"")",Tile & Stone Contractors,2975764,,/companies/2975764-tmg-ltd?searched_category_id=442&service_area=2298246,,tmg-ltd,2022-11-11T13:19:02.000-05:00,NA,NA,NA,,,,,2014,4,,,,,FALSE,FALSE,,,FALSE,FALSE,,2037662,TMG LTD,0,0,1,NA,"Tile & Stone Contractors, Natural Stone Tile, Stone Floor Tile, Ceramic Tile, Floor tile, Tile installers, Stone installers, stone counter top installers, tile counter top installers, stone backsplash intallers, granite installers, marble installers, limestone installers, linoleum installers, slate contractors, slate installers,install tite ,backsplash , fire place veenerneed someone to install blacksplash , wall stone veener bath room mosaic,Bathroom Renovation, Bathroom renovation, bathroom remodeling, bathroom remodelling, renovating the bathroom, tearing out the bathroom, fixing up the bathroom, bathroom contractors, bathroom vanities, bathroom vanity, design of bathroom, bathroom and design, design for bathroom, design a bathroom, design a bath, bath design, bathroom tile, bathroom cabinets, remodeling a bathroom, bathroom remodeling, remodeling the bathroom, ,Bath renovation, New tub, caulking, ,",0,2022-11-11T13:19:35.000-05:00,,FALSE,0,0,2,0,FALSE,6554766b3f2f4e0a860c8f163f7322b8304a4763,FALSE,NA,TRUE,TRUE,2298246,-1.0,442,NA,NA
