Link,n_hits,all_links,category,id,url,hs_path,profile,permalink,created_at,sic_code,service_area,hours,products,services,brands,specialities,established,employee_cnt,payment_method,diplomas,licenses,memberships,liability_insurance,bonded,project_rate,project_minimum,written_contract,written_warranty,warranty_terms,parent_company_id,name,total_number_of_reviews_cache,total_number_of_approved_reviews_cache,number_of_photos_cache,avg_rating_cache,categories_info_cache,savings_count,claimed_at,subdomain,fraudulent,fraudulent_count,total_number_of_pending_reviews_cache,images_count,completion_percent_cache,bully,secret,replied_to_at_least_one_review_cache,latest_approved_review_created_at,has_set_tasks,lead_purchase_eligible,service_area_id,star_score,quote_button_category,direct_phone,direct_contact
https://homestars.com/on/kars/alarm-systems,69,"c(""https://homestars.com/on/kars/alarm-systems?&page=2&"", ""https://homestars.com/on/kars/alarm-systems?&page=3&"", ""https://homestars.com/on/kars/alarm-systems?&page=4&"", ""https://homestars.com/on/kars/alarm-systems?&page=5&"", ""https://homestars.com/on/kars/alarm-systems?&page=6&"", ""https://homestars.com/on/kars/alarm-systems?&page=7&"")",Alarm Systems,223430,http://www.safetechalarms.com,/companies/223430-safetech-alarm-systems-and-video-surveillance?searched_category_id=303&service_area=1852330,"**Special promotion on now: free alarm installation + 15% off the first year of monitoring** (valid for new installations only)
 


By strategically locating devices designed to detect intrusion, Safetech's acquired a unique ability to successfully protect both people and property. By blending together different security technologies and procedures we achieve the highest security standard possible with the lowest “rate of loss” among our clients in the industry.
 
Only by taking a comprehensive integrated security approach to the needs of our clients can the best results be achieved. For instance, statistically adding an alarm will reduce a chance of a ‘break and enter’ by 10x when compared with a home that has no alarm system. However, if you combine one or more surveillance tools together, such as an alarm system combined with video surveillance cameras, your chance of a ‘break and enter’ is reduced by 40x when compared with an unprotected property.
 
Furthermore, even if you do end up being a victim of a ‘break and enter’ the amount of property stolen is 50% less than it would be if the premise only had an alarm system. Compare this to a property that has little or no protection (no alarm or video cameras) the savings are even greater, with a total 80% reduction in loss of property value. Therefore, security surveillance tools work even better when used in tandem to prevent property loss and are a very effective way of deterring and reducing crime.
 
Good Protection Starts with Good Design
 
Safetech loss prevention advisors are trained to ensure clients receive proper security coverage using the significant arsenal of security tools and techniques they have at their disposal.
 
An advisor will begin first by having a detailed discussion with our potential clients to determine their specific application and security needs. Once an advisor is satisfied that they have an understanding of the clients needs a security solution will be recommended. There is absolutely ‘no obligation’ to follow any recommendation given and there is no charge for our security evaluation.
 
Good protection may start with good design but it can only be maintained with good monitoring and management procedures.Most people think that a 24 hour monitoring station exists solely to respond to emergency signals. However, equally important is the need to respond to no signals when one is expected, or to trouble signals coming from the control panel.
 
A trouble condition may arise when a client’s alarm panel fails to send its scheduled weekly test signal to the monitoring station, or, if it sends a signal indicating that the power has failed or the back up battery is low. “How quickly a security company deciphers and responds to these conditions is a true measure of the quality of their service”.
 
Sean O’Leary – President of Safetech Inc.
 
<a href=""https://www.facebook.com/pages/SafeTech-Alarm-Systems/424812180907702"">BE SURE TO LIKE US ON FACEBOOK!</a>
 
<a href=""https://plus.google.com/+SafeTechAlarmSystemsToronto/posts"">BE SURE TO FOLLOW US ON GOOGLE+!
 
<a href=""https://twitter.com/safetech_alarm"">BE SURE TO FOLLOW US ON TWITTER!</a>
 
<a href=""http://www.bbb.org/kitchener/business-reviews/burglar-alarm-systems-dealers-monitoring-and-service/safe-tech-alarm-systems-in-north-york-on-19496"">CHECK OUT RATING ON THE BBB!</a>
 
Alarms, Security Systems, Surveillance Cameras, Security Cameras, Alarm Systems, Access Control, Card Access, Security Alarm, Security Alarm Systems, Security Toronto, Security in Toronto, Home Alarm, Smoke Detectors, Wireless Cameras, Video Surveillance, Home Alarm System, Home Security Systems, Fire Alarms, CCTV Cameras, Business Security, Home Security Alarm, Security Camera Systems, Home Alarms, Alarm Monitoring, Alarm Toronto, Medical Alarms, Business Alarm, Security Monitoring, Burglar Alarm Systems, Alarm System Toronto, Guards, Bodyguard, Security Guard, Security Services, Security Officer,Security Guards, Private Investigator, Security Companies, Emergency Response, Loss Prevention, Guard Dogs, Private Security, Event Security, Corporate Security, Mall Security, Private Guard Company, Security Bars, Window Security Bars, Home Alarm Kits,Medical Alert, Medical Emergency, Medical Bracelets,Medical Alarm, Guard Security, Security Guard Toronto, Ontario Guard Security,Private Investigator Toronto, Security Guards Toronto, Home Alarms in Toronto, Security System in Toronto, 24 HOUR MONITORING, 24 HOUR REAL TIME RECORDER, ACCESS CONTROL, ACCESS CONTROL SYSTEMS, ACCESS SYSTEM, ADEMCO BURGLAR ALARMS, ADT ALARMS, ADT HOME SECURITY, ADT SECURITY, ADVANCED SECURITY, AIPHONE INTERCOMS, ALARM COMPANIES, ALARM MONITORING, ALARM ROUGH, ALARM SYSTEMS TORONTO, ALPHA NUMERIC KEYPAD, API ALARMS, ARTICLE ANTENNAS, ARTICLE SURVEILLANCE, BABY MONITOR, BABY MONITORS, BANNER, BAR FIXTURES, BARD, BATTERY, BLACK AND WHITE CAMERA, BOARD CAMERA, BRINKS HOME SECURITY, BULLET CAMERA, BURGLAR, BURGLAR ALARM, BURGLAR ALARM CONTROL REPAIR, BURGLAR ALARM SYSTEMS, BURGLAR ALARM SYSTEMS RESIDENTIAL, COMMERCIAL & INDUSTRIAL -CANADA, BURGLAR ALARMS, BURGLAR BARD, BURGLAR GLASS FOIL, BURGLAR WINDOW TAPE, BURGLARY, BUSINESS ALARM, BUSINESS ALARM SYSTEM, BUSINESS ALARM SYSTEMS, BUSINESS ALARMS, BUSINESS BURGLAR ALARM, BUSINESS SECURITY, BUSINESS SECUURITY ALARM SYSTEM, BUSINESS SECURITY BARS, BUSINESS SECURITY BARS &GATES, BUSINESS SECURITY BARS &GRILLS, BUSINESS SECURITY BARS BARS PROTECTION, BUSINESS SECURITY CAMERAS, BUSINESS SECURITY COMPANY, BUSINESS SECURITY CONSULTANTS, BUSINESS SECURITY CONTROL, BUSINESS SECURITY CONTROL &MONITORING, BUSINESS SECURITY CONTROL &EQUIPMENT, BUSINESS SECURITY CONTROL &EQUIPMENT SYSTEMS, BUSINESS SECURITY EQUIPMENT, BUSINESS SECURITY GUARD&PATROL, BUSINESS SECURITY MONITORING, BUSINESS SECURITY PRODUCT,  BUSINESS SECURITY SERVICES, BUSINESS SECURITY SURVEILLANCE, BUSINESS SECURITY SYSTEM, BUSINESS SECURITY SYSTEMS, BUZZER, CAMERA, CAMERA BRACKET, CAMERA BULLET, CAMERA DOME, CAMERA HOUSING WITH HEATER AND BLOWER, CAMERA LENS, CAMERA MOUNT, CAMERA&SURVEILLANCE, CANON DIGITAL CIDEO CAMERA, CAPTURE CARDS, CAR ALARM, CARBON MONOXIDE DETECTOR, CCTV CAMERAS,CODE ALARM, COLOUR CAMERA, COMMERCIAL ALARM SYSTEMS, COMMERCIAL SECURITY CAMERAS, COVERT CAMERAS, CRIME PREVENTION, CUSTOM SECURITY SYSTEMS, DELTA TAGS, DIGIPLEX, DIGITAL VIDEO CAMERA, DIGITAL VIDEO SURVEILLANCE, DOME CAMERA, DOOR ACCESS SYSTEM, DOOR GRILLS, DOOR KEYS DOOR LOCKS, DOOR READERS, DOOR SECURITY BARS, DSC BURGLAR ALARMS, DSC CONCOURSE, DSC FIXED ICON KEYPAD DSC GLASS BREAK ,DSC MAXSYS, DSC MOTION, DSC MOTION DETECTIORS, DSC SECURITY PRPDUCTS, DUMMY CAMERA, ALECTRONIC ARTICLE SURVEILLANCE, EMERGENCY SIGNS, FREE ALARM, FREE INSTALLS, FREE SECURITY CONSULTATION, FREE SECURITY INSTALLATION, FREEZER SENSOR, GE BURGLAR ALARM, GE SECURITY PRODUCTS, GENERAL ELECTRIC SECURITY, BLASS BREAK, GUARD, RESPONSE SERVICE, HIDDEN CAMERA, HIDDEN CAMERAS, HIGH RESOLUTION SECURITY CAEMRA, HOME AUTOMATION, HOME BURGLAR ALARM, HOME SECURITY BARS, HOME SECURITY CAMERA, HOME SECURITY CONTROL &EQUIPMENT, HOME SECURITY MONITORING, , HOME SECURITY PRODUCTS, HOME SECURITY SERVICES, HOME SECURITY SURVEILLANCE, HONEY WELL MOTIONS, HONEY WELL SMOKE DETECTORS, HONEYWELL ALARMS, HONEYWELL ALARMS, HONEYWELL FLOOD SENSOR, HONEYWELL KEYPAD, HONEYWELL SECURITY, HONEYWELL THERMOSTAT CENTRAL, INDUSTRIAL ALARM SYSTEM , INTEGRATED ALARM SYSTEMS, INTERLOGIX BURLAR ALARMS, INTERNET CAMERAS, INTERNET SECURITY SYSTEM, IP CAMERAS, ITI BURGLAR ALARMS, JVC DIGITAL VIDEO CAMERA, KEY SECURITY SYSTEMS, LCD KEYPAD, LINEAR BURGLAR ALARMS, MEDICAL EMERGENCIES, MEDICAL PENDANTS, MEDICAL PRESENCE, MEDICAL RESPONSE, MEDICAL SECURITY, MEDICAL SECURITY, MEDICAL SYSTEMS, MOTION DETECTOR, NANNY CAMERAS, ONTARIO HOME ALARMS, OUTDOOR SECURITY CAMERA, PARADOX EMERGENCY RESPONSE SYSTEM, PARADOX MOTIONS, PARADOX SECURITY, PARADOX SYSTEMS, PASSIVE INFRARED DETECTOR, PET MOTION, PRIVATE SECURITY GUARDS, PRIVATE GUARD RESPONSE, PRIVATE GUARDS, RESIDENTIAL ALARM SYSTEMS, RESIDENTIAL ALARM, RESIDENTIAL BURGLAR ALARM, RESIDENTIAL SECURITY ALARMS, RESIDENTIAL SECURITY ALARMS, RESIDENTIAL SECURITY BARS, RESIDENTIAL SECURITY CAMERAS, RESIDENTIAL SECURITY CONTROL &EQUIPMENT, RESIDENTIAL SECURITY GUARD, RESIDENTIAL SECURITY MONITORING, RESIDENTIAL SECURITY SURVEILLANCE, RESIDENTIAL SECURITY SYSTEM, SAFETECH ALARM SYSTEMS, SECURITY ALARM INSTALLATION, SECURITY CONTROL EQUIPMENT &MONITORING, SECURITY SURVEILLANCE, SECURITY TAG, SPY CAMERA, SURVEILLANCE PRODUCTS, TELEVISION EQUIPMENT, TELEVISION SYSTEMS, TEMPERATURE CONTROL, TORONTO ALARM MONITORING, TORONTO ALARMS, TORONTO HOME ALARMS, TORONTO SECURITY, TORONTO SECURITY ALARMS, VEHICLE ALARM VIDEO CAMERAS, VIDEO EQUIPMENT SECURITY SYSTEMS, WINDOW SENSORS, WIRELESS ALARM, WIRELESS DEVICES, WIRELESS HOME SECURITY, WIRELESS KEY REMOTE, WIRELESS MOTION DETECTOR, WIRELESS SECURITY CAMERA, WIRELESS SECURITY SYSTEM, WIRELESS WINDOW CONTACT, SECURITY DOORS, SECURITY LOCKS, LOCKSMITH, REINFORCEMENT DOOR FRAMES, DOOR REINFORCEMENT, LOCKS, ALARMS & VIDEO SURVEILLANCE, Barrie  home alarms	
Brampton home alarms, Burlington home alarms, Cambridge home alarms, Guelph home alarms, Hamilton home alarms, Kingston home alarms, Kitchener home alarms, London home alarms, 	
Markham home alarms, Mississauga home alarms, Niagara home alarms, Oakville home alarms, Oshawa home alarms, Ottawa home alarms, Richmond Hill home alarms, St. Catharines home alarms, Sudbury home alarms, Thunder Bay home alarms
Toronto home alarms, Vaughan home alarms, Waterloo home alarms, Windsor home alarms, Airdrie home alarms, Calgary home alarms, Edmonton home alarms, Red Deer home alarms, Vernon home alarms, New Westminster, Phoenix home alarms, Kelowna home alarms, West Palm Beach home alarms",safetech-alarm-systems-and-video-surveillance,2008-01-23T10:35:08.000-05:00,NA,"(All of Ontario) Brampton, Concord, Etobicoke, Markham, Mississauga, Newmarket, North York, Oakville, Richmond Hill, Scarborough, Thornhill, Toronto, Unionville, Vaughan, Woodbridge, Hamilton, Burlington, Kitchener, Cambridge, Waterloo, Barrie, Kingston etc...",9:00 am to 8:00 pm,"DSC and Honeywell Brand Home and Business Alarm Systems, Security Cameras, CCTV, DVR, Window Bars, Access Control, and much more, GSM 3070. GSM 3060, GSM 2065, DSC 1616, DSC 1832, DSC 1864","Burglar, Fire & Flood Alarm Monitoring, Installation of Surveillance Cameras & Recorders, Card Access Control Systems, Article Surveillance Tags, Area Wide RFID, GPS Tracking, Medical Alarm (Personal Emergency Response Systems, Window Film, Window Bars & Gates, Security Keys, Door & Window Locks, Security Signs, Security Guards, Convex Mirrors, Computer Cages, Security Cable, Client / Employee Training, Fencing,Alarms, Security Systems, Surveillance Cameras, Alarm Systems, Security Cameras, Access Control, Security Alarm Systems, Smoke Detectors, Wireless Cameras, Video Surveillance, Home Security Systems, Fire Alarms, CCTV Cameras, Business Security, Home Alarm Systems, Home Alarms, Alarm Toronto, Burglar Alarm Systems, Guards, Bodyguard, Security Guard, Security Services, Private Investigator, Emergency Response, Office Security, Loss Prevention, Guard Dogs, Private Security, Event Security, Corporate Security, Security Guard Toronto, Mall Security, Security Guards Toronto, Security Guard Companies, Private Security Guards, Bodyguarding, Medical Bracelets, 24 hour monitoring, Digital video cameras, Fire alarms, Private Guards, security doors, security locks, locksmith, reinforcement door frames, door reinforcement, locks, alarms & video surveillance, Brampton home alarms, Burlington home alarms, Cambridge home alarms, Guelph home alarms, Hamilton home alarms, Kingston home alarms, Kitchener home alarms, London home alarms, 	
Markham home alarms, Mississauga home alarms, Niagara home alarms, Oakville home alarms, Oshawa home alarms, Ottawa home alarms, Richmond Hill home alarms, St. Catharines home alarms, Sudbury home alarms, Thunder Bay home alarms
Toronto home alarms, Vaughan home alarms, Waterloo home alarms, Windsor home alarms, Airdrie home alarms, Calgary home alarms, Edmonton home alarms, Red Deer home alarms, Vernon home alarms, New Westminster home alarms, Phoenix home alarms, Kelowna home alarms, West Palm Beach home alarms, Vancouver home alarms","DSC, General Electric, Honeywell. Paradox, GSM, ADEMCO, etc.","Free alarm installations, HD security cameras, uniformed security guards, card access, fire alarms, medical alarms, window bars and gates, security guard service and home automation (smart homes).",1990,44,"Cheque, Visa, MasterCard, American Express, Pre-authorized Payment Plan",,Security Guard License No. 10820898ULC Listed Commercial Type Alarm Systems ,"Canadian Alarm and Security Association,   Underwriters Laboratories of Canada, GTHBA (Builders As",TRUE,TRUE,,,TRUE,TRUE,"1 year parts and labour, Extended 3 year parts and labour",74903,Safe Tech Alarm Systems And Video Surveillance,1374,1026,20,9.50658,"Alarm Systems, Home Alarm Systems, Alarm System Monitoring, Fire Alarm Systems, Home Security Systems, The Alarm, At Home Security, Home Security, Security Systems, Alarm Security, Security Alarm, Security Cameras, Security Company, Security Companies, Home alarm, Alarm home, Alarm security, House security, house alarm, burglar alarm, carbon monoxide, carbon monoxide alarms, business cameras, commercial surveillance systems, surveillance, commercial security cameras, commercial security camera,,",4,2008-01-23T10:35:08.000-05:00,safetech,FALSE,0,0,20,100,FALSE,1ba9d02266b892b8947bb57167d86feeb512af97,TRUE,2022-07-29T12:56:30.000-04:00,TRUE,TRUE,1852330,94.4974590998,303,NA,NA
https://homestars.com/on/kars/alarm-systems,69,"c(""https://homestars.com/on/kars/alarm-systems?&page=2&"", ""https://homestars.com/on/kars/alarm-systems?&page=3&"", ""https://homestars.com/on/kars/alarm-systems?&page=4&"", ""https://homestars.com/on/kars/alarm-systems?&page=5&"", ""https://homestars.com/on/kars/alarm-systems?&page=6&"", ""https://homestars.com/on/kars/alarm-systems?&page=7&"")",Alarm Systems,2783374,https://www.cspalarms.ca/,/companies/2783374-canadian-security-professionals?searched_category_id=303&service_area=2188138,"Canadian Security Professionals is one of the largest Canadian owned and operated Alarm System companies. We provide security and peace of mind for Canadian homes and businesses. Here at CSP we give special promotional offers on the newest and best Security Systems and Smart Home Systems. We are proud to be 100% Canadian with all of our monitoring, customer service, and tech support located in Canada. 

Alarm Systems, Home Alarm Systems, Business Alarm Systems, Security Systems, Home Security Systems, Business Security Systems, Smart Home Systems, Home Automation Systems, Security Cameras, Buy a Security System, Buy an Alarm System, GSM Security System, Wireless Security System, Wireless Alarm Systems, Motion Sensor Alarm Systems, Motion Senor Security, Wireless Security Cameras, Alarm System Door Contacts, Smart Home Alarm System, Interactive Security Systems, Best Alarm Systems, Best Security Systems, Top Alarm Company",canadian-security-professionals,2011-01-09T23:17:31.000-05:00,NA,All of Ontario and Lower Mainland British Columbia,,"Alarm Systems, Home Alarm Systems, Business Alarm Systems, Security Systems, Home Security Systems, Business Security Systems, Smart Home Systems, Home Automation Systems, Security Cameras, Buy a Security System, Buy an Alarm System, GSM Security System, Wireless Security System, Wireless Alarm Systems, Motion Sensor Alarm Systems, Motion Senor Security, Wireless Security Cameras, Alarm System Door Contacts, Smart Home Alarm System, Interactive Security Systems, Best Alarm Systems, Best Security Systems, Top Alarm Company","Install Alarm Systems, Service Alarm Systems, Install Security Systems, Service Security Systems, Home Security, Business Security, Alarm System Monitoring, Security System Monitoring, Alarm Monitoring, Alarm System Phone Apps, Security System Installation, Upgrade Home Alarm System, Upgrade Security System","CSP, Alarm.com, 2GIG, Qolsys, DSC, Hikvision, Weiser, Skybell, Liftmaster",,2010,NA,"Mastercard, Visa, AMEX, Cheque, Money Order, Cash",,,,TRUE,FALSE,,,TRUE,FALSE,Lifetime Warranty,1846426,Canadian Security Professionals,410,234,10,9.75214,"Alarm Systems, Home Alarm Systems, Alarm System Monitoring, Fire Alarm Systems, Home Security Systems, The Alarm, At Home Security, Home Security, Security Systems, Alarm Security, Security Alarm, Security Cameras, Security Company, Security Companies, Home alarm, Alarm home, Alarm security, House security, house alarm, burglar alarm, carbon monoxide, carbon monoxide alarms, business cameras, commercial surveillance systems, surveillance, commercial security cameras, commercial security camera,,",1,2011-01-09T23:17:33.000-05:00,cspalarms,FALSE,0,0,12,NA,FALSE,8836da7a8af6d956d2b4930fee24451f872bfb1c,TRUE,2020-11-05T17:21:54.000-05:00,TRUE,TRUE,2188138,97.6632569232,303,NA,NA
https://homestars.com/on/kars/alarm-systems,69,"c(""https://homestars.com/on/kars/alarm-systems?&page=2&"", ""https://homestars.com/on/kars/alarm-systems?&page=3&"", ""https://homestars.com/on/kars/alarm-systems?&page=4&"", ""https://homestars.com/on/kars/alarm-systems?&page=5&"", ""https://homestars.com/on/kars/alarm-systems?&page=6&"", ""https://homestars.com/on/kars/alarm-systems?&page=7&"")",Alarm Systems,2811075,,/companies/2811075-private-eye-security-inc?searched_category_id=303&service_area=1883541,"$14.99/Mo Standard Rate for Monitoring, www.privateeyesecurity.ca Fully Monitored & Serviced Security Systems, Smart Home Automation, Cameras,  Pre-Wiring, Networking, Ethernet, GPS Systems & Tracking, and much more, with unlimited possibilities….Call us and start saving! 
Don't forget to refer five friends and get a lifetime of free monitoring service guaranteed.  ",private-eye-security-inc,2013-06-12T10:58:59.000-04:00,NA,NA,Mon - Friday 11Am - 7Pm,,,,,NA,NA,,,,,FALSE,FALSE,,,FALSE,FALSE,,1874075,"Private Eye Security, Inc.",25,23,2,10,"Alarm Systems, Home Alarm Systems, Alarm System Monitoring, Fire Alarm Systems, Home Security Systems, The Alarm, At Home Security, Home Security, Security Systems, Alarm Security, Security Alarm, Security Cameras, Security Company, Security Companies, Home alarm, Alarm home, Alarm security, House security, house alarm, burglar alarm, carbon monoxide, carbon monoxide alarms, business cameras, commercial surveillance systems, surveillance, commercial security cameras, commercial security camera,,",0,NA,,FALSE,0,0,3,NA,FALSE,67aef35223876a7ff49f1608d8bd4df22f4084e2,TRUE,2016-05-17T12:14:59.000-04:00,TRUE,TRUE,1883541,91.0604407673,303,NA,NA
https://homestars.com/on/kars/alarm-systems,69,"c(""https://homestars.com/on/kars/alarm-systems?&page=2&"", ""https://homestars.com/on/kars/alarm-systems?&page=3&"", ""https://homestars.com/on/kars/alarm-systems?&page=4&"", ""https://homestars.com/on/kars/alarm-systems?&page=5&"", ""https://homestars.com/on/kars/alarm-systems?&page=6&"", ""https://homestars.com/on/kars/alarm-systems?&page=7&"")",Alarm Systems,2884861,http://www.barnesprotection.ca,/companies/2884861-barnes-protection-services-inc?searched_category_id=303&service_area=2086692,"Barnes Protection Services has been serving the Ottawa community for over 30 years. Our vision is to provide great home and business alarm systems and other services such as video cameras and home automation that our customers can rely on. We also aim to deliver the best customer satisfaction to our clients. Call us today and we will try and determine the best solution for your security needs! 
",barnes-protection-services-inc,2016-03-03T09:35:50.000-05:00,NA,NA,NA,"- Alarm Systems (with ability to control remotely)
- Video Cameras
- Home Automation
- Access Control 
- Speakers and Audio
- Local Monitoring
- Medical Alarms
- 2 Way Voice
- Intercom
- Cellular Communicators","- Wiring
- Installation 
- Maintenance
- Sales","- DSC
- Hikvision
- Sentry CCTV
- Bosch
- Telguard
- Axis Communications
- Northern
- Tane Alarm
- Aiphone
- Clinton Electronics
- Interlogix
- Kantech
- Watchnet
- Uplink
- Trendnet
- OpenEye
- Panasonic
- Samsung",Specializing in alarm systems of all makes and models. Our local monitoring can't be beat and won't break the bank. We also specialize in home automation and remote control via smartphone or tablet. ,1985,3,"Cash, Cheque, PayPal, Visa, Mastercard, Amex and Direct Deposit","Electrical Engineering Technology, Alarm Technician",,"Established in 1977, the Canadian Security Association (CANASA) is a national not-for-profit organiz",TRUE,TRUE,,,FALSE,FALSE,,1947285,Barnes Protection Services Inc.,9,8,14,9.75,"Alarm Systems, Home Alarm Systems, Alarm System Monitoring, Fire Alarm Systems, Home Security Systems, The Alarm, At Home Security, Home Security, Security Systems, Alarm Security, Security Alarm, Security Cameras, Security Company, Security Companies, Home alarm, Alarm home, Alarm security, House security, house alarm, burglar alarm, carbon monoxide, carbon monoxide alarms, business cameras, commercial surveillance systems, surveillance, commercial security cameras, commercial security camera,,",0,NA,barnesprotection,FALSE,0,0,14,0,FALSE,7c0fc50d5aee36d18e17b6f009333c579abf2612,TRUE,2016-06-10T21:57:04.000-04:00,TRUE,TRUE,2086692,85.7371626904,303,NA,NA
