Link,n_hits,all_links,category,id,url,hs_path,profile,permalink,created_at,sic_code,service_area,hours,products,services,brands,specialities,established,employee_cnt,payment_method,diplomas,licenses,memberships,liability_insurance,bonded,project_rate,project_minimum,written_contract,written_warranty,warranty_terms,parent_company_id,name,total_number_of_reviews_cache,total_number_of_approved_reviews_cache,number_of_photos_cache,avg_rating_cache,categories_info_cache,savings_count,claimed_at,subdomain,fraudulent,fraudulent_count,total_number_of_pending_reviews_cache,images_count,completion_percent_cache,bully,secret,replied_to_at_least_one_review_cache,has_set_tasks,lead_purchase_eligible,service_area_id,star_score,quote_button_category,direct_phone,direct_contact,latest_approved_review_created_at
https://homestars.com/on/barrie/moving-storage,47,"c(""https://homestars.com/on/barrie/moving-storage?&page=2&"", ""https://homestars.com/on/barrie/moving-storage?&page=3&"", ""https://homestars.com/on/barrie/moving-storage?&page=4&"", ""https://homestars.com/on/barrie/moving-storage?&page=5&"")",Moving & Storage,2581816,NA,/companies/2581816-barrie-space-station-mini-storage?searched_category_id=407&service_area=1595020,NA,barrie-space-station-mini-storage,2008-03-04T16:55:15.000-05:00,NA,NA,NA,NA,NA,NA,NA,NA,NA,NA,NA,NA,NA,FALSE,FALSE,NA,NA,FALSE,FALSE,NA,1644868,Barrie Space Station Mini Storage,1,1,0,8,"Moving & Storage, Moving Company, Moving Services, Moving Truck, Moving Equipment, Self Storage, Storage Container, portable storage container, moving and, moving in, movers, mover, moving movers, moving on movers, moving mover, self storage, moving companies, company moving, moving company, storage boxes, storage units, storage unit, movers companies, company movers, movers company, moving truck, storage facilities, packers and movers, movers and packers, movers packers, personal storage, moving quotes, moving on quotes, storage containers, car shipping, moving home, storage space, moving house, cardboard boxes, storage solutions, storage container, container storage, moving trucks, moving boxes, boxes for moving, moving and storage in, storage moving, storage and moving, moving storage, moving and storage, storage & moving, a moving and storage, moving to storage, moving rental,  storage bins,  move storage, movers storage, moving storage units, movers with storage, moving pods, moving storage containers, canada moving, moveing, residential moving companies, moving companies, the moving company, canadian moving, mover companies, company movers, moving companies with storage, moving company service, household movers, moving companies in canada, cost of moving across canada, national moving companies, moving estimate, shipping containers moving, moving trailer companies, moving companies local, moving company movers, moving van companies, long distance moving quote, moving agency, residential moving service,  moving van company, household shipping companies, long distance moving and storage, residential mover, company move, moving companies us, storage containers for moving, moving expenses, cross canada movers,  canada movers, home movers, local moving company,  moves canada, best moving companies, western moving and storage, best moving companies canada, moving across canada shipping, moving cost, storage company, moving company rates, moving business, long haul moving companies, full service movers, moving companies from canada to usa, moving prices, containers storage, online movers, packing moving companies, self moving services, movers van, move pods,",0,NA,NA,FALSE,0,0,0,NA,FALSE,NA,FALSE,FALSE,FALSE,1595020,8.6763736264,407,NA,NA,2009-11-27T22:37:13.000-05:00
https://homestars.com/on/barrie/moving-storage,47,"c(""https://homestars.com/on/barrie/moving-storage?&page=2&"", ""https://homestars.com/on/barrie/moving-storage?&page=3&"", ""https://homestars.com/on/barrie/moving-storage?&page=4&"", ""https://homestars.com/on/barrie/moving-storage?&page=5&"")",Moving & Storage,2575705,NA,/companies/2575705-dunlop-at-miller-self-storage?searched_category_id=407&service_area=1588909,NA,dunlop-at-miller-self-storage,2008-03-04T16:55:15.000-05:00,NA,NA,NA,NA,NA,NA,NA,NA,NA,NA,NA,NA,NA,FALSE,FALSE,NA,NA,FALSE,FALSE,NA,1638757,Dunlop At Miller Self Storage,1,1,0,1,"Moving & Storage, Moving Company, Moving Services, Moving Truck, Moving Equipment, Self Storage, Storage Container, portable storage container, moving and, moving in, movers, mover, moving movers, moving on movers, moving mover, self storage, moving companies, company moving, moving company, storage boxes, storage units, storage unit, movers companies, company movers, movers company, moving truck, storage facilities, packers and movers, movers and packers, movers packers, personal storage, moving quotes, moving on quotes, storage containers, car shipping, moving home, storage space, moving house, cardboard boxes, storage solutions, storage container, container storage, moving trucks, moving boxes, boxes for moving, moving and storage in, storage moving, storage and moving, moving storage, moving and storage, storage & moving, a moving and storage, moving to storage, moving rental,  storage bins,  move storage, movers storage, moving storage units, movers with storage, moving pods, moving storage containers, canada moving, moveing, residential moving companies, moving companies, the moving company, canadian moving, mover companies, company movers, moving companies with storage, moving company service, household movers, moving companies in canada, cost of moving across canada, national moving companies, moving estimate, shipping containers moving, moving trailer companies, moving companies local, moving company movers, moving van companies, long distance moving quote, moving agency, residential moving service,  moving van company, household shipping companies, long distance moving and storage, residential mover, company move, moving companies us, storage containers for moving, moving expenses, cross canada movers,  canada movers, home movers, local moving company,  moves canada, best moving companies, western moving and storage, best moving companies canada, moving across canada shipping, moving cost, storage company, moving company rates, moving business, long haul moving companies, full service movers, moving companies from canada to usa, moving prices, containers storage, online movers, packing moving companies, self moving services, movers van, move pods,",0,NA,NA,FALSE,0,0,0,NA,FALSE,NA,FALSE,FALSE,FALSE,1588909,0.0,407,NA,NA,2010-06-03T18:04:27.000-04:00
https://homestars.com/on/barrie/moving-storage,47,"c(""https://homestars.com/on/barrie/moving-storage?&page=2&"", ""https://homestars.com/on/barrie/moving-storage?&page=3&"", ""https://homestars.com/on/barrie/moving-storage?&page=4&"", ""https://homestars.com/on/barrie/moving-storage?&page=5&"")",Moving & Storage,2594932,NA,/companies/2594932-barrie-southend-public-storage?searched_category_id=407&service_area=1608136,NA,barrie-southend-public-storage,2008-03-04T16:55:15.000-05:00,NA,NA,NA,NA,NA,NA,NA,NA,NA,NA,NA,NA,NA,FALSE,FALSE,NA,NA,FALSE,FALSE,NA,1657984,Barrie Southend Public Storage,1,1,0,0,"Moving & Storage, Moving Company, Moving Services, Moving Truck, Moving Equipment, Self Storage, Storage Container, portable storage container, moving and, moving in, movers, mover, moving movers, moving on movers, moving mover, self storage, moving companies, company moving, moving company, storage boxes, storage units, storage unit, movers companies, company movers, movers company, moving truck, storage facilities, packers and movers, movers and packers, movers packers, personal storage, moving quotes, moving on quotes, storage containers, car shipping, moving home, storage space, moving house, cardboard boxes, storage solutions, storage container, container storage, moving trucks, moving boxes, boxes for moving, moving and storage in, storage moving, storage and moving, moving storage, moving and storage, storage & moving, a moving and storage, moving to storage, moving rental,  storage bins,  move storage, movers storage, moving storage units, movers with storage, moving pods, moving storage containers, canada moving, moveing, residential moving companies, moving companies, the moving company, canadian moving, mover companies, company movers, moving companies with storage, moving company service, household movers, moving companies in canada, cost of moving across canada, national moving companies, moving estimate, shipping containers moving, moving trailer companies, moving companies local, moving company movers, moving van companies, long distance moving quote, moving agency, residential moving service,  moving van company, household shipping companies, long distance moving and storage, residential mover, company move, moving companies us, storage containers for moving, moving expenses, cross canada movers,  canada movers, home movers, local moving company,  moves canada, best moving companies, western moving and storage, best moving companies canada, moving across canada shipping, moving cost, storage company, moving company rates, moving business, long haul moving companies, full service movers, moving companies from canada to usa, moving prices, containers storage, online movers, packing moving companies, self moving services, movers van, move pods,",0,NA,NA,FALSE,0,0,0,NA,FALSE,NA,FALSE,FALSE,FALSE,1608136,0.0,407,NA,NA,2009-12-08T23:35:25.000-05:00
https://homestars.com/on/barrie/moving-storage,47,"c(""https://homestars.com/on/barrie/moving-storage?&page=2&"", ""https://homestars.com/on/barrie/moving-storage?&page=3&"", ""https://homestars.com/on/barrie/moving-storage?&page=4&"", ""https://homestars.com/on/barrie/moving-storage?&page=5&"")",Moving & Storage,2758303,NA,/companies/2758303-bayfield-storage-corp?searched_category_id=407&service_area=1771507,NA,bayfield-storage-corp,2008-03-04T16:55:15.000-05:00,NA,NA,NA,NA,NA,NA,NA,NA,NA,NA,NA,NA,NA,FALSE,FALSE,NA,NA,FALSE,FALSE,NA,1821355,Bayfield Storage Corp,0,0,0,NA,"Moving & Storage, Moving Company, Moving Services, Moving Truck, Moving Equipment, Self Storage, Storage Container, portable storage container, moving and, moving in, movers, mover, moving movers, moving on movers, moving mover, self storage, moving companies, company moving, moving company, storage boxes, storage units, storage unit, movers companies, company movers, movers company, moving truck, storage facilities, packers and movers, movers and packers, movers packers, personal storage, moving quotes, moving on quotes, storage containers, car shipping, moving home, storage space, moving house, cardboard boxes, storage solutions, storage container, container storage, moving trucks, moving boxes, boxes for moving, moving and storage in, storage moving, storage and moving, moving storage, moving and storage, storage & moving, a moving and storage, moving to storage, moving rental,  storage bins,  move storage, movers storage, moving storage units, movers with storage, moving pods, moving storage containers, canada moving, moveing, residential moving companies, moving companies, the moving company, canadian moving, mover companies, company movers, moving companies with storage, moving company service, household movers, moving companies in canada, cost of moving across canada, national moving companies, moving estimate, shipping containers moving, moving trailer companies, moving companies local, moving company movers, moving van companies, long distance moving quote, moving agency, residential moving service,  moving van company, household shipping companies, long distance moving and storage, residential mover, company move, moving companies us, storage containers for moving, moving expenses, cross canada movers,  canada movers, home movers, local moving company,  moves canada, best moving companies, western moving and storage, best moving companies canada, moving across canada shipping, moving cost, storage company, moving company rates, moving business, long haul moving companies, full service movers, moving companies from canada to usa, moving prices, containers storage, online movers, packing moving companies, self moving services, movers van, move pods,",0,NA,NA,FALSE,0,0,0,NA,FALSE,NA,FALSE,FALSE,FALSE,1771507,-1.0,407,NA,NA,NA
https://homestars.com/on/barrie/moving-storage,47,"c(""https://homestars.com/on/barrie/moving-storage?&page=2&"", ""https://homestars.com/on/barrie/moving-storage?&page=3&"", ""https://homestars.com/on/barrie/moving-storage?&page=4&"", ""https://homestars.com/on/barrie/moving-storage?&page=5&"")",Moving & Storage,2950906,NA,/companies/2950906-mcleans-moving?searched_category_id=407&service_area=2241706,NA,mcleans-moving,2020-12-14T17:24:09.000-05:00,NA,NA,NA,NA,NA,NA,NA,NA,NA,NA,NA,NA,NA,FALSE,FALSE,NA,NA,FALSE,FALSE,NA,2013002,Mcleans Moving,0,0,0,NA,"Moving & Storage, Moving Company, Moving Services, Moving Truck, Moving Equipment, Self Storage, Storage Container, portable storage container, moving and, moving in, movers, mover, moving movers, moving on movers, moving mover, self storage, moving companies, company moving, moving company, storage boxes, storage units, storage unit, movers companies, company movers, movers company, moving truck, storage facilities, packers and movers, movers and packers, movers packers, personal storage, moving quotes, moving on quotes, storage containers, car shipping, moving home, storage space, moving house, cardboard boxes, storage solutions, storage container, container storage, moving trucks, moving boxes, boxes for moving, moving and storage in, storage moving, storage and moving, moving storage, moving and storage, storage & moving, a moving and storage, moving to storage, moving rental,  storage bins,  move storage, movers storage, moving storage units, movers with storage, moving pods, moving storage containers, canada moving, moveing, residential moving companies, moving companies, the moving company, canadian moving, mover companies, company movers, moving companies with storage, moving company service, household movers, moving companies in canada, cost of moving across canada, national moving companies, moving estimate, shipping containers moving, moving trailer companies, moving companies local, moving company movers, moving van companies, long distance moving quote, moving agency, residential moving service,  moving van company, household shipping companies, long distance moving and storage, residential mover, company move, moving companies us, storage containers for moving, moving expenses, cross canada movers,  canada movers, home movers, local moving company,  moves canada, best moving companies, western moving and storage, best moving companies canada, moving across canada shipping, moving cost, storage company, moving company rates, moving business, long haul moving companies, full service movers, moving companies from canada to usa, moving prices, containers storage, online movers, packing moving companies, self moving services, movers van, move pods,",0,NA,NA,FALSE,0,0,0,0,FALSE,NA,FALSE,FALSE,FALSE,2241706,-1.0,407,NA,NA,NA
https://homestars.com/on/barrie/moving-storage,47,"c(""https://homestars.com/on/barrie/moving-storage?&page=2&"", ""https://homestars.com/on/barrie/moving-storage?&page=3&"", ""https://homestars.com/on/barrie/moving-storage?&page=4&"", ""https://homestars.com/on/barrie/moving-storage?&page=5&"")",Moving & Storage,2889990,NA,/companies/2889990-perfect-packers?searched_category_id=407&service_area=2103004,NA,perfect-packers,2016-08-30T10:31:56.000-04:00,NA,NA,NA,NA,NA,NA,NA,NA,NA,NA,NA,NA,NA,FALSE,FALSE,NA,NA,FALSE,FALSE,NA,1952414,Perfect Packers,0,0,0,NA,"Moving & Storage, Moving Company, Moving Services, Moving Truck, Moving Equipment, Self Storage, Storage Container, portable storage container, moving and, moving in, movers, mover, moving movers, moving on movers, moving mover, self storage, moving companies, company moving, moving company, storage boxes, storage units, storage unit, movers companies, company movers, movers company, moving truck, storage facilities, packers and movers, movers and packers, movers packers, personal storage, moving quotes, moving on quotes, storage containers, car shipping, moving home, storage space, moving house, cardboard boxes, storage solutions, storage container, container storage, moving trucks, moving boxes, boxes for moving, moving and storage in, storage moving, storage and moving, moving storage, moving and storage, storage & moving, a moving and storage, moving to storage, moving rental,  storage bins,  move storage, movers storage, moving storage units, movers with storage, moving pods, moving storage containers, canada moving, moveing, residential moving companies, moving companies, the moving company, canadian moving, mover companies, company movers, moving companies with storage, moving company service, household movers, moving companies in canada, cost of moving across canada, national moving companies, moving estimate, shipping containers moving, moving trailer companies, moving companies local, moving company movers, moving van companies, long distance moving quote, moving agency, residential moving service,  moving van company, household shipping companies, long distance moving and storage, residential mover, company move, moving companies us, storage containers for moving, moving expenses, cross canada movers,  canada movers, home movers, local moving company,  moves canada, best moving companies, western moving and storage, best moving companies canada, moving across canada shipping, moving cost, storage company, moving company rates, moving business, long haul moving companies, full service movers, moving companies from canada to usa, moving prices, containers storage, online movers, packing moving companies, self moving services, movers van, move pods,",0,NA,NA,FALSE,0,0,0,0,FALSE,NA,FALSE,FALSE,FALSE,2103004,-1.0,407,NA,NA,NA
https://homestars.com/on/barrie/moving-storage,47,"c(""https://homestars.com/on/barrie/moving-storage?&page=2&"", ""https://homestars.com/on/barrie/moving-storage?&page=3&"", ""https://homestars.com/on/barrie/moving-storage?&page=4&"", ""https://homestars.com/on/barrie/moving-storage?&page=5&"")",Moving & Storage,2573222,NA,/companies/2573222-alliance-self-storage?searched_category_id=407&service_area=1586426,NA,alliance-self-storage,2008-03-04T16:55:15.000-05:00,NA,NA,NA,NA,NA,NA,NA,NA,NA,NA,NA,NA,NA,FALSE,FALSE,NA,NA,FALSE,FALSE,NA,1636274,Alliance Self Storage,0,0,0,NA,"Moving & Storage, Moving Company, Moving Services, Moving Truck, Moving Equipment, Self Storage, Storage Container, portable storage container, moving and, moving in, movers, mover, moving movers, moving on movers, moving mover, self storage, moving companies, company moving, moving company, storage boxes, storage units, storage unit, movers companies, company movers, movers company, moving truck, storage facilities, packers and movers, movers and packers, movers packers, personal storage, moving quotes, moving on quotes, storage containers, car shipping, moving home, storage space, moving house, cardboard boxes, storage solutions, storage container, container storage, moving trucks, moving boxes, boxes for moving, moving and storage in, storage moving, storage and moving, moving storage, moving and storage, storage & moving, a moving and storage, moving to storage, moving rental,  storage bins,  move storage, movers storage, moving storage units, movers with storage, moving pods, moving storage containers, canada moving, moveing, residential moving companies, moving companies, the moving company, canadian moving, mover companies, company movers, moving companies with storage, moving company service, household movers, moving companies in canada, cost of moving across canada, national moving companies, moving estimate, shipping containers moving, moving trailer companies, moving companies local, moving company movers, moving van companies, long distance moving quote, moving agency, residential moving service,  moving van company, household shipping companies, long distance moving and storage, residential mover, company move, moving companies us, storage containers for moving, moving expenses, cross canada movers,  canada movers, home movers, local moving company,  moves canada, best moving companies, western moving and storage, best moving companies canada, moving across canada shipping, moving cost, storage company, moving company rates, moving business, long haul moving companies, full service movers, moving companies from canada to usa, moving prices, containers storage, online movers, packing moving companies, self moving services, movers van, move pods,",0,NA,NA,FALSE,0,0,0,NA,FALSE,NA,FALSE,FALSE,FALSE,1586426,-1.0,407,NA,NA,NA
https://homestars.com/on/barrie/moving-storage,47,"c(""https://homestars.com/on/barrie/moving-storage?&page=2&"", ""https://homestars.com/on/barrie/moving-storage?&page=3&"", ""https://homestars.com/on/barrie/moving-storage?&page=4&"", ""https://homestars.com/on/barrie/moving-storage?&page=5&"")",Moving & Storage,2638758,NA,/companies/2638758-allstar-moving-storage?searched_category_id=407&service_area=1651962,NA,allstar-moving-storage,2008-03-04T16:55:15.000-05:00,NA,NA,NA,NA,NA,NA,NA,NA,NA,NA,NA,NA,NA,FALSE,FALSE,NA,NA,FALSE,FALSE,NA,1701810,Allstar Moving & Storage,0,0,0,NA,"Moving & Storage, Moving Company, Moving Services, Moving Truck, Moving Equipment, Self Storage, Storage Container, portable storage container, moving and, moving in, movers, mover, moving movers, moving on movers, moving mover, self storage, moving companies, company moving, moving company, storage boxes, storage units, storage unit, movers companies, company movers, movers company, moving truck, storage facilities, packers and movers, movers and packers, movers packers, personal storage, moving quotes, moving on quotes, storage containers, car shipping, moving home, storage space, moving house, cardboard boxes, storage solutions, storage container, container storage, moving trucks, moving boxes, boxes for moving, moving and storage in, storage moving, storage and moving, moving storage, moving and storage, storage & moving, a moving and storage, moving to storage, moving rental,  storage bins,  move storage, movers storage, moving storage units, movers with storage, moving pods, moving storage containers, canada moving, moveing, residential moving companies, moving companies, the moving company, canadian moving, mover companies, company movers, moving companies with storage, moving company service, household movers, moving companies in canada, cost of moving across canada, national moving companies, moving estimate, shipping containers moving, moving trailer companies, moving companies local, moving company movers, moving van companies, long distance moving quote, moving agency, residential moving service,  moving van company, household shipping companies, long distance moving and storage, residential mover, company move, moving companies us, storage containers for moving, moving expenses, cross canada movers,  canada movers, home movers, local moving company,  moves canada, best moving companies, western moving and storage, best moving companies canada, moving across canada shipping, moving cost, storage company, moving company rates, moving business, long haul moving companies, full service movers, moving companies from canada to usa, moving prices, containers storage, online movers, packing moving companies, self moving services, movers van, move pods,",0,NA,NA,FALSE,0,0,0,NA,FALSE,NA,FALSE,FALSE,FALSE,1651962,-1.0,407,NA,NA,NA
