Link,n_hits,all_links,category,id,url,hs_path,profile,permalink,created_at,sic_code,service_area,hours,products,services,brands,specialities,established,employee_cnt,payment_method,diplomas,licenses,memberships,liability_insurance,bonded,project_rate,project_minimum,written_contract,written_warranty,warranty_terms,parent_company_id,name,total_number_of_reviews_cache,total_number_of_approved_reviews_cache,number_of_photos_cache,avg_rating_cache,categories_info_cache,savings_count,claimed_at,subdomain,fraudulent,fraudulent_count,total_number_of_pending_reviews_cache,images_count,completion_percent_cache,bully,secret,replied_to_at_least_one_review_cache,latest_approved_review_created_at,has_set_tasks,lead_purchase_eligible,service_area_id,star_score,quote_button_category,direct_phone,direct_contact
https://homestars.com/on/jordan/siding,9,https://homestars.com/on/jordan/siding,Siding,2800376,http://www.stoneselex.com,/companies/2800376-stone-selex?searched_category_id=432&service_area=2121119,"Siding, Stucco, Stone, Brick, Masonry and Fireplaces
From design to installation, Stone Selex Design is a premier company with over 20 years of experience providing both residential and commercial customers with quality installation and a high level of customer satisfaction. 

Stone Selex Design is committed to providing full service installation for your exterior or interior stone veneer project. We also provide installation of stone veneer, stucco, brick, masonry and fireplace transformations. 
Design your own project with the NEW Stone Veneer Visualizer and have Stone Selex Design install it for you. The Visualizer gives you the ability to envision your project from the comfort of your computer screen. It has the power to transform a photo of your home into a professional digital rendering by adding siding, stucco and stone. 
Make your home the talk of the neighbourhood with stone and <a href=""http://en.wikipedia.org/wiki/Stucco"">stucco</a>, or stone and brick, or siding and <a href=""http://www.en.wikipedia.org/wiki/Brick"">brick</a>, stone tile and wood siding. The possibilities of style and colour combinations are endless. A Stone Selex Design project manager will help you with each stage of your project from where to add stone, stucco, siding, brick and <a href=""http://en.wikipedia.org/wiki/Masonry"">masonry</a> and provide you with a quote for our installation services provided by our experienced masonry installers.  
If it’s a fireplace that you want to create or just simply add stone or masonry, Stone Selex Design and the visualizer can help you with this too. While you are in the planning stages of your <a href="" http://en.wikipedia.org/wiki/Fireplace"">fireplaces</a> transformation the visualizer is a great tool to use. Look through photos for ideas and see what others are doing and then come to Stone Selex Design and ask us to install it for you.


Visit us here:
https://twitter.com/StoneSelex
https://www.facebook.com/StoneSelexInc/",stone-selex,2012-07-27T11:47:40.000-04:00,NA,"St. Catharines, Niagara Falls, Welland, Burlington, Hamilton, Oakville, Milton, Mississauga, Port Credit, Georgetown, Brampton, Bramalea, Etobicoke, Toronto, Willowdale, North York, Scarborough, Woodbridge, Maple, King City, Concord, Richmond Hill, Markham, Unionville, Stratford, Oshawa, Whitby, Clarington, Acton, Erin, Kitchener, Waterloo, Cambridge, Guelph, Brantford, Brant, Brockville, Woodstock, Barrie, Carp, Innisfil, Midland including Tay and Penetanguishene, Orillia, Ramara, Leamington including Kingsville, Sudbury, Chatham, Kent, London, Kingston, South Frontenac, Peterborough including Smith-Ennismore-Lakefield, Belleville, Cornwall, North Bay, Sault Ste. Marie, Kawartha Lake, Muskoka, Norfolk, Timmins, Owen Sound ","Monday to Friday 8am - 6pm, Saturday 10am - 3pm","Manufactured Stone, Decorative stone, Natural Stone Veneer, Canyon Stone Veneer, Canyon Brick Veneer, Stone Fireplace, Natural Stone, Stone Panel,Stone Wall,Home Stone, Cladding Stone ","Stone Installation, Exterior and Interior Installation, Stone Fireplace Package Installation, Stone Sales, Design Consultation, Free Quotation, Sample Board Rentals ","Canyon Stone, Canyon Stone Canada Natural Stone Veneer, DIMPLEX Electric Fireplaces","lightweight manufactured stone veneer, natural stone veneer, brick veneer, thin cut stone panel, interior stone, exterior stone, wall stone panels",2007,15,"Visa, Master Card, Debit, Cheque",,T85-3953274,"BILD, Canadian Home Builder's Association",TRUE,FALSE,,No Minimum,TRUE,FALSE,3 years,1863428,Stone Selex Design,164,139,147,9.54676,"Tile & Stone Contractors, Natural Stone Tile, Stone Floor Tile, Ceramic Tile, Floor tile, Tile installers, Stone installers, stone counter top installers, tile counter top installers, stone backsplash intallers, granite installers, marble installers, limestone installers, linoleum installers, slate contractors, slate installers,install tite ,backsplash , fire place veenerneed someone to install blacksplash , wall stone veener bath room mosaic,Masonry & Bricklaying, Masonry Supply, Masonry Contractor, Stone Masonry, Brick Laying, Technique, Brick Laying Pattern, stone wall, brick wall, masonry repair, brick repairs, masonry, brick masonry, masonry bricklaying, masonry work, mason contractors, york masonry, masonry companies, brick masonry construction, brick contractors, masonry brick laying, masonry workers, bricklaying firms, parging, ,Siding, vinyl siding, wood siding, exterior siding, aluminum siding, cedar shakes, cedar shingles, composite wood siding, seamless steel siding, wood clapboard, stone siding, brick siding, exterior, side, sides, how to siding, the siding, the other side, stucco,  how to vinyl siding, about vinyl siding, what is vinyl siding, in vinyl siding, vinyl siding how to, vinyl siding, siding vinyl, how to install vinyl, cement fiber, fiber cement, siding house, house with siding, siding on a house, what is siding on a house, siding for house, siding a house, how to siding a house, siding on house, house siding, siding for a house, ,Stucco, Stuccos, stucco contractor, stucco surface, exterior stucco, popcorn, popcorn ceiling, popcorn ceilings, popcorn ceiling removal,,Fireplaces, Electric Fireplace, Fireplace Mantel, Fireplace Chimney, Gas Fireplace, Fireplace Screen, Outdoor Fireplace, Fireplace Accessory, Ventless Fireplace, Fieplace Mantle, fireplace, the fireplace, fire place, fireplace stoves, fireplace chimney, fireplace gas, gas fireplace, fireplace heaters, gas fireplaces, fireplaces gas, wood fireplace, wood for fireplace, fireplace electric, electric fireplace, wood stove fireplace, fireplace hearth, electric fireplaces, fireplaces electric, fireplace heater, insert for fireplace, insert fireplace, fireplace insert, gas fireplaces and stoves, wood fireplaces, insert fireplaces, inserts for fireplaces, fireplaces inserts, wood burning fireplace, gas fireplace stoves, fireplace door, gas stove fireplace, fire places, fireplace screen, outdoor fireplace, fireplace outdoor, gas log, wood burning fireplaces, fireplace mantels, mantels for fireplace, fireplace mantle, fireplace mantels, ethanol fireplace, caulking,Interlocking Stone, Interlocking Tile, Stone, tiles for, landscaping, paving, pavers, paver, stone step, wall stone, stone wall, landscape design, patios, interlock, retaining wall, stepping stones, interlocking, landscaping ideas, retaining walls, paving stones, paver stones, pavers stones, pavers and stones, stones pavers, stones and pavers, flagstone, concrete design, landscapers, natural stone, paving stone, stone paving, stone paving stone, walls stone, patio designs, stone and tiles, tiles and stone, stone flagstones, slate tiles, slate tile, stone veneer, pavers stone, stone and pavers, stone pavers, paver stone, stone paver, concrete driveway, stone brick, stone and brick, brick and stone, stone flooring, stone patio, stone for patio,,",0,2014-05-07T16:31:42.000-04:00,stoneselex,FALSE,3,0,207,100,FALSE,8b6ea0190938baafcad801bd126a80361dd521e3,TRUE,2021-09-17T15:58:57.000-04:00,TRUE,TRUE,2121119,91.3786382174,432,NA,NA
https://homestars.com/on/jordan/siding,9,https://homestars.com/on/jordan/siding,Siding,2911003,http://notjustcaulking.ca,/companies/2911003-not-just-caulking?searched_category_id=432&service_area=2152507,"At Not Just Caulking, we specialize in both residential and commercial caulking applications Including swing stage set up and operation but we don’t stop there. We offer the professional advice and support you need for almost any project you have Interior or exterior.  You can count on us to deliver a seamless, high quality job while ensuring your property is clean during and upon completion. ",not-just-caulking,2018-02-27T14:37:08.000-05:00,NA,NA,NA,,"Caulking, Swing Stage set up and operation, Framing, Drywall, Mud & Tape, Painting, Flooring, Plumbing, Tiling, Carpentry, Trim, Countertops, Cabinetry, Door & Cabinet refinishing, Staircase refinishing, Insulation, 

Fence building, Landscaping, Sod, Interlock, Concrete pads, Parging, Shed construction, Deck refinishing, Exterior home painting, Pressure Washing",,Residential/Commercial interior and exterior caulking.,2017,3,"Cash, Cheque, E-transfer",,Swing stage set up and operation,,TRUE,FALSE,,$300.00,TRUE,FALSE,Given on individual bases,1973188,Not Just Caulking,43,38,387,9.89474,"General Contractors, Residential General Contractor, Building Contractor, Additions, Remodeling Contractor,  Renovation, Builder, building construction, renovation, remodeling, construction builders, construction company, construction companies, home repair, construction jobs, home remodeling, general contractors, contractors general, contractor general, contractors construction, construction contractors, home improvement and remodeling, kitchen remodeling, construction contractor, builders contractors, home renovation, general contracting, building contractors, building companies, home renovations, builder contractor, building contractor, remodeling contractor, commercial construction, residential construction, house contractor, concrete contractors, home contractors, general construction, construction general, contractors remodeling, remodeling contractors, remodelers, remodel contractor, remodel contractors, general contract, commercial contractors, renovations contractors, home improvement contractor, licensed contractor, license general contractor, mud room, mudroom, caulking, ,Handyman Services, Handyman, Home Handyman, Handyman Business, Repairmen, Repairman, house doctor, how to be a handyman, what is a handyman, the handyman, a handyman, handy man, the handy man, handy handyman, home repair, in home repair, handymen, the handymen, improvements home, home remodeling, home improvement remodeling, remodeling home improvement, hand man, kitchen and remodeling, home improvement and repair, home repair and improvement, home improvement repair, remodeling and repair, home remodeling and repair, home repair and remodeling, home repair remodeling, home remodeling repair, home improvements remodeling, repair house, house repair, house remodeling, house improvements, property maintenance, home maintenance, home repairs, in home repairs, repairman, services handyman, the handyman service, service handyman, handyman service, handy services, house repairs, repairs house, repair homes, service contractors, mr fix it, mud room, mudroom, caulking,Drywall Contractors, Dry Wall Repair, Dry Wall Installation, dry wall contracting, gypsum repair, gypsum installation, gypsum contractors, gyprock installers, gyprock intallation, dry wall installers, sheetrock, wall board, drywall, drywaller, waller, wall repair, drywall, plaster, how to drywall, drywall, what is drywall, sheetrock, dry wall, plastering, wall repair, drywall repair, how to repair drywall, repair drywall,  ,Siding, vinyl siding, wood siding, exterior siding, aluminum siding, cedar shakes, cedar shingles, composite wood siding, seamless steel siding, wood clapboard, stone siding, brick siding, exterior, side, sides, how to siding, the siding, the other side, stucco,  how to vinyl siding, about vinyl siding, what is vinyl siding, in vinyl siding, vinyl siding how to, vinyl siding, siding vinyl, how to install vinyl, cement fiber, fiber cement, siding house, house with siding, siding on a house, what is siding on a house, siding for house, siding a house, how to siding a house, siding on house, house siding, siding for a house, ,",0,2018-02-27T14:37:40.000-05:00,,FALSE,0,0,356,0,FALSE,ca68bc862051e85c99c320d0ea3c487e15e0aeb4,TRUE,2019-04-28T06:56:46.000-04:00,TRUE,TRUE,2152507,95.9546200549,432,NA,NA
https://homestars.com/on/jordan/siding,9,https://homestars.com/on/jordan/siding,Siding,2974344,https://envirotechexteriors.ca/,/companies/2974344-envirotech-exteriors-inc?searched_category_id=432&service_area=2296119,"Siding, eavestrough and leaf guards contractors, 
Windows and doors. 
",envirotech-exteriors-inc,2022-10-14T16:42:02.000-04:00,NA,NA,NA,,,,,NA,NA,"Cheque, credit cards, e-transfer, 90 day no payments (OAC)",,Licensed and insured. ,,TRUE,FALSE,,,TRUE,FALSE,Lifetime warranty,2036242,Envirotech Exteriors Inc.,8,7,26,10,"Gutters & Eavestroughs, Eavestrough Cleaning, Eavestrough Installation, Eavestrough Maintenance, gutter cleaning, gutter installation, gutter maintenance, installing gutters, installing eavestroughs, Eavestrough Repair, ,Siding, vinyl siding, wood siding, exterior siding, aluminum siding, cedar shakes, cedar shingles, composite wood siding, seamless steel siding, wood clapboard, stone siding, brick siding, exterior, side, sides, how to siding, the siding, the other side, stucco,  how to vinyl siding, about vinyl siding, what is vinyl siding, in vinyl siding, vinyl siding how to, vinyl siding, siding vinyl, how to install vinyl, cement fiber, fiber cement, siding house, house with siding, siding on a house, what is siding on a house, siding for house, siding a house, how to siding a house, siding on house, house siding, siding for a house, ,",0,2022-10-14T16:42:56.000-04:00,envirotechexteriors,FALSE,0,0,27,0,FALSE,21a799e606eeed0700c557443609321c2d5da6a8,TRUE,NA,TRUE,TRUE,2296119,90.894775345,432,NA,NA
https://homestars.com/on/jordan/siding,9,https://homestars.com/on/jordan/siding,Siding,2940922,https://www.lincolncontractors.ca/,/companies/2940922-lincoln-contractors?searched_category_id=432&service_area=2219328,"Lincoln Contractors is a fully licensed and insured family-owned business in the Niagara Region & GTA, specializing in Custom Exteriors, Siding, Seamless Eavestroughs, Soffit & Fascia, Windows & Doors. We are proud to provide services that will alleviate stress, making your experience as comfortable as possible. Our services exceed the industry's expectations, using the latest practices we identify and address all issues, matched with a dedication to safety and quality workmanship. We can't wait to work with you!
 
We are located in the Niagara region and we strive to provide the highest quality of services for you and your household.

We also offer free estimates! Send us an email or give us a call! We can't wait to work with you.
 


",lincoln-contractors,2020-02-26T13:44:12.000-05:00,NA,NA,NA,"Custom Exteriors, Aluminum & Copper: Seamless Eavestrough Systems, Soffit, Fascia, Siding, Leafguard Systems & Gutter Protection, Window & Doors, and More;","We Service All Of The Niagara Region, and Surrounding Areas Bringing Exterior Services That Highly Exceeds The Industries Expectations With A Warm Family Feel.","Residential Building Products, Kaycan, Gentek, Alu-rex, T-rex, GAF, Certain Teed and more...","Custom Exteriors, Seamless Eavestrough, Leafguards, Siding and Windows
",2017,5,ALL Major Payment Methods Accepted.,"Alu Rex Certified, Gentek Premium Renovator","Working at Heights,Lift Ticket and all Safety Certifications",Lincoln Contractors Ltd.,TRUE,FALSE,Lincoln Contractors Ltd.,$ 450+hst,TRUE,FALSE,3 Yr Workmanship & 25 Yr Manufacturer Warranty,2003096,Lincoln Contractors,10,10,14,10,"Siding, vinyl siding, wood siding, exterior siding, aluminum siding, cedar shakes, cedar shingles, composite wood siding, seamless steel siding, wood clapboard, stone siding, brick siding, exterior, side, sides, how to siding, the siding, the other side, stucco,  how to vinyl siding, about vinyl siding, what is vinyl siding, in vinyl siding, vinyl siding how to, vinyl siding, siding vinyl, how to install vinyl, cement fiber, fiber cement, siding house, house with siding, siding on a house, what is siding on a house, siding for house, siding a house, how to siding a house, siding on house, house siding, siding for a house, ,",0,2020-02-26T13:45:46.000-05:00,NA,FALSE,0,0,18,0,FALSE,4029d06e6249ff06d341b2578e888a61d74faae4,TRUE,2020-06-07T12:25:27.000-04:00,TRUE,TRUE,2219328,89.7283850988,432,NA,NA
https://homestars.com/on/jordan/siding,9,https://homestars.com/on/jordan/siding,Siding,2916679,,/companies/2916679-golden-horse-shu-living-inc?searched_category_id=432&service_area=2188423,"While located in Mississauga, Ontario Golden Horse Shu Living Inc. offers our renovation services all over the GTA even covering the Niagara region. We are a family run business, strongly committed to providing a high quality of craftsmanship and customer service to each and every customer, no matter the size of the job. Over eighty percent of our business is from repeat and referral customers. This success stems, in part, from the reputation GHSL Inc. has built over the past 3 years in business.
 
While other companies may send their representatives to your home, the owners of Golden Horse Shu Living Inc. personally estimates each job and works side-by-side with you on every aspect of your project from start to finish. We are a start to finish company we will get your work done in a timely manner and minimize any down time that may occur during your project.
 
Golden Horse Shu Living Inc. licensed and for your protection we carry both liability and WSIB for all of our workers and employees. Our Company stand behind all work performed and backs all projects with a full 1 year warranty.
 
GHSL Inc. offers comprehensive remodeling services and is dedicated to ensuring complete satisfaction on each and every job. Whether you want to remodel the kitchen or redo the bathroom, our team of professional craftsmen can transform your wish list into the reality of a beautifully remodeled home.
 
",golden-horse-shu-living-inc,2018-05-17T10:46:00.000-04:00,NA,NA,NA,,,,,2015,7,"E-transfer, Certified cheque, Cash, Financing (contact for further details)",construction engineering/building renovations,,,TRUE,FALSE,,,FALSE,FALSE,1-Year on Workmanship,1978863,Golden Horse Shu Living Inc.,30,24,214,9.875,"General Contractors, Residential General Contractor, Building Contractor, Additions, Remodeling Contractor,  Renovation, Builder, building construction, renovation, remodeling, construction builders, construction company, construction companies, home repair, construction jobs, home remodeling, general contractors, contractors general, contractor general, contractors construction, construction contractors, home improvement and remodeling, kitchen remodeling, construction contractor, builders contractors, home renovation, general contracting, building contractors, building companies, home renovations, builder contractor, building contractor, remodeling contractor, commercial construction, residential construction, house contractor, concrete contractors, home contractors, general construction, construction general, contractors remodeling, remodeling contractors, remodelers, remodel contractor, remodel contractors, general contract, commercial contractors, renovations contractors, home improvement contractor, licensed contractor, license general contractor, mud room, mudroom, caulking, ,Siding, vinyl siding, wood siding, exterior siding, aluminum siding, cedar shakes, cedar shingles, composite wood siding, seamless steel siding, wood clapboard, stone siding, brick siding, exterior, side, sides, how to siding, the siding, the other side, stucco,  how to vinyl siding, about vinyl siding, what is vinyl siding, in vinyl siding, vinyl siding how to, vinyl siding, siding vinyl, how to install vinyl, cement fiber, fiber cement, siding house, house with siding, siding on a house, what is siding on a house, siding for house, siding a house, how to siding a house, siding on house, house siding, siding for a house, ,Tile & Stone Contractors, Natural Stone Tile, Stone Floor Tile, Ceramic Tile, Floor tile, Tile installers, Stone installers, stone counter top installers, tile counter top installers, stone backsplash intallers, granite installers, marble installers, limestone installers, linoleum installers, slate contractors, slate installers,install tite ,backsplash , fire place veenerneed someone to install blacksplash , wall stone veener bath room mosaic,",0,2018-05-17T10:46:39.000-04:00,NA,FALSE,0,0,71,0,FALSE,4ae3284a54d3edc824ffa253c9443566dc521252,TRUE,NA,TRUE,TRUE,2188423,97.7994252999,432,NA,NA
https://homestars.com/on/jordan/siding,9,https://homestars.com/on/jordan/siding,Siding,2785708,NA,/companies/2785708-carter-exteriors?searched_category_id=432&service_area=1842654,NA,carter-exteriors,2011-03-16T16:11:13.000-04:00,NA,NA,NA,NA,NA,NA,NA,NA,NA,NA,NA,NA,NA,FALSE,FALSE,NA,NA,FALSE,FALSE,NA,1848760,Carter Exteriors,0,0,0,NA,"Siding, vinyl siding, wood siding, exterior siding, aluminum siding, cedar shakes, cedar shingles, composite wood siding, seamless steel siding, wood clapboard, stone siding, brick siding, exterior, side, sides, how to siding, the siding, the other side, stucco,  how to vinyl siding, about vinyl siding, what is vinyl siding, in vinyl siding, vinyl siding how to, vinyl siding, siding vinyl, how to install vinyl, cement fiber, fiber cement, siding house, house with siding, siding on a house, what is siding on a house, siding for house, siding a house, how to siding a house, siding on house, house siding, siding for a house, ,",0,2011-03-16T16:11:14.000-04:00,NA,FALSE,0,0,0,NA,FALSE,85af669401f30cafcee6448951a36c33a2bfa768,FALSE,NA,FALSE,FALSE,1842654,0,432,NA,NA
https://homestars.com/on/jordan/siding,9,https://homestars.com/on/jordan/siding,Siding,2599839,NA,/companies/2599839-plugers-ken-siding?searched_category_id=432&service_area=1613043,NA,plugers-ken-siding,2008-03-04T16:55:15.000-05:00,NA,NA,NA,NA,NA,NA,NA,NA,NA,NA,NA,NA,NA,FALSE,FALSE,NA,NA,FALSE,FALSE,NA,1662891,Plugers Ken Siding,0,0,0,NA,"Siding, vinyl siding, wood siding, exterior siding, aluminum siding, cedar shakes, cedar shingles, composite wood siding, seamless steel siding, wood clapboard, stone siding, brick siding, exterior, side, sides, how to siding, the siding, the other side, stucco,  how to vinyl siding, about vinyl siding, what is vinyl siding, in vinyl siding, vinyl siding how to, vinyl siding, siding vinyl, how to install vinyl, cement fiber, fiber cement, siding house, house with siding, siding on a house, what is siding on a house, siding for house, siding a house, how to siding a house, siding on house, house siding, siding for a house, ,",0,NA,NA,FALSE,0,0,0,NA,FALSE,NA,FALSE,NA,FALSE,FALSE,1613043,0,432,NA,NA
https://homestars.com/on/jordan/siding,9,https://homestars.com/on/jordan/siding,Siding,2636455,NA,/companies/2636455-proper-renovations?searched_category_id=432&service_area=1649659,NA,proper-renovations,2008-03-04T16:55:15.000-05:00,NA,NA,NA,NA,NA,NA,NA,NA,NA,NA,NA,NA,NA,FALSE,FALSE,NA,NA,FALSE,FALSE,NA,1699507,Proper Renovations,0,0,0,NA,"Siding, vinyl siding, wood siding, exterior siding, aluminum siding, cedar shakes, cedar shingles, composite wood siding, seamless steel siding, wood clapboard, stone siding, brick siding, exterior, side, sides, how to siding, the siding, the other side, stucco,  how to vinyl siding, about vinyl siding, what is vinyl siding, in vinyl siding, vinyl siding how to, vinyl siding, siding vinyl, how to install vinyl, cement fiber, fiber cement, siding house, house with siding, siding on a house, what is siding on a house, siding for house, siding a house, how to siding a house, siding on house, house siding, siding for a house, ,",0,NA,NA,FALSE,0,0,0,NA,FALSE,NA,FALSE,NA,FALSE,FALSE,1649659,0,432,NA,NA
https://homestars.com/on/jordan/siding,9,https://homestars.com/on/jordan/siding,Siding,2591610,NA,/companies/2591610-rainscreen-systems?searched_category_id=432&service_area=1604814,NA,rainscreen-systems,2008-03-04T16:55:15.000-05:00,NA,NA,NA,NA,NA,NA,NA,NA,NA,NA,NA,NA,NA,FALSE,FALSE,NA,NA,FALSE,FALSE,NA,1654662,Rainscreen Systems,0,0,0,NA,"Siding, vinyl siding, wood siding, exterior siding, aluminum siding, cedar shakes, cedar shingles, composite wood siding, seamless steel siding, wood clapboard, stone siding, brick siding, exterior, side, sides, how to siding, the siding, the other side, stucco,  how to vinyl siding, about vinyl siding, what is vinyl siding, in vinyl siding, vinyl siding how to, vinyl siding, siding vinyl, how to install vinyl, cement fiber, fiber cement, siding house, house with siding, siding on a house, what is siding on a house, siding for house, siding a house, how to siding a house, siding on house, house siding, siding for a house, ,",0,NA,NA,FALSE,0,0,0,NA,FALSE,NA,FALSE,NA,FALSE,FALSE,1604814,0,432,NA,NA
