Link,n_hits,all_links,category,id,url,hs_path,profile,permalink,created_at,sic_code,service_area,hours,products,services,brands,specialities,established,employee_cnt,payment_method,diplomas,licenses,memberships,liability_insurance,bonded,project_rate,project_minimum,written_contract,written_warranty,warranty_terms,parent_company_id,name,total_number_of_reviews_cache,total_number_of_approved_reviews_cache,number_of_photos_cache,avg_rating_cache,categories_info_cache,savings_count,claimed_at,subdomain,fraudulent,fraudulent_count,total_number_of_pending_reviews_cache,images_count,completion_percent_cache,bully,secret,replied_to_at_least_one_review_cache,has_set_tasks,lead_purchase_eligible,service_area_id,star_score,quote_button_category,direct_phone,direct_contact
https://homestars.com/on/lake-of-bays/lawn-maintenance,1,https://homestars.com/on/lake-of-bays/lawn-maintenance,Lawn Maintenance,2949797,https://www.facebook.com/pg/freshhomeandcottage/services/?service_id=3763311377098088,/companies/2949797-fresh-luxury-home-cottage-care?searched_category_id=397&service_area=2239333,"Fresh is a luxury home and cottage care service located in Muskoka, Ontario.
We specialize in beautiful landscape designs and painting.

Cottage Rental Concierge
2 hours • Ask for price
-	Guest communications and support
-	Greet and receive guests
-	Prepare/Sanitize lodging pre/post stay
-	Respond to guest needs and inquiries
-	Assure timely departure
-	* create sub-website to manage bookings and create/manage rental community

We're social here:
www.facebook.com/freshhomeandcottage
https://www.instagram.com/freshmuskoka/?hl=en",fresh-luxury-home-cottage-care,2020-11-17T13:57:39.000-05:00,NA,NA,NA,,,,"Opening and Closing of Cottages
Cottage Concierge Services Available
",2017,NA,"Cash, Cheque and e-transfer",,,,TRUE,FALSE,,,TRUE,FALSE,Yes. Kindly ask for details. Depends on project completed. ,2011934,Fresh Luxury Home & Cottage Care,0,0,1,NA,"Lawn Maintenance, Lawn Care, Lawn Mowers, Lawn Maintenance Companies, grass cutters, grass cutting, shrub pruning, lawns, a lawns, landscaping, mowing, lawn mowers, mowing lawn, lawn mowing, mowing the lawns, mowing lawns, lawns mowing, yard and garden, maintenance lawn, lawns maintenance, lawncare, service lawn, lawn service, grass mowing, lawn treatment, green grass, lawn repair, grass lawn mowers, lawn & landscape, lawn landscape, a lawn and landscape, landscape and lawn, lawn and landscape, lawn services, yard landscape, lawn maintenance service, lawn service maintenance, landscaping a yard, yard landscaping, lawn maintenance services, maintenance company, grass cutting, maintenance business, lawn business, leaf clean up, fall leaves, hedges ,",0,2021-03-24T14:26:43.000-04:00,,FALSE,0,0,2,0,FALSE,8301f8f28c03738d2bfb11cc00949c3fc2160848,FALSE,TRUE,FALSE,2239333,-1.0,397,NA,NA
