Link,n_hits,all_links,category,id,url,hs_path,profile,permalink,created_at,sic_code,service_area,hours,products,services,brands,specialities,established,employee_cnt,payment_method,diplomas,licenses,memberships,liability_insurance,bonded,project_rate,project_minimum,written_contract,written_warranty,warranty_terms,parent_company_id,name,total_number_of_reviews_cache,total_number_of_approved_reviews_cache,number_of_photos_cache,avg_rating_cache,categories_info_cache,savings_count,claimed_at,subdomain,fraudulent,fraudulent_count,total_number_of_pending_reviews_cache,images_count,completion_percent_cache,bully,secret,replied_to_at_least_one_review_cache,latest_approved_review_created_at,has_set_tasks,lead_purchase_eligible,service_area_id,star_score,quote_button_category,direct_phone,direct_contact
https://homestars.com/on/newcastle/kitchen-planning-renovation,23,"c(""https://homestars.com/on/newcastle/kitchen-planning-renovation?&page=2&"", ""https://homestars.com/on/newcastle/kitchen-planning-renovation?&page=3&"")",Kitchen Planning & Renovation,199682,http://www.refaceyourkitchen.com,/companies/199682-canlik-kitchens?searched_category_id=393&service_area=2145909,"For 25 years, Canlik has been the premier Kitchen Refacing Specialist in Greater Toronto Area. It's kitchen upgrade solutions are custom to fit individual family needs, New Kitchens or Refacing Kitchens, they are more personal, flexible, affordable and environmental friendly. Since 1990, Canlik’s principal has been the same – delivering high quality products and services. No pushy sales. Consultants focus on providing honest and unbiased suggestions so that home owners can make the right decisions. Kitchen projects can be overwhelming and confusing – but it does not have to be if customers chose Canlik Kitchens. 
 
Details on our solutions: - 
 
(A) Kitchen Refacing,
Canlik’s very popular ""Premier Kitchen Refacing” aims at delivering custom kitchen looks with fraction of the cost. It uses the existing infrastructure and replaces exterior elements, like the cabinet doors, gable and fillers. It reduces wastage and helps avoid hidden costs. Kitchen Refacing solution has been providing great alternatives for those who want to achieve their renovation goals with less effort, less risk and have their budget under control.
 
(B) Custom New Kitchens 
“Canlik Custom Kitchens” allow home owners fully utilize limited spaces because cabinets are custom built to fit spaces. It can handle challenging space issues that ""Modular kitchens"" can hardly address. It also makes preserving the existing layouts and the foot prints possible, so that the flooring and other elements are not affected. Storage efficiency is achieved by detail oriented cabinet configurations design and adding effective accessories, if necessary.",canlik-kitchens,2005-12-28T19:00:00.000-05:00,NA,"Ajax, Brampton, Concord, Down Town Toronto, Etobicoke, Markham, Mississauga, Newmarket, North York, Oakville, Pickering Richmond Hill, Scarborough, Thornhill, Toronto,  Unionville, Vaughan, Woodbridge","Mon-Sat 9-5, ","Thermoplastic doors, Solid Wood Doors,Solid Surface Countertops, Engineer Stones, Quartz Surface Countertops, Tiles, Fixtures and Accessories",Kitchen Refacing | Custom New Kitchens | Solid Counter Top Replacement,,The Best Kitchen Refacing Specialist and High Rating Service Kitchen Company in Greater Toronto Area,1990,10,"Cheque, Visa, MasterCard",,"RenoMark, NKBA, BILD",,TRUE,FALSE,,,TRUE,FALSE,2 Years Labor Warranty & 5-10 years Manufacturer Warranty,55972,Canlik Kitchens,211,194,31,9.69201,"Kitchen & Bathroom - Cabinets & Design, Kitchen Cabinet And Counter, Kitchen Cabinet Hardware, Bathroom Cabinet, Bathroom Wall Cabinet, Bathroom Sink Cabinet, cabinets, kitchens, cabinetry, kitchen and cabinets, cabinets for kitchen, about kitchen cabinets, kitchen cabinets, kitchen cabinets in, cabinets for the kitchen, cabinets and kitchen, cabinets kitchen, kitchen cabinet, cabinet kitchen, the kitchen cabinet, kitchen by design, design kitchen, a kitchen design, design a kitchen, design for kitchen, design and kitchen, design by kitchen, kitchen design, cabinetry kitchen, kitchen cabinetry, designs kitchen, kitchen designs, bathroom vanities, vanity and bathroom, bath and vanity, designer kitchen, ,Kitchen Planning & Renovation, Kitchen Planning And Design, Kitchen Cabinet Planning, Kitchen Design, Kitchen Remodeling, kitchen or, and bathroom, a and a kitchens, kitchens and, for kitchens, a kitchens, kitchens, the house design, cabinets for kitchen, cabinets for the kitchen, cabinets and kitchen, kitchen cabinets, design a kitchen, about kitchen design, a kitchen design, how to kitchen design, design and kitchen, the kitchen design, design for kitchen, kitchen designs, renovation and remodeling, remodeling and renovation, kitchen designer,,Kitchen Renovation, caulking, ,",1,2005-12-28T19:00:00.000-05:00,Canlik,FALSE,0,0,54,100,FALSE,37d9f96333c69146418c999043ec16893059c245,TRUE,2021-10-13T12:49:20.000-04:00,TRUE,TRUE,2145909,97.0179041614,393,NA,NA
https://homestars.com/on/newcastle/kitchen-planning-renovation,23,"c(""https://homestars.com/on/newcastle/kitchen-planning-renovation?&page=2&"", ""https://homestars.com/on/newcastle/kitchen-planning-renovation?&page=3&"")",Kitchen Planning & Renovation,2782445,http://www.macleanskitchens.ca,/companies/2782445-macleans-custom-kitchens?searched_category_id=393&service_area=1835616,"MacLeans Custom Kitchens is family owned and operated.

All of Macleans Custom Kitchens reviews are authentic, unedited, and written directly by our customer.

We design quality Kitchens and handle complete renovations from floor to ceiling. 

In the early 1990's, brothers Terry and Dave MacLean, second generation cabinet builders, opened their showroom/workshop in Pickering, making the move to Bowmanville in 2004.

Macleans Custom Kitchens offers one stop shopping with 6 different kitchen displays in our showroom and a huge selection of colours and door styles for your kitchen or vanity. We have a large selection of ceramic tile, granite, quartz and laminate samples.

As part of our free estimate service, from measurements taken at your home, we offer computer assisted designs. We can produce a floor plan and 3D images that can be viewed in our showroom. Written estimates are free to take home.

Whether we custom build, or order your cabinets from one of carefully selected, Canadian suppliers, we guarantee only the finest quality products and workmanship and generous warranties. Rip-out, disposal and installation and all necessary, plumbing, electrical and appliance hook-ups are all included in our pricing - there are no surprises.

Each project is done by or closely overseen by the owners personally. From start to finish, your renovation is our top priority, and we will work within your busy schedule to complete the job in a timely fashion. 


Our business has been built on word-of-mouth referrals and repeat customers, based on our solid practical knowledge, honesty, experience and courteous service. We look forward to being able to add you to our list of satisfied customers!

Our services include:
Full Service Kitchen Renoations
*Custom Cabinets
*Made to Order Cabinets and Vanities- cash and carry for your installation
*Ceramic Tile


*Granite / Quartz Countertops

",macleans-custom-kitchens,2010-11-13T21:13:47.000-05:00,NA,"GTA, Oshawa, Courtice, Whitby, Ajax, Pickering, Bowmanville, Clarington, Brooklin,Orono and beyond","Mon-Thrs 10 - 5,  Fri 10 - 4, Sat 11 - 2, or call for appointment before or","Cabinets, Tile, Countertops, Plumbing Fixtures, Glass Showers, etc...",Complete top to bottom renovations,"Made to Order Cabinets from Canadian Companies: Decor, Kitchencraft, Embassy, Omega . Centura floor & wall tile. Plumbing Fixtures: American Standard, Toto, Moen, Delta, Kohler.",On time installation,NA,NA,Cheque and e-transfer,,,BBB Member,TRUE,FALSE,,,TRUE,FALSE,Yes. Kindly ask for details. Depends on project completed. ,1845497,Mac Leans Custom Kitchens,121,117,65,9.97436,"Kitchen Planning & Renovation, Kitchen Planning And Design, Kitchen Cabinet Planning, Kitchen Design, Kitchen Remodeling, kitchen or, and bathroom, a and a kitchens, kitchens and, for kitchens, a kitchens, kitchens, the house design, cabinets for kitchen, cabinets for the kitchen, cabinets and kitchen, kitchen cabinets, design a kitchen, about kitchen design, a kitchen design, how to kitchen design, design and kitchen, the kitchen design, design for kitchen, kitchen designs, renovation and remodeling, remodeling and renovation, kitchen designer,,Kitchen Renovation, caulking, ,",0,2010-11-13T21:13:48.000-05:00,macleanskitchens,FALSE,0,0,23,100,FALSE,6bcd64e5e9dad89a5f07e352e3672690735caa9c,TRUE,2022-10-20T13:46:40.000-04:00,TRUE,TRUE,1835616,97.2675494926,393,NA,NA
https://homestars.com/on/newcastle/kitchen-planning-renovation,23,"c(""https://homestars.com/on/newcastle/kitchen-planning-renovation?&page=2&"", ""https://homestars.com/on/newcastle/kitchen-planning-renovation?&page=3&"")",Kitchen Planning & Renovation,2782771,http://www.kitchenandbathguys.com,/companies/2782771-kitchen-and-bath-guys?searched_category_id=393&service_area=1836454,"Bathroom Renovation, Kitchen Renovation, Basement Renovation

Our process begins in the comfort of your home with a complimentary consultation. A qualified renovator will take you through our virtual gallery showing off hundreds of inspirational ideas featuring real kitchen & bathroom renovations we have completed, or are capable of offering. Have something else in mind? Splendid! We are sleuths at sourcing hard-to-find products. Together, we’ll discover functional solutions and fashionable options that suit your tastes. Once this process is complete, we’ll present you with a quote and a comprehensive plan encompassing the layout, products and details of your renovation.

As soon as you give us the green light to begin your project, we will prepare a detailed contract and a comfortable payment schedule.Then you can sit back and leave the rest to us! One of our Project Managers will coordinate with our team of skilled drywallers, carpenters, plumbers and electricians so that your dream kitchen or bathroom renovation runs smoothly. In our experience, dealing with one person is much easier for you and ensures the job is done right – the first time!

During the renovation process, rest assured we will treat your home as if it was our own. From drop sheets to vent filters, we’ll create a “bubble” around the project area to keep the space clean with minimal disruption to your household. Upon completion of the project, a cleaning crew will ensure your new kitchen or bathroom is pristine – ready to enjoy immediately – and for years to come.

For added peace of mind, we are proud to guarantee all our Toronto kitchen and bathroom renovation work for 5 years. That’s our commitment and it’s what makes the Kitchen & Bath Guys the definitive choice for discriminating homeowners… like you!
",kitchen-and-bath-guys,2010-12-02T13:34:48.000-05:00,NA,"North York, East York, Scarborough, Durham, Pickering, Ajax, Whitby, Oshawa",,,"Bathroom Renovation, Kitchen Renovation, Basement Renovation",,"Tub to shower conversions, Modern design,
Structural Work , Basements, Laundry rooms, flooring, tile work, solid surface countertops, backsplash, lighting",19,NA,"cheque, Visa, Mastercard, American Express",,Fully licensed as a General Contractor in Toronto,,TRUE,FALSE,,,TRUE,FALSE,,1845823,Kitchen And Bath Guys,114,110,24,9.97273,"General Contractors, Residential General Contractor, Building Contractor, Additions, Remodeling Contractor,  Renovation, Builder, building construction, renovation, remodeling, construction builders, construction company, construction companies, home repair, construction jobs, home remodeling, general contractors, contractors general, contractor general, contractors construction, construction contractors, home improvement and remodeling, kitchen remodeling, construction contractor, builders contractors, home renovation, general contracting, building contractors, building companies, home renovations, builder contractor, building contractor, remodeling contractor, commercial construction, residential construction, house contractor, concrete contractors, home contractors, general construction, construction general, contractors remodeling, remodeling contractors, remodelers, remodel contractor, remodel contractors, general contract, commercial contractors, renovations contractors, home improvement contractor, licensed contractor, license general contractor, mud room, mudroom, caulking, ,Kitchen Planning & Renovation, Kitchen Planning And Design, Kitchen Cabinet Planning, Kitchen Design, Kitchen Remodeling, kitchen or, and bathroom, a and a kitchens, kitchens and, for kitchens, a kitchens, kitchens, the house design, cabinets for kitchen, cabinets for the kitchen, cabinets and kitchen, kitchen cabinets, design a kitchen, about kitchen design, a kitchen design, how to kitchen design, design and kitchen, the kitchen design, design for kitchen, kitchen designs, renovation and remodeling, remodeling and renovation, kitchen designer,,Kitchen Renovation, caulking, ,Bathroom Renovation, Bathroom renovation, bathroom remodeling, bathroom remodelling, renovating the bathroom, tearing out the bathroom, fixing up the bathroom, bathroom contractors, bathroom vanities, bathroom vanity, design of bathroom, bathroom and design, design for bathroom, design a bathroom, design a bath, bath design, bathroom tile, bathroom cabinets, remodeling a bathroom, bathroom remodeling, remodeling the bathroom, ,Bath renovation, New tub, caulking, ,Basement Renovation, Basement renovation, Basement remodeling, Basement remodelling, renovating your basement, renovation, waterproofing, remodeling, home renovation, house renovation, water in basement, basement waterproofing,finishing basement, moistureproof, remodeling the house, caulking,",0,2010-12-02T13:34:50.000-05:00,kitchenandbathguys,FALSE,0,0,12,NA,FALSE,5f725fd4d887dc86bce435f6a451ac3daade96d9,TRUE,2022-11-11T10:18:40.000-05:00,TRUE,TRUE,1836454,95.9371214277,393,NA,NA
https://homestars.com/on/newcastle/kitchen-planning-renovation,23,"c(""https://homestars.com/on/newcastle/kitchen-planning-renovation?&page=2&"", ""https://homestars.com/on/newcastle/kitchen-planning-renovation?&page=3&"")",Kitchen Planning & Renovation,2962158,https://newageproducts.com/,/companies/2962158-newage-products?searched_category_id=393&service_area=2268491,"Plan. Design. Install.

We offer a wide assortment of premium products and services within your Garage, Home, and Outdoor Living Spaces. Get your home reno project off the ground quicker, with a FREE CONSULTATION from one of our award-winning design experts.

NewAge Products is a Home Improvement Industry Disruptor and thought-leader. Founded in 2008, we’ve designed and manufactured hundreds of innovative, modular systems for customers throughout North America while maintaining retail partnerships with Costco, Home Depot, Amazon, and Lowes.",newage-products,2021-12-01T13:37:36.000-05:00,NA,NA,NA,"Garage Cabinets, Shelving and Racking, Outdoor Kitchen, Outdoor Appliances, Outdoor Furniture, Flooring","Free Virtual Design Consultation, Installation, Measurement Services",,"Garage Organization and Design, Outdoor Organization and Design",2008,400,Credit Card,,,,TRUE,FALSE,,,FALSE,FALSE,,2024117,NewAge Products,122,99,151,9.74747,"Garage Design & Organization, shed design, shed organization, garage renovation, garage, car garage, storage systems, starage sheds, storage cabinets, cabinets & storage, storage cabinet, storage system, shop door, storage solutions, garage floor, shed plans, garage and storage, storage for garage, garage storage, storage in garage, garage plans, storage for the home, garage kits, cabinets garage, cabinets for the garage, garage cabinets, metal cabinets, metal cabinet, new garage, new barn, ,Cabinetry & Millwork, Kitchen Cabinetry, Custom Cabinetry, Bathroom Cabinetry, Architectural Millwork, Millwork, custom millwork, bathroom cabinets, Kitchen cabinets, built-in cabinets, built-in cabinetry,  cabinet makers, custom cabinets kitchen, cabinetry, thomasville kitchen cabinets, cabinet doors, millwork cabinetry, custom kitchen cabinets, kraftmaid cabinets, maple cabinets, wood cabinets, stock cabinets, thermofoil cabinets, laminate cabinets, kitchen cabinets design, cherry cabinets, kitchen cabinet designs, hickory cabinets, wholesale cabinets, custom made cabinets, cabinet millwork, cabinets kitchen, kitchen cabinetry, millwork cabinets, ready to assemble cabinets, quality cabinets, bamboo cabinets, caulking,
,Kitchen Planning & Renovation, Kitchen Planning And Design, Kitchen Cabinet Planning, Kitchen Design, Kitchen Remodeling, kitchen or, and bathroom, a and a kitchens, kitchens and, for kitchens, a kitchens, kitchens, the house design, cabinets for kitchen, cabinets for the kitchen, cabinets and kitchen, kitchen cabinets, design a kitchen, about kitchen design, a kitchen design, how to kitchen design, design and kitchen, the kitchen design, design for kitchen, kitchen designs, renovation and remodeling, remodeling and renovation, kitchen designer,,Kitchen Renovation, caulking, ,Floor Retailers, Flooring, Hardwood Floors, Wood Floors, Floor & Tile Stores, laminate, and tile, carpet and, flooring flooring, the flooring, a flooring, floors floors floors, the floors, floors on floors, a floors, floor flooring, flooring floor, flooring and tiles, floor and wood, wood flooring, wood and flooring, wood floors, hardwood flooring, hardwood floors, flooring and tile, tile and flooring, tile flooring, tiles floors, floors and tiles, tile and floor, floor and tile, linoleum, laminate flooring, flooring and laminate, laminate flooring, laminate floor, wooden floors, wooden flooring, laminate floors, laminated flooring, vinyl flooring, tiles and floors, tile floors, carpet and tile, floor covering, carpets and tiles, slate, ceramic, concrete, herringbone,",0,2021-12-01T13:38:43.000-05:00,,FALSE,0,0,175,0,FALSE,2ac1c8a94cf80b4d46cd022ce7a0676b2d5832b2,TRUE,2022-07-25T10:26:43.000-04:00,TRUE,TRUE,2268491,96.0518403947,393,NA,NA
https://homestars.com/on/newcastle/kitchen-planning-renovation,23,"c(""https://homestars.com/on/newcastle/kitchen-planning-renovation?&page=2&"", ""https://homestars.com/on/newcastle/kitchen-planning-renovation?&page=3&"")",Kitchen Planning & Renovation,2918432,https://vailandco.ca,/companies/2918432-vail-co-construction-and-fine-renovations?searched_category_id=393&service_area=2168398,"Specializing but not limited to kitchens, bathrooms and basements as well as interior and exterior residential painting. Our friendly and highly skilled team of contractors make transforming all your living spaces easy and affordable. Contact us today for all your home renovation needs. ",vail-co-construction-and-fine-renovations,2018-06-22T10:33:52.000-04:00,NA,NA,NA,,"Specializing but not limited to Kitchen, bathroom and basement renovations. Your number one stop for all home renovation needs. Our skilled team also specializes in interior and exterior residential painting.",,"Kitchens, Bathrooms and Basement Renovations. Also specializing, but not limited to decks, fences, flooring, interior and exterior residential painting.",2017,NA,,,,,FALSE,FALSE,,,FALSE,FALSE,,1980616,Vail & Co Construction And Fine Renovations,70,66,312,9.98485,"General Contractors, Residential General Contractor, Building Contractor, Additions, Remodeling Contractor,  Renovation, Builder, building construction, renovation, remodeling, construction builders, construction company, construction companies, home repair, construction jobs, home remodeling, general contractors, contractors general, contractor general, contractors construction, construction contractors, home improvement and remodeling, kitchen remodeling, construction contractor, builders contractors, home renovation, general contracting, building contractors, building companies, home renovations, builder contractor, building contractor, remodeling contractor, commercial construction, residential construction, house contractor, concrete contractors, home contractors, general construction, construction general, contractors remodeling, remodeling contractors, remodelers, remodel contractor, remodel contractors, general contract, commercial contractors, renovations contractors, home improvement contractor, licensed contractor, license general contractor, mud room, mudroom, caulking, ,Bathroom Renovation, Bathroom renovation, bathroom remodeling, bathroom remodelling, renovating the bathroom, tearing out the bathroom, fixing up the bathroom, bathroom contractors, bathroom vanities, bathroom vanity, design of bathroom, bathroom and design, design for bathroom, design a bathroom, design a bath, bath design, bathroom tile, bathroom cabinets, remodeling a bathroom, bathroom remodeling, remodeling the bathroom, ,Bath renovation, New tub, caulking, ,Kitchen Planning & Renovation, Kitchen Planning And Design, Kitchen Cabinet Planning, Kitchen Design, Kitchen Remodeling, kitchen or, and bathroom, a and a kitchens, kitchens and, for kitchens, a kitchens, kitchens, the house design, cabinets for kitchen, cabinets for the kitchen, cabinets and kitchen, kitchen cabinets, design a kitchen, about kitchen design, a kitchen design, how to kitchen design, design and kitchen, the kitchen design, design for kitchen, kitchen designs, renovation and remodeling, remodeling and renovation, kitchen designer,,Kitchen Renovation, caulking, ,Basement Renovation, Basement renovation, Basement remodeling, Basement remodelling, renovating your basement, renovation, waterproofing, remodeling, home renovation, house renovation, water in basement, basement waterproofing,finishing basement, moistureproof, remodeling the house, caulking,",0,2018-06-22T10:34:23.000-04:00,,FALSE,0,0,149,0,FALSE,d57d014a525694a5d5397646807ec889e46b8fbd,TRUE,2021-01-10T16:05:56.000-05:00,TRUE,TRUE,2168398,98.6798584424,393,NA,NA
https://homestars.com/on/newcastle/kitchen-planning-renovation,23,"c(""https://homestars.com/on/newcastle/kitchen-planning-renovation?&page=2&"", ""https://homestars.com/on/newcastle/kitchen-planning-renovation?&page=3&"")",Kitchen Planning & Renovation,2885225,http://www.countertoppro.ca,/companies/2885225-gta-countertop-pro?searched_category_id=393&service_area=2144056,"GTA Countertops has more than 10 years of combined experience in the fabrication and installation of stone products. We purchase a carefully selected variety of granite, marble and quartz in large quantities and stock it locally. This system allows us to offer the luxury of real, natural granite or quartz counter tops at very affordable prices.
 
We pride ourselves in helping you achieve a more beautiful, money saving and practical approach to improving your dream home, we do not outsource any part of your project to another company, from start to finish, it is completed by our company!",gta-countertop-pro,2016-03-10T12:07:29.000-05:00,NA,NA,NA,Quartz Caesarstone Granite HanStone Quartz Marble Travertine Limestone Slate,,"Silestone
LG Viatera
Caesarstone 
Hanstone
Corian
Olympia Tile & Stone
Terra Stone
Inter stone
Radianz
Kstone
Tce
Lucent Quartz
SIO4
Quartex
Brick Stone
Vico Stone
",,2005,NA,"Cheque, Cash and e-transfer",,,,TRUE,TRUE,,,TRUE,FALSE,1 Year on Workmanship ,1947649,GTA Countertop Pro,96,85,384,9.69412,"Countertops, Granite Counter Tops, Kitchen Counter Tops, Marble Counter Tops, Laminate Counter Top, Quartz Counter Top, Corian counter top, tile counter top, silestone counter tops, arborite counter tops, custom counter tops, kitchen, remodeling, kitchen cabinet, kitchen design, ,Kitchen Planning & Renovation, Kitchen Planning And Design, Kitchen Cabinet Planning, Kitchen Design, Kitchen Remodeling, kitchen or, and bathroom, a and a kitchens, kitchens and, for kitchens, a kitchens, kitchens, the house design, cabinets for kitchen, cabinets for the kitchen, cabinets and kitchen, kitchen cabinets, design a kitchen, about kitchen design, a kitchen design, how to kitchen design, design and kitchen, the kitchen design, design for kitchen, kitchen designs, renovation and remodeling, remodeling and renovation, kitchen designer,,Kitchen Renovation, caulking, ,",0,NA,Gtacountertops,FALSE,0,0,801,0,FALSE,de1915d009e8ef2574b0aa44b033cc720b354e35,TRUE,2020-11-01T17:38:20.000-05:00,TRUE,TRUE,2144056,95.5021966459,393,NA,NA
