Link,n_hits,all_links,category,id,url,hs_path,profile,permalink,created_at,sic_code,service_area,hours,products,services,brands,specialities,established,employee_cnt,payment_method,diplomas,licenses,memberships,liability_insurance,bonded,project_rate,project_minimum,written_contract,written_warranty,warranty_terms,parent_company_id,name,total_number_of_reviews_cache,total_number_of_approved_reviews_cache,number_of_photos_cache,avg_rating_cache,categories_info_cache,savings_count,claimed_at,subdomain,fraudulent,fraudulent_count,total_number_of_pending_reviews_cache,images_count,completion_percent_cache,bully,secret,replied_to_at_least_one_review_cache,latest_approved_review_created_at,has_set_tasks,lead_purchase_eligible,service_area_id,star_score,quote_button_category,direct_phone,direct_contact
https://homestars.com/on/bramalea/tile-stone-contractors,94,"c(""https://homestars.com/on/bramalea/tile-stone-contractors?&page=2&"", ""https://homestars.com/on/bramalea/tile-stone-contractors?&page=3&"", ""https://homestars.com/on/bramalea/tile-stone-contractors?&page=4&"", ""https://homestars.com/on/bramalea/tile-stone-contractors?&page=5&"", ""https://homestars.com/on/bramalea/tile-stone-contractors?&page=6&"", ""https://homestars.com/on/bramalea/tile-stone-contractors?&page=7&"", ""https://homestars.com/on/bramalea/tile-stone-contractors?&page=8&"", ""https://homestars.com/on/bramalea/tile-stone-contractors?&page=9&"", 
""https://homestars.com/on/bramalea/tile-stone-contractors?&page=10&"")",Tile & Stone Contractors,2951952,https://ajcontracting.co/,/companies/2951952-aj-contracting?searched_category_id=442&service_area=2269752,"At AJ Contracting we take pride in our work and strive meet your expectations at the least, and exceed them proudly. We provide all kinds of home renovations services, such as Bathroom remodels, professional tile installation etc.",aj-contracting,2021-01-15T18:07:01.000-05:00,NA,NA,NA,,"Home renovations, Kitchen and Bathroom renovations, Tile installation, Trim Installation, Painting and much more",,,NA,NA,"Cash, Credit Card, E-transfer",Renovation Technician from Humber College,Licensed Plumbers and Electricians ,,TRUE,FALSE,,,FALSE,FALSE,,2014048,AJ Contracting,14,13,27,10,"Tile & Stone Contractors, Natural Stone Tile, Stone Floor Tile, Ceramic Tile, Floor tile, Tile installers, Stone installers, stone counter top installers, tile counter top installers, stone backsplash intallers, granite installers, marble installers, limestone installers, linoleum installers, slate contractors, slate installers,install tite ,backsplash , fire place veenerneed someone to install blacksplash , wall stone veener bath room mosaic,",0,2021-01-15T18:07:17.000-05:00,,FALSE,0,0,31,0,FALSE,172f586fb8431d0e7e83dc392f6ebe8826bac828,TRUE,NA,TRUE,TRUE,2269752,98.9939524956,442,NA,NA
https://homestars.com/on/bramalea/tile-stone-contractors,94,"c(""https://homestars.com/on/bramalea/tile-stone-contractors?&page=2&"", ""https://homestars.com/on/bramalea/tile-stone-contractors?&page=3&"", ""https://homestars.com/on/bramalea/tile-stone-contractors?&page=4&"", ""https://homestars.com/on/bramalea/tile-stone-contractors?&page=5&"", ""https://homestars.com/on/bramalea/tile-stone-contractors?&page=6&"", ""https://homestars.com/on/bramalea/tile-stone-contractors?&page=7&"", ""https://homestars.com/on/bramalea/tile-stone-contractors?&page=8&"", ""https://homestars.com/on/bramalea/tile-stone-contractors?&page=9&"", 
""https://homestars.com/on/bramalea/tile-stone-contractors?&page=10&"")",Tile & Stone Contractors,2972817,https://www.creativetouchtiles.com/,/companies/2972817-creative-touch-tiles?searched_category_id=442&service_area=2291123,"Who We Are
Creative Touch Tiles is your first choice for industry professionals with over 25 years of experience! 

Passionate about what we do, our team is dedicated to not only satisfy but exceed our clients expectations. We offer our services in Toronto, GTA, Simcoe, Clearview and all surrounding areas. 

Call us about your project today! ",creative-touch-tiles,2022-09-09T09:30:34.000-04:00,NA,NA,NA,,"Floor Tiling
Stand Up Showers & Tubs.
Backsplash and Tiles.",,"We specialize in floor tiling and backsplash, as well as custom stand-up showers and tubs!",NA,NA,,,,,FALSE,FALSE,,,FALSE,FALSE,,2034728,Creative Touch Tiles,4,4,1,10,"Tile & Stone Contractors, Natural Stone Tile, Stone Floor Tile, Ceramic Tile, Floor tile, Tile installers, Stone installers, stone counter top installers, tile counter top installers, stone backsplash intallers, granite installers, marble installers, limestone installers, linoleum installers, slate contractors, slate installers,install tite ,backsplash , fire place veenerneed someone to install blacksplash , wall stone veener bath room mosaic,",0,2022-09-09T09:32:48.000-04:00,CreativeTouchTiles,FALSE,0,0,2,0,FALSE,feb223a4605aa444ed7ecded407d6228d26131c6,TRUE,NA,TRUE,TRUE,2291123,90.0500392473,442,NA,NA
https://homestars.com/on/bramalea/tile-stone-contractors,94,"c(""https://homestars.com/on/bramalea/tile-stone-contractors?&page=2&"", ""https://homestars.com/on/bramalea/tile-stone-contractors?&page=3&"", ""https://homestars.com/on/bramalea/tile-stone-contractors?&page=4&"", ""https://homestars.com/on/bramalea/tile-stone-contractors?&page=5&"", ""https://homestars.com/on/bramalea/tile-stone-contractors?&page=6&"", ""https://homestars.com/on/bramalea/tile-stone-contractors?&page=7&"", ""https://homestars.com/on/bramalea/tile-stone-contractors?&page=8&"", ""https://homestars.com/on/bramalea/tile-stone-contractors?&page=9&"", 
""https://homestars.com/on/bramalea/tile-stone-contractors?&page=10&"")",Tile & Stone Contractors,2966506,,/companies/2966506-alza-contracting?searched_category_id=442&service_area=2280279,"ALZA CONTRACTING  has been in the Construction industry for more than 20 years mainly focusing on:
General Contracting
Interior Renovation and Restoration
Floor Tiling , Bathroom Tiling 
Exterior Renovation and Restoration
Stonework, Concrete Pathways, Interlocking (Sodding)
Interior and Exterior Demolition

In addition, our staff also takes care of general renovations such as:
-Drywall Installation and Repair
-Vinyl and Laminate Flooring
-Painting
-Basement Framing etc

Give us a call - (647) 202-3094",alza-contracting,2022-03-28T16:13:29.000-04:00,NA,NA,NA,,,,,2007,NA,Cash | Cheques | E-Transfer,,Fully Licensed,,TRUE,FALSE,,,TRUE,FALSE,,2028424,Alza Contracting ,7,5,49,10,"Tile & Stone Contractors, Natural Stone Tile, Stone Floor Tile, Ceramic Tile, Floor tile, Tile installers, Stone installers, stone counter top installers, tile counter top installers, stone backsplash intallers, granite installers, marble installers, limestone installers, linoleum installers, slate contractors, slate installers,install tite ,backsplash , fire place veenerneed someone to install blacksplash , wall stone veener bath room mosaic,Demolition, demolition, excavation, salvage, city demolition, demolition city, demolition company, demolition companies, demolition co, demolition inc, demolition business, concrete removal, demolition of building, building demolition, demolition building, demolition contractors, demolition of house, demolition house, house demolition, house for demolition, demolition removal, demolition and removal, demolition home, home demolition, demolish house, how to demolish a house, demo companies, demolition and construction, demolition construction, construction and demolition, construction demolition, demolition contractor, demolition tools, cost of demolition, demolition cost, demolishing a house, demolition concrete, demolition of concrete, concrete demolition, ,Interlocking Stone, Interlocking Tile, Stone, tiles for, landscaping, paving, pavers, paver, stone step, wall stone, stone wall, landscape design, patios, interlock, retaining wall, stepping stones, interlocking, landscaping ideas, retaining walls, paving stones, paver stones, pavers stones, pavers and stones, stones pavers, stones and pavers, flagstone, concrete design, landscapers, natural stone, paving stone, stone paving, stone paving stone, walls stone, patio designs, stone and tiles, tiles and stone, stone flagstones, slate tiles, slate tile, stone veneer, pavers stone, stone and pavers, stone pavers, paver stone, stone paver, concrete driveway, stone brick, stone and brick, brick and stone, stone flooring, stone patio, stone for patio,,Mold Detection & Removal, mould, mildew, mildew dectection and removal, mold removal, mildew removal, mould removal, mould detection, mold cleaning, mould cleaning, mildew cleaning, mildew cleaners, mould cleaners, mold cleaners, mold, to mold, mold and, mildew, mold and mildew, mold removal how to, removal mold, removal of mold, mold removal mold removal, mold removal, black mold, black mold black mold, mould removal, clean mold, mold how to clean, how to clean mold, mold remediation, mold remediation in, remediation mold, mold and remediation, remediation of mold, for mold remediation, mold remediation and, leak detector, how to get of mold, mildew removal, mold remove, remove mold, mold removal remediation, mould remediation, mold and mildew removal, mildew and mold removal, mildew mold removal, lead test, mold cleaning, cleaning mold, mold abatement, mold testing, mold testing in, testing for mold, testing mold, leak test, inspection mold, mold inspection, mold in the home, home mold, mold and mildew remediation, mould abatement, removing mold, mold in the house,,",0,2022-03-28T16:23:20.000-04:00,alza,FALSE,0,0,52,0,FALSE,f9ca14ad9e3dd39db73ab5e1632386f7b768e087,TRUE,NA,TRUE,TRUE,2280279,90.966723707,442,NA,NA
https://homestars.com/on/bramalea/tile-stone-contractors,94,"c(""https://homestars.com/on/bramalea/tile-stone-contractors?&page=2&"", ""https://homestars.com/on/bramalea/tile-stone-contractors?&page=3&"", ""https://homestars.com/on/bramalea/tile-stone-contractors?&page=4&"", ""https://homestars.com/on/bramalea/tile-stone-contractors?&page=5&"", ""https://homestars.com/on/bramalea/tile-stone-contractors?&page=6&"", ""https://homestars.com/on/bramalea/tile-stone-contractors?&page=7&"", ""https://homestars.com/on/bramalea/tile-stone-contractors?&page=8&"", ""https://homestars.com/on/bramalea/tile-stone-contractors?&page=9&"", 
""https://homestars.com/on/bramalea/tile-stone-contractors?&page=10&"")",Tile & Stone Contractors,2966738,,/companies/2966738-saber-construction-ltd?searched_category_id=442&service_area=2277347,"SABER CONSTRUCTION headquartered is in Concord, Ontario. Since 2020.
 We Are offering  services in the GTA areas and Vaughan , Richmond Hill , Markham, king city and Aurora. Also, Mississauga, Brampton, Milton, Scarborough, Pickering, and Ajax.
We install tiles on Bathrooms floors and walls, Kitchen floors and backsplash, Foyer entrance and mood room floors, powder rooms floors, laundry floors, hallway floors, Fireplace and throughout the entire house, condominiums, apartments, buildings lobby, common areas and commercial. 
CALL NOW!!! FOR A FREE QUOTE AT 647-5224194
",saber-construction-ltd,2022-04-03T21:17:47.000-04:00,NA,NA,NA,,"We install tiles on Bathrooms floors and walls, Kitchen floors and backsplash, Foyer entrance and mood room floors, powder rooms floors, laundry floors, hallway floors, fireplaces and throughout entire house, condominiums, apartments, buildings lobby, common areas and commercial.",,"*KITCHEN FLOORS AND BACKSPLASH.
*BATHROOM FLOORS AND WALLS.",2020,8,"Cheque, Cash, E-Transfer",,,,TRUE,FALSE,,,TRUE,FALSE,Yes we do. Please Inquire!,2028656,SABER CONSTRUCTION LTD,11,10,75,10,"Tile & Stone Contractors, Natural Stone Tile, Stone Floor Tile, Ceramic Tile, Floor tile, Tile installers, Stone installers, stone counter top installers, tile counter top installers, stone backsplash intallers, granite installers, marble installers, limestone installers, linoleum installers, slate contractors, slate installers,install tite ,backsplash , fire place veenerneed someone to install blacksplash , wall stone veener bath room mosaic,",0,2022-04-03T21:28:21.000-04:00,saberconstruction,FALSE,0,0,90,0,FALSE,45f4b51bd94d705fd17a92b1e25c99b4505f05e8,TRUE,2022-09-16T07:45:28.000-04:00,TRUE,TRUE,2277347,98.6961011749,442,NA,NA
https://homestars.com/on/bramalea/tile-stone-contractors,94,"c(""https://homestars.com/on/bramalea/tile-stone-contractors?&page=2&"", ""https://homestars.com/on/bramalea/tile-stone-contractors?&page=3&"", ""https://homestars.com/on/bramalea/tile-stone-contractors?&page=4&"", ""https://homestars.com/on/bramalea/tile-stone-contractors?&page=5&"", ""https://homestars.com/on/bramalea/tile-stone-contractors?&page=6&"", ""https://homestars.com/on/bramalea/tile-stone-contractors?&page=7&"", ""https://homestars.com/on/bramalea/tile-stone-contractors?&page=8&"", ""https://homestars.com/on/bramalea/tile-stone-contractors?&page=9&"", 
""https://homestars.com/on/bramalea/tile-stone-contractors?&page=10&"")",Tile & Stone Contractors,2963000,http://marblestoneexpress.com,/companies/2963000-marble-stone-express?searched_category_id=442&service_area=2268646,"With more than 20 years in stone protection and restoration, we provide high quality and highly sought-after professional stone care services for both residential and commercial properties across Ontario.
 
Our highly specialized team will protect and restore the look and feel of your stone surfaces so that you can get the most out of your natural stone.",marble-stone-express,2021-12-28T15:36:38.000-05:00,NA,NA,NA," We offer a StoneGuard protective film that protects your marble, granite, terrazzo, ceramic, slate , limestone, quartz, and natural stone from scratches, stains, etching, and heat resistant.","Polishing, Honing, Grinding, Restoration,    Repair, Chipped or Broken Repair, Sealing , Cleaning, StoneGuard protective film","Marble Stone Express, StoneGuard","Natural Stone, Protection, Restoration",1995,8,"Cash, Cheque, E-transfer",,,,FALSE,FALSE,,$400.00,FALSE,FALSE,,2024951,Marble Stone Express,7,5,292,10,"Tile & Stone Contractors, Natural Stone Tile, Stone Floor Tile, Ceramic Tile, Floor tile, Tile installers, Stone installers, stone counter top installers, tile counter top installers, stone backsplash intallers, granite installers, marble installers, limestone installers, linoleum installers, slate contractors, slate installers,install tite ,backsplash , fire place veenerneed someone to install blacksplash , wall stone veener bath room mosaic,Countertops, Granite Counter Tops, Kitchen Counter Tops, Marble Counter Tops, Laminate Counter Top, Quartz Counter Top, Corian counter top, tile counter top, silestone counter tops, arborite counter tops, custom counter tops, kitchen, remodeling, kitchen cabinet, kitchen design, ,Floor Laying & Refinishing, Hardwood Floor, Wood Floor, Floor Tile, Dance Floor, Ceramic Floor Tile, Floor Refinishing, bamboo floor, cork floor, FSC wood flooring, stone floor, marble floor, slate floor, squeaky floor repair, laminate, laminate repair, wood floor, floor and wood, wood flooring, wood floors, floors in wood, hardwood flooring, hardwood floors, hardwood floors and, hardwood floor, hardwood floor wood, wood floor flooring, refinishing, floor refinishing, floor refinishing in, refinishing floor, hardwood install, floor laying, laying a floor, flood sanding, wood floor refinishing, refinishing hardwood floors, flooring laying, wood floors refinishing, wood flooring refinishing, floor co, flooring hard wood, hard wood floors, laying floors, flooring company, flooring engineered hardwood, floor company, hard wood floor, cleaning hardwood floors, installing hardwood flooring, installing hardwood floors, installing wood flooring, installing wood floors, installing hardwood floors, installing wood flooring, installing wood floors, installing hardwood floor, hardwood flooring installation, business floor, wood flooring installation, hardwood floor installation, floor companies, lay hardwood flooring, lay hardwood floor, wood floor repair, repair wood floor, repair hardwood floor, hardwood floor repair, finishing a hardwood floor, squeeky floors,,Hardwood floors, Install hardwood floors, caulking,",0,2021-12-28T16:00:48.000-05:00,marblestoneexpress,FALSE,0,0,361,0,FALSE,5537b4416bf004821edc6723fc8081a0b31c5209,TRUE,NA,TRUE,TRUE,2268646,89.885174938,442,NA,NA
https://homestars.com/on/bramalea/tile-stone-contractors,94,"c(""https://homestars.com/on/bramalea/tile-stone-contractors?&page=2&"", ""https://homestars.com/on/bramalea/tile-stone-contractors?&page=3&"", ""https://homestars.com/on/bramalea/tile-stone-contractors?&page=4&"", ""https://homestars.com/on/bramalea/tile-stone-contractors?&page=5&"", ""https://homestars.com/on/bramalea/tile-stone-contractors?&page=6&"", ""https://homestars.com/on/bramalea/tile-stone-contractors?&page=7&"", ""https://homestars.com/on/bramalea/tile-stone-contractors?&page=8&"", ""https://homestars.com/on/bramalea/tile-stone-contractors?&page=9&"", 
""https://homestars.com/on/bramalea/tile-stone-contractors?&page=10&"")",Tile & Stone Contractors,2964975,https://lunacflooring.wixsite.com/website,/companies/2964975-lunac-flooring?searched_category_id=442&service_area=2272973,"LUNAC Flooring is a family owned and operated business in Ontario. We specialize in tile, stone, ceramic, laminate, and vinyl floor installation. In addition, we provide service for bath, shower, backsplash and fireplace tile/stone installation. 

The primary contractor, Marko, has been in the business since 2018, however it wasn't until 2020 that he pursued this venture on his own. 

LUNAC Flooring offers top of the industry techniques and materials for all installations regardless of project size and/or complexity. We work with you to determine pricing that fits your budget, and our consultations are free of charge.

Our primary focus is to establish and maintain relationships built on transparency and superior workmanship. Come home to quality!

If this sounds like something that you've been looking for, connect with us, and allow us to bring your vision to life!",lunac-flooring,2022-02-20T15:58:34.000-05:00,NA,NA,NA,,"Tile, stone, ceramic, vinyl and laminate floor installation.
Backsplash, shower, bath and fireplace tile/stone installation.",,,2020,1,,,,,FALSE,FALSE,,,FALSE,FALSE,,2026905,LUNAC Flooring,3,3,17,10,"Tile & Stone Contractors, Natural Stone Tile, Stone Floor Tile, Ceramic Tile, Floor tile, Tile installers, Stone installers, stone counter top installers, tile counter top installers, stone backsplash intallers, granite installers, marble installers, limestone installers, linoleum installers, slate contractors, slate installers,install tite ,backsplash , fire place veenerneed someone to install blacksplash , wall stone veener bath room mosaic,",0,2022-03-07T12:37:33.000-05:00,,FALSE,0,0,18,0,FALSE,6c6c609d8e807abf3ba12cf76dd95b34874bc208,TRUE,NA,TRUE,TRUE,2272973,89.6190581429,442,NA,NA
https://homestars.com/on/bramalea/tile-stone-contractors,94,"c(""https://homestars.com/on/bramalea/tile-stone-contractors?&page=2&"", ""https://homestars.com/on/bramalea/tile-stone-contractors?&page=3&"", ""https://homestars.com/on/bramalea/tile-stone-contractors?&page=4&"", ""https://homestars.com/on/bramalea/tile-stone-contractors?&page=5&"", ""https://homestars.com/on/bramalea/tile-stone-contractors?&page=6&"", ""https://homestars.com/on/bramalea/tile-stone-contractors?&page=7&"", ""https://homestars.com/on/bramalea/tile-stone-contractors?&page=8&"", ""https://homestars.com/on/bramalea/tile-stone-contractors?&page=9&"", 
""https://homestars.com/on/bramalea/tile-stone-contractors?&page=10&"")",Tile & Stone Contractors,2957034,NA,/companies/2957034-black-diamond-construction-and-renovation?searched_category_id=442&service_area=2255202,NA,black-diamond-construction-and-renovation,2021-06-08T15:31:50.000-04:00,NA,NA,NA,NA,NA,NA,NA,NA,NA,NA,NA,NA,NA,FALSE,FALSE,NA,NA,FALSE,FALSE,NA,2019011,Black Diamond Construction and Renovation,3,3,8,10,"Tile & Stone Contractors, Natural Stone Tile, Stone Floor Tile, Ceramic Tile, Floor tile, Tile installers, Stone installers, stone counter top installers, tile counter top installers, stone backsplash intallers, granite installers, marble installers, limestone installers, linoleum installers, slate contractors, slate installers,install tite ,backsplash , fire place veenerneed someone to install blacksplash , wall stone veener bath room mosaic,",0,2021-06-08T15:33:56.000-04:00,NA,FALSE,0,0,8,0,FALSE,693acee98642276a680c26d95a2377f27e4b0004,TRUE,NA,TRUE,TRUE,2255202,89.4802311096,442,NA,NA
https://homestars.com/on/bramalea/tile-stone-contractors,94,"c(""https://homestars.com/on/bramalea/tile-stone-contractors?&page=2&"", ""https://homestars.com/on/bramalea/tile-stone-contractors?&page=3&"", ""https://homestars.com/on/bramalea/tile-stone-contractors?&page=4&"", ""https://homestars.com/on/bramalea/tile-stone-contractors?&page=5&"", ""https://homestars.com/on/bramalea/tile-stone-contractors?&page=6&"", ""https://homestars.com/on/bramalea/tile-stone-contractors?&page=7&"", ""https://homestars.com/on/bramalea/tile-stone-contractors?&page=8&"", ""https://homestars.com/on/bramalea/tile-stone-contractors?&page=9&"", 
""https://homestars.com/on/bramalea/tile-stone-contractors?&page=10&"")",Tile & Stone Contractors,2957034,NA,/companies/2957034-black-diamond-construction-and-renovation?searched_category_id=442&service_area=2266791,NA,black-diamond-construction-and-renovation,2021-06-08T15:31:50.000-04:00,NA,NA,NA,NA,NA,NA,NA,NA,NA,NA,NA,NA,NA,FALSE,FALSE,NA,NA,FALSE,FALSE,NA,2019011,Black Diamond Construction and Renovation,3,3,8,10,"Tile & Stone Contractors, Natural Stone Tile, Stone Floor Tile, Ceramic Tile, Floor tile, Tile installers, Stone installers, stone counter top installers, tile counter top installers, stone backsplash intallers, granite installers, marble installers, limestone installers, linoleum installers, slate contractors, slate installers,install tite ,backsplash , fire place veenerneed someone to install blacksplash , wall stone veener bath room mosaic,",0,2021-06-08T15:33:56.000-04:00,NA,FALSE,0,0,8,0,FALSE,693acee98642276a680c26d95a2377f27e4b0004,TRUE,NA,TRUE,TRUE,2266791,89.4802311096,442,NA,NA
https://homestars.com/on/bramalea/tile-stone-contractors,94,"c(""https://homestars.com/on/bramalea/tile-stone-contractors?&page=2&"", ""https://homestars.com/on/bramalea/tile-stone-contractors?&page=3&"", ""https://homestars.com/on/bramalea/tile-stone-contractors?&page=4&"", ""https://homestars.com/on/bramalea/tile-stone-contractors?&page=5&"", ""https://homestars.com/on/bramalea/tile-stone-contractors?&page=6&"", ""https://homestars.com/on/bramalea/tile-stone-contractors?&page=7&"", ""https://homestars.com/on/bramalea/tile-stone-contractors?&page=8&"", ""https://homestars.com/on/bramalea/tile-stone-contractors?&page=9&"", 
""https://homestars.com/on/bramalea/tile-stone-contractors?&page=10&"")",Tile & Stone Contractors,2962060,,/companies/2962060-tile-proactive?searched_category_id=442&service_area=2266523,"Tile proactive was established in 2001 in Turkey, we took part in large scale contracts such as universities, hospitals and government contracts, this gives us a competitive edge as we have foreign experience. Tile Proactive expanded into North America in 2016. Since then we have been part of a significant number of commercial and residential contracts here in Canada. ",tile-proactive,2021-11-26T15:56:00.000-05:00,NA,NA,NA,"Our products are supplied by squarefootflooring, we invite you to check out their website via this link: https://squarefootflooring.com","We do all types of tile work, Commercial and Residential at a Professional standard. These include but are not limited to Bathrooms, backsplashes, kitchens, Floors, Bathrooms, Fireplaces, Stone wall, Stairs.",,,2016,4,"Cash, cheque, PayPal, Interac",,Fully insured and licensed,,TRUE,FALSE,,,TRUE,FALSE,Satisfaction Guaranteed,2024019,Tile Proactive,12,9,351,10,"Tile & Stone Contractors, Natural Stone Tile, Stone Floor Tile, Ceramic Tile, Floor tile, Tile installers, Stone installers, stone counter top installers, tile counter top installers, stone backsplash intallers, granite installers, marble installers, limestone installers, linoleum installers, slate contractors, slate installers,install tite ,backsplash , fire place veenerneed someone to install blacksplash , wall stone veener bath room mosaic,",0,2021-11-26T15:57:19.000-05:00,tileproactive,FALSE,0,0,392,0,FALSE,5dc4cb84c7c0f995f4e457dd928c0c595887de6d,TRUE,2022-02-22T08:42:36.000-05:00,TRUE,TRUE,2266523,89.5691315229,442,NA,NA
