Link,n_hits,all_links,category,id,url,hs_path,profile,permalink,created_at,sic_code,service_area,hours,products,services,brands,specialities,established,employee_cnt,payment_method,diplomas,licenses,memberships,liability_insurance,bonded,project_rate,project_minimum,written_contract,written_warranty,warranty_terms,parent_company_id,name,total_number_of_reviews_cache,total_number_of_approved_reviews_cache,number_of_photos_cache,avg_rating_cache,categories_info_cache,savings_count,subdomain,fraudulent,fraudulent_count,total_number_of_pending_reviews_cache,images_count,completion_percent_cache,bully,secret,replied_to_at_least_one_review_cache,latest_approved_review_created_at,has_set_tasks,lead_purchase_eligible,service_area_id,star_score,quote_button_category,direct_phone,direct_contact,claimed_at
https://homestars.com/on/rocky%20view%20county/roofing,47,"c(""https://homestars.com/on/rocky%20view%20county/roofing?&page=2&"", ""https://homestars.com/on/rocky%20view%20county/roofing?&page=3&"", ""https://homestars.com/on/rocky%20view%20county/roofing?&page=4&"", ""https://homestars.com/on/rocky%20view%20county/roofing?&page=5&"")",Roofing,2953726,https://www.jepsenconcrete.com/,/companies/2953726-jcl-inc?searched_category_id=428&service_area=2248007,"A Local Expert Committed to Excellence

JCL Inc. is recognized as a top Concrete Contractor in Calgary. I’ve provided clients with a wide range of contracting services for all their remodeling and repairing needs. Whether you’re looking to renovate your existing space or add a whole new extension, I’m happy to help you achieve the results you seek. Contact me today to receive a free estimate.",jcl-inc,2021-03-05T00:16:03.000-05:00,NA,NA,NA,,"Concrete Constructions
Delivery and Demo Service
Full Service Home Contracting",,,NA,22,"Cash, Credit or Cheque!",,,,TRUE,TRUE,,,TRUE,FALSE,,2015822,JCL INC,6,5,5,10,"Roofing, Roofing Contractor, Metal Roofing, Roofing Material, Roofing Shingles, Roofing Company, cedar roofing, roofing repair, roof repair, cedar shingles, shingles, roof repair, slate roofing, slate roofs, cedar shakes, roof, how to roof, about roofing, at roofing, the roofing, roofing roofing, a roofing, roof roof roofing, shingles, roofs, shingles for roof, roof shingles, shingles roof, roofing shingles, shingles roofing, metal roof, roof metal, metal roofing, roofing metal, steel roof, steel roofing, roof repair, roof and repair, roofers, roofer, roof tiles, roof tile, tile roof, roofing contractors, roofing companies, metal roofs, roof shingle, shingle roof, contractor roofing, roofing contractor, Roofing Contractor for New Shingles, roofing canada, roofing companies, canadian roofing contractors, roof builders, roofing installers, contractor roofing, roofing calgary, roofing ottawa, roofers calgary, roofing jobs, roofing barrie, best roofing material, vancouver, roofing contractors, roof contractors, roofing supply , home roofing, roofing ontario, roof ontario, commercial roofing, residential roofers, roofing builders, shingle roof contractor, residential roofing company, roof types, best roofing company, fiberglass shingles,  canadian roofing company, flat roofing, industrail roofing, types of roofing, roofing options, list roofing companies, shinglers, roofing estimates, elk shingles,  roofing reviews, asphalt shingles prices, metal sheet roofing, roofing systems, flat roofing companies, roofing and siding, roofers review, new roofing, slate roofing contractors, roof installers, vinyl roofing material, roof sheets, commercial roof repairs,Concrete Contractors, Impressed concrete, poured concrete, stamped concrete, radiant heating, concrete floors, contractors, concrete repair, concrete in, masonry, asphalt, paving, pavers, in the driveway, driveway, construction companies, driveways, block of concrete, concrete block, concrete mix, concret, concrete blocks, concrete slab, cost of concrete, concrete cost, concrete wall, price of concrete, concrete price, concrete stain, stamped concrete, concrete prices, repair concrete, how to repair concrete, repair of concrete, concrete repair, concrete slabs, decorative concrete, concrete decorative, staining concrete, concrete staining, concrete walls, countertop concrete, concrete countertops, patio ideas, cement companies, ready mix concrete, concrete ready mix, slabjack, slabjacking, mudjack, mudjacking, Driveway, caulking,,Fences & Gates, Dog Fence, Invisible Fence, Chain Link Fence, Pool Fence, Wood Fence, Fence Gates, Dog Gates, Pet Gates, friendly neighbour fence, friendly neighbor fence, picket fence, wrought iron fence, and gate, and gates, gates, the fence, a fence, fence, fences, fence with gate, gate and fence, gate for fence, fence & gate, gate fence, fence gate, fence and gate, gates and fence, gates fence, fence & gates, fence and gates, fence gates, railings, wrought iron, electronic gates, entrance gate, trellis, fence post, front gates, chain fence, fence panels, fence chain link, chain link fence, how to wood fence, fence wood, wood for fence, wood fence, fence panel, garden gate, fence posts, fencing panels, iron gate, chain link fencing, panel fencing, gates iron, iron gates, chain link fences, fences chain link, fencing post, dog fencing, ,",0,,FALSE,0,0,15,0,FALSE,b9007255866e19ad15aad397c5eed2e41b1b54e4,TRUE,NA,TRUE,TRUE,2248007,75.9143684512,428,NA,NA,2021-03-05T00:16:40.000-05:00
https://homestars.com/on/rocky%20view%20county/roofing,47,"c(""https://homestars.com/on/rocky%20view%20county/roofing?&page=2&"", ""https://homestars.com/on/rocky%20view%20county/roofing?&page=3&"", ""https://homestars.com/on/rocky%20view%20county/roofing?&page=4&"", ""https://homestars.com/on/rocky%20view%20county/roofing?&page=5&"")",Roofing,2967045,http://www.maddogexteriors.ca,/companies/2967045-mad-dog-exteriors-inc?searched_category_id=428&service_area=2277666,,mad-dog-exteriors-inc,2022-04-11T20:19:35.000-04:00,NA,NA,NA,,"Asphalt roofing, all types of siding, eaves troughs, soffit, fascia, windows and doors.",,,NA,5,"Check, E-transfer",,City of Calgary,,TRUE,TRUE,,,TRUE,FALSE,,2028963,Mad Dog Exteriors Inc,19,19,11,9.94737,"Siding, vinyl siding, wood siding, exterior siding, aluminum siding, cedar shakes, cedar shingles, composite wood siding, seamless steel siding, wood clapboard, stone siding, brick siding, exterior, side, sides, how to siding, the siding, the other side, stucco,  how to vinyl siding, about vinyl siding, what is vinyl siding, in vinyl siding, vinyl siding how to, vinyl siding, siding vinyl, how to install vinyl, cement fiber, fiber cement, siding house, house with siding, siding on a house, what is siding on a house, siding for house, siding a house, how to siding a house, siding on house, house siding, siding for a house, ,Roofing, Roofing Contractor, Metal Roofing, Roofing Material, Roofing Shingles, Roofing Company, cedar roofing, roofing repair, roof repair, cedar shingles, shingles, roof repair, slate roofing, slate roofs, cedar shakes, roof, how to roof, about roofing, at roofing, the roofing, roofing roofing, a roofing, roof roof roofing, shingles, roofs, shingles for roof, roof shingles, shingles roof, roofing shingles, shingles roofing, metal roof, roof metal, metal roofing, roofing metal, steel roof, steel roofing, roof repair, roof and repair, roofers, roofer, roof tiles, roof tile, tile roof, roofing contractors, roofing companies, metal roofs, roof shingle, shingle roof, contractor roofing, roofing contractor, Roofing Contractor for New Shingles, roofing canada, roofing companies, canadian roofing contractors, roof builders, roofing installers, contractor roofing, roofing calgary, roofing ottawa, roofers calgary, roofing jobs, roofing barrie, best roofing material, vancouver, roofing contractors, roof contractors, roofing supply , home roofing, roofing ontario, roof ontario, commercial roofing, residential roofers, roofing builders, shingle roof contractor, residential roofing company, roof types, best roofing company, fiberglass shingles,  canadian roofing company, flat roofing, industrail roofing, types of roofing, roofing options, list roofing companies, shinglers, roofing estimates, elk shingles,  roofing reviews, asphalt shingles prices, metal sheet roofing, roofing systems, flat roofing companies, roofing and siding, roofers review, new roofing, slate roofing contractors, roof installers, vinyl roofing material, roof sheets, commercial roof repairs,",0,,FALSE,0,0,12,0,FALSE,33ef2d40a0327f2c8bb0cd2ad5d58a591b2be90b,TRUE,2022-04-23T11:28:18.000-04:00,TRUE,TRUE,2277666,98.1269898552,428,NA,NA,2022-04-12T15:08:51.000-04:00
https://homestars.com/on/rocky%20view%20county/roofing,47,"c(""https://homestars.com/on/rocky%20view%20county/roofing?&page=2&"", ""https://homestars.com/on/rocky%20view%20county/roofing?&page=3&"", ""https://homestars.com/on/rocky%20view%20county/roofing?&page=4&"", ""https://homestars.com/on/rocky%20view%20county/roofing?&page=5&"")",Roofing,2901924,http://geometrikprojek.com/,/companies/2901924-geometrik-project-contracting-ltd?searched_category_id=428&service_area=2133189,"Our past projects include  New Projects,repairs/restorations,in Occupied and fully operational job sites are never a problem. And we can also plan, manage, and build multi-phase jobs. We are an  integrated company with strong core values, and always in pursuit to exceed our customers expectations, reinventing ourselves and improving every day to go beyond those of the other companies of renovation, roofing contractors etc etc. 

",geometrik-project-contracting-ltd,2017-09-08T09:05:52.000-04:00,NA,NA,NA,,"We are Specialist in Residential & Commercial:

 Rubber, Slate, Asphalt Roofing & Metal Roofing

Metal, Aluminum, Vinyl & James Hardie Siding  

Soffit, Fascia, Continues Eavestroughing & Cladding

Drywall, Metal Framing and more..",,"Metal Roofing
Metal Cladding
Metal Wall Systems 
Metal Turrets Cladding  ( Copper Or Other Metal Colours)
Metal Copper Roof
Metal Copper Gutters 
Metal Custom Eyebrow Roof 
Metal Capping 

James Hardie Siding  Plank Or Shake 
Vinyl Siding  Vertical Or Horizontal 
Long Board Siding 
Lux Siding  
Icon Siding 



",2017,NA,"E-Transfer, Cash, Cheque, Paypal ",,,BBB,TRUE,FALSE,"15,000 to 75,000",350 Cad ,TRUE,FALSE,"Yes, ask for details. ",1964109,Geometrik Project  Contracting Ltd ,6,5,145,10,"Siding, vinyl siding, wood siding, exterior siding, aluminum siding, cedar shakes, cedar shingles, composite wood siding, seamless steel siding, wood clapboard, stone siding, brick siding, exterior, side, sides, how to siding, the siding, the other side, stucco,  how to vinyl siding, about vinyl siding, what is vinyl siding, in vinyl siding, vinyl siding how to, vinyl siding, siding vinyl, how to install vinyl, cement fiber, fiber cement, siding house, house with siding, siding on a house, what is siding on a house, siding for house, siding a house, how to siding a house, siding on house, house siding, siding for a house, ,Roofing, Roofing Contractor, Metal Roofing, Roofing Material, Roofing Shingles, Roofing Company, cedar roofing, roofing repair, roof repair, cedar shingles, shingles, roof repair, slate roofing, slate roofs, cedar shakes, roof, how to roof, about roofing, at roofing, the roofing, roofing roofing, a roofing, roof roof roofing, shingles, roofs, shingles for roof, roof shingles, shingles roof, roofing shingles, shingles roofing, metal roof, roof metal, metal roofing, roofing metal, steel roof, steel roofing, roof repair, roof and repair, roofers, roofer, roof tiles, roof tile, tile roof, roofing contractors, roofing companies, metal roofs, roof shingle, shingle roof, contractor roofing, roofing contractor, Roofing Contractor for New Shingles, roofing canada, roofing companies, canadian roofing contractors, roof builders, roofing installers, contractor roofing, roofing calgary, roofing ottawa, roofers calgary, roofing jobs, roofing barrie, best roofing material, vancouver, roofing contractors, roof contractors, roofing supply , home roofing, roofing ontario, roof ontario, commercial roofing, residential roofers, roofing builders, shingle roof contractor, residential roofing company, roof types, best roofing company, fiberglass shingles,  canadian roofing company, flat roofing, industrail roofing, types of roofing, roofing options, list roofing companies, shinglers, roofing estimates, elk shingles,  roofing reviews, asphalt shingles prices, metal sheet roofing, roofing systems, flat roofing companies, roofing and siding, roofers review, new roofing, slate roofing contractors, roof installers, vinyl roofing material, roof sheets, commercial roof repairs,",0,,FALSE,0,0,141,0,FALSE,d20617742b323a1d3ce0556b025191957d011098,TRUE,NA,TRUE,TRUE,2133189,80.7067528013,428,NA,NA,2017-09-08T09:06:53.000-04:00
https://homestars.com/on/rocky%20view%20county/roofing,47,"c(""https://homestars.com/on/rocky%20view%20county/roofing?&page=2&"", ""https://homestars.com/on/rocky%20view%20county/roofing?&page=3&"", ""https://homestars.com/on/rocky%20view%20county/roofing?&page=4&"", ""https://homestars.com/on/rocky%20view%20county/roofing?&page=5&"")",Roofing,2943689,https://www.top-roof.ca,/companies/2943689-top-roof-exteriors-inc?searched_category_id=428&service_area=2225647,"Top Roof & Exteriors inc. is a Calgary based company established in 2012 with representatives that have been in the industry for as long as 40+ years! Top Roof & Exteriors provides unrivaled and exceptional roofing services in and around the southern Alberta area. Our highly experienced roofing team specializes in roof replacements and repairs for commercial, industrial and residential properties.

Integrity, professionalism and reliability are always our top priorities and our projects always meet or exceed Alberta Building Codes. We are fully insured to cover: Hot tar, and hot work, roofing and exteriors for both commercial and residential projects. We are also qualified and certified installers for all types of roofing systems and exterior work that we offer like; Torch on (SBS), EPDM, TPO, Spray on coating, Shingles, Cedar, Rubber, Metal, Siding, Eavestrough, Facia, Soffit, Railing and Painting. We really go the extra mile to ensure that our jobs are safe sites and we are proud to be SECOR Certified.  Our workmanship is outstanding and we offer a 10 year workmanship warranty on all of our work.

Before undergoing any work, we will carefully inspect the premises, discuss available options, estimate costs and provide you with solutions that match your needs and budget. Top Roof takes great pride in offering personalized service, which means our clients get to choose the plan that is best suited for their home/business. As a premier company specializing in residential and commercial roofing services, we are dedicated to providing customer service that is second to none. 

Whether you have a new construction project or need to replace an old or damaged roof, we should be your go-to roofing repair and replacement service.",top-roof-exteriors-inc,2020-05-21T10:56:12.000-04:00,NA,NA,NA,"Ashphalt, Metal, Rubber, Cedar,  SBS torch on, Coating, Hardie, Vinyl, EPDM, TPO   ","Slope Roofing, Flat Roofing, Siding, Eavestrough (Gutter), SBS, EPDM, TPO, Rubber, Soffit, Facia, Painting, Railing, ","IKO, Malarkey, Owens Corning, Soprema, IKO Commercial, Euroshield, Duraflo, Velux, Rhino, Resisto","Slope Roofing, Flat Roofing, Siding, Eavestrough, Exteriors",2019,8,"Visa, Mastercard, Debit, E-transfer ",Roofing Journeymen," Journeyman, Soprema instaler, IKO commercial certified, First Aid, SECOR, Man Lift, Fall Arrest ","BBB, WCB, ACSA, Home Stars, SECOR",TRUE,TRUE,"1.200,000",300$,TRUE,FALSE,10 years workmanship,2005842,Top Roof & Exteriors Inc.,13,12,99,9.91667,"Roofing, Roofing Contractor, Metal Roofing, Roofing Material, Roofing Shingles, Roofing Company, cedar roofing, roofing repair, roof repair, cedar shingles, shingles, roof repair, slate roofing, slate roofs, cedar shakes, roof, how to roof, about roofing, at roofing, the roofing, roofing roofing, a roofing, roof roof roofing, shingles, roofs, shingles for roof, roof shingles, shingles roof, roofing shingles, shingles roofing, metal roof, roof metal, metal roofing, roofing metal, steel roof, steel roofing, roof repair, roof and repair, roofers, roofer, roof tiles, roof tile, tile roof, roofing contractors, roofing companies, metal roofs, roof shingle, shingle roof, contractor roofing, roofing contractor, Roofing Contractor for New Shingles, roofing canada, roofing companies, canadian roofing contractors, roof builders, roofing installers, contractor roofing, roofing calgary, roofing ottawa, roofers calgary, roofing jobs, roofing barrie, best roofing material, vancouver, roofing contractors, roof contractors, roofing supply , home roofing, roofing ontario, roof ontario, commercial roofing, residential roofers, roofing builders, shingle roof contractor, residential roofing company, roof types, best roofing company, fiberglass shingles,  canadian roofing company, flat roofing, industrail roofing, types of roofing, roofing options, list roofing companies, shinglers, roofing estimates, elk shingles,  roofing reviews, asphalt shingles prices, metal sheet roofing, roofing systems, flat roofing companies, roofing and siding, roofers review, new roofing, slate roofing contractors, roof installers, vinyl roofing material, roof sheets, commercial roof repairs,",0,,FALSE,0,0,101,0,FALSE,e7211751da4ae986b3b1dea012c4f8e4af9edd6c,TRUE,NA,TRUE,TRUE,2225647,94.9515705655,428,NA,NA,2020-05-21T10:57:45.000-04:00
https://homestars.com/on/rocky%20view%20county/roofing,47,"c(""https://homestars.com/on/rocky%20view%20county/roofing?&page=2&"", ""https://homestars.com/on/rocky%20view%20county/roofing?&page=3&"", ""https://homestars.com/on/rocky%20view%20county/roofing?&page=4&"", ""https://homestars.com/on/rocky%20view%20county/roofing?&page=5&"")",Roofing,2926049,https://calgaryhighlanderroofing.com/,/companies/2926049-highlander-roofing?searched_category_id=428&service_area=2185511,"Highlander Roofing Inc. provides some of the best roofing services for residential roofing And siding. To provide only long-lasting roofing systems, Highlander Roofing Inc. uses roofing’s from Malarkey, Owens Corning, and IKO. All of these companies may already have lengthy manufacturer’s warranties for their products, but highlander Roofing also provides a 10-year workmanship warranty.
Highlander Roofing Inc. services don’t end with roofing because it also offers siding, soffit, fascia, and eavestrough installation and repairs.
Our locally-owned company will be complete your projects on time with professional commitment and timely services as well as providing excellent workmanship.
",highlander-roofing,2019-01-10T13:16:37.000-05:00,NA,NA,NA,"Asphalt Shingles, Siding, fascia, soffit, Eavestough and downspouts","Re Roofing, New Roofing, Roof Repair Residential and Commercial Roofing, Siding, Gutters, Soffit, Fascia","Owens Corning, Iko, Royal, Gentek",,2010,6,"Cash, e-Transfer, bank draft",,,,TRUE,FALSE,,,TRUE,FALSE,10 years workmanship warranty,1988223,Highlander Roofing,21,21,10,9.95238,"Roofing, Roofing Contractor, Metal Roofing, Roofing Material, Roofing Shingles, Roofing Company, cedar roofing, roofing repair, roof repair, cedar shingles, shingles, roof repair, slate roofing, slate roofs, cedar shakes, roof, how to roof, about roofing, at roofing, the roofing, roofing roofing, a roofing, roof roof roofing, shingles, roofs, shingles for roof, roof shingles, shingles roof, roofing shingles, shingles roofing, metal roof, roof metal, metal roofing, roofing metal, steel roof, steel roofing, roof repair, roof and repair, roofers, roofer, roof tiles, roof tile, tile roof, roofing contractors, roofing companies, metal roofs, roof shingle, shingle roof, contractor roofing, roofing contractor, Roofing Contractor for New Shingles, roofing canada, roofing companies, canadian roofing contractors, roof builders, roofing installers, contractor roofing, roofing calgary, roofing ottawa, roofers calgary, roofing jobs, roofing barrie, best roofing material, vancouver, roofing contractors, roof contractors, roofing supply , home roofing, roofing ontario, roof ontario, commercial roofing, residential roofers, roofing builders, shingle roof contractor, residential roofing company, roof types, best roofing company, fiberglass shingles,  canadian roofing company, flat roofing, industrail roofing, types of roofing, roofing options, list roofing companies, shinglers, roofing estimates, elk shingles,  roofing reviews, asphalt shingles prices, metal sheet roofing, roofing systems, flat roofing companies, roofing and siding, roofers review, new roofing, slate roofing contractors, roof installers, vinyl roofing material, roof sheets, commercial roof repairs,",0,,FALSE,0,0,10,0,FALSE,0f4c88637b1b45ce8eb3504a01f25210a990b85e,TRUE,2021-08-26T13:40:31.000-04:00,TRUE,TRUE,2185511,98.6044167527,428,NA,NA,2019-01-10T13:17:14.000-05:00
https://homestars.com/on/rocky%20view%20county/roofing,47,"c(""https://homestars.com/on/rocky%20view%20county/roofing?&page=2&"", ""https://homestars.com/on/rocky%20view%20county/roofing?&page=3&"", ""https://homestars.com/on/rocky%20view%20county/roofing?&page=4&"", ""https://homestars.com/on/rocky%20view%20county/roofing?&page=5&"")",Roofing,2939406,,/companies/2939406-yoab-roofing-ltd?searched_category_id=428&service_area=2216125,Yoab Roofing is a family run business with 8 years of experience in the roofing industry. We started this company 2 years ago and have already built up a fantastic client base we love doing work for. We look forward to connecting with new clients and and can't wait to hear from you!,yoab-roofing-ltd,2020-01-24T12:53:25.000-05:00,NA,NA,NA,,"Roofing Services, Flat Roof, Ashpalt Shingle Roofing",,,2018,5,"E transfer, Cheque",,,,TRUE,FALSE,,,TRUE,FALSE,manufacturers Warranty and 10 years on labour. Kindly ask for more details,2001580,Yoab Roofing Ltd,10,9,13,10,"Roofing, Roofing Contractor, Metal Roofing, Roofing Material, Roofing Shingles, Roofing Company, cedar roofing, roofing repair, roof repair, cedar shingles, shingles, roof repair, slate roofing, slate roofs, cedar shakes, roof, how to roof, about roofing, at roofing, the roofing, roofing roofing, a roofing, roof roof roofing, shingles, roofs, shingles for roof, roof shingles, shingles roof, roofing shingles, shingles roofing, metal roof, roof metal, metal roofing, roofing metal, steel roof, steel roofing, roof repair, roof and repair, roofers, roofer, roof tiles, roof tile, tile roof, roofing contractors, roofing companies, metal roofs, roof shingle, shingle roof, contractor roofing, roofing contractor, Roofing Contractor for New Shingles, roofing canada, roofing companies, canadian roofing contractors, roof builders, roofing installers, contractor roofing, roofing calgary, roofing ottawa, roofers calgary, roofing jobs, roofing barrie, best roofing material, vancouver, roofing contractors, roof contractors, roofing supply , home roofing, roofing ontario, roof ontario, commercial roofing, residential roofers, roofing builders, shingle roof contractor, residential roofing company, roof types, best roofing company, fiberglass shingles,  canadian roofing company, flat roofing, industrail roofing, types of roofing, roofing options, list roofing companies, shinglers, roofing estimates, elk shingles,  roofing reviews, asphalt shingles prices, metal sheet roofing, roofing systems, flat roofing companies, roofing and siding, roofers review, new roofing, slate roofing contractors, roof installers, vinyl roofing material, roof sheets, commercial roof repairs,",0,NA,FALSE,0,0,14,0,FALSE,64108c419910034df26c1733178c700a1c86d3f7,TRUE,NA,TRUE,TRUE,2216125,70.2393979805,428,NA,NA,2020-01-24T12:55:43.000-05:00
