Link,n_hits,all_links,category,id,url,hs_path,profile,permalink,created_at,sic_code,service_area,hours,products,services,brands,specialities,established,employee_cnt,payment_method,diplomas,licenses,memberships,liability_insurance,bonded,project_rate,project_minimum,written_contract,written_warranty,warranty_terms,parent_company_id,name,total_number_of_reviews_cache,total_number_of_approved_reviews_cache,number_of_photos_cache,avg_rating_cache,categories_info_cache,savings_count,subdomain,fraudulent,fraudulent_count,total_number_of_pending_reviews_cache,images_count,completion_percent_cache,bully,secret,replied_to_at_least_one_review_cache,latest_approved_review_created_at,has_set_tasks,lead_purchase_eligible,service_area_id,star_score,quote_button_category,direct_phone,direct_contact,claimed_at
https://homestars.com/on/stittsville/paint-wallpaper-contractors,34,"c(""https://homestars.com/on/stittsville/paint-wallpaper-contractors?&page=2&"", ""https://homestars.com/on/stittsville/paint-wallpaper-contractors?&page=3&"", ""https://homestars.com/on/stittsville/paint-wallpaper-contractors?&page=4&"")",Paint & Wallpaper Contractors,2873804,http://www.millerspainting.ca/,/companies/2873804-millers-painting?searched_category_id=409&service_area=2089408,"  At Millers Painting We know just how important your home or commercial property is to you and we are dedicated to providing a high quality paint job that will look great for years to come.

From our extreme detail on preparation down to the final finishing coat. Millers Painting takes great pride in our work. Our team of professionals offer many years of experience so nothing goes unnoticed. We spend 90% of our time on preparation. Without the right prep the product could fail and the end result wont be as fabulous. From patching your walls, priming, caulking baseboards, window, and door trim. Pole sanding your wall before painting and in between coats, to provide the smoothest looks and finish. For exterior work we scrape off old paint and sand.  We also restore or replace any old rotten wood. Pressure wash to make sure all dirt and debris is removed for maximum adhesion of paint and stain.
* References Available 
* Fully Insured $2,000,000 Residential and commercial
* WSIB $1,000,000
* Free estimates
* 5 Year warranty on interior repaints
* All employees are certified with, Working at Heights, Fall Safety, WHMIS, Background checks

Areas Served
Ottawa, Kemptville, Kanata, Barrhaven, Nepean, Manotick, Stittsville, Carp, Westboro, Riverside, Orleans, Cumberland, Gloucester, Brockville, Prescott, Spencerville,
",millers-painting,2015-07-20T22:31:22.000-04:00,NA,NA,7:30am - 6:00pm,,"Interior and exterior painting and stain for residential and commercial.  Roof painting, Stipple removal, Power washing, Gutter cleaning, Driveway sealing.","Dulux, Sherwin Williams, Benjamin Moore","Interior & exterior paint/stain, Deck & fence paint/stain, Roof painting, Stipple removal,
Power washing",11,5,"Visa, Mastercard, American Express, Cheque, E-transfer/Debit",,,,TRUE,TRUE,,550,TRUE,FALSE,5 year warranty on interior repaints,1936228,Millers Painting,56,49,67,9.65306,"Paint & Wallpaper Contractors, Paint Colors, Paint Store, Paint Brush, Paint Shop, Home Wallpaper,Wallpaper, Paint colour advice, paint colour consultants, wallpapering, painter, faux, painters painting, painters paint, business painting, find painting, painting and restoration, new jersey painting, oh painting, local painting, wall paper repair, ,",1,millers,FALSE,0,1,63,0,FALSE,1f889b837497c3715cbe3a294914d55e3aa5203f,TRUE,2022-11-15T13:30:06.000-05:00,TRUE,TRUE,2089408,94.0462907742,409,NA,NA,NA
https://homestars.com/on/stittsville/paint-wallpaper-contractors,34,"c(""https://homestars.com/on/stittsville/paint-wallpaper-contractors?&page=2&"", ""https://homestars.com/on/stittsville/paint-wallpaper-contractors?&page=3&"", ""https://homestars.com/on/stittsville/paint-wallpaper-contractors?&page=4&"")",Paint & Wallpaper Contractors,2878609,https://ottawapainter.com,/companies/2878609-ottawa-gatineau-painting?searched_category_id=409&service_area=2062382,"With House Painters in Ottawa You Get:
 
Affordable prices – we have some of the most competitive rates in Ottawa. When it comes to value for money, we can’t be beat.
 
Reliability – we complete the work within the estimated time, and there are no hidden costs. All of our painters are thoroughly vetted. You can feel that all of your possessions are safe at all times.
Quality And Satisfaction Guaranteed – our work is backed by our word and a satisfaction guarantee.
 
Ottawa Painting Services
We are dedicated to providing the highest level of service in and around Ottawa, including communities on both sides of the river. Being the capital of Canada, Ottawans are used to a certain level of service, and we have lived up to expectations time and again.
 
We offer commercial and residential painting services, including:
Interior and exterior painting/
exterior painting/
Epoxy floor painting/
Wall repair/
Home improvement services such as plastering and sheetrock installation/
Power washing/
And more
 
Call us or contact us on the web for your free quote. Fill out our form and we will be with you ASAP.",ottawa-gatineau-painting,2015-10-28T12:49:25.000-04:00,NA,NA,NA,,,,,NA,NA,,,,,TRUE,TRUE,,,TRUE,FALSE,,1941033,Peinture Ottawa Gatineau Painting,48,38,146,9.73684,"Paint & Wallpaper Contractors, Paint Colors, Paint Store, Paint Brush, Paint Shop, Home Wallpaper,Wallpaper, Paint colour advice, paint colour consultants, wallpapering, painter, faux, painters painting, painters paint, business painting, find painting, painting and restoration, new jersey painting, oh painting, local painting, wall paper repair, ,",0,peintureottawa,FALSE,0,0,140,0,FALSE,9e16a582bb9cfb7cfc5937deefb897c8e3d6e602,TRUE,NA,TRUE,TRUE,2062382,83.726458423,409,NA,NA,NA
https://homestars.com/on/stittsville/paint-wallpaper-contractors,34,"c(""https://homestars.com/on/stittsville/paint-wallpaper-contractors?&page=2&"", ""https://homestars.com/on/stittsville/paint-wallpaper-contractors?&page=3&"", ""https://homestars.com/on/stittsville/paint-wallpaper-contractors?&page=4&"")",Paint & Wallpaper Contractors,2974918,,/companies/2974918-cameron-sons-general-contracting-and-excavation?searched_category_id=409&service_area=2296326,,cameron-sons-general-contracting-and-excavation,2022-10-26T10:50:29.000-04:00,NA,NA,NA,,,,,NA,NA,,,,,FALSE,FALSE,,,FALSE,FALSE,,2036816,Cameron & sons General Contracting and Excavation,4,4,7,10,"Excavation, Excavation, Demolition, building construction, asphalt, demolition, trenching, excavator, excavators, what is excavation, excavating, excavations, excavate, excavated, earth moving, mini excavator, earthmoving, mini excavators, excavator sale, excavator for sale, excavators for sale, excavators sale, cat excavator, excavator cat, land clearing, excavator rental, rental excavator, backhoe excavator, cat excavators, micro excavator, hitachi excavator, caterpillar excavator, caterpillar excavators, excavator buckets, ,Handyman Services, Handyman, Home Handyman, Handyman Business, Repairmen, Repairman, house doctor, how to be a handyman, what is a handyman, the handyman, a handyman, handy man, the handy man, handy handyman, home repair, in home repair, handymen, the handymen, improvements home, home remodeling, home improvement remodeling, remodeling home improvement, hand man, kitchen and remodeling, home improvement and repair, home repair and improvement, home improvement repair, remodeling and repair, home remodeling and repair, home repair and remodeling, home repair remodeling, home remodeling repair, home improvements remodeling, repair house, house repair, house remodeling, house improvements, property maintenance, home maintenance, home repairs, in home repairs, repairman, services handyman, the handyman service, service handyman, handyman service, handy services, house repairs, repairs house, repair homes, service contractors, mr fix it, mud room, mudroom, caulking,Paint & Wallpaper Contractors, Paint Colors, Paint Store, Paint Brush, Paint Shop, Home Wallpaper,Wallpaper, Paint colour advice, paint colour consultants, wallpapering, painter, faux, painters painting, painters paint, business painting, find painting, painting and restoration, new jersey painting, oh painting, local painting, wall paper repair, ,",0,cameronsons,FALSE,0,0,8,0,FALSE,560861d242905d2bdf3027bc59b87bd7bf406bc7,TRUE,2022-11-22T08:15:05.000-05:00,TRUE,TRUE,2296326,90.2209847753,409,NA,NA,2022-10-26T11:01:10.000-04:00
https://homestars.com/on/stittsville/paint-wallpaper-contractors,34,"c(""https://homestars.com/on/stittsville/paint-wallpaper-contractors?&page=2&"", ""https://homestars.com/on/stittsville/paint-wallpaper-contractors?&page=3&"", ""https://homestars.com/on/stittsville/paint-wallpaper-contractors?&page=4&"")",Paint & Wallpaper Contractors,2973656,,/companies/2973656-propaintplus?searched_category_id=409&service_area=2293114,,propaintplus,2022-09-29T11:09:55.000-04:00,NA,NA,NA,,,,,NA,NA,,,,,FALSE,FALSE,,,FALSE,FALSE,,2035567,ProPaintPlus,3,3,0,10,"Paint & Wallpaper Contractors, Paint Colors, Paint Store, Paint Brush, Paint Shop, Home Wallpaper,Wallpaper, Paint colour advice, paint colour consultants, wallpapering, painter, faux, painters painting, painters paint, business painting, find painting, painting and restoration, new jersey painting, oh painting, local painting, wall paper repair, ,",0,propaintplus,FALSE,0,0,1,0,FALSE,ad336cd3ef631c63803f70304b51e5534cc5642d,TRUE,NA,TRUE,TRUE,2293114,84.0970179175,409,NA,NA,2022-09-29T11:12:12.000-04:00
https://homestars.com/on/stittsville/paint-wallpaper-contractors,34,"c(""https://homestars.com/on/stittsville/paint-wallpaper-contractors?&page=2&"", ""https://homestars.com/on/stittsville/paint-wallpaper-contractors?&page=3&"", ""https://homestars.com/on/stittsville/paint-wallpaper-contractors?&page=4&"")",Paint & Wallpaper Contractors,2658725,NA,/companies/2658725-benger-tim-painting-decorating-ltd?searched_category_id=409&service_area=1671929,NA,benger-tim-painting-decorating-ltd,2008-03-04T16:55:15.000-05:00,NA,NA,NA,NA,NA,NA,NA,NA,NA,NA,NA,NA,NA,FALSE,FALSE,NA,NA,FALSE,FALSE,NA,1721777,Benger Tim Painting & Decorating Ltd,0,0,0,NA,"Paint & Wallpaper Contractors, Paint Colors, Paint Store, Paint Brush, Paint Shop, Home Wallpaper,Wallpaper, Paint colour advice, paint colour consultants, wallpapering, painter, faux, painters painting, painters paint, business painting, find painting, painting and restoration, new jersey painting, oh painting, local painting, wall paper repair, ,",0,NA,FALSE,0,0,0,NA,FALSE,NA,FALSE,NA,FALSE,FALSE,1671929,0,409,NA,NA,NA
https://homestars.com/on/stittsville/paint-wallpaper-contractors,34,"c(""https://homestars.com/on/stittsville/paint-wallpaper-contractors?&page=2&"", ""https://homestars.com/on/stittsville/paint-wallpaper-contractors?&page=3&"", ""https://homestars.com/on/stittsville/paint-wallpaper-contractors?&page=4&"")",Paint & Wallpaper Contractors,2737430,NA,/companies/2737430-kanata-bead-craft-company?searched_category_id=409&service_area=1750634,NA,kanata-bead-craft-company,2008-03-04T16:55:15.000-05:00,NA,NA,NA,NA,NA,NA,NA,NA,NA,NA,NA,NA,NA,FALSE,FALSE,NA,NA,FALSE,FALSE,NA,1800482,Kanata Bead & Craft Company,0,0,0,NA,"Paint & Wallpaper Contractors, Paint Colors, Paint Store, Paint Brush, Paint Shop, Home Wallpaper,Wallpaper, Paint colour advice, paint colour consultants, wallpapering, painter, faux, painters painting, painters paint, business painting, find painting, painting and restoration, new jersey painting, oh painting, local painting, wall paper repair, ,",0,NA,FALSE,0,0,0,NA,FALSE,NA,FALSE,NA,FALSE,FALSE,1750634,0,409,NA,NA,NA
https://homestars.com/on/stittsville/paint-wallpaper-contractors,34,"c(""https://homestars.com/on/stittsville/paint-wallpaper-contractors?&page=2&"", ""https://homestars.com/on/stittsville/paint-wallpaper-contractors?&page=3&"", ""https://homestars.com/on/stittsville/paint-wallpaper-contractors?&page=4&"")",Paint & Wallpaper Contractors,2739651,NA,/companies/2739651-painted-pony-the?searched_category_id=409&service_area=1752855,NA,painted-pony-the,2008-03-04T16:55:15.000-05:00,NA,NA,NA,NA,NA,NA,NA,NA,NA,NA,NA,NA,NA,FALSE,FALSE,NA,NA,FALSE,FALSE,NA,1802703,Painted Pony (The),0,0,0,NA,"Paint & Wallpaper Contractors, Paint Colors, Paint Store, Paint Brush, Paint Shop, Home Wallpaper,Wallpaper, Paint colour advice, paint colour consultants, wallpapering, painter, faux, painters painting, painters paint, business painting, find painting, painting and restoration, new jersey painting, oh painting, local painting, wall paper repair, ,",0,NA,FALSE,0,0,0,NA,FALSE,NA,FALSE,NA,FALSE,FALSE,1752855,0,409,NA,NA,NA
https://homestars.com/on/stittsville/paint-wallpaper-contractors,34,"c(""https://homestars.com/on/stittsville/paint-wallpaper-contractors?&page=2&"", ""https://homestars.com/on/stittsville/paint-wallpaper-contractors?&page=3&"", ""https://homestars.com/on/stittsville/paint-wallpaper-contractors?&page=4&"")",Paint & Wallpaper Contractors,2769814,NA,/companies/2769814-proline-graphix-mobile-service?searched_category_id=409&service_area=1783018,NA,proline-graphix-mobile-service,2008-03-04T16:55:15.000-05:00,NA,NA,NA,NA,NA,NA,NA,NA,NA,NA,NA,NA,NA,FALSE,FALSE,NA,NA,FALSE,FALSE,NA,1832866,Proline Graphix Mobile Service,0,0,0,NA,"Paint & Wallpaper Contractors, Paint Colors, Paint Store, Paint Brush, Paint Shop, Home Wallpaper,Wallpaper, Paint colour advice, paint colour consultants, wallpapering, painter, faux, painters painting, painters paint, business painting, find painting, painting and restoration, new jersey painting, oh painting, local painting, wall paper repair, ,",0,NA,FALSE,0,0,0,NA,FALSE,NA,FALSE,NA,FALSE,FALSE,1783018,0,409,NA,NA,NA
