Link,n_hits,all_links,category,id,url,hs_path,profile,permalink,created_at,sic_code,service_area,hours,products,services,brands,specialities,established,employee_cnt,payment_method,diplomas,licenses,memberships,liability_insurance,bonded,project_rate,project_minimum,written_contract,written_warranty,warranty_terms,parent_company_id,name,total_number_of_reviews_cache,total_number_of_approved_reviews_cache,number_of_photos_cache,avg_rating_cache,categories_info_cache,savings_count,subdomain,fraudulent,fraudulent_count,total_number_of_pending_reviews_cache,images_count,completion_percent_cache,bully,secret,replied_to_at_least_one_review_cache,latest_approved_review_created_at,has_set_tasks,lead_purchase_eligible,service_area_id,star_score,quote_button_category,direct_phone,direct_contact,claimed_at
https://homestars.com/on/pelham/handyman-services,27,"c(""https://homestars.com/on/pelham/handyman-services?&page=2&"", ""https://homestars.com/on/pelham/handyman-services?&page=3&"")",Handyman Services,2814511,http://danpostman.homestars.com,/companies/2814511-dan-s-home-improvements?searched_category_id=374&service_area=2238059,"Dan's Home Improvements focuses on small jobs, they have been working in the painting and handyman industry for over 40 years.  Dan Postman offers interior and exterior painting, pressure washing, tiling, flooring, carpet cleaning, decks, fences, and complete home renovations.  Contact me today to discuss your project! ",dan-s-home-improvements,2013-09-10T23:02:13.000-04:00,NA,NA,NA,,"We offer interior and exterior painting, pressure washing, tiling, flooring, carpet cleaning, decks, fences, your complete home renovations, and more!  ",,,1970,NA,,,,,FALSE,FALSE,,,TRUE,FALSE,,1877456,Dan's Home Improvements,59,53,85,9.39623,"Handyman Services, Handyman, Home Handyman, Handyman Business, Repairmen, Repairman, house doctor, how to be a handyman, what is a handyman, the handyman, a handyman, handy man, the handy man, handy handyman, home repair, in home repair, handymen, the handymen, improvements home, home remodeling, home improvement remodeling, remodeling home improvement, hand man, kitchen and remodeling, home improvement and repair, home repair and improvement, home improvement repair, remodeling and repair, home remodeling and repair, home repair and remodeling, home repair remodeling, home remodeling repair, home improvements remodeling, repair house, house repair, house remodeling, house improvements, property maintenance, home maintenance, home repairs, in home repairs, repairman, services handyman, the handyman service, service handyman, handyman service, handy services, house repairs, repairs house, repair homes, service contractors, mr fix it, mud room, mudroom, caulking,Drywall Contractors, Dry Wall Repair, Dry Wall Installation, dry wall contracting, gypsum repair, gypsum installation, gypsum contractors, gyprock installers, gyprock intallation, dry wall installers, sheetrock, wall board, drywall, drywaller, waller, wall repair, drywall, plaster, how to drywall, drywall, what is drywall, sheetrock, dry wall, plastering, wall repair, drywall repair, how to repair drywall, repair drywall,  ,",0,danpostman,FALSE,0,0,90,0,FALSE,8d0dab3c7a9e3781fda55b3e2a1da134269ec723,TRUE,2019-09-12T18:28:54.000-04:00,TRUE,TRUE,2238059,91.1533479114,374,NA,NA,NA
https://homestars.com/on/pelham/handyman-services,27,"c(""https://homestars.com/on/pelham/handyman-services?&page=2&"", ""https://homestars.com/on/pelham/handyman-services?&page=3&"")",Handyman Services,2973117,,/companies/2973117-top2bottom-home-improvements?searched_category_id=374&service_area=2291850,We a truly a one stop shop. We can do everything from small minor repairs to full reno.  You can rest assured that all your needs whether big or small will be met by our capable experts. ,top2bottom-home-improvements,2022-09-15T20:16:08.000-04:00,NA,NA,NA,,,,,2016,6,"Cash, Cheques, e-Transfers",,,,TRUE,FALSE,,,TRUE,FALSE,,2035028,Top2Bottom Home Improvements ,2,2,149,10,"Handyman Services, Handyman, Home Handyman, Handyman Business, Repairmen, Repairman, house doctor, how to be a handyman, what is a handyman, the handyman, a handyman, handy man, the handy man, handy handyman, home repair, in home repair, handymen, the handymen, improvements home, home remodeling, home improvement remodeling, remodeling home improvement, hand man, kitchen and remodeling, home improvement and repair, home repair and improvement, home improvement repair, remodeling and repair, home remodeling and repair, home repair and remodeling, home repair remodeling, home remodeling repair, home improvements remodeling, repair house, house repair, house remodeling, house improvements, property maintenance, home maintenance, home repairs, in home repairs, repairman, services handyman, the handyman service, service handyman, handyman service, handy services, house repairs, repairs house, repair homes, service contractors, mr fix it, mud room, mudroom, caulking,Tile & Stone Contractors, Natural Stone Tile, Stone Floor Tile, Ceramic Tile, Floor tile, Tile installers, Stone installers, stone counter top installers, tile counter top installers, stone backsplash intallers, granite installers, marble installers, limestone installers, linoleum installers, slate contractors, slate installers,install tite ,backsplash , fire place veenerneed someone to install blacksplash , wall stone veener bath room mosaic,",0,,FALSE,0,0,154,0,FALSE,aaed8fc1ebc6e3a91f902886f59ba28843203033,TRUE,NA,TRUE,TRUE,2291850,90.8603253258,374,NA,NA,2022-09-15T20:16:56.000-04:00
https://homestars.com/on/pelham/handyman-services,27,"c(""https://homestars.com/on/pelham/handyman-services?&page=2&"", ""https://homestars.com/on/pelham/handyman-services?&page=3&"")",Handyman Services,2964187,,/companies/2964187-madeira-woodworking?searched_category_id=374&service_area=2273781,,madeira-woodworking,2022-01-31T16:50:03.000-05:00,NA,NA,NA,,,,,2018,NA,Cash | Cheques | E-Transfer,,Fully Licensed,,TRUE,FALSE,,,TRUE,FALSE,,2026119,Madeira Woodworking,3,3,50,10,"Handyman Services, Handyman, Home Handyman, Handyman Business, Repairmen, Repairman, house doctor, how to be a handyman, what is a handyman, the handyman, a handyman, handy man, the handy man, handy handyman, home repair, in home repair, handymen, the handymen, improvements home, home remodeling, home improvement remodeling, remodeling home improvement, hand man, kitchen and remodeling, home improvement and repair, home repair and improvement, home improvement repair, remodeling and repair, home remodeling and repair, home repair and remodeling, home repair remodeling, home remodeling repair, home improvements remodeling, repair house, house repair, house remodeling, house improvements, property maintenance, home maintenance, home repairs, in home repairs, repairman, services handyman, the handyman service, service handyman, handyman service, handy services, house repairs, repairs house, repair homes, service contractors, mr fix it, mud room, mudroom, caulking,Carpenters, carpenter, finish carpenter, local carpenter, carpenter work, carpenter companies, master carpenter, carpenters and joiners, carpentry, union carpenter, carpenter co, carpenter services, carpenter construction, interior framing, mud room, mudroom, playsets, playground, wooden playset, wooden playground, play set, caulking,,",0,madeira,FALSE,0,0,50,0,FALSE,7a501fdeefb5d0b2de1182e093bd0984657cd022,TRUE,NA,TRUE,TRUE,2273781,89.0067467828,374,NA,NA,2022-01-31T16:51:25.000-05:00
https://homestars.com/on/pelham/handyman-services,27,"c(""https://homestars.com/on/pelham/handyman-services?&page=2&"", ""https://homestars.com/on/pelham/handyman-services?&page=3&"")",Handyman Services,2929593,https://www.siliconeseals.ca,/companies/2929593-silicone-seals?searched_category_id=374&service_area=2275142,"At Silicone Seals, our goal is to make sure you get quality service for what you need.
 We specialize in a variety of services to take care of the big and small things your home needs.
 Whether you need sealant in your bathroom, or caulking around windows and doors, we got you covered.

We believe that our exceptional customer service, and quality work makes many happy customers. Contact us today to get a FREE QUOTE for your home.",silicone-seals,2019-04-06T12:14:30.000-04:00,NA,NA,NA,,"Our Primary Services:

- replacing caulking that is moldy and falling apart in your bathroom or kitchen

- caulking and sealing around masonry, concrete, decking/porch, and foundations

- draft sealing (foaming), using the highest quality low, medium, and high expansion foam and insulations, from todays leading manufactures. Let us get rid of those cold air drafts inside your home, and get you winter ready

- repairing or replacing caulking around windows and doors, using the highest grade of, silicone, polyurethane, acrylic or elastomeric sealants 

- caulking new windows and doors (new construction or installation) 

- Indoor and outdoor 

We also specialize in:
- repairing Interior water/moisture damage due to failed caulking or leaks, including drywall, ceiling, and floor repair.

- window and door trim repair.

- weather striping and threshold installation 

- stud and joist repair/replacing. Painting/repainting damaged or new surfaces. 

- epoxy and acrylic sealers over concrete, masonry, hardscaping and many other surfaces 

- restoring, staining and sealing wooden decks, fences, gazebos and docks 

- power washing and refreshing old masonry and concrete 

- we also offer grading and hardscaping as part of improving your homes water diversion, and prevent icing. Including, limestone screening, weed barrier, gravel, HPB, decorative river/quarry rock, interlocking, retaining wall, (both masonry, and lumber) and flag stone repairs and installation.","Sika, Adfast, AkFix ",,NA,3,"Cash, Cheque and e-transfer",,,,TRUE,FALSE,,,TRUE,FALSE,Yes. Kindly ask for details. Depends on project completed. ,1991767,Silicone Seals,30,29,44,10,"Handyman Services, Handyman, Home Handyman, Handyman Business, Repairmen, Repairman, house doctor, how to be a handyman, what is a handyman, the handyman, a handyman, handy man, the handy man, handy handyman, home repair, in home repair, handymen, the handymen, improvements home, home remodeling, home improvement remodeling, remodeling home improvement, hand man, kitchen and remodeling, home improvement and repair, home repair and improvement, home improvement repair, remodeling and repair, home remodeling and repair, home repair and remodeling, home repair remodeling, home remodeling repair, home improvements remodeling, repair house, house repair, house remodeling, house improvements, property maintenance, home maintenance, home repairs, in home repairs, repairman, services handyman, the handyman service, service handyman, handyman service, handy services, house repairs, repairs house, repair homes, service contractors, mr fix it, mud room, mudroom, caulking,",0,,FALSE,0,0,47,0,FALSE,d64f707abd64158d9f2e9ea7fe7b2a104676dd73,TRUE,2022-08-20T15:21:02.000-04:00,TRUE,TRUE,2275142,98.7718113303,374,NA,NA,2019-04-06T12:15:58.000-04:00
https://homestars.com/on/pelham/handyman-services,27,"c(""https://homestars.com/on/pelham/handyman-services?&page=2&"", ""https://homestars.com/on/pelham/handyman-services?&page=3&"")",Handyman Services,2948005,https://www.mrhandyman.ca/niagara-region/,/companies/2948005-mr-handyman-of-niagara-region?searched_category_id=374&service_area=2236873,"

ABOUT US
Mr. Handyman, a Neighbourly company, is closely monitoring COVID-19 (coronavirus) and its impact in our community. The health and safety of our customers is our highest priority during this time. While we cannot control the severity or unpredictability of this virus, we can take preventive measures to limit the spread and impact of COVID-19. We are currently acting with prudence in our day-to-day operation with basic preventative safety measures following the guidance set forth by the Canadian Government and your local provincial authorities, including:

Cleaning hands with soap often, for at least 20 seconds.
Using an alcohol-based hand sanitizer when soap and water are not available.
Keeping the recommended 2 metres from people.
Cleaning frequently touched surfaces.
Covering cough or sneeze with a tissue, then throwing tissue in the trash.
Staying home when sick.
We encourage our customers to let us know in advance of an appointment if there are any concerns or they would like us to take special precautions. We will continue to closely monitor the situation surrounding the COVID-19 coronavirus and act accordingly.

What can you do:

Follow tips from the Canadian Government to help prevent the spread of the seasonal flu and respiratory diseases like Coronavirus (COVID-19): Canadian Coronavirus website

If you have additional questions or concerns, please contact your local Mr. Handyman office.

The Safe, Guaranteed Solution to Your Home Repair and Maintenance Needs
Mr. Handyman, a Neighbourly company, was founded in 1996. We are your one-call solution for a wide range of home maintenance and repair needs. Our uniformed technicians are fully insured professionals, and our professionals always arrive on time, in uniform, and with a marked van with the tools to complete the job right.

Mr. Handyman technicians are highly skilled craftsmen with an average of 10 years’ experience in the trades. We’re home repair and improvement experts, and we are known for the quality of our workmanship and professional reliability, so you know the job will be done correctly and efficiently on the first visit.

Here are a few reasons why our customers recommend Mr. Handyman to their friends:

One simple call provides easy scheduling
Our quality workmanship is guaranteed
We promise to clean up when we’re done
Our repairmen are fully insured for your safety
We always arrive on time and well-prepared
Our technicians do every job right the first time
Wide variety of repair, maintenance and improvements services
Technicians have an average of 10 years’ experience in the trades
Who is Mr. Handyman?
Mr. Handyman isn't the guy offering home repair services from the back of his pickup truck. Mr. Handyman is your personal home improvement consultant and a trusted, knowledgeable resource that is part of a leading national service franchise. Our experienced, professional home repair and improvement technicians are skilled craftsmen with expertise in all trades. We’re so confident in our work that each job we do, whether a repair, installation, or assembly task, is backed by our Done Right Guarantee.

Our customers deserve hassle-free service. You don’t have time to spend on a service that’s less than reliable and dependable, and you shouldn’t let just anyone in your home. When you need professional handyman services you can trust and depend on to get it done right, you can count on Mr. Handyman.",mr-handyman-of-niagara-region,2020-09-24T10:07:56.000-04:00,NA,NA,NA,,,,"WHY HIRE US
Many homeowners will say that it is hard to find a reliable, professional home repair person. With over 100 locations across Canada and the United States, you can trust your local Mr. Handyman team of home improvement professionals to care for your home. There are many reasons why calling your local Mr. Handyman is the best choice for when you need house maintenance or repair tasks to be completed.

NATIONAL STANDARDS, LOCAL OWNERS
Mr. Handyman is a national franchise with strong ethics and service standards. We’ve been in business for 15+ years, and are committed to serving homeowners with old-fashioned and reliable service. We are one of the largest networks of home improvement contractors in Canada and the U.S. Mr. Handyman is locally-owned and operated and many of the franchise owners are actively involved in the local community.

WORRY-FREE EXPERIENCE
Mr. Handyman is consistently growing in the number of customers we serve across the country. Why? Maybe it’s because we have a responsive, professional approach to customer service, or because we hire quality technicians with an average 10 years’ experience in the field. Maybe it’s because our technicians are accountable to us and to you. Maybe it’s because Mr. Handyman technicians have a variety of skills for all types of work. We’re the go-to solution for homeowners who need skilled labour and reliability to get things done quickly and correctly. We also guarantee our workmanship so you can have peace of mind when you call us.

WHOLE HOME IMPROVEMENT TEAM
We’re not one guy, we’re a whole team. When you hire Mr. Handyman, you’ll work with an entire team of home improvement professionals beginning with your first phone call. From our friendly customer service representatives, to our highly skilled technicians and local franchise owners, you can expect an exceptional service experience from each team member you interact with.

PROFESSIONAL APPROACH
Live Call Answering

We strive to answer every single phone call that rings into our office, which means you won’t get an answering machine or wait hours for a call back. We have a friendly staff of office professionals to schedule appointments, make reminder calls, and help answer any questions you may have about how we work, or what to expect on the day of your service appointment.

Service Technicians

Mr. Handyman service technicians arrive in marked Mr. Handyman vans with a variety of tools and supplies for the job. We treat you and your home with respect—we even wear booties to protect your flooring and clean up when we’re finished. Mr. Handyman technicians are experienced with a variety of skills, so please don’t hesitate to ask for help with any repair, maintenance, or improvement project.",NA,NA,ALL Major Payment types Accepted. ,,,,TRUE,FALSE,,,TRUE,FALSE,Yes. Kindly ask for details. Depends on service provided. ,2010142,Mr. Handyman of Niagara Region,20,17,6,10,"Handyman Services, Handyman, Home Handyman, Handyman Business, Repairmen, Repairman, house doctor, how to be a handyman, what is a handyman, the handyman, a handyman, handy man, the handy man, handy handyman, home repair, in home repair, handymen, the handymen, improvements home, home remodeling, home improvement remodeling, remodeling home improvement, hand man, kitchen and remodeling, home improvement and repair, home repair and improvement, home improvement repair, remodeling and repair, home remodeling and repair, home repair and remodeling, home repair remodeling, home remodeling repair, home improvements remodeling, repair house, house repair, house remodeling, house improvements, property maintenance, home maintenance, home repairs, in home repairs, repairman, services handyman, the handyman service, service handyman, handyman service, handy services, house repairs, repairs house, repair homes, service contractors, mr fix it, mud room, mudroom, caulking,",0,,FALSE,0,0,6,0,FALSE,372e7133640a93d53a323dd86e209d5047c11a9b,TRUE,NA,TRUE,TRUE,2236873,96.0272771186,374,NA,NA,2020-09-24T10:09:15.000-04:00
https://homestars.com/on/pelham/handyman-services,27,"c(""https://homestars.com/on/pelham/handyman-services?&page=2&"", ""https://homestars.com/on/pelham/handyman-services?&page=3&"")",Handyman Services,2937771,https://www.starvinhandymanservices.com,/companies/2937771-starvin-handyman-services?searched_category_id=374&service_area=2212450,"Specializing in Renovations, General Contracting & Handyman, Lawn & Tree Maintenance, Painting, Roofing, Brick, Masonry & Concrete, Flooring, Excavation, Demolition & Waterproofing, Drywall, HVAC, Plumbing, Electrical, Carpentry, Crown Moulding & Trimwork, Fence, Deck, Railing, Eaves trough, Siding, Interlock, Appliance Repair & Installation, Windows & Doors, Insulation.",starvin-handyman-services,2019-12-03T17:10:12.000-05:00,NA,NA,NA,NA,NA,NA,NA,NA,NA,NA,NA,NA,NA,FALSE,FALSE,NA,NA,FALSE,FALSE,NA,1999945,Starvin' Handyman Services,2,2,9,5,"Handyman Services, Handyman, Home Handyman, Handyman Business, Repairmen, Repairman, house doctor, how to be a handyman, what is a handyman, the handyman, a handyman, handy man, the handy man, handy handyman, home repair, in home repair, handymen, the handymen, improvements home, home remodeling, home improvement remodeling, remodeling home improvement, hand man, kitchen and remodeling, home improvement and repair, home repair and improvement, home improvement repair, remodeling and repair, home remodeling and repair, home repair and remodeling, home repair remodeling, home remodeling repair, home improvements remodeling, repair house, house repair, house remodeling, house improvements, property maintenance, home maintenance, home repairs, in home repairs, repairman, services handyman, the handyman service, service handyman, handyman service, handy services, house repairs, repairs house, repair homes, service contractors, mr fix it, mud room, mudroom, caulking,",0,NA,FALSE,0,0,10,0,FALSE,72181cd456ae48d45449f4f2f83bef407ed700ee,TRUE,NA,TRUE,FALSE,2212450,39.0566927459,374,NA,NA,2019-12-03T17:10:43.000-05:00
https://homestars.com/on/pelham/handyman-services,27,"c(""https://homestars.com/on/pelham/handyman-services?&page=2&"", ""https://homestars.com/on/pelham/handyman-services?&page=3&"")",Handyman Services,2902594,NA,/companies/2902594-castle-consultant-and-handyman-services?searched_category_id=374&service_area=2134628,NA,castle-consultant-and-handyman-services,2017-09-23T14:33:05.000-04:00,NA,NA,NA,NA,NA,NA,NA,NA,NA,NA,NA,NA,NA,FALSE,FALSE,NA,NA,FALSE,FALSE,NA,1964779,Castle Consultant And Handyman Services ,0,0,0,NA,"Handyman Services, Handyman, Home Handyman, Handyman Business, Repairmen, Repairman, house doctor, how to be a handyman, what is a handyman, the handyman, a handyman, handy man, the handy man, handy handyman, home repair, in home repair, handymen, the handymen, improvements home, home remodeling, home improvement remodeling, remodeling home improvement, hand man, kitchen and remodeling, home improvement and repair, home repair and improvement, home improvement repair, remodeling and repair, home remodeling and repair, home repair and remodeling, home repair remodeling, home remodeling repair, home improvements remodeling, repair house, house repair, house remodeling, house improvements, property maintenance, home maintenance, home repairs, in home repairs, repairman, services handyman, the handyman service, service handyman, handyman service, handy services, house repairs, repairs house, repair homes, service contractors, mr fix it, mud room, mudroom, caulking,",0,NA,FALSE,0,0,0,0,FALSE,19c6aa398983ba9cd06ede5c5d80e0ae8b6d8794,FALSE,NA,TRUE,FALSE,2134628,0,374,NA,NA,2017-09-23T14:33:49.000-04:00
https://homestars.com/on/pelham/handyman-services,27,"c(""https://homestars.com/on/pelham/handyman-services?&page=2&"", ""https://homestars.com/on/pelham/handyman-services?&page=3&"")",Handyman Services,2939378,NA,/companies/2939378-lifestyle-home-improvements?searched_category_id=374&service_area=2216057,"Renovations, Repairs, Handyman Services",lifestyle-home-improvements,2020-01-23T19:58:34.000-05:00,NA,NA,NA,NA,NA,NA,NA,NA,NA,NA,NA,NA,NA,FALSE,FALSE,NA,NA,FALSE,FALSE,NA,2001552,Lifestyle Home Improvements ,0,0,0,NA,"Handyman Services, Handyman, Home Handyman, Handyman Business, Repairmen, Repairman, house doctor, how to be a handyman, what is a handyman, the handyman, a handyman, handy man, the handy man, handy handyman, home repair, in home repair, handymen, the handymen, improvements home, home remodeling, home improvement remodeling, remodeling home improvement, hand man, kitchen and remodeling, home improvement and repair, home repair and improvement, home improvement repair, remodeling and repair, home remodeling and repair, home repair and remodeling, home repair remodeling, home remodeling repair, home improvements remodeling, repair house, house repair, house remodeling, house improvements, property maintenance, home maintenance, home repairs, in home repairs, repairman, services handyman, the handyman service, service handyman, handyman service, handy services, house repairs, repairs house, repair homes, service contractors, mr fix it, mud room, mudroom, caulking,",0,NA,FALSE,0,0,0,0,FALSE,dbf20d676bae3c59c5e0b78d2a80b0018f585747,FALSE,NA,FALSE,FALSE,2216057,0,374,NA,NA,2020-01-23T20:00:25.000-05:00
