Link,n_hits,all_links,category,id,url,hs_path,profile,permalink,created_at,sic_code,service_area,hours,products,services,brands,specialities,established,employee_cnt,payment_method,diplomas,licenses,memberships,liability_insurance,bonded,project_rate,project_minimum,written_contract,written_warranty,warranty_terms,parent_company_id,name,total_number_of_reviews_cache,total_number_of_approved_reviews_cache,number_of_photos_cache,avg_rating_cache,categories_info_cache,savings_count,claimed_at,subdomain,fraudulent,fraudulent_count,total_number_of_pending_reviews_cache,images_count,completion_percent_cache,bully,secret,replied_to_at_least_one_review_cache,latest_approved_review_created_at,has_set_tasks,lead_purchase_eligible,service_area_id,star_score,quote_button_category,direct_phone,direct_contact
https://homestars.com/on/grant-town/kitchen-bathroom-cabinets-design,55,"c(""https://homestars.com/on/grant-town/kitchen-bathroom-cabinets-design?&page=2&"", ""https://homestars.com/on/grant-town/kitchen-bathroom-cabinets-design?&page=3&"", ""https://homestars.com/on/grant-town/kitchen-bathroom-cabinets-design?&page=4&"", ""https://homestars.com/on/grant-town/kitchen-bathroom-cabinets-design?&page=5&"", ""https://homestars.com/on/grant-town/kitchen-bathroom-cabinets-design?&page=6&"")",Kitchen & Bathroom - Cabinets & Design,2721303,http://www.homeimprovementpeople.com,/companies/2721303-home-improvement-people?searched_category_id=392&service_area=2126386,"The Home Improvement People have completed literally thousands of renovations since our inception. We are a unique award winning contracting company, consulted by various media as industry experts. 
Please view our website at homeimprovementpeople.com to view images of some of our projects. 
For our clients' convenience, we've implemented progress billing as well as financing.
Regardless of scope, we approach every single home renovation with a foundation of strong design aesthetics, comprehensive product options, sound project management, and a commitment to craftsmanship.
 
Our projects range from remodelled bathrooms and kitchens, to rear additions,  hardwood flooring, basements, second story additions and other extensive renovations. We undertake work in all budget ranges.
 
Choosing a reputable contractor is the most important decision you will make regarding your renovation. From plans and permits, to last little finishing details, The Home Improvement People is committed to completing your renovations and home improvements in a professional manner and to your complete satisfaction.
We take pride in our personalized service and our high quality workmanship. 
Call us for quality, insured work - completed on time, and on budget.
416-782-7605.",home-improvement-people,2008-03-04T16:55:15.000-05:00,NA,"Ajax,Cobourg,Mississauga,Stouffville Aurora,Courtice,Newmarket,Thornhill Barrie,Etobicoke,North York,Toronto Bolton,Georgetown,Oakville,Vaughan Brampton,Hamilton,Paris,Whitby Brantford ,Kitchener,Pickering Burlington,Maple,Richmond Hill, Willowdale, Caledon, Markham Scarborough,Woodbridge Cambridge,Milton,North York ",,,,,,2002,80,Visa/MC/Cheque,,All ,,TRUE,TRUE,,,TRUE,FALSE,3 years,1784355,Home Improvement People Inc.,663,502,234,9.80296,"General Contractors, Residential General Contractor, Building Contractor, Additions, Remodeling Contractor,  Renovation, Builder, building construction, renovation, remodeling, construction builders, construction company, construction companies, home repair, construction jobs, home remodeling, general contractors, contractors general, contractor general, contractors construction, construction contractors, home improvement and remodeling, kitchen remodeling, construction contractor, builders contractors, home renovation, general contracting, building contractors, building companies, home renovations, builder contractor, building contractor, remodeling contractor, commercial construction, residential construction, house contractor, concrete contractors, home contractors, general construction, construction general, contractors remodeling, remodeling contractors, remodelers, remodel contractor, remodel contractors, general contract, commercial contractors, renovations contractors, home improvement contractor, licensed contractor, license general contractor, mud room, mudroom, caulking, ,Design/Build, Contracting, Renovation, Remodeling, Restoration, Project Management, Renovation Assistance, Reno Management, architect, architects, design build, build & design, design and build, build by design, design to build. building construction, building a house, house designs, house plans, home designs, house plan, how to design a house, design house, house design, remodeling, building and design, design for building, design building, building by design, a building design, design of building, building design, design a building, building & design,  playsets, playground, wooden playset, wooden playground, play set, ,Basement Renovation, Basement renovation, Basement remodeling, Basement remodelling, renovating your basement, renovation, waterproofing, remodeling, home renovation, house renovation, water in basement, basement waterproofing,finishing basement, moistureproof, remodeling the house, caulking,Kitchen & Bathroom - Cabinets & Design, Kitchen Cabinet And Counter, Kitchen Cabinet Hardware, Bathroom Cabinet, Bathroom Wall Cabinet, Bathroom Sink Cabinet, cabinets, kitchens, cabinetry, kitchen and cabinets, cabinets for kitchen, about kitchen cabinets, kitchen cabinets, kitchen cabinets in, cabinets for the kitchen, cabinets and kitchen, cabinets kitchen, kitchen cabinet, cabinet kitchen, the kitchen cabinet, kitchen by design, design kitchen, a kitchen design, design a kitchen, design for kitchen, design and kitchen, design by kitchen, kitchen design, cabinetry kitchen, kitchen cabinetry, designs kitchen, kitchen designs, bathroom vanities, vanity and bathroom, bath and vanity, designer kitchen, ,Kitchen Planning & Renovation, Kitchen Planning And Design, Kitchen Cabinet Planning, Kitchen Design, Kitchen Remodeling, kitchen or, and bathroom, a and a kitchens, kitchens and, for kitchens, a kitchens, kitchens, the house design, cabinets for kitchen, cabinets for the kitchen, cabinets and kitchen, kitchen cabinets, design a kitchen, about kitchen design, a kitchen design, how to kitchen design, design and kitchen, the kitchen design, design for kitchen, kitchen designs, renovation and remodeling, remodeling and renovation, kitchen designer,,Kitchen Renovation, caulking, ,Condominium Renovations, Condo, Apartment, remodeling, renovations, kitchen cabinet, home decor, condo apartments, home improvement, home improvements, remodeling home, home remodeling, remodeling a home, new condo, Condo facelift, 
I ,Condo RenovationsRenovations for a new condo that include removing a drywall and creating an island and a full kitchen remodeling. ,Small rodent in Attic,Bathroom Renovation, Bathroom renovation, bathroom remodeling, bathroom remodelling, renovating the bathroom, tearing out the bathroom, fixing up the bathroom, bathroom contractors, bathroom vanities, bathroom vanity, design of bathroom, bathroom and design, design for bathroom, design a bathroom, design a bath, bath design, bathroom tile, bathroom cabinets, remodeling a bathroom, bathroom remodeling, remodeling the bathroom, ,Bath renovation, New tub, caulking, ,Builders, Home Builders, Home Contractors, residential builders, home construction companies, residential building contractor, builder, construction builders, local home builders, custom home builders, master builders, general builders, new home builders, building contractors, custom home builders, luxury home builders, ,Cabinetry & Millwork, Kitchen Cabinetry, Custom Cabinetry, Bathroom Cabinetry, Architectural Millwork, Millwork, custom millwork, bathroom cabinets, Kitchen cabinets, built-in cabinets, built-in cabinetry,  cabinet makers, custom cabinets kitchen, cabinetry, thomasville kitchen cabinets, cabinet doors, millwork cabinetry, custom kitchen cabinets, kraftmaid cabinets, maple cabinets, wood cabinets, stock cabinets, thermofoil cabinets, laminate cabinets, kitchen cabinets design, cherry cabinets, kitchen cabinet designs, hickory cabinets, wholesale cabinets, custom made cabinets, cabinet millwork, cabinets kitchen, kitchen cabinetry, millwork cabinets, ready to assemble cabinets, quality cabinets, bamboo cabinets, caulking,
,Home Additions, General contractor, home improvement, building addition, home expansion, house expansion, house building, plans house, house plans from, plans for house, the house plans, house plans, renovation, in house design, home plans house, home house plans, house home plans, house plans home, remodeling, house plans and designs, designs house plans, house designs plans, house plans designs, home plans and designs, home designs plans, floor plans, house build, renovations, plans for building, kitchen cabinets, remodel, kitchen design, house plans for building, house plans building, ,Design/Project Management, Drafters, Drafting, Project Management, Building, General Contracting, Renovation Management, Project Manager, Design Management.,",0,2017-04-05T10:18:55.000-04:00,TheHIP,FALSE,0,1,279,100,FALSE,7fbc45f3170f9c9c4247a2eca79f1488f75c5fa0,TRUE,2022-09-09T20:23:14.000-04:00,TRUE,TRUE,2126386,95.9525032698,392,NA,NA
https://homestars.com/on/grant-town/kitchen-bathroom-cabinets-design,55,"c(""https://homestars.com/on/grant-town/kitchen-bathroom-cabinets-design?&page=2&"", ""https://homestars.com/on/grant-town/kitchen-bathroom-cabinets-design?&page=3&"", ""https://homestars.com/on/grant-town/kitchen-bathroom-cabinets-design?&page=4&"", ""https://homestars.com/on/grant-town/kitchen-bathroom-cabinets-design?&page=5&"", ""https://homestars.com/on/grant-town/kitchen-bathroom-cabinets-design?&page=6&"")",Kitchen & Bathroom - Cabinets & Design,2807659,http://www.agmrenovations.com/,/companies/2807659-agm-renovations?searched_category_id=392&service_area=1959335,"AGM Renovations experts provide quality basement and Bathroom Renovation services throughout the GTA and the surrounding area. See our Service Area for the complete list of towns where our  renovation services are offered. We offer 100% satisfaction guarantee on our workmanship and offer competitive prices with exceptional quality.

Expect more and when you need the best; trust AGM Renovations. We guarantee that you will be completely satisfied, which means that you don't pay until you are satisfied.
Our mission is to be committed to excel in the work we do. We are committed to excel and maintain a sense of pride in our all we do! 

AGM Basements, Basement finishing, Basement Renovations, Basement Reno, Finishing Basements, Basement Company, Finished Basements, Basement Expert, Finished Basements Company, Bathroom Renovations, Bathroom remodeling.",agm-renovations,2013-03-21T13:05:30.000-04:00,NA,"Ajax, Aurora, Barrie, Bradford, Brampton, Brock, Brantford, Burlington, Etobicoke, Georgetown, Georgina, East Gwillimbury, West Gwillimbury, Halton Hills, Hamilton, King City, London, Maple, Markham, Milton, Mississauga, Newmarket, Oakville, Oshawa, Pickering, Richmond Hill, Scarborough, Scugog, Stoufville, Thornhill, Toronto, Uxbridge, Vaughan, Whitby, Woodbridge",,"AGM Renovations, Basement finishing, Basement Renovations, Basement Reno, Finishing Basements, Basement Company, Finished Basements, Basement Expert, Finished Basements Company, Bathroom Renovations","AGM Renovations offers Complete basement and Bathroom renovations packages from the professional design through the professional cleaning including:

Drywall- We employ only professional drywall installers and our goal is deliver complete satisfaction to each and every client with the quality of our workmanship and our prompt, reliable service.
    
Taping- Our drywall taping techniques will bring a high quality smooth finish, with a level of excellence you will take pride in.

Painting- We include all wall priming, painting of ceilings, baseboards, casing, crown and cove moldings into our basement construction packages
    
High Grade Laminate Flooring- is standard in our basement renovations packages.

Tiling- Shower, bathroom, or kitchenette tiling will be done by professional tile installers who are employed directly by AGM. A 2 year unlimited warranty is provided to you standard when you finish your basement with AGM
   
Plumbing- Our licensed plumbers will ensure that no problem is left unsolved and you can be sure that any drain or other plumbing defects left by the original house builder will be fixed effectively.

Electrical- We are committed to providing fully licensed electrician service as part of our standard package. Should you ever require an electrical certificate when you decide to sell your property, we will be happy to provide it to you

AGM Basements, Basement finishing, Basement Renovations, Basement Reno, Finishing Basements, Basement Company, Finished Basements, Basement Expert, Finished Basements Company",,"AGM Renovations - offers complete basement and Bathroom renovations packages from professional design to professional cleaning.

AGM Basements, Basement finishing, Basement Renovations, Basement Reno, Finishing Basements, Basement Company, Finished Basements, Basement Expert, Finished Basements Company",18,80,,,"Master Business Licence, Toronto Builder's licence","Built,",TRUE,TRUE,,,TRUE,FALSE,2 year unlimited warranty,1870659,AGM Renovations,611,477,79,9.3522,"Basement Renovation, Basement renovation, Basement remodeling, Basement remodelling, renovating your basement, renovation, waterproofing, remodeling, home renovation, house renovation, water in basement, basement waterproofing,finishing basement, moistureproof, remodeling the house, caulking,General Contractors, Residential General Contractor, Building Contractor, Additions, Remodeling Contractor,  Renovation, Builder, building construction, renovation, remodeling, construction builders, construction company, construction companies, home repair, construction jobs, home remodeling, general contractors, contractors general, contractor general, contractors construction, construction contractors, home improvement and remodeling, kitchen remodeling, construction contractor, builders contractors, home renovation, general contracting, building contractors, building companies, home renovations, builder contractor, building contractor, remodeling contractor, commercial construction, residential construction, house contractor, concrete contractors, home contractors, general construction, construction general, contractors remodeling, remodeling contractors, remodelers, remodel contractor, remodel contractors, general contract, commercial contractors, renovations contractors, home improvement contractor, licensed contractor, license general contractor, mud room, mudroom, caulking, ,Bathroom Renovation, Bathroom renovation, bathroom remodeling, bathroom remodelling, renovating the bathroom, tearing out the bathroom, fixing up the bathroom, bathroom contractors, bathroom vanities, bathroom vanity, design of bathroom, bathroom and design, design for bathroom, design a bathroom, design a bath, bath design, bathroom tile, bathroom cabinets, remodeling a bathroom, bathroom remodeling, remodeling the bathroom, ,Bath renovation, New tub, caulking, ,Kitchen Planning & Renovation, Kitchen Planning And Design, Kitchen Cabinet Planning, Kitchen Design, Kitchen Remodeling, kitchen or, and bathroom, a and a kitchens, kitchens and, for kitchens, a kitchens, kitchens, the house design, cabinets for kitchen, cabinets for the kitchen, cabinets and kitchen, kitchen cabinets, design a kitchen, about kitchen design, a kitchen design, how to kitchen design, design and kitchen, the kitchen design, design for kitchen, kitchen designs, renovation and remodeling, remodeling and renovation, kitchen designer,,Kitchen Renovation, caulking, ,Kitchen & Bathroom - Cabinets & Design, Kitchen Cabinet And Counter, Kitchen Cabinet Hardware, Bathroom Cabinet, Bathroom Wall Cabinet, Bathroom Sink Cabinet, cabinets, kitchens, cabinetry, kitchen and cabinets, cabinets for kitchen, about kitchen cabinets, kitchen cabinets, kitchen cabinets in, cabinets for the kitchen, cabinets and kitchen, cabinets kitchen, kitchen cabinet, cabinet kitchen, the kitchen cabinet, kitchen by design, design kitchen, a kitchen design, design a kitchen, design for kitchen, design and kitchen, design by kitchen, kitchen design, cabinetry kitchen, kitchen cabinetry, designs kitchen, kitchen designs, bathroom vanities, vanity and bathroom, bath and vanity, designer kitchen, ,",0,NA,agm,FALSE,0,1,80,NA,FALSE,a0b9b6e67166497359f0fe46f88ee02725bb0fb4,TRUE,2022-10-23T13:04:19.000-04:00,TRUE,TRUE,1959335,91.5863876034,392,NA,NA
https://homestars.com/on/grant-town/kitchen-bathroom-cabinets-design,55,"c(""https://homestars.com/on/grant-town/kitchen-bathroom-cabinets-design?&page=2&"", ""https://homestars.com/on/grant-town/kitchen-bathroom-cabinets-design?&page=3&"", ""https://homestars.com/on/grant-town/kitchen-bathroom-cabinets-design?&page=4&"", ""https://homestars.com/on/grant-town/kitchen-bathroom-cabinets-design?&page=5&"", ""https://homestars.com/on/grant-town/kitchen-bathroom-cabinets-design?&page=6&"")",Kitchen & Bathroom - Cabinets & Design,2798119,http://www.danthedrawerman.ca,/companies/2798119-dan-the-drawer-man?searched_category_id=392&service_area=1861626,"Based in York Region, Southern Ontario Dan ""The Drawer"" Man specializes in custom sliding drawers for existing cabinets in your home. Also known as pull out shelves, gliding shelves, roll out shelves, cabinet drawers or sliding shelves but whatever you call them, sliding drawers will organize your kitchen, pantry, linen closets, armoires or bathroom vanity’s and make your life a whole lot easier. You will never get on your hands and knees to get something out of your kitchen cabinets again! All of our sliding drawers for your kitchen storage, pantry and bathroom cabinets are strictly custom made by my hands to your existing cabinet’s dimensions. No alterations to your existing cabinets will be made. I offer high quality workmanship that is very strong and durable. Dan ""The Drawer"" Man will come out to your home with a sample and will create a layout for your personal style and budget. Not only will I come to your home to create a layout for you, I will personally construct and install the finished product in a very short period of time. I have done your homework for you – Dan ""The Drawer"" Man’s prices are about 50% lower than similar companies offering the same service. That is a huge saving for you. I keep my overhead very low and pass on the savings to you. I offer a high quality product, excellent service for a very, very reasonable price.
References available upon request
Many very satisfied customers
Fully customized to your request
100 lb Accuride full extention hardware included
Fast installation
Servicing Southern Ontario 
Satisfaction Guaranteed
Lifetime Warranty ",dan-the-drawer-man,2012-05-21T16:30:46.000-04:00,NA,"Aurora, East Gwillimbury, Georgina, King, Markham, Newmarket, Richmond Hill, Vaughan, Whitechurch-Stouffville, Toronto and GTA, Scarborough, Mississauga, Etobicoke, Oakville, Oshawa,Brampton",,,,,,2010,1,Cheque or Cash,,,Newmarket Chamber of Commerce,TRUE,TRUE,,,TRUE,FALSE,Life Time Warranty ,1861171,Dan The Drawer Man,212,200,28,10,"Kitchen & Bathroom - Cabinets & Design, Kitchen Cabinet And Counter, Kitchen Cabinet Hardware, Bathroom Cabinet, Bathroom Wall Cabinet, Bathroom Sink Cabinet, cabinets, kitchens, cabinetry, kitchen and cabinets, cabinets for kitchen, about kitchen cabinets, kitchen cabinets, kitchen cabinets in, cabinets for the kitchen, cabinets and kitchen, cabinets kitchen, kitchen cabinet, cabinet kitchen, the kitchen cabinet, kitchen by design, design kitchen, a kitchen design, design a kitchen, design for kitchen, design and kitchen, design by kitchen, kitchen design, cabinetry kitchen, kitchen cabinetry, designs kitchen, kitchen designs, bathroom vanities, vanity and bathroom, bath and vanity, designer kitchen, ,Bathroom & Kitchen - Fixtures & Accessories, bathroom fixtures, kitchen fixtures, kitchen accessories, bathroom accessories, sink, faucet, tub, bathtub, shower, taps, kitchen reno, grouting, cabinet refinishing, custom cabinets, appliances, new appliances, kitchen island, waterfall island,,",0,NA,danthedrawerman,FALSE,0,0,57,100,FALSE,2b669d7d00edab24c2dc6fdcbe979bf0160b834d,TRUE,2022-05-20T11:18:44.000-04:00,TRUE,TRUE,1861626,99.853356831,392,NA,NA
