Link,n_hits,all_links,category,id,url,hs_path,profile,permalink,created_at,sic_code,service_area,hours,products,services,brands,specialities,established,employee_cnt,payment_method,diplomas,licenses,memberships,liability_insurance,bonded,project_rate,project_minimum,written_contract,written_warranty,warranty_terms,parent_company_id,name,total_number_of_reviews_cache,total_number_of_approved_reviews_cache,number_of_photos_cache,avg_rating_cache,categories_info_cache,savings_count,fraudulent,fraudulent_count,total_number_of_pending_reviews_cache,images_count,completion_percent_cache,bully,secret,replied_to_at_least_one_review_cache,has_set_tasks,lead_purchase_eligible,service_area_id,star_score,quote_button_category,direct_phone,direct_contact,claimed_at
https://homestars.com/on/laval/kitchen-bathroom-cabinets-design,3,https://homestars.com/on/laval/kitchen-bathroom-cabinets-design,Kitchen & Bathroom - Cabinets & Design,2878300,NA,/companies/2878300-solution-plan?searched_category_id=392&service_area=2061270,"At Solution Plan, we find great satisfaction in transforming your vision of ‘the perfect kitchen’ into the attractive, smart and highly practical kitchen you deserve. Our strength is in understanding our clients’ visions and putting them into great looking, functional designs with high-quality materials. 
",solution-plan,2015-10-21T05:01:42.000-04:00,NA,NA,NA,NA,NA,NA,NA,NA,NA,NA,NA,NA,NA,FALSE,FALSE,NA,NA,FALSE,FALSE,NA,1940724,Solution Plan,0,0,0,NA,"Kitchen & Bathroom - Cabinets & Design, Kitchen Cabinet And Counter, Kitchen Cabinet Hardware, Bathroom Cabinet, Bathroom Wall Cabinet, Bathroom Sink Cabinet, cabinets, kitchens, cabinetry, kitchen and cabinets, cabinets for kitchen, about kitchen cabinets, kitchen cabinets, kitchen cabinets in, cabinets for the kitchen, cabinets and kitchen, cabinets kitchen, kitchen cabinet, cabinet kitchen, the kitchen cabinet, kitchen by design, design kitchen, a kitchen design, design a kitchen, design for kitchen, design and kitchen, design by kitchen, kitchen design, cabinetry kitchen, kitchen cabinetry, designs kitchen, kitchen designs, bathroom vanities, vanity and bathroom, bath and vanity, designer kitchen, ,",0,FALSE,0,0,0,0,FALSE,86e9e4c4407a26ba39321ec45f9e96f51aac8e30,FALSE,FALSE,FALSE,2061270,0,392,NA,NA,NA
https://homestars.com/on/laval/kitchen-bathroom-cabinets-design,3,https://homestars.com/on/laval/kitchen-bathroom-cabinets-design,Kitchen & Bathroom - Cabinets & Design,2664158,NA,/companies/2664158-club-cuisine-salle-de-bain-bcbg-inc?searched_category_id=392&service_area=1677362,"Compagnie d’armoires de cuisine située à Laval. Nos designers exceptionnelles vous attendent dans notre magnifique salle de montre. Vaste choix d’échantillons, de matériaux et de couleurs. Service hors pair par notre équipe professionnelle. Multiple gagnant du choix du consommateur. L’endroit à découvrir avant d’acheter.",club-cuisine-salle-de-bain-bcbg-inc,2008-03-04T16:55:15.000-05:00,NA,NA,9:00 am ,NA,NA,NA,NA,NA,NA,NA,NA,NA,NA,FALSE,FALSE,NA,NA,FALSE,FALSE,NA,1727210,Club Cuisine & Salle De Bain Bcbg Inc,0,0,0,NA,"Kitchen & Bathroom - Cabinets & Design, Kitchen Cabinet And Counter, Kitchen Cabinet Hardware, Bathroom Cabinet, Bathroom Wall Cabinet, Bathroom Sink Cabinet, cabinets, kitchens, cabinetry, kitchen and cabinets, cabinets for kitchen, about kitchen cabinets, kitchen cabinets, kitchen cabinets in, cabinets for the kitchen, cabinets and kitchen, cabinets kitchen, kitchen cabinet, cabinet kitchen, the kitchen cabinet, kitchen by design, design kitchen, a kitchen design, design a kitchen, design for kitchen, design and kitchen, design by kitchen, kitchen design, cabinetry kitchen, kitchen cabinetry, designs kitchen, kitchen designs, bathroom vanities, vanity and bathroom, bath and vanity, designer kitchen, ,",0,FALSE,0,0,0,NA,FALSE,975a4df437e817618814a20ea7ce01aa0756f569,FALSE,FALSE,FALSE,1677362,0,392,NA,NA,2014-10-28T11:12:15.000-04:00
https://homestars.com/on/laval/kitchen-bathroom-cabinets-design,3,https://homestars.com/on/laval/kitchen-bathroom-cabinets-design,Kitchen & Bathroom - Cabinets & Design,2923560,https://boiseriesgms.com,/companies/2923560-boiseries-gms?searched_category_id=392&service_area=2179912,"For over 20 years, Boiseries GMS have been making custom kitchen cabinets, bathroom vanities, staircases, doors and moldings in our Laval factory.

We're open to both the trade and general public.",boiseries-gms,2018-11-01T14:04:57.000-04:00,NA,NA,NA,NA,NA,NA,NA,NA,NA,NA,NA,NA,NA,FALSE,FALSE,NA,NA,FALSE,FALSE,NA,1985734,Boiseries Gms,0,0,12,NA,"Kitchen & Bathroom - Cabinets & Design, Kitchen Cabinet And Counter, Kitchen Cabinet Hardware, Bathroom Cabinet, Bathroom Wall Cabinet, Bathroom Sink Cabinet, cabinets, kitchens, cabinetry, kitchen and cabinets, cabinets for kitchen, about kitchen cabinets, kitchen cabinets, kitchen cabinets in, cabinets for the kitchen, cabinets and kitchen, cabinets kitchen, kitchen cabinet, cabinet kitchen, the kitchen cabinet, kitchen by design, design kitchen, a kitchen design, design a kitchen, design for kitchen, design and kitchen, design by kitchen, kitchen design, cabinetry kitchen, kitchen cabinetry, designs kitchen, kitchen designs, bathroom vanities, vanity and bathroom, bath and vanity, designer kitchen, ,",0,FALSE,0,0,13,0,FALSE,b664a772f9c69ff6618a946a4c81200a196c602c,FALSE,TRUE,FALSE,2179912,0,392,NA,NA,2018-11-01T14:05:20.000-04:00
