Link,n_hits,all_links,category,id,url,hs_path,profile,permalink,created_at,sic_code,service_area,hours,products,services,brands,specialities,established,employee_cnt,payment_method,diplomas,licenses,memberships,liability_insurance,bonded,project_rate,project_minimum,written_contract,written_warranty,warranty_terms,parent_company_id,name,total_number_of_reviews_cache,total_number_of_approved_reviews_cache,number_of_photos_cache,avg_rating_cache,categories_info_cache,savings_count,claimed_at,subdomain,fraudulent,fraudulent_count,total_number_of_pending_reviews_cache,images_count,completion_percent_cache,bully,secret,replied_to_at_least_one_review_cache,latest_approved_review_created_at,has_set_tasks,lead_purchase_eligible,service_area_id,star_score,quote_button_category,direct_phone,direct_contact
https://homestars.com/on/mayfield/concrete-contractors,62,"c(""https://homestars.com/on/mayfield/concrete-contractors?&page=2&"", ""https://homestars.com/on/mayfield/concrete-contractors?&page=3&"", ""https://homestars.com/on/mayfield/concrete-contractors?&page=4&"", ""https://homestars.com/on/mayfield/concrete-contractors?&page=5&"", ""https://homestars.com/on/mayfield/concrete-contractors?&page=6&"", ""https://homestars.com/on/mayfield/concrete-contractors?&page=7&"")",Concrete Contractors,2775549,https://www.aamasonry.ca,/companies/2775549-a-a-masonry?searched_category_id=337&service_area=2291052,"Award Winning Specialists!
416-236-8721

A&A Masonry is an award-winning Toronto based firm specializing in almost everything exterior.  Specialties include Stone work, Interlock, Interlocking, Paver stones, paving stones, Natural Stone, Pavers, Stone Veneer Cladding, Tuckpointing, Masonry, brick repair, brick restoration, tuck pointing, waterproofing, foundation repairs, concrete steps, porches, walkways, caulking services (windows & doors), chimney repair and general exterior restorations for residential, commercial and industrial customers.

A&A is dedicated to providing the highest quality on every job. With a proud team of qualified artisans, we strive to complete every project in a timely and safe manner.

Our mission is to offer a unique and reliable service in anything Exterior within the Greater Toronto Area, differentiating ourselves from the competition by means of always delivering what we promise, on time and on budget.

Our commitment to excellence is our core value.
Customer satisfaction is our main goal, and we reach it every day by relying on our attention to customer service. By providing customized solutions for every job, we guarantee that we will never compromise on quality, safety and efficiency.

This approach together with our experience and knowledge allows us to effectively handle a wide variety of projects, from small to big, indoors or outdoors, renovations or repairs. 

We service:  Toronto, Etobicoke, Mississauga, Thornhill, Richmond Hill, York, North York, East York, Mimico, Hamilton, Brampton, Bolton and surrounding areas. 

For FREE ESTIMATE CALL: 416-236-8721

Being Masonry Contractors, Concrete Contractors, Stone  Contractors & Waterproofing Contractors we specialize in:
Stone work, Interlocking Natural Stone & Pavers, Stone Veneer Cladding, Tuckpointing, Tuck Pointing, Chimney Repair, Chimney Rebuild, Chimney Restoration, tuckpointing, Brickwork, Brick Repair, Brick Replacement, Parging, Waterproofing, Foundation Repair, Concrete Resurfacing, Concrete Porches, Concrete Steps, Patios and Walkways, Flagstone, Cultured Stone, Caulking services (windows and doors), Masonry, Masonry repair, steps, concrete porches, concrete walkways and patios, caulking services.

For the Hamilton area please visit out Hamilton websites
https://hamiltonmasonry.ca
https://hamiltonconcrete.ca
https://hamiltonwaterproofing.ca 

Licenses- 
City of Toronto license # T85-4429645
City of Mississauga license # 2022 005912 BR
Town of Oakville license # 22-114336
City Hamilton license # 20 298360 01 MA; No. 20 298361 01 CL
City of Brampton license # DW0062 21",a-a-masonry,2009-06-27T12:37:38.000-04:00,NA,"Toronto, Etobicoke, Mississauga, 
<br />Oakville, Bolton, Brampton, Caledon, Hamilton
<br />Thornhill, Richmond Hill, York, North York, East York, Mimico and surrounding areas. ",,,"Natural stone and stone veneer contractor, Interlocking Stone & Pavers, Hardscaping, Stone Fireplace, Brick Fireplace, Tuckpointing, Chimney Repair, Chimney Rebuild, Chimney Restoration, tuck pointing, Brickwork, Brick Repair, Brick Replacement, Parging, Foundation Repair, Concrete, Porches, Concrete Steps, Concrete Resurfacing, Patios and Concrete Walkways, Flagstone, Cultured Stone, Caulking services (windows and doors), Masonry, Masonry repair, Water Proofing, ",A&A Masonry,"Stone veneer cladding, Interlock, Interlocking Stone, Paver stones, Paving stones,  Stone Installation, Hardscaping, chimney rebuild and repair, tuckpointing, waterproofing, water proofing, foundation repair, concrete steps, concrete porches, concrete walkways, concrete patios.",2009,NA,check,,"Yes, All Applicable - See Profile Description For Full Details",BBB Accredited Business,TRUE,TRUE,,"Masonry $2800, Concrete $5000, Interlocking $3500",TRUE,FALSE,,1838601,A&A Masonry,875,745,73,9.93826,"Foundations, foundation repair, foundation pouring, foundation, the foundation, foundations, foundation for home, home foundation, foundation of home, foundation home, the home foundation, foundation house, house foundation, foundation of a house, foundation for a house, building foundation, homes foundation, foundation for homes, foundation homes, foundations home, foundations house, house foundations, foundations for homes, home foundation repair, building home foundation, manufactured homes foundation, types of home foundations, home foundations types, home foundation problems, mobile home foundations, home building foundations, home foundation cracks, cracks in home foundation, new home foundations, home foundation design, foundation design, foundation cracks, underpinning, ,Historical Restoration, heritage restoration, historical restoration, restorers, old houses, historic, preservation, historic buildings, buildings historic, historic district, historic property, historical homes, restoration homes, historic homes for sale, historical properties, repair contractors, repair contractor, brick repair, restoration company, historical preservation, restoration co, historical architecture, restoration contractors, building restoration, restoration building, masonry repair, restoration homes, homes restoration, restoration construction, construction restoration, historic restoration, historical conservation, building preservation, restoration brick, brick restoration, masonry restoration, restoration masonry, restoration corporation, antique buildings, restoration of buildings, ,Chimney Build & Repair, Chimney repairs, Chimney Building, Chimney maintenance, Chimney sweeping, chimney cleaning, chimney, fireplace and chimney, chimney sweep, chimney cleaning how to, chimney cleaning, chimney repair, repair chimney, chimney clean, chimney cleaners, brick chimney, chimney service, chimney cleaner, new chimney, chimney repair service, build chimney, chimney build, chimney restoration, fireplace chimney cleaning, fireplace chimney repair, chimney cleaning repair, chimney building, chimney building how to, ,Interlocking Stone, Interlocking Tile, Stone, tiles for, landscaping, paving, pavers, paver, stone step, wall stone, stone wall, landscape design, patios, interlock, retaining wall, stepping stones, interlocking, landscaping ideas, retaining walls, paving stones, paver stones, pavers stones, pavers and stones, stones pavers, stones and pavers, flagstone, concrete design, landscapers, natural stone, paving stone, stone paving, stone paving stone, walls stone, patio designs, stone and tiles, tiles and stone, stone flagstones, slate tiles, slate tile, stone veneer, pavers stone, stone and pavers, stone pavers, paver stone, stone paver, concrete driveway, stone brick, stone and brick, brick and stone, stone flooring, stone patio, stone for patio,,Tuck Pointing, Chimney Repair, Chimney Bricklaying, Chimney Masonry Repair, Chimney Sweeps, repointing, pointing, Chimney and Tuck Pointing, ,Concrete Contractors, Impressed concrete, poured concrete, stamped concrete, radiant heating, concrete floors, contractors, concrete repair, concrete in, masonry, asphalt, paving, pavers, in the driveway, driveway, construction companies, driveways, block of concrete, concrete block, concrete mix, concret, concrete blocks, concrete slab, cost of concrete, concrete cost, concrete wall, price of concrete, concrete price, concrete stain, stamped concrete, concrete prices, repair concrete, how to repair concrete, repair of concrete, concrete repair, concrete slabs, decorative concrete, concrete decorative, staining concrete, concrete staining, concrete walls, countertop concrete, concrete countertops, patio ideas, cement companies, ready mix concrete, concrete ready mix, slabjack, slabjacking, mudjack, mudjacking, Driveway, caulking,,Masonry & Bricklaying, Masonry Supply, Masonry Contractor, Stone Masonry, Brick Laying, Technique, Brick Laying Pattern, stone wall, brick wall, masonry repair, brick repairs, masonry, brick masonry, masonry bricklaying, masonry work, mason contractors, york masonry, masonry companies, brick masonry construction, brick contractors, masonry brick laying, masonry workers, bricklaying firms, parging, ,Waterproofing, Basement Waterproofing, Foundation Waterproofing, Waterproofing Contractor, Water, Waterproof, Wet Basement, Leaky Basement, Flood, Flooded Basement, Flooding ,Waterproofing, Basement leaks, underpinning, caulking,,",2,2009-06-27T12:37:37.000-04:00,aaconcrete,FALSE,0,0,62,100,FALSE,a5c33dc0b1e833fd530fc249a4facab54f125529,TRUE,2022-11-08T12:02:52.000-05:00,TRUE,TRUE,2291052,99.1848266106,337,NA,NA
https://homestars.com/on/mayfield/concrete-contractors,62,"c(""https://homestars.com/on/mayfield/concrete-contractors?&page=2&"", ""https://homestars.com/on/mayfield/concrete-contractors?&page=3&"", ""https://homestars.com/on/mayfield/concrete-contractors?&page=4&"", ""https://homestars.com/on/mayfield/concrete-contractors?&page=5&"", ""https://homestars.com/on/mayfield/concrete-contractors?&page=6&"", ""https://homestars.com/on/mayfield/concrete-contractors?&page=7&"")",Concrete Contractors,2564263,http://www.ottosmasonry.ca,/companies/2564263-otto-s-masonry?searched_category_id=337&service_area=1828016,"Internal waterproofing, masonry & bricklaying, tuckpointing, parging, chimney rebuild and repair, concrete, stone porches and much more.

Call (416) 467-1717 for a free estimate! Over 30 years doing concrete, chimneys, fireplaces, tuckpointing, bricklaying, porches...and everything masonry.",otto-s-masonry,2008-02-27T16:42:23.000-05:00,NA,Toronto (416 area code only).,"Mon to Sat, 8 am- 5 pm",,"Waterproofing, Tuckpointing, brick repair, brick replacement, chimney rebuild or repair, walkways, driveways, concrete steps/stairs, porches, window sills, flagstone installation.",We work with a lot of Banas stone and will use a variance of brands on brickwork to get the best match we can on your home.,"We specialize in waterproofing, tuckpointing, concrete porches and stone work. ",NA,NA,"We ask for a downpayment for big jobs, and we expect payment upon satisfactory completion of job",,Metro Licence: T85-3959154,,TRUE,FALSE,,,FALSE,FALSE,3 to 4 years on complete new builds.,1627315,Otto's Masonry,404,375,105,9.864,"Tuck Pointing, Chimney Repair, Chimney Bricklaying, Chimney Masonry Repair, Chimney Sweeps, repointing, pointing, Chimney and Tuck Pointing, ,Chimney Build & Repair, Chimney repairs, Chimney Building, Chimney maintenance, Chimney sweeping, chimney cleaning, chimney, fireplace and chimney, chimney sweep, chimney cleaning how to, chimney cleaning, chimney repair, repair chimney, chimney clean, chimney cleaners, brick chimney, chimney service, chimney cleaner, new chimney, chimney repair service, build chimney, chimney build, chimney restoration, fireplace chimney cleaning, fireplace chimney repair, chimney cleaning repair, chimney building, chimney building how to, ,Masonry & Bricklaying, Masonry Supply, Masonry Contractor, Stone Masonry, Brick Laying, Technique, Brick Laying Pattern, stone wall, brick wall, masonry repair, brick repairs, masonry, brick masonry, masonry bricklaying, masonry work, mason contractors, york masonry, masonry companies, brick masonry construction, brick contractors, masonry brick laying, masonry workers, bricklaying firms, parging, ,Concrete Contractors, Impressed concrete, poured concrete, stamped concrete, radiant heating, concrete floors, contractors, concrete repair, concrete in, masonry, asphalt, paving, pavers, in the driveway, driveway, construction companies, driveways, block of concrete, concrete block, concrete mix, concret, concrete blocks, concrete slab, cost of concrete, concrete cost, concrete wall, price of concrete, concrete price, concrete stain, stamped concrete, concrete prices, repair concrete, how to repair concrete, repair of concrete, concrete repair, concrete slabs, decorative concrete, concrete decorative, staining concrete, concrete staining, concrete walls, countertop concrete, concrete countertops, patio ideas, cement companies, ready mix concrete, concrete ready mix, slabjack, slabjacking, mudjack, mudjacking, Driveway, caulking,,",0,2008-02-27T16:42:23.000-05:00,ottosmasonry,FALSE,0,0,95,100,FALSE,7d925046e35a6214f6e57af2ee1d6173f654b51f,TRUE,2022-10-31T19:42:30.000-04:00,TRUE,TRUE,1828016,98.8124376079,337,NA,NA
https://homestars.com/on/mayfield/concrete-contractors,62,"c(""https://homestars.com/on/mayfield/concrete-contractors?&page=2&"", ""https://homestars.com/on/mayfield/concrete-contractors?&page=3&"", ""https://homestars.com/on/mayfield/concrete-contractors?&page=4&"", ""https://homestars.com/on/mayfield/concrete-contractors?&page=5&"", ""https://homestars.com/on/mayfield/concrete-contractors?&page=6&"", ""https://homestars.com/on/mayfield/concrete-contractors?&page=7&"")",Concrete Contractors,2879877,https://tornado-plumbing.com/,/companies/2879877-tornado-plumbing?searched_category_id=337&service_area=2067689,"At Tornado Plumbing we work hard to fulfill all your plumbing needs, and offer some of the best service in the GTA. Our products are high quality, and all of our work is under warranty. By using the most recent technology we can offer you the best service to ensure your plumbing work is done efficiently and with quality. We provide free estimates, competitive rates, and city rebates are available.
Our services include waterproofing, pipe burst, plumbing repairs, backwater valve, concrete work, water service and repairs, drain camera inspections, drain snaking, and underpinning (basement lowering).
With appointments booked at your convenience, and 24 hour emergency service, you’re sure to get the job done with Tornado Plumbing.

Check us out here:
https://www.facebook.com/TornadoPlumbingCom
https://twitter.com/TornadoPlumbing
https://www.instagram.com/tornado_plumbing/

YouTube videos on various plumbing and drain services may be found in our photo gallery.

",tornado-plumbing,2015-11-24T22:06:11.000-05:00,NA,NA,NA,,"Waterproofing
Our skilled crews take all the necessary steps to clean and prepare your foundation wall prior to waterproofing.
We only use materials of the highest industry standard to seal your home from leaks.
With a 25 year warranty, you are guaranteed a dry basement and piece of mind.

Drains
When you need to replace your damaged sewer lines, we meet all city standards for drain work and backwater valves.
Using the minimally invasive pipe burst method, we can have your drains running again quickly.

Water Service
Using trench-less technology we can quickly replace your lead waterline or
upgrade your current water service, causing minimal damage to your property

Plumbing
We can take care of all your plumbing needs no matter the size.
Fixing small leaks to full plumbing line replacement, and everything in between.

Concrete work
From walkways to patio slabs we’ve got all your concrete needs covered.

Underpinning & Walkouts
If you’re looking for more living space, we can lower your basement to your desired height or add a second entrance.
Using approved engineer drawings, and following building codes, we will create the basement you want.

24/7 EMERGENCY SERVICE",,Ask about the City Rebates for Sump Pumps and Back Water Valves,2014,NA,ALL Major Payment types Accepted. ,Ontario College of Trades and Apprenticeships   (Plumbing)  ,"Drain Layer, Drain Contractor, Building Renovator.  See photo gallery. ",,TRUE,FALSE,,,TRUE,FALSE,25 years Labour and Warranty. Kindly ask for more details. ,1942301,Tornado Plumbing & Drains,406,366,2596,9.89891,"Drain Services, blocked drain, clogged drain, overflowing drain, roots in drain, sewage back up into house, drain repair, drain, plumber, plumbers, drains, sewer, drainage, clogged, septic tank, drain and sewer, sewer drain, sewer and drain, plumbing supplies, plummer, rooter rooter, plumbing and heating, heating and plumbing, plumbing heating, drain pipe, cleaning drain, cleaning the drain, drain cleaning, plumber heating, septic systems, cleaning drains, drain cleaner, water drainage, drain pipes, clean drain, drain clean, drainage pipe, plumbing service, service plumbing, drain cleaners, plumbing company, plumbing services, services plumbing, french drain, drainage systems, drainage pipes, septic plumbing, shower drains, drain systems, sewer line, french drains, caulking,,Foundations, foundation repair, foundation pouring, foundation, the foundation, foundations, foundation for home, home foundation, foundation of home, foundation home, the home foundation, foundation house, house foundation, foundation of a house, foundation for a house, building foundation, homes foundation, foundation for homes, foundation homes, foundations home, foundations house, house foundations, foundations for homes, home foundation repair, building home foundation, manufactured homes foundation, types of home foundations, home foundations types, home foundation problems, mobile home foundations, home building foundations, home foundation cracks, cracks in home foundation, new home foundations, home foundation design, foundation design, foundation cracks, underpinning, ,Plumbing, Plumber, Plumbers, Plumbing Contractor, Plumbing Repair, toilet repair, fixing toilet, fixing sink, broken faucet, faucet repair, tap repair, leaking toilet, leaking sink, leaking pipes, drain snaking, at plumbing, plumbing in, what is plumbing, a plumbing, the plumbing, plumbing and, how to plumbing, plumbing a, plumbing how to, an plumbing, a plumber, plumber, the plumber, plumber plumber, plumber in, how to plumber, plumbers in, the plumbers, plumbers, plumbing pipe, how to plumb, pipes and plumbing, plumbing pipes, pipes for plumbing, plummer, plumbing supplies, plumbing supply, plumbing heating, plumbing & heating, heating and plumbing, heating plumbing, plumbing and heating, pipe plumber, plumbing stores, plumbing suppliers, the plumbs centre, plumb centre, ,Waterproofing, Basement Waterproofing, Foundation Waterproofing, Waterproofing Contractor, Water, Waterproof, Wet Basement, Leaky Basement, Flood, Flooded Basement, Flooding ,Waterproofing, Basement leaks, underpinning, caulking,,Concrete Contractors, Impressed concrete, poured concrete, stamped concrete, radiant heating, concrete floors, contractors, concrete repair, concrete in, masonry, asphalt, paving, pavers, in the driveway, driveway, construction companies, driveways, block of concrete, concrete block, concrete mix, concret, concrete blocks, concrete slab, cost of concrete, concrete cost, concrete wall, price of concrete, concrete price, concrete stain, stamped concrete, concrete prices, repair concrete, how to repair concrete, repair of concrete, concrete repair, concrete slabs, decorative concrete, concrete decorative, staining concrete, concrete staining, concrete walls, countertop concrete, concrete countertops, patio ideas, cement companies, ready mix concrete, concrete ready mix, slabjack, slabjacking, mudjack, mudjacking, Driveway, caulking,,",0,NA,tornado,FALSE,0,0,1831,0,FALSE,71bf627bba9507016c570b3181652d89ec789754,TRUE,2022-07-01T12:41:08.000-04:00,TRUE,TRUE,2067689,96.5654407786,337,NA,NA
https://homestars.com/on/mayfield/concrete-contractors,62,"c(""https://homestars.com/on/mayfield/concrete-contractors?&page=2&"", ""https://homestars.com/on/mayfield/concrete-contractors?&page=3&"", ""https://homestars.com/on/mayfield/concrete-contractors?&page=4&"", ""https://homestars.com/on/mayfield/concrete-contractors?&page=5&"", ""https://homestars.com/on/mayfield/concrete-contractors?&page=6&"", ""https://homestars.com/on/mayfield/concrete-contractors?&page=7&"")",Concrete Contractors,2922789,http://www.rooterworx.ca/,/companies/2922789-rooterworx?searched_category_id=337&service_area=2178209,"The ROOTERWORX was established by a team that is experienced, skilled, and are in construction for decades. 

The head office of the ROOTERWORX is located in Mississauga and covers Toronto and GTA.
There are two divisions in our company for residential services: drain repair, catch basin cleaning, waterproofing, foundation & structural repair, concrete repair, concrete & foundation crack repair. 

And commercial services and multi-residential (apartment buildings, condominiums, commercial facilities): kitchen drain stack cleaning, negative side waterproofing, elevator shaft waterproofing, expansion joint waterproofing, ledge beam repair, concrete balcony repair, underground garage structural repair, underground garage waterproofing, underground garage concrete repair.

We know how to make quality; we learned the most efficient practices and use the best products on the market approved by building official associates. 
We have learned a lot through those years, and now we deliver the best to our customers.

Also, ROOTERWORX is open 24/7 for drain cleaning and drain repair services! 

416-400-2685",rooterworx,2018-10-15T12:32:01.000-04:00,NA,NA,NA,,,,,NA,NA,"We accept Cash, Cheque, Debit & Credit Cards",,Fully Licensed,,TRUE,FALSE,,,TRUE,FALSE,,1984963,ROOTERWORX,296,274,1057,9.88686,"Drain Services, blocked drain, clogged drain, overflowing drain, roots in drain, sewage back up into house, drain repair, drain, plumber, plumbers, drains, sewer, drainage, clogged, septic tank, drain and sewer, sewer drain, sewer and drain, plumbing supplies, plummer, rooter rooter, plumbing and heating, heating and plumbing, plumbing heating, drain pipe, cleaning drain, cleaning the drain, drain cleaning, plumber heating, septic systems, cleaning drains, drain cleaner, water drainage, drain pipes, clean drain, drain clean, drainage pipe, plumbing service, service plumbing, drain cleaners, plumbing company, plumbing services, services plumbing, french drain, drainage systems, drainage pipes, septic plumbing, shower drains, drain systems, sewer line, french drains, caulking,,Concrete Contractors, Impressed concrete, poured concrete, stamped concrete, radiant heating, concrete floors, contractors, concrete repair, concrete in, masonry, asphalt, paving, pavers, in the driveway, driveway, construction companies, driveways, block of concrete, concrete block, concrete mix, concret, concrete blocks, concrete slab, cost of concrete, concrete cost, concrete wall, price of concrete, concrete price, concrete stain, stamped concrete, concrete prices, repair concrete, how to repair concrete, repair of concrete, concrete repair, concrete slabs, decorative concrete, concrete decorative, staining concrete, concrete staining, concrete walls, countertop concrete, concrete countertops, patio ideas, cement companies, ready mix concrete, concrete ready mix, slabjack, slabjacking, mudjack, mudjacking, Driveway, caulking,,Waterproofing, Basement Waterproofing, Foundation Waterproofing, Waterproofing Contractor, Water, Waterproof, Wet Basement, Leaky Basement, Flood, Flooded Basement, Flooding ,Waterproofing, Basement leaks, underpinning, caulking,,Foundations, foundation repair, foundation pouring, foundation, the foundation, foundations, foundation for home, home foundation, foundation of home, foundation home, the home foundation, foundation house, house foundation, foundation of a house, foundation for a house, building foundation, homes foundation, foundation for homes, foundation homes, foundations home, foundations house, house foundations, foundations for homes, home foundation repair, building home foundation, manufactured homes foundation, types of home foundations, home foundations types, home foundation problems, mobile home foundations, home building foundations, home foundation cracks, cracks in home foundation, new home foundations, home foundation design, foundation design, foundation cracks, underpinning, ,Drainage Contractors, clogged drain, blocked drain, clogged drain, overflowing drain, roots in drain, sewage backup , drain repair, drain, the drains, drains, drainage, septic tank, sewer drain, drain pipe, stormwater, drain cleaning, culvert, cleaning drains, manhole covers, water drainage, drain pipes, culverts, drainage pipe, drainage system, drainage systems, drainage pipes, shower drains, drain systems, french drains, drain opener, drain clearing, blocked drain, drain blocked, drain repair, drains blocked, blocked drains, drainage basin, storm drain, caulking,,",0,2018-10-15T12:33:20.000-04:00,rooterworx,FALSE,0,0,1488,0,FALSE,7d6e9bc49caaf3b33b9e1b4afa58b9406c8485e2,TRUE,2022-10-11T10:00:21.000-04:00,TRUE,TRUE,2178209,98.7317136399,337,NA,NA
