Link,n_hits,all_links,category,id,url,hs_path,profile,permalink,created_at,sic_code,service_area,hours,products,services,brands,specialities,established,employee_cnt,payment_method,diplomas,licenses,memberships,liability_insurance,bonded,project_rate,project_minimum,written_contract,written_warranty,warranty_terms,parent_company_id,name,total_number_of_reviews_cache,total_number_of_approved_reviews_cache,number_of_photos_cache,avg_rating_cache,categories_info_cache,savings_count,claimed_at,subdomain,fraudulent,fraudulent_count,total_number_of_pending_reviews_cache,images_count,completion_percent_cache,bully,secret,replied_to_at_least_one_review_cache,has_set_tasks,lead_purchase_eligible,service_area_id,star_score,quote_button_category,direct_phone,direct_contact
https://homestars.com/on/plainfield/waterproofing,1,https://homestars.com/on/plainfield/waterproofing,Waterproofing,2969000,https://quickfixwaterproofing.ca/,/companies/2969000-quick-fix-waterproofing?searched_category_id=448&service_area=2282430,"We have been local since 1983.  Our team provides waterproofing and wet basement services, free estimates and bring a very highly skilled and experienced team together.

Our newly renovated central office and is located at 1055 Stoney Point Rd, Quinte West, ON. 

From here we dispatch for jobs to west of Port Hope, toward Peterborough, north of Tweed, east of Belleville.  We cover the counties of Northumberland, Peterborough, Hastings, Prince Edward County.

Our primary solutions are exterior and interior wraps.  We apply epoxy crack repair solutions.

The team of nearly 10 tradesmen covers additional specializations.  We are insured, have completed projects to maintain properties beyond waterproofing solutions for wet basements.  As related to core waterproofing needs, we also do block repair on foundations, closing old basement doorways, fixing exterior stairwells.  Separate from waterproofing, we have multiple in-house experts in carpentry, driveway repair, roofing and more.",quick-fix-waterproofing,2022-06-05T17:29:11.000-04:00,NA,NA,NA,,"Waterproofing, crack repair, parging, and related basement maintenance services.
Expanding services include:
-driveway maintenance;",,"Interior waterproofing wraps and crack repairs, exterior excavations and wraps.",NA,8,,,,"Chambers of Commerce - Belleville, Peterborough, Northumberland",TRUE,FALSE,,,TRUE,FALSE,Lifetime Warranty,2030918,Quick Fix Waterproofing,7,5,27,10,"Waterproofing, Basement Waterproofing, Foundation Waterproofing, Waterproofing Contractor, Water, Waterproof, Wet Basement, Leaky Basement, Flood, Flooded Basement, Flooding ,Waterproofing, Basement leaks, underpinning, caulking,,",0,2022-06-05T17:31:07.000-04:00,quickfixwaterproofing,FALSE,0,0,28,0,FALSE,4d8bee9a1aed799328ae2ab72c1e6ee9091cbf06,TRUE,TRUE,TRUE,2282430,89.6848739194,448,NA,NA
