Link,n_hits,all_links,category,id,url,hs_path,profile,permalink,created_at,sic_code,service_area,hours,products,services,brands,specialities,established,employee_cnt,payment_method,diplomas,licenses,memberships,liability_insurance,bonded,project_rate,project_minimum,written_contract,written_warranty,warranty_terms,parent_company_id,name,total_number_of_reviews_cache,total_number_of_approved_reviews_cache,number_of_photos_cache,avg_rating_cache,categories_info_cache,savings_count,claimed_at,subdomain,fraudulent,fraudulent_count,total_number_of_pending_reviews_cache,images_count,completion_percent_cache,bully,secret,replied_to_at_least_one_review_cache,latest_approved_review_created_at,has_set_tasks,lead_purchase_eligible,service_area_id,star_score,quote_button_category,direct_phone,direct_contact
https://homestars.com/on/blue-springs/masonry-bricklaying,17,https://homestars.com/on/blue-springs/masonry-bricklaying?&page=2&,Masonry & Bricklaying,2971146,,/companies/2971146-toro-masonry?searched_category_id=401&service_area=2287258,"The company is known for its service and customer-friendly solutions. Toro Masonry deliver what the customers are asking for fair market prices, quality and above all with the customer in focus so that you as a customer should always feel sure of a perfect end result. Regardless of whether it is large renovation project, cleaning of facades or whether it is a smaller work in private property.
",toro-masonry,2022-07-29T09:31:28.000-04:00,NA,NA,NA,,,,,NA,NA,,,,,FALSE,FALSE,,,FALSE,FALSE,,2033057,Toro Masonry,6,6,13,10,"Masonry & Bricklaying, Masonry Supply, Masonry Contractor, Stone Masonry, Brick Laying, Technique, Brick Laying Pattern, stone wall, brick wall, masonry repair, brick repairs, masonry, brick masonry, masonry bricklaying, masonry work, mason contractors, york masonry, masonry companies, brick masonry construction, brick contractors, masonry brick laying, masonry workers, bricklaying firms, parging, ,Tuck Pointing, Chimney Repair, Chimney Bricklaying, Chimney Masonry Repair, Chimney Sweeps, repointing, pointing, Chimney and Tuck Pointing, ,",0,2022-07-29T09:32:37.000-04:00,,FALSE,0,0,14,0,FALSE,4d74fa97fd0a266ee27b8d8880deb87029c5d281,TRUE,NA,TRUE,TRUE,2287258,90.8775648136,401,NA,NA
https://homestars.com/on/blue-springs/masonry-bricklaying,17,https://homestars.com/on/blue-springs/masonry-bricklaying?&page=2&,Masonry & Bricklaying,2971633,https://mastercraftmasonrysolutions.ca/,/companies/2971633-mastercraft-masonry?searched_category_id=401&service_area=2288397,"Welcome To Master Craft Masonry

Our experts work with all masonry & roofing material and installation types. 
So, whether your roof is flat or pitched; on a home or commercial property, we are your best choice.

24/7 Customer Support Services
Get in touch:
Mobile: (905) 336-8941
Whatsapp Business: (647) 533-5416",mastercraft-masonry,2022-08-11T14:30:28.000-04:00,NA,NA,NA,,Flat Roofing | Gutters | Moss Removal | Slate Roofing | Masonry | Repointing | Mortar Work |  Cracked Bricks ,,Masonry | Roofing,NA,NA,Cash | Cheques | E-Transfer,,Fully Licensed,,TRUE,FALSE,,,TRUE,FALSE,,2033544,Mastercraft Masonry,7,6,28,10,"Masonry & Bricklaying, Masonry Supply, Masonry Contractor, Stone Masonry, Brick Laying, Technique, Brick Laying Pattern, stone wall, brick wall, masonry repair, brick repairs, masonry, brick masonry, masonry bricklaying, masonry work, mason contractors, york masonry, masonry companies, brick masonry construction, brick contractors, masonry brick laying, masonry workers, bricklaying firms, parging, ,Gutters & Eavestroughs, Eavestrough Cleaning, Eavestrough Installation, Eavestrough Maintenance, gutter cleaning, gutter installation, gutter maintenance, installing gutters, installing eavestroughs, Eavestrough Repair, ,Siding, vinyl siding, wood siding, exterior siding, aluminum siding, cedar shakes, cedar shingles, composite wood siding, seamless steel siding, wood clapboard, stone siding, brick siding, exterior, side, sides, how to siding, the siding, the other side, stucco,  how to vinyl siding, about vinyl siding, what is vinyl siding, in vinyl siding, vinyl siding how to, vinyl siding, siding vinyl, how to install vinyl, cement fiber, fiber cement, siding house, house with siding, siding on a house, what is siding on a house, siding for house, siding a house, how to siding a house, siding on house, house siding, siding for a house, ,",0,2022-08-11T14:32:24.000-04:00,Mastercraft,FALSE,0,0,29,0,FALSE,d00394ff66440ef1eaa4ce623d9e6fd8b0a0fb85,TRUE,NA,TRUE,TRUE,2288397,90.1576088274,401,NA,NA
https://homestars.com/on/blue-springs/masonry-bricklaying,17,https://homestars.com/on/blue-springs/masonry-bricklaying?&page=2&,Masonry & Bricklaying,2966574,,/companies/2966574-rd-mouldings?searched_category_id=401&service_area=2293624,"Everyone loves to reside in a modern and luxurious built home. RD Mouldings is a leading decorative trim company serving residential clients with an array of reliable crown moulding, waffle ceiling, wainscoting , panels and lots more.
With years of experience in the industry, we have managed to earn a positive reputation for delivering best-in-class trim services among many others. We are passionate about what we do and utilize the superior materials to enhance the interior decor of your property.",rd-mouldings,2022-03-30T14:37:50.000-04:00,NA,NA,NA,,"Crown Moulding, Waffle Ceiling, Wainscoting, Panels, Accent Wall, Baseboards, Casing, Columns",,,2021,NA,"Etransfer, Cheque, Cash",,,,TRUE,FALSE,,,TRUE,FALSE,,2028492,RD Mouldings,15,15,504,10,"Carpenters, carpenter, finish carpenter, local carpenter, carpenter work, carpenter companies, master carpenter, carpenters and joiners, carpentry, union carpenter, carpenter co, carpenter services, carpenter construction, interior framing, mud room, mudroom, playsets, playground, wooden playset, wooden playground, play set, caulking,,Trim and Moldings, Wood Mouldings, Architectural Mouldings, Decorative Mouldings, Ornamental Mouldings, Mouldings For Picture Frame, Trimwork, wood moldings, architectural moldings, ornamental moldings, decorative moldings, decorative mouldings, dado rails, wood paneling, French baseboards, 9"" baseboards, stair rails, stair bannister, cornice moulding, crown moulding, crown molding, molding, moulding molding, molding or moulding, molding trim, molding and trim, trim molding, moulding and trim, moulding trim, trim moulding, mouldings, moldings, crown molding, molding crown, crown molding in, crown moulding, moulding crown, crown molding moulding, door trim molding, door trim moulding, trim mouldings, mouldings trim, mouldings and trim, moldings crown, crown moldings, crown mouldings, install crown molding, crown molding cut, cut crown molding, crown moulding cut, cut crown moulding, molding company, wood trim moulding, molding corner, corner molding, mold trim, plastic trim moulding, molding corner, corner molding, mold trim, plastic trim moulding, plastic moulding trim, moulding company, corner moulding, moulding corner, plastic trim molding, moldings and trim, moldings trim, trim moldings, molding co, molding companies, installing crown molding,,Fireplaces, Electric Fireplace, Fireplace Mantel, Fireplace Chimney, Gas Fireplace, Fireplace Screen, Outdoor Fireplace, Fireplace Accessory, Ventless Fireplace, Fieplace Mantle, fireplace, the fireplace, fire place, fireplace stoves, fireplace chimney, fireplace gas, gas fireplace, fireplace heaters, gas fireplaces, fireplaces gas, wood fireplace, wood for fireplace, fireplace electric, electric fireplace, wood stove fireplace, fireplace hearth, electric fireplaces, fireplaces electric, fireplace heater, insert for fireplace, insert fireplace, fireplace insert, gas fireplaces and stoves, wood fireplaces, insert fireplaces, inserts for fireplaces, fireplaces inserts, wood burning fireplace, gas fireplace stoves, fireplace door, gas stove fireplace, fire places, fireplace screen, outdoor fireplace, fireplace outdoor, gas log, wood burning fireplaces, fireplace mantels, mantels for fireplace, fireplace mantle, fireplace mantels, ethanol fireplace, caulking,Masonry & Bricklaying, Masonry Supply, Masonry Contractor, Stone Masonry, Brick Laying, Technique, Brick Laying Pattern, stone wall, brick wall, masonry repair, brick repairs, masonry, brick masonry, masonry bricklaying, masonry work, mason contractors, york masonry, masonry companies, brick masonry construction, brick contractors, masonry brick laying, masonry workers, bricklaying firms, parging, ,",0,2022-03-30T14:39:47.000-04:00,,FALSE,0,0,562,0,FALSE,6753c9645ccaa385a2d7c290dd8d8bf2e47cfd33,TRUE,2022-10-27T21:01:57.000-04:00,TRUE,TRUE,2293624,99.050351432,401,NA,NA
https://homestars.com/on/blue-springs/masonry-bricklaying,17,https://homestars.com/on/blue-springs/masonry-bricklaying?&page=2&,Masonry & Bricklaying,2956149,,/companies/2956149-t-m-construction-team?searched_category_id=401&service_area=2283280,"With over 20 years of experience we have the knowledge of all of your home’s masonry needs.  
With our knowledgeable, experienced, training in providing clients with an exceptional quality of service and product. 
We communicate and work with our clients from start to finish.  
We always ensure that our clients feel comfortable every step of the way, understand and agree with the work that is being conducted.

Get in touch with us - 416-835-8719
",t-m-construction-team,2021-05-10T17:23:39.000-04:00,NA,NA,NA,,,,,NA,NA,Cash | Cheques | E-Transfer,,Fully Licensed,,TRUE,FALSE,,,TRUE,FALSE,,2018127,T&M CONSTRUCTION TEAM,15,14,10,10,"Masonry & Bricklaying, Masonry Supply, Masonry Contractor, Stone Masonry, Brick Laying, Technique, Brick Laying Pattern, stone wall, brick wall, masonry repair, brick repairs, masonry, brick masonry, masonry bricklaying, masonry work, mason contractors, york masonry, masonry companies, brick masonry construction, brick contractors, masonry brick laying, masonry workers, bricklaying firms, parging, ,",0,2021-05-10T17:24:34.000-04:00,TM,FALSE,0,0,12,0,FALSE,5ac9940bfad344887d57a9267fd8db0656d9b966,TRUE,NA,TRUE,TRUE,2283280,98.8570183392,401,NA,NA
https://homestars.com/on/blue-springs/masonry-bricklaying,17,https://homestars.com/on/blue-springs/masonry-bricklaying?&page=2&,Masonry & Bricklaying,2969362,https://www.masonrydoctors.com/,/companies/2969362-the-masonry-doctors?searched_category_id=401&service_area=2292873,"With over 30 years experience, Masonry Doctors are a leading masonry contractor in Toronto. Our services include Chimney Builds & Repairs, Roofing, Guttering, All Masonry Services, Patios, Walkways, Stairs, Steps, Basement & Foundation.

Browse through Masonry Doctors latest masonry, chimney, and concrete projects. Take a look at our recent work and see for yourself the quality of work we provide. Contact us today for a FREE estimate!

Do you need to have your existing outdoor masonry features repaired? Turn to the professionals from Masonry Doctors for all  your masonry restoration needs.

Protect your landscape from the effects of flooding by having custom-designed retaining walls installed by our professionals. Call for your service.

If you love spending time outdoors, a patio is a must-have feature for your home. The team from Masonry Doctors can custom-design a patio for you.

The skilled masons from Masonry Doctors can install decorative stairs for your landscape. We can also repair your damaged steps. Call for more details.

Whether you have damaged concrete or a cracked foundation, the team from Masonry Doctors can repair it for you. Get 15% OFF our services.

Veneer facades and pillars can transform the appearance of any property. Trust us to upgrade your home with quality pillars and columns. Request a call back today!

Rely on the professionals at Masonry Doctors for all of your foundation and basement repair needs. Hire us today and get 15% OFF all our foundation or basement services.

Whether you need chimney rebuilding, repairing, or repointing services, Masonry Doctors does it all. Contact us today for a FREE estimate.

Our experts work with all roofing material and installation types. So, whether your roof is flat or pitched; on a home or commercial property, we are your best choice.",the-masonry-doctors,2022-06-14T11:40:48.000-04:00,NA,NA,NA,,"Exceptional Masonry Work
Precise Retaining Wall Installs
Custom Patios & Walkways
Attractive Stairs & Steps
Effective Concrete Repairs
Stunning Veneers & Pillars
Basement / Foundation
Chimneys
Roofing",,,30,NA,"Cheque, Cash , e-transfer, Credit Card",,,,FALSE,FALSE,,$5000,FALSE,FALSE,,2031280,The Masonry Doctors,14,6,44,10,"Masonry & Bricklaying, Masonry Supply, Masonry Contractor, Stone Masonry, Brick Laying, Technique, Brick Laying Pattern, stone wall, brick wall, masonry repair, brick repairs, masonry, brick masonry, masonry bricklaying, masonry work, mason contractors, york masonry, masonry companies, brick masonry construction, brick contractors, masonry brick laying, masonry workers, bricklaying firms, parging, ,Foundations, foundation repair, foundation pouring, foundation, the foundation, foundations, foundation for home, home foundation, foundation of home, foundation home, the home foundation, foundation house, house foundation, foundation of a house, foundation for a house, building foundation, homes foundation, foundation for homes, foundation homes, foundations home, foundations house, house foundations, foundations for homes, home foundation repair, building home foundation, manufactured homes foundation, types of home foundations, home foundations types, home foundation problems, mobile home foundations, home building foundations, home foundation cracks, cracks in home foundation, new home foundations, home foundation design, foundation design, foundation cracks, underpinning, ,Waterproofing, Basement Waterproofing, Foundation Waterproofing, Waterproofing Contractor, Water, Waterproof, Wet Basement, Leaky Basement, Flood, Flooded Basement, Flooding ,Waterproofing, Basement leaks, underpinning, caulking,,Roofing, Roofing Contractor, Metal Roofing, Roofing Material, Roofing Shingles, Roofing Company, cedar roofing, roofing repair, roof repair, cedar shingles, shingles, roof repair, slate roofing, slate roofs, cedar shakes, roof, how to roof, about roofing, at roofing, the roofing, roofing roofing, a roofing, roof roof roofing, shingles, roofs, shingles for roof, roof shingles, shingles roof, roofing shingles, shingles roofing, metal roof, roof metal, metal roofing, roofing metal, steel roof, steel roofing, roof repair, roof and repair, roofers, roofer, roof tiles, roof tile, tile roof, roofing contractors, roofing companies, metal roofs, roof shingle, shingle roof, contractor roofing, roofing contractor, Roofing Contractor for New Shingles, roofing canada, roofing companies, canadian roofing contractors, roof builders, roofing installers, contractor roofing, roofing calgary, roofing ottawa, roofers calgary, roofing jobs, roofing barrie, best roofing material, vancouver, roofing contractors, roof contractors, roofing supply , home roofing, roofing ontario, roof ontario, commercial roofing, residential roofers, roofing builders, shingle roof contractor, residential roofing company, roof types, best roofing company, fiberglass shingles,  canadian roofing company, flat roofing, industrail roofing, types of roofing, roofing options, list roofing companies, shinglers, roofing estimates, elk shingles,  roofing reviews, asphalt shingles prices, metal sheet roofing, roofing systems, flat roofing companies, roofing and siding, roofers review, new roofing, slate roofing contractors, roof installers, vinyl roofing material, roof sheets, commercial roof repairs,Basement Renovation, Basement renovation, Basement remodeling, Basement remodelling, renovating your basement, renovation, waterproofing, remodeling, home renovation, house renovation, water in basement, basement waterproofing,finishing basement, moistureproof, remodeling the house, caulking,Bathroom Renovation, Bathroom renovation, bathroom remodeling, bathroom remodelling, renovating the bathroom, tearing out the bathroom, fixing up the bathroom, bathroom contractors, bathroom vanities, bathroom vanity, design of bathroom, bathroom and design, design for bathroom, design a bathroom, design a bath, bath design, bathroom tile, bathroom cabinets, remodeling a bathroom, bathroom remodeling, remodeling the bathroom, ,Bath renovation, New tub, caulking, ,Kitchen Planning & Renovation, Kitchen Planning And Design, Kitchen Cabinet Planning, Kitchen Design, Kitchen Remodeling, kitchen or, and bathroom, a and a kitchens, kitchens and, for kitchens, a kitchens, kitchens, the house design, cabinets for kitchen, cabinets for the kitchen, cabinets and kitchen, kitchen cabinets, design a kitchen, about kitchen design, a kitchen design, how to kitchen design, design and kitchen, the kitchen design, design for kitchen, kitchen designs, renovation and remodeling, remodeling and renovation, kitchen designer,,Kitchen Renovation, caulking, ,",0,2022-06-14T11:44:15.000-04:00,,FALSE,0,0,47,0,FALSE,a2af3b6b2b1588724c94514e22267a89f40c2b31,TRUE,2022-08-02T15:58:20.000-04:00,TRUE,TRUE,2292873,89.7762868567,401,NA,NA
https://homestars.com/on/blue-springs/masonry-bricklaying,17,https://homestars.com/on/blue-springs/masonry-bricklaying?&page=2&,Masonry & Bricklaying,2967731,,/companies/2967731-s-s-stone-inc?searched_category_id=401&service_area=2279874,,s-s-stone-inc,2022-04-30T07:32:34.000-04:00,NA,NA,NA,,,,,NA,NA,,,,,FALSE,FALSE,,,FALSE,FALSE,,2029649,S & S Stone Inc. ,10,9,76,10,"Masonry & Bricklaying, Masonry Supply, Masonry Contractor, Stone Masonry, Brick Laying, Technique, Brick Laying Pattern, stone wall, brick wall, masonry repair, brick repairs, masonry, brick masonry, masonry bricklaying, masonry work, mason contractors, york masonry, masonry companies, brick masonry construction, brick contractors, masonry brick laying, masonry workers, bricklaying firms, parging, ,Interlocking Stone, Interlocking Tile, Stone, tiles for, landscaping, paving, pavers, paver, stone step, wall stone, stone wall, landscape design, patios, interlock, retaining wall, stepping stones, interlocking, landscaping ideas, retaining walls, paving stones, paver stones, pavers stones, pavers and stones, stones pavers, stones and pavers, flagstone, concrete design, landscapers, natural stone, paving stone, stone paving, stone paving stone, walls stone, patio designs, stone and tiles, tiles and stone, stone flagstones, slate tiles, slate tile, stone veneer, pavers stone, stone and pavers, stone pavers, paver stone, stone paver, concrete driveway, stone brick, stone and brick, brick and stone, stone flooring, stone patio, stone for patio,,",0,2022-04-30T07:33:34.000-04:00,ssstoneinc,FALSE,0,0,85,0,FALSE,2e2dad647e1c617e4c2e3cd2f9c34753b434318d,TRUE,2022-05-06T21:07:38.000-04:00,TRUE,TRUE,2279874,85.302306771,401,NA,NA
https://homestars.com/on/blue-springs/masonry-bricklaying,17,https://homestars.com/on/blue-springs/masonry-bricklaying?&page=2&,Masonry & Bricklaying,2895122,https://www.briansmasonry.com/#HomeTop,/companies/2895122-brian-s-masonry?searched_category_id=401&service_area=2288158,"Welcome to Brian's Masonry....

Meet Brian Buttigieg...
A passion for the trade and the challenges that are thrown at him in the form of difficult projects is what has kept Brian working in this field for 30 years.

Brian's Masonry
The decision to expand the company was made after many years of practice in the field. The goal for Brian was to start a company that clients can trust and turn to whenever they have an issues or projects they would like to take on. All the highly skilled workers that work alongside Brian were chosen for having the same values and drive to constantly improve. Due to this we feel confident when saying we can help you with even the most challenging of tasks.


How We Prepare
We begin by detailing a several step plan of approach before starting anything else. This plan is looked over several times to ensure the steps can be followed precisely and swiftly.

Consultation
Your needs and requirements being met is our top priority. We want to make sure that you are satisfied and due to this, make sure to communicate the above multi step plan to you and confer with you along the way.

Safety
We very closely follow all procedures and guidelines set by the Ministry of Labour in the Occupational Health and Safety Guidelines as well as the Construction Requirements and Guidelines set both by the city and province. We ensure that neither us, the contractor, nor anyone else will be harmed or injured to the best of our abilities.

Practice What We Preach
We have done work from the basics to very intricate projects. We follow through all of the discussed plan, and check at the very end that it was followed very closely. We pride ourselves on making sure it is done with good quality materials and top quality workers.

CHIMNEY REBUILDS
HISTORICAL BUILDINGS
BRICK/BLOCK/STONE WORK
BRICK RESTORATION
PORCHES
WALKWAYS
WINDOW SILLS
RETAINING WALLS
TUCK-POINTING
CHIMNEY SWEEP",brian-s-masonry,2017-03-16T20:00:43.000-04:00,NA,NA,NA,,"SPECIALIZING IN HERITAGE BUILDINGS-
- Brick Replacement
-Tuckpointing
- Window Openings
- Door opening
-Window Sills 

CHIMNEY REBUILDS
HISTORICAL BUILDINGS
BRICK/BLOCK/STONE WORK
BRICK RESTORATION
CHIMNEY SWEEP
PORCHES
WALKWAYS
WINDOW SILLS
RETAINING WALLS
TUCK-POINTING",,Specializing in historical ,1996,NA,Cash and Cheque,,Licensed in Toronto ,,TRUE,FALSE,,,TRUE,FALSE,10 Years on Workmanship. Kindly ask for more details. ,1957546,Brian's Masonry,21,20,25,10,"Masonry & Bricklaying, Masonry Supply, Masonry Contractor, Stone Masonry, Brick Laying, Technique, Brick Laying Pattern, stone wall, brick wall, masonry repair, brick repairs, masonry, brick masonry, masonry bricklaying, masonry work, mason contractors, york masonry, masonry companies, brick masonry construction, brick contractors, masonry brick laying, masonry workers, bricklaying firms, parging, ,Chimney Build & Repair, Chimney repairs, Chimney Building, Chimney maintenance, Chimney sweeping, chimney cleaning, chimney, fireplace and chimney, chimney sweep, chimney cleaning how to, chimney cleaning, chimney repair, repair chimney, chimney clean, chimney cleaners, brick chimney, chimney service, chimney cleaner, new chimney, chimney repair service, build chimney, chimney build, chimney restoration, fireplace chimney cleaning, fireplace chimney repair, chimney cleaning repair, chimney building, chimney building how to, ,",0,NA,,FALSE,0,0,31,0,FALSE,d430e9844929f28e2e5a3b0d15ed75f61a6eaec0,TRUE,NA,TRUE,TRUE,2288158,93.8702200369,401,NA,NA
https://homestars.com/on/blue-springs/masonry-bricklaying,17,https://homestars.com/on/blue-springs/masonry-bricklaying?&page=2&,Masonry & Bricklaying,2946641,,/companies/2946641-ct-design-and-contracting?searched_category_id=401&service_area=2291202,"Welcome to CT Design and Contracting. We offer both Commercial and Residential work and are here to assist you with your project needs. Deck designs, landscaping, gazebos, pergula, cabana designs, masonry, stonework, brickwork, and blocks. We can work on the plans and designs for your additions and all your projects with you. 

****

We offer onsite consultations so contact us today to schedule your appointment. ",ct-design-and-contracting,2020-08-11T19:13:19.000-04:00,NA,NA,NA,,"Masonry, Brick Replacement, Stone work, Landscaping, Interlocking",,,NA,NA,"Cash, Cheque, E-Transfer ",,,,FALSE,FALSE,,,TRUE,FALSE,,2008778,CT design and contracting ,9,9,142,10,"Masonry & Bricklaying, Masonry Supply, Masonry Contractor, Stone Masonry, Brick Laying, Technique, Brick Laying Pattern, stone wall, brick wall, masonry repair, brick repairs, masonry, brick masonry, masonry bricklaying, masonry work, mason contractors, york masonry, masonry companies, brick masonry construction, brick contractors, masonry brick laying, masonry workers, bricklaying firms, parging, ,Interlocking Stone, Interlocking Tile, Stone, tiles for, landscaping, paving, pavers, paver, stone step, wall stone, stone wall, landscape design, patios, interlock, retaining wall, stepping stones, interlocking, landscaping ideas, retaining walls, paving stones, paver stones, pavers stones, pavers and stones, stones pavers, stones and pavers, flagstone, concrete design, landscapers, natural stone, paving stone, stone paving, stone paving stone, walls stone, patio designs, stone and tiles, tiles and stone, stone flagstones, slate tiles, slate tile, stone veneer, pavers stone, stone and pavers, stone pavers, paver stone, stone paver, concrete driveway, stone brick, stone and brick, brick and stone, stone flooring, stone patio, stone for patio,,Landscape Contractors & Designers, Landscape Contractor Designer, Landscape Design, Landscape Contractor, Landscapers, Landscaping, Landscape, Backyard, patio, Fountain, Ponds and Waterfalls, garden, gardens, landscape, how to landscape, landscaping and, landscape garden, garden landscape, gardening, landscape gardens, pavers, garden design, design a garden, design for garden, design garden, how to design garden, lawn maintenance, how to design landscape, design landscape, landscape and design, design and landscape, how to design a landscape, landscape design, design a landscape, patios, architects landscape, landscape architects, garden designs, lawn service, garden landscaping, landscaping garden, landscape lighting, garden designer, designer garden,,landscapemakeover of backyard and improve front yard
build fence, landscape, Landscaping, retaining wall, grading,",0,2020-08-12T11:58:22.000-04:00,ctdesignandcon,FALSE,0,0,144,0,FALSE,251ea4ccdaf9a80687e9ad114bf7ca3db2660bcb,TRUE,2022-04-01T17:22:08.000-04:00,TRUE,TRUE,2291202,87.714231423,401,NA,NA
