Link,n_hits,all_links,category,id,url,hs_path,profile,permalink,created_at,sic_code,service_area,hours,products,services,brands,specialities,established,employee_cnt,payment_method,diplomas,licenses,memberships,liability_insurance,bonded,project_rate,project_minimum,written_contract,written_warranty,warranty_terms,parent_company_id,name,total_number_of_reviews_cache,total_number_of_approved_reviews_cache,number_of_photos_cache,avg_rating_cache,categories_info_cache,savings_count,claimed_at,subdomain,fraudulent,fraudulent_count,total_number_of_pending_reviews_cache,images_count,completion_percent_cache,bully,secret,replied_to_at_least_one_review_cache,latest_approved_review_created_at,has_set_tasks,lead_purchase_eligible,service_area_id,star_score,quote_button_category,direct_phone,direct_contact
https://homestars.com/on/mayfield/concrete-contractors,62,"c(""https://homestars.com/on/mayfield/concrete-contractors?&page=2&"", ""https://homestars.com/on/mayfield/concrete-contractors?&page=3&"", ""https://homestars.com/on/mayfield/concrete-contractors?&page=4&"", ""https://homestars.com/on/mayfield/concrete-contractors?&page=5&"", ""https://homestars.com/on/mayfield/concrete-contractors?&page=6&"", ""https://homestars.com/on/mayfield/concrete-contractors?&page=7&"")",Concrete Contractors,2861842,http://allseasonconcrete.ca/,/companies/2861842-allseason-concrete-inc?searched_category_id=337&service_area=1999755,"AllSeason Concrete Inc. is a registered concrete company based out of  Caledon, Ontario. Owned and operated by Altino Rego with many years of experience, dedication and loyalty to his family, customers, communities and the concrete industry.

Our company’s main focus is to provide the highest quality of service and customer satisfaction with a wide variety of concrete styles and finishes. No matter if your project is commercial or residential, our team of dedicated professionals will treat your property like it was their own and complete any project in a timely and skillful manner.

We will meet your needs and make your dream ours!

Delivering you perfection is not just our mission statement, its a promise.",allseason-concrete-inc,2014-11-08T08:40:18.000-05:00,NA,NA,NA,,,,,2011,NA,,,,BBB A+,TRUE,FALSE,,,TRUE,FALSE,,1924272,Allseason Concrete Inc ,30,28,85,9.89286,"Concrete Contractors, Impressed concrete, poured concrete, stamped concrete, radiant heating, concrete floors, contractors, concrete repair, concrete in, masonry, asphalt, paving, pavers, in the driveway, driveway, construction companies, driveways, block of concrete, concrete block, concrete mix, concret, concrete blocks, concrete slab, cost of concrete, concrete cost, concrete wall, price of concrete, concrete price, concrete stain, stamped concrete, concrete prices, repair concrete, how to repair concrete, repair of concrete, concrete repair, concrete slabs, decorative concrete, concrete decorative, staining concrete, concrete staining, concrete walls, countertop concrete, concrete countertops, patio ideas, cement companies, ready mix concrete, concrete ready mix, slabjack, slabjacking, mudjack, mudjacking, Driveway, caulking,,",0,NA,allseason,FALSE,0,0,87,0,FALSE,53c6be1dc604921c422e3a69c061e71e55f416f3,TRUE,2021-09-25T14:51:37.000-04:00,TRUE,TRUE,1999755,98.3903575386,337,NA,NA
https://homestars.com/on/mayfield/concrete-contractors,62,"c(""https://homestars.com/on/mayfield/concrete-contractors?&page=2&"", ""https://homestars.com/on/mayfield/concrete-contractors?&page=3&"", ""https://homestars.com/on/mayfield/concrete-contractors?&page=4&"", ""https://homestars.com/on/mayfield/concrete-contractors?&page=5&"", ""https://homestars.com/on/mayfield/concrete-contractors?&page=6&"", ""https://homestars.com/on/mayfield/concrete-contractors?&page=7&"")",Concrete Contractors,2901004,http://www.margis.ca,/companies/2901004-margis-construction?searched_category_id=337&service_area=2178846,"MarGis Construction, specializes in architectural concrete finishes such as stamped concrete, coloured concrete, exposed aggregate, broom finish. 

Our work is all related to concrete in driveways, patios, walkways, verandas, porches, retaining walls and curbing, basement slabs and garages, heated driveways. 

We always provide quality installations. 

We can't wait to hear back from you! 

We service all GTA Toronto",margis-construction,2017-08-18T08:05:55.000-04:00,NA,NA,NA,,,,,NA,NA,"Cheque, Cash and e-transfer",,,,TRUE,FALSE,,,TRUE,FALSE,Yes. Kindly ask for details. Depends on project completed. ,1963290,Margis Construction ,27,25,156,9.96,"Concrete Contractors, Impressed concrete, poured concrete, stamped concrete, radiant heating, concrete floors, contractors, concrete repair, concrete in, masonry, asphalt, paving, pavers, in the driveway, driveway, construction companies, driveways, block of concrete, concrete block, concrete mix, concret, concrete blocks, concrete slab, cost of concrete, concrete cost, concrete wall, price of concrete, concrete price, concrete stain, stamped concrete, concrete prices, repair concrete, how to repair concrete, repair of concrete, concrete repair, concrete slabs, decorative concrete, concrete decorative, staining concrete, concrete staining, concrete walls, countertop concrete, concrete countertops, patio ideas, cement companies, ready mix concrete, concrete ready mix, slabjack, slabjacking, mudjack, mudjacking, Driveway, caulking,,",0,2017-08-18T08:07:01.000-04:00,NA,FALSE,0,0,131,0,FALSE,1039c7bd7f81f3a5e7e993f675b4d2a9967fba37,TRUE,2021-06-26T16:38:52.000-04:00,TRUE,TRUE,2178846,94.3716630179,337,NA,NA
https://homestars.com/on/mayfield/concrete-contractors,62,"c(""https://homestars.com/on/mayfield/concrete-contractors?&page=2&"", ""https://homestars.com/on/mayfield/concrete-contractors?&page=3&"", ""https://homestars.com/on/mayfield/concrete-contractors?&page=4&"", ""https://homestars.com/on/mayfield/concrete-contractors?&page=5&"", ""https://homestars.com/on/mayfield/concrete-contractors?&page=6&"", ""https://homestars.com/on/mayfield/concrete-contractors?&page=7&"")",Concrete Contractors,198164,http://www.bomanite.ca,/companies/198164-bomanite-toronto-ltd?searched_category_id=337&service_area=1808581,"The Bomanite name is built on quality, value and service. Every member of the Bomanite organization is dedicated to long-term business relationships that are perpetuated by experienced personnel, quality workmanship and competitive pricing. When you want the best in architectural concrete paving, turn to Bomanite.

Residential concrete paving and flooring services: Concrete Driveways, Concrete Patios, Concrete Pool Decks, Concrete Walkways, Concrete Interior Flooring, One-of-a-Kind Custom Concrete Limestone, Toping Systems, Custom Polishing, Imprinting System,
Exposed Aggregate, Pervious Concrete

",bomanite-toronto-ltd,2008-01-23T10:23:32.000-05:00,NA,"Ajax, Brampton, Concord, Etobicoke, King, Kleinburg, Maple, Markham, Mississauga, Newmarket, North York, Oakville, Richmond Hill, Scarborough, Stouffville,Thornhill, Toronto, Unionville, Vaughan, Woodbridge",Monday-Friday 9:00am- 5:00pm,"Limestone, Toping Systems, Custom Polishing, Imprinting System,
Exposed Aggregate, Pervious Concrete","Residential concrete paving and flooring services: Concrete Driveways, Concrete Patios, Concrete Pool Decks, Concrete Walkways, Concrete Interior Flooring, One-of-a-Kind Custom Concrete
",,"Driveways, Patios. Pool decks, Walkways, Interior flooring

Commercial

Building entrances, Vehicular entryways, Showroom floors. Theme parks. Courtyards, Lobbies, Retail walkways",1970,NA,,,,,TRUE,TRUE,,,TRUE,FALSE,,54727,Bomanite (Toronto) Ltd,85,54,16,8.55093,"Concrete Contractors, Impressed concrete, poured concrete, stamped concrete, radiant heating, concrete floors, contractors, concrete repair, concrete in, masonry, asphalt, paving, pavers, in the driveway, driveway, construction companies, driveways, block of concrete, concrete block, concrete mix, concret, concrete blocks, concrete slab, cost of concrete, concrete cost, concrete wall, price of concrete, concrete price, concrete stain, stamped concrete, concrete prices, repair concrete, how to repair concrete, repair of concrete, concrete repair, concrete slabs, decorative concrete, concrete decorative, staining concrete, concrete staining, concrete walls, countertop concrete, concrete countertops, patio ideas, cement companies, ready mix concrete, concrete ready mix, slabjack, slabjacking, mudjack, mudjacking, Driveway, caulking,,Interlocking Stone, Interlocking Tile, Stone, tiles for, landscaping, paving, pavers, paver, stone step, wall stone, stone wall, landscape design, patios, interlock, retaining wall, stepping stones, interlocking, landscaping ideas, retaining walls, paving stones, paver stones, pavers stones, pavers and stones, stones pavers, stones and pavers, flagstone, concrete design, landscapers, natural stone, paving stone, stone paving, stone paving stone, walls stone, patio designs, stone and tiles, tiles and stone, stone flagstones, slate tiles, slate tile, stone veneer, pavers stone, stone and pavers, stone pavers, paver stone, stone paver, concrete driveway, stone brick, stone and brick, brick and stone, stone flooring, stone patio, stone for patio,,Paving Contractors, Paver, Asphalt Paving, Paving Stones, Paving Commercial Paving, Asphalt Paving Material, Driveway Paving, residential paving, what is asphalt, asphalt, paving, slabs, pavers, driveway, paver, driveways, pavements, patios, tarmac, paving pavers, asfalt, blacktop, paving stones, paver stones, paving stone, stone paving, stamped concrete, flagstones, paving slabs, patio designs, concrete slabs, block paving, patio design, paving slab, patio ideas, paving flags, asphalt pavement, concrete driveway, driveway concrete, concrete patio, concrete calculator, paving asphalt, asphalt paving, asphalt and paving, concrete contractors, concrete contractors in, concrete driveways, patio pavers, concrete contractor, concrete pavers, seal coating, paving concrete, concrete paving, paving and concrete, paving or concrete, paver patio, sealcoating, paving blocks, ,Decorative Concrete, Stamped Concrete, Impressed Concrete, Decorative Concrete, Coloured Concrete, Driveways, Patios, Walkways, Curbs, Garden Walls, Pool Decks, Porches, Steps, Concrete Sealing, driveway, sinking pool, ,Landscape Contractors & Designers, Landscape Contractor Designer, Landscape Design, Landscape Contractor, Landscapers, Landscaping, Landscape, Backyard, patio, Fountain, Ponds and Waterfalls, garden, gardens, landscape, how to landscape, landscaping and, landscape garden, garden landscape, gardening, landscape gardens, pavers, garden design, design a garden, design for garden, design garden, how to design garden, lawn maintenance, how to design landscape, design landscape, landscape and design, design and landscape, how to design a landscape, landscape design, design a landscape, patios, architects landscape, landscape architects, garden designs, lawn service, garden landscaping, landscaping garden, landscape lighting, garden designer, designer garden,,landscapemakeover of backyard and improve front yard
build fence, landscape, Landscaping, retaining wall, grading,Swimming Pools, Spas & Hot Tubs, Swimming Pool Cover, Inground Swimming Pool, Spa Cover, Spa Equipment, Hot Tub Cover, Portable Hot Tub, Hot Tub Accessory, vinyl swimming pools, pool liners, vinyl pool liners, above ground pools, whirlpools, jet pools, sauna, saunas,",0,2012-05-10T08:59:09.000-04:00,bomanite,FALSE,0,0,16,100,FALSE,27b6bce155650eae07ec077aec5a4d87ec01f9c7,TRUE,2021-10-28T22:04:38.000-04:00,TRUE,TRUE,1808581,79.7033423828,337,NA,NA
https://homestars.com/on/mayfield/concrete-contractors,62,"c(""https://homestars.com/on/mayfield/concrete-contractors?&page=2&"", ""https://homestars.com/on/mayfield/concrete-contractors?&page=3&"", ""https://homestars.com/on/mayfield/concrete-contractors?&page=4&"", ""https://homestars.com/on/mayfield/concrete-contractors?&page=5&"", ""https://homestars.com/on/mayfield/concrete-contractors?&page=6&"", ""https://homestars.com/on/mayfield/concrete-contractors?&page=7&"")",Concrete Contractors,2957988,https://www.primeconcrete.ca/,/companies/2957988-prime-concrete-inc?searched_category_id=337&service_area=2257331,"PRIME Concrete Inc. has been serving the GTA and golden horseshoe area since 2017. As a family owned business, we strive to treat all of our clients with trust and respect. We have worked on a wide variety of projects over the years, from small residential jobs to large sub-divisions to larger commercial developments. No matter the size of the job, we always ensure we provide excellence in service, quality and efficiency to every project. ",prime-concrete-inc,2021-07-12T17:39:51.000-04:00,NA,NA,NA,,"Concrete walkways, patios, driveways. All types of finishes and colours. Footings, foundation walls, slabs and MORE!",,,2017,NA,Cash and Cheques,,,,FALSE,FALSE,,,TRUE,FALSE,1 year warranty on product,2019965,Prime Concrete Inc.,9,8,56,9.875,"Concrete Contractors, Impressed concrete, poured concrete, stamped concrete, radiant heating, concrete floors, contractors, concrete repair, concrete in, masonry, asphalt, paving, pavers, in the driveway, driveway, construction companies, driveways, block of concrete, concrete block, concrete mix, concret, concrete blocks, concrete slab, cost of concrete, concrete cost, concrete wall, price of concrete, concrete price, concrete stain, stamped concrete, concrete prices, repair concrete, how to repair concrete, repair of concrete, concrete repair, concrete slabs, decorative concrete, concrete decorative, staining concrete, concrete staining, concrete walls, countertop concrete, concrete countertops, patio ideas, cement companies, ready mix concrete, concrete ready mix, slabjack, slabjacking, mudjack, mudjacking, Driveway, caulking,,",0,2021-07-12T17:41:01.000-04:00,primeconcrete,FALSE,0,0,71,0,FALSE,11f1808453cf2f391245df52e04176e68a81f4c3,TRUE,NA,TRUE,TRUE,2257331,88.1007245232,337,NA,NA
https://homestars.com/on/mayfield/concrete-contractors,62,"c(""https://homestars.com/on/mayfield/concrete-contractors?&page=2&"", ""https://homestars.com/on/mayfield/concrete-contractors?&page=3&"", ""https://homestars.com/on/mayfield/concrete-contractors?&page=4&"", ""https://homestars.com/on/mayfield/concrete-contractors?&page=5&"", ""https://homestars.com/on/mayfield/concrete-contractors?&page=6&"", ""https://homestars.com/on/mayfield/concrete-contractors?&page=7&"")",Concrete Contractors,2784045,https://sgmcontracting.ca/,/companies/2784045-sgm-contracting-inc?searched_category_id=337&service_area=2246932,"SGM Contracting has been in business for over 50 years. Consistent with the vision and values of our founder, we strive to provide innovative techniques to Commercial & Residential EIFS/Stucco and Masonry projects.  We’ve been blessed to create lasting relationships with some of Canada’s most notable brands. SGM Contracting is proud of our “Coast-to-Coast” reputation for excellence! 

Today, SGM Contracting is bringing all of your exterior designs and dreams to life from wall to ground, serving the Greater Toronto Area and Surrounding Areas. Contact us today and we’ll have one of our representatives take you through the process of having your contracting needs met, step-by-step.

Covid 19 Update: We are following all the health and safety guidelines as directed by the Province of Ontario to ensure the safety of our customers and employees. We are open to phone appointments, onsite appointments and ZOOM appointments or FaceTime if you prefer. 

",sgm-contracting-inc,2011-02-09T15:21:09.000-05:00,NA,NA,NA,,,,,1969,NA,Cheque or E-Transfer,,,,TRUE,FALSE,,,TRUE,FALSE,Per project ,1847097,SGM Contracting,11,10,122,9.8,"Stucco, Stuccos, stucco contractor, stucco surface, exterior stucco, popcorn, popcorn ceiling, popcorn ceilings, popcorn ceiling removal,,Concrete Contractors, Impressed concrete, poured concrete, stamped concrete, radiant heating, concrete floors, contractors, concrete repair, concrete in, masonry, asphalt, paving, pavers, in the driveway, driveway, construction companies, driveways, block of concrete, concrete block, concrete mix, concret, concrete blocks, concrete slab, cost of concrete, concrete cost, concrete wall, price of concrete, concrete price, concrete stain, stamped concrete, concrete prices, repair concrete, how to repair concrete, repair of concrete, concrete repair, concrete slabs, decorative concrete, concrete decorative, staining concrete, concrete staining, concrete walls, countertop concrete, concrete countertops, patio ideas, cement companies, ready mix concrete, concrete ready mix, slabjack, slabjacking, mudjack, mudjacking, Driveway, caulking,,",0,2011-02-09T15:21:10.000-05:00,,FALSE,0,0,140,NA,FALSE,3eb00e33c36f8b3d0525048df675f0ec2d605b61,TRUE,NA,TRUE,TRUE,2246932,92.1561110992,337,NA,NA
https://homestars.com/on/mayfield/concrete-contractors,62,"c(""https://homestars.com/on/mayfield/concrete-contractors?&page=2&"", ""https://homestars.com/on/mayfield/concrete-contractors?&page=3&"", ""https://homestars.com/on/mayfield/concrete-contractors?&page=4&"", ""https://homestars.com/on/mayfield/concrete-contractors?&page=5&"", ""https://homestars.com/on/mayfield/concrete-contractors?&page=6&"", ""https://homestars.com/on/mayfield/concrete-contractors?&page=7&"")",Concrete Contractors,2858553,http://www.dmgconcretedesign.com,/companies/2858553-dmg-concrete-design-finish?searched_category_id=337&service_area=1988741,"DMG Concrete Design & Finish specializes in one of a kind designs using a variety of finishes such as Limestone, Exposed Aggregate and Stamped Concrete. We can do anything for your house to give it the update it deserves. We also specialize in Insulated Concrete Form Swimming Pool construction.",dmg-concrete-design-finish,2014-08-31T21:04:46.000-04:00,NA,NA,,"<style>.ig-b- { display: inline-block; }
.ig-b- img { visibility: hidden; }
.ig-b-:hover { background-position: 0 -60px; } .ig-b-:active { background-position: 0 -120px; }
.ig-b-v-24 { width: 137px; height: 24px; background: url(//badges.instagram.com/static/images/ig-badge-view-sprite-24.png) no-repeat 0 0; }
@media only screen and (-webkit-min-device-pixel-ratio: 2), only screen and (min--moz-device-pixel-ratio: 2), only screen and (-o-min-device-pixel-ratio: 2 / 1), only screen and (min-device-pixel-ratio: 2), only screen and (min-resolution: 192dpi), only screen and (min-resolution: 2dppx) {
.ig-b-v-24 { background-image: url(//badges.instagram.com/static/images/ig-badge-view-sprite-24@2x.png); background-size: 160px 178px; } }</style>
<a href=""https://www.instagram.com/dgrecko/?ref=badge"" class=""ig-b- ig-b-v-24""><img src=""//badges.instagram.com/static/images/ig-badge-view-24.png"" alt=""Instagram"" /></a>",,,"Front Entrance, driveways, backyard landscaping, Insulated Concrete Form Swimming Pools",2012,NA,"Visa, MasterCard, Cheque",,Cement finisher ,,TRUE,FALSE,,,TRUE,FALSE,1 year from completion of project ,1920983,DMG Concrete Design & Finish,32,28,261,9.57143,"Concrete Contractors, Impressed concrete, poured concrete, stamped concrete, radiant heating, concrete floors, contractors, concrete repair, concrete in, masonry, asphalt, paving, pavers, in the driveway, driveway, construction companies, driveways, block of concrete, concrete block, concrete mix, concret, concrete blocks, concrete slab, cost of concrete, concrete cost, concrete wall, price of concrete, concrete price, concrete stain, stamped concrete, concrete prices, repair concrete, how to repair concrete, repair of concrete, concrete repair, concrete slabs, decorative concrete, concrete decorative, staining concrete, concrete staining, concrete walls, countertop concrete, concrete countertops, patio ideas, cement companies, ready mix concrete, concrete ready mix, slabjack, slabjacking, mudjack, mudjacking, Driveway, caulking,,Decorative Concrete, Stamped Concrete, Impressed Concrete, Decorative Concrete, Coloured Concrete, Driveways, Patios, Walkways, Curbs, Garden Walls, Pool Decks, Porches, Steps, Concrete Sealing, driveway, sinking pool, ,",0,NA,dgconcrete,FALSE,0,0,243,0,FALSE,07524da5087f6630d5e071127778356a4af5d84a,TRUE,2021-07-07T22:42:40.000-04:00,TRUE,TRUE,1988741,92.9814103268,337,NA,NA
https://homestars.com/on/mayfield/concrete-contractors,62,"c(""https://homestars.com/on/mayfield/concrete-contractors?&page=2&"", ""https://homestars.com/on/mayfield/concrete-contractors?&page=3&"", ""https://homestars.com/on/mayfield/concrete-contractors?&page=4&"", ""https://homestars.com/on/mayfield/concrete-contractors?&page=5&"", ""https://homestars.com/on/mayfield/concrete-contractors?&page=6&"", ""https://homestars.com/on/mayfield/concrete-contractors?&page=7&"")",Concrete Contractors,2946621,https://homestars.com/companies/2946621-mosart-construction-inc,/companies/2946621-mosart-construction-inc?searched_category_id=337&service_area=2281927,"Company servicing gta with over twenty years Canadian experience . We specialize in : new interlock installations, lift and relay . Power wash sand and seal , retaining walls, flagstone , concrete sod and much more . Reputable company with good work ethics , punctual and very clean . No job is too small or too big ! ",mosart-construction-inc,2020-08-11T11:51:57.000-04:00,NA,NA,NA,,Repair and Installation ,,"new interlock installations, lift and relay . Power wash sand and seal , retaining walls, flagstone , concrete sod and much more",NA,NA,"Cash, Cheque & E-Transfer",,,,TRUE,FALSE,,,TRUE,FALSE,"Yes, kindly ask for further information ",2008758,Mosart construction inc,24,21,8,9.38095,"Interlocking Stone, Interlocking Tile, Stone, tiles for, landscaping, paving, pavers, paver, stone step, wall stone, stone wall, landscape design, patios, interlock, retaining wall, stepping stones, interlocking, landscaping ideas, retaining walls, paving stones, paver stones, pavers stones, pavers and stones, stones pavers, stones and pavers, flagstone, concrete design, landscapers, natural stone, paving stone, stone paving, stone paving stone, walls stone, patio designs, stone and tiles, tiles and stone, stone flagstones, slate tiles, slate tile, stone veneer, pavers stone, stone and pavers, stone pavers, paver stone, stone paver, concrete driveway, stone brick, stone and brick, brick and stone, stone flooring, stone patio, stone for patio,,Concrete Contractors, Impressed concrete, poured concrete, stamped concrete, radiant heating, concrete floors, contractors, concrete repair, concrete in, masonry, asphalt, paving, pavers, in the driveway, driveway, construction companies, driveways, block of concrete, concrete block, concrete mix, concret, concrete blocks, concrete slab, cost of concrete, concrete cost, concrete wall, price of concrete, concrete price, concrete stain, stamped concrete, concrete prices, repair concrete, how to repair concrete, repair of concrete, concrete repair, concrete slabs, decorative concrete, concrete decorative, staining concrete, concrete staining, concrete walls, countertop concrete, concrete countertops, patio ideas, cement companies, ready mix concrete, concrete ready mix, slabjack, slabjacking, mudjack, mudjacking, Driveway, caulking,,",0,2020-08-11T13:09:33.000-04:00,mosartconstruc,FALSE,0,0,10,0,FALSE,8eb4db9438959c52f45b0b8ffd74172e443b5ccb,TRUE,2021-09-02T16:54:56.000-04:00,TRUE,TRUE,2281927,92.875751062,337,NA,NA
