Link,n_hits,all_links,category,id,url,hs_path,profile,permalink,created_at,sic_code,service_area,hours,products,services,brands,specialities,established,employee_cnt,payment_method,diplomas,licenses,memberships,liability_insurance,bonded,project_rate,project_minimum,written_contract,written_warranty,warranty_terms,parent_company_id,name,total_number_of_reviews_cache,total_number_of_approved_reviews_cache,number_of_photos_cache,avg_rating_cache,categories_info_cache,savings_count,fraudulent,fraudulent_count,total_number_of_pending_reviews_cache,images_count,completion_percent_cache,bully,secret,replied_to_at_least_one_review_cache,has_set_tasks,lead_purchase_eligible,service_area_id,star_score,quote_button_category,direct_phone,direct_contact
"https://homestars.com/on/shefford,%20quebec/house-cleaning-exteriors",1,"https://homestars.com/on/shefford,%20quebec/house-cleaning-exteriors",House Cleaning Exteriors,2877955,NA,/companies/2877955-sparkling4you?searched_category_id=384&service_area=2060128,"Nothing is nicer than a clean space. Excess dust and dirt is unsightly and can be embarrassing when you have visitors. Most importantly, it gets into the air you breathe and can seriously impact your health. Sparkling4You Cleaning Services has been providing 12 years of residential and commercial cleaning services in New York, and their expert cleaners will make your home shine.

Is your schedule so hectic that you don’t have time to clean? Whatever your situation may be, simply call Sparkling4You Cleaning Services and they will leave your place spotless. Each room will receive the care and attention it deserves. Living rooms will get a thorough vacuuming, bathrooms will receive a complete scrub down, and your kitchen will be gleaming.

Sparkling4You Cleaning Services will even do specialty jobs, such as refrigerator cleanings, closet and cabinet interiors, and laundry. Whether you need a maid to visit on a regular basis or are moving out and need your former home cleaned, Sparkling4You Cleaning Services will meet your cleaning needs.

Sparkling4You Cleaning Services will also help you organize your closets, attics, or any space you use for storage. You can also hire them for after-party cleanups or cleaning a new home before you move in. This cleaning company provides services for jobs of all sizes, from closets to commercial spaces.

A clean home is a healthy home, and healthy means happy; Sparkling4You Cleaning Services wants you and your family to be happy. Call them at (646) 594-8808 to speak to a cleaning professional or visit their website for a cleaning estimate and a full list of their services.

Business Hours: Mon-Sat: 7am-10pm",sparkling4you,2015-10-15T05:18:57.000-04:00,NA,NA,NA,NA,NA,NA,NA,NA,NA,NA,NA,NA,NA,FALSE,FALSE,NA,NA,FALSE,FALSE,NA,1940379,Sparkling4 You,0,0,0,NA,"House Cleaning Exteriors, exterior house cleaning, sandblasting, powerwashing, cleaner, power wash, washer, sand, pressure washing companies, house washing service, pressure washing houses, pressure washing business, pressure washing service, house power washing, power washing business, exterior house cleaning products, pressure washing roof, window washing, window washing services, exterior house cleaning services, house cleaner, exterior house cleaning chemicals, house washing, power washing, pressure washing, exterior house cleaning, home pressure washing, house exterior cleaning, power washing homes, pressure washing services, house cleaning exterior, house cleaner services, power washing house, power washing services, , power was vinyl siding,  pressure washing house, power washing houses, house washing business, exterior house wash, power washing service, pressure cleaning, power washing companies, exterior house cleaners, home cleaning, exterior house washing, housekeeping services, home cleaning services, power wash, exterior home cleaning, pressure washing company, pressure washing homes, cleaning exterior windows, power washing a house, pressure washing gutters, ,",0,FALSE,0,0,0,0,FALSE,f6844e012de90c8362ce672260895bc0c9e9bdbb,FALSE,FALSE,FALSE,2060128,0,384,NA,NA
