Link,n_hits,all_links,category,id,url,hs_path,profile,permalink,created_at,sic_code,service_area,hours,products,services,brands,specialities,established,employee_cnt,payment_method,diplomas,licenses,memberships,liability_insurance,bonded,project_rate,project_minimum,written_contract,written_warranty,warranty_terms,parent_company_id,name,total_number_of_reviews_cache,total_number_of_approved_reviews_cache,number_of_photos_cache,avg_rating_cache,categories_info_cache,savings_count,claimed_at,subdomain,fraudulent,fraudulent_count,total_number_of_pending_reviews_cache,images_count,completion_percent_cache,bully,secret,replied_to_at_least_one_review_cache,latest_approved_review_created_at,has_set_tasks,lead_purchase_eligible,service_area_id,star_score,quote_button_category,direct_phone,direct_contact
https://homestars.com/on/pompano-beach/fences-gates,72,"c(""https://homestars.com/on/pompano-beach/fences-gates?&page=2&"", ""https://homestars.com/on/pompano-beach/fences-gates?&page=3&"", ""https://homestars.com/on/pompano-beach/fences-gates?&page=4&"", ""https://homestars.com/on/pompano-beach/fences-gates?&page=5&"", ""https://homestars.com/on/pompano-beach/fences-gates?&page=6&"", ""https://homestars.com/on/pompano-beach/fences-gates?&page=7&"", ""https://homestars.com/on/pompano-beach/fences-gates?&page=8&"")",Fences & Gates,2903296,http://www.gcgeneralcontracting.com,/companies/2903296-gc-general-contracting-inc?searched_category_id=354&service_area=2173893,"10% OFF FOR CUSTOMERS DOING HOME RENOVATIONS!!!

Welcome to GC Contracting
Our commitment to your project is reflected in the over 20 years committed from learning from master trade and journeymen.  We will execute on your desired outcome while being transparent and enlightening  on the process.
We love what we do and it will show in the quality and craftsmanship. 
Contact us today to see what is possible.
Services: Kitchens, Flooring & Tiling, Decks & Fencing, Wainscoting, Rough Carpentry, Basement Renovations, Bathroom Renovations, Home Renovations.
",gc-general-contracting-inc,2017-10-10T10:44:13.000-04:00,NA,NA,NA,,"Bathroom Renovations, Kitchen Renovations, Flooring & Tiling, Decks & Fencing, Wainscoting, Rough Carpentry, Basement Reno",,Trust us to do the job once and do it right.,2012,5,"Cash, Cheque and e-transfer",,All technicians are licensed as required ,,TRUE,FALSE,,,TRUE,FALSE,YES. Ask for details. Depends on Project. ,1965481,GC General Contracting Inc.,43,31,260,9.58065,"General Contractors, Residential General Contractor, Building Contractor, Additions, Remodeling Contractor,  Renovation, Builder, building construction, renovation, remodeling, construction builders, construction company, construction companies, home repair, construction jobs, home remodeling, general contractors, contractors general, contractor general, contractors construction, construction contractors, home improvement and remodeling, kitchen remodeling, construction contractor, builders contractors, home renovation, general contracting, building contractors, building companies, home renovations, builder contractor, building contractor, remodeling contractor, commercial construction, residential construction, house contractor, concrete contractors, home contractors, general construction, construction general, contractors remodeling, remodeling contractors, remodelers, remodel contractor, remodel contractors, general contract, commercial contractors, renovations contractors, home improvement contractor, licensed contractor, license general contractor, mud room, mudroom, caulking, ,Framing, carpentry, carpenter, building a house, house building, house designs, home designs, house plan, design house, house design, how to build a house. build a house, building plans, houseplans, home builders in, building house, house building plans, house builders, construction of house, house construction, building homes, design homes, modular home, house builder, homebuilders,Carpenters, interior framing, ,Home Additions, General contractor, home improvement, building addition, home expansion, house expansion, house building, plans house, house plans from, plans for house, the house plans, house plans, renovation, in house design, home plans house, home house plans, house home plans, house plans home, remodeling, house plans and designs, designs house plans, house designs plans, house plans designs, home plans and designs, home designs plans, floor plans, house build, renovations, plans for building, kitchen cabinets, remodel, kitchen design, house plans for building, house plans building, ,Basement Renovation, Basement renovation, Basement remodeling, Basement remodelling, renovating your basement, renovation, waterproofing, remodeling, home renovation, house renovation, water in basement, basement waterproofing,finishing basement, moistureproof, remodeling the house, caulking,Kitchen Planning & Renovation, Kitchen Planning And Design, Kitchen Cabinet Planning, Kitchen Design, Kitchen Remodeling, kitchen or, and bathroom, a and a kitchens, kitchens and, for kitchens, a kitchens, kitchens, the house design, cabinets for kitchen, cabinets for the kitchen, cabinets and kitchen, kitchen cabinets, design a kitchen, about kitchen design, a kitchen design, how to kitchen design, design and kitchen, the kitchen design, design for kitchen, kitchen designs, renovation and remodeling, remodeling and renovation, kitchen designer,,Kitchen Renovation, caulking, ,Bathroom Renovation, Bathroom renovation, bathroom remodeling, bathroom remodelling, renovating the bathroom, tearing out the bathroom, fixing up the bathroom, bathroom contractors, bathroom vanities, bathroom vanity, design of bathroom, bathroom and design, design for bathroom, design a bathroom, design a bath, bath design, bathroom tile, bathroom cabinets, remodeling a bathroom, bathroom remodeling, remodeling the bathroom, ,Bath renovation, New tub, caulking, ,Fences & Gates, Dog Fence, Invisible Fence, Chain Link Fence, Pool Fence, Wood Fence, Fence Gates, Dog Gates, Pet Gates, friendly neighbour fence, friendly neighbor fence, picket fence, wrought iron fence, and gate, and gates, gates, the fence, a fence, fence, fences, fence with gate, gate and fence, gate for fence, fence & gate, gate fence, fence gate, fence and gate, gates and fence, gates fence, fence & gates, fence and gates, fence gates, railings, wrought iron, electronic gates, entrance gate, trellis, fence post, front gates, chain fence, fence panels, fence chain link, chain link fence, how to wood fence, fence wood, wood for fence, wood fence, fence panel, garden gate, fence posts, fencing panels, iron gate, chain link fencing, panel fencing, gates iron, iron gates, chain link fences, fences chain link, fencing post, dog fencing, ,Floor Laying & Refinishing, Hardwood Floor, Wood Floor, Floor Tile, Dance Floor, Ceramic Floor Tile, Floor Refinishing, bamboo floor, cork floor, FSC wood flooring, stone floor, marble floor, slate floor, squeaky floor repair, laminate, laminate repair, wood floor, floor and wood, wood flooring, wood floors, floors in wood, hardwood flooring, hardwood floors, hardwood floors and, hardwood floor, hardwood floor wood, wood floor flooring, refinishing, floor refinishing, floor refinishing in, refinishing floor, hardwood install, floor laying, laying a floor, flood sanding, wood floor refinishing, refinishing hardwood floors, flooring laying, wood floors refinishing, wood flooring refinishing, floor co, flooring hard wood, hard wood floors, laying floors, flooring company, flooring engineered hardwood, floor company, hard wood floor, cleaning hardwood floors, installing hardwood flooring, installing hardwood floors, installing wood flooring, installing wood floors, installing hardwood floors, installing wood flooring, installing wood floors, installing hardwood floor, hardwood flooring installation, business floor, wood flooring installation, hardwood floor installation, floor companies, lay hardwood flooring, lay hardwood floor, wood floor repair, repair wood floor, repair hardwood floor, hardwood floor repair, finishing a hardwood floor, squeeky floors,,Hardwood floors, Install hardwood floors, caulking,",0,2017-10-11T17:11:26.000-04:00,gccontracting,FALSE,0,0,448,0,FALSE,9cb00eedf7098d91a9978269096ade087e7d9e5e,TRUE,2020-09-03T05:47:04.000-04:00,TRUE,TRUE,2173893,91.5381202978,354,NA,NA
https://homestars.com/on/pompano-beach/fences-gates,72,"c(""https://homestars.com/on/pompano-beach/fences-gates?&page=2&"", ""https://homestars.com/on/pompano-beach/fences-gates?&page=3&"", ""https://homestars.com/on/pompano-beach/fences-gates?&page=4&"", ""https://homestars.com/on/pompano-beach/fences-gates?&page=5&"", ""https://homestars.com/on/pompano-beach/fences-gates?&page=6&"", ""https://homestars.com/on/pompano-beach/fences-gates?&page=7&"", ""https://homestars.com/on/pompano-beach/fences-gates?&page=8&"")",Fences & Gates,2581020,https://www.firmfence.com/,/companies/2581020-firm-fence?searched_category_id=354&service_area=2192882,"Firm Fence is an industry leader in residential and commercial fence installation in the Greater Toronto Area. With over 35 years of experience, Firm Fence has completed thousands of projects, ranging from backyard fences to industrial enclosures to custom decks/pergolas.",firm-fence,2008-03-04T16:55:15.000-05:00,NA,NA,,"Fence, Deck, Pergola, chain link,",Installation,,,NA,6,All means,,,,FALSE,FALSE,,,FALSE,FALSE,,1644072,Firm Fence,37,31,1,8.80645,"Fences & Gates, Dog Fence, Invisible Fence, Chain Link Fence, Pool Fence, Wood Fence, Fence Gates, Dog Gates, Pet Gates, friendly neighbour fence, friendly neighbor fence, picket fence, wrought iron fence, and gate, and gates, gates, the fence, a fence, fence, fences, fence with gate, gate and fence, gate for fence, fence & gate, gate fence, fence gate, fence and gate, gates and fence, gates fence, fence & gates, fence and gates, fence gates, railings, wrought iron, electronic gates, entrance gate, trellis, fence post, front gates, chain fence, fence panels, fence chain link, chain link fence, how to wood fence, fence wood, wood for fence, wood fence, fence panel, garden gate, fence posts, fencing panels, iron gate, chain link fencing, panel fencing, gates iron, iron gates, chain link fences, fences chain link, fencing post, dog fencing, ,",0,2012-11-12T08:30:15.000-05:00,firmfence,FALSE,0,0,2,NA,FALSE,e963563208603286cd9ad27918bcd701700e7cb4,TRUE,2022-02-16T10:07:45.000-05:00,TRUE,TRUE,2192882,91.4472939927,354,NA,NA
https://homestars.com/on/pompano-beach/fences-gates,72,"c(""https://homestars.com/on/pompano-beach/fences-gates?&page=2&"", ""https://homestars.com/on/pompano-beach/fences-gates?&page=3&"", ""https://homestars.com/on/pompano-beach/fences-gates?&page=4&"", ""https://homestars.com/on/pompano-beach/fences-gates?&page=5&"", ""https://homestars.com/on/pompano-beach/fences-gates?&page=6&"", ""https://homestars.com/on/pompano-beach/fences-gates?&page=7&"", ""https://homestars.com/on/pompano-beach/fences-gates?&page=8&"")",Fences & Gates,2914230,https://mrfencee.com,/companies/2914230-mr-fencee-inc?searched_category_id=354&service_area=2191864,"Mr. Fencee Inc is a Toronto based, Eco-friendly, maintenance-free fence company with over 7 years of experience. Offering clients the best quality fences at unbeatable prices with the fastest installation times in Ontario. We offer fence installations in the regions of GTA, Toronto, Mississauga, Scarborough, Markham, Vaughan, Richmond Hill, Newmarket, King City, Bradford, Brampton, Oakville, Oshawa, Bradford etc. Our aim is to provide modern, and innovative fence designs at the lowest prices. Our fences are unique and manufactured domestically in North York using only recycled materials, better for the environment is better for us. There are no wooden products involved in the manufacturing or during installation of Mr. Fencee fences. More importantly, Mr. Fencee Fences are made in Canada, made for Canada, withstanding the most severe weather conditions and up to 147km/hr winds.",mr-fencee-inc,2018-04-11T15:26:13.000-04:00,NA,NA,NA,Vinyl (PVC) Fences and Decks,Installation of Vinyl Fences,All Season Fencing,,2017,5,"Email Transfer, cheque, and cash",,,,FALSE,FALSE,,,TRUE,FALSE,2 Years Labor and Lifetime Product Warranties,1976414,Mr. Fencee Inc.,42,34,145,9.55882,"Fences & Gates, Dog Fence, Invisible Fence, Chain Link Fence, Pool Fence, Wood Fence, Fence Gates, Dog Gates, Pet Gates, friendly neighbour fence, friendly neighbor fence, picket fence, wrought iron fence, and gate, and gates, gates, the fence, a fence, fence, fences, fence with gate, gate and fence, gate for fence, fence & gate, gate fence, fence gate, fence and gate, gates and fence, gates fence, fence & gates, fence and gates, fence gates, railings, wrought iron, electronic gates, entrance gate, trellis, fence post, front gates, chain fence, fence panels, fence chain link, chain link fence, how to wood fence, fence wood, wood for fence, wood fence, fence panel, garden gate, fence posts, fencing panels, iron gate, chain link fencing, panel fencing, gates iron, iron gates, chain link fences, fences chain link, fencing post, dog fencing, ,",0,2018-04-11T15:26:35.000-04:00,,FALSE,0,0,239,0,FALSE,f79ae7b479aad53489481b697e03af473c5e25d7,TRUE,2022-05-12T13:43:57.000-04:00,TRUE,TRUE,2191864,94.3628761627,354,NA,NA
https://homestars.com/on/pompano-beach/fences-gates,72,"c(""https://homestars.com/on/pompano-beach/fences-gates?&page=2&"", ""https://homestars.com/on/pompano-beach/fences-gates?&page=3&"", ""https://homestars.com/on/pompano-beach/fences-gates?&page=4&"", ""https://homestars.com/on/pompano-beach/fences-gates?&page=5&"", ""https://homestars.com/on/pompano-beach/fences-gates?&page=6&"", ""https://homestars.com/on/pompano-beach/fences-gates?&page=7&"", ""https://homestars.com/on/pompano-beach/fences-gates?&page=8&"")",Fences & Gates,2969810,https://www.elisgroup.ca/,/companies/2969810-elis-group?searched_category_id=354&service_area=2284925,Leave it to us to bring your visions to life. Elis Group provides clients with a comprehensive range of design services that turn ideas from mere concept to reality. Contact us today and learn what we can do for you. Please feel free to text Levan at 236-858-8210.,elis-group,2022-06-24T13:56:39.000-04:00,NA,NA,NA,,"Residental & Commercial Fencing

Our services might be varied, but they all come with the same promise of quality, dedication, and durability. Licensed and insured, an experienced contractor with knowledge.
 Exterior Stone Cladding

Our full service design & build firm specializes in major home renovations.",,,2022,2,"Cheque, Cash, E-Transfer",,,,FALSE,FALSE,,,FALSE,FALSE,Yes. Please Inquire,2031721,Elis Group,12,11,84,10,"Fences & Gates, Dog Fence, Invisible Fence, Chain Link Fence, Pool Fence, Wood Fence, Fence Gates, Dog Gates, Pet Gates, friendly neighbour fence, friendly neighbor fence, picket fence, wrought iron fence, and gate, and gates, gates, the fence, a fence, fence, fences, fence with gate, gate and fence, gate for fence, fence & gate, gate fence, fence gate, fence and gate, gates and fence, gates fence, fence & gates, fence and gates, fence gates, railings, wrought iron, electronic gates, entrance gate, trellis, fence post, front gates, chain fence, fence panels, fence chain link, chain link fence, how to wood fence, fence wood, wood for fence, wood fence, fence panel, garden gate, fence posts, fencing panels, iron gate, chain link fencing, panel fencing, gates iron, iron gates, chain link fences, fences chain link, fencing post, dog fencing, ,Lawn Maintenance, Lawn Care, Lawn Mowers, Lawn Maintenance Companies, grass cutters, grass cutting, shrub pruning, lawns, a lawns, landscaping, mowing, lawn mowers, mowing lawn, lawn mowing, mowing the lawns, mowing lawns, lawns mowing, yard and garden, maintenance lawn, lawns maintenance, lawncare, service lawn, lawn service, grass mowing, lawn treatment, green grass, lawn repair, grass lawn mowers, lawn & landscape, lawn landscape, a lawn and landscape, landscape and lawn, lawn and landscape, lawn services, yard landscape, lawn maintenance service, lawn service maintenance, landscaping a yard, yard landscaping, lawn maintenance services, maintenance company, grass cutting, maintenance business, lawn business, leaf clean up, fall leaves, hedges ,Paint & Wallpaper Contractors, Paint Colors, Paint Store, Paint Brush, Paint Shop, Home Wallpaper,Wallpaper, Paint colour advice, paint colour consultants, wallpapering, painter, faux, painters painting, painters paint, business painting, find painting, painting and restoration, new jersey painting, oh painting, local painting, wall paper repair, ,",0,2022-06-24T13:57:01.000-04:00,elisgroup,FALSE,0,0,113,0,FALSE,0514546a1fd52cdf6a00a9a7229b86f46fa97646,TRUE,NA,TRUE,TRUE,2284925,98.6530915768,354,NA,NA
https://homestars.com/on/pompano-beach/fences-gates,72,"c(""https://homestars.com/on/pompano-beach/fences-gates?&page=2&"", ""https://homestars.com/on/pompano-beach/fences-gates?&page=3&"", ""https://homestars.com/on/pompano-beach/fences-gates?&page=4&"", ""https://homestars.com/on/pompano-beach/fences-gates?&page=5&"", ""https://homestars.com/on/pompano-beach/fences-gates?&page=6&"", ""https://homestars.com/on/pompano-beach/fences-gates?&page=7&"", ""https://homestars.com/on/pompano-beach/fences-gates?&page=8&"")",Fences & Gates,2969578,,/companies/2969578-rhinestone-fencing-landscaping?searched_category_id=354&service_area=2283680,"Started working in 1993, this company was started in 2004. 
Give us a call for all your Fencing, Decks, Gates, Gazebos, Pergolas and Interlocking needs. 
We service the entire GTA and surrounding areas.  

Give us a call for your next project - (647)-633-1440",rhinestone-fencing-landscaping,2022-06-20T11:11:31.000-04:00,NA,NA,NA,,,,Fencing | Decks | Gates | Gazebos | Pergolas | Interlocking | Pre-Made Kitchen Install,2004,NA,Cash | E-Transfer | Cheques,,Fully Licensed,,TRUE,FALSE,,,TRUE,FALSE,,2031496,Rhinestone Fencing & Landscaping,19,18,31,9.94444,"Fences & Gates, Dog Fence, Invisible Fence, Chain Link Fence, Pool Fence, Wood Fence, Fence Gates, Dog Gates, Pet Gates, friendly neighbour fence, friendly neighbor fence, picket fence, wrought iron fence, and gate, and gates, gates, the fence, a fence, fence, fences, fence with gate, gate and fence, gate for fence, fence & gate, gate fence, fence gate, fence and gate, gates and fence, gates fence, fence & gates, fence and gates, fence gates, railings, wrought iron, electronic gates, entrance gate, trellis, fence post, front gates, chain fence, fence panels, fence chain link, chain link fence, how to wood fence, fence wood, wood for fence, wood fence, fence panel, garden gate, fence posts, fencing panels, iron gate, chain link fencing, panel fencing, gates iron, iron gates, chain link fences, fences chain link, fencing post, dog fencing, ,Decks, Deck, Wood Deck, Deck Patio Furniture, Patio Heater, Patio Deck, Patio Door, Patio Cover, Patio Umbrella, Patio Furniture Set, Patio Furniture Cushion, the deck, on deck, deck tech, patios, construction plans, how to build a deck, build decks, build a deck, deck plans, design deck, design a deck, deck design, deck building, building a deck, building deck, deck designs, how to make a deck, patio cover, wood deck, deck wood, deck board, patio designs, deck designs plans, deck plans designs, deck builder, deck stain, deck builders, ,Cabinetry & Millwork, Kitchen Cabinetry, Custom Cabinetry, Bathroom Cabinetry, Architectural Millwork, Millwork, custom millwork, bathroom cabinets, Kitchen cabinets, built-in cabinets, built-in cabinetry,  cabinet makers, custom cabinets kitchen, cabinetry, thomasville kitchen cabinets, cabinet doors, millwork cabinetry, custom kitchen cabinets, kraftmaid cabinets, maple cabinets, wood cabinets, stock cabinets, thermofoil cabinets, laminate cabinets, kitchen cabinets design, cherry cabinets, kitchen cabinet designs, hickory cabinets, wholesale cabinets, custom made cabinets, cabinet millwork, cabinets kitchen, kitchen cabinetry, millwork cabinets, ready to assemble cabinets, quality cabinets, bamboo cabinets, caulking,
,",0,2022-06-20T11:12:51.000-04:00,Rhinestone,FALSE,0,0,65,0,FALSE,7c9ea3b1cf5b6744b917dcee24ea73224bdf6499,TRUE,2022-11-15T09:49:14.000-05:00,TRUE,TRUE,2283680,98.519753455,354,NA,NA
https://homestars.com/on/pompano-beach/fences-gates,72,"c(""https://homestars.com/on/pompano-beach/fences-gates?&page=2&"", ""https://homestars.com/on/pompano-beach/fences-gates?&page=3&"", ""https://homestars.com/on/pompano-beach/fences-gates?&page=4&"", ""https://homestars.com/on/pompano-beach/fences-gates?&page=5&"", ""https://homestars.com/on/pompano-beach/fences-gates?&page=6&"", ""https://homestars.com/on/pompano-beach/fences-gates?&page=7&"", ""https://homestars.com/on/pompano-beach/fences-gates?&page=8&"")",Fences & Gates,2956483,https://apcons.ca/,/companies/2956483-ap-cons?searched_category_id=354&service_area=2253971,"Ap Cons is a modern construction service provider committed to delivering the best and customizable construction services to people in Toronto. We’re a one-stop brand for property owners who desire to get the best value for their resources when hiring experts to meet their construction needs. From clearing and excavation services to home additions and all that falls in between, our team of dexterous professionals can always give you the best.

Having been in the industry for a pretty while, we’ve mastered the rudiments and all it takes to keep every customer smiling in satisfaction. Little wonder our previous clients can’t stop recommending our services and hoisting our brand name in praise. When you think of a construction company you can trust in Toronto for excellent services, Ap Cons is the brand to call.  

What We Do
Here at Ap Cons, we provide a wide range of reliable construction solutions. We strive to be involved in every project we handle from start to finish, offering our clients cost-effective solutions.
Check out our services:

Excavation
Waterproofing
Concrete Work
Home Additions
Interlocking

Ap Cons is a brand that tailors each service to meet the exact needs of each client. So, when you come to us with a project, rest assured that we’ll carve out a process that works in line with your budget, site, requirements and timeline. ",ap-cons,2021-05-20T13:16:30.000-04:00,NA,NA,NA,,,,,2012,NA,"E-transfer, Cash, Cheque",,,,TRUE,FALSE,,No job is too small or big,TRUE,FALSE,"Yes, kindly ask for details",2018461,AP CONS,3,3,18,10,"Concrete Contractors, Impressed concrete, poured concrete, stamped concrete, radiant heating, concrete floors, contractors, concrete repair, concrete in, masonry, asphalt, paving, pavers, in the driveway, driveway, construction companies, driveways, block of concrete, concrete block, concrete mix, concret, concrete blocks, concrete slab, cost of concrete, concrete cost, concrete wall, price of concrete, concrete price, concrete stain, stamped concrete, concrete prices, repair concrete, how to repair concrete, repair of concrete, concrete repair, concrete slabs, decorative concrete, concrete decorative, staining concrete, concrete staining, concrete walls, countertop concrete, concrete countertops, patio ideas, cement companies, ready mix concrete, concrete ready mix, slabjack, slabjacking, mudjack, mudjacking, Driveway, caulking,,Fences & Gates, Dog Fence, Invisible Fence, Chain Link Fence, Pool Fence, Wood Fence, Fence Gates, Dog Gates, Pet Gates, friendly neighbour fence, friendly neighbor fence, picket fence, wrought iron fence, and gate, and gates, gates, the fence, a fence, fence, fences, fence with gate, gate and fence, gate for fence, fence & gate, gate fence, fence gate, fence and gate, gates and fence, gates fence, fence & gates, fence and gates, fence gates, railings, wrought iron, electronic gates, entrance gate, trellis, fence post, front gates, chain fence, fence panels, fence chain link, chain link fence, how to wood fence, fence wood, wood for fence, wood fence, fence panel, garden gate, fence posts, fencing panels, iron gate, chain link fencing, panel fencing, gates iron, iron gates, chain link fences, fences chain link, fencing post, dog fencing, ,",0,2021-05-20T13:18:06.000-04:00,,FALSE,0,0,29,0,FALSE,0814696a903043045d5e62027c3da4aff5633c60,TRUE,NA,TRUE,TRUE,2253971,78.2252388711,354,NA,NA
