Link,n_hits,all_links,category,id,url,hs_path,profile,permalink,created_at,sic_code,service_area,hours,products,services,brands,specialities,established,employee_cnt,payment_method,diplomas,licenses,memberships,liability_insurance,bonded,project_rate,project_minimum,written_contract,written_warranty,warranty_terms,parent_company_id,name,total_number_of_reviews_cache,total_number_of_approved_reviews_cache,number_of_photos_cache,avg_rating_cache,categories_info_cache,savings_count,claimed_at,subdomain,fraudulent,fraudulent_count,total_number_of_pending_reviews_cache,images_count,completion_percent_cache,bully,secret,replied_to_at_least_one_review_cache,has_set_tasks,lead_purchase_eligible,service_area_id,star_score,quote_button_category,direct_phone,direct_contact
https://homestars.com/on/camrose/gutters-eavestroughs,1,https://homestars.com/on/camrose/gutters-eavestroughs,Gutters & Eavestroughs,2952072,http://www.adamsonexteriors.ca/,/companies/2952072-adamson-exteriors?searched_category_id=347&service_area=2244266,"ABOUT ADAMSON EXTERIORS
After many years of service in the Camrose community, we feel confident that we can cater to your needs. We get the job done and we don’t just meet expectations; we exceed them. Our customers keep coming back because we’re dependable, knowledgeable and pleasant to work with.


Our employees provide unmatched service, delivering top quality service for your business! Each is committed to personal service.


Aside from our amazing staff, we take the time and care to make sure even the tiniest detail is managed, in every circumstance. There, really, is no other way.


Contact us today at 780-679-8230 to find out how we can help you. It’s our pleasure!",adamson-exteriors,2021-01-19T13:11:16.000-05:00,NA,NA,NA,,,,,2004,NA,"E-transfer, Cash, Cheque ",,,,TRUE,FALSE,,No job is too small or big,TRUE,FALSE,"Yes, kindly ask for details.",2014168,Adamson Exteriors,3,3,9,10,"Gutters & Eavestroughs, Eavestrough Cleaning, Eavestrough Installation, Eavestrough Maintenance, gutter cleaning, gutter installation, gutter maintenance, installing gutters, installing eavestroughs, Eavestrough Repair, ,",0,2021-01-19T13:12:55.000-05:00,,FALSE,0,0,10,0,FALSE,cf03ccd40143c35e76373d155e23386b5167c4b4,TRUE,TRUE,FALSE,2244266,81.5430070693,347,NA,NA
