Link,n_hits,all_links,category,id,url,hs_path,profile,permalink,created_at,sic_code,service_area,hours,products,services,brands,specialities,established,employee_cnt,payment_method,diplomas,licenses,memberships,liability_insurance,bonded,project_rate,project_minimum,written_contract,written_warranty,warranty_terms,parent_company_id,name,total_number_of_reviews_cache,total_number_of_approved_reviews_cache,number_of_photos_cache,avg_rating_cache,categories_info_cache,savings_count,claimed_at,subdomain,fraudulent,fraudulent_count,total_number_of_pending_reviews_cache,images_count,completion_percent_cache,bully,secret,replied_to_at_least_one_review_cache,latest_approved_review_created_at,has_set_tasks,lead_purchase_eligible,service_area_id,star_score,quote_button_category,direct_phone,direct_contact
https://homestars.com/on/grant-town/kitchen-bathroom-cabinets-design,55,"c(""https://homestars.com/on/grant-town/kitchen-bathroom-cabinets-design?&page=2&"", ""https://homestars.com/on/grant-town/kitchen-bathroom-cabinets-design?&page=3&"", ""https://homestars.com/on/grant-town/kitchen-bathroom-cabinets-design?&page=4&"", ""https://homestars.com/on/grant-town/kitchen-bathroom-cabinets-design?&page=5&"", ""https://homestars.com/on/grant-town/kitchen-bathroom-cabinets-design?&page=6&"")",Kitchen & Bathroom - Cabinets & Design,212424,http://www.kwoodkitchens.com,/companies/212424-k-wood-kitchens-and-bath?searched_category_id=392&service_area=2292157,"Our Services
FREE ESTIMATION K-Wood is pleased to offer free, no obligation estimates! Our qualified design consultants are ready to assistant you in every step of your project and can accurately cost out all elements to ensure there are no surprises. Visit them at our newly developed showroom today! Our showroom is open to the public weekdays from 9:00 am to 6:00 pm and Saturdays 9:00 am to 5:00 pm.
 
Kitchen Cabinetry and Design
At K-Wood, we have over 20 years’ experience designing or remodeling new kitchen spaces and manufacturing custom cabinetry for thousands of happy clients. Our experience and familiarity with the industry is vast, making us well-suited to take on any project regardless of its complexity. Whether you are looking to gain more space or build the kitchen of your dreams, trust that the specialists at K-Wood will deliver results that are beyond your expectations.
 
Bathroom Cabinetry and Design
Our team of trusted design and manufacturing professionals can offer you expert advice in improving the functionality and atmosphere of your bathroom while recommending the best materials for your design objectives. Our experienced team has successfully designed and installed thousands of bathrooms in a wide array of spaces for many delighted customers.


Renovation Services
The K-Wood team includes highly skilled and trained renovation specialists who are all licensed in their respective trades. Together with our in-house designers, they are always aware of the industry's newest trends to bring our customers only the best. Our team of renovation specialists has a large array of industry experience, from basement development to new foyers, and endeavour to elevate the experience each of our clients gets out of their home. 

TRY OUR VIRTUAL KITCHEN AND BATH DESIGNER TODAY AT kwoodkitchens.com



K-Wood Kitchens Inc. specializes in custom designs in the following:
- Kitchen Remodeling
- Bathroom Remodeling
- Custom Built Cabinetry
- Home Renovation",k-wood-kitchens-and-bath,2008-01-23T10:30:09.000-05:00,NA,"Etobicoke, Markham, Mississauga, North York, Richmond Hill, Scarborough, Thornhill, Toronto, Unionville, Vaughan, Woodbridge","Mon-Fri 9-6, Sat 9-5",,"- Kitchen Remodeling
- Bathroom Remodeling
- Custom Built Cabinetry
- Home Renovation",,"K-Wood Kitchens has over 30 years of combined industry experience in the manufacturing and design of custom kitchens, cabinetry, bathrooms and whole home renovations. Visit our state-of-the-art showroom today to start planning your dream project. ",1987,NA,All Acceptable. ,,,,TRUE,FALSE,,,TRUE,FALSE,"Yes, 5 years warranty.",66258,K Wood Kitchens and Bath,113,104,222,9.81731,"Kitchen Planning & Renovation, Kitchen Planning And Design, Kitchen Cabinet Planning, Kitchen Design, Kitchen Remodeling, kitchen or, and bathroom, a and a kitchens, kitchens and, for kitchens, a kitchens, kitchens, the house design, cabinets for kitchen, cabinets for the kitchen, cabinets and kitchen, kitchen cabinets, design a kitchen, about kitchen design, a kitchen design, how to kitchen design, design and kitchen, the kitchen design, design for kitchen, kitchen designs, renovation and remodeling, remodeling and renovation, kitchen designer,,Kitchen Renovation, caulking, ,Bathroom Renovation, Bathroom renovation, bathroom remodeling, bathroom remodelling, renovating the bathroom, tearing out the bathroom, fixing up the bathroom, bathroom contractors, bathroom vanities, bathroom vanity, design of bathroom, bathroom and design, design for bathroom, design a bathroom, design a bath, bath design, bathroom tile, bathroom cabinets, remodeling a bathroom, bathroom remodeling, remodeling the bathroom, ,Bath renovation, New tub, caulking, ,Kitchen & Bathroom - Cabinets & Design, Kitchen Cabinet And Counter, Kitchen Cabinet Hardware, Bathroom Cabinet, Bathroom Wall Cabinet, Bathroom Sink Cabinet, cabinets, kitchens, cabinetry, kitchen and cabinets, cabinets for kitchen, about kitchen cabinets, kitchen cabinets, kitchen cabinets in, cabinets for the kitchen, cabinets and kitchen, cabinets kitchen, kitchen cabinet, cabinet kitchen, the kitchen cabinet, kitchen by design, design kitchen, a kitchen design, design a kitchen, design for kitchen, design and kitchen, design by kitchen, kitchen design, cabinetry kitchen, kitchen cabinetry, designs kitchen, kitchen designs, bathroom vanities, vanity and bathroom, bath and vanity, designer kitchen, ,",0,2014-07-24T11:36:07.000-04:00,kwoodkitchens,FALSE,0,0,242,NA,FALSE,71238eba1eaf8470b100679e9709ab7702ee50ee,TRUE,2022-02-05T11:08:33.000-05:00,TRUE,TRUE,2292157,98.6417663806,392,NA,NA
https://homestars.com/on/grant-town/kitchen-bathroom-cabinets-design,55,"c(""https://homestars.com/on/grant-town/kitchen-bathroom-cabinets-design?&page=2&"", ""https://homestars.com/on/grant-town/kitchen-bathroom-cabinets-design?&page=3&"", ""https://homestars.com/on/grant-town/kitchen-bathroom-cabinets-design?&page=4&"", ""https://homestars.com/on/grant-town/kitchen-bathroom-cabinets-design?&page=5&"", ""https://homestars.com/on/grant-town/kitchen-bathroom-cabinets-design?&page=6&"")",Kitchen & Bathroom - Cabinets & Design,198439,http://www.bramptonkitchen.com,/companies/198439-brampton-kitchen-and-cabinets-ltd?searched_category_id=392&service_area=2013828,"From the year 1989 Brampton Kitchen & Cabinets Ltd. has been designing and manufacturing Custom Cabinetry, with Custom Kitchens being its flagship service. Brampton Kitchen follows a set of ethical values and professional procedures. We operate with the highest level of integrity and rigidly adhere to the policy of customer service, accountability and skill. We are a credible organization that stands behind its product. 
Extensive experience of several years and expertise of best artisans and craftsmen, we create designs that stand out. Be it your Kitchen, Bathroom, Vanity, Entertainment Unit, Bar or Walk-in Closet we have the skills to meet your every need. Our thorough knowledge of our trade is our biggest asset. We learn about your lifestyle while working alongside with you, so as to tailor your kitchen or cabinetry according to your specifications. From Planning to Designing to Manufacturing, we make sure you love every step along the way. We educate you about the industry, current trends and styles so that you make an informed decision.  We can turn your dream into reality without having to compromise on budget or quality.
",brampton-kitchen-and-cabinets-ltd,2008-01-23T10:23:40.000-05:00,NA,"Southern Ontario - Brampton, Toronto, Mississauga, Oakville, Caledon, Burlington, Vaughan, Malton, Niagara, GTA, Milton, Scarborough, Woodbridge, Richmond Hill, Orangeville, Markham, Georgetown, London, Barrie, Kingston, Kitchener, Ajax and suburbs of Toronto","Mon to Fri : 8 AM - 6 PM, Sat : 8 AM - 4 PM, Sunday - By appointment Only","All Custom Cabinetry - Custom Kitchens, Custom Bathroom Vanities, Bars, Entertainment Units, Walk-in Closets, Offices, Counter-tops. Kitchen Doors, Kitchen Cabinets, Bathroom Cabinets, Wall Units, TV units, Custom bars, Custom built-ins, custom bars, custom cabinetry, custom entertainment units, custom walk in closets, custom vanities, Custom bathroom cabinets, Custom kitchen","Kitchen / Bathroom / Offices / Entertainment Units / Closets / Bars- Manufacturing, Planning and Designing. Cabinet Installation, Servicing, Refacing of Cabinetry, Kitchen Renovation, Kitchen styles, Kitchen Manufacturing, Kitchen Designing, Bathroom Designing, Kitchen planning, kitchen redesigning, kitchen cabinetry design, counter-top installation, cabinet removal, post installation services, Kitchen designer available, custom kitchen designing, customized manufacturing, customized kitchen styles
","Richelieu, Blum, Caesarstone, Diamastone, Brampton Kitchen and Cabinets, Silestone","Over 25 years of experience, Kitchens manufactured in our own 25,000 sq.ft. facility, In-house designers, ",1989,25,"All major credit cards accepted, Debit cards, Cheques",,,"C.K.C.A, B.B.B.",TRUE,FALSE,,,TRUE,FALSE,,54939,Brampton Kitchen & Cabinets Ltd,213,153,47,9.11111,"Countertops, Granite Counter Tops, Kitchen Counter Tops, Marble Counter Tops, Laminate Counter Top, Quartz Counter Top, Corian counter top, tile counter top, silestone counter tops, arborite counter tops, custom counter tops, kitchen, remodeling, kitchen cabinet, kitchen design, ,Bathroom & Kitchen - Fixtures & Accessories, bathroom fixtures, kitchen fixtures, kitchen accessories, bathroom accessories, sink, faucet, tub, bathtub, shower, taps, kitchen reno, grouting, cabinet refinishing, custom cabinets, appliances, new appliances, kitchen island, waterfall island,,Cabinetry & Millwork, Kitchen Cabinetry, Custom Cabinetry, Bathroom Cabinetry, Architectural Millwork, Millwork, custom millwork, bathroom cabinets, Kitchen cabinets, built-in cabinets, built-in cabinetry,  cabinet makers, custom cabinets kitchen, cabinetry, thomasville kitchen cabinets, cabinet doors, millwork cabinetry, custom kitchen cabinets, kraftmaid cabinets, maple cabinets, wood cabinets, stock cabinets, thermofoil cabinets, laminate cabinets, kitchen cabinets design, cherry cabinets, kitchen cabinet designs, hickory cabinets, wholesale cabinets, custom made cabinets, cabinet millwork, cabinets kitchen, kitchen cabinetry, millwork cabinets, ready to assemble cabinets, quality cabinets, bamboo cabinets, caulking,
,Kitchen & Bathroom - Cabinets & Design, Kitchen Cabinet And Counter, Kitchen Cabinet Hardware, Bathroom Cabinet, Bathroom Wall Cabinet, Bathroom Sink Cabinet, cabinets, kitchens, cabinetry, kitchen and cabinets, cabinets for kitchen, about kitchen cabinets, kitchen cabinets, kitchen cabinets in, cabinets for the kitchen, cabinets and kitchen, cabinets kitchen, kitchen cabinet, cabinet kitchen, the kitchen cabinet, kitchen by design, design kitchen, a kitchen design, design a kitchen, design for kitchen, design and kitchen, design by kitchen, kitchen design, cabinetry kitchen, kitchen cabinetry, designs kitchen, kitchen designs, bathroom vanities, vanity and bathroom, bath and vanity, designer kitchen, ,Kitchen Planning & Renovation, Kitchen Planning And Design, Kitchen Cabinet Planning, Kitchen Design, Kitchen Remodeling, kitchen or, and bathroom, a and a kitchens, kitchens and, for kitchens, a kitchens, kitchens, the house design, cabinets for kitchen, cabinets for the kitchen, cabinets and kitchen, kitchen cabinets, design a kitchen, about kitchen design, a kitchen design, how to kitchen design, design and kitchen, the kitchen design, design for kitchen, kitchen designs, renovation and remodeling, remodeling and renovation, kitchen designer,,Kitchen Renovation, caulking, ,",0,2014-02-18T17:10:21.000-05:00,bramptonkitchens,FALSE,0,0,65,NA,FALSE,4f3a0f3d10af718f751def185f95430deb56e60d,TRUE,2019-06-27T12:57:23.000-04:00,TRUE,TRUE,2013828,87.3571226826,392,NA,NA
https://homestars.com/on/grant-town/kitchen-bathroom-cabinets-design,55,"c(""https://homestars.com/on/grant-town/kitchen-bathroom-cabinets-design?&page=2&"", ""https://homestars.com/on/grant-town/kitchen-bathroom-cabinets-design?&page=3&"", ""https://homestars.com/on/grant-town/kitchen-bathroom-cabinets-design?&page=4&"", ""https://homestars.com/on/grant-town/kitchen-bathroom-cabinets-design?&page=5&"", ""https://homestars.com/on/grant-town/kitchen-bathroom-cabinets-design?&page=6&"")",Kitchen & Bathroom - Cabinets & Design,2930808,http://www.gtakitchendepot.com/,/companies/2930808-gta-kitchen-depot?searched_category_id=392&service_area=2265927,"GTA Kitchen Depot has always operated under strong values aimed at exceeding client needs. Our communication channels are always open—our relationship with our clients begins on the first day of contact, and only ends once they’re fully satisfied with our work.

We are also a sister company of :
GTA Countertop Depot - https://www.gtacountertopdepot.com/
Paint X Pro - https://www.paintxpro.com/

When you hire our services, you can count on us for the results you want and need. Get in touch today, and discover the advantage of working with GTA Kitchen Depot",gta-kitchen-depot,2019-05-08T16:03:55.000-04:00,NA,NA,NA,,"Custom Kitchen Cabinets and Vanity designs, Painting
Countertops installation, repairs and refinishing.",,,NA,NA,"E-Transfer, Cash, Cheque",,,,TRUE,FALSE,,,TRUE,FALSE,,1992982,GTA Kitchen Depot,50,47,133,9.97872,"Kitchen & Bathroom - Cabinets & Design, Kitchen Cabinet And Counter, Kitchen Cabinet Hardware, Bathroom Cabinet, Bathroom Wall Cabinet, Bathroom Sink Cabinet, cabinets, kitchens, cabinetry, kitchen and cabinets, cabinets for kitchen, about kitchen cabinets, kitchen cabinets, kitchen cabinets in, cabinets for the kitchen, cabinets and kitchen, cabinets kitchen, kitchen cabinet, cabinet kitchen, the kitchen cabinet, kitchen by design, design kitchen, a kitchen design, design a kitchen, design for kitchen, design and kitchen, design by kitchen, kitchen design, cabinetry kitchen, kitchen cabinetry, designs kitchen, kitchen designs, bathroom vanities, vanity and bathroom, bath and vanity, designer kitchen, ,Cabinetry & Millwork, Kitchen Cabinetry, Custom Cabinetry, Bathroom Cabinetry, Architectural Millwork, Millwork, custom millwork, bathroom cabinets, Kitchen cabinets, built-in cabinets, built-in cabinetry,  cabinet makers, custom cabinets kitchen, cabinetry, thomasville kitchen cabinets, cabinet doors, millwork cabinetry, custom kitchen cabinets, kraftmaid cabinets, maple cabinets, wood cabinets, stock cabinets, thermofoil cabinets, laminate cabinets, kitchen cabinets design, cherry cabinets, kitchen cabinet designs, hickory cabinets, wholesale cabinets, custom made cabinets, cabinet millwork, cabinets kitchen, kitchen cabinetry, millwork cabinets, ready to assemble cabinets, quality cabinets, bamboo cabinets, caulking,
,",0,2019-05-08T16:04:13.000-04:00,,FALSE,0,0,191,0,FALSE,a18f1bd24ee1097db264d1aa151f97a8112a9673,TRUE,2022-08-16T18:01:25.000-04:00,TRUE,TRUE,2265927,98.5818334525,392,NA,NA
https://homestars.com/on/grant-town/kitchen-bathroom-cabinets-design,55,"c(""https://homestars.com/on/grant-town/kitchen-bathroom-cabinets-design?&page=2&"", ""https://homestars.com/on/grant-town/kitchen-bathroom-cabinets-design?&page=3&"", ""https://homestars.com/on/grant-town/kitchen-bathroom-cabinets-design?&page=4&"", ""https://homestars.com/on/grant-town/kitchen-bathroom-cabinets-design?&page=5&"", ""https://homestars.com/on/grant-town/kitchen-bathroom-cabinets-design?&page=6&"")",Kitchen & Bathroom - Cabinets & Design,2798123,http://sosna.ca/,/companies/2798123-sosna-inc?searched_category_id=392&service_area=1861631,"Sosna Inc is a reliable full-service residential Renovation company that helps homeowners implement their visions for their homes through a detailed Design and Renovation process that eliminates surprises.
",sosna-inc,2012-05-22T01:01:28.000-04:00,NA,"Toronto, Markham, Thornhill, Richmond Hill, Etobicoke, Mississauga",by appointment,,"General Contractor, Home Additions, Kitchen Renovations, Bathroom renovations, Home Renovations, Bathroom Remodeling, Kitchen Remodeling, Richmond Hill General Contractor, North York General Contractor, General Contractor in North York, General Contractor in Richmond Hill, Thornhill General Contractor, General Contractor in Thornhill, Additions, Kitchen Renovations, Bathroom renovations, Richmond Hill Home Renovations,Thornhill Home Renovations, North York Home Renovations, Kitchen renovations in Richmond Hill, Kitchen renovations in Thornhill, Kitchen renovations in North York, Thornhill Bathroom Renovations, North York Bathroom Renovations, Richmond hill Bathroom Renovations, Additions in Richmond Hill, Additions in Thornhill, Additions in North York.",,"Design, Kitchen renovations, Bathroom renovations, Interior renovations, Additions.",2001,17,,,"Toronto Metro Licence, Building Renovator License, General Carpenter License","Renomark, BBB, BILD, NKBA, Toronto Construction Association",TRUE,TRUE,,25000,TRUE,FALSE,2 years,1861175,Sosna Inc,57,54,42,9.98148,"General Contractors, Residential General Contractor, Building Contractor, Additions, Remodeling Contractor,  Renovation, Builder, building construction, renovation, remodeling, construction builders, construction company, construction companies, home repair, construction jobs, home remodeling, general contractors, contractors general, contractor general, contractors construction, construction contractors, home improvement and remodeling, kitchen remodeling, construction contractor, builders contractors, home renovation, general contracting, building contractors, building companies, home renovations, builder contractor, building contractor, remodeling contractor, commercial construction, residential construction, house contractor, concrete contractors, home contractors, general construction, construction general, contractors remodeling, remodeling contractors, remodelers, remodel contractor, remodel contractors, general contract, commercial contractors, renovations contractors, home improvement contractor, licensed contractor, license general contractor, mud room, mudroom, caulking, ,Interior Design, Home Interior Designers, Kitchen Interior Design, interior, what is interior design, about interior design, design interior, interior by design, home designs, interior designer, designer interior, how to be a interior designer, what is an interior designer, home design, decorating ideas, design and decorating, decorating and design, interior designers, interior decoration, room design, interior design decoration, interior decorating, house decorating, home decorating, desings homes, interior design decorating, interior decorating design, decorating and interior design, home building plans, decorating tips, room designs, design homes, decorating design ideas, design photos, interior house, interior decorator, bedroom design, architecture design, bedroom designs, careers in design, interior designs, office design, architectural design, ,Kitchen & Bathroom - Cabinets & Design, Kitchen Cabinet And Counter, Kitchen Cabinet Hardware, Bathroom Cabinet, Bathroom Wall Cabinet, Bathroom Sink Cabinet, cabinets, kitchens, cabinetry, kitchen and cabinets, cabinets for kitchen, about kitchen cabinets, kitchen cabinets, kitchen cabinets in, cabinets for the kitchen, cabinets and kitchen, cabinets kitchen, kitchen cabinet, cabinet kitchen, the kitchen cabinet, kitchen by design, design kitchen, a kitchen design, design a kitchen, design for kitchen, design and kitchen, design by kitchen, kitchen design, cabinetry kitchen, kitchen cabinetry, designs kitchen, kitchen designs, bathroom vanities, vanity and bathroom, bath and vanity, designer kitchen, ,Kitchen Planning & Renovation, Kitchen Planning And Design, Kitchen Cabinet Planning, Kitchen Design, Kitchen Remodeling, kitchen or, and bathroom, a and a kitchens, kitchens and, for kitchens, a kitchens, kitchens, the house design, cabinets for kitchen, cabinets for the kitchen, cabinets and kitchen, kitchen cabinets, design a kitchen, about kitchen design, a kitchen design, how to kitchen design, design and kitchen, the kitchen design, design for kitchen, kitchen designs, renovation and remodeling, remodeling and renovation, kitchen designer,,Kitchen Renovation, caulking, ,Design/Build, Contracting, Renovation, Remodeling, Restoration, Project Management, Renovation Assistance, Reno Management, architect, architects, design build, build & design, design and build, build by design, design to build. building construction, building a house, house designs, house plans, home designs, house plan, how to design a house, design house, house design, remodeling, building and design, design for building, design building, building by design, a building design, design of building, building design, design a building, building & design,  playsets, playground, wooden playset, wooden playground, play set, ",0,NA,sosnainc,FALSE,0,0,45,NA,FALSE,5e604991f7c7a1a70103a1936cc243ff16058b66,TRUE,2022-01-02T16:58:17.000-05:00,TRUE,TRUE,1861631,97.4731969951,392,NA,NA
