Link,n_hits,all_links,category,id,url,hs_path,profile,permalink,created_at,sic_code,service_area,hours,products,services,brands,specialities,established,employee_cnt,payment_method,diplomas,licenses,memberships,liability_insurance,bonded,project_rate,project_minimum,written_contract,written_warranty,warranty_terms,parent_company_id,name,total_number_of_reviews_cache,total_number_of_approved_reviews_cache,number_of_photos_cache,avg_rating_cache,categories_info_cache,savings_count,claimed_at,subdomain,fraudulent,fraudulent_count,total_number_of_pending_reviews_cache,images_count,completion_percent_cache,bully,secret,replied_to_at_least_one_review_cache,latest_approved_review_created_at,has_set_tasks,lead_purchase_eligible,service_area_id,star_score,quote_button_category,direct_phone,direct_contact
https://homestars.com/on/meadowvale/cabinetry-millwork,162,"c(""https://homestars.com/on/meadowvale/cabinetry-millwork?&page=2&"", ""https://homestars.com/on/meadowvale/cabinetry-millwork?&page=3&"", ""https://homestars.com/on/meadowvale/cabinetry-millwork?&page=4&"", ""https://homestars.com/on/meadowvale/cabinetry-millwork?&page=5&"", ""https://homestars.com/on/meadowvale/cabinetry-millwork?&page=6&"", ""https://homestars.com/on/meadowvale/cabinetry-millwork?&page=7&"", ""https://homestars.com/on/meadowvale/cabinetry-millwork?&page=8&"", ""https://homestars.com/on/meadowvale/cabinetry-millwork?&page=9&"", 
""https://homestars.com/on/meadowvale/cabinetry-millwork?&page=10&"", ""https://homestars.com/on/meadowvale/cabinetry-millwork?&page=11&"", ""https://homestars.com/on/meadowvale/cabinetry-millwork?&page=12&"", ""https://homestars.com/on/meadowvale/cabinetry-millwork?&page=13&"", ""https://homestars.com/on/meadowvale/cabinetry-millwork?&page=14&"", ""https://homestars.com/on/meadowvale/cabinetry-millwork?&page=15&"", ""https://homestars.com/on/meadowvale/cabinetry-millwork?&page=16&"", ""https://homestars.com/on/meadowvale/cabinetry-millwork?&page=17&""
)",Cabinetry & Millwork,2974220,,/companies/2974220-room-by-room?searched_category_id=322&service_area=2294431,,room-by-room,2022-10-12T15:53:02.000-04:00,NA,NA,NA,,,,,NA,NA,,,,,FALSE,FALSE,,,FALSE,FALSE,,2036121,Room by Room,2,2,14,10,"Kitchen Planning & Renovation, Kitchen Planning And Design, Kitchen Cabinet Planning, Kitchen Design, Kitchen Remodeling, kitchen or, and bathroom, a and a kitchens, kitchens and, for kitchens, a kitchens, kitchens, the house design, cabinets for kitchen, cabinets for the kitchen, cabinets and kitchen, kitchen cabinets, design a kitchen, about kitchen design, a kitchen design, how to kitchen design, design and kitchen, the kitchen design, design for kitchen, kitchen designs, renovation and remodeling, remodeling and renovation, kitchen designer,,Kitchen Renovation, caulking, ,Cabinetry & Millwork, Kitchen Cabinetry, Custom Cabinetry, Bathroom Cabinetry, Architectural Millwork, Millwork, custom millwork, bathroom cabinets, Kitchen cabinets, built-in cabinets, built-in cabinetry,  cabinet makers, custom cabinets kitchen, cabinetry, thomasville kitchen cabinets, cabinet doors, millwork cabinetry, custom kitchen cabinets, kraftmaid cabinets, maple cabinets, wood cabinets, stock cabinets, thermofoil cabinets, laminate cabinets, kitchen cabinets design, cherry cabinets, kitchen cabinet designs, hickory cabinets, wholesale cabinets, custom made cabinets, cabinet millwork, cabinets kitchen, kitchen cabinetry, millwork cabinets, ready to assemble cabinets, quality cabinets, bamboo cabinets, caulking,
,",0,2022-10-12T16:03:42.000-04:00,,FALSE,0,0,15,0,FALSE,02eeb747080a54deab0366940f4c75af7e617d44,TRUE,2022-10-27T09:57:00.000-04:00,TRUE,TRUE,2294431,90.8572973489,322,NA,NA
https://homestars.com/on/meadowvale/cabinetry-millwork,162,"c(""https://homestars.com/on/meadowvale/cabinetry-millwork?&page=2&"", ""https://homestars.com/on/meadowvale/cabinetry-millwork?&page=3&"", ""https://homestars.com/on/meadowvale/cabinetry-millwork?&page=4&"", ""https://homestars.com/on/meadowvale/cabinetry-millwork?&page=5&"", ""https://homestars.com/on/meadowvale/cabinetry-millwork?&page=6&"", ""https://homestars.com/on/meadowvale/cabinetry-millwork?&page=7&"", ""https://homestars.com/on/meadowvale/cabinetry-millwork?&page=8&"", ""https://homestars.com/on/meadowvale/cabinetry-millwork?&page=9&"", 
""https://homestars.com/on/meadowvale/cabinetry-millwork?&page=10&"", ""https://homestars.com/on/meadowvale/cabinetry-millwork?&page=11&"", ""https://homestars.com/on/meadowvale/cabinetry-millwork?&page=12&"", ""https://homestars.com/on/meadowvale/cabinetry-millwork?&page=13&"", ""https://homestars.com/on/meadowvale/cabinetry-millwork?&page=14&"", ""https://homestars.com/on/meadowvale/cabinetry-millwork?&page=15&"", ""https://homestars.com/on/meadowvale/cabinetry-millwork?&page=16&"", ""https://homestars.com/on/meadowvale/cabinetry-millwork?&page=17&""
)",Cabinetry & Millwork,2972451,,/companies/2972451-cj-renos?searched_category_id=322&service_area=2290295,"Cj Renos is an Ontario based kitchen renovation company that specializes in refacing, rather than replacing. we serve all around GTA.

",cj-renos,2022-08-31T15:08:22.000-04:00,NA,NA,NA,benjamin moore,"Kitchen Cabinet  spray Painting , Refinishing,Refacing, New countertop, Backsplash, custom cabinetry,  Bathroom renovation, all type of flooring,  Deck and fence ",,,2021,3,"Visa, Mastercard, Amex, Cash, Debit, Cheque, Email Money Transfer",,,,FALSE,TRUE,,,FALSE,FALSE,,2034362,Cj Renos,2,2,79,10,"Cabinetry & Millwork, Kitchen Cabinetry, Custom Cabinetry, Bathroom Cabinetry, Architectural Millwork, Millwork, custom millwork, bathroom cabinets, Kitchen cabinets, built-in cabinets, built-in cabinetry,  cabinet makers, custom cabinets kitchen, cabinetry, thomasville kitchen cabinets, cabinet doors, millwork cabinetry, custom kitchen cabinets, kraftmaid cabinets, maple cabinets, wood cabinets, stock cabinets, thermofoil cabinets, laminate cabinets, kitchen cabinets design, cherry cabinets, kitchen cabinet designs, hickory cabinets, wholesale cabinets, custom made cabinets, cabinet millwork, cabinets kitchen, kitchen cabinetry, millwork cabinets, ready to assemble cabinets, quality cabinets, bamboo cabinets, caulking,
,Floor Laying & Refinishing, Hardwood Floor, Wood Floor, Floor Tile, Dance Floor, Ceramic Floor Tile, Floor Refinishing, bamboo floor, cork floor, FSC wood flooring, stone floor, marble floor, slate floor, squeaky floor repair, laminate, laminate repair, wood floor, floor and wood, wood flooring, wood floors, floors in wood, hardwood flooring, hardwood floors, hardwood floors and, hardwood floor, hardwood floor wood, wood floor flooring, refinishing, floor refinishing, floor refinishing in, refinishing floor, hardwood install, floor laying, laying a floor, flood sanding, wood floor refinishing, refinishing hardwood floors, flooring laying, wood floors refinishing, wood flooring refinishing, floor co, flooring hard wood, hard wood floors, laying floors, flooring company, flooring engineered hardwood, floor company, hard wood floor, cleaning hardwood floors, installing hardwood flooring, installing hardwood floors, installing wood flooring, installing wood floors, installing hardwood floors, installing wood flooring, installing wood floors, installing hardwood floor, hardwood flooring installation, business floor, wood flooring installation, hardwood floor installation, floor companies, lay hardwood flooring, lay hardwood floor, wood floor repair, repair wood floor, repair hardwood floor, hardwood floor repair, finishing a hardwood floor, squeeky floors,,Hardwood floors, Install hardwood floors, caulking,",0,2022-08-31T15:09:18.000-04:00,,FALSE,0,0,80,0,FALSE,0a958afd44186e5a683e40ea7f3a499877a2636e,TRUE,NA,TRUE,TRUE,2290295,85.7495740148,322,NA,NA
https://homestars.com/on/meadowvale/cabinetry-millwork,162,"c(""https://homestars.com/on/meadowvale/cabinetry-millwork?&page=2&"", ""https://homestars.com/on/meadowvale/cabinetry-millwork?&page=3&"", ""https://homestars.com/on/meadowvale/cabinetry-millwork?&page=4&"", ""https://homestars.com/on/meadowvale/cabinetry-millwork?&page=5&"", ""https://homestars.com/on/meadowvale/cabinetry-millwork?&page=6&"", ""https://homestars.com/on/meadowvale/cabinetry-millwork?&page=7&"", ""https://homestars.com/on/meadowvale/cabinetry-millwork?&page=8&"", ""https://homestars.com/on/meadowvale/cabinetry-millwork?&page=9&"", 
""https://homestars.com/on/meadowvale/cabinetry-millwork?&page=10&"", ""https://homestars.com/on/meadowvale/cabinetry-millwork?&page=11&"", ""https://homestars.com/on/meadowvale/cabinetry-millwork?&page=12&"", ""https://homestars.com/on/meadowvale/cabinetry-millwork?&page=13&"", ""https://homestars.com/on/meadowvale/cabinetry-millwork?&page=14&"", ""https://homestars.com/on/meadowvale/cabinetry-millwork?&page=15&"", ""https://homestars.com/on/meadowvale/cabinetry-millwork?&page=16&"", ""https://homestars.com/on/meadowvale/cabinetry-millwork?&page=17&""
)",Cabinetry & Millwork,2959882,https://www.shoprhw.com,/companies/2959882-rhw?searched_category_id=322&service_area=2261568,"Shop RHW is a Toronto-based studio with a focus on solid wood custom furniture hand crafted by Rundell Haynes-Wells. 
In addition to being a craftsman, he also offers custom design consultation and renderings.

Rundell combines years of experience problem solving, exploring, and innovating, and has been a maker of things all of his life. 
He’s a natural born collaborator and is generous with the information he shares with his clients in the hope that more knowledge and understanding of custom furniture will inspire sustained interest and appreciation.

Please give me a call - 647-453-0093",rhw,2021-09-21T01:27:51.000-04:00,NA,NA,NA,,,,Furniture | Cabinets | Millwork,NA,NA,Cash | Cheques | E-Transfer,,Fully Licensed,,TRUE,FALSE,,,TRUE,FALSE,,2021858,RHW,8,8,31,10,"Furniture, Bedroom Furniture, Office Furniture, Furniture Store, Kid Furniture, Patio Furniture, Baby Furniture, Contemporary Furniture, Dining Room Furniture, furniture stores, the furniture store, furniture store, furniture shops, office furniture, patio furniture, home furnishings, the furniture warehouse, warehouse furniture, furniture warehouse, home furniture, furniture shop, bedroom furniture, furniture bedroom, home decorating, outdoor furniture, room furniture, room to room furniture, outside furniture, used furniture, bed furniture, house furniture, city furniture, furniture city, outlet furniture, furniture outlet, wood furniture, furniture for sale, furniture sale, sale furniture, furniture on sale, out door furniture, cheap furniture, furniture cheap, furnitures, sofa furniture, furniture modern, modern furniture, furniture discount, discount furniture, old furniture, furniture outlets, ,Cabinetry & Millwork, Kitchen Cabinetry, Custom Cabinetry, Bathroom Cabinetry, Architectural Millwork, Millwork, custom millwork, bathroom cabinets, Kitchen cabinets, built-in cabinets, built-in cabinetry,  cabinet makers, custom cabinets kitchen, cabinetry, thomasville kitchen cabinets, cabinet doors, millwork cabinetry, custom kitchen cabinets, kraftmaid cabinets, maple cabinets, wood cabinets, stock cabinets, thermofoil cabinets, laminate cabinets, kitchen cabinets design, cherry cabinets, kitchen cabinet designs, hickory cabinets, wholesale cabinets, custom made cabinets, cabinet millwork, cabinets kitchen, kitchen cabinetry, millwork cabinets, ready to assemble cabinets, quality cabinets, bamboo cabinets, caulking,
,",0,2021-09-21T01:36:19.000-04:00,RHW,FALSE,0,0,36,0,FALSE,7aa83401a3703649b922292b28ac91e38539d3b1,TRUE,NA,TRUE,TRUE,2261568,90.684163543,322,NA,NA
https://homestars.com/on/meadowvale/cabinetry-millwork,162,"c(""https://homestars.com/on/meadowvale/cabinetry-millwork?&page=2&"", ""https://homestars.com/on/meadowvale/cabinetry-millwork?&page=3&"", ""https://homestars.com/on/meadowvale/cabinetry-millwork?&page=4&"", ""https://homestars.com/on/meadowvale/cabinetry-millwork?&page=5&"", ""https://homestars.com/on/meadowvale/cabinetry-millwork?&page=6&"", ""https://homestars.com/on/meadowvale/cabinetry-millwork?&page=7&"", ""https://homestars.com/on/meadowvale/cabinetry-millwork?&page=8&"", ""https://homestars.com/on/meadowvale/cabinetry-millwork?&page=9&"", 
""https://homestars.com/on/meadowvale/cabinetry-millwork?&page=10&"", ""https://homestars.com/on/meadowvale/cabinetry-millwork?&page=11&"", ""https://homestars.com/on/meadowvale/cabinetry-millwork?&page=12&"", ""https://homestars.com/on/meadowvale/cabinetry-millwork?&page=13&"", ""https://homestars.com/on/meadowvale/cabinetry-millwork?&page=14&"", ""https://homestars.com/on/meadowvale/cabinetry-millwork?&page=15&"", ""https://homestars.com/on/meadowvale/cabinetry-millwork?&page=16&"", ""https://homestars.com/on/meadowvale/cabinetry-millwork?&page=17&""
)",Cabinetry & Millwork,2928471,https://www.xactdesign.ca,/companies/2928471-xact-design-inc?searched_category_id=322&service_area=2295671,"Who We Are
Xact Design Inc. Since 1995
For over 20 years, Xact Design has been delivering quality workmanship, superior reliability, and excellence in the latest trends to homes across the GTA.

Xact Design Inc. is not just a construction company; we are a dedicated team of creative and experienced professionals striving to bring our clients’ vision to reality.
XACT offers an innovative and professional approach to residential and commercial renovations. 
From kitchens, bathroom, custom cabinetry, complete home projects, retail stores, display projects.

Our team’s standard for high quality finishes giving each client the finest complete project - better than they had imagined.
We have built a solid reputation for quality workmanship, reliability, and competitive pricing. 
Our unique approach to working closely with our customers and our care for craftsmanship have lead to countless successful renovation projects.

Give us a call now - 416-897-2805",xact-design-inc,2019-03-11T20:51:00.000-04:00,NA,NA,NA,,,,Kitchen Renovation | Basement Renovation | Bathroom Renovation | Living Room Renovation | Bedroom Renovation | Home Addition | Full Home Renovation | Custom Cabinetry | Design & Planning,NA,NA,Cash | Cheques | E-Transfer,,Fully Licensed,,TRUE,FALSE,,,TRUE,FALSE,,1990645,Xact Design Inc,11,6,55,10,"Cabinetry & Millwork, Kitchen Cabinetry, Custom Cabinetry, Bathroom Cabinetry, Architectural Millwork, Millwork, custom millwork, bathroom cabinets, Kitchen cabinets, built-in cabinets, built-in cabinetry,  cabinet makers, custom cabinets kitchen, cabinetry, thomasville kitchen cabinets, cabinet doors, millwork cabinetry, custom kitchen cabinets, kraftmaid cabinets, maple cabinets, wood cabinets, stock cabinets, thermofoil cabinets, laminate cabinets, kitchen cabinets design, cherry cabinets, kitchen cabinet designs, hickory cabinets, wholesale cabinets, custom made cabinets, cabinet millwork, cabinets kitchen, kitchen cabinetry, millwork cabinets, ready to assemble cabinets, quality cabinets, bamboo cabinets, caulking,
,",0,2019-03-11T20:51:32.000-04:00,xact,FALSE,0,0,56,0,FALSE,1329d9001475fac6bb2157436450d3b865dc0ba6,TRUE,NA,TRUE,TRUE,2295671,90.3739803511,322,NA,NA
https://homestars.com/on/meadowvale/cabinetry-millwork,162,"c(""https://homestars.com/on/meadowvale/cabinetry-millwork?&page=2&"", ""https://homestars.com/on/meadowvale/cabinetry-millwork?&page=3&"", ""https://homestars.com/on/meadowvale/cabinetry-millwork?&page=4&"", ""https://homestars.com/on/meadowvale/cabinetry-millwork?&page=5&"", ""https://homestars.com/on/meadowvale/cabinetry-millwork?&page=6&"", ""https://homestars.com/on/meadowvale/cabinetry-millwork?&page=7&"", ""https://homestars.com/on/meadowvale/cabinetry-millwork?&page=8&"", ""https://homestars.com/on/meadowvale/cabinetry-millwork?&page=9&"", 
""https://homestars.com/on/meadowvale/cabinetry-millwork?&page=10&"", ""https://homestars.com/on/meadowvale/cabinetry-millwork?&page=11&"", ""https://homestars.com/on/meadowvale/cabinetry-millwork?&page=12&"", ""https://homestars.com/on/meadowvale/cabinetry-millwork?&page=13&"", ""https://homestars.com/on/meadowvale/cabinetry-millwork?&page=14&"", ""https://homestars.com/on/meadowvale/cabinetry-millwork?&page=15&"", ""https://homestars.com/on/meadowvale/cabinetry-millwork?&page=16&"", ""https://homestars.com/on/meadowvale/cabinetry-millwork?&page=17&""
)",Cabinetry & Millwork,2968746,https://adastrapainting.ca/,/companies/2968746-adastra-painting-inc?searched_category_id=322&service_area=2281798,"Who we are
We are a team of experienced painters who have been painting for over 15 years, and specializing in Kitchen Cabinet Refinishing for over 5 years. 



Ultimately, we want you to show off our work!! 

Highly Trained and Experienced Painters
As a premier Kitchen Cabinet Refinishing Firm, we take the utmost pride in providing the best customer experience which means we will always leave the space we worked in cleaner than we found it. We will always deliver what we promised as we are not happy until our clients are satisfied.

We Care About the Details
Kitchen Cabinets are the foremost important aspect of your kitchen. 

Our process is tried and true, it will leave your kitchen with a refreshed Factory Finish that will bring your cabinets back to Brand New.

Customer Satisfaction Guaranteed
We work around your busy schedule and consult with you on all aspects of colour selection and colour coordination for your project to ensure that the project is completed according to your preferences. ",adastra-painting-inc,2022-05-29T00:13:57.000-04:00,NA,NA,NA,,,,,NA,NA,,,,,FALSE,FALSE,,,FALSE,FALSE,,2030664,Adastra Painting Inc.,7,7,17,10,"Cabinetry & Millwork, Kitchen Cabinetry, Custom Cabinetry, Bathroom Cabinetry, Architectural Millwork, Millwork, custom millwork, bathroom cabinets, Kitchen cabinets, built-in cabinets, built-in cabinetry,  cabinet makers, custom cabinets kitchen, cabinetry, thomasville kitchen cabinets, cabinet doors, millwork cabinetry, custom kitchen cabinets, kraftmaid cabinets, maple cabinets, wood cabinets, stock cabinets, thermofoil cabinets, laminate cabinets, kitchen cabinets design, cherry cabinets, kitchen cabinet designs, hickory cabinets, wholesale cabinets, custom made cabinets, cabinet millwork, cabinets kitchen, kitchen cabinetry, millwork cabinets, ready to assemble cabinets, quality cabinets, bamboo cabinets, caulking,
,Paint & Wallpaper Contractors, Paint Colors, Paint Store, Paint Brush, Paint Shop, Home Wallpaper,Wallpaper, Paint colour advice, paint colour consultants, wallpapering, painter, faux, painters painting, painters paint, business painting, find painting, painting and restoration, new jersey painting, oh painting, local painting, wall paper repair, ,",0,2022-05-29T00:15:04.000-04:00,AdastraPainting,FALSE,0,0,13,0,FALSE,8738b6c3693dab97fdd24ce1a485732d748c2b86,TRUE,NA,TRUE,TRUE,2281798,89.6005981695,322,NA,NA
https://homestars.com/on/meadowvale/cabinetry-millwork,162,"c(""https://homestars.com/on/meadowvale/cabinetry-millwork?&page=2&"", ""https://homestars.com/on/meadowvale/cabinetry-millwork?&page=3&"", ""https://homestars.com/on/meadowvale/cabinetry-millwork?&page=4&"", ""https://homestars.com/on/meadowvale/cabinetry-millwork?&page=5&"", ""https://homestars.com/on/meadowvale/cabinetry-millwork?&page=6&"", ""https://homestars.com/on/meadowvale/cabinetry-millwork?&page=7&"", ""https://homestars.com/on/meadowvale/cabinetry-millwork?&page=8&"", ""https://homestars.com/on/meadowvale/cabinetry-millwork?&page=9&"", 
""https://homestars.com/on/meadowvale/cabinetry-millwork?&page=10&"", ""https://homestars.com/on/meadowvale/cabinetry-millwork?&page=11&"", ""https://homestars.com/on/meadowvale/cabinetry-millwork?&page=12&"", ""https://homestars.com/on/meadowvale/cabinetry-millwork?&page=13&"", ""https://homestars.com/on/meadowvale/cabinetry-millwork?&page=14&"", ""https://homestars.com/on/meadowvale/cabinetry-millwork?&page=15&"", ""https://homestars.com/on/meadowvale/cabinetry-millwork?&page=16&"", ""https://homestars.com/on/meadowvale/cabinetry-millwork?&page=17&""
)",Cabinetry & Millwork,2968746,https://adastrapainting.ca/,/companies/2968746-adastra-painting-inc?searched_category_id=322&service_area=2282290,"Who we are
We are a team of experienced painters who have been painting for over 15 years, and specializing in Kitchen Cabinet Refinishing for over 5 years. 



Ultimately, we want you to show off our work!! 

Highly Trained and Experienced Painters
As a premier Kitchen Cabinet Refinishing Firm, we take the utmost pride in providing the best customer experience which means we will always leave the space we worked in cleaner than we found it. We will always deliver what we promised as we are not happy until our clients are satisfied.

We Care About the Details
Kitchen Cabinets are the foremost important aspect of your kitchen. 

Our process is tried and true, it will leave your kitchen with a refreshed Factory Finish that will bring your cabinets back to Brand New.

Customer Satisfaction Guaranteed
We work around your busy schedule and consult with you on all aspects of colour selection and colour coordination for your project to ensure that the project is completed according to your preferences. ",adastra-painting-inc,2022-05-29T00:13:57.000-04:00,NA,NA,NA,,,,,NA,NA,,,,,FALSE,FALSE,,,FALSE,FALSE,,2030664,Adastra Painting Inc.,7,7,17,10,"Cabinetry & Millwork, Kitchen Cabinetry, Custom Cabinetry, Bathroom Cabinetry, Architectural Millwork, Millwork, custom millwork, bathroom cabinets, Kitchen cabinets, built-in cabinets, built-in cabinetry,  cabinet makers, custom cabinets kitchen, cabinetry, thomasville kitchen cabinets, cabinet doors, millwork cabinetry, custom kitchen cabinets, kraftmaid cabinets, maple cabinets, wood cabinets, stock cabinets, thermofoil cabinets, laminate cabinets, kitchen cabinets design, cherry cabinets, kitchen cabinet designs, hickory cabinets, wholesale cabinets, custom made cabinets, cabinet millwork, cabinets kitchen, kitchen cabinetry, millwork cabinets, ready to assemble cabinets, quality cabinets, bamboo cabinets, caulking,
,Paint & Wallpaper Contractors, Paint Colors, Paint Store, Paint Brush, Paint Shop, Home Wallpaper,Wallpaper, Paint colour advice, paint colour consultants, wallpapering, painter, faux, painters painting, painters paint, business painting, find painting, painting and restoration, new jersey painting, oh painting, local painting, wall paper repair, ,",0,2022-05-29T00:15:04.000-04:00,AdastraPainting,FALSE,0,0,13,0,FALSE,8738b6c3693dab97fdd24ce1a485732d748c2b86,TRUE,NA,TRUE,TRUE,2282290,89.6005981695,322,NA,NA
