Link,n_hits,all_links,category,id,url,hs_path,profile,permalink,created_at,sic_code,service_area,hours,products,services,brands,specialities,established,employee_cnt,payment_method,diplomas,licenses,memberships,liability_insurance,bonded,project_rate,project_minimum,written_contract,written_warranty,warranty_terms,parent_company_id,name,total_number_of_reviews_cache,total_number_of_approved_reviews_cache,number_of_photos_cache,avg_rating_cache,categories_info_cache,savings_count,claimed_at,subdomain,fraudulent,fraudulent_count,total_number_of_pending_reviews_cache,images_count,completion_percent_cache,bully,secret,replied_to_at_least_one_review_cache,latest_approved_review_created_at,has_set_tasks,lead_purchase_eligible,service_area_id,star_score,quote_button_category,direct_phone,direct_contact
https://homestars.com/on/bramalea/tile-stone-contractors,94,"c(""https://homestars.com/on/bramalea/tile-stone-contractors?&page=2&"", ""https://homestars.com/on/bramalea/tile-stone-contractors?&page=3&"", ""https://homestars.com/on/bramalea/tile-stone-contractors?&page=4&"", ""https://homestars.com/on/bramalea/tile-stone-contractors?&page=5&"", ""https://homestars.com/on/bramalea/tile-stone-contractors?&page=6&"", ""https://homestars.com/on/bramalea/tile-stone-contractors?&page=7&"", ""https://homestars.com/on/bramalea/tile-stone-contractors?&page=8&"", ""https://homestars.com/on/bramalea/tile-stone-contractors?&page=9&"", 
""https://homestars.com/on/bramalea/tile-stone-contractors?&page=10&"")",Tile & Stone Contractors,2973477,,/companies/2973477-david-gta-hardwood-flooring?searched_category_id=442&service_area=2292690,,david-gta-hardwood-flooring,2022-09-26T08:08:58.000-04:00,NA,NA,NA,,,,,NA,NA,,,,,FALSE,FALSE,,,FALSE,FALSE,,2035388,David GTA Hardwood Flooring,2,1,2,10,"Tile & Stone Contractors, Natural Stone Tile, Stone Floor Tile, Ceramic Tile, Floor tile, Tile installers, Stone installers, stone counter top installers, tile counter top installers, stone backsplash intallers, granite installers, marble installers, limestone installers, linoleum installers, slate contractors, slate installers,install tite ,backsplash , fire place veenerneed someone to install blacksplash , wall stone veener bath room mosaic,Floor Laying & Refinishing, Hardwood Floor, Wood Floor, Floor Tile, Dance Floor, Ceramic Floor Tile, Floor Refinishing, bamboo floor, cork floor, FSC wood flooring, stone floor, marble floor, slate floor, squeaky floor repair, laminate, laminate repair, wood floor, floor and wood, wood flooring, wood floors, floors in wood, hardwood flooring, hardwood floors, hardwood floors and, hardwood floor, hardwood floor wood, wood floor flooring, refinishing, floor refinishing, floor refinishing in, refinishing floor, hardwood install, floor laying, laying a floor, flood sanding, wood floor refinishing, refinishing hardwood floors, flooring laying, wood floors refinishing, wood flooring refinishing, floor co, flooring hard wood, hard wood floors, laying floors, flooring company, flooring engineered hardwood, floor company, hard wood floor, cleaning hardwood floors, installing hardwood flooring, installing hardwood floors, installing wood flooring, installing wood floors, installing hardwood floors, installing wood flooring, installing wood floors, installing hardwood floor, hardwood flooring installation, business floor, wood flooring installation, hardwood floor installation, floor companies, lay hardwood flooring, lay hardwood floor, wood floor repair, repair wood floor, repair hardwood floor, hardwood floor repair, finishing a hardwood floor, squeeky floors,,Hardwood floors, Install hardwood floors, caulking,Stair Builders, stairs, spiral stairways, spiral stairs, wood stairs, staircase, staircases,stairsSimple ten stairs instillation straigth,stairs instalation, ,",0,2022-09-26T08:16:12.000-04:00,,FALSE,0,0,3,0,FALSE,5435bfffb5ed97222bb187884b36993d3ced826c,TRUE,2022-09-29T22:59:15.000-04:00,TRUE,TRUE,2292690,90.5741664043,442,NA,NA
https://homestars.com/on/bramalea/tile-stone-contractors,94,"c(""https://homestars.com/on/bramalea/tile-stone-contractors?&page=2&"", ""https://homestars.com/on/bramalea/tile-stone-contractors?&page=3&"", ""https://homestars.com/on/bramalea/tile-stone-contractors?&page=4&"", ""https://homestars.com/on/bramalea/tile-stone-contractors?&page=5&"", ""https://homestars.com/on/bramalea/tile-stone-contractors?&page=6&"", ""https://homestars.com/on/bramalea/tile-stone-contractors?&page=7&"", ""https://homestars.com/on/bramalea/tile-stone-contractors?&page=8&"", ""https://homestars.com/on/bramalea/tile-stone-contractors?&page=9&"", 
""https://homestars.com/on/bramalea/tile-stone-contractors?&page=10&"")",Tile & Stone Contractors,2973545,NA,/companies/2973545-clarke-construction-clever-truckers-incorporated?searched_category_id=442&service_area=2292852,NA,clarke-construction-clever-truckers-incorporated,2022-09-27T11:41:22.000-04:00,NA,NA,NA,NA,NA,NA,NA,NA,NA,NA,NA,NA,NA,FALSE,FALSE,NA,NA,FALSE,FALSE,NA,2035456,Clarke Construction & Clever Truckers Incorporated,0,0,0,NA,"Tile & Stone Contractors, Natural Stone Tile, Stone Floor Tile, Ceramic Tile, Floor tile, Tile installers, Stone installers, stone counter top installers, tile counter top installers, stone backsplash intallers, granite installers, marble installers, limestone installers, linoleum installers, slate contractors, slate installers,install tite ,backsplash , fire place veenerneed someone to install blacksplash , wall stone veener bath room mosaic,Floor Laying & Refinishing, Hardwood Floor, Wood Floor, Floor Tile, Dance Floor, Ceramic Floor Tile, Floor Refinishing, bamboo floor, cork floor, FSC wood flooring, stone floor, marble floor, slate floor, squeaky floor repair, laminate, laminate repair, wood floor, floor and wood, wood flooring, wood floors, floors in wood, hardwood flooring, hardwood floors, hardwood floors and, hardwood floor, hardwood floor wood, wood floor flooring, refinishing, floor refinishing, floor refinishing in, refinishing floor, hardwood install, floor laying, laying a floor, flood sanding, wood floor refinishing, refinishing hardwood floors, flooring laying, wood floors refinishing, wood flooring refinishing, floor co, flooring hard wood, hard wood floors, laying floors, flooring company, flooring engineered hardwood, floor company, hard wood floor, cleaning hardwood floors, installing hardwood flooring, installing hardwood floors, installing wood flooring, installing wood floors, installing hardwood floors, installing wood flooring, installing wood floors, installing hardwood floor, hardwood flooring installation, business floor, wood flooring installation, hardwood floor installation, floor companies, lay hardwood flooring, lay hardwood floor, wood floor repair, repair wood floor, repair hardwood floor, hardwood floor repair, finishing a hardwood floor, squeeky floors,,Hardwood floors, Install hardwood floors, caulking,Framing, carpentry, carpenter, building a house, house building, house designs, home designs, house plan, design house, house design, how to build a house. build a house, building plans, houseplans, home builders in, building house, house building plans, house builders, construction of house, house construction, building homes, design homes, modular home, house builder, homebuilders,Carpenters, interior framing, ,General Contractors, Residential General Contractor, Building Contractor, Additions, Remodeling Contractor,  Renovation, Builder, building construction, renovation, remodeling, construction builders, construction company, construction companies, home repair, construction jobs, home remodeling, general contractors, contractors general, contractor general, contractors construction, construction contractors, home improvement and remodeling, kitchen remodeling, construction contractor, builders contractors, home renovation, general contracting, building contractors, building companies, home renovations, builder contractor, building contractor, remodeling contractor, commercial construction, residential construction, house contractor, concrete contractors, home contractors, general construction, construction general, contractors remodeling, remodeling contractors, remodelers, remodel contractor, remodel contractors, general contract, commercial contractors, renovations contractors, home improvement contractor, licensed contractor, license general contractor, mud room, mudroom, caulking, ,Paint & Wallpaper Contractors, Paint Colors, Paint Store, Paint Brush, Paint Shop, Home Wallpaper,Wallpaper, Paint colour advice, paint colour consultants, wallpapering, painter, faux, painters painting, painters paint, business painting, find painting, painting and restoration, new jersey painting, oh painting, local painting, wall paper repair, ,Drywall Contractors, Dry Wall Repair, Dry Wall Installation, dry wall contracting, gypsum repair, gypsum installation, gypsum contractors, gyprock installers, gyprock intallation, dry wall installers, sheetrock, wall board, drywall, drywaller, waller, wall repair, drywall, plaster, how to drywall, drywall, what is drywall, sheetrock, dry wall, plastering, wall repair, drywall repair, how to repair drywall, repair drywall,  ,",0,2022-09-27T11:44:01.000-04:00,NA,FALSE,0,0,0,0,FALSE,a582a4d1adfcbff4812ff71d9898bdc1b64638ec,FALSE,NA,FALSE,TRUE,2292852,-1.0,442,NA,NA
https://homestars.com/on/bramalea/tile-stone-contractors,94,"c(""https://homestars.com/on/bramalea/tile-stone-contractors?&page=2&"", ""https://homestars.com/on/bramalea/tile-stone-contractors?&page=3&"", ""https://homestars.com/on/bramalea/tile-stone-contractors?&page=4&"", ""https://homestars.com/on/bramalea/tile-stone-contractors?&page=5&"", ""https://homestars.com/on/bramalea/tile-stone-contractors?&page=6&"", ""https://homestars.com/on/bramalea/tile-stone-contractors?&page=7&"", ""https://homestars.com/on/bramalea/tile-stone-contractors?&page=8&"", ""https://homestars.com/on/bramalea/tile-stone-contractors?&page=9&"", 
""https://homestars.com/on/bramalea/tile-stone-contractors?&page=10&"")",Tile & Stone Contractors,2973545,NA,/companies/2973545-clarke-construction-clever-truckers-incorporated?searched_category_id=442&service_area=2292859,NA,clarke-construction-clever-truckers-incorporated,2022-09-27T11:41:22.000-04:00,NA,NA,NA,NA,NA,NA,NA,NA,NA,NA,NA,NA,NA,FALSE,FALSE,NA,NA,FALSE,FALSE,NA,2035456,Clarke Construction & Clever Truckers Incorporated,0,0,0,NA,"Tile & Stone Contractors, Natural Stone Tile, Stone Floor Tile, Ceramic Tile, Floor tile, Tile installers, Stone installers, stone counter top installers, tile counter top installers, stone backsplash intallers, granite installers, marble installers, limestone installers, linoleum installers, slate contractors, slate installers,install tite ,backsplash , fire place veenerneed someone to install blacksplash , wall stone veener bath room mosaic,Floor Laying & Refinishing, Hardwood Floor, Wood Floor, Floor Tile, Dance Floor, Ceramic Floor Tile, Floor Refinishing, bamboo floor, cork floor, FSC wood flooring, stone floor, marble floor, slate floor, squeaky floor repair, laminate, laminate repair, wood floor, floor and wood, wood flooring, wood floors, floors in wood, hardwood flooring, hardwood floors, hardwood floors and, hardwood floor, hardwood floor wood, wood floor flooring, refinishing, floor refinishing, floor refinishing in, refinishing floor, hardwood install, floor laying, laying a floor, flood sanding, wood floor refinishing, refinishing hardwood floors, flooring laying, wood floors refinishing, wood flooring refinishing, floor co, flooring hard wood, hard wood floors, laying floors, flooring company, flooring engineered hardwood, floor company, hard wood floor, cleaning hardwood floors, installing hardwood flooring, installing hardwood floors, installing wood flooring, installing wood floors, installing hardwood floors, installing wood flooring, installing wood floors, installing hardwood floor, hardwood flooring installation, business floor, wood flooring installation, hardwood floor installation, floor companies, lay hardwood flooring, lay hardwood floor, wood floor repair, repair wood floor, repair hardwood floor, hardwood floor repair, finishing a hardwood floor, squeeky floors,,Hardwood floors, Install hardwood floors, caulking,Framing, carpentry, carpenter, building a house, house building, house designs, home designs, house plan, design house, house design, how to build a house. build a house, building plans, houseplans, home builders in, building house, house building plans, house builders, construction of house, house construction, building homes, design homes, modular home, house builder, homebuilders,Carpenters, interior framing, ,General Contractors, Residential General Contractor, Building Contractor, Additions, Remodeling Contractor,  Renovation, Builder, building construction, renovation, remodeling, construction builders, construction company, construction companies, home repair, construction jobs, home remodeling, general contractors, contractors general, contractor general, contractors construction, construction contractors, home improvement and remodeling, kitchen remodeling, construction contractor, builders contractors, home renovation, general contracting, building contractors, building companies, home renovations, builder contractor, building contractor, remodeling contractor, commercial construction, residential construction, house contractor, concrete contractors, home contractors, general construction, construction general, contractors remodeling, remodeling contractors, remodelers, remodel contractor, remodel contractors, general contract, commercial contractors, renovations contractors, home improvement contractor, licensed contractor, license general contractor, mud room, mudroom, caulking, ,Paint & Wallpaper Contractors, Paint Colors, Paint Store, Paint Brush, Paint Shop, Home Wallpaper,Wallpaper, Paint colour advice, paint colour consultants, wallpapering, painter, faux, painters painting, painters paint, business painting, find painting, painting and restoration, new jersey painting, oh painting, local painting, wall paper repair, ,Drywall Contractors, Dry Wall Repair, Dry Wall Installation, dry wall contracting, gypsum repair, gypsum installation, gypsum contractors, gyprock installers, gyprock intallation, dry wall installers, sheetrock, wall board, drywall, drywaller, waller, wall repair, drywall, plaster, how to drywall, drywall, what is drywall, sheetrock, dry wall, plastering, wall repair, drywall repair, how to repair drywall, repair drywall,  ,",0,2022-09-27T11:44:01.000-04:00,NA,FALSE,0,0,0,0,FALSE,a582a4d1adfcbff4812ff71d9898bdc1b64638ec,FALSE,NA,FALSE,TRUE,2292859,-1.0,442,NA,NA
https://homestars.com/on/bramalea/tile-stone-contractors,94,"c(""https://homestars.com/on/bramalea/tile-stone-contractors?&page=2&"", ""https://homestars.com/on/bramalea/tile-stone-contractors?&page=3&"", ""https://homestars.com/on/bramalea/tile-stone-contractors?&page=4&"", ""https://homestars.com/on/bramalea/tile-stone-contractors?&page=5&"", ""https://homestars.com/on/bramalea/tile-stone-contractors?&page=6&"", ""https://homestars.com/on/bramalea/tile-stone-contractors?&page=7&"", ""https://homestars.com/on/bramalea/tile-stone-contractors?&page=8&"", ""https://homestars.com/on/bramalea/tile-stone-contractors?&page=9&"", 
""https://homestars.com/on/bramalea/tile-stone-contractors?&page=10&"")",Tile & Stone Contractors,2960822,,/companies/2960822-risingstar-constructions-inc?searched_category_id=442&service_area=2263758,,risingstar-constructions-inc,2021-10-22T20:59:23.000-04:00,NA,NA,NA,,"
General Contractor
Bathroom Renovation
Flooring
Tile & Stone
",,,2016,NA,"Cash, E-transfer, Certified Cheques",,,,TRUE,FALSE,,,TRUE,FALSE,6 months on labour and material,2022793,RisingStar Constructions inc,5,3,13,10,"Tile & Stone Contractors, Natural Stone Tile, Stone Floor Tile, Ceramic Tile, Floor tile, Tile installers, Stone installers, stone counter top installers, tile counter top installers, stone backsplash intallers, granite installers, marble installers, limestone installers, linoleum installers, slate contractors, slate installers,install tite ,backsplash , fire place veenerneed someone to install blacksplash , wall stone veener bath room mosaic,",0,2021-10-22T21:00:18.000-04:00,risingstarconstructions,FALSE,0,0,16,0,FALSE,1387b259842e30de36be19f6afd1c05d264a1661,TRUE,NA,TRUE,FALSE,2263758,87.045181018,442,NA,NA
https://homestars.com/on/bramalea/tile-stone-contractors,94,"c(""https://homestars.com/on/bramalea/tile-stone-contractors?&page=2&"", ""https://homestars.com/on/bramalea/tile-stone-contractors?&page=3&"", ""https://homestars.com/on/bramalea/tile-stone-contractors?&page=4&"", ""https://homestars.com/on/bramalea/tile-stone-contractors?&page=5&"", ""https://homestars.com/on/bramalea/tile-stone-contractors?&page=6&"", ""https://homestars.com/on/bramalea/tile-stone-contractors?&page=7&"", ""https://homestars.com/on/bramalea/tile-stone-contractors?&page=8&"", ""https://homestars.com/on/bramalea/tile-stone-contractors?&page=9&"", 
""https://homestars.com/on/bramalea/tile-stone-contractors?&page=10&"")",Tile & Stone Contractors,2945401,http://infinitytiling.ca/,/companies/2945401-infinity-tiling?searched_category_id=442&service_area=2229388,"Infinity Tiling was created by passionate tile setter Jason Williams as homage to his father.
Since he was a young boy Jason was taught the art of tile setting by his father. 
The passion he got for the craft propelled him to start his own tiling company.

At Infinity tiling, we provide our clients with professional service that will bring any vision to life. 
We guide our clients through the entire renovation process from start to finish to ensure they are always at ease.

The Infinity tiling team are highly experienced, with over 8+ years of experience in small and large projects in the residential and commercial arena. 
From back splashes, flooring, shower, stonework and grouting we provide an array of services.

At Infinity Tiling we provide professional work while treating our clients with the upmost respect. 

We will ensure will deliver your project within your budget and on time!

Give us a call today to discuss your next tiling renovation and we will make sure we deliver it with EXCELLENCE & INTEGRITY. 
905 226 9486",infinity-tiling,2020-07-09T09:25:08.000-04:00,NA,NA,NA,,Commercial and Residential,,"Specialized tile setter
New installations and repairs
Commercial  and residential work
Bathroom, decks, floors, backsplashes, and more",2008,NA,"Cash, Cheque and e-transfer",,,,TRUE,FALSE,,,TRUE,FALSE,Yes. Kindly ask for details. Depends on project completed. ,2007538,Infinity Tiling,13,12,16,10,"Tile & Stone Contractors, Natural Stone Tile, Stone Floor Tile, Ceramic Tile, Floor tile, Tile installers, Stone installers, stone counter top installers, tile counter top installers, stone backsplash intallers, granite installers, marble installers, limestone installers, linoleum installers, slate contractors, slate installers,install tite ,backsplash , fire place veenerneed someone to install blacksplash , wall stone veener bath room mosaic,",0,2020-07-09T09:31:21.000-04:00,infinitytiling,FALSE,0,0,17,0,FALSE,e21c96861a38108edcf588ca8d7120d8be084d3b,TRUE,2022-06-17T17:18:54.000-04:00,TRUE,FALSE,2229388,97.0282463194,442,NA,NA
https://homestars.com/on/bramalea/tile-stone-contractors,94,"c(""https://homestars.com/on/bramalea/tile-stone-contractors?&page=2&"", ""https://homestars.com/on/bramalea/tile-stone-contractors?&page=3&"", ""https://homestars.com/on/bramalea/tile-stone-contractors?&page=4&"", ""https://homestars.com/on/bramalea/tile-stone-contractors?&page=5&"", ""https://homestars.com/on/bramalea/tile-stone-contractors?&page=6&"", ""https://homestars.com/on/bramalea/tile-stone-contractors?&page=7&"", ""https://homestars.com/on/bramalea/tile-stone-contractors?&page=8&"", ""https://homestars.com/on/bramalea/tile-stone-contractors?&page=9&"", 
""https://homestars.com/on/bramalea/tile-stone-contractors?&page=10&"")",Tile & Stone Contractors,2925247,https://platinumtile.ca/,/companies/2925247-platinum-tile-and-stone-inc?searched_category_id=442&service_area=2183745," Professional Tile and Stone services. More than 10 years of experience with love and passion for construction.  Customer satisfaction is our goal.  Provide high-quality installation services and the best product that right for your project.  2 years warranty after service and always free consultation.  We believed everyone deserves a beautiful home. 




",platinum-tile-and-stone-inc,2018-12-14T14:17:35.000-05:00,NA,NA,NA,,,,,2013,NA,ALL Major Payment types Accepted. ,Professional Tile Installer,,Toronto Contracting Association ,TRUE,TRUE,,,TRUE,FALSE,2 years on Workmanship. Please ask for details. Depends on project completed. ,1987421,Platinum Tile And Stone Inc,7,5,108,10,"Tile & Stone Contractors, Natural Stone Tile, Stone Floor Tile, Ceramic Tile, Floor tile, Tile installers, Stone installers, stone counter top installers, tile counter top installers, stone backsplash intallers, granite installers, marble installers, limestone installers, linoleum installers, slate contractors, slate installers,install tite ,backsplash , fire place veenerneed someone to install blacksplash , wall stone veener bath room mosaic,",0,2018-12-14T14:20:05.000-05:00,NA,FALSE,0,0,139,0,FALSE,dc1571b1d8713cd9ef4e30171f6357505ab5181c,TRUE,2019-08-17T12:34:07.000-04:00,TRUE,FALSE,2183745,79.5997311435,442,NA,NA
https://homestars.com/on/bramalea/tile-stone-contractors,94,"c(""https://homestars.com/on/bramalea/tile-stone-contractors?&page=2&"", ""https://homestars.com/on/bramalea/tile-stone-contractors?&page=3&"", ""https://homestars.com/on/bramalea/tile-stone-contractors?&page=4&"", ""https://homestars.com/on/bramalea/tile-stone-contractors?&page=5&"", ""https://homestars.com/on/bramalea/tile-stone-contractors?&page=6&"", ""https://homestars.com/on/bramalea/tile-stone-contractors?&page=7&"", ""https://homestars.com/on/bramalea/tile-stone-contractors?&page=8&"", ""https://homestars.com/on/bramalea/tile-stone-contractors?&page=9&"", 
""https://homestars.com/on/bramalea/tile-stone-contractors?&page=10&"")",Tile & Stone Contractors,2914868,NA,/companies/2914868-a-g-tiling-and-renovation?searched_category_id=442&service_area=2160682,"We do all tiling jobs , basement reno , kitchen reno,washroom renos",a-g-tiling-and-renovation,2018-04-19T14:31:03.000-04:00,NA,NA,NA,NA,NA,NA,NA,NA,NA,NA,NA,NA,NA,FALSE,FALSE,NA,NA,FALSE,FALSE,NA,1977052,A&G Tiling And Renovation ,3,2,52,10,"Tile & Stone Contractors, Natural Stone Tile, Stone Floor Tile, Ceramic Tile, Floor tile, Tile installers, Stone installers, stone counter top installers, tile counter top installers, stone backsplash intallers, granite installers, marble installers, limestone installers, linoleum installers, slate contractors, slate installers,install tite ,backsplash , fire place veenerneed someone to install blacksplash , wall stone veener bath room mosaic,",0,2018-04-19T14:31:37.000-04:00,NA,FALSE,0,0,47,0,FALSE,d7c352babf3bea8c5b86bb94609136a299e68510,FALSE,NA,TRUE,FALSE,2160682,81.899529019,442,NA,NA
https://homestars.com/on/bramalea/tile-stone-contractors,94,"c(""https://homestars.com/on/bramalea/tile-stone-contractors?&page=2&"", ""https://homestars.com/on/bramalea/tile-stone-contractors?&page=3&"", ""https://homestars.com/on/bramalea/tile-stone-contractors?&page=4&"", ""https://homestars.com/on/bramalea/tile-stone-contractors?&page=5&"", ""https://homestars.com/on/bramalea/tile-stone-contractors?&page=6&"", ""https://homestars.com/on/bramalea/tile-stone-contractors?&page=7&"", ""https://homestars.com/on/bramalea/tile-stone-contractors?&page=8&"", ""https://homestars.com/on/bramalea/tile-stone-contractors?&page=9&"", 
""https://homestars.com/on/bramalea/tile-stone-contractors?&page=10&"")",Tile & Stone Contractors,2887376,NA,/companies/2887376-backsplash-plus?searched_category_id=442&service_area=2094847,NA,backsplash-plus,2016-05-19T00:20:45.000-04:00,NA,NA,NA,NA,NA,NA,NA,NA,NA,NA,NA,NA,NA,FALSE,FALSE,NA,NA,FALSE,FALSE,NA,1949800,Backsplash Plus,2,2,9,10,"Tile & Stone Contractors, Natural Stone Tile, Stone Floor Tile, Ceramic Tile, Floor tile, Tile installers, Stone installers, stone counter top installers, tile counter top installers, stone backsplash intallers, granite installers, marble installers, limestone installers, linoleum installers, slate contractors, slate installers,install tite ,backsplash , fire place veenerneed someone to install blacksplash , wall stone veener bath room mosaic,",0,NA,NA,FALSE,0,0,9,0,FALSE,52a76cff2c1e24194cf47e4cad335a956d6b7097,TRUE,NA,TRUE,FALSE,2094847,79.8030895526,442,NA,NA
