Link,n_hits,all_links,category,id,url,hs_path,profile,permalink,created_at,sic_code,service_area,hours,products,services,brands,specialities,established,employee_cnt,payment_method,diplomas,licenses,memberships,liability_insurance,bonded,project_rate,project_minimum,written_contract,written_warranty,warranty_terms,parent_company_id,name,total_number_of_reviews_cache,total_number_of_approved_reviews_cache,number_of_photos_cache,avg_rating_cache,categories_info_cache,savings_count,claimed_at,subdomain,fraudulent,fraudulent_count,total_number_of_pending_reviews_cache,images_count,bully,secret,replied_to_at_least_one_review_cache,latest_approved_review_created_at,has_set_tasks,lead_purchase_eligible,service_area_id,star_score,quote_button_category,direct_phone,direct_contact,completion_percent_cache
https://homestars.com/on/snelgrove/carpenters,102,"c(""https://homestars.com/on/snelgrove/carpenters?&page=2&"", ""https://homestars.com/on/snelgrove/carpenters?&page=3&"", ""https://homestars.com/on/snelgrove/carpenters?&page=4&"", ""https://homestars.com/on/snelgrove/carpenters?&page=5&"", ""https://homestars.com/on/snelgrove/carpenters?&page=6&"", ""https://homestars.com/on/snelgrove/carpenters?&page=7&"", ""https://homestars.com/on/snelgrove/carpenters?&page=8&"", ""https://homestars.com/on/snelgrove/carpenters?&page=9&"", ""https://homestars.com/on/snelgrove/carpenters?&page=10&"", 
""https://homestars.com/on/snelgrove/carpenters?&page=11&"")",Carpenters,2783787,https://www.thig.pro,/companies/2783787-the-home-improvement-group?searched_category_id=323&service_area=2109832,"The Home Improvement Group is the premier One Stop Shop for all of your home and office renovations needs.  We have multiple divisions such as Perfect Painter, Affinity Renovations, Perfect Handyman and formally  Mr. Rescue to service all your needs. 

We service work form $400.00 to $500,000.00+ from our Painter and Handyman of the Day Service to  Home Additions and Major Renovation and Structural work.   We want to earn your trust and as a family owned business that delivers on providing outstanding home/office renovation work. 

Not convinced we have enough renovation reviews please see Perfect Painters & Home Renovations Services for a more detailed list on reviews.

We have a commitment to Quality work and dealing with a no risk contractor and we will always compete for your business.


We have also expanded our service areas to include Burlington, Oakville, Milton, Mississauga, Brampton, Toronto, Vaughan, Markham, Newmark, Aurora, Stouffville, Pickering and Oshawa.

Call or email us at sales@thig.pro for all your renovation needs
",the-home-improvement-group,2011-01-30T17:45:45.000-05:00,NA,"                         Greater Toronto Area , and Beyond !!<br/>

<br/>",,"Interior Painting,Exterior Painting,Residential Painting and Commercial Painting,Staircase refinishing, Condo or Apartment Renovations and Handyman Services, Kitchen Design and Build, Home Additions, Structural work, Garage Design and Build, Basement Renovations, Bathroom Renovations, Basement Underpinning and Waterproofing,Custom Cabinetry, Flooring Installation including, Laminate, Hardwood, Engineered, Tiles, Including Porcelain, marble and granite. We also have Master Electricians, Master Plumbers and Gas and HVAC members as a part of our team.","House Painters, Office Painting, Exterior Painting, Residential Painting, Wallpaper Installation & Removal, Stucco Removal, Drywall Installation and Plaster repairs, Paint & Wallpaper Retailer save up to 50% off, Demolition, Rough and Finished Carpentry, Home and Renovation advisors, Kitchen Planning and Design, Handyman and Painter for a Day Services, Deck Design and Build, Basement renovations, general contractors","Benjamin Moore, Dulux Paint, and Sherwin Williams. We Believe in not Including Paint and providing you our wholesale Paint Pricing as many of our Competitors include paint in your pricing and then substitute low grade paint. We believe in provide you the best paint for your home and to provide access to our unbelievable wholesale pricing.","Custom painting, Stucco removal, staircase refinishing and rebuilding,wallpaper installation, wallpaper removal, handyman services, home renovations including bathroom renovations, basement renovations & condo and apartment renovations. Plus our Award Winning Painter and Handyman for a Day Services. Our Painting Services including Kitchen Cabinet Painting and Spraying are specialties. Kitchen Design Services and Complete Kitchen Design, Build and Installation.",2011,30,"Cash, Cheques, Email Transfers, all Major Credit Cards",Open 7 Days a Week Call  or emailNow,City of Toronto & Other Muncipalities in the GTA,"BBB, Homestars,",TRUE,TRUE,"$400.00 to $500,000.00+",400.00,TRUE,FALSE,1 Year Warranty,1846839,The Home Improvement Group - THIG,423,363,654,9.43802,"Handyman Services, Handyman, Home Handyman, Handyman Business, Repairmen, Repairman, house doctor, how to be a handyman, what is a handyman, the handyman, a handyman, handy man, the handy man, handy handyman, home repair, in home repair, handymen, the handymen, improvements home, home remodeling, home improvement remodeling, remodeling home improvement, hand man, kitchen and remodeling, home improvement and repair, home repair and improvement, home improvement repair, remodeling and repair, home remodeling and repair, home repair and remodeling, home repair remodeling, home remodeling repair, home improvements remodeling, repair house, house repair, house remodeling, house improvements, property maintenance, home maintenance, home repairs, in home repairs, repairman, services handyman, the handyman service, service handyman, handyman service, handy services, house repairs, repairs house, repair homes, service contractors, mr fix it, mud room, mudroom, caulking,Paint & Wallpaper Contractors, Paint Colors, Paint Store, Paint Brush, Paint Shop, Home Wallpaper,Wallpaper, Paint colour advice, paint colour consultants, wallpapering, painter, faux, painters painting, painters paint, business painting, find painting, painting and restoration, new jersey painting, oh painting, local painting, wall paper repair, ,Basement Renovation, Basement renovation, Basement remodeling, Basement remodelling, renovating your basement, renovation, waterproofing, remodeling, home renovation, house renovation, water in basement, basement waterproofing,finishing basement, moistureproof, remodeling the house, caulking,General Contractors, Residential General Contractor, Building Contractor, Additions, Remodeling Contractor,  Renovation, Builder, building construction, renovation, remodeling, construction builders, construction company, construction companies, home repair, construction jobs, home remodeling, general contractors, contractors general, contractor general, contractors construction, construction contractors, home improvement and remodeling, kitchen remodeling, construction contractor, builders contractors, home renovation, general contracting, building contractors, building companies, home renovations, builder contractor, building contractor, remodeling contractor, commercial construction, residential construction, house contractor, concrete contractors, home contractors, general construction, construction general, contractors remodeling, remodeling contractors, remodelers, remodel contractor, remodel contractors, general contract, commercial contractors, renovations contractors, home improvement contractor, licensed contractor, license general contractor, mud room, mudroom, caulking, ,Floor Laying & Refinishing, Hardwood Floor, Wood Floor, Floor Tile, Dance Floor, Ceramic Floor Tile, Floor Refinishing, bamboo floor, cork floor, FSC wood flooring, stone floor, marble floor, slate floor, squeaky floor repair, laminate, laminate repair, wood floor, floor and wood, wood flooring, wood floors, floors in wood, hardwood flooring, hardwood floors, hardwood floors and, hardwood floor, hardwood floor wood, wood floor flooring, refinishing, floor refinishing, floor refinishing in, refinishing floor, hardwood install, floor laying, laying a floor, flood sanding, wood floor refinishing, refinishing hardwood floors, flooring laying, wood floors refinishing, wood flooring refinishing, floor co, flooring hard wood, hard wood floors, laying floors, flooring company, flooring engineered hardwood, floor company, hard wood floor, cleaning hardwood floors, installing hardwood flooring, installing hardwood floors, installing wood flooring, installing wood floors, installing hardwood floors, installing wood flooring, installing wood floors, installing hardwood floor, hardwood flooring installation, business floor, wood flooring installation, hardwood floor installation, floor companies, lay hardwood flooring, lay hardwood floor, wood floor repair, repair wood floor, repair hardwood floor, hardwood floor repair, finishing a hardwood floor, squeeky floors,,Hardwood floors, Install hardwood floors, caulking,Drywall Contractors, Dry Wall Repair, Dry Wall Installation, dry wall contracting, gypsum repair, gypsum installation, gypsum contractors, gyprock installers, gyprock intallation, dry wall installers, sheetrock, wall board, drywall, drywaller, waller, wall repair, drywall, plaster, how to drywall, drywall, what is drywall, sheetrock, dry wall, plastering, wall repair, drywall repair, how to repair drywall, repair drywall,  ,Demolition, demolition, excavation, salvage, city demolition, demolition city, demolition company, demolition companies, demolition co, demolition inc, demolition business, concrete removal, demolition of building, building demolition, demolition building, demolition contractors, demolition of house, demolition house, house demolition, house for demolition, demolition removal, demolition and removal, demolition home, home demolition, demolish house, how to demolish a house, demo companies, demolition and construction, demolition construction, construction and demolition, construction demolition, demolition contractor, demolition tools, cost of demolition, demolition cost, demolishing a house, demolition concrete, demolition of concrete, concrete demolition, ,Carpenters, carpenter, finish carpenter, local carpenter, carpenter work, carpenter companies, master carpenter, carpenters and joiners, carpentry, union carpenter, carpenter co, carpenter services, carpenter construction, interior framing, mud room, mudroom, playsets, playground, wooden playset, wooden playground, play set, caulking,,Bathroom Renovation, Bathroom renovation, bathroom remodeling, bathroom remodelling, renovating the bathroom, tearing out the bathroom, fixing up the bathroom, bathroom contractors, bathroom vanities, bathroom vanity, design of bathroom, bathroom and design, design for bathroom, design a bathroom, design a bath, bath design, bathroom tile, bathroom cabinets, remodeling a bathroom, bathroom remodeling, remodeling the bathroom, ,Bath renovation, New tub, caulking, ,Plumbing, Plumber, Plumbers, Plumbing Contractor, Plumbing Repair, toilet repair, fixing toilet, fixing sink, broken faucet, faucet repair, tap repair, leaking toilet, leaking sink, leaking pipes, drain snaking, at plumbing, plumbing in, what is plumbing, a plumbing, the plumbing, plumbing and, how to plumbing, plumbing a, plumbing how to, an plumbing, a plumber, plumber, the plumber, plumber plumber, plumber in, how to plumber, plumbers in, the plumbers, plumbers, plumbing pipe, how to plumb, pipes and plumbing, plumbing pipes, pipes for plumbing, plummer, plumbing supplies, plumbing supply, plumbing heating, plumbing & heating, heating and plumbing, heating plumbing, plumbing and heating, pipe plumber, plumbing stores, plumbing suppliers, the plumbs centre, plumb centre, ,Condominium Renovations, Condo, Apartment, remodeling, renovations, kitchen cabinet, home decor, condo apartments, home improvement, home improvements, remodeling home, home remodeling, remodeling a home, new condo, Condo facelift, 
I ,Condo RenovationsRenovations for a new condo that include removing a drywall and creating an island and a full kitchen remodeling. ,Small rodent in Attic,Tile & Stone Contractors, Natural Stone Tile, Stone Floor Tile, Ceramic Tile, Floor tile, Tile installers, Stone installers, stone counter top installers, tile counter top installers, stone backsplash intallers, granite installers, marble installers, limestone installers, linoleum installers, slate contractors, slate installers,install tite ,backsplash , fire place veenerneed someone to install blacksplash , wall stone veener bath room mosaic,Stair Builders, stairs, spiral stairways, spiral stairs, wood stairs, staircase, staircases,stairsSimple ten stairs instillation straigth,stairs instalation, ,Renovation Advisors, renovation consultant, remodelling advisor, remodeling consultant, remodeling advisor, remodelling consultant, construction consultant, construction advisor, structural, engineer, Renovation Coaching, Renovation Coaching, Coach, home building project management, renovation advisor,,Trim and Moldings, Wood Mouldings, Architectural Mouldings, Decorative Mouldings, Ornamental Mouldings, Mouldings For Picture Frame, Trimwork, wood moldings, architectural moldings, ornamental moldings, decorative moldings, decorative mouldings, dado rails, wood paneling, French baseboards, 9"" baseboards, stair rails, stair bannister, cornice moulding, crown moulding, crown molding, molding, moulding molding, molding or moulding, molding trim, molding and trim, trim molding, moulding and trim, moulding trim, trim moulding, mouldings, moldings, crown molding, molding crown, crown molding in, crown moulding, moulding crown, crown molding moulding, door trim molding, door trim moulding, trim mouldings, mouldings trim, mouldings and trim, moldings crown, crown moldings, crown mouldings, install crown molding, crown molding cut, cut crown molding, crown moulding cut, cut crown moulding, molding company, wood trim moulding, molding corner, corner molding, mold trim, plastic trim moulding, molding corner, corner molding, mold trim, plastic trim moulding, plastic moulding trim, moulding company, corner moulding, moulding corner, plastic trim molding, moldings and trim, moldings trim, trim moldings, molding co, molding companies, installing crown molding,,Kitchen & Bathroom - Cabinets & Design, Kitchen Cabinet And Counter, Kitchen Cabinet Hardware, Bathroom Cabinet, Bathroom Wall Cabinet, Bathroom Sink Cabinet, cabinets, kitchens, cabinetry, kitchen and cabinets, cabinets for kitchen, about kitchen cabinets, kitchen cabinets, kitchen cabinets in, cabinets for the kitchen, cabinets and kitchen, cabinets kitchen, kitchen cabinet, cabinet kitchen, the kitchen cabinet, kitchen by design, design kitchen, a kitchen design, design a kitchen, design for kitchen, design and kitchen, design by kitchen, kitchen design, cabinetry kitchen, kitchen cabinetry, designs kitchen, kitchen designs, bathroom vanities, vanity and bathroom, bath and vanity, designer kitchen, ,Electricians, Residential Electricians, Electrical Contractors, Electrical Wiring, knob and tube contractors, electrician, which electrician, electrical companies, electrical work, electrical contractors, jobs electrician, electrical contractor, electrical services, electric contractors, electric contractor, generator, generators, ,Kitchen Planning & Renovation, Kitchen Planning And Design, Kitchen Cabinet Planning, Kitchen Design, Kitchen Remodeling, kitchen or, and bathroom, a and a kitchens, kitchens and, for kitchens, a kitchens, kitchens, the house design, cabinets for kitchen, cabinets for the kitchen, cabinets and kitchen, kitchen cabinets, design a kitchen, about kitchen design, a kitchen design, how to kitchen design, design and kitchen, the kitchen design, design for kitchen, kitchen designs, renovation and remodeling, remodeling and renovation, kitchen designer,,Kitchen Renovation, caulking, ,Structural Engineering, Planning, Permit, Building, Plans, Diagrams, Drawings, Architects, Architecture, fireplace, chimney, fireplace and chimney, chimneys, chimney fire, wood burning stoves, how to sweep chimney, sweep chimney, a chimney sweep, chimney sweep, how to sweep a chimney, ,Plastering, Plastering Wall, Pool Plastering, Plastering Contractor, plasterers, moulding plasterers, plaster mouldings, plaster moldings, molding plasterers, plaster, what is plaster, how to plaster, plastering how to, plasterers, plasterer, stucco plaster, screed, plasters, plastered, gypsum plaster, plaster board, plaster wall, wall plaster, how to plaster a wall, drywall plaster, plaster boards, plaster ceiling, how to plaster a ceiling, plaster walls, plaster repair, repair plaster, plaster design, plaster and paint, paint on plaster, plaster paint, plaster to paint, plaster designs, plaster ceilings, venetian plaster, plaster venetian, casting plaster, plaster casting, plaster painting, painting on plaster, painting plaster, taping, taper, tapering, mudder,,Electrical Vehicle Charging, Electrical Vehicle Charging, Electrical Vehicle, Charging,",0,2011-01-30T17:45:46.000-05:00,homeimprovement,FALSE,0,0,629,FALSE,7a7700a6805bf8f663270dc2999bf9fdd3364a9d,TRUE,2022-11-24T10:59:13.000-05:00,TRUE,TRUE,2109832,92.4484548617,323,NA,NA,NA
https://homestars.com/on/snelgrove/carpenters,102,"c(""https://homestars.com/on/snelgrove/carpenters?&page=2&"", ""https://homestars.com/on/snelgrove/carpenters?&page=3&"", ""https://homestars.com/on/snelgrove/carpenters?&page=4&"", ""https://homestars.com/on/snelgrove/carpenters?&page=5&"", ""https://homestars.com/on/snelgrove/carpenters?&page=6&"", ""https://homestars.com/on/snelgrove/carpenters?&page=7&"", ""https://homestars.com/on/snelgrove/carpenters?&page=8&"", ""https://homestars.com/on/snelgrove/carpenters?&page=9&"", ""https://homestars.com/on/snelgrove/carpenters?&page=10&"", 
""https://homestars.com/on/snelgrove/carpenters?&page=11&"")",Carpenters,2807848,http://www.delcowindows.com,/companies/2807848-delco-windows-and-doors-inc?searched_category_id=323&service_area=1877095,"At Delco Windows and Doors we understand that your home is your biggest investment, so when its time to renovate your home only the best will do.
 
We specialize in the replacement and installation of vinyl windows, steel and fiberglass doors, patio and storm doors and porch enclosures in Toronto and the entire GTA.
We are factory-direct, eliminating the middleman so that we can provide the most competitive pricing available. We provide the finest products using the latest machinery, craftsmanship and technologies. Our products have some of the best warranties available including the lifetime transferrable warranty. Whether you are looking for vinyl windows, a beautiful fiberglass front door or an efficient patio door you will get the best value for your buck, installed by our quality installers with many years of experience and customer service that is second to none.
 
Giving customers more value for their money, providing excellent customer service and quality reliable products has been our winning formula for many years and we look forward to continue to service our valued customers for many more.",delco-windows-and-doors-inc,2013-03-25T14:46:53.000-04:00,NA,"Toronto, Mississauga, Brampton, Kleinburg, Schomberg, Caledon, Oakville, Burlington, Milton, Woodbridge, Etobicoke, Thornhill, Maple, Richmond Hill, Markham, Stoufville, Uxbridge, Pickering, Ajax, Whitby, Oshawa, Courtice, Newcastle, Downsview, North York, Orangeville, Holland Landing, Bradford, Newmarket, Aurora, King City, and more...
<br /> ",,"European Tilt Turn Windows ,Tilt and Turn Doors, Replacement Vinyl Windows, Fiberglass Windows, Steel and Fiberglass entry Doors, Patio Doors, Sliding Doors, French Doors, Garden Doors, Storm Doors, Screen Doors, Wood Doors, Hybrid windows and doors","Sales and Installation of Quality Replacement Vinyl Windows, European Tilt and Turn Windows and Doors, Woodgrain and Smooth Fiberglass Doors, Steel Doors and Sliding Patio Doors, Garden Doors and French Doors, Replacement Windows Toronto,Vinyl Windows Toronto, Energy Efficient Windows Toronto, European Tilt and Turn Windows Toronto, Window Replacement Toronto, Fiberglass Entry Doors, Entry Doors Toronto, Exterior Doors Toronto, Windows & Doors Toronto, Doors Toronto, Windows Toronto, Window Installation Company
",,"Windows and doors installation, selling direct to consumers, no middleman, no hassle, straight talk, honest approach",1989,NA,"Visa, Master Card, Money Order, Cheque",,Toronto T85-4310368,"Sawdac, BBB, Energy Star Partner",TRUE,FALSE,,,TRUE,FALSE,Transferable Warranty,1870848,Delco Windows And Doors Inc,171,159,145,9.83648,"Windows & Doors Installation & Service, install Replacement Window, Screen Door, Wood door, metal door, fire door, sliding door, french door, glass paned door, sash windows, casement windows, bay windows, bow windows, energy star windows, lead-paned windows, Windows,  wondows, windowa, windwos, winows, windows canada, windows home, canadian windows and doors, window manufacturers canada, house windows canada, canada windows, vinyl windows and doors, windows and doors canada, windows and doors, house windows, vinyl windows, canadian windows, buy windows, windows price, doors canada, windows manufacturers, windows for houses, canada doors, canadian door, windows vinyl, new house windows, canadian made windows, exterior windows, residential windows, black vinyl windows, garden doors canada, windows house, window suppliers, window companies toronto, vinyl windows price, windows canada store, window stores, store windows, vinyl doors, gta windows, buy doors, new windows and doors, shop windows, replacement windows, buy home windows, cheap home windows,  phantom screens, doors ontario, doors canada, canada doors, phantom screen doors, custom sliding window, double french doors, phantom retractable screens, plywood doors, screen doors wood, exterior doors, barn doors, entrance doors, steel doors, sliding screen doors, sliding barn doors, retractable screen door, exterior french doors, saloon doors, french windows, barn style doors, wooden doors, french patio doors, loft doors, solid wood doors, types of doors, custom doors, wood front doors, window doors, invisible screen door, exterior wood doors, interior wood doors, panel doors, door screens,  shutter doors, swing doors, wood entry doors, office doors, barn windows, retractable door, patio screen door, basement doors, exterior glass, exterior glass doors, french door screens, rolling screen door, screens for french doors, wooden exterior door, custom front doors, solid wood exterior doors, unique doors, pocket doors toronto, cheap interior doors, front doors, entry doors, solid oak doors, shop windows, front screen doors, custom wood doors toronto, window installations, window installation companies, windows and doors installation, windows and door installer, door installer, window contractors, door installation toronto, home window installation, windows and doors replacement, door installer toronto, replacement window doors, door replacement toronto, door company, best windows and doors reviews, long life windows, longlife windows, custom windows toronto, replacement doors, certified windows and doors reviews, install vinyl windows, install a door, door contractors, interior door installation, door repair, windows repair, windows replacement, exterior door installation, shower door installation,  front door replacement, garden doors, caulking,Carpenters, carpenter, finish carpenter, local carpenter, carpenter work, carpenter companies, master carpenter, carpenters and joiners, carpentry, union carpenter, carpenter co, carpenter services, carpenter construction, interior framing, mud room, mudroom, playsets, playground, wooden playset, wooden playground, play set, caulking,,",2,NA,delcowindows,FALSE,0,0,172,FALSE,e1f0948e62910e52f32e4a91bda9f3d5c5e59041,TRUE,2021-05-05T12:54:47.000-04:00,TRUE,TRUE,1877095,82.0415237831,323,NA,NA,100
