Link,n_hits,all_links,category,id,url,hs_path,profile,permalink,created_at,sic_code,service_area,hours,products,services,brands,specialities,established,employee_cnt,payment_method,diplomas,licenses,memberships,liability_insurance,bonded,project_rate,project_minimum,written_contract,written_warranty,warranty_terms,parent_company_id,name,total_number_of_reviews_cache,total_number_of_approved_reviews_cache,number_of_photos_cache,avg_rating_cache,categories_info_cache,savings_count,claimed_at,subdomain,fraudulent,fraudulent_count,total_number_of_pending_reviews_cache,images_count,completion_percent_cache,bully,secret,replied_to_at_least_one_review_cache,has_set_tasks,lead_purchase_eligible,service_area_id,star_score,quote_button_category,direct_phone,direct_contact
https://homestars.com/on/quinte/appliance-retailers,4,https://homestars.com/on/quinte/appliance-retailers,Appliance Retailers,2963071,,/companies/2963071-concrete-fusion?searched_category_id=307&service_area=2268801,"https://www.concretefusion.ca/
Concrete Fusion Inc. is a cutting-edge concrete finishing company specializing in concrete flooring, surface preparation, epoxy coatings, and polished concrete surfaces.
",concrete-fusion,2022-01-02T13:17:11.000-05:00,NA,NA,NA,,,,,NA,NA,,,,,FALSE,FALSE,,,FALSE,FALSE,,2025022,Concrete Fusion,0,0,0,NA,"Appliance Retailers, Home Appliances, Kitchen Appliances, Appliance Stores, Refrigerator, Fridge, Stove, Oven, Washer, Dryer, Microwave, refrigerator, appliance, stove, stoves, appliances, freezer, dishwasher, kitchenaid, fridgidaire, cooktop, appliance parts, electric appliance, electric appliances, appliance shop, appliance store, appliance installation,,",0,2022-01-02T13:19:02.000-05:00,,FALSE,0,0,0,0,FALSE,d441492afc4ead6417752e83380215f8c276c599,FALSE,TRUE,FALSE,2268801,-1.0,307,NA,NA
https://homestars.com/on/quinte/appliance-retailers,4,https://homestars.com/on/quinte/appliance-retailers,Appliance Retailers,2582403,NA,/companies/2582403-p-e-appliances?searched_category_id=307&service_area=1595607,NA,p-e-appliances,2008-03-04T16:55:15.000-05:00,NA,NA,NA,NA,NA,NA,NA,NA,NA,NA,NA,NA,NA,FALSE,FALSE,NA,NA,FALSE,FALSE,NA,1645455,P E Appliances,0,0,0,NA,"Appliance Retailers, Home Appliances, Kitchen Appliances, Appliance Stores, Refrigerator, Fridge, Stove, Oven, Washer, Dryer, Microwave, refrigerator, appliance, stove, stoves, appliances, freezer, dishwasher, kitchenaid, fridgidaire, cooktop, appliance parts, electric appliance, electric appliances, appliance shop, appliance store, appliance installation,,",0,NA,NA,FALSE,0,0,0,NA,FALSE,NA,FALSE,FALSE,FALSE,1595607,-1.0,307,NA,NA
https://homestars.com/on/quinte/appliance-retailers,4,https://homestars.com/on/quinte/appliance-retailers,Appliance Retailers,2647671,NA,/companies/2647671-bourdeau-appliance-service?searched_category_id=307&service_area=1660875,NA,bourdeau-appliance-service,2008-03-04T16:55:15.000-05:00,NA,NA,NA,NA,NA,NA,NA,NA,NA,NA,NA,NA,NA,FALSE,FALSE,NA,NA,FALSE,FALSE,NA,1710723,Bourdeau Appliance Service,0,0,0,NA,"Appliance Retailers, Home Appliances, Kitchen Appliances, Appliance Stores, Refrigerator, Fridge, Stove, Oven, Washer, Dryer, Microwave, refrigerator, appliance, stove, stoves, appliances, freezer, dishwasher, kitchenaid, fridgidaire, cooktop, appliance parts, electric appliance, electric appliances, appliance shop, appliance store, appliance installation,,",0,NA,NA,FALSE,0,0,0,NA,FALSE,NA,FALSE,FALSE,FALSE,1660875,-1.0,307,NA,NA
https://homestars.com/on/quinte/appliance-retailers,4,https://homestars.com/on/quinte/appliance-retailers,Appliance Retailers,2647672,NA,/companies/2647672-bourdeau-roch-appliance-service?searched_category_id=307&service_area=1660876,NA,bourdeau-roch-appliance-service,2008-03-04T16:55:15.000-05:00,NA,NA,NA,NA,NA,NA,NA,NA,NA,NA,NA,NA,NA,FALSE,FALSE,NA,NA,FALSE,FALSE,NA,1710724,Bourdeau Roch Appliance Service,0,0,0,NA,"Appliance Retailers, Home Appliances, Kitchen Appliances, Appliance Stores, Refrigerator, Fridge, Stove, Oven, Washer, Dryer, Microwave, refrigerator, appliance, stove, stoves, appliances, freezer, dishwasher, kitchenaid, fridgidaire, cooktop, appliance parts, electric appliance, electric appliances, appliance shop, appliance store, appliance installation,,",0,NA,NA,FALSE,0,0,0,NA,FALSE,NA,FALSE,FALSE,FALSE,1660876,-1.0,307,NA,NA
