Link,n_hits,all_links,category,id,url,hs_path,profile,permalink,created_at,sic_code,service_area,hours,products,services,brands,specialities,established,employee_cnt,payment_method,diplomas,licenses,memberships,liability_insurance,bonded,project_rate,project_minimum,written_contract,written_warranty,warranty_terms,parent_company_id,name,total_number_of_reviews_cache,total_number_of_approved_reviews_cache,number_of_photos_cache,avg_rating_cache,categories_info_cache,savings_count,claimed_at,fraudulent,fraudulent_count,total_number_of_pending_reviews_cache,images_count,completion_percent_cache,bully,secret,replied_to_at_least_one_review_cache,has_set_tasks,lead_purchase_eligible,service_area_id,star_score,quote_button_category,direct_phone,direct_contact
https://homestars.com/on/bonnyville/stucco,2,https://homestars.com/on/bonnyville/stucco,Stucco,2953516,NA,/companies/2953516-r-type-stucco?searched_category_id=454&service_area=2247508,NA,r-type-stucco,2021-02-26T15:13:48.000-05:00,NA,NA,NA,NA,NA,NA,NA,NA,NA,NA,NA,NA,NA,FALSE,FALSE,NA,NA,FALSE,FALSE,NA,2015612,R-type Stucco,0,0,0,NA,"Stucco, Stuccos, stucco contractor, stucco surface, exterior stucco, popcorn, popcorn ceiling, popcorn ceilings, popcorn ceiling removal,,",0,2021-02-26T15:15:25.000-05:00,FALSE,0,0,0,0,FALSE,5485eeb1ed91b7f92cc4352cca8b9f7d3f79ac25,FALSE,FALSE,FALSE,2247508,0,454,NA,NA
https://homestars.com/on/bonnyville/stucco,2,https://homestars.com/on/bonnyville/stucco,Stucco,2936641,NA,/companies/2936641-k-city-construction?searched_category_id=454&service_area=2209842,"K-CITY CONSTRUCTION 
Free Estimate


We are ready to do stucco and stone service for you property with reasonable price and good quality (15 years warranty). We have experience for more than 15 years (commercial and residential) around Cold Lake, Bonnyville, St. Paul, Edmonton, Lac La Biche.

Feel free to contact us!
Have a good day

",k-city-construction,2019-11-03T21:01:03.000-05:00,NA,NA,NA,NA,NA,NA,NA,NA,NA,NA,NA,NA,NA,FALSE,FALSE,NA,NA,FALSE,FALSE,NA,1998815,K-City Construction,0,0,10,NA,"Stucco, Stuccos, stucco contractor, stucco surface, exterior stucco, popcorn, popcorn ceiling, popcorn ceilings, popcorn ceiling removal,,",0,2019-11-03T21:02:28.000-05:00,FALSE,0,0,12,0,FALSE,f85bb87ffa76fca5aa17a604bf0ebce4ad6cefd1,FALSE,FALSE,FALSE,2209842,0,454,NA,NA
