Link,n_hits,all_links,category,id,url,hs_path,profile,permalink,created_at,sic_code,service_area,hours,products,services,brands,specialities,established,employee_cnt,payment_method,diplomas,licenses,memberships,liability_insurance,bonded,project_rate,project_minimum,written_contract,written_warranty,warranty_terms,parent_company_id,name,total_number_of_reviews_cache,total_number_of_approved_reviews_cache,number_of_photos_cache,avg_rating_cache,categories_info_cache,savings_count,claimed_at,subdomain,fraudulent,fraudulent_count,total_number_of_pending_reviews_cache,images_count,completion_percent_cache,bully,secret,replied_to_at_least_one_review_cache,latest_approved_review_created_at,has_set_tasks,lead_purchase_eligible,service_area_id,star_score,quote_button_category,direct_phone,direct_contact
https://homestars.com/on/mono-mills/furniture,4,https://homestars.com/on/mono-mills/furniture,Furniture,2780160,http://www.tonfurniture.com,/companies/2780160-ton-furniture?searched_category_id=364&service_area=2172046," 6 Times Winner - THE BEST MATTRESS STORE IN TORONTO - BEST OF HOMESTARS AWARD WINNER - THANK YOU! :)

WE HAVE THE LOWEST PRICE ON TOP QUALITY MATTRESSES AND THE BEST SERVICE



Its simple, we sell Top Quality Mattresses for Less, directly from the Factory. 
WE ARE THE MATTRESS SPECIALISTS! Professional - No pushy service, no upselling, friendly service, best 
industry knowledge.

Best Quality. Best Service. Best Price. Buy a top quality mattress from the mattress specialists! 

As we are an online store, we offer lower price thanks to no retail fees or fancy showrooms (overhead costs). You save 40-60% compare to any retail sale! 
-------------------------------------------------------------------------------
You can always come and see mattresses before buying in our warehouse (please contact us for appointment).
-------------------------------------------------------------------------------
We provide FREE DELIVERY IN GTA! Same day delivery or delivery out of GTA available as well. Anytime you wish, we will deliver it directly to your room and will help you with set up.

>>>>> Local pick up is also available! <<<<<

We sell all types of mattresses: euro top, tight top, orthopedic, all natural, hypo-allergenic, talalay latex, memory foam, BIO soy bean foam, coil free, pocket coil, baby crib mattresses, custom sized mattresses and more. All TOP QUALITY and Made in Canada. 

All mattresses are under the FULL manufacturer warranty. 


TonFurniture.com 
Euro-Canadian Mattress Specialists
647.839.5672",ton-furniture,2010-07-14T14:25:13.000-04:00,NA,"Toronto area online mattress store - Factory direct sale. Best place to get quality mattresses for less!
<br />Free delivery within the GTA!<br/>

<br/>We serve the whole GTA:
<br /> Toronto, Burlington, Oakville, Mississauga, Thornhill,Scarborough,Pickering,Ajax, Whitby, Oshawa, Markham, Richmond Hill, Vaughan,Woodbridge, Aurora, Newmarket, Maple, Orangeville, Brampton, Georgetown, Milton.<br/>

<br/>","non-stop (deliveries daily, on your request)","We sell all types of mattresses: euro top, tight top, orthopedic, all natural, hypo-allergenic, Talalay latex, memory foam, BIO soy bean foam, coil free, pocket coil, baby crib mattresses, custom sized mattresses and more. All TOP QUALITY and Made in Canada. 
","Free Delivery in GTA
from Brulington on west to Oshawa on east and north to Newmarket.","Top Quality, brand NEW Mattresses - Made in Canada. All sizes - all types.","All Natural latex, Bio Soy foam, Gel foam, memory foam, pocket coiled, anti-bacterial and orthopedic mattresses.",2006,NA,"Credit Catds, Cash on Delivery or direct payment in our warehouse.",,,,FALSE,FALSE,,,FALSE,FALSE,Full Manufacturer Warranty,1843212,Ton Furniture,310,253,39,9.98419,"Furniture, Bedroom Furniture, Office Furniture, Furniture Store, Kid Furniture, Patio Furniture, Baby Furniture, Contemporary Furniture, Dining Room Furniture, furniture stores, the furniture store, furniture store, furniture shops, office furniture, patio furniture, home furnishings, the furniture warehouse, warehouse furniture, furniture warehouse, home furniture, furniture shop, bedroom furniture, furniture bedroom, home decorating, outdoor furniture, room furniture, room to room furniture, outside furniture, used furniture, bed furniture, house furniture, city furniture, furniture city, outlet furniture, furniture outlet, wood furniture, furniture for sale, furniture sale, sale furniture, furniture on sale, out door furniture, cheap furniture, furniture cheap, furnitures, sofa furniture, furniture modern, modern furniture, furniture discount, discount furniture, old furniture, furniture outlets, ,",7,2011-07-18T14:55:04.000-04:00,tonfurniture,FALSE,0,1,52,100,FALSE,7aa1fa5b549d2fc4d6ad5f905ed117a4d4ff6458,TRUE,2021-09-29T22:19:41.000-04:00,TRUE,TRUE,2172046,99.5626201103,364,NA,NA
https://homestars.com/on/mono-mills/furniture,4,https://homestars.com/on/mono-mills/furniture,Furniture,2893193,,/companies/2893193-abdullah-testing?searched_category_id=364&service_area=2280434,,abdullah-testing,2017-01-17T09:44:10.000-05:00,NA,NA,NA,Watermelons,,,,NA,NA,,,,,FALSE,FALSE,,,FALSE,FALSE,,1955617,Abdullah Testing,9,6,6,8.33333,"Cabinetry & Millwork, Kitchen Cabinetry, Custom Cabinetry, Bathroom Cabinetry, Architectural Millwork, Millwork, custom millwork, bathroom cabinets, Kitchen cabinets, built-in cabinets, built-in cabinetry,  cabinet makers, custom cabinets kitchen, cabinetry, thomasville kitchen cabinets, cabinet doors, millwork cabinetry, custom kitchen cabinets, kraftmaid cabinets, maple cabinets, wood cabinets, stock cabinets, thermofoil cabinets, laminate cabinets, kitchen cabinets design, cherry cabinets, kitchen cabinet designs, hickory cabinets, wholesale cabinets, custom made cabinets, cabinet millwork, cabinets kitchen, kitchen cabinetry, millwork cabinets, ready to assemble cabinets, quality cabinets, bamboo cabinets, caulking,
,Closet & Storage Solutions, Closets, Closet, Storage, Closet Organizer, Closet And Room Organizer, Storage Cabinet, Storage Container, Interior closet shelves, custom fitted interior closets, custom closets, interior closet organizer, shelving, built-in shelving, built-in shelves, storage, the container, the closet, a closet, closet and, closet closet, closet to closet, closet, shelves, wardrobe, the closets, shelving, wardrobes, pantry, storage boxes, container store, storage containers, storage and containers, shoe rack, storage bins, storage systems, shoe racks, storage cabinets, storage cabinet, food storage, wall shelves, solutions storage, storage solutions, clothes rack, closet and organizer, the closet organizer, organizer for closet, closet organizer, closet organizers, organizers closet, wardrobe closet, Custom Shelves, ,Framing, carpentry, carpenter, building a house, house building, house designs, home designs, house plan, design house, house design, how to build a house. build a house, building plans, houseplans, home builders in, building house, house building plans, house builders, construction of house, house construction, building homes, design homes, modular home, house builder, homebuilders,Carpenters, interior framing, ,Furniture, Bedroom Furniture, Office Furniture, Furniture Store, Kid Furniture, Patio Furniture, Baby Furniture, Contemporary Furniture, Dining Room Furniture, furniture stores, the furniture store, furniture store, furniture shops, office furniture, patio furniture, home furnishings, the furniture warehouse, warehouse furniture, furniture warehouse, home furniture, furniture shop, bedroom furniture, furniture bedroom, home decorating, outdoor furniture, room furniture, room to room furniture, outside furniture, used furniture, bed furniture, house furniture, city furniture, furniture city, outlet furniture, furniture outlet, wood furniture, furniture for sale, furniture sale, sale furniture, furniture on sale, out door furniture, cheap furniture, furniture cheap, furnitures, sofa furniture, furniture modern, modern furniture, furniture discount, discount furniture, old furniture, furniture outlets, ,Trim and Moldings, Wood Mouldings, Architectural Mouldings, Decorative Mouldings, Ornamental Mouldings, Mouldings For Picture Frame, Trimwork, wood moldings, architectural moldings, ornamental moldings, decorative moldings, decorative mouldings, dado rails, wood paneling, French baseboards, 9"" baseboards, stair rails, stair bannister, cornice moulding, crown moulding, crown molding, molding, moulding molding, molding or moulding, molding trim, molding and trim, trim molding, moulding and trim, moulding trim, trim moulding, mouldings, moldings, crown molding, molding crown, crown molding in, crown moulding, moulding crown, crown molding moulding, door trim molding, door trim moulding, trim mouldings, mouldings trim, mouldings and trim, moldings crown, crown moldings, crown mouldings, install crown molding, crown molding cut, cut crown molding, crown moulding cut, cut crown moulding, molding company, wood trim moulding, molding corner, corner molding, mold trim, plastic trim moulding, molding corner, corner molding, mold trim, plastic trim moulding, plastic moulding trim, moulding company, corner moulding, moulding corner, plastic trim molding, moldings and trim, moldings trim, trim moldings, molding co, molding companies, installing crown molding,,Plastering, Plastering Wall, Pool Plastering, Plastering Contractor, plasterers, moulding plasterers, plaster mouldings, plaster moldings, molding plasterers, plaster, what is plaster, how to plaster, plastering how to, plasterers, plasterer, stucco plaster, screed, plasters, plastered, gypsum plaster, plaster board, plaster wall, wall plaster, how to plaster a wall, drywall plaster, plaster boards, plaster ceiling, how to plaster a ceiling, plaster walls, plaster repair, repair plaster, plaster design, plaster and paint, paint on plaster, plaster paint, plaster to paint, plaster designs, plaster ceilings, venetian plaster, plaster venetian, casting plaster, plaster casting, plaster painting, painting on plaster, painting plaster, taping, taper, tapering, mudder,,Drywall Contractors, Dry Wall Repair, Dry Wall Installation, dry wall contracting, gypsum repair, gypsum installation, gypsum contractors, gyprock installers, gyprock intallation, dry wall installers, sheetrock, wall board, drywall, drywaller, waller, wall repair, drywall, plaster, how to drywall, drywall, what is drywall, sheetrock, dry wall, plastering, wall repair, drywall repair, how to repair drywall, repair drywall,  ,Door & Window Frames, Door & Window Frames, Door Frame, Window Frame,",0,2017-01-17T13:23:47.000-05:00,,FALSE,0,0,8,0,FALSE,a45cb23ac3a6108eb145634553831b868068305f,FALSE,NA,TRUE,FALSE,2280434,72.2196433385,364,NA,NA
https://homestars.com/on/mono-mills/furniture,4,https://homestars.com/on/mono-mills/furniture,Furniture,2852445,NA,/companies/2852445-west-michigan-office-interiors?searched_category_id=364&service_area=1967730,Less than 100 Characters: West Michigan Office Interiors offers design solutions for offices in the Grand Rapids area.,west-michigan-office-interiors,2014-04-23T01:33:42.000-04:00,NA,NA,Mon-Fri 8:00 AM 5:00 PM ,NA,NA,NA,NA,NA,NA,NA,NA,NA,NA,FALSE,FALSE,NA,NA,FALSE,FALSE,NA,1914876,West Michigan Office Interiors,0,0,0,NA,"Furniture, Bedroom Furniture, Office Furniture, Furniture Store, Kid Furniture, Patio Furniture, Baby Furniture, Contemporary Furniture, Dining Room Furniture, furniture stores, the furniture store, furniture store, furniture shops, office furniture, patio furniture, home furnishings, the furniture warehouse, warehouse furniture, furniture warehouse, home furniture, furniture shop, bedroom furniture, furniture bedroom, home decorating, outdoor furniture, room furniture, room to room furniture, outside furniture, used furniture, bed furniture, house furniture, city furniture, furniture city, outlet furniture, furniture outlet, wood furniture, furniture for sale, furniture sale, sale furniture, furniture on sale, out door furniture, cheap furniture, furniture cheap, furnitures, sofa furniture, furniture modern, modern furniture, furniture discount, discount furniture, old furniture, furniture outlets, ,",1,NA,NA,FALSE,0,0,0,0,FALSE,b2f9df47087f1d3ab44b2760d24a9b1f6ab7e2d2,FALSE,NA,FALSE,FALSE,1967730,-1.0,364,NA,NA
https://homestars.com/on/mono-mills/furniture,4,https://homestars.com/on/mono-mills/furniture,Furniture,213454,,/companies/213454-la-z-boy-furniture-galleries?searched_category_id=364&service_area=1811604,NA,la-z-boy-furniture-galleries,2008-01-23T10:30:39.000-05:00,NA,,,NA,NA,NA,NA,0,0,NA,NA,NA,NA,FALSE,FALSE,NA,NA,FALSE,FALSE,NA,67051,La-Z-Boy Furniture Galleries,3,3,0,4.83333,"Furniture, Bedroom Furniture, Office Furniture, Furniture Store, Kid Furniture, Patio Furniture, Baby Furniture, Contemporary Furniture, Dining Room Furniture, furniture stores, the furniture store, furniture store, furniture shops, office furniture, patio furniture, home furnishings, the furniture warehouse, warehouse furniture, furniture warehouse, home furniture, furniture shop, bedroom furniture, furniture bedroom, home decorating, outdoor furniture, room furniture, room to room furniture, outside furniture, used furniture, bed furniture, house furniture, city furniture, furniture city, outlet furniture, furniture outlet, wood furniture, furniture for sale, furniture sale, sale furniture, furniture on sale, out door furniture, cheap furniture, furniture cheap, furnitures, sofa furniture, furniture modern, modern furniture, furniture discount, discount furniture, old furniture, furniture outlets, ,",0,NA,NA,FALSE,0,0,0,NA,FALSE,NA,FALSE,2007-09-23T20:00:00.000-04:00,FALSE,FALSE,1811604,4.4010989619,364,NA,NA
