Link,n_hits,all_links,category,id,url,hs_path,profile,permalink,created_at,sic_code,service_area,hours,products,services,brands,specialities,established,employee_cnt,payment_method,diplomas,licenses,memberships,liability_insurance,bonded,project_rate,project_minimum,written_contract,written_warranty,warranty_terms,parent_company_id,name,total_number_of_reviews_cache,total_number_of_approved_reviews_cache,number_of_photos_cache,avg_rating_cache,categories_info_cache,savings_count,claimed_at,subdomain,fraudulent,fraudulent_count,total_number_of_pending_reviews_cache,images_count,completion_percent_cache,bully,secret,replied_to_at_least_one_review_cache,has_set_tasks,lead_purchase_eligible,service_area_id,star_score,quote_button_category,direct_phone,direct_contact,latest_approved_review_created_at
https://homestars.com/on/barrie/moving-storage,47,"c(""https://homestars.com/on/barrie/moving-storage?&page=2&"", ""https://homestars.com/on/barrie/moving-storage?&page=3&"", ""https://homestars.com/on/barrie/moving-storage?&page=4&"", ""https://homestars.com/on/barrie/moving-storage?&page=5&"")",Moving & Storage,2944544,https://getmovers.ca,/companies/2944544-getmovers?searched_category_id=407&service_area=2234057,"The goal at GetMovers is to provide detail-oriented moving assistance that's tailored to the needs of each customer.

That is why all GetMovers employees from call centre assistants to drivers get special trainings and their salary is highly affected by our customers satisfaction.

Our quality management system is adapting quickly to client’s needs, saving you time and money.

So, if you want to move your belongings stress-free, on time and in full safety GetMovers is the company to turn to.

We are specializing on local residential and commercial moving. Moving can be very stressful and complicated if you haven’t chosen the right moving company and completed all the preparations needed, ahead of your moving day.
You should be checking if the company have full insurance coverage for your content and the properties, full equipment including packaging materials and tools to assemble and dissemble your furniture, how many years they are in business and read their third party reviews and must have back up trucks just in case something happen on your moving date! Our Team will be happy to advice you on other things that are extremely important during your move, so call us today and will be gladly assisting you.


Moving process starts with packing.

Packing is really time consuming.

Do you know that a 2-bedroom apartment will typically take a homeowner or renter 6 hours – 1 day to pack. A two-bedroom home will likely take up to 2 days

Our trained GetMovers team is happy to free you several precious hours.

We know how to handle bulky, fragile, oddly shaped and unique items to prevent damage while transportation.
We use high quality packing supplies, containers, wardrobe boxes to ensure the smoothness of moving process.

If you prefer packing by yourself, we can deliver all necessary packing materials to your doorstep.

We also provide Partial Packing Service. It means that we would pack or unpack only large items or pack up items in a specific room.

The decision is always yours.

Get in touch and we'll Pack and unpack It for You.



Getmovers has a large operating network across Canada. So, if you. need to relocate from Toronto to Vancouver or from Edmonton to Calgary we are happy to help you.

We’re not just moving experts, we’re relocation experts. Since 2008 we constantly enriching our expertise moving people and businesses around Canada.

We have the knowledge you need for a successful relocation.

We've partnered with competent international moving companies near you to help you ship your goods to any country in the world.

You can delegate us the whole process or the most time-consuming tasks while relocation.


Get your quote on get movers.ca


Looking for secure and climate control storage space with full access to? With over 10,000 Sqft   storage capacity GetMovers provides secure solutions for short or long-term storage.

Whether you need to store furniture, commercial goods or professional equipment, our secure storage facilities across Canada are equipped with the best technology to keep your belongings safe.

Our storage facilities are regularly inspected and well equipped, we make sure your belongings are securely stored in the best conditions.

Get Movers offers both private and corporate relocation services.

A well-designed action plan of your office relocation would minimize the loss of productivity for your business.

GetMovers are well trained to pack and move your company’s assets such as office furniture and electronics to your new premises.

You probably would ask yourself after everything we covered here is why should I be choosing Get Movers? Here are only the few reasons why:
1.	All our movers are professionals and  exceptionally well trained.
2.	We use the latest technology solution to monitor live the process of your move, we know where our trucks are, crews located and their live actions (use Samsara) so while calling our customer service team will be able to answer all your questions live!
3.	Full customer service, support and management team is here to serve you 7 days a week!
4.	Back up trucks and crews in cases for last minute moves or emergencies 
5.	Exceptionally high referral rate based on our past customers that are referring us.
6.	Honest upfront pricing without any hidden fees or surprises after
7.	We are One stop shop for all your moving needs.
8.	Nationwide Canadian coverage allowing us serving you anywhere in Canada and US.
9.	Great Team with Over 12 years of successful experience in the moving industry.



So, call us now at 1888 to get your move arranged or Get your free quote on get movers.ca

Get Movers – Caring while Carrying
",getmovers,2020-06-12T23:03:56.000-04:00,NA,NA,NA,moving and storage,packing,,,2008,150,"Visa/MC ,debit cards ,Cash",,,,TRUE,TRUE,,,TRUE,FALSE,,2006683,GetMovers,583,490,48,9.39796,"Moving & Storage, Moving Company, Moving Services, Moving Truck, Moving Equipment, Self Storage, Storage Container, portable storage container, moving and, moving in, movers, mover, moving movers, moving on movers, moving mover, self storage, moving companies, company moving, moving company, storage boxes, storage units, storage unit, movers companies, company movers, movers company, moving truck, storage facilities, packers and movers, movers and packers, movers packers, personal storage, moving quotes, moving on quotes, storage containers, car shipping, moving home, storage space, moving house, cardboard boxes, storage solutions, storage container, container storage, moving trucks, moving boxes, boxes for moving, moving and storage in, storage moving, storage and moving, moving storage, moving and storage, storage & moving, a moving and storage, moving to storage, moving rental,  storage bins,  move storage, movers storage, moving storage units, movers with storage, moving pods, moving storage containers, canada moving, moveing, residential moving companies, moving companies, the moving company, canadian moving, mover companies, company movers, moving companies with storage, moving company service, household movers, moving companies in canada, cost of moving across canada, national moving companies, moving estimate, shipping containers moving, moving trailer companies, moving companies local, moving company movers, moving van companies, long distance moving quote, moving agency, residential moving service,  moving van company, household shipping companies, long distance moving and storage, residential mover, company move, moving companies us, storage containers for moving, moving expenses, cross canada movers,  canada movers, home movers, local moving company,  moves canada, best moving companies, western moving and storage, best moving companies canada, moving across canada shipping, moving cost, storage company, moving company rates, moving business, long haul moving companies, full service movers, moving companies from canada to usa, moving prices, containers storage, online movers, packing moving companies, self moving services, movers van, move pods,",0,2020-06-12T23:04:51.000-04:00,,FALSE,0,3,52,0,FALSE,530d5dbb285e3496df19d5f958acf77620a59f1b,TRUE,TRUE,TRUE,2234057,76.3019581944,407,NA,NA,NA
https://homestars.com/on/barrie/moving-storage,47,"c(""https://homestars.com/on/barrie/moving-storage?&page=2&"", ""https://homestars.com/on/barrie/moving-storage?&page=3&"", ""https://homestars.com/on/barrie/moving-storage?&page=4&"", ""https://homestars.com/on/barrie/moving-storage?&page=5&"")",Moving & Storage,228172,https://twomenandatruck.ca,/companies/228172-two-men-and-a-truck?searched_category_id=407&service_area=2066587,"We’re the ""Movers Who Care®"". We're a lot more than two men and one truck when we need to be so no move is too big or too small.
 
With a 96% customer referral rate TWO MEN AND A TRUCK® is not just a moving company - We're a Customer Service Company that moves people. It's our goal to exceed your expectations on each and every move.",two-men-and-a-truck,2006-11-08T19:00:00.000-05:00,NA,"Brampton, Concord, Etobicoke, Markham, Mississauga, Newmarket, North York, Oakville, Richmond Hill, Scarborough, Thornhill, Toronto, Unionville, Vaughan, Woodbridge",Mon-Fri 9-5,"Cardboard Moving Boxes
Wardrobe Boxes
Moving & Packing Supplies","Home Moving Services
Residential Moving Services
Business Moving Services
Office Moving Services
Packing Services
Short-term storage
Long-term storage
Climate controlled storage 
Piano Moving
Junk Removal",,,2005,NA,,,,Canadian Association of Movers (CAM),TRUE,TRUE,,,TRUE,FALSE,,78758,Two Men And A Truck,1027,870,8,9.10517,"Moving & Storage, Moving Company, Moving Services, Moving Truck, Moving Equipment, Self Storage, Storage Container, portable storage container, moving and, moving in, movers, mover, moving movers, moving on movers, moving mover, self storage, moving companies, company moving, moving company, storage boxes, storage units, storage unit, movers companies, company movers, movers company, moving truck, storage facilities, packers and movers, movers and packers, movers packers, personal storage, moving quotes, moving on quotes, storage containers, car shipping, moving home, storage space, moving house, cardboard boxes, storage solutions, storage container, container storage, moving trucks, moving boxes, boxes for moving, moving and storage in, storage moving, storage and moving, moving storage, moving and storage, storage & moving, a moving and storage, moving to storage, moving rental,  storage bins,  move storage, movers storage, moving storage units, movers with storage, moving pods, moving storage containers, canada moving, moveing, residential moving companies, moving companies, the moving company, canadian moving, mover companies, company movers, moving companies with storage, moving company service, household movers, moving companies in canada, cost of moving across canada, national moving companies, moving estimate, shipping containers moving, moving trailer companies, moving companies local, moving company movers, moving van companies, long distance moving quote, moving agency, residential moving service,  moving van company, household shipping companies, long distance moving and storage, residential mover, company move, moving companies us, storage containers for moving, moving expenses, cross canada movers,  canada movers, home movers, local moving company,  moves canada, best moving companies, western moving and storage, best moving companies canada, moving across canada shipping, moving cost, storage company, moving company rates, moving business, long haul moving companies, full service movers, moving companies from canada to usa, moving prices, containers storage, online movers, packing moving companies, self moving services, movers van, move pods,",0,2011-09-28T10:03:16.000-04:00,twomenandatruck,FALSE,0,0,4,NA,FALSE,26f2631f9efbc745fd7750a934b08d8b37338b93,TRUE,TRUE,TRUE,2066587,90.7460513208,407,NA,NA,2022-10-19T15:46:04.000-04:00
https://homestars.com/on/barrie/moving-storage,47,"c(""https://homestars.com/on/barrie/moving-storage?&page=2&"", ""https://homestars.com/on/barrie/moving-storage?&page=3&"", ""https://homestars.com/on/barrie/moving-storage?&page=4&"", ""https://homestars.com/on/barrie/moving-storage?&page=5&"")",Moving & Storage,210692,http://www.hudsonmovers.com,/companies/210692-hudson-movers?searched_category_id=407&service_area=2109270,Hudson Movers is the premier Toronto Mover. We take great pride in providing the very best service for our customers. We can move you across town or across the world. Choose Hudson Movers  and find a mover for life. Give us a call and let us take the worry out of moving. ,hudson-movers,2008-01-23T10:29:21.000-05:00,NA,"Brampton, Concord, Etobicoke, Markham, Mississauga, Newmarket, North York, Oakville, Richmond Hill, Scarborough, Thornhill, Toronto, Unionville, Vaughan, Woodbridge, Province wide, Nation Wide, Cross Border and International",,"Trust our family to move your family, across town or around the world.
Local Moving experts: ""Toronto's local mover"",
Precise estimates,
On-time pick up and delivery,
Secure warehouse storage,
Accurate billing

","With a full-time staff and crew committed to being the best in the business, every aspect of your move is done the right way. 
Local and Long distance moving, Full service storage and logistics.
In business since 1923",Hudson is a proud member of United Van Lines,"Household Moving, Antiques, High Value Items, Art work, ",1923,30,"CASH, VISA, MASTERCARD",,,"CAM, BBB, United Van Lines",TRUE,FALSE,,,TRUE,FALSE,,64824,Hudson Movers,139,108,14,8.78009,"Moving & Storage, Moving Company, Moving Services, Moving Truck, Moving Equipment, Self Storage, Storage Container, portable storage container, moving and, moving in, movers, mover, moving movers, moving on movers, moving mover, self storage, moving companies, company moving, moving company, storage boxes, storage units, storage unit, movers companies, company movers, movers company, moving truck, storage facilities, packers and movers, movers and packers, movers packers, personal storage, moving quotes, moving on quotes, storage containers, car shipping, moving home, storage space, moving house, cardboard boxes, storage solutions, storage container, container storage, moving trucks, moving boxes, boxes for moving, moving and storage in, storage moving, storage and moving, moving storage, moving and storage, storage & moving, a moving and storage, moving to storage, moving rental,  storage bins,  move storage, movers storage, moving storage units, movers with storage, moving pods, moving storage containers, canada moving, moveing, residential moving companies, moving companies, the moving company, canadian moving, mover companies, company movers, moving companies with storage, moving company service, household movers, moving companies in canada, cost of moving across canada, national moving companies, moving estimate, shipping containers moving, moving trailer companies, moving companies local, moving company movers, moving van companies, long distance moving quote, moving agency, residential moving service,  moving van company, household shipping companies, long distance moving and storage, residential mover, company move, moving companies us, storage containers for moving, moving expenses, cross canada movers,  canada movers, home movers, local moving company,  moves canada, best moving companies, western moving and storage, best moving companies canada, moving across canada shipping, moving cost, storage company, moving company rates, moving business, long haul moving companies, full service movers, moving companies from canada to usa, moving prices, containers storage, online movers, packing moving companies, self moving services, movers van, move pods,Self Storage, Self Storage, self-storage, selfstorage, in self storage, self storage storage, storage self storage, self storage in, a self storage, self storage self storage, moving companies, moving company, storage units, storage units in, storage unit, selfstorage, storage facilities, personal storage, storage containers, moving truck rental, storage facility, storage space, publicstorage, storage solutions, storage container, container storage, moving storage, moving & storage, mini storage, a mini storage, storage buildings, storage solution, warehouse storage, storage new, storages, storage room, portable storage, mini self storage, boat storage, ,",0,2012-10-12T16:24:55.000-04:00,hudsonmovers,FALSE,0,0,18,100,FALSE,c7b580c6a8b0e72af01304b51f1627e61346d2d4,TRUE,TRUE,TRUE,2109270,79.1291162877,407,NA,NA,2021-12-11T20:53:44.000-05:00
https://homestars.com/on/barrie/moving-storage,47,"c(""https://homestars.com/on/barrie/moving-storage?&page=2&"", ""https://homestars.com/on/barrie/moving-storage?&page=3&"", ""https://homestars.com/on/barrie/moving-storage?&page=4&"", ""https://homestars.com/on/barrie/moving-storage?&page=5&"")",Moving & Storage,228179,http://www.moving.ca,/companies/228179-two-small-men-with-big-hearts?searched_category_id=407&service_area=1870423,"Two Small Men With Big Hearts Moving is one of Canada's largest network of independent moving companies . Our goal is to provide a top level of moving service anywhere in Canada at a competitive price. This will ensure stable, steady growth and make us a force in the future.  We offer local and long distance moving services for homes, apartments & offices within Canada.

Kingston movers ray@moving.ca 613-549-1888 or 613-968-9097
Oshawa movers (Durham region) toronto@moving.ca 905-665-6404
Greater Toronto movers toronto@moving.ca 416-663-6300
York Region movers toronto@moving.ca 905-761-7488
Barrie movers toronto@moving.ca 905-841-9210 or 705-722-9970
Mississauga movers sam@moving.ca 905-272-9310
Kitchener Waterloo movers danmayo@moving.ca 519-748-1117
Hamilton movers (Burlington) kyle@moving.ca 905-524-3278
London movers danmayo@moving.ca 519-666-3600

Some services that we provide are, local moving, Long Haul, long distance moving, National and International Moving for Residential, Office and Commercial Moves. ",two-small-men-with-big-hearts,2007-05-02T20:00:00.000-04:00,NA,Cross Country moves servicing all points in North America. Locally Servicing: All of Ontario,Monday to Friday 9AM to 6PM Saturday 9AM to 5PM  ,Packing Services available.,"Local moving, Long distance moving, National and International Moving for Residential, Office and Commercial Moves. ",,,32,80,"Visa, Mastercard, Cash, Etransfer",,,"BBB, Consumers Choice Award",TRUE,TRUE,,Please call for a free estimate.,TRUE,FALSE,,78765,Two Small Men With Big Hearts,235,173,10,8.03468,"Moving & Storage, Moving Company, Moving Services, Moving Truck, Moving Equipment, Self Storage, Storage Container, portable storage container, moving and, moving in, movers, mover, moving movers, moving on movers, moving mover, self storage, moving companies, company moving, moving company, storage boxes, storage units, storage unit, movers companies, company movers, movers company, moving truck, storage facilities, packers and movers, movers and packers, movers packers, personal storage, moving quotes, moving on quotes, storage containers, car shipping, moving home, storage space, moving house, cardboard boxes, storage solutions, storage container, container storage, moving trucks, moving boxes, boxes for moving, moving and storage in, storage moving, storage and moving, moving storage, moving and storage, storage & moving, a moving and storage, moving to storage, moving rental,  storage bins,  move storage, movers storage, moving storage units, movers with storage, moving pods, moving storage containers, canada moving, moveing, residential moving companies, moving companies, the moving company, canadian moving, mover companies, company movers, moving companies with storage, moving company service, household movers, moving companies in canada, cost of moving across canada, national moving companies, moving estimate, shipping containers moving, moving trailer companies, moving companies local, moving company movers, moving van companies, long distance moving quote, moving agency, residential moving service,  moving van company, household shipping companies, long distance moving and storage, residential mover, company move, moving companies us, storage containers for moving, moving expenses, cross canada movers,  canada movers, home movers, local moving company,  moves canada, best moving companies, western moving and storage, best moving companies canada, moving across canada shipping, moving cost, storage company, moving company rates, moving business, long haul moving companies, full service movers, moving companies from canada to usa, moving prices, containers storage, online movers, packing moving companies, self moving services, movers van, move pods,",0,2008-07-29T14:07:29.000-04:00,Moving,FALSE,0,0,10,100,FALSE,cbcd62e9db3eed485ab1d2d3e8d0a595025781b1,TRUE,TRUE,TRUE,1870423,79.2468521394,407,NA,NA,2020-10-05T22:41:12.000-04:00
https://homestars.com/on/barrie/moving-storage,47,"c(""https://homestars.com/on/barrie/moving-storage?&page=2&"", ""https://homestars.com/on/barrie/moving-storage?&page=3&"", ""https://homestars.com/on/barrie/moving-storage?&page=4&"", ""https://homestars.com/on/barrie/moving-storage?&page=5&"")",Moving & Storage,2965531,https://moverstoprated.com/,/companies/2965531-top-rated-movers?searched_category_id=407&service_area=2274233,"We are a Top-Rated moving company located in Bradford, ON. 

Our Company services all across GTA, and Simcoe County Region. 

We are a professional moving company with more than 11 years of experience.

Your belongings have great value for us, therefore we take extra care of each and every piece in the house by packing your furniture, mirrors, glass accessories, etc. 

We use heavy-duty blankets and shrink wrap on top to ensure your goods arrive at the new place unharmed and in the same condition it was before.",top-rated-movers,2022-03-06T14:45:06.000-05:00,NA,NA,NA,,"Professional Moving Services
Professional Packing Services
Residential/Commercial Moving Services
Piano Moving
Delivery
",,,NA,NA,,,,,FALSE,FALSE,,,FALSE,FALSE,,2027461,Top Rated Movers,26,25,74,10,"Moving & Storage, Moving Company, Moving Services, Moving Truck, Moving Equipment, Self Storage, Storage Container, portable storage container, moving and, moving in, movers, mover, moving movers, moving on movers, moving mover, self storage, moving companies, company moving, moving company, storage boxes, storage units, storage unit, movers companies, company movers, movers company, moving truck, storage facilities, packers and movers, movers and packers, movers packers, personal storage, moving quotes, moving on quotes, storage containers, car shipping, moving home, storage space, moving house, cardboard boxes, storage solutions, storage container, container storage, moving trucks, moving boxes, boxes for moving, moving and storage in, storage moving, storage and moving, moving storage, moving and storage, storage & moving, a moving and storage, moving to storage, moving rental,  storage bins,  move storage, movers storage, moving storage units, movers with storage, moving pods, moving storage containers, canada moving, moveing, residential moving companies, moving companies, the moving company, canadian moving, mover companies, company movers, moving companies with storage, moving company service, household movers, moving companies in canada, cost of moving across canada, national moving companies, moving estimate, shipping containers moving, moving trailer companies, moving companies local, moving company movers, moving van companies, long distance moving quote, moving agency, residential moving service,  moving van company, household shipping companies, long distance moving and storage, residential mover, company move, moving companies us, storage containers for moving, moving expenses, cross canada movers,  canada movers, home movers, local moving company,  moves canada, best moving companies, western moving and storage, best moving companies canada, moving across canada shipping, moving cost, storage company, moving company rates, moving business, long haul moving companies, full service movers, moving companies from canada to usa, moving prices, containers storage, online movers, packing moving companies, self moving services, movers van, move pods,",0,2022-03-06T14:47:34.000-05:00,,FALSE,0,0,91,0,FALSE,fba3559ecc2da06b0cd7142b4b21b14d6a741941,TRUE,TRUE,TRUE,2274233,98.6716519028,407,NA,NA,2022-05-06T14:59:42.000-04:00
