Link,n_hits,all_links,category,id,url,hs_path,profile,permalink,created_at,sic_code,service_area,hours,products,services,brands,specialities,established,employee_cnt,payment_method,diplomas,licenses,memberships,liability_insurance,bonded,project_rate,project_minimum,written_contract,written_warranty,warranty_terms,parent_company_id,name,total_number_of_reviews_cache,total_number_of_approved_reviews_cache,number_of_photos_cache,avg_rating_cache,categories_info_cache,savings_count,claimed_at,subdomain,fraudulent,fraudulent_count,total_number_of_pending_reviews_cache,images_count,completion_percent_cache,bully,secret,replied_to_at_least_one_review_cache,latest_approved_review_created_at,has_set_tasks,lead_purchase_eligible,service_area_id,star_score,quote_button_category,direct_phone,direct_contact
https://homestars.com/on/schomberg/tile-stone-contractors,24,"c(""https://homestars.com/on/schomberg/tile-stone-contractors?&page=2&"", ""https://homestars.com/on/schomberg/tile-stone-contractors?&page=3&"")",Tile & Stone Contractors,2893844,https://www.instagram.com/a_s_tile_flooring/,/companies/2893844-a-and-s-tile?searched_category_id=442&service_area=2114368,"Welcome to A and S Tile
Tiling comes natural to me and I will only do what I do well and not misrepresent what is possible. 
Customers say they appreciate my commitment to their project and I will work 7 days a week if necessary to get the project complete.
I will guide you accordingly and provide my experience so that you're able to also future protect your investment.
Please call to discuss what is possible. ",a-and-s-tile,2017-02-07T02:08:40.000-05:00,NA,NA,NA,,,,,NA,NA,"Cash, Cheque and e-transfer",Worker Health And Safety Awareness In 4 Steps Certificate,,,FALSE,FALSE,,,FALSE,FALSE,1 Year on Workmanship. Kindly ask for more  details. ,1956268,A And S Tile,36,33,77,9.87879,"Tile & Stone Contractors, Natural Stone Tile, Stone Floor Tile, Ceramic Tile, Floor tile, Tile installers, Stone installers, stone counter top installers, tile counter top installers, stone backsplash intallers, granite installers, marble installers, limestone installers, linoleum installers, slate contractors, slate installers,install tite ,backsplash , fire place veenerneed someone to install blacksplash , wall stone veener bath room mosaic,",0,NA,NA,FALSE,0,0,87,0,FALSE,8c4fef38005d6af6f9d2e0904f65b1871032f633,TRUE,2021-06-07T20:46:50.000-04:00,TRUE,TRUE,2114368,96.9037757613,442,NA,NA
https://homestars.com/on/schomberg/tile-stone-contractors,24,"c(""https://homestars.com/on/schomberg/tile-stone-contractors?&page=2&"", ""https://homestars.com/on/schomberg/tile-stone-contractors?&page=3&"")",Tile & Stone Contractors,2972998,https://www.wolfconstructionandrenovation.com/,/companies/2972998-wolf-construction-renovation-ltd?searched_category_id=442&service_area=2291585,"Family-runned business. Our residential projects include both new construction and repairs/restorations. Occupied and fully operational job sites are never a problem. And we can also plan, manage, and build multi-phase jobs. Specializing in tile & marble, bathroom and kitchen remodeling, custom closets, basement renovation, flooring, demolition projects, and home extensions. Fully licensed and liability insured $5,000,000. Building trust with quality work.",wolf-construction-renovation-ltd,2022-09-13T16:08:34.000-04:00,NA,NA,NA,,"Tile & marble, bathroom and kitchen remodeling, custom closets, basement renovation, flooring, demolition projects, and home extensions.",,,10,10,"cash, cheques, e-transfers, money orders.",,"Fully licensed and insured $5,000,000.",,TRUE,FALSE,,$3500,TRUE,FALSE,all work 5 year warranty,2034909,Wolf Construction & Renovation LTD,7,7,34,10,"Bathroom Renovation, Bathroom renovation, bathroom remodeling, bathroom remodelling, renovating the bathroom, tearing out the bathroom, fixing up the bathroom, bathroom contractors, bathroom vanities, bathroom vanity, design of bathroom, bathroom and design, design for bathroom, design a bathroom, design a bath, bath design, bathroom tile, bathroom cabinets, remodeling a bathroom, bathroom remodeling, remodeling the bathroom, ,Bath renovation, New tub, caulking, ,Floor Laying & Refinishing, Hardwood Floor, Wood Floor, Floor Tile, Dance Floor, Ceramic Floor Tile, Floor Refinishing, bamboo floor, cork floor, FSC wood flooring, stone floor, marble floor, slate floor, squeaky floor repair, laminate, laminate repair, wood floor, floor and wood, wood flooring, wood floors, floors in wood, hardwood flooring, hardwood floors, hardwood floors and, hardwood floor, hardwood floor wood, wood floor flooring, refinishing, floor refinishing, floor refinishing in, refinishing floor, hardwood install, floor laying, laying a floor, flood sanding, wood floor refinishing, refinishing hardwood floors, flooring laying, wood floors refinishing, wood flooring refinishing, floor co, flooring hard wood, hard wood floors, laying floors, flooring company, flooring engineered hardwood, floor company, hard wood floor, cleaning hardwood floors, installing hardwood flooring, installing hardwood floors, installing wood flooring, installing wood floors, installing hardwood floors, installing wood flooring, installing wood floors, installing hardwood floor, hardwood flooring installation, business floor, wood flooring installation, hardwood floor installation, floor companies, lay hardwood flooring, lay hardwood floor, wood floor repair, repair wood floor, repair hardwood floor, hardwood floor repair, finishing a hardwood floor, squeeky floors,,Hardwood floors, Install hardwood floors, caulking,Kitchen Planning & Renovation, Kitchen Planning And Design, Kitchen Cabinet Planning, Kitchen Design, Kitchen Remodeling, kitchen or, and bathroom, a and a kitchens, kitchens and, for kitchens, a kitchens, kitchens, the house design, cabinets for kitchen, cabinets for the kitchen, cabinets and kitchen, kitchen cabinets, design a kitchen, about kitchen design, a kitchen design, how to kitchen design, design and kitchen, the kitchen design, design for kitchen, kitchen designs, renovation and remodeling, remodeling and renovation, kitchen designer,,Kitchen Renovation, caulking, ,Tile & Stone Contractors, Natural Stone Tile, Stone Floor Tile, Ceramic Tile, Floor tile, Tile installers, Stone installers, stone counter top installers, tile counter top installers, stone backsplash intallers, granite installers, marble installers, limestone installers, linoleum installers, slate contractors, slate installers,install tite ,backsplash , fire place veenerneed someone to install blacksplash , wall stone veener bath room mosaic,",0,2022-09-13T16:10:10.000-04:00,wolfconstruction,FALSE,0,0,53,0,FALSE,fe6854a2c06e75143909d5518782e3b71311a4f7,TRUE,NA,TRUE,TRUE,2291585,90.6269241173,442,NA,NA
https://homestars.com/on/schomberg/tile-stone-contractors,24,"c(""https://homestars.com/on/schomberg/tile-stone-contractors?&page=2&"", ""https://homestars.com/on/schomberg/tile-stone-contractors?&page=3&"")",Tile & Stone Contractors,2965348,,/companies/2965348-black-falcon-construction?searched_category_id=442&service_area=2274148,,black-falcon-construction,2022-03-01T21:56:48.000-05:00,NA,NA,NA,,Full Home Build | Full Home Renovation | Bathrooms Renovation | Kitchen Renovation | Basement Renovation | Flooring | Handyman Services,,Residential | Commercial,NA,NA,Cash | Cheques | E-Transfer,,Fully Licensed,,TRUE,FALSE,,,TRUE,FALSE,,2027278,Black Falcon Construction ,3,3,191,10,"General Contractors, Residential General Contractor, Building Contractor, Additions, Remodeling Contractor,  Renovation, Builder, building construction, renovation, remodeling, construction builders, construction company, construction companies, home repair, construction jobs, home remodeling, general contractors, contractors general, contractor general, contractors construction, construction contractors, home improvement and remodeling, kitchen remodeling, construction contractor, builders contractors, home renovation, general contracting, building contractors, building companies, home renovations, builder contractor, building contractor, remodeling contractor, commercial construction, residential construction, house contractor, concrete contractors, home contractors, general construction, construction general, contractors remodeling, remodeling contractors, remodelers, remodel contractor, remodel contractors, general contract, commercial contractors, renovations contractors, home improvement contractor, licensed contractor, license general contractor, mud room, mudroom, caulking, ,Floor Laying & Refinishing, Hardwood Floor, Wood Floor, Floor Tile, Dance Floor, Ceramic Floor Tile, Floor Refinishing, bamboo floor, cork floor, FSC wood flooring, stone floor, marble floor, slate floor, squeaky floor repair, laminate, laminate repair, wood floor, floor and wood, wood flooring, wood floors, floors in wood, hardwood flooring, hardwood floors, hardwood floors and, hardwood floor, hardwood floor wood, wood floor flooring, refinishing, floor refinishing, floor refinishing in, refinishing floor, hardwood install, floor laying, laying a floor, flood sanding, wood floor refinishing, refinishing hardwood floors, flooring laying, wood floors refinishing, wood flooring refinishing, floor co, flooring hard wood, hard wood floors, laying floors, flooring company, flooring engineered hardwood, floor company, hard wood floor, cleaning hardwood floors, installing hardwood flooring, installing hardwood floors, installing wood flooring, installing wood floors, installing hardwood floors, installing wood flooring, installing wood floors, installing hardwood floor, hardwood flooring installation, business floor, wood flooring installation, hardwood floor installation, floor companies, lay hardwood flooring, lay hardwood floor, wood floor repair, repair wood floor, repair hardwood floor, hardwood floor repair, finishing a hardwood floor, squeeky floors,,Hardwood floors, Install hardwood floors, caulking,Tile & Stone Contractors, Natural Stone Tile, Stone Floor Tile, Ceramic Tile, Floor tile, Tile installers, Stone installers, stone counter top installers, tile counter top installers, stone backsplash intallers, granite installers, marble installers, limestone installers, linoleum installers, slate contractors, slate installers,install tite ,backsplash , fire place veenerneed someone to install blacksplash , wall stone veener bath room mosaic,",0,2022-03-04T16:47:47.000-05:00,BlackFalcon,FALSE,0,0,234,0,FALSE,b12bafb64dd5b6928d83364863dcfb4a8299890a,TRUE,NA,TRUE,TRUE,2274148,90.1379107989,442,NA,NA
https://homestars.com/on/schomberg/tile-stone-contractors,24,"c(""https://homestars.com/on/schomberg/tile-stone-contractors?&page=2&"", ""https://homestars.com/on/schomberg/tile-stone-contractors?&page=3&"")",Tile & Stone Contractors,2964593,,/companies/2964593-top-renovation-and-repairs?searched_category_id=442&service_area=2273741,"Fast, efficient, and honest, TOP Renovation has become a reputable home renovation company. Our team is up for every job, managing projects with the skill and experience our clients have come to expect.

TOP Renovation offers a wide range of renovation options from kitchen, bathroom, basement, whole house, painting and flooring. We work closely with customers to develop their ideal home renovation. We want our customers to be satisfied with our work, which is why we provide open communication channels throughout the duration of each project.

TOP Renovation has gained a solid reputation in GTA area and maintains an A+ rating with most of our clients. We encourage you to check our current standing! We strive to provide complete satisfaction to our customers, which provides consistent referrals for new work.

Our beautiful showroom provides access to the most populous selection of tiles, floorings, lights, walls, handrails, woodboards and other accessories from famous brands, feel free to contact us today and make an appointment.
",top-renovation-and-repairs,2022-02-10T11:55:27.000-05:00,NA,NA,NA,,"installation kitchen tiles, bathroom, basement, whole house, painting and flooring",,,2012,20,,,,,TRUE,TRUE,,,TRUE,FALSE,,2026523,Top Renovation and Repairs,5,5,106,10,"General Contractors, Residential General Contractor, Building Contractor, Additions, Remodeling Contractor,  Renovation, Builder, building construction, renovation, remodeling, construction builders, construction company, construction companies, home repair, construction jobs, home remodeling, general contractors, contractors general, contractor general, contractors construction, construction contractors, home improvement and remodeling, kitchen remodeling, construction contractor, builders contractors, home renovation, general contracting, building contractors, building companies, home renovations, builder contractor, building contractor, remodeling contractor, commercial construction, residential construction, house contractor, concrete contractors, home contractors, general construction, construction general, contractors remodeling, remodeling contractors, remodelers, remodel contractor, remodel contractors, general contract, commercial contractors, renovations contractors, home improvement contractor, licensed contractor, license general contractor, mud room, mudroom, caulking, ,Floor Laying & Refinishing, Hardwood Floor, Wood Floor, Floor Tile, Dance Floor, Ceramic Floor Tile, Floor Refinishing, bamboo floor, cork floor, FSC wood flooring, stone floor, marble floor, slate floor, squeaky floor repair, laminate, laminate repair, wood floor, floor and wood, wood flooring, wood floors, floors in wood, hardwood flooring, hardwood floors, hardwood floors and, hardwood floor, hardwood floor wood, wood floor flooring, refinishing, floor refinishing, floor refinishing in, refinishing floor, hardwood install, floor laying, laying a floor, flood sanding, wood floor refinishing, refinishing hardwood floors, flooring laying, wood floors refinishing, wood flooring refinishing, floor co, flooring hard wood, hard wood floors, laying floors, flooring company, flooring engineered hardwood, floor company, hard wood floor, cleaning hardwood floors, installing hardwood flooring, installing hardwood floors, installing wood flooring, installing wood floors, installing hardwood floors, installing wood flooring, installing wood floors, installing hardwood floor, hardwood flooring installation, business floor, wood flooring installation, hardwood floor installation, floor companies, lay hardwood flooring, lay hardwood floor, wood floor repair, repair wood floor, repair hardwood floor, hardwood floor repair, finishing a hardwood floor, squeeky floors,,Hardwood floors, Install hardwood floors, caulking,Paint & Wallpaper Contractors, Paint Colors, Paint Store, Paint Brush, Paint Shop, Home Wallpaper,Wallpaper, Paint colour advice, paint colour consultants, wallpapering, painter, faux, painters painting, painters paint, business painting, find painting, painting and restoration, new jersey painting, oh painting, local painting, wall paper repair, ,Tile & Stone Contractors, Natural Stone Tile, Stone Floor Tile, Ceramic Tile, Floor tile, Tile installers, Stone installers, stone counter top installers, tile counter top installers, stone backsplash intallers, granite installers, marble installers, limestone installers, linoleum installers, slate contractors, slate installers,install tite ,backsplash , fire place veenerneed someone to install blacksplash , wall stone veener bath room mosaic,Drywall Contractors, Dry Wall Repair, Dry Wall Installation, dry wall contracting, gypsum repair, gypsum installation, gypsum contractors, gyprock installers, gyprock intallation, dry wall installers, sheetrock, wall board, drywall, drywaller, waller, wall repair, drywall, plaster, how to drywall, drywall, what is drywall, sheetrock, dry wall, plastering, wall repair, drywall repair, how to repair drywall, repair drywall,  ,",0,2022-02-10T12:00:19.000-05:00,,FALSE,0,0,108,0,FALSE,53d84a5dfda03af96cdc83d656f9bede3d84f887,TRUE,NA,TRUE,TRUE,2273741,90.7180377355,442,NA,NA
https://homestars.com/on/schomberg/tile-stone-contractors,24,"c(""https://homestars.com/on/schomberg/tile-stone-contractors?&page=2&"", ""https://homestars.com/on/schomberg/tile-stone-contractors?&page=3&"")",Tile & Stone Contractors,2959223,https://www.venusinahomes.ca/,/companies/2959223-venusina-homes?searched_category_id=442&service_area=2260108,"What you should know about us!

At VENUSINA HOMES every possible measure is taken to ensure customers become repeat clients and inform their related ones about the great experience they have with us. We are persistent with providing highly competitive service to our clients and providing utmost attention to your needs and wants is part of our service commitment to you. High Quality Service, Highly Competitive Pricing and High Level of Client Satisfaction are the elements which form the VENUSINA triangle of success. 

Your 100% sarisfaction is what keeps us motivated to take that extra step and have you come back only to us.

We are loyal and devoted to you! Call Sina Okhovat for consultation and estimate at 416.540.7533

Famous for Unique Service. Personalized Experience.
High Quality & Desirable Result.",venusina-homes,2021-08-28T18:31:21.000-04:00,NA,NA,NA,,"Obtaining Permits for Your Desired Projects

Kitchen Design, Supply and Installation of All Dimensions

Upgrading Kitchen and Workshop Countertops

Bathroom Remodeling, Upgrades & Repairs

Basement Finishing (Including Walk-Outs and Walk-Ups)

Hardwood, Engineered Hardwood, Laminate, Luxury Vinyl and Carpet Installation

Removal of Old Tiles & Installation of New Tiles of all Dimensions

Carpentry, and Finishing of Unfinished Projects

Removal & Relocation of Walls, Plumbing, Electrical and Ventilation Ducts

All Sorts of Electrical and Plumbing Services

All Types of Interior & Exterior Painting

All Sorts of Landscaping (Interlocking and Garden Design)

All Sorts of Exterior Fixtures (Decks, Gazebos, Pergolas, Sheds)

Repairs & Remodeling - All types and sorts

Handyman Services (Minor Interior and Exterior Repairs, Hanging
Picture Frames, etc.)",,,NA,NA,,,,,FALSE,FALSE,,,FALSE,FALSE,,2021200,VENUSINA HOMES,10,9,167,10,"General Contractors, Residential General Contractor, Building Contractor, Additions, Remodeling Contractor,  Renovation, Builder, building construction, renovation, remodeling, construction builders, construction company, construction companies, home repair, construction jobs, home remodeling, general contractors, contractors general, contractor general, contractors construction, construction contractors, home improvement and remodeling, kitchen remodeling, construction contractor, builders contractors, home renovation, general contracting, building contractors, building companies, home renovations, builder contractor, building contractor, remodeling contractor, commercial construction, residential construction, house contractor, concrete contractors, home contractors, general construction, construction general, contractors remodeling, remodeling contractors, remodelers, remodel contractor, remodel contractors, general contract, commercial contractors, renovations contractors, home improvement contractor, licensed contractor, license general contractor, mud room, mudroom, caulking, ,Basement Renovation, Basement renovation, Basement remodeling, Basement remodelling, renovating your basement, renovation, waterproofing, remodeling, home renovation, house renovation, water in basement, basement waterproofing,finishing basement, moistureproof, remodeling the house, caulking,Tile & Stone Contractors, Natural Stone Tile, Stone Floor Tile, Ceramic Tile, Floor tile, Tile installers, Stone installers, stone counter top installers, tile counter top installers, stone backsplash intallers, granite installers, marble installers, limestone installers, linoleum installers, slate contractors, slate installers,install tite ,backsplash , fire place veenerneed someone to install blacksplash , wall stone veener bath room mosaic,Kitchen Planning & Renovation, Kitchen Planning And Design, Kitchen Cabinet Planning, Kitchen Design, Kitchen Remodeling, kitchen or, and bathroom, a and a kitchens, kitchens and, for kitchens, a kitchens, kitchens, the house design, cabinets for kitchen, cabinets for the kitchen, cabinets and kitchen, kitchen cabinets, design a kitchen, about kitchen design, a kitchen design, how to kitchen design, design and kitchen, the kitchen design, design for kitchen, kitchen designs, renovation and remodeling, remodeling and renovation, kitchen designer,,Kitchen Renovation, caulking, ,",0,2021-08-28T18:31:49.000-04:00,venusinahomes,FALSE,0,0,225,0,FALSE,19b4c74cce44dee0befc431ed300a09b12b3d69e,TRUE,2022-06-22T20:51:46.000-04:00,TRUE,TRUE,2260108,90.4890245952,442,NA,NA
https://homestars.com/on/schomberg/tile-stone-contractors,24,"c(""https://homestars.com/on/schomberg/tile-stone-contractors?&page=2&"", ""https://homestars.com/on/schomberg/tile-stone-contractors?&page=3&"")",Tile & Stone Contractors,2958205,https://www.grandetile.ca/,/companies/2958205-grande-tile-and-reno-plus?searched_category_id=442&service_area=2257820,"A Trusted Team of Experts raising the bar for Home Renovations and New Project Interiors

What makes Grande Tile and Reno Plus different? 
Producing and quickly sourcing beautiful products, delivering on time, and on budget. 
We truly enjoy working with Homeowners to create their dreams and we are trusted by Project Managers and Developers helping them make their developments shine with exceptionally beautiful rooms and on site showrooms. 

Our work is done exactingly, always on time and at affordable prices. 


Why Choose Us?
- Expert artisan and building teams producing wonderful results
- With over 100 types of hardwood floors, 50 types of vinyl flooring, 200 countertop choices, 300 tiling options, and fully customizable cabinets, the only limit is your imagination. 
- A 5-star rating on Google

",grande-tile-and-reno-plus,2021-07-20T12:00:58.000-04:00,NA,NA,NA,,,,,2012,NA,"Cash, Cheques, E-Transfer, AMEX/VISA/Mastercard Credit or Debit",,Fully Licensed,"BILD, Renomark",TRUE,TRUE,,,TRUE,FALSE,,2020182,Grande Tile and Reno Plus,23,21,41,10,"Tile & Stone Contractors, Natural Stone Tile, Stone Floor Tile, Ceramic Tile, Floor tile, Tile installers, Stone installers, stone counter top installers, tile counter top installers, stone backsplash intallers, granite installers, marble installers, limestone installers, linoleum installers, slate contractors, slate installers,install tite ,backsplash , fire place veenerneed someone to install blacksplash , wall stone veener bath room mosaic,Countertops, Granite Counter Tops, Kitchen Counter Tops, Marble Counter Tops, Laminate Counter Top, Quartz Counter Top, Corian counter top, tile counter top, silestone counter tops, arborite counter tops, custom counter tops, kitchen, remodeling, kitchen cabinet, kitchen design, ,Floor Laying & Refinishing, Hardwood Floor, Wood Floor, Floor Tile, Dance Floor, Ceramic Floor Tile, Floor Refinishing, bamboo floor, cork floor, FSC wood flooring, stone floor, marble floor, slate floor, squeaky floor repair, laminate, laminate repair, wood floor, floor and wood, wood flooring, wood floors, floors in wood, hardwood flooring, hardwood floors, hardwood floors and, hardwood floor, hardwood floor wood, wood floor flooring, refinishing, floor refinishing, floor refinishing in, refinishing floor, hardwood install, floor laying, laying a floor, flood sanding, wood floor refinishing, refinishing hardwood floors, flooring laying, wood floors refinishing, wood flooring refinishing, floor co, flooring hard wood, hard wood floors, laying floors, flooring company, flooring engineered hardwood, floor company, hard wood floor, cleaning hardwood floors, installing hardwood flooring, installing hardwood floors, installing wood flooring, installing wood floors, installing hardwood floors, installing wood flooring, installing wood floors, installing hardwood floor, hardwood flooring installation, business floor, wood flooring installation, hardwood floor installation, floor companies, lay hardwood flooring, lay hardwood floor, wood floor repair, repair wood floor, repair hardwood floor, hardwood floor repair, finishing a hardwood floor, squeeky floors,,Hardwood floors, Install hardwood floors, caulking,Kitchen & Bathroom - Cabinets & Design, Kitchen Cabinet And Counter, Kitchen Cabinet Hardware, Bathroom Cabinet, Bathroom Wall Cabinet, Bathroom Sink Cabinet, cabinets, kitchens, cabinetry, kitchen and cabinets, cabinets for kitchen, about kitchen cabinets, kitchen cabinets, kitchen cabinets in, cabinets for the kitchen, cabinets and kitchen, cabinets kitchen, kitchen cabinet, cabinet kitchen, the kitchen cabinet, kitchen by design, design kitchen, a kitchen design, design a kitchen, design for kitchen, design and kitchen, design by kitchen, kitchen design, cabinetry kitchen, kitchen cabinetry, designs kitchen, kitchen designs, bathroom vanities, vanity and bathroom, bath and vanity, designer kitchen, ,",0,2021-07-20T12:03:22.000-04:00,grandetile,FALSE,0,0,49,0,FALSE,7ced7c3100820f4754bad6d4f94f1c85814ddefd,TRUE,2022-02-08T00:54:44.000-05:00,TRUE,TRUE,2257820,99.0137624947,442,NA,NA
