Link,n_hits,all_links,category,id,url,hs_path,profile,permalink,created_at,sic_code,service_area,hours,products,services,brands,specialities,established,employee_cnt,payment_method,diplomas,licenses,memberships,liability_insurance,bonded,project_rate,project_minimum,written_contract,written_warranty,warranty_terms,parent_company_id,name,total_number_of_reviews_cache,total_number_of_approved_reviews_cache,number_of_photos_cache,avg_rating_cache,categories_info_cache,savings_count,claimed_at,subdomain,fraudulent,fraudulent_count,total_number_of_pending_reviews_cache,images_count,completion_percent_cache,bully,secret,replied_to_at_least_one_review_cache,latest_approved_review_created_at,has_set_tasks,lead_purchase_eligible,service_area_id,star_score,quote_button_category,direct_phone,direct_contact
https://homestars.com/on/georgetown/concrete-contractors,54,"c(""https://homestars.com/on/georgetown/concrete-contractors?&page=2&"", ""https://homestars.com/on/georgetown/concrete-contractors?&page=3&"", ""https://homestars.com/on/georgetown/concrete-contractors?&page=4&"", ""https://homestars.com/on/georgetown/concrete-contractors?&page=5&"", ""https://homestars.com/on/georgetown/concrete-contractors?&page=6&"")",Concrete Contractors,2965032,https://www.sabbadinconstruction.com/,/companies/2965032-sabbadin-construction?searched_category_id=337&service_area=2275010,"Sabbadin Construction INC. 
- Branded company in the concrete finishing industry 
- WE OFFER FINANCING! https://www.financeit.ca/s/yV67jQ
Sabbadin construction is a general construction company, known for its decorative concrete work in early years. Sabbadin construction has moved into a full scale building company offering you project planning and coordination from the first step to the last.

We here at Sabbadin Construction strive for a test of time building customers branded images built by the best. Future out look into the development stages of custom building homes true one stop shop for all your contracting needs.
",sabbadin-construction,2022-02-22T09:42:55.000-05:00,NA,NA,NA,concrete sealers ,"Driveways , Patios , Pool decks , walkways , steps  , finished floors , foundations , engineered slabs and much more ",Sabbadin Construction will be offering a custom stamp design that will only be available by us ,Decorative concrete work with many styles colours and finishes. Also power finished floors major areas ,2017,20,"Cheque , credit card , e-transfer and we offer financing ",,,,TRUE,FALSE,,"$10,000",TRUE,FALSE,,2026962,Sabbadin Construction ,3,3,2,10,"Concrete Contractors, Impressed concrete, poured concrete, stamped concrete, radiant heating, concrete floors, contractors, concrete repair, concrete in, masonry, asphalt, paving, pavers, in the driveway, driveway, construction companies, driveways, block of concrete, concrete block, concrete mix, concret, concrete blocks, concrete slab, cost of concrete, concrete cost, concrete wall, price of concrete, concrete price, concrete stain, stamped concrete, concrete prices, repair concrete, how to repair concrete, repair of concrete, concrete repair, concrete slabs, decorative concrete, concrete decorative, staining concrete, concrete staining, concrete walls, countertop concrete, concrete countertops, patio ideas, cement companies, ready mix concrete, concrete ready mix, slabjack, slabjacking, mudjack, mudjacking, Driveway, caulking,,",0,2022-02-22T09:44:13.000-05:00,sabbadinconstruction,FALSE,0,0,3,0,FALSE,a6a119eb8765583df40655860f4efef5280a0723,TRUE,NA,TRUE,TRUE,2275010,89.6878245607,337,NA,NA
https://homestars.com/on/georgetown/concrete-contractors,54,"c(""https://homestars.com/on/georgetown/concrete-contractors?&page=2&"", ""https://homestars.com/on/georgetown/concrete-contractors?&page=3&"", ""https://homestars.com/on/georgetown/concrete-contractors?&page=4&"", ""https://homestars.com/on/georgetown/concrete-contractors?&page=5&"", ""https://homestars.com/on/georgetown/concrete-contractors?&page=6&"")",Concrete Contractors,2963655,https://touchconstruction.ca/,/companies/2963655-touch-construction-inc?searched_category_id=337&service_area=2270092,"Offering exceptional and professional services for all your construction needs.

With over 30 years of experience in industry, trust our team to guide you through your construction project with confidence and ease.

Our clients depend on our knowledge and skill to ensure their projects are completed to the highest standards. At Touch Construction we believe our work speaks for itself. 

From Renovations & Additions, Custom Homes, Demolition & Excavations and Concrete Foundations, we are excited to show you what we can do!

Renovations & Additions
Extensions, underpinning, waterproofing, walk-outs, porches, and more.

Custom Homes
Turn-key operations; liaising with architects and homeowners to achieve the desired results.

Demolition & Excavation
Removal of existing home and debris, excavation and soil removal, locates and more.

Concrete Foundations
Concrete footings, full foundation walls, concrete stairs, concrete basements, and more.

Give Us A Call - 416-417-7589",touch-construction-inc,2022-01-18T13:14:47.000-05:00,NA,NA,NA,,"RENOVATIONS & ADDITIONS | CUSTOM HOMES | DEMOLITION & EXCAVATION
| CONCRETE FOUNDATIONS",,,NA,NA,Cash | Cheques | E-Transfer,,,,TRUE,FALSE,,,TRUE,FALSE,,2025605,Touch Construction Inc,2,2,15,10,"General Contractors, Residential General Contractor, Building Contractor, Additions, Remodeling Contractor,  Renovation, Builder, building construction, renovation, remodeling, construction builders, construction company, construction companies, home repair, construction jobs, home remodeling, general contractors, contractors general, contractor general, contractors construction, construction contractors, home improvement and remodeling, kitchen remodeling, construction contractor, builders contractors, home renovation, general contracting, building contractors, building companies, home renovations, builder contractor, building contractor, remodeling contractor, commercial construction, residential construction, house contractor, concrete contractors, home contractors, general construction, construction general, contractors remodeling, remodeling contractors, remodelers, remodel contractor, remodel contractors, general contract, commercial contractors, renovations contractors, home improvement contractor, licensed contractor, license general contractor, mud room, mudroom, caulking, ,Concrete Contractors, Impressed concrete, poured concrete, stamped concrete, radiant heating, concrete floors, contractors, concrete repair, concrete in, masonry, asphalt, paving, pavers, in the driveway, driveway, construction companies, driveways, block of concrete, concrete block, concrete mix, concret, concrete blocks, concrete slab, cost of concrete, concrete cost, concrete wall, price of concrete, concrete price, concrete stain, stamped concrete, concrete prices, repair concrete, how to repair concrete, repair of concrete, concrete repair, concrete slabs, decorative concrete, concrete decorative, staining concrete, concrete staining, concrete walls, countertop concrete, concrete countertops, patio ideas, cement companies, ready mix concrete, concrete ready mix, slabjack, slabjacking, mudjack, mudjacking, Driveway, caulking,,Home Additions, General contractor, home improvement, building addition, home expansion, house expansion, house building, plans house, house plans from, plans for house, the house plans, house plans, renovation, in house design, home plans house, home house plans, house home plans, house plans home, remodeling, house plans and designs, designs house plans, house designs plans, house plans designs, home plans and designs, home designs plans, floor plans, house build, renovations, plans for building, kitchen cabinets, remodel, kitchen design, house plans for building, house plans building, ,",0,2022-01-18T13:16:47.000-05:00,touchconstruction,FALSE,0,0,16,0,FALSE,95e0856286691fe7d831726a4c68504c9abf505c,TRUE,NA,TRUE,TRUE,2270092,89.3110323058,337,NA,NA
https://homestars.com/on/georgetown/concrete-contractors,54,"c(""https://homestars.com/on/georgetown/concrete-contractors?&page=2&"", ""https://homestars.com/on/georgetown/concrete-contractors?&page=3&"", ""https://homestars.com/on/georgetown/concrete-contractors?&page=4&"", ""https://homestars.com/on/georgetown/concrete-contractors?&page=5&"", ""https://homestars.com/on/georgetown/concrete-contractors?&page=6&"")",Concrete Contractors,2957945,,/companies/2957945-alonzi-construction-ltd?searched_category_id=337&service_area=2260177,,alonzi-construction-ltd,2021-07-10T17:23:27.000-04:00,NA,NA,NA,,,,,NA,NA,,,,,FALSE,FALSE,,,FALSE,FALSE,,2019922,Alonzi construction Ltd ,6,4,28,10,"Concrete Contractors, Impressed concrete, poured concrete, stamped concrete, radiant heating, concrete floors, contractors, concrete repair, concrete in, masonry, asphalt, paving, pavers, in the driveway, driveway, construction companies, driveways, block of concrete, concrete block, concrete mix, concret, concrete blocks, concrete slab, cost of concrete, concrete cost, concrete wall, price of concrete, concrete price, concrete stain, stamped concrete, concrete prices, repair concrete, how to repair concrete, repair of concrete, concrete repair, concrete slabs, decorative concrete, concrete decorative, staining concrete, concrete staining, concrete walls, countertop concrete, concrete countertops, patio ideas, cement companies, ready mix concrete, concrete ready mix, slabjack, slabjacking, mudjack, mudjacking, Driveway, caulking,,",0,2021-07-10T17:24:11.000-04:00,,FALSE,0,0,39,0,FALSE,63ff2b22890e4f9936358bc07b3f44b0a24bfd26,TRUE,NA,TRUE,TRUE,2260177,82.0116595768,337,NA,NA
https://homestars.com/on/georgetown/concrete-contractors,54,"c(""https://homestars.com/on/georgetown/concrete-contractors?&page=2&"", ""https://homestars.com/on/georgetown/concrete-contractors?&page=3&"", ""https://homestars.com/on/georgetown/concrete-contractors?&page=4&"", ""https://homestars.com/on/georgetown/concrete-contractors?&page=5&"", ""https://homestars.com/on/georgetown/concrete-contractors?&page=6&"")",Concrete Contractors,2956483,https://apcons.ca/,/companies/2956483-ap-cons?searched_category_id=337&service_area=2253971,"Ap Cons is a modern construction service provider committed to delivering the best and customizable construction services to people in Toronto. We’re a one-stop brand for property owners who desire to get the best value for their resources when hiring experts to meet their construction needs. From clearing and excavation services to home additions and all that falls in between, our team of dexterous professionals can always give you the best.

Having been in the industry for a pretty while, we’ve mastered the rudiments and all it takes to keep every customer smiling in satisfaction. Little wonder our previous clients can’t stop recommending our services and hoisting our brand name in praise. When you think of a construction company you can trust in Toronto for excellent services, Ap Cons is the brand to call.  

What We Do
Here at Ap Cons, we provide a wide range of reliable construction solutions. We strive to be involved in every project we handle from start to finish, offering our clients cost-effective solutions.
Check out our services:

Excavation
Waterproofing
Concrete Work
Home Additions
Interlocking

Ap Cons is a brand that tailors each service to meet the exact needs of each client. So, when you come to us with a project, rest assured that we’ll carve out a process that works in line with your budget, site, requirements and timeline. ",ap-cons,2021-05-20T13:16:30.000-04:00,NA,NA,NA,,,,,2012,NA,"E-transfer, Cash, Cheque",,,,TRUE,FALSE,,No job is too small or big,TRUE,FALSE,"Yes, kindly ask for details",2018461,AP CONS,3,3,18,10,"Concrete Contractors, Impressed concrete, poured concrete, stamped concrete, radiant heating, concrete floors, contractors, concrete repair, concrete in, masonry, asphalt, paving, pavers, in the driveway, driveway, construction companies, driveways, block of concrete, concrete block, concrete mix, concret, concrete blocks, concrete slab, cost of concrete, concrete cost, concrete wall, price of concrete, concrete price, concrete stain, stamped concrete, concrete prices, repair concrete, how to repair concrete, repair of concrete, concrete repair, concrete slabs, decorative concrete, concrete decorative, staining concrete, concrete staining, concrete walls, countertop concrete, concrete countertops, patio ideas, cement companies, ready mix concrete, concrete ready mix, slabjack, slabjacking, mudjack, mudjacking, Driveway, caulking,,Fences & Gates, Dog Fence, Invisible Fence, Chain Link Fence, Pool Fence, Wood Fence, Fence Gates, Dog Gates, Pet Gates, friendly neighbour fence, friendly neighbor fence, picket fence, wrought iron fence, and gate, and gates, gates, the fence, a fence, fence, fences, fence with gate, gate and fence, gate for fence, fence & gate, gate fence, fence gate, fence and gate, gates and fence, gates fence, fence & gates, fence and gates, fence gates, railings, wrought iron, electronic gates, entrance gate, trellis, fence post, front gates, chain fence, fence panels, fence chain link, chain link fence, how to wood fence, fence wood, wood for fence, wood fence, fence panel, garden gate, fence posts, fencing panels, iron gate, chain link fencing, panel fencing, gates iron, iron gates, chain link fences, fences chain link, fencing post, dog fencing, ,",0,2021-05-20T13:18:06.000-04:00,,FALSE,0,0,29,0,FALSE,0814696a903043045d5e62027c3da4aff5633c60,TRUE,NA,TRUE,TRUE,2253971,78.2489591048,337,NA,NA
https://homestars.com/on/georgetown/concrete-contractors,54,"c(""https://homestars.com/on/georgetown/concrete-contractors?&page=2&"", ""https://homestars.com/on/georgetown/concrete-contractors?&page=3&"", ""https://homestars.com/on/georgetown/concrete-contractors?&page=4&"", ""https://homestars.com/on/georgetown/concrete-contractors?&page=5&"", ""https://homestars.com/on/georgetown/concrete-contractors?&page=6&"")",Concrete Contractors,2948855,https://pj11construction.com/,/companies/2948855-pj11-construction?searched_category_id=337&service_area=2243324,"“WE DO IT ALL”
25+ years of International Experience
Free Estimates & Best Prices in Ontario
Concrete, Decks, Interior & Exterior Renovations 

Our international experience will provide you with an excellent work and exceptional service, with
our quality being nothing less 10/10. We take pride in satisfying our clients and we hope to see you soon.
",pj11-construction,2020-10-20T15:17:24.000-04:00,NA,NA,NA,,,,,2005,NA,"e-transfer, cash, cheque. All Card payments debit and credit",,,,TRUE,FALSE,,No job is too small or big,TRUE,FALSE,"Yes, kindly ask for details.",2010992,PJ11 Construction,25,20,164,9.95,"General Contractors, Residential General Contractor, Building Contractor, Additions, Remodeling Contractor,  Renovation, Builder, building construction, renovation, remodeling, construction builders, construction company, construction companies, home repair, construction jobs, home remodeling, general contractors, contractors general, contractor general, contractors construction, construction contractors, home improvement and remodeling, kitchen remodeling, construction contractor, builders contractors, home renovation, general contracting, building contractors, building companies, home renovations, builder contractor, building contractor, remodeling contractor, commercial construction, residential construction, house contractor, concrete contractors, home contractors, general construction, construction general, contractors remodeling, remodeling contractors, remodelers, remodel contractor, remodel contractors, general contract, commercial contractors, renovations contractors, home improvement contractor, licensed contractor, license general contractor, mud room, mudroom, caulking, ,Concrete Contractors, Impressed concrete, poured concrete, stamped concrete, radiant heating, concrete floors, contractors, concrete repair, concrete in, masonry, asphalt, paving, pavers, in the driveway, driveway, construction companies, driveways, block of concrete, concrete block, concrete mix, concret, concrete blocks, concrete slab, cost of concrete, concrete cost, concrete wall, price of concrete, concrete price, concrete stain, stamped concrete, concrete prices, repair concrete, how to repair concrete, repair of concrete, concrete repair, concrete slabs, decorative concrete, concrete decorative, staining concrete, concrete staining, concrete walls, countertop concrete, concrete countertops, patio ideas, cement companies, ready mix concrete, concrete ready mix, slabjack, slabjacking, mudjack, mudjacking, Driveway, caulking,,",0,2020-10-20T15:17:33.000-04:00,,FALSE,0,0,165,0,FALSE,b760e74150c33a6e65285ffd284ecb560af0e15e,TRUE,2021-09-08T22:18:16.000-04:00,TRUE,TRUE,2243324,98.2632211867,337,NA,NA
https://homestars.com/on/georgetown/concrete-contractors,54,"c(""https://homestars.com/on/georgetown/concrete-contractors?&page=2&"", ""https://homestars.com/on/georgetown/concrete-contractors?&page=3&"", ""https://homestars.com/on/georgetown/concrete-contractors?&page=4&"", ""https://homestars.com/on/georgetown/concrete-contractors?&page=5&"", ""https://homestars.com/on/georgetown/concrete-contractors?&page=6&"")",Concrete Contractors,2901004,http://www.margis.ca,/companies/2901004-margis-construction?searched_category_id=337&service_area=2178846,"MarGis Construction, specializes in architectural concrete finishes such as stamped concrete, coloured concrete, exposed aggregate, broom finish. 

Our work is all related to concrete in driveways, patios, walkways, verandas, porches, retaining walls and curbing, basement slabs and garages, heated driveways. 

We always provide quality installations. 

We can't wait to hear back from you! 

We service all GTA Toronto",margis-construction,2017-08-18T08:05:55.000-04:00,NA,NA,NA,,,,,NA,NA,"Cheque, Cash and e-transfer",,,,TRUE,FALSE,,,TRUE,FALSE,Yes. Kindly ask for details. Depends on project completed. ,1963290,Margis Construction ,27,25,156,9.96,"Concrete Contractors, Impressed concrete, poured concrete, stamped concrete, radiant heating, concrete floors, contractors, concrete repair, concrete in, masonry, asphalt, paving, pavers, in the driveway, driveway, construction companies, driveways, block of concrete, concrete block, concrete mix, concret, concrete blocks, concrete slab, cost of concrete, concrete cost, concrete wall, price of concrete, concrete price, concrete stain, stamped concrete, concrete prices, repair concrete, how to repair concrete, repair of concrete, concrete repair, concrete slabs, decorative concrete, concrete decorative, staining concrete, concrete staining, concrete walls, countertop concrete, concrete countertops, patio ideas, cement companies, ready mix concrete, concrete ready mix, slabjack, slabjacking, mudjack, mudjacking, Driveway, caulking,,",0,2017-08-18T08:07:01.000-04:00,NA,FALSE,0,0,131,0,FALSE,1039c7bd7f81f3a5e7e993f675b4d2a9967fba37,TRUE,2021-06-26T16:38:52.000-04:00,TRUE,TRUE,2178846,94.3936244138,337,NA,NA
https://homestars.com/on/georgetown/concrete-contractors,54,"c(""https://homestars.com/on/georgetown/concrete-contractors?&page=2&"", ""https://homestars.com/on/georgetown/concrete-contractors?&page=3&"", ""https://homestars.com/on/georgetown/concrete-contractors?&page=4&"", ""https://homestars.com/on/georgetown/concrete-contractors?&page=5&"", ""https://homestars.com/on/georgetown/concrete-contractors?&page=6&"")",Concrete Contractors,2957988,https://www.primeconcrete.ca/,/companies/2957988-prime-concrete-inc?searched_category_id=337&service_area=2257331,"PRIME Concrete Inc. has been serving the GTA and golden horseshoe area since 2017. As a family owned business, we strive to treat all of our clients with trust and respect. We have worked on a wide variety of projects over the years, from small residential jobs to large sub-divisions to larger commercial developments. No matter the size of the job, we always ensure we provide excellence in service, quality and efficiency to every project. ",prime-concrete-inc,2021-07-12T17:39:51.000-04:00,NA,NA,NA,,"Concrete walkways, patios, driveways. All types of finishes and colours. Footings, foundation walls, slabs and MORE!",,,2017,NA,Cash and Cheques,,,,FALSE,FALSE,,,TRUE,FALSE,1 year warranty on product,2019965,Prime Concrete Inc.,9,8,56,9.875,"Concrete Contractors, Impressed concrete, poured concrete, stamped concrete, radiant heating, concrete floors, contractors, concrete repair, concrete in, masonry, asphalt, paving, pavers, in the driveway, driveway, construction companies, driveways, block of concrete, concrete block, concrete mix, concret, concrete blocks, concrete slab, cost of concrete, concrete cost, concrete wall, price of concrete, concrete price, concrete stain, stamped concrete, concrete prices, repair concrete, how to repair concrete, repair of concrete, concrete repair, concrete slabs, decorative concrete, concrete decorative, staining concrete, concrete staining, concrete walls, countertop concrete, concrete countertops, patio ideas, cement companies, ready mix concrete, concrete ready mix, slabjack, slabjacking, mudjack, mudjacking, Driveway, caulking,,",0,2021-07-12T17:41:01.000-04:00,primeconcrete,FALSE,0,0,71,0,FALSE,11f1808453cf2f391245df52e04176e68a81f4c3,TRUE,NA,TRUE,TRUE,2257331,88.2897247673,337,NA,NA
https://homestars.com/on/georgetown/concrete-contractors,54,"c(""https://homestars.com/on/georgetown/concrete-contractors?&page=2&"", ""https://homestars.com/on/georgetown/concrete-contractors?&page=3&"", ""https://homestars.com/on/georgetown/concrete-contractors?&page=4&"", ""https://homestars.com/on/georgetown/concrete-contractors?&page=5&"", ""https://homestars.com/on/georgetown/concrete-contractors?&page=6&"")",Concrete Contractors,2861842,http://allseasonconcrete.ca/,/companies/2861842-allseason-concrete-inc?searched_category_id=337&service_area=1999755,"AllSeason Concrete Inc. is a registered concrete company based out of  Caledon, Ontario. Owned and operated by Altino Rego with many years of experience, dedication and loyalty to his family, customers, communities and the concrete industry.

Our company’s main focus is to provide the highest quality of service and customer satisfaction with a wide variety of concrete styles and finishes. No matter if your project is commercial or residential, our team of dedicated professionals will treat your property like it was their own and complete any project in a timely and skillful manner.

We will meet your needs and make your dream ours!

Delivering you perfection is not just our mission statement, its a promise.",allseason-concrete-inc,2014-11-08T08:40:18.000-05:00,NA,NA,NA,,,,,2011,NA,,,,BBB A+,TRUE,FALSE,,,TRUE,FALSE,,1924272,Allseason Concrete Inc ,30,27,85,9.88889,"Concrete Contractors, Impressed concrete, poured concrete, stamped concrete, radiant heating, concrete floors, contractors, concrete repair, concrete in, masonry, asphalt, paving, pavers, in the driveway, driveway, construction companies, driveways, block of concrete, concrete block, concrete mix, concret, concrete blocks, concrete slab, cost of concrete, concrete cost, concrete wall, price of concrete, concrete price, concrete stain, stamped concrete, concrete prices, repair concrete, how to repair concrete, repair of concrete, concrete repair, concrete slabs, decorative concrete, concrete decorative, staining concrete, concrete staining, concrete walls, countertop concrete, concrete countertops, patio ideas, cement companies, ready mix concrete, concrete ready mix, slabjack, slabjacking, mudjack, mudjacking, Driveway, caulking,,",0,NA,allseason,FALSE,0,1,87,0,FALSE,53c6be1dc604921c422e3a69c061e71e55f416f3,TRUE,2021-09-25T14:51:37.000-04:00,TRUE,TRUE,1999755,97.108580772,337,NA,NA
