Link,n_hits,all_links,category,id,url,hs_path,profile,permalink,created_at,sic_code,service_area,hours,products,services,brands,specialities,established,employee_cnt,payment_method,diplomas,licenses,memberships,liability_insurance,bonded,project_rate,project_minimum,written_contract,written_warranty,warranty_terms,parent_company_id,name,total_number_of_reviews_cache,total_number_of_approved_reviews_cache,number_of_photos_cache,avg_rating_cache,categories_info_cache,savings_count,claimed_at,subdomain,fraudulent,fraudulent_count,total_number_of_pending_reviews_cache,images_count,completion_percent_cache,bully,secret,replied_to_at_least_one_review_cache,latest_approved_review_created_at,has_set_tasks,lead_purchase_eligible,service_area_id,star_score,quote_button_category,direct_phone,direct_contact
https://homestars.com/on/pottageville/cabinetry-millwork,34,"c(""https://homestars.com/on/pottageville/cabinetry-millwork?&page=2&"", ""https://homestars.com/on/pottageville/cabinetry-millwork?&page=3&"", ""https://homestars.com/on/pottageville/cabinetry-millwork?&page=4&"")",Cabinetry & Millwork,2721303,http://www.homeimprovementpeople.com,/companies/2721303-home-improvement-people?searched_category_id=322&service_area=2126386,"The Home Improvement People have completed literally thousands of renovations since our inception. We are a unique award winning contracting company, consulted by various media as industry experts. 
Please view our website at homeimprovementpeople.com to view images of some of our projects. 
For our clients' convenience, we've implemented progress billing as well as financing.
Regardless of scope, we approach every single home renovation with a foundation of strong design aesthetics, comprehensive product options, sound project management, and a commitment to craftsmanship.
 
Our projects range from remodelled bathrooms and kitchens, to rear additions,  hardwood flooring, basements, second story additions and other extensive renovations. We undertake work in all budget ranges.
 
Choosing a reputable contractor is the most important decision you will make regarding your renovation. From plans and permits, to last little finishing details, The Home Improvement People is committed to completing your renovations and home improvements in a professional manner and to your complete satisfaction.
We take pride in our personalized service and our high quality workmanship. 
Call us for quality, insured work - completed on time, and on budget.
416-782-7605.",home-improvement-people,2008-03-04T16:55:15.000-05:00,NA,"Ajax,Cobourg,Mississauga,Stouffville Aurora,Courtice,Newmarket,Thornhill Barrie,Etobicoke,North York,Toronto Bolton,Georgetown,Oakville,Vaughan Brampton,Hamilton,Paris,Whitby Brantford ,Kitchener,Pickering Burlington,Maple,Richmond Hill, Willowdale, Caledon, Markham Scarborough,Woodbridge Cambridge,Milton,North York ",,,,,,2002,80,Visa/MC/Cheque,,All ,,TRUE,TRUE,,,TRUE,FALSE,3 years,1784355,Home Improvement People Inc.,663,504,234,9.80357,"General Contractors, Residential General Contractor, Building Contractor, Additions, Remodeling Contractor,  Renovation, Builder, building construction, renovation, remodeling, construction builders, construction company, construction companies, home repair, construction jobs, home remodeling, general contractors, contractors general, contractor general, contractors construction, construction contractors, home improvement and remodeling, kitchen remodeling, construction contractor, builders contractors, home renovation, general contracting, building contractors, building companies, home renovations, builder contractor, building contractor, remodeling contractor, commercial construction, residential construction, house contractor, concrete contractors, home contractors, general construction, construction general, contractors remodeling, remodeling contractors, remodelers, remodel contractor, remodel contractors, general contract, commercial contractors, renovations contractors, home improvement contractor, licensed contractor, license general contractor, mud room, mudroom, caulking, ,Design/Build, Contracting, Renovation, Remodeling, Restoration, Project Management, Renovation Assistance, Reno Management, architect, architects, design build, build & design, design and build, build by design, design to build. building construction, building a house, house designs, house plans, home designs, house plan, how to design a house, design house, house design, remodeling, building and design, design for building, design building, building by design, a building design, design of building, building design, design a building, building & design,  playsets, playground, wooden playset, wooden playground, play set, ,Basement Renovation, Basement renovation, Basement remodeling, Basement remodelling, renovating your basement, renovation, waterproofing, remodeling, home renovation, house renovation, water in basement, basement waterproofing,finishing basement, moistureproof, remodeling the house, caulking,Kitchen & Bathroom - Cabinets & Design, Kitchen Cabinet And Counter, Kitchen Cabinet Hardware, Bathroom Cabinet, Bathroom Wall Cabinet, Bathroom Sink Cabinet, cabinets, kitchens, cabinetry, kitchen and cabinets, cabinets for kitchen, about kitchen cabinets, kitchen cabinets, kitchen cabinets in, cabinets for the kitchen, cabinets and kitchen, cabinets kitchen, kitchen cabinet, cabinet kitchen, the kitchen cabinet, kitchen by design, design kitchen, a kitchen design, design a kitchen, design for kitchen, design and kitchen, design by kitchen, kitchen design, cabinetry kitchen, kitchen cabinetry, designs kitchen, kitchen designs, bathroom vanities, vanity and bathroom, bath and vanity, designer kitchen, ,Kitchen Planning & Renovation, Kitchen Planning And Design, Kitchen Cabinet Planning, Kitchen Design, Kitchen Remodeling, kitchen or, and bathroom, a and a kitchens, kitchens and, for kitchens, a kitchens, kitchens, the house design, cabinets for kitchen, cabinets for the kitchen, cabinets and kitchen, kitchen cabinets, design a kitchen, about kitchen design, a kitchen design, how to kitchen design, design and kitchen, the kitchen design, design for kitchen, kitchen designs, renovation and remodeling, remodeling and renovation, kitchen designer,,Kitchen Renovation, caulking, ,Condominium Renovations, Condo, Apartment, remodeling, renovations, kitchen cabinet, home decor, condo apartments, home improvement, home improvements, remodeling home, home remodeling, remodeling a home, new condo, Condo facelift, 
I ,Condo RenovationsRenovations for a new condo that include removing a drywall and creating an island and a full kitchen remodeling. ,Small rodent in Attic,Bathroom Renovation, Bathroom renovation, bathroom remodeling, bathroom remodelling, renovating the bathroom, tearing out the bathroom, fixing up the bathroom, bathroom contractors, bathroom vanities, bathroom vanity, design of bathroom, bathroom and design, design for bathroom, design a bathroom, design a bath, bath design, bathroom tile, bathroom cabinets, remodeling a bathroom, bathroom remodeling, remodeling the bathroom, ,Bath renovation, New tub, caulking, ,Builders, Home Builders, Home Contractors, residential builders, home construction companies, residential building contractor, builder, construction builders, local home builders, custom home builders, master builders, general builders, new home builders, building contractors, custom home builders, luxury home builders, ,Cabinetry & Millwork, Kitchen Cabinetry, Custom Cabinetry, Bathroom Cabinetry, Architectural Millwork, Millwork, custom millwork, bathroom cabinets, Kitchen cabinets, built-in cabinets, built-in cabinetry,  cabinet makers, custom cabinets kitchen, cabinetry, thomasville kitchen cabinets, cabinet doors, millwork cabinetry, custom kitchen cabinets, kraftmaid cabinets, maple cabinets, wood cabinets, stock cabinets, thermofoil cabinets, laminate cabinets, kitchen cabinets design, cherry cabinets, kitchen cabinet designs, hickory cabinets, wholesale cabinets, custom made cabinets, cabinet millwork, cabinets kitchen, kitchen cabinetry, millwork cabinets, ready to assemble cabinets, quality cabinets, bamboo cabinets, caulking,
,Home Additions, General contractor, home improvement, building addition, home expansion, house expansion, house building, plans house, house plans from, plans for house, the house plans, house plans, renovation, in house design, home plans house, home house plans, house home plans, house plans home, remodeling, house plans and designs, designs house plans, house designs plans, house plans designs, home plans and designs, home designs plans, floor plans, house build, renovations, plans for building, kitchen cabinets, remodel, kitchen design, house plans for building, house plans building, ,Design/Project Management, Drafters, Drafting, Project Management, Building, General Contracting, Renovation Management, Project Manager, Design Management.,",0,2017-04-05T10:18:55.000-04:00,TheHIP,FALSE,0,0,279,100,FALSE,7fbc45f3170f9c9c4247a2eca79f1488f75c5fa0,TRUE,2022-09-09T20:23:14.000-04:00,TRUE,TRUE,2126386,96.3063198007,322,NA,NA
https://homestars.com/on/pottageville/cabinetry-millwork,34,"c(""https://homestars.com/on/pottageville/cabinetry-millwork?&page=2&"", ""https://homestars.com/on/pottageville/cabinetry-millwork?&page=3&"", ""https://homestars.com/on/pottageville/cabinetry-millwork?&page=4&"")",Cabinetry & Millwork,224673,http://www.skykitchen.ca,/companies/224673-sky-kitchen-cabinets-ltd?searched_category_id=322&service_area=2240242,"Sky Kitchen values our clients' ideas and provide excellent service by personally hand crafting our kitchen designs. Combining years of experience and innovative technology, each product is meticuously crafted to our clients' specifications. Let SKY Kitchen Cabinets entertain you, let us pamper you. You deserve the best.",sky-kitchen-cabinets-ltd,2008-01-23T12:58:12.000-05:00,NA,"Brampton, Concord, Etobicoke, Markham, Mississauga, Newmarket, North York, Oakville, Richmond Hill, Scarborough, Thornhill, Toronto, Unionville, Vaughan, Woodbridge,Whitby,Ajax,Oshawa (GTA)",Mon-Friday 8 AM -6 PM &     Sat -9 AM to 4:00 PM,"Kitchens, Vanities, Entertainment Centres and Bars, Specialty Items, Doors/Mouldings and Hardware,","Complete Renovation..Floor Tiles,Plumbing & Electrical (subcontracted to licensed trades),Drywall,Painting",,,2000,20,"Cash, Interac, Cheque, Visa, MasterCard",,,"BBB, GTHBA, CKCA, Reno Mark,NKBA",TRUE,TRUE,,Not Applicable,TRUE,TRUE,Yes,75895,Sky Kitchens,834,695,331,9.73201,"Bathroom Renovation, Bathroom renovation, bathroom remodeling, bathroom remodelling, renovating the bathroom, tearing out the bathroom, fixing up the bathroom, bathroom contractors, bathroom vanities, bathroom vanity, design of bathroom, bathroom and design, design for bathroom, design a bathroom, design a bath, bath design, bathroom tile, bathroom cabinets, remodeling a bathroom, bathroom remodeling, remodeling the bathroom, ,Bath renovation, New tub, caulking, ,Cabinetry & Millwork, Kitchen Cabinetry, Custom Cabinetry, Bathroom Cabinetry, Architectural Millwork, Millwork, custom millwork, bathroom cabinets, Kitchen cabinets, built-in cabinets, built-in cabinetry,  cabinet makers, custom cabinets kitchen, cabinetry, thomasville kitchen cabinets, cabinet doors, millwork cabinetry, custom kitchen cabinets, kraftmaid cabinets, maple cabinets, wood cabinets, stock cabinets, thermofoil cabinets, laminate cabinets, kitchen cabinets design, cherry cabinets, kitchen cabinet designs, hickory cabinets, wholesale cabinets, custom made cabinets, cabinet millwork, cabinets kitchen, kitchen cabinetry, millwork cabinets, ready to assemble cabinets, quality cabinets, bamboo cabinets, caulking,
,Countertops, Granite Counter Tops, Kitchen Counter Tops, Marble Counter Tops, Laminate Counter Top, Quartz Counter Top, Corian counter top, tile counter top, silestone counter tops, arborite counter tops, custom counter tops, kitchen, remodeling, kitchen cabinet, kitchen design, ,Kitchen & Bathroom - Cabinets & Design, Kitchen Cabinet And Counter, Kitchen Cabinet Hardware, Bathroom Cabinet, Bathroom Wall Cabinet, Bathroom Sink Cabinet, cabinets, kitchens, cabinetry, kitchen and cabinets, cabinets for kitchen, about kitchen cabinets, kitchen cabinets, kitchen cabinets in, cabinets for the kitchen, cabinets and kitchen, cabinets kitchen, kitchen cabinet, cabinet kitchen, the kitchen cabinet, kitchen by design, design kitchen, a kitchen design, design a kitchen, design for kitchen, design and kitchen, design by kitchen, kitchen design, cabinetry kitchen, kitchen cabinetry, designs kitchen, kitchen designs, bathroom vanities, vanity and bathroom, bath and vanity, designer kitchen, ,Kitchen Planning & Renovation, Kitchen Planning And Design, Kitchen Cabinet Planning, Kitchen Design, Kitchen Remodeling, kitchen or, and bathroom, a and a kitchens, kitchens and, for kitchens, a kitchens, kitchens, the house design, cabinets for kitchen, cabinets for the kitchen, cabinets and kitchen, kitchen cabinets, design a kitchen, about kitchen design, a kitchen design, how to kitchen design, design and kitchen, the kitchen design, design for kitchen, kitchen designs, renovation and remodeling, remodeling and renovation, kitchen designer,,Kitchen Renovation, caulking, ,Woodworking, millwork, carpentry, carpenter, handyman, mud room, mudroom, built ins, builtin, window seat, trim, ,",0,2008-01-23T12:58:12.000-05:00,skykitchen,FALSE,0,0,366,100,FALSE,68356d922dca72319cbdedaf72cea0b488c339da,TRUE,2022-10-17T21:10:42.000-04:00,TRUE,TRUE,2240242,96.1200661703,322,NA,NA
https://homestars.com/on/pottageville/cabinetry-millwork,34,"c(""https://homestars.com/on/pottageville/cabinetry-millwork?&page=2&"", ""https://homestars.com/on/pottageville/cabinetry-millwork?&page=3&"", ""https://homestars.com/on/pottageville/cabinetry-millwork?&page=4&"")",Cabinetry & Millwork,2851257,http://www.EcoRefinishers.com,/companies/2851257-ecorefinishers?searched_category_id=322&service_area=2295742,"We specialize in professional cabinet refinishing using eco-friendly, water-based lacquers to achieve a quality, factory finish.  In business for over 16 years, we excel in punctuality, communication, and attention to detail.  We offer a three year warranty, as well as free in-home consultations.  Email us today to either get an estimate right online or book an appointment!  We look forward to working with you.

Kindest Regards,

Rachel Germain: Co-Director/Owner

Zack Hounsome: Co-Director/Owner

The EcoRefinishers Team 

EcoRefinishers
Professional Cabinet Refinishing
https://ecorefinishers.com/ 
https://www.instagram.com/theecorefinishersteam/
705-345-6102",ecorefinishers,2014-03-31T13:32:21.000-04:00,NA,"Newmarket, North York, Richmond Hill, Vaughn, Aurora, Bradford, Holland Landing, Innisfil, Barrie, Midhurst, Orillia, Brechin, Ramara, Wasaga Beach, Midland, Washago, Cumberland Beach, Huntsville, Gravenhurst, Bracebridge, Bala, Coldwater, Angus, New Tecumseth, Beeton, Thornton, Stroud, Collingwood, Stayner, Schomberg, King City, Moonstone, Elmvale, Oro, Penetanguishene, Port Severn, Mac Tier, Port Carling, Midhurst",M-F 9am-7pm Sat 9-5 Sun.closed,We use environmentally friendly water-based lacquers with just the right level of hardeners to create a lasting durability to our product with a quality factory finish.,Professional Kitchen Cabinet Refinishing,"We prefer to work with Benjamin Moore colours, but can also colour match.","We known for our promptness, professionalism, and excellent service -- as well as an exceptional product.",2006,3,"Cash, Cheque, E-Transfer, Visa & Mastercard",,,Newmarket Chamber of Commerce; Southern Georgian Bay Chamber of Commerce,TRUE,FALSE,,"$1,000.00",TRUE,FALSE,3 year normal wear,1913689,EcoRefinishers,140,128,124,9.97656,"Cabinetry & Millwork, Kitchen Cabinetry, Custom Cabinetry, Bathroom Cabinetry, Architectural Millwork, Millwork, custom millwork, bathroom cabinets, Kitchen cabinets, built-in cabinets, built-in cabinetry,  cabinet makers, custom cabinets kitchen, cabinetry, thomasville kitchen cabinets, cabinet doors, millwork cabinetry, custom kitchen cabinets, kraftmaid cabinets, maple cabinets, wood cabinets, stock cabinets, thermofoil cabinets, laminate cabinets, kitchen cabinets design, cherry cabinets, kitchen cabinet designs, hickory cabinets, wholesale cabinets, custom made cabinets, cabinet millwork, cabinets kitchen, kitchen cabinetry, millwork cabinets, ready to assemble cabinets, quality cabinets, bamboo cabinets, caulking,
,Woodworking, millwork, carpentry, carpenter, handyman, mud room, mudroom, built ins, builtin, window seat, trim, ,",1,NA,refinishers,FALSE,0,0,131,0,FALSE,3adc24e104657201895b0606067bb676c3ab9261,TRUE,2017-01-07T13:51:53.000-05:00,TRUE,TRUE,2295742,99.7624210546,322,NA,NA
https://homestars.com/on/pottageville/cabinetry-millwork,34,"c(""https://homestars.com/on/pottageville/cabinetry-millwork?&page=2&"", ""https://homestars.com/on/pottageville/cabinetry-millwork?&page=3&"", ""https://homestars.com/on/pottageville/cabinetry-millwork?&page=4&"")",Cabinetry & Millwork,2568754,https://www.spaceageclosets.com/,/companies/2568754-space-age-closets-and-custom-cabinetry?searched_category_id=322&service_area=1581958,"Welcome to Space Age Closets And Customer Cabinetry. Quality isn't expensive, it's priceless!  Space Age has been in business for over 30 years and we've evolved from simply organizing your closet to creating them from scratch.  We specialize in custom walk-in closets, custom reach-in closets, custom sliding doors, custom wall units, Murphy beds (wall beds), home offices, kitchen islands, floating shelves, and pop-up TV units.  The specialize in creating our cabinetry with Canadian materials.  We can beautify any room in your home, adding to your home's value and practicality.",space-age-closets-and-custom-cabinetry,2008-03-04T16:55:15.000-05:00,NA,"We cater to an area that covers most of the GTA.  For locations further afield, we are able to ship our product.  Feel free to contact us for further information.","Monday to Saturday 10-6, Sunday 11-5","We design and construct closets from LPL (low pressure laminate), high gloss ","Home consultation, custom design to suit your home, friendly installers.  ",,Custom design,1985,NA,"VISA, MC, Debit, Cheque, Cash",,,,TRUE,TRUE,$1400 and up,3 hour labour,TRUE,FALSE,life time guarantee under normal use,1631806,Space Age Closets And Custom Cabinetry,178,135,115,9.81481,"Closet & Storage Solutions, Closets, Closet, Storage, Closet Organizer, Closet And Room Organizer, Storage Cabinet, Storage Container, Interior closet shelves, custom fitted interior closets, custom closets, interior closet organizer, shelving, built-in shelving, built-in shelves, storage, the container, the closet, a closet, closet and, closet closet, closet to closet, closet, shelves, wardrobe, the closets, shelving, wardrobes, pantry, storage boxes, container store, storage containers, storage and containers, shoe rack, storage bins, storage systems, shoe racks, storage cabinets, storage cabinet, food storage, wall shelves, solutions storage, storage solutions, clothes rack, closet and organizer, the closet organizer, organizer for closet, closet organizer, closet organizers, organizers closet, wardrobe closet, Custom Shelves, ,Cabinetry & Millwork, Kitchen Cabinetry, Custom Cabinetry, Bathroom Cabinetry, Architectural Millwork, Millwork, custom millwork, bathroom cabinets, Kitchen cabinets, built-in cabinets, built-in cabinetry,  cabinet makers, custom cabinets kitchen, cabinetry, thomasville kitchen cabinets, cabinet doors, millwork cabinetry, custom kitchen cabinets, kraftmaid cabinets, maple cabinets, wood cabinets, stock cabinets, thermofoil cabinets, laminate cabinets, kitchen cabinets design, cherry cabinets, kitchen cabinet designs, hickory cabinets, wholesale cabinets, custom made cabinets, cabinet millwork, cabinets kitchen, kitchen cabinetry, millwork cabinets, ready to assemble cabinets, quality cabinets, bamboo cabinets, caulking,
,Furniture Designers & Custom Builders, Modern Furniture, Custom Furniture, Custom Wood Furniture, custom builders, custom builder, furniture custom, interior & furniture, furniture interior, furniture builders, builders furniture, salon designers, custom builders, ,",0,2014-08-21T14:18:13.000-04:00,spaceageclosets,FALSE,0,0,119,NA,FALSE,4fc2639e31703fa475c22c9db30e32dcc8698f2a,TRUE,2021-09-29T17:58:53.000-04:00,TRUE,TRUE,1581958,97.5358418348,322,NA,NA
