Link,n_hits,all_links,category,id,url,hs_path,profile,permalink,created_at,sic_code,service_area,hours,products,services,brands,specialities,established,employee_cnt,payment_method,diplomas,licenses,memberships,liability_insurance,bonded,project_rate,project_minimum,written_contract,written_warranty,warranty_terms,parent_company_id,name,total_number_of_reviews_cache,total_number_of_approved_reviews_cache,number_of_photos_cache,avg_rating_cache,categories_info_cache,savings_count,claimed_at,subdomain,fraudulent,fraudulent_count,total_number_of_pending_reviews_cache,images_count,completion_percent_cache,bully,secret,replied_to_at_least_one_review_cache,latest_approved_review_created_at,has_set_tasks,lead_purchase_eligible,service_area_id,star_score,quote_button_category,direct_phone,direct_contact
https://homestars.com/on/elmwood/waterproofing,13,https://homestars.com/on/elmwood/waterproofing?&page=2&,Waterproofing,221811,https://www.rccwaterproofing.com,/companies/221811-rcc-waterproofing?searched_category_id=448&service_area=1830735,"RCC WATERPROOFING TORONTO
Phone: 416-747-1920 or toll free 1888-766-2071
 Basement Waterproofing Toronto, Hamilton, London, Scarborough, Mississauga, Oakville, Vaughan and more!

Wet Basement? Since 1920, Toronto homeowners and businesses have trusted RCC Waterproofing Toronto to solve their basement foundation repair issues. With over 100 years of experience in waterproofing solutions, RCC Waterproofing has the right waterproofing services for all your leaky basement and structural foundation concerns. We are waterproofing contractors specializing in residential, commercial, and industrial structures in Toronto, Hamilton, Niagara, London, Oshawa, Barrie, and everywhere in between - Leaky basements made permanently dry, from the interior basement or exterior foundation. Look up waterproofing near me and guaranteed you will find us and RCC Waterproofing will be ready to take on any basement leak repair.

RCC Waterproofing's experience in solving wet basements, damp basements, foundation cracks, and basement leaks is second to none. We offer waterproofing services like external waterproofing, internal waterproofing, sump pump repair, basement underpinning & basement lowering, basement repair, foundation repair and crack repair. Trust in the wet basement people to get the job done!
",rcc-waterproofing,2007-04-22T20:00:00.000-04:00,NA,"Toronto Waterproofing, Waterproofing Hamilton, Toronto Waterproofing, Waterproofing Brampton, Mississauga Waterproofing, Etobicoke, North York, Scarborough, Markahm, Newmarket, Oakville, Richmond Hill, Thornhill, Unionville, Vaughan, Woodbridge, Concord, Burlington, London, Kitchener, Waterloo, St. Thomas, Welland, Fort Erie, Port Colborne, Grimsby, Stoney Creek, Brantford, Cambridge, Sarnia, Plympton-Wyoming, Port Stanley, Port Dover, Caledon, Oshawa, Orangeville, Georgetown",8am to 5pm monday to saturday,"Hydro Guard superior waterproofing rubber membrane.
DMX AG soil side and air gap drainage sheeting
Bakor waterproofing products","Waterproofing Toronto basement leak
Repair leaky basements in Toronto
Hamilton Basement waterproofing
",WET BASEMENT? is a registered trade mark of RCC  and is registered with the federal government of Canada. Anyone using such a term is in breach of this trade mark.,"Waterproofing, Leaky Basement, Basement lowering, Underpinning, and benching. In Toronto,Hamilton,",1920,150,"Visa OR Mastercard, CHEQUE, CASH",National Waterproofing Association,"Toronto,Hamilton","Toronto Construction Association, Better Business Bureau, Ontario Waterproofing Association, NAWSRC",TRUE,FALSE,On Request,$500,TRUE,FALSE,Lifetime Guarantee,73669,Rcc Waterproofing,902,740,49,9.5027,"Waterproofing, Basement Waterproofing, Foundation Waterproofing, Waterproofing Contractor, Water, Waterproof, Wet Basement, Leaky Basement, Flood, Flooded Basement, Flooding ,Waterproofing, Basement leaks, underpinning, caulking,,",1,2009-01-22T13:01:01.000-05:00,rccwaterproofing,FALSE,0,1,23,100,FALSE,0906ce1f7621bccfeb961b81ac96d66b105f3cab,TRUE,2022-10-30T09:41:57.000-04:00,TRUE,TRUE,1830735,95.6210905479,448,NA,NA
https://homestars.com/on/elmwood/waterproofing,13,https://homestars.com/on/elmwood/waterproofing?&page=2&,Waterproofing,2871030,NA,/companies/2871030-wal-tech-drainage?searched_category_id=448&service_area=2034436,"Established since 1984 Wal-Tech Drainage sets the standard for quality basement waterproofing. Proven to be a reliable, honest waterproofing contractor with 1000's of successful projects completed.",wal-tech-drainage,2015-05-25T20:28:14.000-04:00,NA,NA,7-7 with 24 hour phone answering service,NA,NA,NA,NA,NA,NA,NA,NA,NA,NA,FALSE,FALSE,NA,NA,FALSE,FALSE,NA,1933454,Wal Tech Drainage,15,14,0,10,"Waterproofing, Basement Waterproofing, Foundation Waterproofing, Waterproofing Contractor, Water, Waterproof, Wet Basement, Leaky Basement, Flood, Flooded Basement, Flooding ,Waterproofing, Basement leaks, underpinning, caulking,,",0,2015-06-14T20:59:23.000-04:00,NA,FALSE,0,0,0,0,FALSE,d4325a8c2577c29b4cf3f590b7a1d7e8e70c3273,TRUE,2022-03-04T20:37:34.000-05:00,TRUE,FALSE,2034436,97.7725793829,448,NA,NA
https://homestars.com/on/elmwood/waterproofing,13,https://homestars.com/on/elmwood/waterproofing?&page=2&,Waterproofing,2904395,NA,/companies/2904395-london-drain-service?searched_category_id=448&service_area=2138613,NA,london-drain-service,2017-11-05T10:07:32.000-05:00,NA,NA,NA,NA,NA,NA,NA,NA,NA,NA,NA,NA,NA,FALSE,FALSE,NA,NA,FALSE,FALSE,NA,1966580,London Drain Service,0,0,10,NA,"Waterproofing, Basement Waterproofing, Foundation Waterproofing, Waterproofing Contractor, Water, Waterproof, Wet Basement, Leaky Basement, Flood, Flooded Basement, Flooding ,Waterproofing, Basement leaks, underpinning, caulking,,",0,2017-11-05T10:08:31.000-05:00,NA,FALSE,0,0,11,0,FALSE,c09f833d7b292e114ea58d0b5d683ab09d03d208,FALSE,NA,FALSE,FALSE,2138613,-1.0,448,NA,NA
https://homestars.com/on/elmwood/waterproofing,13,https://homestars.com/on/elmwood/waterproofing?&page=2&,Waterproofing,2903376,http://www.ashworthdrainage.ca,/companies/2903376-ashworth-drainage-and-waterproofing?searched_category_id=448&service_area=2136265,"Established in 1972, Ashworth Drainage brings more than 70 years of combined experience to the London area. Our well-trained basement waterproofing technicians are dedicated to customer satisfaction. We are committed to providing customers with superior, courteous service. Our reputation reflects this.

",ashworth-drainage-and-waterproofing,2017-10-11T12:05:55.000-04:00,NA,NA,NA,NA,NA,NA,NA,NA,NA,NA,NA,NA,NA,FALSE,FALSE,NA,NA,FALSE,FALSE,NA,1965561,Ashworth Drainage And Waterproofing,0,0,0,NA,"Waterproofing, Basement Waterproofing, Foundation Waterproofing, Waterproofing Contractor, Water, Waterproof, Wet Basement, Leaky Basement, Flood, Flooded Basement, Flooding ,Waterproofing, Basement leaks, underpinning, caulking,,",0,2017-10-11T12:06:23.000-04:00,NA,FALSE,0,0,1,0,FALSE,9bc24b390bbe924777b3a74153e1ea1e2ddba1aa,FALSE,NA,FALSE,FALSE,2136265,-1.0,448,NA,NA
https://homestars.com/on/elmwood/waterproofing,13,https://homestars.com/on/elmwood/waterproofing?&page=2&,Waterproofing,2601480,NA,/companies/2601480-barry-r-clarke-liquid-rubber-applicator?searched_category_id=448&service_area=1614684,NA,barry-r-clarke-liquid-rubber-applicator,2008-03-04T16:55:15.000-05:00,NA,NA,NA,NA,NA,NA,NA,NA,NA,NA,NA,NA,NA,FALSE,FALSE,NA,NA,FALSE,FALSE,NA,1664532,Barry R Clarke Liquid Rubber Applicator,0,0,0,NA,"Waterproofing, Basement Waterproofing, Foundation Waterproofing, Waterproofing Contractor, Water, Waterproof, Wet Basement, Leaky Basement, Flood, Flooded Basement, Flooding ,Waterproofing, Basement leaks, underpinning, caulking,,",0,NA,NA,FALSE,0,0,0,NA,FALSE,NA,FALSE,NA,FALSE,FALSE,1614684,-1.0,448,NA,NA
https://homestars.com/on/elmwood/waterproofing,13,https://homestars.com/on/elmwood/waterproofing?&page=2&,Waterproofing,2950799,NA,/companies/2950799-a1-waterproofing?searched_category_id=448&service_area=2241477,NA,a1-waterproofing,2020-12-10T22:37:14.000-05:00,NA,NA,NA,NA,NA,NA,NA,NA,NA,NA,NA,NA,NA,FALSE,FALSE,NA,NA,FALSE,FALSE,NA,2012895,A1 Waterproofing,0,0,0,NA,"Waterproofing, Basement Waterproofing, Foundation Waterproofing, Waterproofing Contractor, Water, Waterproof, Wet Basement, Leaky Basement, Flood, Flooded Basement, Flooding ,Waterproofing, Basement leaks, underpinning, caulking,,",0,NA,NA,FALSE,0,0,0,0,FALSE,NA,FALSE,NA,FALSE,FALSE,2241477,-1.0,448,NA,NA
https://homestars.com/on/elmwood/waterproofing,13,https://homestars.com/on/elmwood/waterproofing?&page=2&,Waterproofing,2758000,NA,/companies/2758000-a-stopleak-basement-waterproofing?searched_category_id=448&service_area=1771204,NA,a-stopleak-basement-waterproofing,2008-03-04T16:55:15.000-05:00,NA,NA,NA,NA,NA,NA,NA,NA,NA,NA,NA,NA,NA,FALSE,FALSE,NA,NA,FALSE,FALSE,NA,1821052,A Stopleak Basement Waterproofing,0,0,0,NA,"Waterproofing, Basement Waterproofing, Foundation Waterproofing, Waterproofing Contractor, Water, Waterproof, Wet Basement, Leaky Basement, Flood, Flooded Basement, Flooding ,Waterproofing, Basement leaks, underpinning, caulking,,",0,NA,NA,FALSE,0,0,0,NA,FALSE,NA,FALSE,NA,FALSE,FALSE,1771204,-1.0,448,NA,NA
https://homestars.com/on/elmwood/waterproofing,13,https://homestars.com/on/elmwood/waterproofing?&page=2&,Waterproofing,2612568,NA,/companies/2612568-industrial-waterproof-systems-ltd?searched_category_id=448&service_area=1625772,NA,industrial-waterproof-systems-ltd,2008-03-04T16:55:15.000-05:00,NA,NA,NA,NA,NA,NA,NA,NA,NA,NA,NA,NA,NA,FALSE,FALSE,NA,NA,FALSE,FALSE,NA,1675620,Industrial Waterproof Systems Ltd,0,0,0,NA,"Waterproofing, Basement Waterproofing, Foundation Waterproofing, Waterproofing Contractor, Water, Waterproof, Wet Basement, Leaky Basement, Flood, Flooded Basement, Flooding ,Waterproofing, Basement leaks, underpinning, caulking,,",0,NA,NA,FALSE,0,0,0,NA,FALSE,NA,FALSE,NA,FALSE,FALSE,1625772,-1.0,448,NA,NA
https://homestars.com/on/elmwood/waterproofing,13,https://homestars.com/on/elmwood/waterproofing?&page=2&,Waterproofing,2634495,NA,/companies/2634495-glass-cell-isofab-inc?searched_category_id=448&service_area=1647699,NA,glass-cell-isofab-inc,2008-03-04T16:55:15.000-05:00,NA,NA,NA,NA,NA,NA,NA,NA,NA,NA,NA,NA,NA,FALSE,FALSE,NA,NA,FALSE,FALSE,NA,1697547,Glass-Cell Isofab Inc,0,0,0,NA,"Waterproofing, Basement Waterproofing, Foundation Waterproofing, Waterproofing Contractor, Water, Waterproof, Wet Basement, Leaky Basement, Flood, Flooded Basement, Flooding ,Waterproofing, Basement leaks, underpinning, caulking,,",0,NA,NA,FALSE,0,0,0,NA,FALSE,NA,FALSE,NA,FALSE,FALSE,1647699,-1.0,448,NA,NA
https://homestars.com/on/elmwood/waterproofing,13,https://homestars.com/on/elmwood/waterproofing?&page=2&,Waterproofing,2613811,NA,/companies/2613811-london-caulking-installations?searched_category_id=448&service_area=1627015,NA,london-caulking-installations,2008-03-04T16:55:15.000-05:00,NA,NA,NA,NA,NA,NA,NA,NA,NA,NA,NA,NA,NA,FALSE,FALSE,NA,NA,FALSE,FALSE,NA,1676863,London Caulking & Installations,0,0,0,NA,"Waterproofing, Basement Waterproofing, Foundation Waterproofing, Waterproofing Contractor, Water, Waterproof, Wet Basement, Leaky Basement, Flood, Flooded Basement, Flooding ,Waterproofing, Basement leaks, underpinning, caulking,,",0,NA,NA,FALSE,0,0,0,NA,FALSE,NA,FALSE,NA,FALSE,FALSE,1627015,-1.0,448,NA,NA
https://homestars.com/on/elmwood/waterproofing,13,https://homestars.com/on/elmwood/waterproofing?&page=2&,Waterproofing,2586582,NA,/companies/2586582-piccoli-n-construction-ltd?searched_category_id=448&service_area=1599786,NA,piccoli-n-construction-ltd,2008-03-04T16:55:15.000-05:00,NA,NA,NA,NA,NA,NA,NA,NA,NA,NA,NA,NA,NA,FALSE,FALSE,NA,NA,FALSE,FALSE,NA,1649634,Piccoli N Construction Ltd,0,0,0,NA,"Waterproofing, Basement Waterproofing, Foundation Waterproofing, Waterproofing Contractor, Water, Waterproof, Wet Basement, Leaky Basement, Flood, Flooded Basement, Flooding ,Waterproofing, Basement leaks, underpinning, caulking,,",0,NA,NA,FALSE,0,0,0,NA,FALSE,NA,FALSE,NA,FALSE,FALSE,1599786,-1.0,448,NA,NA
https://homestars.com/on/elmwood/waterproofing,13,https://homestars.com/on/elmwood/waterproofing?&page=2&,Waterproofing,2760178,NA,/companies/2760178-canadian-leak-detection?searched_category_id=448&service_area=1773382,NA,canadian-leak-detection,2008-03-04T16:55:15.000-05:00,NA,NA,NA,NA,NA,NA,NA,NA,NA,NA,NA,NA,NA,FALSE,FALSE,NA,NA,FALSE,FALSE,NA,1823230,Canadian Leak Detection,0,0,0,NA,"Waterproofing, Basement Waterproofing, Foundation Waterproofing, Waterproofing Contractor, Water, Waterproof, Wet Basement, Leaky Basement, Flood, Flooded Basement, Flooding ,Waterproofing, Basement leaks, underpinning, caulking,,",0,NA,NA,FALSE,0,0,0,NA,FALSE,NA,FALSE,NA,FALSE,FALSE,1773382,-1.0,448,NA,NA
https://homestars.com/on/elmwood/waterproofing,13,https://homestars.com/on/elmwood/waterproofing?&page=2&,Waterproofing,2805416,NA,/companies/2805416-ajn-waterproofing-inc?searched_category_id=448&service_area=1872368,NA,ajn-waterproofing-inc,2013-01-28T19:55:09.000-05:00,NA,NA,NA,NA,NA,NA,NA,NA,NA,NA,NA,NA,NA,FALSE,FALSE,NA,NA,FALSE,FALSE,NA,1868416,AJN waterproofing inc,0,0,0,NA,"Waterproofing, Basement Waterproofing, Foundation Waterproofing, Waterproofing Contractor, Water, Waterproof, Wet Basement, Leaky Basement, Flood, Flooded Basement, Flooding ,Waterproofing, Basement leaks, underpinning, caulking,,",0,NA,NA,FALSE,0,0,0,NA,FALSE,NA,FALSE,NA,FALSE,FALSE,1872368,-1.0,448,NA,NA
