Link,n_hits,all_links,category,id,url,hs_path,profile,permalink,created_at,sic_code,service_area,hours,products,services,brands,specialities,established,employee_cnt,payment_method,diplomas,licenses,memberships,liability_insurance,bonded,project_rate,project_minimum,written_contract,written_warranty,warranty_terms,parent_company_id,name,total_number_of_reviews_cache,total_number_of_approved_reviews_cache,number_of_photos_cache,avg_rating_cache,categories_info_cache,savings_count,claimed_at,subdomain,fraudulent,fraudulent_count,total_number_of_pending_reviews_cache,images_count,completion_percent_cache,bully,secret,replied_to_at_least_one_review_cache,latest_approved_review_created_at,has_set_tasks,lead_purchase_eligible,service_area_id,star_score,quote_button_category,direct_phone,direct_contact
https://homestars.com/on/grand/weed-control,9,https://homestars.com/on/grand/weed-control,Weed Control,210478,http://www.hometurf.ca,/companies/210478-hometurf-lawn-care-service?searched_category_id=449&service_area=2082621,"At Hometurf Lawn Care, we have been treating the lawns of our loyal customers for over 30 years. As a family-owned and -operated business, we have grown by delivering lush, healthy, green lawns while using only the highest quality products applied by professional lawn care technicians. Let us help you make your lawn look its best this season!

Our season-long lawn care programs take the guess work out of which products to use and when. Applications are scheduled to be applied four to six weeks apart throughout the season for optimal turf care. We strive to ensure everything your lawn needs is included in our programs. No telemarketing or sales calls pushing unnecessary extras.

Our services include: lawn care programs, lawn maintenance programs, fertilizer, weed control, insect control, aeration, grass seeding, dethatching, top dressing, chinch bug control and grub control. ",hometurf-lawn-care-service,2008-01-23T10:29:16.000-05:00,NA,"Brampton, Mississauga, Oakville, Burlington, Etobicoke, North York, Scarborough, Toronto, Markham, Richmond Hill, Vaughan, New Market, Aurora, Barrie, Pickering, Ajax, Whitby, Oshawa, Hamilton, Guelph, Cambridge, Kitchener, Waterloo,Milton, Georgetown",9AM to 7PM EST,"Lawn Care Programs, Fertilizer, Weed Control, Insect Control, Aeration, Grass Seeding, Dethatching, Top Dressing","Lawn Care Programs, Fertilizer, Weed Control, Insect Control, Aeration, Grass Seeding, Dethatching, Top Dressing",,,1988,50,"Cheque, Visa, MasterCard, Online Banking",,"Ministry of Ontario Landscape Exterminator, Ministry of Ontario Pesticide Operator License","Landscape Ontario, Professional Lawn Care Association of Ontario, CNLA, OIPMA, PLANET, PLCAA",TRUE,TRUE,Varies based on property size.,No project too small,TRUE,FALSE,,64667,Hometurf Lawn Care Service,3279,2958,94,8.93915,"Weed Control, lawn maintenance, weeding companies, weed companies, weed and pest control,Lawn Maintenance, Lawn Care, Lawn Mowers, Lawn Maintenance Companies, grass cutters, grass cutting, shrub pruning, lawns, a lawns, landscaping, mowing, lawn mowers, mowing lawn, lawn mowing, mowing the lawns, mowing lawns, lawns mowing, yard and garden, maintenance lawn, lawns maintenance, lawncare, service lawn, lawn service, grass mowing, lawn treatment, green grass, lawn repair, grass lawn mowers, lawn & landscape, lawn landscape, a lawn and landscape, landscape and lawn, lawn and landscape, lawn services, yard landscape, lawn maintenance service, lawn service maintenance, landscaping a yard, yard landscaping, lawn maintenance services, maintenance company, grass cutting, maintenance business, lawn business, leaf clean up, fall leaves, hedges ,",7,2012-03-09T16:51:04.000-05:00,hometurf,FALSE,0,0,105,100,FALSE,eb5cc0102fd54f2953313096478d09fec68576b3,TRUE,2022-10-26T17:10:45.000-04:00,TRUE,TRUE,2082621,89.1104059603,449,NA,NA
https://homestars.com/on/grand/weed-control,9,https://homestars.com/on/grand/weed-control,Weed Control,2613394,,/companies/2613394-peerless-turfcare?searched_category_id=449&service_area=1626598,"27 Years serving Waterloo Region
We are the ONLY Lawn care firm who is a Chamber of Commerce Member
Lawn services : Fertilizing, Weed control, Insect control, Crabgrass control, Aeration, Turf Restoration (Slit seeding, Top dressing, Overseeding), Corrective applications
Tree and Shrub care and spraying, Pruning, Tree Removal
Aquatic weed management, for weeds in water all over Ontario
Agricultural spraying for farm fields, pastures etc
Richard Maass BSc.Forestry, Certified Horticulturist, Licensed since 1986",peerless-turfcare,2008-03-04T16:55:15.000-05:00,NA,,OFFICE 10-3 Field 6-6,,,,,NA,NA,,,,,FALSE,FALSE,,,FALSE,FALSE,,1676446,Peerless Turfcare,6,5,0,9.2,"Weed Control, lawn maintenance, weeding companies, weed companies, weed and pest control,",1,2012-03-19T08:31:11.000-04:00,peerlessturfcare,FALSE,0,0,0,NA,FALSE,94cf4180c152072d87116fc15b3c0f630deaf979,TRUE,2015-06-03T10:14:48.000-04:00,TRUE,FALSE,1626598,36.5258950232,449,NA,NA
https://homestars.com/on/grand/weed-control,9,https://homestars.com/on/grand/weed-control,Weed Control,2588170,NA,/companies/2588170-lawn-man?searched_category_id=449&service_area=1601374,NA,lawn-man,2008-03-04T16:55:15.000-05:00,NA,NA,NA,NA,NA,NA,NA,NA,NA,NA,NA,NA,NA,FALSE,FALSE,NA,NA,FALSE,FALSE,NA,1651222,Lawn Man,3,2,0,8.5,"Weed Control, lawn maintenance, weeding companies, weed companies, weed and pest control,",0,NA,NA,FALSE,0,0,0,NA,FALSE,NA,FALSE,2011-12-17T13:46:37.000-05:00,FALSE,FALSE,1601374,9.5025805692,449,NA,NA
https://homestars.com/on/grand/weed-control,9,https://homestars.com/on/grand/weed-control,Weed Control,2586218,NA,/companies/2586218-heather-lawn-spray?searched_category_id=449&service_area=1599422,NA,heather-lawn-spray,2008-03-04T16:55:15.000-05:00,NA,NA,NA,NA,NA,NA,NA,NA,NA,NA,NA,NA,NA,FALSE,FALSE,NA,NA,FALSE,FALSE,NA,1649270,Heather Lawn Spray,1,1,0,8,"Weed Control, lawn maintenance, weeding companies, weed companies, weed and pest control,",0,NA,NA,FALSE,0,0,0,NA,FALSE,NA,FALSE,2014-10-16T22:25:09.000-04:00,FALSE,FALSE,1599422,26.1501242518,449,NA,NA
https://homestars.com/on/grand/weed-control,9,https://homestars.com/on/grand/weed-control,Weed Control,2604394,NA,/companies/2604394-lee-saunders-flowers-ltd?searched_category_id=449&service_area=1617598,NA,lee-saunders-flowers-ltd,2008-03-04T16:55:15.000-05:00,NA,NA,NA,NA,NA,NA,NA,NA,NA,NA,NA,NA,NA,FALSE,FALSE,NA,NA,FALSE,FALSE,NA,1667446,Lee Saunders Flowers Ltd,0,0,0,NA,"Weed Control, lawn maintenance, weeding companies, weed companies, weed and pest control,",0,NA,NA,FALSE,0,0,0,NA,FALSE,NA,FALSE,NA,FALSE,FALSE,1617598,-1.0,449,NA,NA
https://homestars.com/on/grand/weed-control,9,https://homestars.com/on/grand/weed-control,Weed Control,2758004,NA,/companies/2758004-enviro-masters-lawn-care?searched_category_id=449&service_area=1771208,NA,enviro-masters-lawn-care,2008-03-04T16:55:15.000-05:00,NA,NA,NA,NA,NA,NA,NA,NA,NA,NA,NA,NA,NA,FALSE,FALSE,NA,NA,FALSE,FALSE,NA,1821056,Enviro Masters Lawn Care,0,0,0,NA,"Weed Control, lawn maintenance, weeding companies, weed companies, weed and pest control,",0,NA,NA,FALSE,0,0,0,NA,FALSE,NA,FALSE,NA,FALSE,FALSE,1771208,-1.0,449,NA,NA
https://homestars.com/on/grand/weed-control,9,https://homestars.com/on/grand/weed-control,Weed Control,2752771,NA,/companies/2752771-kollegiate-lawn-care?searched_category_id=449&service_area=1765975,NA,kollegiate-lawn-care,2008-03-04T16:55:15.000-05:00,NA,NA,NA,NA,NA,NA,NA,NA,NA,NA,NA,NA,NA,FALSE,FALSE,NA,NA,FALSE,FALSE,NA,1815823,Kollegiate Lawn Care,0,0,0,NA,"Weed Control, lawn maintenance, weeding companies, weed companies, weed and pest control,",0,NA,NA,FALSE,0,0,0,NA,FALSE,NA,FALSE,NA,FALSE,FALSE,1765975,0,449,NA,NA
https://homestars.com/on/grand/weed-control,9,https://homestars.com/on/grand/weed-control,Weed Control,2596859,NA,/companies/2596859-weed-man?searched_category_id=449&service_area=1610063,NA,weed-man,2008-03-04T16:55:15.000-05:00,NA,NA,NA,NA,NA,NA,NA,NA,NA,NA,NA,NA,NA,FALSE,FALSE,NA,NA,FALSE,FALSE,NA,1659911,Weed Man,0,0,0,NA,"Weed Control, lawn maintenance, weeding companies, weed companies, weed and pest control,",0,NA,NA,FALSE,0,0,0,NA,FALSE,NA,FALSE,NA,FALSE,FALSE,1610063,0,449,NA,NA
https://homestars.com/on/grand/weed-control,9,https://homestars.com/on/grand/weed-control,Weed Control,2760034,NA,/companies/2760034-lady-luck-flowers?searched_category_id=449&service_area=1773238,NA,lady-luck-flowers,2008-03-04T16:55:15.000-05:00,NA,NA,NA,NA,NA,NA,NA,NA,NA,NA,NA,NA,NA,FALSE,FALSE,NA,NA,FALSE,FALSE,NA,1823086,Lady Luck Flowers,0,0,0,NA,"Weed Control, lawn maintenance, weeding companies, weed companies, weed and pest control,",0,NA,NA,FALSE,0,0,0,NA,FALSE,NA,FALSE,NA,FALSE,FALSE,1773238,-1.0,449,NA,NA
