Link,n_hits,all_links,category,id,url,hs_path,profile,permalink,created_at,sic_code,service_area,hours,products,services,brands,specialities,established,employee_cnt,payment_method,diplomas,licenses,memberships,liability_insurance,bonded,project_rate,project_minimum,written_contract,written_warranty,warranty_terms,parent_company_id,name,total_number_of_reviews_cache,total_number_of_approved_reviews_cache,number_of_photos_cache,avg_rating_cache,categories_info_cache,savings_count,claimed_at,subdomain,fraudulent,fraudulent_count,total_number_of_pending_reviews_cache,images_count,completion_percent_cache,bully,secret,replied_to_at_least_one_review_cache,latest_approved_review_created_at,has_set_tasks,lead_purchase_eligible,service_area_id,star_score,quote_button_category,direct_phone,direct_contact
https://homestars.com/on/gulf-breeze/duct-cleaning,9,https://homestars.com/on/gulf-breeze/duct-cleaning,Duct Cleaning,2904655,http://airforceduct.com/,/companies/2904655-air-force-duct-cleaning?searched_category_id=346&service_area=2247709,"For Air Force COVID-19 - Infectious Disease Preparedness Response Plan, pls see: 
https://www.airforceduct.com/covid-19.html

We are fully open for business and are here to talk with you and assist you with your cleaning needs. 

**** Air Force Duct Cleaning is a certified & locally owned company that specializes in residential Air Ducts cleaning ****

We have been providing comfort & Order for your busy lifestyle since 2003. Our Cleaning equipment are truck mounted, Cleans Deeper.  We guarantee you the most professional and thorough Air Duct Cleaning Ever or its FREE. Guaranteed. We accept VISA, Master Card, AMEX, Cheques & Cash. 

For upfront no hidden cost pricing: http://www.airforceduct.com/online-quote.html",air-force-duct-cleaning,2017-11-10T15:33:31.000-05:00,NA,NA,NA,,Air Duct Cleaning,,Air Duct Cleaning ,2003,10,"VISA, Master Card, AMEX, Cheques & Cash ",,,,TRUE,TRUE,http://www.airforceduct.com/online-quote.html,,TRUE,FALSE,Ask Us about our LOVE IT or DON'T PAY Guarantee,1966840,Air Force Duct Cleaning,977,922,340,9.94469,"Duct Cleaning, Air Duct Cleaning, Furnace Duct Cleaning, vent cleaning, air vent cleaning, duct, ducts, air duct, duct air, cleaning the air, cleaning air, what is duct cleaning, cleaning duct, air ducts, cleaning ducts, cleaning the ducts, ducts cleaning, ducts and vents, vent cleaning, cleaning vent, air conditioning duct, what is air duct cleaning, air duct cleaning in, air duct cleaning, cleaning air duct, duct cleaning company, duct cleaning price, ac duc cleaning, duct cleaning prices, duct and carpet cleaning, duct cleaning canada, home air duct cleaning, air duct cleaning services reviews, residential duct cleaning, how much is duct cleaning, professional duct cleaning toronto, home duct cleaning services, heating duct cleaning, duct cleaning machine, professional duct cleaning, duct clean, hvac duct cleaning, duct cleaning service, duck cleaning, ducts cleaning, fresh air duct cleaning, commercial duct cleaning, industrial duct cleaning, canada duct cleaning, duct cleaning costs,",0,2017-11-10T15:36:37.000-05:00,AirForce,FALSE,0,1,57,0,FALSE,3c1ea32e0ae4818578adfd949a155aa4568bb476,TRUE,2022-11-22T18:07:13.000-05:00,TRUE,TRUE,2247709,99.4920234518,346,NA,NA
https://homestars.com/on/gulf-breeze/duct-cleaning,9,https://homestars.com/on/gulf-breeze/duct-cleaning,Duct Cleaning,2775055,http://www.416SoClean.ca,/companies/2775055-416-so-clean-carpet-upholstery-care?searched_category_id=346&service_area=1828092,"For 416-SO-CLEAN COVID-19 - Infectious Disease Preparedness Response Plan, pls see: https://www.416soclean.ca/covid-19-prepare.html 

416-SO-CLEAN is a certified & locally-owned company that specializes in residential and commercial carpet, upholstery & duct cleaning. Established in 2003, 416-SO-CLEAN has amassed a 98% Homestar rating that showcases our exemplary workmanship. We go as far as guaranteeing our work with a 100% satisfaction guarantee with our ""Love it or Don't Pay Guarantee"". 

We use environmentally-safe cleaning products with state of the art truck-mounted steam cleaning technology for carpet and duct cleaning. We also offer a premium Detox and Platinum cleaning plans to eliminate allergens and pet stains, as well as fabric protection. We are located in North York, however, our trucks service all major cities from Mississauga to Oshawa.",416-so-clean-carpet-upholstery-care,2009-04-12T07:14:44.000-04:00,NA,"Toronto, Markham, Stouffville, Richmond Hill, Aurora, Newmarket, Vaughn, Pickering, Ajax, Whitby, Mississauga, Milton, Brampton. Oakville, North York, East York, Scarborough, Etobicoke. Thornhill, Unionville, Maple, Concord, Brooklyn  ",Mon - Sun: 8:00 AM - 8:00 PM,,"Carpet, Upholstery, & Air Duct cleaning, sanitizing and disinfecting. We offer same day service. ",,"- Pet Stains & Odor Removal 
- Wool Safe Approved Fabric Care Specialist 
- Certified Fabric Care Specialist",2003,NA,"VISA, Master Card, AMEX, Cheques & Cash ",,,,TRUE,TRUE,,$180,TRUE,FALSE,"Ask Us about our ""LOVE IT or DON'T PAY"" Guarantee",1838107,416 So Clean ,1386,1275,38,9.92392,"Duct Cleaning, Air Duct Cleaning, Furnace Duct Cleaning, vent cleaning, air vent cleaning, duct, ducts, air duct, duct air, cleaning the air, cleaning air, what is duct cleaning, cleaning duct, air ducts, cleaning ducts, cleaning the ducts, ducts cleaning, ducts and vents, vent cleaning, cleaning vent, air conditioning duct, what is air duct cleaning, air duct cleaning in, air duct cleaning, cleaning air duct, duct cleaning company, duct cleaning price, ac duc cleaning, duct cleaning prices, duct and carpet cleaning, duct cleaning canada, home air duct cleaning, air duct cleaning services reviews, residential duct cleaning, how much is duct cleaning, professional duct cleaning toronto, home duct cleaning services, heating duct cleaning, duct cleaning machine, professional duct cleaning, duct clean, hvac duct cleaning, duct cleaning service, duck cleaning, ducts cleaning, fresh air duct cleaning, commercial duct cleaning, industrial duct cleaning, canada duct cleaning, duct cleaning costs,Carpet & Rug Cleaning & Repairing, Carpet Cleaning, Carpet Cleaners, Rug Cleaning, rug cleaners, area rug cleaners, area rug cleaning, persian rug cleaning, Rug repair, carpet repair, persian rug repair, persian carpet repair, area rug repair, carpet rug cleaning, oriental rug cleaning, area rug cleaning service, rug cleaning and repair, professional rug cleaning, carpet and rug cleaning, rug cleaning services, wool rug cleaning, rug cleaning service, carpet cleaning repair, rug cleaning company, rug clean, industrial carpet cleaning, area rug cleaning services, ,Drapery & Upholstery Cleaning, soft furnishing cleaning, curtain cleaning, drape cleaning, drapes cleaning, blind cleaning, furniture cleaning, upholstery cleaning, sofa cleaning, chesterfield cleaning, armchair cleaning, ,",0,2009-04-12T07:14:40.000-04:00,416SoClean,FALSE,0,0,58,100,FALSE,211bec112678e29bf93d021ffdc029b1b8e1fa1d,TRUE,2022-11-16T13:58:22.000-05:00,TRUE,TRUE,1828092,99.250320874,346,NA,NA
https://homestars.com/on/gulf-breeze/duct-cleaning,9,https://homestars.com/on/gulf-breeze/duct-cleaning,Duct Cleaning,2777315,http://www.CanaDuct.com,/companies/2777315-canaduct-cleaning?searched_category_id=346&service_area=2077015,"Categories: » Duct Cleaning » Heating & Air Conditioning

Heating and Air Conditioning  Website:  www.HeatingOntario.ca

CanaDuct is the established leader in air duct cleaning in Toronto. CanaDuct Duct Cleaning specialize in residential and commercial duct cleaning services as well as vent cleaning, dryer cleaning, furnace cleaning and HVAC cleaning.

Over the past 10 years CanaDuct Duct Cleaning have had the privilege of working with area homeowners and businesses, gaining an understanding of their needs. We are pleased that many of our clients return to us for repeat services such as air conditioning cleaning and HVAC cleaning. Not only do our current customers keep coming back for regular duct cleaning service, our reputation has gained us many new customers through word-of-mouth. Once you experience CanaDuct's impeccable air duct cleaning services, you'll never have to worry about poor air quality in your home or workplace ever again. ",canaduct-cleaning,2010-01-08T08:26:34.000-05:00,NA,"
Most duct cleaning companies are not NADCA certified, nor are they equipped with a truck that boasts a 300 HP vacuum.  They do not offer the expertise of certified technicians nor do they deliver the raw mechanical power required to effectively perform professional duct cleaning. <br/>

<br/>In fact, most companies have trucks mounted with a mere 24 HP Heat Seal vacuum, specifically designed for vans.
<br />Our equipment delivers 5 - 10 times more power than our competitors!!<br/>

<br/>When shopping for qualified and certified duct cleaning companies, be sure to compare apples to apples.<br/>

<br/>Brampton, Concord, Etobicoke, Markham, Mississauga, Newmarket, North York, Oakville, Richmond Hill, Scarborough, Thornhill, Toronto, Unionville, Vaughan, Woodbridge,pickering,ajax,whitby,oshawa,bowmanville,etc <br/>

<br/>",8 am- 8pm,"Hepa Filter Systems Humidifiers Systems HRV Systems Ultraviolet Air Purifiers Thermostats
","Commercial Residential Industrial Duct Cleaning * Furnace Cleaning * Residential & Commercial Dryer Vent Cleaning and solutions * Installation of Humidifiers / HRV systems / Hepa Filter Systems Ultraviolet Air Purifier / Thermostats * Commercial & Industrial Overhead Cleaning * Bird And Nest Removal * See our website for other services provided!
","Lennox, Carrier, Amana, Bryant, Electro air, Fantech, General Air, Honeywell, Keeprite, Lifebreath, Trion, York, White-Rodgers, Amaircare.
","Cottages, Condos, High Rises, and all types of exhausting systems.
For more information visit us online: www.canaduct.com",2000,10,"cash, debit, Visa, MasterCard, check,American Express","ASCS BY NADCA,G2 by TSSA",NADCA. TSSA certified :000206794,"Whether you suffer from seasonal allergies, sinus problems, asthma or other respiratory ailments, Ca",TRUE,TRUE,According to the size of the house,$100,TRUE,FALSE,"5 years for HEPA, Lifetime on washable filters, lifetime on UV light, lifetime on Humidifiers.",1840367,Canaduct Duct Cleaning,2297,1230,23,9.7065,"Duct Cleaning, Air Duct Cleaning, Furnace Duct Cleaning, vent cleaning, air vent cleaning, duct, ducts, air duct, duct air, cleaning the air, cleaning air, what is duct cleaning, cleaning duct, air ducts, cleaning ducts, cleaning the ducts, ducts cleaning, ducts and vents, vent cleaning, cleaning vent, air conditioning duct, what is air duct cleaning, air duct cleaning in, air duct cleaning, cleaning air duct, duct cleaning company, duct cleaning price, ac duc cleaning, duct cleaning prices, duct and carpet cleaning, duct cleaning canada, home air duct cleaning, air duct cleaning services reviews, residential duct cleaning, how much is duct cleaning, professional duct cleaning toronto, home duct cleaning services, heating duct cleaning, duct cleaning machine, professional duct cleaning, duct clean, hvac duct cleaning, duct cleaning service, duck cleaning, ducts cleaning, fresh air duct cleaning, commercial duct cleaning, industrial duct cleaning, canada duct cleaning, duct cleaning costs,",3,2010-01-08T08:26:34.000-05:00,CanaDuctCleaning,FALSE,0,0,39,100,FALSE,197b73a2253f6397cb426cf767b9fdf609fcf998,TRUE,2022-07-21T09:34:07.000-04:00,TRUE,TRUE,2077015,95.5594027737,346,NA,NA
https://homestars.com/on/gulf-breeze/duct-cleaning,9,https://homestars.com/on/gulf-breeze/duct-cleaning,Duct Cleaning,221292,http://www.qualityhomecomfort.ca/,/companies/221292-quality-built-in-home-systems-inc?searched_category_id=346&service_area=2172007,"Full service residential and commercial heating and cooling. Fully licensed and certified. Family owned and operated for over 30 years.  Masters of installation and design. Commitment to excellence in customer service.

Specialists in radiant heating and electric/oil to gas conversions. ",quality-built-in-home-systems-inc,2006-04-20T20:00:00.000-04:00,NA,"Brampton, Concord, Etobicoke, Markham, Mississauga, Newmarket, North York, Oakville, Richmond Hill, Scarborough, Thornhill, Toronto, Unionville, Vaughan, Woodbridge",,"Furnace
Air conditioner
Boiler 
Tankless water heater 
Duct Cleaning
And much more","We service all makes and models. Furnaces, boilers, air conditioners (central and ductless/mini-split), water heaters (tanks and tankless), radiant and in floor heating, gas connection for bbq, stove, etc, duct work, HVAC design, electric/oil to gas conversion, duct cleaning","Goodman,Carrier,Lennox, Daikin,Mitsubishi,Fujitsu, LG","HVAC,Water Heaters,Ventalation, Duct Work,HVAC Design, In Floor Heaters, Gas Connections,Radiant Heating,Pool Heaters,Tankless Water Heaters, Furnace, Boilers, Combi Boilers,Smart Thermostats,Air Quality, Duct Cleaning",1988,NA,"Cash, Cheque & Etransfer ",,"HVAC Design,Heating Fuel Contractor, TSSA, HRAI, Licensed Gas Tech, Ont College of Trades Ref Tech","HRAI, TSSA, GreenON",TRUE,FALSE,,,TRUE,FALSE,"Yes, minimum 1 year. ",73214,Quality Home Comfort,194,172,63,9.85756,"Heating & Air Conditioning, Air Conditioning Installation, Air Conditioning Repair, Heating Oil, Heating System, heat, furnace, a/c, air conditioning, air conditioner, ac air conditioning, air conditioners, furnace, furnaces, airconditioner, lenneox, airconditioning, hvac, what is hvac, air condition, trane, hvac air conditioning, air conditioning hvac, a heating and air, air heating, heating & air, heating and air, heating air, heat pump, air conditioning units, air conditioning unit, unit air conditioning, air conditioner unit, air conditioner units, heating & cooling, heating and cooling, heating cooling, cooling and heating, system heating, heating system, air conditioning cooling, heat and air, heat air, heat & air, air and heat, air conditioning and heating, heating and air conditioning, air conditioning heating, air conditioning & heating, a and a heating and air conditioning, heating air conditioning, heat pumps, airconditioners, systems heating, heating systems, portable air conditioner, cooling system, Furnace Humidifier,  heating and cooling contractors, heat pump installation, home heating, heating ventilation and air conditioning, hvac industry, residential heat pump, heating services, heating contractor, homes heating, central heat, heat sources,  new heating systems, industrial air conditioning, radiant floor heating,  floor heating, central cooling and heating systems, residential heating, heat pump installers,  thermostat, in floor heating, ductless heat pump, programmable thermostat, mini split heat pump, heated floors, hvac systems, hvac technician, what is a heat pump, climate control, what does hvac stand for, electric heating, electric floor heating, new furnace, heat and temperature, h vac, heatpump, hvac design, electric heat, central heating, hvac engineer, home heating systems, hvac supply, thermo stat, heat pumps prices, heat pump efficiency, split heat pump, hvac maintenance, in floor heating cost, electric heat pumps, boiler heating systems, hvac unit, hvac mechanic, hvac repair, commercial hvac, hvac installation, heated tile floor, hvac specialist, hvac services, types of heating systems, hvac tech, air con unit,  air conditioner, canada air conditioner, air condition unit, air conditioning canada, portable air conditioner, room air conditioning, mobile air conditioning, portable ac, indoor air conditioner,Solar Water Heating, Solar Water Heating, Solar Water Heating Installation, Heating,Duct Cleaning, Air Duct Cleaning, Furnace Duct Cleaning, vent cleaning, air vent cleaning, duct, ducts, air duct, duct air, cleaning the air, cleaning air, what is duct cleaning, cleaning duct, air ducts, cleaning ducts, cleaning the ducts, ducts cleaning, ducts and vents, vent cleaning, cleaning vent, air conditioning duct, what is air duct cleaning, air duct cleaning in, air duct cleaning, cleaning air duct, duct cleaning company, duct cleaning price, ac duc cleaning, duct cleaning prices, duct and carpet cleaning, duct cleaning canada, home air duct cleaning, air duct cleaning services reviews, residential duct cleaning, how much is duct cleaning, professional duct cleaning toronto, home duct cleaning services, heating duct cleaning, duct cleaning machine, professional duct cleaning, duct clean, hvac duct cleaning, duct cleaning service, duck cleaning, ducts cleaning, fresh air duct cleaning, commercial duct cleaning, industrial duct cleaning, canada duct cleaning, duct cleaning costs,Gas Installers, natural gas, propane, water heater, furnace, barbeque, bbq, appliance servicing repair, ,",0,2018-07-06T13:59:42.000-04:00,qualityhome,FALSE,0,0,79,NA,FALSE,590269a8c8f6c49cddbea070fadfc3dcb94be21d,TRUE,2022-11-11T13:37:28.000-05:00,TRUE,TRUE,2172007,96.2973543492,346,NA,NA
https://homestars.com/on/gulf-breeze/duct-cleaning,9,https://homestars.com/on/gulf-breeze/duct-cleaning,Duct Cleaning,2946228,http://www.mpductcleaning.com,/companies/2946228-mp-professional?searched_category_id=346&service_area=2231229,"MP Professional provides quality Air Duct Cleaning services throughout the GTA and North locations.  
Guaranteed quality customer service with affordable pricing and no hidden fees!  

NO TELEMARKETING.  You will never be contacted by an MP Professional representative unless requested by a customer.  Our company strictly operates with our strong referral program, quality work and proud advertisement through social media and digital marketing.  

Best referral program in the business, get free duct cleaning for your home. Ask how!

Service Areas GTA :  Brampton, Mississauga, Etobicoke, North York, Woodbridge, Maple, King City, Thornhill, Richmond Hill, Aurora, Newmarket, Nobleton
Service Areas North:  Tottenham, Alliston, Beeton, Loretto, Schomberg, Bradford, Barrie

If area is not listed above give us a call and we will make arrangements the best we can to get to you!
",mp-professional,2020-07-30T12:08:54.000-04:00,NA,NA,NA,"Hepa Filter, Electrostatic Filter, Humidifier ","Residential Duct Cleaning, Furnace cleaning and maintenance, AC cleaning and maintenance, Humidifier installation, Hepa Filter installation, Dryer vent cleaning, Sanitize and deodorize 
",,,2015,NA,"Visa, Mastercard, Debit",,,,TRUE,TRUE,,,TRUE,FALSE,90 day money back guarantee,2008365,MP Professional,123,119,7,9.98319,"Duct Cleaning, Air Duct Cleaning, Furnace Duct Cleaning, vent cleaning, air vent cleaning, duct, ducts, air duct, duct air, cleaning the air, cleaning air, what is duct cleaning, cleaning duct, air ducts, cleaning ducts, cleaning the ducts, ducts cleaning, ducts and vents, vent cleaning, cleaning vent, air conditioning duct, what is air duct cleaning, air duct cleaning in, air duct cleaning, cleaning air duct, duct cleaning company, duct cleaning price, ac duc cleaning, duct cleaning prices, duct and carpet cleaning, duct cleaning canada, home air duct cleaning, air duct cleaning services reviews, residential duct cleaning, how much is duct cleaning, professional duct cleaning toronto, home duct cleaning services, heating duct cleaning, duct cleaning machine, professional duct cleaning, duct clean, hvac duct cleaning, duct cleaning service, duck cleaning, ducts cleaning, fresh air duct cleaning, commercial duct cleaning, industrial duct cleaning, canada duct cleaning, duct cleaning costs,",0,2020-07-30T12:09:16.000-04:00,,FALSE,0,0,14,0,FALSE,3332eebec849ed8ece07f5b57a507cf386936398,TRUE,2022-10-26T16:07:55.000-04:00,TRUE,TRUE,2231229,99.7687421672,346,NA,NA
https://homestars.com/on/gulf-breeze/duct-cleaning,9,https://homestars.com/on/gulf-breeze/duct-cleaning,Duct Cleaning,2779118,http://www.stronghouse.ca/home.html,/companies/2779118-stronghouse-inc?searched_category_id=346&service_area=2292370,"Specializing in Air Duct Cleaning Services across the GTA for over 20 years.  
At StrongHouse we always provide a free estimate along with our 90 day service guarantee and a clear scope of work.

Residential and Commercial Air Duct Cleaning, Dryer Vent Cleaning, Air Conditioning Maintenance, Furnace Maintenance, Humidifier Installation, Air Filter Installation, Air Quality Testing, Air System Sanitizing and Deodorizing.

416-456-0106",stronghouse-inc,2010-04-01T10:18:27.000-04:00,NA,"Toronto and GTA including, Etobicoke, North York, Brampton, Mississauga, Oakville, Vaughan, King City, Richmond Hill, Thornhill, Markham, and Scarborough. Please feel free to give us a call if you are in an area that is not listed and we will be happy to do our best to accommodate you.",Monday - Sunday 8am-9pm,"Air Filters, Whole Home HEPA Filtration systems, UVC Virus Killing Lighting System, Whole home Humidifiers.","Residential and Commercial Air Duct Cleaning, Dryer Vent Cleaning, Air Conditioning Maintenance, Furnace Maintenance, Humidifier Installation, Air Filter Installation, Air Quality Testing, Air System Sanitizing and Deodorizing.",,,1997,NA,Visa / MasterCard / AMEX / ,,,,TRUE,TRUE,,,TRUE,FALSE,90 Day Money Back. Ask for Details.,1842170,StrongHouse Inc.,86,70,206,9.54286,"Duct Cleaning, Air Duct Cleaning, Furnace Duct Cleaning, vent cleaning, air vent cleaning, duct, ducts, air duct, duct air, cleaning the air, cleaning air, what is duct cleaning, cleaning duct, air ducts, cleaning ducts, cleaning the ducts, ducts cleaning, ducts and vents, vent cleaning, cleaning vent, air conditioning duct, what is air duct cleaning, air duct cleaning in, air duct cleaning, cleaning air duct, duct cleaning company, duct cleaning price, ac duc cleaning, duct cleaning prices, duct and carpet cleaning, duct cleaning canada, home air duct cleaning, air duct cleaning services reviews, residential duct cleaning, how much is duct cleaning, professional duct cleaning toronto, home duct cleaning services, heating duct cleaning, duct cleaning machine, professional duct cleaning, duct clean, hvac duct cleaning, duct cleaning service, duck cleaning, ducts cleaning, fresh air duct cleaning, commercial duct cleaning, industrial duct cleaning, canada duct cleaning, duct cleaning costs,",1,2010-04-01T10:59:50.000-04:00,stronghouse,FALSE,0,0,94,NA,FALSE,3d435c4a843d212f0316e8915ef7766ab14c3857,TRUE,2022-04-25T09:42:45.000-04:00,TRUE,TRUE,2292370,94.4908543619,346,NA,NA
