Link,n_hits,all_links,category,id,url,hs_path,profile,permalink,created_at,sic_code,service_area,hours,products,services,brands,specialities,established,employee_cnt,payment_method,diplomas,licenses,memberships,liability_insurance,bonded,project_rate,project_minimum,written_contract,written_warranty,warranty_terms,parent_company_id,name,total_number_of_reviews_cache,total_number_of_approved_reviews_cache,number_of_photos_cache,avg_rating_cache,categories_info_cache,savings_count,claimed_at,subdomain,fraudulent,fraudulent_count,total_number_of_pending_reviews_cache,images_count,completion_percent_cache,bully,secret,replied_to_at_least_one_review_cache,latest_approved_review_created_at,has_set_tasks,lead_purchase_eligible,service_area_id,star_score,quote_button_category,direct_phone,direct_contact
https://homestars.com/on/queensville/condominium-renovations,7,https://homestars.com/on/queensville/condominium-renovations,Condominium Renovations,2721303,http://www.homeimprovementpeople.com,/companies/2721303-home-improvement-people?searched_category_id=459&service_area=2126386,"The Home Improvement People have completed literally thousands of renovations since our inception. We are a unique award winning contracting company, consulted by various media as industry experts. 
Please view our website at homeimprovementpeople.com to view images of some of our projects. 
For our clients' convenience, we've implemented progress billing as well as financing.
Regardless of scope, we approach every single home renovation with a foundation of strong design aesthetics, comprehensive product options, sound project management, and a commitment to craftsmanship.
 
Our projects range from remodelled bathrooms and kitchens, to rear additions,  hardwood flooring, basements, second story additions and other extensive renovations. We undertake work in all budget ranges.
 
Choosing a reputable contractor is the most important decision you will make regarding your renovation. From plans and permits, to last little finishing details, The Home Improvement People is committed to completing your renovations and home improvements in a professional manner and to your complete satisfaction.
We take pride in our personalized service and our high quality workmanship. 
Call us for quality, insured work - completed on time, and on budget.
416-782-7605.",home-improvement-people,2008-03-04T16:55:15.000-05:00,NA,"Ajax,Cobourg,Mississauga,Stouffville Aurora,Courtice,Newmarket,Thornhill Barrie,Etobicoke,North York,Toronto Bolton,Georgetown,Oakville,Vaughan Brampton,Hamilton,Paris,Whitby Brantford ,Kitchener,Pickering Burlington,Maple,Richmond Hill, Willowdale, Caledon, Markham Scarborough,Woodbridge Cambridge,Milton,North York ",,,,,,2002,80,Visa/MC/Cheque,,All ,,TRUE,TRUE,,,TRUE,FALSE,3 years,1784355,Home Improvement People Inc.,663,504,234,9.80357,"General Contractors, Residential General Contractor, Building Contractor, Additions, Remodeling Contractor,  Renovation, Builder, building construction, renovation, remodeling, construction builders, construction company, construction companies, home repair, construction jobs, home remodeling, general contractors, contractors general, contractor general, contractors construction, construction contractors, home improvement and remodeling, kitchen remodeling, construction contractor, builders contractors, home renovation, general contracting, building contractors, building companies, home renovations, builder contractor, building contractor, remodeling contractor, commercial construction, residential construction, house contractor, concrete contractors, home contractors, general construction, construction general, contractors remodeling, remodeling contractors, remodelers, remodel contractor, remodel contractors, general contract, commercial contractors, renovations contractors, home improvement contractor, licensed contractor, license general contractor, mud room, mudroom, caulking, ,Design/Build, Contracting, Renovation, Remodeling, Restoration, Project Management, Renovation Assistance, Reno Management, architect, architects, design build, build & design, design and build, build by design, design to build. building construction, building a house, house designs, house plans, home designs, house plan, how to design a house, design house, house design, remodeling, building and design, design for building, design building, building by design, a building design, design of building, building design, design a building, building & design,  playsets, playground, wooden playset, wooden playground, play set, ,Basement Renovation, Basement renovation, Basement remodeling, Basement remodelling, renovating your basement, renovation, waterproofing, remodeling, home renovation, house renovation, water in basement, basement waterproofing,finishing basement, moistureproof, remodeling the house, caulking,Kitchen & Bathroom - Cabinets & Design, Kitchen Cabinet And Counter, Kitchen Cabinet Hardware, Bathroom Cabinet, Bathroom Wall Cabinet, Bathroom Sink Cabinet, cabinets, kitchens, cabinetry, kitchen and cabinets, cabinets for kitchen, about kitchen cabinets, kitchen cabinets, kitchen cabinets in, cabinets for the kitchen, cabinets and kitchen, cabinets kitchen, kitchen cabinet, cabinet kitchen, the kitchen cabinet, kitchen by design, design kitchen, a kitchen design, design a kitchen, design for kitchen, design and kitchen, design by kitchen, kitchen design, cabinetry kitchen, kitchen cabinetry, designs kitchen, kitchen designs, bathroom vanities, vanity and bathroom, bath and vanity, designer kitchen, ,Kitchen Planning & Renovation, Kitchen Planning And Design, Kitchen Cabinet Planning, Kitchen Design, Kitchen Remodeling, kitchen or, and bathroom, a and a kitchens, kitchens and, for kitchens, a kitchens, kitchens, the house design, cabinets for kitchen, cabinets for the kitchen, cabinets and kitchen, kitchen cabinets, design a kitchen, about kitchen design, a kitchen design, how to kitchen design, design and kitchen, the kitchen design, design for kitchen, kitchen designs, renovation and remodeling, remodeling and renovation, kitchen designer,,Kitchen Renovation, caulking, ,Condominium Renovations, Condo, Apartment, remodeling, renovations, kitchen cabinet, home decor, condo apartments, home improvement, home improvements, remodeling home, home remodeling, remodeling a home, new condo, Condo facelift, 
I ,Condo RenovationsRenovations for a new condo that include removing a drywall and creating an island and a full kitchen remodeling. ,Small rodent in Attic,Bathroom Renovation, Bathroom renovation, bathroom remodeling, bathroom remodelling, renovating the bathroom, tearing out the bathroom, fixing up the bathroom, bathroom contractors, bathroom vanities, bathroom vanity, design of bathroom, bathroom and design, design for bathroom, design a bathroom, design a bath, bath design, bathroom tile, bathroom cabinets, remodeling a bathroom, bathroom remodeling, remodeling the bathroom, ,Bath renovation, New tub, caulking, ,Builders, Home Builders, Home Contractors, residential builders, home construction companies, residential building contractor, builder, construction builders, local home builders, custom home builders, master builders, general builders, new home builders, building contractors, custom home builders, luxury home builders, ,Cabinetry & Millwork, Kitchen Cabinetry, Custom Cabinetry, Bathroom Cabinetry, Architectural Millwork, Millwork, custom millwork, bathroom cabinets, Kitchen cabinets, built-in cabinets, built-in cabinetry,  cabinet makers, custom cabinets kitchen, cabinetry, thomasville kitchen cabinets, cabinet doors, millwork cabinetry, custom kitchen cabinets, kraftmaid cabinets, maple cabinets, wood cabinets, stock cabinets, thermofoil cabinets, laminate cabinets, kitchen cabinets design, cherry cabinets, kitchen cabinet designs, hickory cabinets, wholesale cabinets, custom made cabinets, cabinet millwork, cabinets kitchen, kitchen cabinetry, millwork cabinets, ready to assemble cabinets, quality cabinets, bamboo cabinets, caulking,
,Home Additions, General contractor, home improvement, building addition, home expansion, house expansion, house building, plans house, house plans from, plans for house, the house plans, house plans, renovation, in house design, home plans house, home house plans, house home plans, house plans home, remodeling, house plans and designs, designs house plans, house designs plans, house plans designs, home plans and designs, home designs plans, floor plans, house build, renovations, plans for building, kitchen cabinets, remodel, kitchen design, house plans for building, house plans building, ,Design/Project Management, Drafters, Drafting, Project Management, Building, General Contracting, Renovation Management, Project Manager, Design Management.,",0,2017-04-05T10:18:55.000-04:00,TheHIP,FALSE,0,0,279,100,FALSE,7fbc45f3170f9c9c4247a2eca79f1488f75c5fa0,TRUE,2022-09-09T20:23:14.000-04:00,TRUE,TRUE,2126386,96.3063198007,459,NA,NA
https://homestars.com/on/queensville/condominium-renovations,7,https://homestars.com/on/queensville/condominium-renovations,Condominium Renovations,2868402,http://www.splishsplash.ca,/companies/2868402-splish-splash-bathrooms?searched_category_id=459&service_area=2107373,"At Splish Splash Bathrooms, Kitchens & More, we take pride in completing beautiful renovations with outstanding workmanship on every project. Our highly skilled crew members are Schluter Systems Certified and fully insured (including WSIB coverage). 

Bathrooms and kitchens are our specialty, so you can feel confident that your project is in good hands. If you have additional needs, we're great at other residential renovations too!

We stand by our work. After your project is complete, we're still here for you, and provide a warranty on our workmanship: free of charge. 

Contact us with your questions and to request a free in-home assessment.",splish-splash-bathrooms,2015-03-29T11:19:08.000-04:00,NA,"Proudly serving the GTA, York, Peel and Durham Regions.
<br />This includes: Toronto, Vaughan, Richmond Hill, Markham,  Aurora, Newmarket, King City, Mississauga, Oakville, Burlington, Pickering, Ajax, Whitby and Oshawa.<br/>

<br/>Additional service areas can be scheduled. Contact us for more information.",,,,,"Bathroom renovations, kitchen renovations, condo renovations, general residential renovations and other services",NA,NA,,Schluter Systems Certified,Valid Metro Licence,,TRUE,FALSE,,,TRUE,FALSE,Workmanship,1930826,Splish Splash Bathrooms ,82,76,89,9.98684,"Bathroom Renovation, Bathroom renovation, bathroom remodeling, bathroom remodelling, renovating the bathroom, tearing out the bathroom, fixing up the bathroom, bathroom contractors, bathroom vanities, bathroom vanity, design of bathroom, bathroom and design, design for bathroom, design a bathroom, design a bath, bath design, bathroom tile, bathroom cabinets, remodeling a bathroom, bathroom remodeling, remodeling the bathroom, ,Bath renovation, New tub, caulking, ,Kitchen Planning & Renovation, Kitchen Planning And Design, Kitchen Cabinet Planning, Kitchen Design, Kitchen Remodeling, kitchen or, and bathroom, a and a kitchens, kitchens and, for kitchens, a kitchens, kitchens, the house design, cabinets for kitchen, cabinets for the kitchen, cabinets and kitchen, kitchen cabinets, design a kitchen, about kitchen design, a kitchen design, how to kitchen design, design and kitchen, the kitchen design, design for kitchen, kitchen designs, renovation and remodeling, remodeling and renovation, kitchen designer,,Kitchen Renovation, caulking, ,Condominium Renovations, Condo, Apartment, remodeling, renovations, kitchen cabinet, home decor, condo apartments, home improvement, home improvements, remodeling home, home remodeling, remodeling a home, new condo, Condo facelift, 
I ,Condo RenovationsRenovations for a new condo that include removing a drywall and creating an island and a full kitchen remodeling. ,Small rodent in Attic,",0,NA,splishsplash,FALSE,0,0,141,0,FALSE,41bb1c88082be87f16140927eed8d82add3d4c3d,TRUE,2022-11-16T19:57:20.000-05:00,TRUE,TRUE,2107373,98.7514100534,459,NA,NA
https://homestars.com/on/queensville/condominium-renovations,7,https://homestars.com/on/queensville/condominium-renovations,Condominium Renovations,2925692,https://csgrenovation.ca/,/companies/2925692-construction-solutions-group-inc?searched_category_id=459&service_area=2184712,"The CSG renovations inc is proud to serve customers in Toronto and all across the Greater Toronto Area. We are your go-to professionals for anything to do with your house, from interior home designs and renovations to buying and selling. We embrace the excitement of working in one of the most dynamic, diverse housing markets in North America.

CSG renovations inc employs a wide range of professionals who are ready to help you with whatever you need.
Whether you want to renovate, rebuild, buy or sell a home, CSG renovations inc is your number one choice. Our services include the following:

Renovations to one or more of the rooms in your home 
Basement finishing and renovations 
Whole house renovations or rebuilding 
Planning and designing

Check us out on:
https://csgrenovation.ca/ 
https://www.facebook.com/CSG-renovation-419284458839188 
https://www.instagram.com/csgrenovation/",construction-solutions-group-inc,2019-01-02T11:00:18.000-05:00,NA,NA,NA,,"Basement Renovation
Bathroom Renovation
Commercial Renovation
Condominium  Renovation
Kitchen Renovation
House Painting
Interior Design
Popcorn Ceiling Removal
Residential Renovation
Backsplash Tile Installation
",,,NA,NA,"Cash, Cheque and e-transfer",,All electrical and plumbing licences held in good standard and are insured.,,TRUE,FALSE,,,TRUE,FALSE,Yes. Kindly ask for details. Depends on service provided. ,1987866,Construction Solutions Group Inc,45,43,19,9.88372,"General Contractors, Residential General Contractor, Building Contractor, Additions, Remodeling Contractor,  Renovation, Builder, building construction, renovation, remodeling, construction builders, construction company, construction companies, home repair, construction jobs, home remodeling, general contractors, contractors general, contractor general, contractors construction, construction contractors, home improvement and remodeling, kitchen remodeling, construction contractor, builders contractors, home renovation, general contracting, building contractors, building companies, home renovations, builder contractor, building contractor, remodeling contractor, commercial construction, residential construction, house contractor, concrete contractors, home contractors, general construction, construction general, contractors remodeling, remodeling contractors, remodelers, remodel contractor, remodel contractors, general contract, commercial contractors, renovations contractors, home improvement contractor, licensed contractor, license general contractor, mud room, mudroom, caulking, ,Condominium Renovations, Condo, Apartment, remodeling, renovations, kitchen cabinet, home decor, condo apartments, home improvement, home improvements, remodeling home, home remodeling, remodeling a home, new condo, Condo facelift, 
I ,Condo RenovationsRenovations for a new condo that include removing a drywall and creating an island and a full kitchen remodeling. ,Small rodent in Attic,Basement Renovation, Basement renovation, Basement remodeling, Basement remodelling, renovating your basement, renovation, waterproofing, remodeling, home renovation, house renovation, water in basement, basement waterproofing,finishing basement, moistureproof, remodeling the house, caulking,",0,2019-01-02T11:05:42.000-05:00,NA,FALSE,0,0,21,0,FALSE,b931b662584af5b30a7ea7fbb37949f807f0ac65,TRUE,2021-06-23T09:07:30.000-04:00,TRUE,TRUE,2184712,91.6775256182,459,NA,NA
https://homestars.com/on/queensville/condominium-renovations,7,https://homestars.com/on/queensville/condominium-renovations,Condominium Renovations,2966360,,/companies/2966360-mareno-services-inc?searched_category_id=459&service_area=2276106,,mareno-services-inc,2022-03-24T18:30:43.000-04:00,NA,NA,NA,,,,,NA,NA,,,,,FALSE,FALSE,,,FALSE,FALSE,,2028278,Mareno Services Inc,8,6,26,10,"Bathroom Renovation, Bathroom renovation, bathroom remodeling, bathroom remodelling, renovating the bathroom, tearing out the bathroom, fixing up the bathroom, bathroom contractors, bathroom vanities, bathroom vanity, design of bathroom, bathroom and design, design for bathroom, design a bathroom, design a bath, bath design, bathroom tile, bathroom cabinets, remodeling a bathroom, bathroom remodeling, remodeling the bathroom, ,Bath renovation, New tub, caulking, ,Basement Renovation, Basement renovation, Basement remodeling, Basement remodelling, renovating your basement, renovation, waterproofing, remodeling, home renovation, house renovation, water in basement, basement waterproofing,finishing basement, moistureproof, remodeling the house, caulking,General Contractors, Residential General Contractor, Building Contractor, Additions, Remodeling Contractor,  Renovation, Builder, building construction, renovation, remodeling, construction builders, construction company, construction companies, home repair, construction jobs, home remodeling, general contractors, contractors general, contractor general, contractors construction, construction contractors, home improvement and remodeling, kitchen remodeling, construction contractor, builders contractors, home renovation, general contracting, building contractors, building companies, home renovations, builder contractor, building contractor, remodeling contractor, commercial construction, residential construction, house contractor, concrete contractors, home contractors, general construction, construction general, contractors remodeling, remodeling contractors, remodelers, remodel contractor, remodel contractors, general contract, commercial contractors, renovations contractors, home improvement contractor, licensed contractor, license general contractor, mud room, mudroom, caulking, ,Kitchen Planning & Renovation, Kitchen Planning And Design, Kitchen Cabinet Planning, Kitchen Design, Kitchen Remodeling, kitchen or, and bathroom, a and a kitchens, kitchens and, for kitchens, a kitchens, kitchens, the house design, cabinets for kitchen, cabinets for the kitchen, cabinets and kitchen, kitchen cabinets, design a kitchen, about kitchen design, a kitchen design, how to kitchen design, design and kitchen, the kitchen design, design for kitchen, kitchen designs, renovation and remodeling, remodeling and renovation, kitchen designer,,Kitchen Renovation, caulking, ,Condominium Renovations, Condo, Apartment, remodeling, renovations, kitchen cabinet, home decor, condo apartments, home improvement, home improvements, remodeling home, home remodeling, remodeling a home, new condo, Condo facelift, 
I ,Condo RenovationsRenovations for a new condo that include removing a drywall and creating an island and a full kitchen remodeling. ,Small rodent in Attic,",0,2022-03-24T18:32:26.000-04:00,marenoservicesinc,FALSE,0,0,22,0,FALSE,3cd1bd9740434308db86d0350dc7fda89decfb46,TRUE,2022-08-10T21:45:10.000-04:00,TRUE,TRUE,2276106,88.6294097149,459,NA,NA
https://homestars.com/on/queensville/condominium-renovations,7,https://homestars.com/on/queensville/condominium-renovations,Condominium Renovations,2974357,NA,/companies/2974357-renomen?searched_category_id=459&service_area=2294958,NA,renomen,2022-10-15T07:05:16.000-04:00,NA,NA,NA,NA,NA,NA,NA,NA,NA,NA,NA,NA,NA,FALSE,FALSE,NA,NA,FALSE,FALSE,NA,2036255,Renomen,0,0,0,NA,"Condominium Renovations, Condo, Apartment, remodeling, renovations, kitchen cabinet, home decor, condo apartments, home improvement, home improvements, remodeling home, home remodeling, remodeling a home, new condo, Condo facelift, 
I ,Condo RenovationsRenovations for a new condo that include removing a drywall and creating an island and a full kitchen remodeling. ,Small rodent in Attic,",0,2022-10-15T07:06:27.000-04:00,NA,FALSE,0,0,0,0,FALSE,9f34a6c4b4257f11301e7f9a8ac5f601e1f85b69,FALSE,NA,FALSE,FALSE,2294958,-1.0,459,NA,NA
https://homestars.com/on/queensville/condominium-renovations,7,https://homestars.com/on/queensville/condominium-renovations,Condominium Renovations,2918755,NA,/companies/2918755-brookline-international-inc?searched_category_id=459&service_area=2169130,NA,brookline-international-inc,2018-06-29T22:07:08.000-04:00,NA,NA,NA,NA,NA,NA,NA,NA,NA,NA,NA,NA,NA,FALSE,FALSE,NA,NA,FALSE,FALSE,NA,1980939,Brookline International Inc. ,0,0,0,NA,"Condominium Renovations, Condo, Apartment, remodeling, renovations, kitchen cabinet, home decor, condo apartments, home improvement, home improvements, remodeling home, home remodeling, remodeling a home, new condo, Condo facelift, 
I ,Condo RenovationsRenovations for a new condo that include removing a drywall and creating an island and a full kitchen remodeling. ,Small rodent in Attic,",0,2018-06-29T22:08:39.000-04:00,NA,FALSE,0,0,0,0,FALSE,6454ea66eb4ef5a5cc8c0813c13899c87e9cc701,FALSE,NA,FALSE,FALSE,2169130,-1.0,459,NA,NA
https://homestars.com/on/queensville/condominium-renovations,7,https://homestars.com/on/queensville/condominium-renovations,Condominium Renovations,2888613,NA,/companies/2888613-jco-associates?searched_category_id=459&service_area=2098690,NA,jco-associates,2016-07-11T19:11:01.000-04:00,NA,NA,NA,NA,NA,NA,NA,NA,NA,NA,NA,NA,NA,FALSE,FALSE,NA,NA,FALSE,FALSE,NA,1951037,JCO & Associates,7,7,0,9,"Condominium Renovations, Condo, Apartment, remodeling, renovations, kitchen cabinet, home decor, condo apartments, home improvement, home improvements, remodeling home, home remodeling, remodeling a home, new condo, Condo facelift, 
I ,Condo RenovationsRenovations for a new condo that include removing a drywall and creating an island and a full kitchen remodeling. ,Small rodent in Attic,",0,NA,NA,FALSE,0,0,0,0,FALSE,NA,FALSE,2022-05-19T15:51:07.000-04:00,FALSE,FALSE,2098690,79.5257963488,459,NA,NA
