Link,n_hits,all_links,category,id,url,hs_path,profile,permalink,created_at,sic_code,service_area,hours,products,services,brands,specialities,established,employee_cnt,payment_method,diplomas,licenses,memberships,liability_insurance,bonded,project_rate,project_minimum,written_contract,written_warranty,warranty_terms,parent_company_id,name,total_number_of_reviews_cache,total_number_of_approved_reviews_cache,number_of_photos_cache,avg_rating_cache,categories_info_cache,savings_count,claimed_at,subdomain,fraudulent,fraudulent_count,total_number_of_pending_reviews_cache,images_count,completion_percent_cache,bully,secret,replied_to_at_least_one_review_cache,latest_approved_review_created_at,has_set_tasks,lead_purchase_eligible,service_area_id,star_score,quote_button_category,direct_phone,direct_contact
https://homestars.com/on/lynden/vacuum-sales-service,25,"c(""https://homestars.com/on/lynden/vacuum-sales-service?&page=2&"", ""https://homestars.com/on/lynden/vacuum-sales-service?&page=3&"")",Vacuum Sales & Service,2780350,http://www.grandalarms.com,/companies/2780350-grand-alarms?searched_category_id=446&service_area=1866523,"Grand Alarms Ltd., a recognized Canadian company conveniently situated within the Greater?Toronto?Area, has built its reputation within the security industry by providing customers with the latest cutting?edge home electronics, whole?home security and information?networking that is designed to fit the modern lifestyle. Since the company’s establishment over a decade ago, Grand Alarms has been the trusted security company of choice to provide first?class security and home automation to customers across Canada.

Certified and active members of both the Home Builder’s Association and the Canadian Security Association, Grand Alarms offers proven solutions designed to equip each home with the amenities and the flexibility that best meet the needs of our customers. By offering industry?leading Smart?Home networking solutions, multi?room Audio Video Distribution, technologically advanced IP Alarm Monitoring components, and state?of?the?art Central Vacuums, home Surveillance components and Garage Door Openers, Grand Alarms has established a long list of dedicated customers who are benefiting from our elite services through?out their home.

Grand Alarms prides itself on providing each customer with an alarm system that is ready for the unexpected by centralizing and routing security to every corner of the home, blanketing it in protection and giving you piece of mind knowing that your family and possessions are secure. With Grand Alarms, every installation is performed by our highly trained technicians ensuring that the set?up and operation of your alarm system is entrusted only to those who can be trusted.

We are dedicated to maintaining a high level of effective and professional customer service in a number of languages that will best suit individual needs. With our cost effective plans and service, and a completely free full lifetime warranty, Grand Alarms continues to be the no. 1 Canadian choice for new homes, residences and businesses of all size.

Grand Alarms Ltd – Home Security solutions that bring comfort to your home and safety to your life.",grand-alarms,2010-08-04T16:16:51.000-04:00,NA,"GTA, Vaughan, Bradford, Newmarket, Brooklyn, Ajax, Pickering, Caledon, Georgetown, Brampton, Milton, Mississauga, Oakville, Burlington","M-Th 9-9, F 9-5, Sa 9-5","Home Alarm Products, Home Alarm System Products, Alarm Monitoring, 24/7 Monitoring, Smart Home Monitoring, Smart Home Security","wireless alarm systems, home security, home security systems, home security system, wireless home alarm systems, wireless home alarm systems toronto, wireless home alarm systems vaughan, home alarms, home wireless alarm system, wireless home security, wireless home security system, wireless home security systems canada, wireless home surveillance, wired home alarms, wired home alarm systems, wired home alarm systems in toronto, vaughan wired alarms, home security systems wireless, home security systems wired, home alarm systems canada, best home alarm systems, best home alarm systems canada, best home alarm systems vaughan, best home alarm systems, toronto, best home alarm systems mississauga, best home alarm systems ajax, best home alarm systems maple, home security canada, canada home security, toronto home security, home security in canada, home security alarm systems, security alarm system, home alarm security system reviews, home alarm reviews, alarm security system, security alarm systems for home, security alarm systems for homes, best security alarm system,, alarm home security systems, home alarm systems reviews canada, wireless home alarm systems reviews, home alarm system review, alarm system reviews, alarm systems reviews, alarm reviews vaughan, grand alarms, surveillance system reviews, wireless alarm system review, home video surveillance systems reviews, wireless alarm system reviews, home surveillance system reviews, best home alarm system reviews, best home alarm system reviews, wireless home alarm, home security system wireless, best home alarm, best home alarm company vaughan, best home alarm company ajax, best home alarm company in canada, what is the best home alarm company, best home alarm systems consumer reporters, best home alarm systems, the best home alarm systems, which is the best home alarm system, what is the best home alarm system, who has the best home alarm system, home alarm security vaughan, home alarm security woodbridge, home alarm security toronto, home alarm security ajax, home alarm security pickering, home alarm security brampton, home alarm security canada, security alarms for homes, alarm security home, residential security alarms, commercial security alarms, home alarm monitoring, home monitoring vaughan, monitored home alarm systems, home monitoring systems, cheap home alarm monitoring, home alarms monitoring, home security monitoring, home alarm monitoring toronto, cheapest home alarm monitoring, home security monitoring service, home video monitoring, monitored home security systems, home alarm system monitoring, home alarm from your phone, security cameras, security camera, home security camera, wireless security camera, wireless security cameras, smart home monitoring, smart home, home smart alarm, home security camera, home video surveillance systems, best home surveillance system, wireless surveillance systems, home surveillance systems canada, business surveillance systems, residential surveillance systems, best home video systems, best surveillance systems for home, best home surveillance systems, video surveillance systems for home, surveillance systems wireless, home alarm battery, home alarm battery replacement, home alarm batteries, where to buy home alarm system, burglar alarm system, burglar alarm system vaughan, home burglar alarm systems, burglar alarm system, home burglar alarm system, best home burglar alarm system, alarm monitoring, alarm system monitoring, monitored alarm system, monitored alarm, burglar alarms monitoring, wireless alarm monitoring, best security systems, best home security, best home security system, best wireless security system, best home security system toronto, best home security system vaughan, best home security system milton, the best home security system, best home security alarms, home security camera system, residential alarm systems, residential security systems, residential security, residential alarm companies, residential home alarm systems, security system reviews, home security reviews, home security reviews canada, wireless home security system reviews, security system reviews, vaughan home security reviews, home alarm security reviews, home security system reviews, burglar alarm, home burglar alarm, smart home monitoring, smart home systems, home monitoring systems, smart home technology, home control, smart home monitoring system, home automation, alarm systems, home security cameras, smart home monitoring review","DSC, DSC Security, DSC alarm systems, DSC alarms, DSC home alarms","Home Alarm Systems, Smart Home Alarm Systems",1999,NA,,,,CANASA ( Canadian Security Association ) BILD ( Building industry and Land Development ) CFIB ( Ca,TRUE,TRUE,,,TRUE,FALSE,,1843402,Grand Alarms,1744,1282,16,9.27769,"Alarm Systems, Home Alarm Systems, Alarm System Monitoring, Fire Alarm Systems, Home Security Systems, The Alarm, At Home Security, Home Security, Security Systems, Alarm Security, Security Alarm, Security Cameras, Security Company, Security Companies, Home alarm, Alarm home, Alarm security, House security, house alarm, burglar alarm, carbon monoxide, carbon monoxide alarms, business cameras, commercial surveillance systems, surveillance, commercial security cameras, commercial security camera,,Home Automation, Home Automation System, Wireless Home Automation, Home Automation Software, Smart Homes, wire, x10, home theatre, home security security, in home security, home security home, at home security, home security, home home security, control 4, wireless home, light control, the smart home, smart home, a smart home, home smart home, in home security systems, home security systems, security systems home, security systems for home, security systems for the home, home security system, security system home, home system security, security home system, security system for home, in home security system, house of security, in home automation, automation home, about home automation, what is home automation, how to home automation, home automation how to, automation for home, smart house, crestron, automation house, house automation, house of automation, smart homes, automation system, homeautomation, i home remote, remote home, TV Install, TV Wall Mounting, Ceiling Speaker Automation, Ceiling Speaking Installation,Home Theater, Home Theatre System, Home Theatre Projector, Home Theatre Seating, Audio System, electronics, flat panel screen TV stereo, plasma, LCD, home theater how to, home theater home theater, home theatre, theatre home, home cinema, home theater system, home theatre system, surround sound, home theaters, home theaters system, home theater systems, home theatre systems, home theater 5.1, 5.1 home theater, home movie theater, in home movie theater, surround sound systems, samsung home theater, home theater samsung, home theater speaker, home theater lg, lg home theater, home theater best, best home theater, home theater wireless, wireless home theater, surround sound speakers, home theater blu ray, home theater with bly ray, bly ray home theater, speakers for home theater, home theater speakers, speakers home theater, philips home theater, 5.1 home theater system, home theater system 5.1, dvd home theater, bluray home theater, home theatre samsung, home audio systems, home theater receiver, receiver home theater, home theater review, home sounds systems, home theater price, home theater reviews, projectors home theater, antenna, antennas, home theatre, home theater, TV Install, TV Wall Mounting, Ceiling Speaker Automation,
Ceiling Speaking Installation,Vacuum Sales & Service, Vacuum Cleaners, Vacuum Cleaner Bag, Vacuum Pump, Vacuum Cleaner Sales, Vacuum Cleaner Service, central vacuum service, central vacuum installation, vacuum repair, central vacuum sale, ,Sump pump line tepair,",1,2010-08-04T16:16:51.000-04:00,grandalarms,FALSE,0,0,15,100,FALSE,8fcce42c1e23234eaecd08ba61d41ba6b7488250,TRUE,2022-01-26T06:54:02.000-05:00,TRUE,TRUE,1866523,90.3370452722,446,NA,NA
https://homestars.com/on/lynden/vacuum-sales-service,25,"c(""https://homestars.com/on/lynden/vacuum-sales-service?&page=2&"", ""https://homestars.com/on/lynden/vacuum-sales-service?&page=3&"")",Vacuum Sales & Service,2935042,https://info@parkdalevacuum.com,/companies/2935042-parkdale-vacuum-centre?searched_category_id=446&service_area=2206192,since 2000 Vacuum cleaner sales service repair. Central vac installation.,parkdale-vacuum-centre,2019-09-18T12:35:49.000-04:00,NA,NA,NA,NA,NA,NA,NA,NA,NA,NA,NA,NA,NA,FALSE,FALSE,NA,NA,FALSE,FALSE,NA,1997216,PARKDALE VACUUM CENTRE,1,1,0,10,"Vacuum Sales & Service, Vacuum Cleaners, Vacuum Cleaner Bag, Vacuum Pump, Vacuum Cleaner Sales, Vacuum Cleaner Service, central vacuum service, central vacuum installation, vacuum repair, central vacuum sale, ,Sump pump line tepair,",0,2019-09-18T12:46:44.000-04:00,NA,FALSE,0,0,0,0,FALSE,6cbee301d0745641a12721599bc876d75e87ef51,FALSE,NA,FALSE,FALSE,2206192,0.0,446,NA,NA
https://homestars.com/on/lynden/vacuum-sales-service,25,"c(""https://homestars.com/on/lynden/vacuum-sales-service?&page=2&"", ""https://homestars.com/on/lynden/vacuum-sales-service?&page=3&"")",Vacuum Sales & Service,2965963,,/companies/2965963-vacu-man-furnace-and-duct-cleaning?searched_category_id=446&service_area=2275217,"Address:
4 Lyndhurst St, Hamilton, Ontario, L8L 7G7

Phone: (905) 333-5454

Description:
Vacu-Man Duct and Furnace cleaning started in 1979 and for over 40 years has been a family run business focused on providing the best in air duct and furnace cleaning. ",vacu-man-furnace-and-duct-cleaning,2022-03-16T03:25:17.000-04:00,NA,NA,NA,,,,,NA,NA,,,,,FALSE,FALSE,,,FALSE,FALSE,,2027893,Vacu-Man Furnace and Duct Cleaning,0,0,3,NA,"Vacuum Sales & Service, Vacuum Cleaners, Vacuum Cleaner Bag, Vacuum Pump, Vacuum Cleaner Sales, Vacuum Cleaner Service, central vacuum service, central vacuum installation, vacuum repair, central vacuum sale, ,Sump pump line tepair,",0,2022-03-16T03:25:26.000-04:00,,FALSE,0,0,4,0,FALSE,626e4a96c2fd951a14bcab7487049d27ca27559b,FALSE,NA,TRUE,FALSE,2275217,-1.0,446,NA,NA
https://homestars.com/on/lynden/vacuum-sales-service,25,"c(""https://homestars.com/on/lynden/vacuum-sales-service?&page=2&"", ""https://homestars.com/on/lynden/vacuum-sales-service?&page=3&"")",Vacuum Sales & Service,205145,NA,/companies/205145-electrolux-canada?searched_category_id=446&service_area=1807945,"Vacuum Cleaners & Systems, Air & Water Purification Systems, Furncae Filters, Allergen Relief and other home wellness products",electrolux-canada,2008-01-23T10:26:47.000-05:00,NA,"Hamilton, Burlington, Brantford and Niagara Region ",Mon - Fri 9-5 Sat 9-4,NA,NA,NA,NA,0,0,NA,NA,NA,NA,FALSE,FALSE,NA,NA,FALSE,FALSE,NA,60389,Electrolux Canada,0,0,0,NA,"Vacuum Sales & Service, Vacuum Cleaners, Vacuum Cleaner Bag, Vacuum Pump, Vacuum Cleaner Sales, Vacuum Cleaner Service, central vacuum service, central vacuum installation, vacuum repair, central vacuum sale, ,Sump pump line tepair,",3,2011-04-14T17:24:55.000-04:00,NA,FALSE,0,0,0,NA,FALSE,992ec338549a78fe48c606788c82627cde918448,FALSE,NA,FALSE,FALSE,1807945,-1.0,446,NA,NA
https://homestars.com/on/lynden/vacuum-sales-service,25,"c(""https://homestars.com/on/lynden/vacuum-sales-service?&page=2&"", ""https://homestars.com/on/lynden/vacuum-sales-service?&page=3&"")",Vacuum Sales & Service,2575542,NA,/companies/2575542-mountain-vacuum?searched_category_id=446&service_area=1588746,NA,mountain-vacuum,2008-03-04T16:55:15.000-05:00,NA,NA,NA,NA,NA,NA,NA,NA,NA,NA,NA,NA,NA,FALSE,FALSE,NA,NA,FALSE,FALSE,NA,1638594,Mountain Vacuum,2,2,0,10,"Vacuum Sales & Service, Vacuum Cleaners, Vacuum Cleaner Bag, Vacuum Pump, Vacuum Cleaner Sales, Vacuum Cleaner Service, central vacuum service, central vacuum installation, vacuum repair, central vacuum sale, ,Sump pump line tepair,",0,NA,NA,FALSE,0,0,0,NA,FALSE,NA,FALSE,NA,FALSE,FALSE,1588746,67.0741758242,446,NA,NA
https://homestars.com/on/lynden/vacuum-sales-service,25,"c(""https://homestars.com/on/lynden/vacuum-sales-service?&page=2&"", ""https://homestars.com/on/lynden/vacuum-sales-service?&page=3&"")",Vacuum Sales & Service,209224,NA,/companies/209224-hamilton-vacuum-supply-co-ltd?searched_category_id=446&service_area=1806347,NA,hamilton-vacuum-supply-co-ltd,2008-01-23T10:28:41.000-05:00,NA,NA,NA,NA,NA,NA,NA,0,0,NA,NA,NA,NA,FALSE,FALSE,NA,NA,FALSE,FALSE,NA,63640,Hamilton Vacuum Supply Co Ltd,1,1,0,10,"Vacuum Sales & Service, Vacuum Cleaners, Vacuum Cleaner Bag, Vacuum Pump, Vacuum Cleaner Sales, Vacuum Cleaner Service, central vacuum service, central vacuum installation, vacuum repair, central vacuum sale, ,Sump pump line tepair,",0,NA,NA,FALSE,0,0,0,NA,FALSE,NA,FALSE,2011-10-02T21:17:55.000-04:00,FALSE,FALSE,1806347,0.0,446,NA,NA
https://homestars.com/on/lynden/vacuum-sales-service,25,"c(""https://homestars.com/on/lynden/vacuum-sales-service?&page=2&"", ""https://homestars.com/on/lynden/vacuum-sales-service?&page=3&"")",Vacuum Sales & Service,2784965,NA,/companies/2784965-superior-vaccum?searched_category_id=446&service_area=1841491,NA,superior-vaccum,2011-03-01T11:43:22.000-05:00,NA,NA,NA,NA,NA,NA,NA,NA,NA,NA,NA,NA,NA,FALSE,FALSE,NA,NA,FALSE,FALSE,NA,1848017,Superior Vaccum,1,1,0,10,"Vacuum Sales & Service, Vacuum Cleaners, Vacuum Cleaner Bag, Vacuum Pump, Vacuum Cleaner Sales, Vacuum Cleaner Service, central vacuum service, central vacuum installation, vacuum repair, central vacuum sale, ,Sump pump line tepair,",0,NA,NA,FALSE,0,0,0,NA,FALSE,NA,FALSE,2011-03-01T12:20:45.000-05:00,FALSE,FALSE,1841491,31.1263736264,446,NA,NA
https://homestars.com/on/lynden/vacuum-sales-service,25,"c(""https://homestars.com/on/lynden/vacuum-sales-service?&page=2&"", ""https://homestars.com/on/lynden/vacuum-sales-service?&page=3&"")",Vacuum Sales & Service,193216,NA,/companies/193216-a-h-c-a-vacuum-world?searched_category_id=446&service_area=1805999,NA,a-h-c-a-vacuum-world,2008-01-23T10:21:14.000-05:00,NA,NA,NA,NA,NA,NA,NA,0,0,NA,NA,NA,NA,FALSE,FALSE,NA,NA,FALSE,FALSE,NA,50583,A H C A Vacuum World,0,0,0,NA,"Vacuum Sales & Service, Vacuum Cleaners, Vacuum Cleaner Bag, Vacuum Pump, Vacuum Cleaner Sales, Vacuum Cleaner Service, central vacuum service, central vacuum installation, vacuum repair, central vacuum sale, ,Sump pump line tepair,",0,NA,NA,FALSE,0,0,0,NA,FALSE,NA,FALSE,NA,FALSE,FALSE,1805999,-1.0,446,NA,NA
https://homestars.com/on/lynden/vacuum-sales-service,25,"c(""https://homestars.com/on/lynden/vacuum-sales-service?&page=2&"", ""https://homestars.com/on/lynden/vacuum-sales-service?&page=3&"")",Vacuum Sales & Service,213154,NA,/companies/213154-knitals-sewing-machine-vacuum?searched_category_id=446&service_area=1806160,NA,knitals-sewing-machine-vacuum,2008-01-23T10:30:31.000-05:00,NA,NA,NA,NA,NA,NA,NA,0,0,NA,NA,NA,NA,FALSE,FALSE,NA,NA,FALSE,FALSE,NA,66817,Knitals Sewing Machine & Vacuum,0,0,0,NA,"Vacuum Sales & Service, Vacuum Cleaners, Vacuum Cleaner Bag, Vacuum Pump, Vacuum Cleaner Sales, Vacuum Cleaner Service, central vacuum service, central vacuum installation, vacuum repair, central vacuum sale, ,Sump pump line tepair,",0,NA,NA,FALSE,0,0,0,NA,FALSE,NA,FALSE,NA,FALSE,FALSE,1806160,-1.0,446,NA,NA
https://homestars.com/on/lynden/vacuum-sales-service,25,"c(""https://homestars.com/on/lynden/vacuum-sales-service?&page=2&"", ""https://homestars.com/on/lynden/vacuum-sales-service?&page=3&"")",Vacuum Sales & Service,2599907,NA,/companies/2599907-cliff-s-vacuum?searched_category_id=446&service_area=1613111,NA,cliff-s-vacuum,2008-03-04T16:55:15.000-05:00,NA,NA,NA,NA,NA,NA,NA,NA,NA,NA,NA,NA,NA,FALSE,FALSE,NA,NA,FALSE,FALSE,NA,1662959,Cliff's Vacuum,0,0,0,NA,"Vacuum Sales & Service, Vacuum Cleaners, Vacuum Cleaner Bag, Vacuum Pump, Vacuum Cleaner Sales, Vacuum Cleaner Service, central vacuum service, central vacuum installation, vacuum repair, central vacuum sale, ,Sump pump line tepair,",0,NA,NA,FALSE,0,0,0,NA,FALSE,NA,FALSE,NA,FALSE,FALSE,1613111,-1.0,446,NA,NA
https://homestars.com/on/lynden/vacuum-sales-service,25,"c(""https://homestars.com/on/lynden/vacuum-sales-service?&page=2&"", ""https://homestars.com/on/lynden/vacuum-sales-service?&page=3&"")",Vacuum Sales & Service,201129,NA,/companies/201129-cliff-s-vacuum-supply?searched_category_id=446&service_area=1808412,NA,cliff-s-vacuum-supply,2008-01-23T10:24:55.000-05:00,NA,NA,NA,NA,NA,NA,NA,0,0,NA,NA,NA,NA,FALSE,FALSE,NA,NA,FALSE,FALSE,NA,57057,Cliff's Vacuum Supply,0,0,0,NA,"Vacuum Sales & Service, Vacuum Cleaners, Vacuum Cleaner Bag, Vacuum Pump, Vacuum Cleaner Sales, Vacuum Cleaner Service, central vacuum service, central vacuum installation, vacuum repair, central vacuum sale, ,Sump pump line tepair,",0,NA,NA,FALSE,0,0,0,NA,FALSE,NA,FALSE,NA,FALSE,FALSE,1808412,-1.0,446,NA,NA
https://homestars.com/on/lynden/vacuum-sales-service,25,"c(""https://homestars.com/on/lynden/vacuum-sales-service?&page=2&"", ""https://homestars.com/on/lynden/vacuum-sales-service?&page=3&"")",Vacuum Sales & Service,201084,NA,/companies/201084-cleaning-house-ltd-the?searched_category_id=446&service_area=1806442,NA,cleaning-house-ltd-the,2008-01-23T10:24:54.000-05:00,NA,NA,NA,NA,NA,NA,NA,0,0,NA,NA,NA,NA,FALSE,FALSE,NA,NA,FALSE,FALSE,NA,57019,Cleaning House Ltd The,0,0,0,NA,"Vacuum Sales & Service, Vacuum Cleaners, Vacuum Cleaner Bag, Vacuum Pump, Vacuum Cleaner Sales, Vacuum Cleaner Service, central vacuum service, central vacuum installation, vacuum repair, central vacuum sale, ,Sump pump line tepair,",0,NA,NA,FALSE,0,0,0,NA,FALSE,NA,FALSE,NA,FALSE,FALSE,1806442,-1.0,446,NA,NA
https://homestars.com/on/lynden/vacuum-sales-service,25,"c(""https://homestars.com/on/lynden/vacuum-sales-service?&page=2&"", ""https://homestars.com/on/lynden/vacuum-sales-service?&page=3&"")",Vacuum Sales & Service,218879,NA,/companies/218879-ontario-vacuum?searched_category_id=446&service_area=1806486,NA,ontario-vacuum,2008-01-23T10:33:02.000-05:00,NA,NA,NA,NA,NA,NA,NA,0,0,NA,NA,NA,NA,FALSE,FALSE,NA,NA,FALSE,FALSE,NA,71250,Ontario Vacuum,0,0,0,NA,"Vacuum Sales & Service, Vacuum Cleaners, Vacuum Cleaner Bag, Vacuum Pump, Vacuum Cleaner Sales, Vacuum Cleaner Service, central vacuum service, central vacuum installation, vacuum repair, central vacuum sale, ,Sump pump line tepair,",0,NA,NA,FALSE,0,0,0,NA,FALSE,NA,FALSE,NA,FALSE,FALSE,1806486,-1.0,446,NA,NA
https://homestars.com/on/lynden/vacuum-sales-service,25,"c(""https://homestars.com/on/lynden/vacuum-sales-service?&page=2&"", ""https://homestars.com/on/lynden/vacuum-sales-service?&page=3&"")",Vacuum Sales & Service,2584129,NA,/companies/2584129-knitals-ca?searched_category_id=446&service_area=1597333,NA,knitals-ca,2008-03-04T16:55:15.000-05:00,NA,NA,NA,NA,NA,NA,NA,NA,NA,NA,NA,NA,NA,FALSE,FALSE,NA,NA,FALSE,FALSE,NA,1647181,Knitals.ca,0,0,0,NA,"Vacuum Sales & Service, Vacuum Cleaners, Vacuum Cleaner Bag, Vacuum Pump, Vacuum Cleaner Sales, Vacuum Cleaner Service, central vacuum service, central vacuum installation, vacuum repair, central vacuum sale, ,Sump pump line tepair,",0,NA,NA,FALSE,0,0,0,NA,FALSE,NA,FALSE,NA,FALSE,FALSE,1597333,-1.0,446,NA,NA
https://homestars.com/on/lynden/vacuum-sales-service,25,"c(""https://homestars.com/on/lynden/vacuum-sales-service?&page=2&"", ""https://homestars.com/on/lynden/vacuum-sales-service?&page=3&"")",Vacuum Sales & Service,230740,NA,/companies/230740-stoney-creek-vacuum-centre?searched_category_id=446&service_area=1806529,NA,stoney-creek-vacuum-centre,2008-01-23T10:38:30.000-05:00,NA,NA,NA,NA,NA,NA,NA,0,0,NA,NA,NA,NA,FALSE,FALSE,NA,NA,FALSE,FALSE,NA,80857,Stoney Creek Vacuum Centre,0,0,0,NA,"Vacuum Sales & Service, Vacuum Cleaners, Vacuum Cleaner Bag, Vacuum Pump, Vacuum Cleaner Sales, Vacuum Cleaner Service, central vacuum service, central vacuum installation, vacuum repair, central vacuum sale, ,Sump pump line tepair,",0,NA,NA,FALSE,0,0,0,NA,FALSE,NA,FALSE,NA,FALSE,FALSE,1806529,-1.0,446,NA,NA
https://homestars.com/on/lynden/vacuum-sales-service,25,"c(""https://homestars.com/on/lynden/vacuum-sales-service?&page=2&"", ""https://homestars.com/on/lynden/vacuum-sales-service?&page=3&"")",Vacuum Sales & Service,2570725,NA,/companies/2570725-ancaster-vacuum?searched_category_id=446&service_area=1583929,NA,ancaster-vacuum,2008-03-04T16:55:15.000-05:00,NA,NA,NA,NA,NA,NA,NA,NA,NA,NA,NA,NA,NA,FALSE,FALSE,NA,NA,FALSE,FALSE,NA,1633777,Ancaster Vacuum,0,0,0,NA,"Vacuum Sales & Service, Vacuum Cleaners, Vacuum Cleaner Bag, Vacuum Pump, Vacuum Cleaner Sales, Vacuum Cleaner Service, central vacuum service, central vacuum installation, vacuum repair, central vacuum sale, ,Sump pump line tepair,",0,NA,NA,FALSE,0,0,0,NA,FALSE,NA,FALSE,NA,FALSE,FALSE,1583929,-1.0,446,NA,NA
https://homestars.com/on/lynden/vacuum-sales-service,25,"c(""https://homestars.com/on/lynden/vacuum-sales-service?&page=2&"", ""https://homestars.com/on/lynden/vacuum-sales-service?&page=3&"")",Vacuum Sales & Service,2578011,NA,/companies/2578011-hamilton-vacuum-supply-co-ltd?searched_category_id=446&service_area=1591215,NA,hamilton-vacuum-supply-co-ltd,2008-03-04T16:55:15.000-05:00,NA,NA,NA,NA,NA,NA,NA,NA,NA,NA,NA,NA,NA,FALSE,FALSE,NA,NA,FALSE,FALSE,NA,1641063,Hamilton Vacuum Supply Co Ltd,0,0,0,NA,"Vacuum Sales & Service, Vacuum Cleaners, Vacuum Cleaner Bag, Vacuum Pump, Vacuum Cleaner Sales, Vacuum Cleaner Service, central vacuum service, central vacuum installation, vacuum repair, central vacuum sale, ,Sump pump line tepair,",0,NA,NA,FALSE,0,0,0,NA,FALSE,NA,FALSE,NA,FALSE,FALSE,1591215,-1.0,446,NA,NA
https://homestars.com/on/lynden/vacuum-sales-service,25,"c(""https://homestars.com/on/lynden/vacuum-sales-service?&page=2&"", ""https://homestars.com/on/lynden/vacuum-sales-service?&page=3&"")",Vacuum Sales & Service,2601443,NA,/companies/2601443-electrolux-vacuum-cleaners-polishers?searched_category_id=446&service_area=1614647,NA,electrolux-vacuum-cleaners-polishers,2008-03-04T16:55:15.000-05:00,NA,NA,NA,NA,NA,NA,NA,NA,NA,NA,NA,NA,NA,FALSE,FALSE,NA,NA,FALSE,FALSE,NA,1664495,Electrolux Vacuum Cleaners & Polishers,0,0,0,NA,"Vacuum Sales & Service, Vacuum Cleaners, Vacuum Cleaner Bag, Vacuum Pump, Vacuum Cleaner Sales, Vacuum Cleaner Service, central vacuum service, central vacuum installation, vacuum repair, central vacuum sale, ,Sump pump line tepair,",0,NA,NA,FALSE,0,0,0,NA,FALSE,NA,FALSE,NA,FALSE,FALSE,1614647,-1.0,446,NA,NA
