Link,n_hits,all_links,category,id,url,hs_path,profile,permalink,created_at,sic_code,service_area,hours,products,services,brands,specialities,established,employee_cnt,payment_method,diplomas,licenses,memberships,liability_insurance,bonded,project_rate,project_minimum,written_contract,written_warranty,warranty_terms,parent_company_id,name,total_number_of_reviews_cache,total_number_of_approved_reviews_cache,number_of_photos_cache,avg_rating_cache,categories_info_cache,savings_count,claimed_at,subdomain,fraudulent,fraudulent_count,total_number_of_pending_reviews_cache,images_count,completion_percent_cache,bully,secret,replied_to_at_least_one_review_cache,latest_approved_review_created_at,has_set_tasks,lead_purchase_eligible,service_area_id,star_score,quote_button_category,direct_phone,direct_contact
https://homestars.com/on/cheltenham/cabinetry-millwork,10,https://homestars.com/on/cheltenham/cabinetry-millwork,Cabinetry & Millwork,2968195,,/companies/2968195-skyworth-kitchen-cabinet?searched_category_id=322&service_area=2281526,"Skyworth specialises in customising cabinets, wardrobes and wooden furniture. The master has more than 10 years of working experience, can help customers customize their own furniture from the most professional perspective. We also use quality materials in order to provide high quality service to our customers. Under the premise of high quality, our pricing is also very appropriate to ensure that customers get their favorite products.
",skyworth-kitchen-cabinet,2022-05-13T14:08:58.000-04:00,NA,NA,NA," cabinets, wardrobes and wooden furniture","custom cabinets, wardrobes and wooden furniture","quora, unihopper, robert bury, winnec,wandersa,eldorado,katilac",,2021,7,any,no,,no,TRUE,TRUE,,5000,TRUE,FALSE,2 years,2030113,skyworth kitchen cabinet,3,1,1,10,"Cabinetry & Millwork, Kitchen Cabinetry, Custom Cabinetry, Bathroom Cabinetry, Architectural Millwork, Millwork, custom millwork, bathroom cabinets, Kitchen cabinets, built-in cabinets, built-in cabinetry,  cabinet makers, custom cabinets kitchen, cabinetry, thomasville kitchen cabinets, cabinet doors, millwork cabinetry, custom kitchen cabinets, kraftmaid cabinets, maple cabinets, wood cabinets, stock cabinets, thermofoil cabinets, laminate cabinets, kitchen cabinets design, cherry cabinets, kitchen cabinet designs, hickory cabinets, wholesale cabinets, custom made cabinets, cabinet millwork, cabinets kitchen, kitchen cabinetry, millwork cabinets, ready to assemble cabinets, quality cabinets, bamboo cabinets, caulking,
,Kitchen & Bathroom - Cabinets & Design, Kitchen Cabinet And Counter, Kitchen Cabinet Hardware, Bathroom Cabinet, Bathroom Wall Cabinet, Bathroom Sink Cabinet, cabinets, kitchens, cabinetry, kitchen and cabinets, cabinets for kitchen, about kitchen cabinets, kitchen cabinets, kitchen cabinets in, cabinets for the kitchen, cabinets and kitchen, cabinets kitchen, kitchen cabinet, cabinet kitchen, the kitchen cabinet, kitchen by design, design kitchen, a kitchen design, design a kitchen, design for kitchen, design and kitchen, design by kitchen, kitchen design, cabinetry kitchen, kitchen cabinetry, designs kitchen, kitchen designs, bathroom vanities, vanity and bathroom, bath and vanity, designer kitchen, ,",0,2022-05-25T11:59:53.000-04:00,,FALSE,0,0,2,0,FALSE,101b15720edec985ffbf1efd952979edb02b07a9,FALSE,NA,TRUE,TRUE,2281526,83.8928524842,322,NA,NA
https://homestars.com/on/cheltenham/cabinetry-millwork,10,https://homestars.com/on/cheltenham/cabinetry-millwork,Cabinetry & Millwork,2968991,,/companies/2968991-jsr-woodworking-inc?searched_category_id=322&service_area=2282354,,jsr-woodworking-inc,2022-06-05T00:01:33.000-04:00,NA,NA,NA,,,,,2021,NA,,,,,FALSE,FALSE,,,FALSE,FALSE,,2030909,JSR Woodworking Inc.,0,0,23,NA,"Cabinetry & Millwork, Kitchen Cabinetry, Custom Cabinetry, Bathroom Cabinetry, Architectural Millwork, Millwork, custom millwork, bathroom cabinets, Kitchen cabinets, built-in cabinets, built-in cabinetry,  cabinet makers, custom cabinets kitchen, cabinetry, thomasville kitchen cabinets, cabinet doors, millwork cabinetry, custom kitchen cabinets, kraftmaid cabinets, maple cabinets, wood cabinets, stock cabinets, thermofoil cabinets, laminate cabinets, kitchen cabinets design, cherry cabinets, kitchen cabinet designs, hickory cabinets, wholesale cabinets, custom made cabinets, cabinet millwork, cabinets kitchen, kitchen cabinetry, millwork cabinets, ready to assemble cabinets, quality cabinets, bamboo cabinets, caulking,
,",0,2022-06-05T00:02:18.000-04:00,,FALSE,0,0,29,0,FALSE,b8c7c7fcb197a73f13934ace71ba12d344eb6c9e,FALSE,NA,TRUE,TRUE,2282354,-1.0,322,NA,NA
https://homestars.com/on/cheltenham/cabinetry-millwork,10,https://homestars.com/on/cheltenham/cabinetry-millwork,Cabinetry & Millwork,2899175,http://google.ca,/companies/2899175-klm-testing?searched_category_id=322&service_area=2299127,I do stuff,klm-testing,2017-07-10T09:38:06.000-04:00,NA,NA,NA,NA,NA,NA,NA,NA,NA,NA,NA,NA,NA,FALSE,FALSE,NA,NA,FALSE,FALSE,NA,1961599,KLM Testing,0,0,0,NA,"Cabinetry & Millwork, Kitchen Cabinetry, Custom Cabinetry, Bathroom Cabinetry, Architectural Millwork, Millwork, custom millwork, bathroom cabinets, Kitchen cabinets, built-in cabinets, built-in cabinetry,  cabinet makers, custom cabinets kitchen, cabinetry, thomasville kitchen cabinets, cabinet doors, millwork cabinetry, custom kitchen cabinets, kraftmaid cabinets, maple cabinets, wood cabinets, stock cabinets, thermofoil cabinets, laminate cabinets, kitchen cabinets design, cherry cabinets, kitchen cabinet designs, hickory cabinets, wholesale cabinets, custom made cabinets, cabinet millwork, cabinets kitchen, kitchen cabinetry, millwork cabinets, ready to assemble cabinets, quality cabinets, bamboo cabinets, caulking,
,",0,2017-09-19T16:21:01.000-04:00,NA,FALSE,0,0,0,0,FALSE,938ab0b53897fa2f23b9652b87ceb0074d8ed040,FALSE,NA,TRUE,TRUE,2299127,0,322,NA,NA
