Link,n_hits,all_links,category,id,url,hs_path,profile,permalink,created_at,sic_code,service_area,hours,products,services,brands,specialities,established,employee_cnt,payment_method,diplomas,licenses,memberships,liability_insurance,bonded,project_rate,project_minimum,written_contract,written_warranty,warranty_terms,parent_company_id,name,total_number_of_reviews_cache,total_number_of_approved_reviews_cache,number_of_photos_cache,avg_rating_cache,categories_info_cache,savings_count,claimed_at,subdomain,fraudulent,fraudulent_count,total_number_of_pending_reviews_cache,images_count,completion_percent_cache,bully,secret,replied_to_at_least_one_review_cache,latest_approved_review_created_at,has_set_tasks,lead_purchase_eligible,service_area_id,star_score,quote_button_category,direct_phone,direct_contact
https://homestars.com/on/pottageville/cabinetry-millwork,34,"c(""https://homestars.com/on/pottageville/cabinetry-millwork?&page=2&"", ""https://homestars.com/on/pottageville/cabinetry-millwork?&page=3&"", ""https://homestars.com/on/pottageville/cabinetry-millwork?&page=4&"")",Cabinetry & Millwork,2959544,https://renovatorsgroup.com/,/companies/2959544-renovators-group?searched_category_id=322&service_area=2299601,"Renovators Group is all about building you a home you love. We specialize in renovating bathrooms, kitchens, basements and home additions. In your outside space, we create and build deck that make sense for your space. Renovators Group offers a solution which is a contract system that ensures you, the homeowner, is in control of your budget and that you have complete transparency during your project. Our specialized client software provides access to your job schedule, daily logs from the team, pictures and more. Communication is of utmost importance when go through a renovation and you can be confident in knowing that we stand by this principle. Contact us for more information.",renovators-group,2021-09-09T14:52:20.000-04:00,NA,NA,NA,,"Basement Renovation,Bathroom Renovations, Kitchen Renovations,Home Addition, Framing/Carpentry, Electrical,Flooring, Painting, Commercial renovation and etc.",,"General contracting, Basement Renovation, Bathroom Renovations, Kitchen Renovations, Home Addition, Framing/Carpentry, Electrical,Flooring, Painting, Commercial renovation, commercial Framing  and framing for home addition etc.",2010,NA,"Cash, Cheque, E-transfer, Debt, Visa, Mastercard, Amex,",,"WSIB, 5 Million Liability",,TRUE,FALSE,,,TRUE,FALSE,5 year warranty,2021521,Renovators Group,28,15,31,10,"General Contractors, Residential General Contractor, Building Contractor, Additions, Remodeling Contractor,  Renovation, Builder, building construction, renovation, remodeling, construction builders, construction company, construction companies, home repair, construction jobs, home remodeling, general contractors, contractors general, contractor general, contractors construction, construction contractors, home improvement and remodeling, kitchen remodeling, construction contractor, builders contractors, home renovation, general contracting, building contractors, building companies, home renovations, builder contractor, building contractor, remodeling contractor, commercial construction, residential construction, house contractor, concrete contractors, home contractors, general construction, construction general, contractors remodeling, remodeling contractors, remodelers, remodel contractor, remodel contractors, general contract, commercial contractors, renovations contractors, home improvement contractor, licensed contractor, license general contractor, mud room, mudroom, caulking, ,Bathroom Renovation, Bathroom renovation, bathroom remodeling, bathroom remodelling, renovating the bathroom, tearing out the bathroom, fixing up the bathroom, bathroom contractors, bathroom vanities, bathroom vanity, design of bathroom, bathroom and design, design for bathroom, design a bathroom, design a bath, bath design, bathroom tile, bathroom cabinets, remodeling a bathroom, bathroom remodeling, remodeling the bathroom, ,Bath renovation, New tub, caulking, ,Cabinetry & Millwork, Kitchen Cabinetry, Custom Cabinetry, Bathroom Cabinetry, Architectural Millwork, Millwork, custom millwork, bathroom cabinets, Kitchen cabinets, built-in cabinets, built-in cabinetry,  cabinet makers, custom cabinets kitchen, cabinetry, thomasville kitchen cabinets, cabinet doors, millwork cabinetry, custom kitchen cabinets, kraftmaid cabinets, maple cabinets, wood cabinets, stock cabinets, thermofoil cabinets, laminate cabinets, kitchen cabinets design, cherry cabinets, kitchen cabinet designs, hickory cabinets, wholesale cabinets, custom made cabinets, cabinet millwork, cabinets kitchen, kitchen cabinetry, millwork cabinets, ready to assemble cabinets, quality cabinets, bamboo cabinets, caulking,
,",0,2021-09-09T14:54:09.000-04:00,,FALSE,0,0,32,0,FALSE,27f724d997512fb6500106603515852ebba062f2,TRUE,2022-04-30T22:36:38.000-04:00,TRUE,TRUE,2299601,98.6920584345,322,NA,NA
https://homestars.com/on/pottageville/cabinetry-millwork,34,"c(""https://homestars.com/on/pottageville/cabinetry-millwork?&page=2&"", ""https://homestars.com/on/pottageville/cabinetry-millwork?&page=3&"", ""https://homestars.com/on/pottageville/cabinetry-millwork?&page=4&"")",Cabinetry & Millwork,2940342,https://www.paintmycabinets.ca,/companies/2940342-paint-my-cabinets-inc?searched_category_id=322&service_area=2294493,"A full cabinet replacement is a messy, time-consuming, and often expensive process. Kitchen cabinet painting and refinishing can be done at a fraction of the cost of refacing or replacing. The whole process can be completed in as little as 10 days. Why go through the headache of pulling apart your kitchen when our team of professional painters can deliver the customized, updated style you’ve been dreaming of?",paint-my-cabinets-inc,2020-02-12T08:34:33.000-05:00,NA,NA,NA,,Kitchen Cabinet Painting,,,2017,10,,,,,TRUE,TRUE,,,TRUE,FALSE,,2002516,Paint My Cabinets Inc.,17,14,14,10,"Paint & Wallpaper Contractors, Paint Colors, Paint Store, Paint Brush, Paint Shop, Home Wallpaper,Wallpaper, Paint colour advice, paint colour consultants, wallpapering, painter, faux, painters painting, painters paint, business painting, find painting, painting and restoration, new jersey painting, oh painting, local painting, wall paper repair, ,Cabinetry & Millwork, Kitchen Cabinetry, Custom Cabinetry, Bathroom Cabinetry, Architectural Millwork, Millwork, custom millwork, bathroom cabinets, Kitchen cabinets, built-in cabinets, built-in cabinetry,  cabinet makers, custom cabinets kitchen, cabinetry, thomasville kitchen cabinets, cabinet doors, millwork cabinetry, custom kitchen cabinets, kraftmaid cabinets, maple cabinets, wood cabinets, stock cabinets, thermofoil cabinets, laminate cabinets, kitchen cabinets design, cherry cabinets, kitchen cabinet designs, hickory cabinets, wholesale cabinets, custom made cabinets, cabinet millwork, cabinets kitchen, kitchen cabinetry, millwork cabinets, ready to assemble cabinets, quality cabinets, bamboo cabinets, caulking,
,",0,2020-02-12T08:35:08.000-05:00,paintmycabinets,FALSE,0,0,15,0,FALSE,25240c21dc3b580697e7403ac0d322a3f410f70d,FALSE,NA,TRUE,TRUE,2294493,96.7973516761,322,NA,NA
https://homestars.com/on/pottageville/cabinetry-millwork,34,"c(""https://homestars.com/on/pottageville/cabinetry-millwork?&page=2&"", ""https://homestars.com/on/pottageville/cabinetry-millwork?&page=3&"", ""https://homestars.com/on/pottageville/cabinetry-millwork?&page=4&"")",Cabinetry & Millwork,2957029,https://www.sevenkdesign.com/,/companies/2957029-7k-design-ltd?searched_category_id=322&service_area=2255191,"7K MOTTO:
Design amazing things by being an amazing person. So from beginning to end, we value professionalism and we dedicate our life & love of design from our whole team to you. 

ABOUT:
7K Design Ltd. Is a studio based in the Toronto, Canada. We are a design & archt studio that specializes in residential & commercial work that covers all of the 6ix.  Whether it is working on a 30,000sqft mansion that covers 12 football fields worth of land or a 200sqft bedroom that is set inside a 50 year old home, we at 7K is happy take all projects through our creative endivors to create the best plan possible. 

The foundation of our Studio is designed from years of Collaboratory harmony + the love for creating extraordinary spaces for new stories to be begin & take place in.  Our design philosophy and influences has always been about being aspired to create and transform ones life to the one they always wanted and never knew possible.

So from beginning to end, it was never about us, because it is always about you.


",7k-design-ltd,2021-06-08T13:13:50.000-04:00,NA,NA,NA,,"Architectural, Structural, Hvac, Interior Design, Renovations, Custom Millwork Design, Consultation","TNT Supermarket, Vava Designer Cakes, Suntea, Yangs Tea, ",,NA,NA,"Cheque, E-transfer",,,,FALSE,FALSE,,,TRUE,FALSE,Yes. Kindly ask for details. Depends on project completed. ,2019006,7K Design Ltd,6,5,145,10,"Architects, Architectural Consultants, Residential Architects, Architect, structural, engineer, architects, landscape architects, architect design, design architect, architectural design, architect landscape, landscape architect, designer architect, architect designer, 3d architect, home architect, architect home, architecture firm, architect firm, construction architect, architect studio, ,Interior Design, Home Interior Designers, Kitchen Interior Design, interior, what is interior design, about interior design, design interior, interior by design, home designs, interior designer, designer interior, how to be a interior designer, what is an interior designer, home design, decorating ideas, design and decorating, decorating and design, interior designers, interior decoration, room design, interior design decoration, interior decorating, house decorating, home decorating, desings homes, interior design decorating, interior decorating design, decorating and interior design, home building plans, decorating tips, room designs, design homes, decorating design ideas, design photos, interior house, interior decorator, bedroom design, architecture design, bedroom designs, careers in design, interior designs, office design, architectural design, ,Cabinetry & Millwork, Kitchen Cabinetry, Custom Cabinetry, Bathroom Cabinetry, Architectural Millwork, Millwork, custom millwork, bathroom cabinets, Kitchen cabinets, built-in cabinets, built-in cabinetry,  cabinet makers, custom cabinets kitchen, cabinetry, thomasville kitchen cabinets, cabinet doors, millwork cabinetry, custom kitchen cabinets, kraftmaid cabinets, maple cabinets, wood cabinets, stock cabinets, thermofoil cabinets, laminate cabinets, kitchen cabinets design, cherry cabinets, kitchen cabinet designs, hickory cabinets, wholesale cabinets, custom made cabinets, cabinet millwork, cabinets kitchen, kitchen cabinetry, millwork cabinets, ready to assemble cabinets, quality cabinets, bamboo cabinets, caulking,
,",0,2021-06-08T13:16:08.000-04:00,7kdesign,FALSE,0,0,152,0,FALSE,0a6c2cfac0e3782cc7a76a384c90c1bb91de848e,TRUE,2021-06-14T19:10:55.000-04:00,TRUE,TRUE,2255191,86.2735658043,322,NA,NA
https://homestars.com/on/pottageville/cabinetry-millwork,34,"c(""https://homestars.com/on/pottageville/cabinetry-millwork?&page=2&"", ""https://homestars.com/on/pottageville/cabinetry-millwork?&page=3&"", ""https://homestars.com/on/pottageville/cabinetry-millwork?&page=4&"")",Cabinetry & Millwork,2907615,http://wildwoodkitchens.ca,/companies/2907615-wildwood-kitchens?searched_category_id=322&service_area=2293951,"We are specialized in the production of fine kitchen cabinets, custom shelving, and high-end closet storage solutions . We are confident in the products we make, as well as the services we provide, on every project will suit your vision.

20 years of experience
Our 20 years of experience led to remodeling any kitchen, wall unit, home office, or walk-in closet style you like

Whether meeting with you and your family or collaborating with architects, contractors, and interior decorators, we’re here to help you define your scope of work and articulate a vision that’s uniquely yours.


The experienced design team will turn your vision into a reality detailed plan, creating custom solutions that blend form a function to fit all your family’s needs.

Build
Our designs of combining the old and the new world approach to the top of craftsmanship and that mean you can have the best rich design from both worlds for kitchens or bathrooms. We make every piece of cabinetry in our shop in Toronto, Proudly 100% Canadian-made. To this regard, we offer a warranty against defects in materials and/or workmanship for a period of two years under average residential usage.  

Our Values
We believe in building durable and functional cabinetry that will make things easy to store, easy to find, and easy to clean. By choosing to work with us you will get the real value for your investment and your cabinets will look as good up close as they do from a distance.",wildwood-kitchens,2018-01-19T17:03:35.000-05:00,NA,NA,NA,,,,,2016,NA,"Cash, Cheque & E-transfer",Woodworking,,,FALSE,FALSE,,,FALSE,FALSE,2 years,1969800,Wildwood Kitchens,5,5,47,10,"Cabinetry & Millwork, Kitchen Cabinetry, Custom Cabinetry, Bathroom Cabinetry, Architectural Millwork, Millwork, custom millwork, bathroom cabinets, Kitchen cabinets, built-in cabinets, built-in cabinetry,  cabinet makers, custom cabinets kitchen, cabinetry, thomasville kitchen cabinets, cabinet doors, millwork cabinetry, custom kitchen cabinets, kraftmaid cabinets, maple cabinets, wood cabinets, stock cabinets, thermofoil cabinets, laminate cabinets, kitchen cabinets design, cherry cabinets, kitchen cabinet designs, hickory cabinets, wholesale cabinets, custom made cabinets, cabinet millwork, cabinets kitchen, kitchen cabinetry, millwork cabinets, ready to assemble cabinets, quality cabinets, bamboo cabinets, caulking,
,Kitchen & Bathroom - Cabinets & Design, Kitchen Cabinet And Counter, Kitchen Cabinet Hardware, Bathroom Cabinet, Bathroom Wall Cabinet, Bathroom Sink Cabinet, cabinets, kitchens, cabinetry, kitchen and cabinets, cabinets for kitchen, about kitchen cabinets, kitchen cabinets, kitchen cabinets in, cabinets for the kitchen, cabinets and kitchen, cabinets kitchen, kitchen cabinet, cabinet kitchen, the kitchen cabinet, kitchen by design, design kitchen, a kitchen design, design a kitchen, design for kitchen, design and kitchen, design by kitchen, kitchen design, cabinetry kitchen, kitchen cabinetry, designs kitchen, kitchen designs, bathroom vanities, vanity and bathroom, bath and vanity, designer kitchen, ,Kitchen Planning & Renovation, Kitchen Planning And Design, Kitchen Cabinet Planning, Kitchen Design, Kitchen Remodeling, kitchen or, and bathroom, a and a kitchens, kitchens and, for kitchens, a kitchens, kitchens, the house design, cabinets for kitchen, cabinets for the kitchen, cabinets and kitchen, kitchen cabinets, design a kitchen, about kitchen design, a kitchen design, how to kitchen design, design and kitchen, the kitchen design, design for kitchen, kitchen designs, renovation and remodeling, remodeling and renovation, kitchen designer,,Kitchen Renovation, caulking, ,Carpenters, carpenter, finish carpenter, local carpenter, carpenter work, carpenter companies, master carpenter, carpenters and joiners, carpentry, union carpenter, carpenter co, carpenter services, carpenter construction, interior framing, mud room, mudroom, playsets, playground, wooden playset, wooden playground, play set, caulking,,Closet & Storage Solutions, Closets, Closet, Storage, Closet Organizer, Closet And Room Organizer, Storage Cabinet, Storage Container, Interior closet shelves, custom fitted interior closets, custom closets, interior closet organizer, shelving, built-in shelving, built-in shelves, storage, the container, the closet, a closet, closet and, closet closet, closet to closet, closet, shelves, wardrobe, the closets, shelving, wardrobes, pantry, storage boxes, container store, storage containers, storage and containers, shoe rack, storage bins, storage systems, shoe racks, storage cabinets, storage cabinet, food storage, wall shelves, solutions storage, storage solutions, clothes rack, closet and organizer, the closet organizer, organizer for closet, closet organizer, closet organizers, organizers closet, wardrobe closet, Custom Shelves, ,",0,2018-01-19T17:04:22.000-05:00,,FALSE,0,0,48,0,FALSE,ac63e38a765ce26c609b851e859eb132655c6bdf,TRUE,NA,TRUE,TRUE,2293951,87.6028386081,322,NA,NA
https://homestars.com/on/pottageville/cabinetry-millwork,34,"c(""https://homestars.com/on/pottageville/cabinetry-millwork?&page=2&"", ""https://homestars.com/on/pottageville/cabinetry-millwork?&page=3&"", ""https://homestars.com/on/pottageville/cabinetry-millwork?&page=4&"")",Cabinetry & Millwork,2954311,https://www.neocabinets.ca,/companies/2954311-neocabinets?searched_category_id=322&service_area=2249189,"NeoCabinets is a combination of Dad’s wisdom and Son’s youthful designs. Rasoul’s twenty-plus years of experience in kitchenware, as well as Pouya’s Architectural knowledge earned through his degree from Humber College, is what brings the most practical and unique projects to any space. NeoCabinets provides services throughout the entire Toronto and GTA. This duo’s mission is to collaborate with you on bringing your most creative ideas to life.",neocabinets,2021-03-21T22:34:35.000-04:00,NA,NA,NA,,,,,NA,NA,,,,,TRUE,FALSE,,,TRUE,FALSE,,2016289,NeoCabinets,12,12,84,9.75,"Kitchen & Bathroom - Cabinets & Design, Kitchen Cabinet And Counter, Kitchen Cabinet Hardware, Bathroom Cabinet, Bathroom Wall Cabinet, Bathroom Sink Cabinet, cabinets, kitchens, cabinetry, kitchen and cabinets, cabinets for kitchen, about kitchen cabinets, kitchen cabinets, kitchen cabinets in, cabinets for the kitchen, cabinets and kitchen, cabinets kitchen, kitchen cabinet, cabinet kitchen, the kitchen cabinet, kitchen by design, design kitchen, a kitchen design, design a kitchen, design for kitchen, design and kitchen, design by kitchen, kitchen design, cabinetry kitchen, kitchen cabinetry, designs kitchen, kitchen designs, bathroom vanities, vanity and bathroom, bath and vanity, designer kitchen, ,Cabinetry & Millwork, Kitchen Cabinetry, Custom Cabinetry, Bathroom Cabinetry, Architectural Millwork, Millwork, custom millwork, bathroom cabinets, Kitchen cabinets, built-in cabinets, built-in cabinetry,  cabinet makers, custom cabinets kitchen, cabinetry, thomasville kitchen cabinets, cabinet doors, millwork cabinetry, custom kitchen cabinets, kraftmaid cabinets, maple cabinets, wood cabinets, stock cabinets, thermofoil cabinets, laminate cabinets, kitchen cabinets design, cherry cabinets, kitchen cabinet designs, hickory cabinets, wholesale cabinets, custom made cabinets, cabinet millwork, cabinets kitchen, kitchen cabinetry, millwork cabinets, ready to assemble cabinets, quality cabinets, bamboo cabinets, caulking,
,",0,2021-03-21T22:38:53.000-04:00,neocabinets,FALSE,0,0,85,0,FALSE,a3cd93f8f19ec7710368f9ac4d52d792a2b05066,TRUE,NA,TRUE,TRUE,2249189,96.2453167623,322,NA,NA
https://homestars.com/on/pottageville/cabinetry-millwork,34,"c(""https://homestars.com/on/pottageville/cabinetry-millwork?&page=2&"", ""https://homestars.com/on/pottageville/cabinetry-millwork?&page=3&"", ""https://homestars.com/on/pottageville/cabinetry-millwork?&page=4&"")",Cabinetry & Millwork,2926585,https://www.gtakitchenbath.com,/companies/2926585-gta-kitchen-and-bath-depot?searched_category_id=322&service_area=2186686,"At GTA kitchen & Bath Depot, we specialize in kitchen and bathroom renovations, with over 12 years of experience in construction and renovation industry, our qualified team is ready to tackle all of your remodeling and renovation needs. Our products and services include: Shower Glass, Glass partitions, railings and wine cellars, Quartz Countertops for all surfaces, kitchen and bathroom cabinets & vanities.

















",gta-kitchen-and-bath-depot,2019-01-22T05:41:04.000-05:00,NA,NA,NA,"shower glass, Kitchen cabinets, closets, office/TV units, quartz countertops & bathroom renovations","glass and mirror, Custom cabinets, kitchen renovations, bathroom renovations, Quartz countertops ","Ceasarstone, hanstone, vecostone, TCE, Sio4, and many more","Tempered Glass, Kitchen, custom cabinets, and Bathroom renovations",2018,6,"Visa, Matercard, ",,yes,,TRUE,TRUE,,,TRUE,FALSE,,1988759,GTA Kitchen and Bath Depot,20,14,14,9.64286,"Kitchen & Bathroom - Cabinets & Design, Kitchen Cabinet And Counter, Kitchen Cabinet Hardware, Bathroom Cabinet, Bathroom Wall Cabinet, Bathroom Sink Cabinet, cabinets, kitchens, cabinetry, kitchen and cabinets, cabinets for kitchen, about kitchen cabinets, kitchen cabinets, kitchen cabinets in, cabinets for the kitchen, cabinets and kitchen, cabinets kitchen, kitchen cabinet, cabinet kitchen, the kitchen cabinet, kitchen by design, design kitchen, a kitchen design, design a kitchen, design for kitchen, design and kitchen, design by kitchen, kitchen design, cabinetry kitchen, kitchen cabinetry, designs kitchen, kitchen designs, bathroom vanities, vanity and bathroom, bath and vanity, designer kitchen, ,Cabinetry & Millwork, Kitchen Cabinetry, Custom Cabinetry, Bathroom Cabinetry, Architectural Millwork, Millwork, custom millwork, bathroom cabinets, Kitchen cabinets, built-in cabinets, built-in cabinetry,  cabinet makers, custom cabinets kitchen, cabinetry, thomasville kitchen cabinets, cabinet doors, millwork cabinetry, custom kitchen cabinets, kraftmaid cabinets, maple cabinets, wood cabinets, stock cabinets, thermofoil cabinets, laminate cabinets, kitchen cabinets design, cherry cabinets, kitchen cabinet designs, hickory cabinets, wholesale cabinets, custom made cabinets, cabinet millwork, cabinets kitchen, kitchen cabinetry, millwork cabinets, ready to assemble cabinets, quality cabinets, bamboo cabinets, caulking,
,",0,2019-01-22T05:43:24.000-05:00,tilexpro,FALSE,0,0,20,0,FALSE,d930a5db18c9d336daa7a39c6bc479ca34e1954d,TRUE,NA,TRUE,TRUE,2186686,92.6382361778,322,NA,NA
https://homestars.com/on/pottageville/cabinetry-millwork,34,"c(""https://homestars.com/on/pottageville/cabinetry-millwork?&page=2&"", ""https://homestars.com/on/pottageville/cabinetry-millwork?&page=3&"", ""https://homestars.com/on/pottageville/cabinetry-millwork?&page=4&"")",Cabinetry & Millwork,2929784,https://www.interiorjunction.ca,/companies/2929784-interior-junction?searched_category_id=322&service_area=2195771,"Interior Junction is a 23 year old company based out of Toronto, specializing in Turn Key interior mill-work projects for: Hospitality - Health Care - Commercial - Exhibition - Residential sectors. Our Services are: Custom Cabinetry, Millwork, Kitchens, CNC, Bathrooms, Office. We work closely with local and international Architects, Interior Designers and Engineers because our qualified staff, and skilled workers go the extra mile to deliver what you expect. This means we don’t just execute your designs we add value to them.",interior-junction,2019-04-10T22:37:53.000-04:00,NA,NA,NA,Kitchen Cabinetry,"Design, Interior Design, Renovations, Custom Cabinetry",custom,,1995,7,,Interior Design / Project Management / Mechanical Engineering / Sustainability Management,Fully Insured,,FALSE,TRUE,,"1,000",TRUE,FALSE,10 Year Warranty,1991958,Interior Junction,10,5,20,9.6,"Kitchen & Bathroom - Cabinets & Design, Kitchen Cabinet And Counter, Kitchen Cabinet Hardware, Bathroom Cabinet, Bathroom Wall Cabinet, Bathroom Sink Cabinet, cabinets, kitchens, cabinetry, kitchen and cabinets, cabinets for kitchen, about kitchen cabinets, kitchen cabinets, kitchen cabinets in, cabinets for the kitchen, cabinets and kitchen, cabinets kitchen, kitchen cabinet, cabinet kitchen, the kitchen cabinet, kitchen by design, design kitchen, a kitchen design, design a kitchen, design for kitchen, design and kitchen, design by kitchen, kitchen design, cabinetry kitchen, kitchen cabinetry, designs kitchen, kitchen designs, bathroom vanities, vanity and bathroom, bath and vanity, designer kitchen, ,Cabinetry & Millwork, Kitchen Cabinetry, Custom Cabinetry, Bathroom Cabinetry, Architectural Millwork, Millwork, custom millwork, bathroom cabinets, Kitchen cabinets, built-in cabinets, built-in cabinetry,  cabinet makers, custom cabinets kitchen, cabinetry, thomasville kitchen cabinets, cabinet doors, millwork cabinetry, custom kitchen cabinets, kraftmaid cabinets, maple cabinets, wood cabinets, stock cabinets, thermofoil cabinets, laminate cabinets, kitchen cabinets design, cherry cabinets, kitchen cabinet designs, hickory cabinets, wholesale cabinets, custom made cabinets, cabinet millwork, cabinets kitchen, kitchen cabinetry, millwork cabinets, ready to assemble cabinets, quality cabinets, bamboo cabinets, caulking,
,",0,2019-04-10T22:38:05.000-04:00,interiorjunction,FALSE,0,0,134,0,FALSE,17c5470bbd60a51395a9199ccb7d84ca63cf2f26,TRUE,NA,TRUE,TRUE,2195771,75.3307861592,322,NA,NA
